timestamp,ticker,source,text,url
2026-01-16 11:00:26+00:00,CDNS,Simply Wall St.,"Cadence Design Systems, Inc. (NASDAQ:CDNS) is favoured by institutional owners who hold 89% of the company",https://finance.yahoo.com/news/cadence-design-systems-inc-nasdaq-110026253.html
2026-01-16 11:11:00+00:00,ASML,Zacks,"Zacks Investment Ideas feature highlights: Taiwan Semiconductor Manufacturing, ASML and Lam Research",https://finance.yahoo.com/news/zacks-investment-ideas-feature-highlights-111100567.html
2026-01-16 11:23:42+00:00,WDC,Barchart,Nasdaq Futures Climb on AI Optimism,https://finance.yahoo.com/news/nasdaq-futures-climb-ai-optimism-112342658.html
2026-01-16 11:30:00+00:00,DASH,Motley Fool,A $450 Billion Opportunity: Is Serve Robotics Stock a Buy in 2026?,https://finance.yahoo.com/news/450-billion-opportunity-serve-robotics-113000911.html
2026-01-16 11:30:00+00:00,WBD,Reuters,"UK minister met Paramount CEO Ellison in London on Thursday, source says",https://finance.yahoo.com/news/uk-minister-met-paramount-ceo-105758058.html
2026-01-16 11:38:45+00:00,PLTR,Simply Wall St.,Exploring High Growth Tech Stocks In The US January 2026,https://finance.yahoo.com/news/exploring-high-growth-tech-stocks-113845100.html
2026-01-16 11:56:37+00:00,ASML,Investing.com,Morgan Stanley lifts ASML stock target by 40% on expectations for a stronger 2027,https://finance.yahoo.com/news/morgan-stanley-lifts-asml-stock-115637496.html
2026-01-16 12:01:00+00:00,SHOP,GlobeNewswire,GoodDay Software Raises $7M to Build an AI-Native ERP Alternative for Shopify Brands,https://finance.yahoo.com/news/goodday-software-raises-7m-build-120100204.html
2026-01-16 12:02:00+00:00,COST,Zacks,"Zacks Investment Ideas feature highlights: GLD, SLV and Costco",https://finance.yahoo.com/news/zacks-investment-ideas-feature-highlights-120200447.html
2026-01-16 12:12:08+00:00,CDNS,Barchart,Cadence Design Systems' Q4 2025 Earnings: What to Expect,https://finance.yahoo.com/news/cadence-design-systems-q4-2025-121208559.html
2026-01-16 12:14:11+00:00,PDD,Simply Wall St.,Can PDD (PDD) Turn Its Billion-Dollar Supermarket Bet Into Lasting Competitive Advantage?,https://finance.yahoo.com/news/pdd-pdd-turn-billion-dollar-121411959.html
2026-01-16 12:15:00+00:00,COST,Motley Fool,"Have $1,000? 3 Consumer Stocks to Buy and Hold for the Next 10 Years: Costco, Coca-Cola, and Amazon​.",https://finance.yahoo.com/news/1-000-3-consumer-stocks-121500931.html
2026-01-16 12:15:00+00:00,STX,Zacks,"Zacks Industry Outlook Highlights Micron Technology, Advanced Micro Devices, International Business Machines and Seagate Technology",https://finance.yahoo.com/news/zacks-industry-outlook-highlights-micron-121500733.html
2026-01-16 12:22:07+00:00,ASML,MT Newswires,"Equity Futures Rise Amid Gains in Major Bank, Semiconductor Stocks",https://finance.yahoo.com/news/equity-futures-rise-amid-gains-122207854.html
2026-01-16 12:24:00+00:00,BKNG,Zacks,"The Zacks Analyst Blog Highlights American Express, Intuitive Surgical, Booking Holdings, Daily Journal and Star Group",https://finance.yahoo.com/news/zacks-analyst-blog-highlights-american-122400931.html
2026-01-16 12:25:38+00:00,CSGP,Barchart,What You Need to Know Ahead of CoStar Group's Earnings Release,https://finance.yahoo.com/news/know-ahead-costar-groups-earnings-122538907.html
2026-01-16 12:26:33+00:00,SNPS,Verdict,Synopsys to sell processor IP solutions business to GlobalFoundries,https://finance.yahoo.com/news/synopsys-sell-processor-ip-solutions-122633708.html
2026-01-16 12:30:00+00:00,PYPL,GlobeNewswire,"Ireland Buy Now Pay Later Business and Investment Report 2026-2031 Featuring PayPal, Klarna, Clearpay (Afterpay), and humm",https://finance.yahoo.com/news/ireland-buy-now-pay-later-123000129.html
2026-01-16 12:30:02+00:00,APP,Barchart,Evercore Analysts Are Pounding the Table on This 1 ‘Strong Buy’ Tech Stock,https://finance.yahoo.com/news/evercore-analysts-pounding-table-1-123002541.html
2026-01-16 12:42:00+00:00,PLTR,Motley Fool,This Artificial Intelligence (AI) Stock Has Jumped 328% in 1 Year. It Can Soar Higher After Feb. 3. (Hint: It's Not Palantir.),https://finance.yahoo.com/news/artificial-intelligence-ai-stock-jumped-124200189.html
2026-01-16 12:47:24+00:00,NXPI,TipRanks,NXP Semiconductors price target raised to $285 from $275 at Citi,https://finance.yahoo.com/news/nxp-semiconductors-price-target-raised-124724921.html
2026-01-16 13:00:07+00:00,WDC,Simply Wall St.,Is Western Digital Corporation (NASDAQ:WDC) Trading At A 21% Discount?,https://finance.yahoo.com/news/western-digital-corporation-nasdaq-wdc-130007603.html
2026-01-16 13:02:49+00:00,STX,24/7 Wall St.,"Here Are Friday’s Top Wall Street Analyst Research Calls: ConocoPhillips, Devon Energy, Garmin, Honeywell, HP, PepsiCo, Rocket Labs, Seagate, and More",https://finance.yahoo.com/news/friday-top-wall-street-analyst-130249265.html
2026-01-16 13:03:46+00:00,AMAT,Barchart,Here's What to Expect From Applied Materials' Next Earnings Report,https://finance.yahoo.com/news/heres-expect-applied-materials-next-130346908.html
2026-01-16 13:06:43+00:00,MCHP,TipRanks,"SST, UMC announce availability of 28nm SuperFlash Gen 4 platform",https://finance.yahoo.com/news/sst-umc-announce-availability-28nm-130643772.html
2026-01-16 13:26:29+00:00,QCOM,Motor Finance,AI dash cam aims to reduce fleet collisions: Motive,https://finance.yahoo.com/news/ai-dash-cam-aims-reduce-132629358.html
2026-01-16 13:30:03+00:00,LRCX,Zacks,Here's How Much You'd Have If You Invested $1000 in Lam Research a Decade Ago,https://finance.yahoo.com/news/heres-much-youd-invested-1000-133003018.html
2026-01-16 13:32:55+00:00,WBD,The Telegraph,Hollywood billionaire’s battle royale over Warner Bros comes to Britain,https://finance.yahoo.com/news/hollywood-billionaire-battle-royale-over-133255318.html
2026-01-16 13:35:00+00:00,COST,Motley Fool,"1 Consumer Stock I'd Be Comfortable Holding for 20 Years: Costco, Coca-Cola, or Walmart?​",https://finance.yahoo.com/news/1-consumer-stock-id-comfortable-133500878.html
2026-01-16 13:38:00+00:00,ADP,Zacks,4 Women-Run Company Stocks Building Durable Growth Stories,https://finance.yahoo.com/news/4-women-run-company-stocks-133800151.html
2026-01-16 13:50:00+00:00,PYPL,Motley Fool,5 Bargain Stocks That Could Deliver Jaw-Dropping Returns in 2026,https://finance.yahoo.com/news/5-bargain-stocks-could-deliver-135000336.html
2026-01-16 13:54:00+00:00,VRTX,Zacks,Implied Volatility Surging for Vertex Pharmaceuticals Stock Options,https://finance.yahoo.com/news/implied-volatility-surging-vertex-pharmaceuticals-135400632.html
2026-01-16 13:56:36+00:00,SHOP,24/7 Wall St.,The Cross-Border Specialist Posts 25% Growth but Its Platform Rival Delivers Better Returns,https://finance.yahoo.com/news/cross-border-specialist-posts-25-135636492.html
2026-01-16 14:00:00+00:00,QCOM,Business Wire,Qualcomm Announces Quarterly Cash Dividend,https://finance.yahoo.com/news/qualcomm-announces-quarterly-cash-dividend-140000242.html
2026-01-16 14:00:03+00:00,CMCSA,Zacks,Comcast Corporation (CMCSA) is Attracting Investor Attention: Here is What You Should Know,https://finance.yahoo.com/news/comcast-corporation-cmcsa-attracting-investor-140003562.html
2026-01-16 14:00:03+00:00,WDC,Barchart,NAND Demand Stays Strong as Chip Sales Slump. Is Sandisk or Western Digital Stock a Better Buy in January 2026?,https://finance.yahoo.com/news/nand-demand-stays-strong-chip-140003403.html
2026-01-16 14:00:04+00:00,ZS,Zacks,"Zscaler, Inc. (ZS) is Attracting Investor Attention: Here is What You Should Know",https://finance.yahoo.com/news/zscaler-inc-zs-attracting-investor-140004211.html
2026-01-16 14:00:05+00:00,BKR,Zacks,These 2 Oils-Energy Stocks Could Beat Earnings: Why They Should Be on Your Radar,https://finance.yahoo.com/news/2-oils-energy-stocks-could-140005860.html
2026-01-16 14:00:07+00:00,AMAT,Zacks,"Here is What to Know Beyond Why Applied Materials, Inc. (AMAT) is a Trending Stock",https://finance.yahoo.com/news/know-beyond-why-applied-materials-140007873.html
2026-01-16 14:00:19+00:00,AMAT,Simply Wall St.,"Is It Too Late To Consider Buying Applied Materials, Inc. (NASDAQ:AMAT)?",https://finance.yahoo.com/news/too-consider-buying-applied-materials-140019774.html
2026-01-16 14:01:00+00:00,CSCO,Zacks,MRVL's Data Center Switching Business Expands: New Growth Engine?,https://finance.yahoo.com/news/mrvls-data-center-switching-business-140100393.html
2026-01-16 14:05:05+00:00,SBUX,GOBankingRates,"8 Things About Getting Rich You Aren’t Aware Of, According to Chelsea Fagan",https://finance.yahoo.com/news/8-things-getting-rich-probably-230433787.html
2026-01-16 14:07:00+00:00,AMAT,Zacks,ASML Pushes High-NA EUV Forward: How Big is the Manufacturing Leap?,https://finance.yahoo.com/news/asml-pushes-high-na-euv-140700764.html
2026-01-16 14:10:02+00:00,ROST,Insider Monkey,Here’s What Lifts Ross Stores (ROST),https://finance.yahoo.com/news/lifts-ross-stores-rost-141002426.html
2026-01-16 14:10:09+00:00,QCOM,Yahoo Finance Video,"Tech rally, US-Taiwan chip deal, power grid auction: 3 Things",https://finance.yahoo.com/video/tech-rally-us-taiwan-chip-141009857.html
2026-01-16 14:15:00+00:00,PAYX,Business Wire,Paychex Announces $1 Billion Stock Repurchase Authorization and Declares Quarterly Dividend,https://finance.yahoo.com/news/paychex-announces-1-billion-stock-141500342.html
2026-01-16 14:15:07+00:00,CSX,Zacks,CSX (CSX) Q4 Earnings on the Horizon: Analysts' Insights on Key Performance Measures,https://finance.yahoo.com/news/csx-csx-q4-earnings-horizon-141507970.html
2026-01-16 14:15:08+00:00,ISRG,Zacks,Intuitive Surgical (ISRG) Q4 Earnings on the Horizon: Analysts' Insights on Key Performance Measures,https://finance.yahoo.com/news/intuitive-surgical-isrg-q4-earnings-141508122.html
2026-01-16 14:27:00+00:00,CDNS,Zacks,Is CDNS Worth Adding Despite Breakeven Returns in the Past Six Months?,https://finance.yahoo.com/news/cdns-worth-adding-despite-breakeven-142700575.html
2026-01-16 14:28:27+00:00,PANW,Barchart,What You Need To Know Ahead of Palo Alto Networks' Earnings Release,https://finance.yahoo.com/news/know-ahead-palo-alto-networks-142827020.html
2026-01-16 14:29:31+00:00,PAYX,Insider Monkey,Paychex (PAYX) Sold Off 10% Despite Strong Earnings,https://finance.yahoo.com/news/paychex-payx-sold-off-10-142931627.html
2026-01-16 14:30:03+00:00,MRVL,Zacks,Is It Worth Investing in Marvell (MRVL) Based on Wall Street's Bullish Views?,https://finance.yahoo.com/news/worth-investing-marvell-mrvl-based-143003839.html
2026-01-16 14:30:03+00:00,ISRG,Zacks,Brokers Suggest Investing in Intuitive Surgical (ISRG): Read This Before Placing a Bet,https://finance.yahoo.com/news/brokers-suggest-investing-intuitive-surgical-143003674.html
2026-01-16 14:30:04+00:00,WDAY,Zacks,Brokers Suggest Investing in Workday (WDAY): Read This Before Placing a Bet,https://finance.yahoo.com/news/brokers-suggest-investing-workday-wday-143004965.html
2026-01-16 14:30:34+00:00,ISRG,Investor's Business Daily,"Surging Intel Stock, 2 Other Nasdaq 100 Giants Headline Earnings Calendar",https://www.investors.com/research/earnings-preview/intel-stock-nasdaq-100-netflix-earnings-isrg-ge-earnings/?src=A00220&yptr=yahoo
2026-01-16 14:32:25+00:00,KHC,The Fly,"Seagate upgraded, Tractor Supply downgraded: Wall Street's top analyst calls",https://finance.yahoo.com/news/seagate-upgraded-tractor-supply-downgraded-143225421.html
2026-01-16 14:34:00+00:00,DXCM,Zacks,Here's Why You Should Hold DexCom Stock in Your Portfolio for Now,https://finance.yahoo.com/news/heres-why-hold-dexcom-stock-143400000.html
2026-01-16 14:35:00+00:00,PEP,Motley Fool,3 Brilliant Dividend Stocks to Buy Now and Hold for the Long Term,https://finance.yahoo.com/news/3-brilliant-dividend-stocks-buy-143500939.html
2026-01-16 14:41:15+00:00,HON,Investing.com,Honeywell upgraded at JPM as breakup nears and aerospace momentum builds,https://finance.yahoo.com/news/honeywell-upgraded-jpm-breakup-nears-144115373.html
2026-01-16 14:42:00+00:00,AMAT,Zacks,"Company News for Jan 16, 2026",https://finance.yahoo.com/news/company-news-jan-16-2026-144200958.html
2026-01-16 14:42:57+00:00,FAST,Insider Monkey,Fastenal Co. (FAST) Slid on Soft US Industrial Manufacturing,https://finance.yahoo.com/news/fastenal-co-fast-slid-soft-144257846.html
2026-01-16 14:48:00+00:00,ABNB,Zacks,Buy 4 Discretionary Stocks as Rate Cut Hopes Rise on Easing Inflation,https://finance.yahoo.com/news/buy-4-discretionary-stocks-rate-144800807.html
2026-01-16 15:01:00+00:00,STX,Barrons.com,Micron and Sandisk Stocks Are on a Roll. This Is the Latest Memory-Chip Catalyst.,https://www.barrons.com/articles/micron-sandisk-stocks-memory-chip-catalyst-693e7b55?siteid=yhoof2&yptr=yahoo
2026-01-16 15:06:00+00:00,QCOM,Barrons.com,TSMC Stock Rises as It Plans $56 Billion Splurge on AI Chip Making. What Really Matters.,https://www.barrons.com/articles/tsm-stock-price-tsmc-spending-ai-intel-323b808f?siteid=yhoof2&yptr=yahoo
2026-01-16 15:09:19+00:00,DDOG,Barchart,Datadog's Q4 2025 Earnings: What to Expect,https://finance.yahoo.com/news/datadogs-q4-2025-earnings-expect-150919707.html
2026-01-16 15:10:07+00:00,MU,reddit.com/r/stocks,"MU Hitting Back-to-Back All-Time Highs. Are We Going to the Moon? - To be honest, MU performance feels almost surreal and has completely exceeded my expectations. I’ve been holding MU since 2020. Back then, friends urged me to trim my position and rotation into other tech stocks that were performing better at the time, but I stuck to my guns and decided to hold long-term In my view, MU is one of the few 'hard",
2026-01-16 15:10:46+00:00,GEHC,Simply Wall St.,Is GE HealthCare (GEHC) Using Edge AI Partnerships To Redefine Its Long-Term Competitive Moat?,https://finance.yahoo.com/news/ge-healthcare-gehc-using-edge-151046205.html
2026-01-16 15:18:59+00:00,WBD,MT Newswires,Market Chatter: Movie Theater Group Tells EU Regulators That Warner Bros. Bids Threaten Sector,https://finance.yahoo.com/news/market-chatter-movie-theater-group-151859789.html
2026-01-16 15:26:58+00:00,WBD,Yahoo Finance Video,Netflix earnings on tap amid Warner Bros. saga: A closer look,https://finance.yahoo.com/video/netflix-earnings-tap-amid-warner-152658277.html
2026-01-16 15:55:00+00:00,CSCO,Zacks,DELL vs. CSCO: Which AI Infrastructure Stock Is the Better Buy Now?,https://finance.yahoo.com/news/dell-vs-csco-ai-infrastructure-155500445.html
2026-01-16 16:05:00+00:00,MRVL,Zacks,"At 15.93 P/S, Broadcom Is Overvalued: Buy, Sell or Hold the Stock?",https://finance.yahoo.com/news/15-93-p-broadcom-overvalued-160500681.html
2026-01-16 16:05:28+00:00,ADP,MT Newswires,"Automatic Data Processing Poised to Gain From AI Product Launches, RBC Says",https://finance.yahoo.com/news/automatic-data-processing-poised-gain-160528246.html
2026-01-16 16:07:00+00:00,COST,TheStreet,Costco makes big decision members will love,https://finance.yahoo.com/news/costco-makes-big-decision-members-160700539.html
2026-01-16 16:23:30+00:00,LRCX,24/7 Wall St.,TSMC’s $56B AI Bet Just Made These 3 Stocks Millionaire Makers,https://finance.yahoo.com/news/tsmc-56b-ai-bet-just-162330104.html
2026-01-16 16:39:00+00:00,MRVL,Barrons.com,"3 Chip Stocks to Buy for 2026, According to an Analyst",https://www.barrons.com/articles/buy-broadcom-nvidia-marvell-2026-jefferies-449ab6eb?siteid=yhoof2&yptr=yahoo
2026-01-16 16:42:00+00:00,ADBE,Zacks,"Adobe Drops 9% in 3 Months: Buy, Sell or Hold the Stock in 2026?",https://finance.yahoo.com/news/adobe-drops-9-3-months-164200853.html
2026-01-16 16:58:00+00:00,DASH,GlobeNewswire,"Online Grocery Market Projected to Reach US$ 2,237.1 Billion by 2035, Supported by Rising Digital Transaction Volumes Says Astute Analytica",https://finance.yahoo.com/news/online-grocery-market-projected-reach-165800229.html
2026-01-16 17:00:05+00:00,KLAC,Zacks,Are You Looking for a Top Momentum Pick? Why KLA (KLAC) is a Great Choice,https://finance.yahoo.com/news/looking-top-momentum-pick-why-170005608.html
2026-01-16 17:05:00+00:00,MRVL,Barrons.com,Don’t Go Chasing Semis (Yet). What the Charts Say About Entry Points for 3 Chip Stocks.,https://www.barrons.com/articles/semiconductor-stocks-rally-entry-points-amd-marvell-texas-instruments-stocks-9c4ba532?siteid=yhoof2&yptr=yahoo
2026-01-16 17:09:00+00:00,CSCO,Zacks,Ciena Stock Gains 43% in 3 Months: Should Investors Buy or Hold Now?,https://finance.yahoo.com/news/ciena-stock-gains-43-3-170900393.html
2026-01-16 17:09:00+00:00,APP,Zacks,AppLovin's Scalable Ad Engine Emerges as the Real Growth Catalyst,https://finance.yahoo.com/news/applovins-scalable-ad-engine-emerges-170900851.html
2026-01-16 17:10:03+00:00,BKR,Zacks,Will Baker Hughes (BKR) Beat Estimates Again in Its Next Earnings Report?,https://finance.yahoo.com/news/baker-hughes-bkr-beat-estimates-171003667.html
2026-01-16 17:13:21+00:00,TXN,Insider Monkey,Jim Cramer on Texas Instruments: “It’ll Come Around”,https://finance.yahoo.com/news/jim-cramer-texas-instruments-ll-171321530.html
2026-01-16 17:13:22+00:00,BKR,Insider Monkey,Jim Cramer Calls Crane Company a “Good Company”,https://finance.yahoo.com/news/jim-cramer-calls-crane-company-171322098.html
2026-01-16 17:27:09+00:00,WBD,Yahoo Finance Video,Warner Bros–Netflix: What an all-cash bid means for Paramount,https://finance.yahoo.com/video/warner-bros-netflix-cash-bid-172709221.html
2026-01-16 17:31:00+00:00,SBUX,Barrons.com,"30 Stocks to Buy in 2026, According to Our Roundtable Pros",https://www.barrons.com/articles/stocks-to-buy-nike-home-depot-starbucks-doordash-deere-nestle-lvmh-roundtable-46ff33e3?siteid=yhoof2&yptr=yahoo
2026-01-16 17:37:00+00:00,CMCSA,MarketBeat,3 Low P/E Stocks: Separating Multibaggers From a Value Trap,https://finance.yahoo.com/news/3-low-p-e-stocks-173700481.html
2026-01-16 17:42:00+00:00,DXCM,Zacks,DexCom Stock Declines Following Strong Preliminary Q4 Results,https://finance.yahoo.com/news/dexcom-stock-declines-following-strong-174200925.html
2026-01-16 17:42:03+00:00,ASML,GuruFocus.com,Morgan Stanley Sees Up to 70% Upside for ASML as AI Spending Accelerates,https://finance.yahoo.com/news/morgan-stanley-sees-70-upside-174203160.html
2026-01-16 17:44:43+00:00,COST,Insider Monkey,"Walmart (WMT)’s Giving Great Competition to Amazon, Says Jim Cramer",https://finance.yahoo.com/news/walmart-wmt-giving-great-competition-174443352.html
2026-01-16 17:46:00+00:00,ISRG,Zacks,Intuitive Surgical Stock Dips on Q4 Preliminary Revenue Results,https://finance.yahoo.com/news/intuitive-surgical-stock-dips-q4-174600391.html
2026-01-16 17:47:14+00:00,CMCSA,Insider Monkey,"Paramount Skydance (PSKY)’s Warner Bros. Lawsuit is a Waste of Time, Says Jim Cramer",https://finance.yahoo.com/news/paramount-skydance-psky-warner-bros-174714492.html
2026-01-16 17:47:32+00:00,WBD,Insider Monkey,"Warner Bros. (WBD) Getting Sued is a Waste of Time, Says Jim Cramer",https://finance.yahoo.com/news/warner-bros-wbd-getting-sued-174732799.html
2026-01-16 17:47:50+00:00,CEG,Motley Fool,Why Constellation Energy Tanked Today,https://finance.yahoo.com/news/why-constellation-energy-tanked-today-174750047.html
2026-01-16 17:53:40+00:00,PLTR,24/7 Wall St.,3 Stocks to Buy Ahead of Midterm Elections This Year,https://finance.yahoo.com/news/3-stocks-buy-ahead-midterm-175340104.html
2026-01-16 18:06:07+00:00,META,reddit.com/r/stocks,"How is META not a steal right now? - I’ve been looking at every metric related to META and the only negative I can see was that VR was a disaster, and AI may not be their strongest weapon, but aside from that, their moat and overarching business model is absolutely incredible. They have billions of daily active users, across multiple integrated platforms and their ad revenue is unbelievable. As a business owner myself, IG",
2026-01-16 18:06:51+00:00,WBD,The Daily Upside,4 Simple Ways to Pad Your Nest Egg in 2026,https://finance.yahoo.com/news/4-simple-ways-pad-nest-180651561.html
2026-01-16 18:07:10+00:00,BKR,Oilprice.com,US Oil Drillers Add To Active Rigs,https://finance.yahoo.com/news/us-oil-drillers-add-active-180710112.html
2026-01-16 18:09:40+00:00,CEG,Yahoo Finance Video,"Trump threatens tariffs over Greenland, addresses AI power costs",https://finance.yahoo.com/video/trump-threatens-tariffs-over-greenland-180940319.html
2026-01-16 18:14:14+00:00,CEG,MT Newswires,Sector Update: Energy,https://finance.yahoo.com/news/sector-energy-181414328.html
2026-01-16 18:18:55+00:00,KLAC,Insider Monkey,"KLA (KLAC) is “Terrific,” Says Jim Cramer",https://finance.yahoo.com/news/kla-klac-terrific-says-jim-181855444.html
2026-01-16 18:22:35+00:00,ARM,GuruFocus.com,Intel Stock Fall Despite Citi Upgrade Amid Foundry Hopes,https://finance.yahoo.com/news/intel-stock-fall-despite-citi-182235864.html
2026-01-16 18:25:00+00:00,CEG,Barrons.com,Indexes Turn Positive as Stocks Fight for Gains,https://www.barrons.com/livecoverage/stock-market-news-today-011626/card/indexes-turn-positive-as-stocks-fight-for-gains-RoRyjtgogUpO6aHOeIhq?siteid=yhoof2&yptr=yahoo
2026-01-16 18:25:27+00:00,COST,GuruFocus.com,Costco Declares $1.30 Quarterly Dividend,https://finance.yahoo.com/news/costco-declares-1-30-quarterly-182527133.html
2026-01-16 18:30:02+00:00,COST,Barchart,Why Selling Costco and 3 Other Unusually Active Puts Could Save You From Overpaying,https://finance.yahoo.com/news/why-selling-costco-3-other-183002499.html
2026-01-16 18:33:00+00:00,QCOM,TheStreet,Fund manager pulls plug on popular semiconductor stock,https://finance.yahoo.com/news/fund-manager-pulls-plug-popular-183300070.html
2026-01-16 18:35:52+00:00,AMAT,Barchart,Applied Materials Stock Just Hit a New All-Time High. Should You Buy AMAT Here?,https://finance.yahoo.com/news/applied-materials-stock-just-hit-183552255.html
2026-01-16 18:43:11+00:00,CEG,MT Newswires,Sector Update: Energy Stocks Increase Friday Afternoon,https://finance.yahoo.com/news/sector-energy-stocks-increase-friday-184311970.html
2026-01-16 18:52:35+00:00,DASH,MT Newswires,Sector Update: Consumer Stocks Decline in Afternoon Trading,https://finance.yahoo.com/news/sector-consumer-stocks-decline-afternoon-185235448.html
2026-01-16 19:10:38+00:00,DDOG,Insider Monkey,DataDog Inc (DDOG) Set To Be a Beneficiary of Vendor Consolidation,https://finance.yahoo.com/news/datadog-inc-ddog-set-beneficiary-191038557.html
2026-01-16 19:19:34+00:00,CEG,MT Newswires,Equities Rise Intraday as Traders Monitor Fed Chair Race,https://finance.yahoo.com/news/equities-rise-intraday-traders-monitor-191934768.html
2026-01-16 19:28:00+00:00,LRCX,24/7 Wall St.,"2026’s Biggest AI Trends: The Memory Explosion | MU Stock, SNDK Stock, SK Hynix, CAMT Stock",https://finance.yahoo.com/news/2026-biggest-ai-trends-memory-192800383.html
2026-01-16 19:30:00+00:00,PLTR,Motley Fool,Palantir Stock Falls Hard to Start 2026. Here's What Investors Need to Know,https://finance.yahoo.com/news/palantir-stock-falls-hard-start-193000907.html
2026-01-16 19:45:00+00:00,SHOP,ACCESS Newswire,Emersoft Launches First Complete Commerce Solution for Online and Brick-and-Mortar Bookstores,https://finance.yahoo.com/news/emersoft-launches-first-complete-commerce-194500714.html
2026-01-16 19:55:00+00:00,WDC,Barrons.com,Seagate Stock Continues to Rally. The Stock’s Last Doubter Waved the White Flag.,https://www.barrons.com/articles/data-storage-stocks-upgrade-d00d3373?siteid=yhoof2&yptr=yahoo
2026-01-16 20:04:30+00:00,PYPL,Insider Monkey,"Is PayPal Holdings, Inc. (PYPL) One of the Best Depressed Stocks to Buy Right Now?",https://finance.yahoo.com/news/paypal-holdings-inc-pypl-one-200430775.html
2026-01-16 20:04:33+00:00,WDAY,Insider Monkey,"Barclays Lowers Firm’s PT on Workday, Inc. (WDAY) Stock",https://finance.yahoo.com/news/barclays-lowers-firm-pt-workday-200433445.html
2026-01-16 20:04:35+00:00,ROP,Insider Monkey,Piper Sandler Reduces the Firm’s PT on Roper Technologies (ROP) Stock,https://finance.yahoo.com/news/piper-sandler-reduces-firm-pt-200435734.html
2026-01-16 20:15:00+00:00,WDC,Barrons.com,"18% of S&P 500 Stocks Are Up at Least least 10% This Year. That’s Really, Really Good.",https://www.barrons.com/articles/stock-market-strength-2026-e37aef2e?siteid=yhoof2&yptr=yahoo
2026-01-16 20:32:00+00:00,CRWD,MarketBeat,Why CrowdStrike’s SGNL Acquisition Matters for CRWD Stock,https://finance.yahoo.com/news/why-crowdstrike-sgnl-acquisition-matters-203200400.html
2026-01-16 20:45:00+00:00,COST,FastCompany,Meet the Sam’s Club CEO tasked with taking on Costco,https://finance.yahoo.com/news/meet-sam-club-ceo-tasked-204500797.html
2026-01-16 20:49:57+00:00,DASH,MT Newswires,Sector Update: Consumer Stocks Decline Late Afternoon,https://finance.yahoo.com/news/sector-consumer-stocks-decline-afternoon-204957517.html
2026-01-16 20:53:20+00:00,AMAT,Barchart,Wells Fargo Can’t Get Enough of These 2 Semiconductor Stocks,https://finance.yahoo.com/news/wells-fargo-t-enough-2-205320169.html
2026-01-16 20:54:44+00:00,KHC,Yahoo Finance Video,"Honeywell upgraded by JPMorgan, OpenAI to begin testing ads",https://finance.yahoo.com/video/honeywell-upgraded-jpmorgan-openai-begin-205444316.html
2026-01-16 20:55:50+00:00,AMGN,Barchart,"Ahead of the Quantinuum IPO, Should You Buy Honeywell Stock?",https://finance.yahoo.com/news/ahead-quantinuum-ipo-buy-honeywell-205550077.html
2026-01-16 20:59:55+00:00,CEG,MT Newswires,Sector Update: Energy Stocks Advance Late Afternoon,https://finance.yahoo.com/news/sector-energy-stocks-advance-afternoon-205955078.html
2026-01-16 21:10:50+00:00,TEAM,StockStory,Why Atlassian (TEAM) Stock Is Nosediving,https://finance.yahoo.com/news/why-atlassian-team-stock-nosediving-211050461.html
2026-01-16 21:18:00+00:00,WDC,Barrons.com,"Today’s Stock Movers: GE Vernova, Constellation Energy, Micron, AST SpaceMobile, Novo Nordisk, and More",https://www.barrons.com/articles/stock-movers-45c8219d?siteid=yhoof2&yptr=yahoo
