timestamp,ticker,source,text,url
2026-01-18 15:15:00+00:00,INTC,Motley Fool,"I Predicted Nvidia Was a Better Dow Stock Than Amazon in 2025, and I Was Right. But Which Is the Better ""Magnificent Seven"" Stock for 2026?",https://finance.yahoo.com/news/predicted-nvidia-better-dow-stock-151500176.html
2026-01-18 15:49:00+00:00,CRWD,MarketBeat,"Big Risk, Potentially Bigger Return For These 3 Leveraged ETF's",https://finance.yahoo.com/news/big-risk-potentially-bigger-return-154900407.html
2026-01-18 16:05:56+00:00,ASML,Yahoo Finance,'A broadening playbook': Wall Street sees stock market gains beyond tech,https://finance.yahoo.com/news/a-broadening-playbook-wall-street-sees-stock-market-gains-beyond-tech-160556466.html
2026-01-18 17:25:00+00:00,AMD,Motley Fool,A Once-in-a-Decade Opportunity: AMD's Stock Could Surge 348% Through 2030,https://finance.yahoo.com/news/once-decade-opportunity-amds-stock-172500633.html
2026-01-18 17:25:32+00:00,ADBE,reddit.com/r/stocks,"Anyone else catching the falling knife in SaaS lately? - AI fears have crushed software stocks while the rest of tech is near highs. Valuations looks attractive though, with many names at multi-year lows despite wide moats and strong margins. I started buying last week (ADBE and WDAY) and think pessimism may be overdone. Curious if others are buying here or waiting for a clearer catalyst.",
2026-01-18 17:29:44+00:00,AVGO,Insider Monkey,Wells Fargo Upgrades Broadcom Inc. (AVGO) to Overweight From Equal Weight,https://finance.yahoo.com/news/wells-fargo-upgrades-broadcom-inc-172944327.html
2026-01-18 17:30:11+00:00,AMGN,Insider Monkey,Is Evotec SE (EVO) One of the Best Debt-Free Penny Stocks to Buy Right Now?,https://finance.yahoo.com/news/evotec-se-evo-one-best-173011910.html
2026-01-18 17:33:00+00:00,COST,TheStreet,Costco adds trendy new beverage line to warehouses nationwide,https://finance.yahoo.com/news/costco-adds-trendy-beverage-line-173300582.html
2026-01-18 17:48:40+00:00,CSCO,Insider Monkey,"Jim Cramer Says “Lately, Though, Cisco’s Gotten Its Act Together”",https://finance.yahoo.com/news/jim-cramer-says-lately-though-174840590.html
2026-01-18 17:48:42+00:00,AMD,Insider Monkey,"Jim Cramer Says “Once They Cleaned Up the Balance Sheet, Intel Instantly Became a Much Better Story”",https://finance.yahoo.com/news/jim-cramer-says-once-cleaned-174842427.html
2026-01-18 17:48:44+00:00,ADBE,Insider Monkey,Jim Cramer Says “I Am Not Going to Call Bottom in ServiceNow”,https://finance.yahoo.com/news/jim-cramer-says-am-not-174844627.html
2026-01-18 18:00:02+00:00,KLAC,Barchart,KLA Corp. Stock Just Got a New Street-High Price Target. Should You Buy KLAC Shares Now?,https://finance.yahoo.com/news/kla-corp-stock-just-got-180002478.html
2026-01-18 18:00:02+00:00,INTC,Barchart,"Trump Speech, Earnings and Other Key Things to Watch this Week",https://finance.yahoo.com/news/trump-speech-earnings-other-key-180002680.html
2026-01-18 18:47:00+00:00,PEP,TheStreet,"How much to invest in Pepsi for $1,000 in annual dividends (2026)",https://finance.yahoo.com/news/much-invest-pepsi-1-000-184700632.html
2026-01-18 19:00:00+00:00,INTC,Barrons.com,"Netflix, United Airlines, GE Aerospace, Intel, CPE, and More to Watch This Week",https://www.barrons.com/articles/netflix-united-airlines-ge-aerospace-intel-cpe-cf2b31d3?siteid=yhoof2&yptr=yahoo
2026-01-18 19:16:01+00:00,CEG,GuruFocus.com,Constellation Energy: Current Price Levels Leave No Room for Error,https://finance.yahoo.com/news/constellation-energy-current-price-levels-191601152.html
2026-01-18 20:09:16+00:00,MPWR,Insider Monkey,Monolithic Power Systems (MPWR) Emerges as High-Conviction AI Data Center Power Play,https://finance.yahoo.com/news/monolithic-power-systems-mpwr-emerges-200916476.html
2026-01-18 20:20:00+00:00,AMD,Motley Fool,"Got $3,000? 3 Artificial Intelligence (AI) Stocks to Buy and Hold for the Long Term",https://finance.yahoo.com/news/got-3-000-3-artificial-202000810.html
2026-01-18 21:55:05+00:00,CRWD,Insider Monkey,"BTIG Sees Strategic Value in CrowdStrike’s (CRWD) SGNL, Seraphic Acquisitions",https://finance.yahoo.com/news/btig-sees-strategic-value-crowdstrike-215505035.html
2026-01-18 22:25:00+00:00,INTC,Motley Fool,"By 2027, This Could Be One of the Most Important Stocks in Its Industry",https://finance.yahoo.com/news/2027-could-one-most-important-222500911.html
2026-01-18 23:30:00+00:00,SBUX,Money Digest,Chick-Fil-A's Bold Move Shows How Far Restaurants Will Go To Protect Sales,https://finance.yahoo.com/news/chick-fil-bold-move-shows-233000082.html
2026-01-19 00:05:00+00:00,WDAY,Motley Fool,Software Stocks Are in Turmoil. Here Are 5 to Buy Right Now.,https://finance.yahoo.com/news/software-stocks-turmoil-5-buy-000500190.html
2026-01-19 00:30:00+00:00,AZN,PR Newswire,AbelZeta Announces Remaining China Rights to GPC3 Armored CAR-T Therapy to be Acquired by AstraZeneca,https://finance.yahoo.com/news/abelzeta-announces-remaining-china-rights-003000712.html
2026-01-19 00:33:00+00:00,AMD,Motley Fool,2 Artificial Intelligence (AI) Stocks to Buy in January and Hold for 10 Years,https://finance.yahoo.com/news/2-artificial-intelligence-ai-stocks-003300077.html
2026-01-19 01:09:02+00:00,FAST,Simply Wall St.,The Bull Case For Fastenal (FAST) Could Change Following Dividend Hike And CEO Transition Timing,https://finance.yahoo.com/news/bull-case-fastenal-fast-could-010902663.html
2026-01-19 01:10:23+00:00,QCOM,Simply Wall St.,Assessing Qualcomm (QCOM) Valuation After New Robotics And AI Announcements,https://finance.yahoo.com/news/assessing-qualcomm-qcom-valuation-robotics-011023701.html
2026-01-19 02:05:00+00:00,BKNG,PR Newswire,"Agoda reveals: Sapa, Vietnam is Asia's top emerging destination",https://finance.yahoo.com/news/agoda-reveals-sapa-vietnam-asias-020500604.html
2026-01-19 02:06:41+00:00,COST,reddit.com/r/stocks,"DD on $CDE silver/gold miner - Here is DD on an undervalued silver and gold mining stock, CDE: Couer Mining (CDE) is currently trading at 22.6, and is valued at 32.2. I have shares at 18.5 and have been playing calls. I am expecting a BIG gap up on Tuesday so hopefully you guys bought in last week, but it may not be too late! Here is why I like CDE: They have an upcoming",
2026-01-19 02:08:31+00:00,CEG,Simply Wall St.,Does Constellation Energy’s (CEG) Massive Shelf and NRC Win Reframe Its Data Center Nuclear Thesis?,https://finance.yahoo.com/news/does-constellation-energy-ceg-massive-020831256.html
2026-01-19 02:10:44+00:00,XEL,Simply Wall St.,Did Exelon's (EXC) New Grid Plan and Tech Leadership Shift Its Regulated Growth Narrative?,https://finance.yahoo.com/news/did-exelons-exc-grid-plan-021044748.html
2026-01-19 03:01:57+00:00,NFLX,StockStory,Netflix (NFLX) Reports Q4: Everything You Need To Know Ahead Of Earnings,https://finance.yahoo.com/news/netflix-nflx-reports-q4-everything-030157109.html
2026-01-19 03:02:26+00:00,FAST,StockStory,Fastenal (FAST) Q4 Earnings: What To Expect,https://finance.yahoo.com/news/fastenal-fast-q4-earnings-expect-030226753.html
2026-01-19 03:13:33+00:00,STX,Simply Wall St.,Does Seagate (STX) Leaning Into AI Edge Storage Reframe Its Core Competitive Moat?,https://finance.yahoo.com/news/does-seagate-stx-leaning-ai-031333928.html
2026-01-19 04:20:45+00:00,FANG,Insider Monkey,Diamondback (FANG) Says Realized Oil Prices Fell in Q4 as Crude Market Weakened,https://finance.yahoo.com/news/diamondback-fang-says-realized-oil-042045952.html
2026-01-19 04:23:26+00:00,FAST,Simply Wall St.,Fastenal (FAST) Valuation Check After Dividend Increase CEO Change And Upcoming Earnings,https://finance.yahoo.com/news/fastenal-fast-valuation-check-dividend-042326326.html
2026-01-19 04:31:40+00:00,CHTR,StockStory,3 Consumer Stocks We’re Skeptical Of,https://finance.yahoo.com/news/3-consumer-stocks-skeptical-043140767.html
2026-01-19 04:34:01+00:00,CDNS,StockStory,2 of Wall Street’s Favorite Stocks with Solid Fundamentals and 1 Facing Challenges,https://finance.yahoo.com/news/2-wall-street-favorite-stocks-043401238.html
2026-01-19 04:34:48+00:00,CMCSA,StockStory,1 Value Stock with Competitive Advantages and 2 We Avoid,https://finance.yahoo.com/news/1-value-stock-competitive-advantages-043448291.html
2026-01-19 04:35:36+00:00,ODFL,Insider Monkey,Evercore ISI Raises Old Dominion (ODFL) Target but Warns Transport Optimism is Priced In,https://finance.yahoo.com/news/evercore-isi-raises-old-dominion-043536873.html
2026-01-19 04:35:53+00:00,TTWO,StockStory,2 Internet Stocks with Competitive Advantages and 1 We Turn Down,https://finance.yahoo.com/news/2-internet-stocks-competitive-advantages-043553768.html
2026-01-19 04:37:20+00:00,COST,StockStory,1 Cash-Producing Stock on Our Watchlist and 2 We Question,https://finance.yahoo.com/news/1-cash-producing-stock-watchlist-043720093.html
2026-01-19 04:38:07+00:00,HON,StockStory,2 Cash-Producing Stocks for Long-Term Investors and 1 That Underwhelm,https://finance.yahoo.com/news/2-cash-producing-stocks-long-043807661.html
2026-01-19 04:38:08+00:00,QCOM,StockStory,1 Large-Cap Stock with Exciting Potential and 2 That Underwhelm,https://finance.yahoo.com/news/1-large-cap-stock-exciting-043808890.html
2026-01-19 04:38:21+00:00,MNST,StockStory,2 Large-Cap Stocks with Promising Prospects and 1 We Avoid,https://finance.yahoo.com/news/2-large-cap-stocks-promising-043821129.html
2026-01-19 04:39:20+00:00,REGN,StockStory,3 Profitable Stocks We Think Twice About,https://finance.yahoo.com/news/3-profitable-stocks-think-twice-043920792.html
2026-01-19 04:39:23+00:00,INTC,StockStory,1 Momentum  Stock to Target This Week and 2 We Find Risky,https://finance.yahoo.com/news/1-momentum-stock-target-week-043923009.html
2026-01-19 04:40:08+00:00,VRSK,StockStory,3 Large-Cap Stocks We Find Risky,https://finance.yahoo.com/news/3-large-cap-stocks-risky-044008757.html
2026-01-19 05:05:11+00:00,WDC,Simply Wall St.,Sandisk (SNDK) Is Up 9.6% After AI-Fueled NAND Shortage Tightens SSD Supply - Has The Bull Case Changed?,https://finance.yahoo.com/news/sandisk-sndk-9-6-ai-050511710.html
2026-01-19 05:06:05+00:00,EXC,Simply Wall St.,Assessing Exelon (EXC) Valuation After New Grid Plan Customer Relief Fund And Transmission Agreements,https://finance.yahoo.com/news/assessing-exelon-exc-valuation-grid-050605056.html
2026-01-19 06:04:24+00:00,INSM,Insider Monkey,Analyst Weighs Patent Cliff Risks Against Insmed’s (INSM) Growth Story,https://finance.yahoo.com/news/analyst-weighs-patent-cliff-risks-060424848.html
2026-01-19 06:28:10+00:00,PANW,Insider Monkey,Analysts Remain Cautious on Palo Alto (PANW) Amid Growth Challenges,https://finance.yahoo.com/news/analysts-remain-cautious-palo-alto-062810398.html
2026-01-19 06:55:07+00:00,AMZN,reddit.com/r/stocks,"Amazon: European Sovereign Cloud Launch - ​Amazon Web Services (AWS) has officially launched the AWS European Sovereign Cloud, beginning with its first region in Brandenburg, Germany with €7.8 billion investment through 2040. **AWS European Sovereign Cloud** * Set up as a distinct corporate entity under EU law. * Physically and logically independent cloud environment designed to ensure compliance to EU digital sovereignty laws. * Will be operated and maintained by EU citizens (after transition). *",
2026-01-19 06:58:00+00:00,PYPL,Motley Fool,"Palantir Billionaire Peter Thiel Sells Nvidia and Tesla Shares, Then Buys an AI Stock That's Up Nearly 460,000% Since Its IPO",https://finance.yahoo.com/news/palantir-billionaire-peter-thiel-sells-065800486.html
2026-01-19 07:00:00+00:00,SBUX,PR Newswire,"Water.org Partners with Gap Inc., Amazon, Starbucks, and Ecolab to Launch Get Blue™, Advancing Water.org's Goal of Reaching 200 Million People by 2030",https://finance.yahoo.com/news/water-org-partners-gap-inc-070000823.html
2026-01-19 07:08:44+00:00,MCHP,Simply Wall St.,A Look At Microchip Technology (MCHP) Valuation After Positive Analyst Support And New Automotive And Aerospace Products,https://finance.yahoo.com/news/look-microchip-technology-mchp-valuation-070844863.html
2026-01-19 07:30:00+00:00,AZN,Business Wire,ENHERTU® Plus Pertuzumab Type II Variation Application Validated in the EU as First-Line Treatment of Patients with HER2 Positive Metastatic Breast Cancer,https://finance.yahoo.com/news/enhertu-plus-pertuzumab-type-ii-073000943.html
2026-01-19 08:06:00+00:00,ORLY,Motley Fool,This Dirt Cheap Stock Could Make You Filthy Rich,https://finance.yahoo.com/news/dirt-cheap-stock-could-filthy-080600334.html
2026-01-19 08:57:22+00:00,NFLX,FX Empire,"Core Performance, Margins and Monetisation: What Netflix’s Fundamentals Tell Traders",https://finance.yahoo.com/news/core-performance-margins-monetisation-netflix-085722022.html
2026-01-19 09:08:16+00:00,MSTR,99bitcoins,Michael Saylor’s Bitcoin Bet Faces Reality Check as Strategy Slips,https://finance.yahoo.com/news/michael-saylor-bitcoin-bet-faces-090816258.html
2026-01-19 09:10:00+00:00,PLTR,Motley Fool,Palantir Stock Drops 17% From Its High. Wall Street Has Best- and Worst-Case Scenarios for What Happens Next.,https://finance.yahoo.com/news/palantir-stock-drops-17-high-091000548.html
2026-01-19 09:19:18+00:00,AVGO,Insider Monkey,What Does the Street Think About Broadcom Inc. (AVGO)?,https://finance.yahoo.com/news/does-street-think-broadcom-inc-091918341.html
2026-01-19 09:57:00+00:00,MAR,GlobeNewswire,"Hotels, Resorts, & Cruise Lines Market Forecast Report, 2026-2032: Accor, Hilton, Marriott, Carnival, and Royal Caribbean Ramp Up Tech Investments",https://finance.yahoo.com/news/hotels-resorts-cruise-lines-market-095700986.html
2026-01-19 10:12:16+00:00,CEG,Simply Wall St.,US Stock Market Today: S&P 500 Futures Fall On Tariff And Rate Jitters,https://finance.yahoo.com/news/us-stock-market-today-p-101216047.html
2026-01-19 10:42:35+00:00,DASH,Insider Monkey,Analysts See Over 30% Upside in DoorDash Inc. (DASH) Despite Margin Uncertainty,https://finance.yahoo.com/news/analysts-see-over-30-upside-104235022.html
2026-01-19 11:00:14+00:00,ADBE,Simply Wall St.,Institutional owners may consider drastic measures as Adobe Inc.'s (NASDAQ:ADBE) recent US$13b drop adds to long-term losses,https://finance.yahoo.com/news/institutional-owners-may-consider-drastic-110014972.html
2026-01-19 11:00:25+00:00,ROP,Simply Wall St.,"Should Weakness in Roper Technologies, Inc.'s (NASDAQ:ROP) Stock Be Seen As A Sign That Market Will Correct The Share Price Given Decent Financials?",https://finance.yahoo.com/news/weakness-roper-technologies-inc-nasdaq-110025601.html
2026-01-19 11:04:00+00:00,MU,Barrons.com,Nvidia Faces Another Obstacle in China. But Wall Street Still Loves the Stock.,https://www.barrons.com/articles/nvidia-stock-price-h200-sales-5efcbb2c?siteid=yhoof2&yptr=yahoo
2026-01-19 11:06:37+00:00,MSTR,CoinDesk,"Strive’s preferred stock hits par value, unlocking bitcoin funding channel",https://finance.yahoo.com/news/strive-preferred-stock-hits-par-110637196.html
2026-01-19 11:07:50+00:00,MU,Verdict,Micron breaks ground on $100bn megafab project in US,https://finance.yahoo.com/news/micron-breaks-ground-100bn-megafab-110750842.html
2026-01-19 11:10:00+00:00,AVGO,Motley Fool,Which Vanguard ETF Is Most Likely to Soar in 2026?,https://finance.yahoo.com/news/vanguard-etf-most-likely-soar-111000393.html
2026-01-19 11:10:33+00:00,CSX,Simply Wall St.,Assessing CSX (CSX) Valuation After Recent Share Price Stability And Mixed Short Term Returns,https://finance.yahoo.com/news/assessing-csx-csx-valuation-recent-111033111.html
2026-01-19 11:12:31+00:00,CRWD,Simply Wall St.,CrowdStrike (CRWD) Valuation Check As Short Term Returns Cool And Long Term Gains Remain Strong,https://finance.yahoo.com/news/crowdstrike-crwd-valuation-check-short-111231831.html
2026-01-19 11:17:37+00:00,AZN,Pharmaceutical Technology,AstraZeneca to acquire China rights for AbelZeta’s CAR-T therapy,https://finance.yahoo.com/news/astrazeneca-acquire-china-rights-abelzeta-111737394.html
2026-01-19 11:28:49+00:00,ADI,Barchart,Analog Devices' Quarterly Earnings Preview: What You Need to Know,https://finance.yahoo.com/news/analog-devices-quarterly-earnings-preview-112849189.html
2026-01-19 11:36:50+00:00,AVGO,GuruFocus.com,SEC Approves Expanded Option Expirations for Magnificent Seven Stocks,https://finance.yahoo.com/news/sec-approves-expanded-option-expirations-113650138.html
2026-01-19 11:37:23+00:00,MU,Simply Wall St.,Latest News In AI Chips - Micron Boosts DRAM Capacity with Strategic Taiwan Acquisition,https://finance.yahoo.com/news/latest-news-ai-chips-micron-113723442.html
2026-01-19 11:42:46+00:00,AAPL,GuruFocus.com,Cathie Wood Bets Big on TSMC -- Loads Up Millions After Strong Q4 Earnings,https://finance.yahoo.com/news/cathie-wood-bets-big-tsmc-114246476.html
2026-01-19 11:43:00+00:00,TSLA,GlobeNewswire,Autonomous Driving Market Sees Robust Growth with CAGR of 17.63% Expected By 2033 | Astute Analytica,https://finance.yahoo.com/news/autonomous-driving-market-sees-robust-114300151.html
2026-01-19 11:47:59+00:00,AMD,Investing.com,"Top 3 AI Stocks Dominating the Market, According to WarrenAI",https://finance.yahoo.com/news/top-3-ai-stocks-dominating-114759478.html
2026-01-19 11:48:05+00:00,MU,GuruFocus.com,Micron Flags Unprecedented Memory Shortage,https://finance.yahoo.com/news/micron-flags-unprecedented-memory-shortage-114805478.html
2026-01-19 11:53:14+00:00,AAPL,Insider Monkey,Apple Inc. (AAPL) Faces Added Uncertainty from Regulatory Scrutiny in India,https://finance.yahoo.com/news/apple-inc-aapl-faces-added-115314843.html
2026-01-19 11:56:24+00:00,MSTR,Coinspeaker,Michael Saylor Hints at More Bitcoin Buys as BTC Hovers Above $93K,https://finance.yahoo.com/news/michael-saylor-hints-more-bitcoin-115624033.html
2026-01-19 11:57:40+00:00,AMD,reddit.com/r/stocks,"Black Swan | The Greenland Gambit: Why Novo Nordisk (NVO) is the Ultimate Geopolitical Pawn | Denmark's Crown Jewel on US Entity Black List - # Section 1: The Arctic Standoff and the ""Novo Nordisk Risk"" In the early weeks of 2026, the frozen landscape of the Arctic has transformed into the most volatile theater in global geopolitics. What began as the ""Greenland Crisis"" has rapidly escalated from a diplomatic curiosity into a full-blown transatlantic",
2026-01-19 11:59:23+00:00,MU,Insider Monkey,Memory Bottlenecks Cloud NVIDIA’s (NVDA) Latest China Export Approval,https://finance.yahoo.com/news/memory-bottlenecks-cloud-nvidia-nvda-115923745.html
2026-01-19 12:00:00+00:00,AMZN,TMX Newsfile,SuperQ Quantum Strengthens Global Leadership with Appointment of Key Strategic Advisors in Science and Commercialization,https://finance.yahoo.com/news/superq-quantum-strengthens-global-leadership-120000310.html
2026-01-19 12:00:00+00:00,MCHP,GlobeNewswire,Microchip Expands PolarFire® FPGA Smart Embedded Video Ecosystem with New SDI IP Cores and Quad CoaXPress™ Bridge Kit,https://finance.yahoo.com/news/microchip-expands-polarfire-fpga-smart-120000054.html
2026-01-19 12:00:09+00:00,MNST,Simply Wall St.,"Insiders At Monster Beverage Sold US$4.3m In Stock, Alluding To Potential Weakness",https://finance.yahoo.com/news/insiders-monster-beverage-sold-us-120009599.html
2026-01-19 12:00:13+00:00,BKR,Simply Wall St.,Here's Why Baker Hughes (NASDAQ:BKR) Has Caught The Eye Of Investors,https://finance.yahoo.com/news/heres-why-baker-hughes-nasdaq-120013420.html
2026-01-19 12:00:19+00:00,AXON,Simply Wall St.,"Axon Enterprise Insiders Sell US$43m Of Stock, Possibly Signalling Caution",https://finance.yahoo.com/news/axon-enterprise-insiders-sell-us-120019015.html
2026-01-19 12:01:27+00:00,MAR,Barchart,What to Expect From Marriott International’s Next Quarterly Earnings Report,https://finance.yahoo.com/news/expect-marriott-international-next-quarterly-120127091.html
2026-01-19 12:09:06+00:00,MSFT,Simply Wall St.,How HP’s CES AI PC Push At HP (HPQ) Has Changed Its Investment Story,https://finance.yahoo.com/news/hp-ces-ai-pc-push-120906251.html
2026-01-19 12:15:08+00:00,TSLA,24/7 Wall St.,"Tesla (NASDAQ: TSLA) Bull, Base and Bear Price Prediction and Forecast",https://finance.yahoo.com/news/tesla-nasdaq-tsla-bull-bear-153808849.html
2026-01-19 12:30:00+00:00,DASH,Moneywise,Philadelphia dad wants to ditch steady salary to finance new car and drive Uber. Ramsey hosts beg for him to rethink it,https://finance.yahoo.com/news/philadelphia-dad-wants-ditch-steady-123000948.html
2026-01-19 12:37:52+00:00,PYPL,Simply Wall St.,Latest News In Digital Payment - Rapid Growth and Innovation Transform the Payment Market,https://finance.yahoo.com/news/latest-news-digital-payment-rapid-123752467.html
2026-01-19 12:38:35+00:00,TSLA,Verdict,ClickHouse secures $400m in Series D led by Dragoneer,https://finance.yahoo.com/news/clickhouse-secures-400m-series-d-123835366.html
2026-01-19 12:41:42+00:00,AAPL,Yahoo Finance UK,Are you concerned about Trump's tariff threat over Greenland? Have your say,https://finance.yahoo.com/news/trump-tariffs-greenland-investing-poll-124142379.html
2026-01-19 12:49:16+00:00,PYPL,Insider Monkey,Stephens Remains a Hold on PayPal Holdings (PYPL),https://finance.yahoo.com/news/stephens-remains-hold-paypal-holdings-124916238.html
2026-01-19 12:49:17+00:00,MSFT,Insider Monkey,TD Cowen Remains a Hold on Fiserv (FISV),https://finance.yahoo.com/news/td-cowen-remains-hold-fiserv-124917129.html
2026-01-19 12:49:29+00:00,INTC,Insider Monkey,Goldman Sachs Downgrades HP Inc (HPQ) to Sell,https://finance.yahoo.com/news/goldman-sachs-downgrades-hp-inc-124929663.html
2026-01-19 12:49:53+00:00,AZN,Insider Monkey,AstraZeneca’s Subcutaneous Saphnelo Shows Significant Disease Reduction in Landmark Lupus Trial,https://finance.yahoo.com/news/astrazeneca-subcutaneous-saphnelo-shows-significant-124953424.html
2026-01-19 12:49:55+00:00,AXON,Insider Monkey,Northcoast Upgrades Axon (AXON) to Buy With $742 Price Target,https://finance.yahoo.com/news/northcoast-upgrades-axon-axon-buy-124955508.html
2026-01-19 12:49:57+00:00,VRTX,Insider Monkey,Bernstein Names Vertex (VRTX) a “Top Biotech Pick” for 2026 Following Upgrade to Outperform,https://finance.yahoo.com/news/bernstein-names-vertex-vrtx-top-124957060.html
2026-01-19 12:49:58+00:00,WDAY,Insider Monkey,Goldman Sachs Initiates Workday (WDAY) at Neutral as Challenging Market Share Gains Temper AI Optimism,https://finance.yahoo.com/news/goldman-sachs-initiates-workday-wday-124958448.html
2026-01-19 12:50:02+00:00,INTU,Insider Monkey,Wells Fargo Downgrades Intuit (INTU) as “Impossible” 2025 Comparisons Cloud 2026 Growth Outlook,https://finance.yahoo.com/news/wells-fargo-downgrades-intuit-intu-125002984.html
2026-01-19 12:50:05+00:00,AMD,Insider Monkey,Citi Maintains Neutral on AMD With $260 PT as Muted Margin Leverage Tempers AI Growth,https://finance.yahoo.com/news/citi-maintains-neutral-amd-260-125005690.html
2026-01-19 12:50:08+00:00,AVGO,Insider Monkey,Citi Bullish on Broadcom (AVGO) as Accelerating AI Sales Drive $480 PT,https://finance.yahoo.com/news/citi-bullish-broadcom-avgo-accelerating-125008352.html
2026-01-19 12:50:10+00:00,AMZN,Insider Monkey,Amazon’s New Sovereign Cloud Solidifies its Long-Term Growth Potential,https://finance.yahoo.com/news/amazon-sovereign-cloud-solidifies-long-125010661.html
2026-01-19 13:00:00+00:00,CSCO,Business Wire,Sharon AI Accelerates Enterprise AI & High-Performance Compute Expansion with an Investment from Digital Alpha of up to US$200M and Strategic Technology Partnership with Cisco,https://finance.yahoo.com/news/sharon-ai-accelerates-enterprise-ai-130000117.html
2026-01-19 13:00:43+00:00,CRWD,Yahoo Finance Video,More AI means a higher need for cybersecurity: CrowdStrike CEO,https://finance.yahoo.com/video/more-ai-means-higher-cybersecurity-110043500.html
2026-01-19 13:01:00+00:00,LRCX,Zacks,"Beat the Market the Zacks Way: Amicus, Micron, Amgen in Focus",https://finance.yahoo.com/news/beat-market-zacks-way-amicus-130100666.html
2026-01-19 13:03:00+00:00,MU,Zacks,NVIDIA vs. Micron: Which AI Chip Stock Is a Better Investment Option?,https://finance.yahoo.com/news/nvidia-vs-micron-ai-chip-130300506.html
2026-01-19 13:05:00+00:00,AMZN,Motley Fool,Is Robinhood Stock a Millionaire Maker?,https://finance.yahoo.com/news/robinhood-stock-millionaire-maker-130500332.html
2026-01-19 13:06:22+00:00,FAST,reddit.com/r/stocks,"Makes a sense to wait and see when evidence is there? Anktiva from IBRX, question. - FDA approved.SFDA approved.EMA fast track approved. Phase 3 for lung cancer. Phase 1/2 for pancreatic cancer, lymphoma. All the behind the scenes tech involved,the supporting science ebidence and pathways,all the possible pipelines as combo treatment improving survival rates...this looks very very promising.",
2026-01-19 13:08:02+00:00,PAYX,Simply Wall St.,Assessing Paychex (PAYX) Valuation After Earnings Beat And New US$1b Buyback In A Soft Employment Backdrop,https://finance.yahoo.com/news/assessing-paychex-payx-valuation-earnings-130802299.html
2026-01-19 13:09:33+00:00,ASML,Simply Wall St.,ASML Holding (ENXTAM:ASML) Is Up 7.4% After TSMC Unveils Higher AI-Focused Capex Plans,https://finance.yahoo.com/news/asml-holding-enxtam-asml-7-130933205.html
2026-01-19 13:15:06+00:00,MSTR,Insider Monkey,"Strategy Inc. (MSTR) Acquires 13,627 BTC after $1.13B Balance Sheet Boost",https://finance.yahoo.com/news/strategy-inc-mstr-acquires-13-131506176.html
2026-01-19 13:15:16+00:00,GILD,Barchart,Gilead Sciences Earnings Preview: What to Expect,https://finance.yahoo.com/news/gilead-sciences-earnings-preview-expect-131516991.html
2026-01-19 13:22:00+00:00,PANW,Zacks,PANW vs. ALLT: Which Network Security Stock is the Better Buy?,https://finance.yahoo.com/news/panw-vs-allt-network-security-132200346.html
2026-01-19 13:29:42+00:00,SBUX,Insider Monkey,Jim Cramer Says Texas Roadhouse Is “Breaking Out to the Upside”,https://finance.yahoo.com/news/jim-cramer-says-texas-roadhouse-132942355.html
2026-01-19 13:29:45+00:00,AVGO,Insider Monkey,Jim Cramer on Apple: “It Worries Me That the Buyers Haven’t Figured Out to Buy It Yet”,https://finance.yahoo.com/news/jim-cramer-apple-worries-buyers-132945742.html
