timestamp,ticker,source,text,url
2026-01-13 09:24:38+00:00,MAR,Hotel Dive,"St. Regis Houston hotel sold, will convert under The Luxury Collection",https://finance.yahoo.com/news/st-regis-houston-hotel-sold-092438561.html
2026-01-13 09:41:00+00:00,SHOP,Payments Dive,Google takes agentic retail into chat,https://finance.yahoo.com/news/google-takes-agentic-retail-chat-094100521.html
2026-01-13 10:12:26+00:00,TMUS,Simply Wall St.,T-Mobile US (TMUS) Valuation Check After Recent Share Price Swings And Analyst Target Gap,https://finance.yahoo.com/news/t-mobile-us-tmus-valuation-101226008.html
2026-01-13 10:55:00+00:00,MAR,GlobeNewswire,Crestline Adds to its Executive Management Team with the Appointment of Orcun Turkay as Vice President of Food & Beverage,https://finance.yahoo.com/news/crestline-adds-executive-management-team-105500512.html
2026-01-13 11:00:00+00:00,CSCO,PR Newswire,"FRC Appoints Christopher Lynch to Board of Directors, Strengthening Data and AI Leadership",https://finance.yahoo.com/news/frc-appoints-christopher-lynch-board-110000740.html
2026-01-13 11:00:10+00:00,WDAY,Yahoo Finance Video,From Nvidia to Salesforce: Where money is made in Enterprise AI,https://finance.yahoo.com/video/nvidia-salesforce-where-money-made-110010284.html
2026-01-13 11:00:22+00:00,EXC,Simply Wall St.,Exelon (NASDAQ:EXC) Ticks All The Boxes When It Comes To Earnings Growth,https://finance.yahoo.com/news/exelon-nasdaq-exc-ticks-boxes-110022503.html
2026-01-13 11:14:10+00:00,STX,Barchart,"S&P Futures Muted as Investors Weigh JPMorgan Earnings, U.S. Inflation Data in Focus",https://finance.yahoo.com/news/p-futures-muted-investors-weigh-111410399.html
2026-01-13 11:16:00+00:00,IDXX,Zacks,RxSight (RXST) Soars 14.1%: Is Further Upside Left in the Stock?,https://finance.yahoo.com/news/rxsight-rxst-soars-14-1-111600352.html
2026-01-13 11:38:16+00:00,WDAY,Simply Wall St.,High Growth Tech Stocks To Watch In The US Market January 2026,https://finance.yahoo.com/news/high-growth-tech-stocks-watch-113816712.html
2026-01-13 11:38:20+00:00,DDOG,Simply Wall St.,3 Stocks Estimated To Be Trading At Discounts Of Up To 40.7%,https://finance.yahoo.com/news/3-stocks-estimated-trading-discounts-113820551.html
2026-01-13 12:00:00+00:00,KHC,Business Wire,HEINZ Unveils the First Fry Box with a Built-In Condiment Compartment in Eleven Countries Across the Globe,https://finance.yahoo.com/news/heinz-unveils-first-fry-box-120000335.html
2026-01-13 12:00:15+00:00,SBUX,Simply Wall St.,"With 83% ownership of the shares, Starbucks Corporation (NASDAQ:SBUX) is heavily dominated by institutional owners",https://finance.yahoo.com/news/83-ownership-shares-starbucks-corporation-120015800.html
2026-01-13 12:00:28+00:00,TXN,Simply Wall St.,What Does Texas Instruments Incorporated's (NASDAQ:TXN) Share Price Indicate?,https://finance.yahoo.com/news/does-texas-instruments-incorporateds-nasdaq-120028905.html
2026-01-13 12:05:00+00:00,MPWR,Zacks,M/A-Com (MTSI) Surges 13.0%: Is This an Indication of Further Gains?,https://finance.yahoo.com/news/m-com-mtsi-surges-13-120500271.html
2026-01-13 12:18:36+00:00,PEP,Insider Monkey,PepsiCo (PEP) is in the Crosshairs of Weight Loss Drugs,https://finance.yahoo.com/news/pepsico-pep-crosshairs-weight-loss-121836901.html
2026-01-13 12:23:06+00:00,EA,Yahoo Finance,"JPMorgan earnings miss forecasts on Apple Card costs, Dimon warns markets 'underappreciate' risks",https://finance.yahoo.com/news/jpmorgan-earnings-miss-forecasts-on-apple-card-costs-dimon-warns-markets-underappreciate-risks-122306831.html
2026-01-13 12:23:24+00:00,STX,Insider Monkey,"Jim Cramer on Taiwan Semi: “It Should Be a Monster Quarter, But I Think Everyone Knows That”",https://finance.yahoo.com/news/jim-cramer-taiwan-semi-monster-122324188.html
2026-01-13 12:35:00+00:00,CSCO,ESG Dive,VC firm Superorganism raises over $25M to back biodiversity startups,https://finance.yahoo.com/news/vc-firm-superorganism-raises-over-123500894.html
2026-01-13 12:39:42+00:00,IDXX,Insider Monkey,IDEXX Laboratories (IDXX): From a Detractor to a Revivor,https://finance.yahoo.com/news/idexx-laboratories-idxx-detractor-revivor-123942219.html
2026-01-13 12:47:13+00:00,GILD,Pharmaceutical Technology,JPM26: HIV pipeline dosing optionality gives Gilead advantage,https://finance.yahoo.com/news/jpm26-hiv-pipeline-dosing-optionality-124713655.html
2026-01-13 12:51:40+00:00,DXCM,Medical Device Network,JPM26: Dexcom’s new CEO eyes international CGM markets for 2026 growth,https://finance.yahoo.com/news/jpm26-dexcom-ceo-eyes-international-125140707.html
2026-01-13 12:55:32+00:00,TTWO,Barchart,Earnings Preview: What to Expect From Take-Two Interactive Software’s Report,https://finance.yahoo.com/news/earnings-preview-expect-two-interactive-125532875.html
2026-01-13 13:00:00+00:00,MCHP,GlobeNewswire,Microchip Launches Military-Qualified Plastic Transient Voltage Suppressors for Aerospace and Defense Applications,https://finance.yahoo.com/news/microchip-launches-military-qualified-plastic-130000090.html
2026-01-13 13:00:00+00:00,AMGN,PR Newswire,RO ANNOUNCES RESEARCH COLLABORATION TO BETTER UNDERSTAND AND IMPROVE THE REAL-WORLD PATIENT EXPERIENCE WITH GLP-1S,https://finance.yahoo.com/news/ro-announces-research-collaboration-better-130000887.html
2026-01-13 13:00:00+00:00,MAR,PR Newswire,Noble Receives Marriott International Serve360 Award,https://finance.yahoo.com/news/noble-receives-marriott-international-serve360-130000906.html
2026-01-13 13:00:24+00:00,SNPS,24/7 Wall St.,"Here Are Tuesday’s Top Wall Street Analyst Research Calls: Adobe, AMD, Disney, Five Below, Intel, Reddit, KLA Corp, PayPal, Super Micro Computer and More",https://finance.yahoo.com/news/tuesday-top-wall-street-analyst-130024366.html
2026-01-13 13:01:00+00:00,MDLZ,CNW Group,OREO Supports Youth Hockey with Second Year of 'OREO Stay Playful For All' Program Delivering Additional Grants Across Canada,https://finance.yahoo.com/news/oreo-supports-youth-hockey-second-130100446.html
2026-01-13 13:04:00+00:00,MAR,PR Newswire,"WeatherPromise Closes Oversubscribed Series A Round, Led by Maveron",https://finance.yahoo.com/news/weatherpromise-closes-oversubscribed-series-round-130400380.html
2026-01-13 13:15:00+00:00,ADP,PR Newswire,"ADP National Employment Report Preliminary Estimate December 20, 2025",https://finance.yahoo.com/news/adp-national-employment-report-preliminary-131500904.html
2026-01-13 13:20:25+00:00,EA,Insider Monkey,Jim Cramer on Take-Two: “Great Scarcity Value There”,https://finance.yahoo.com/news/jim-cramer-two-great-scarcity-132025003.html
2026-01-13 13:30:00+00:00,IDXX,Business Wire,IDEXX Announces CEO Succession,https://finance.yahoo.com/news/idexx-announces-ceo-succession-133000572.html
2026-01-13 13:30:00+00:00,KHC,GlobeNewswire,"[Latest] Global Hybrid Meat Market Size/Share Worth USD 1,212.1 Billion by 2034 at a 9.4% CAGR: Custom Market Insights (Analysis, Outlook, Leaders, Report, Trends, Forecast, Segmentation, Growth Rate, Value, SWOT Analysis)",https://finance.yahoo.com/news/latest-global-hybrid-meat-market-133000728.html
2026-01-13 13:41:00+00:00,STX,Zacks,WDC Skyrockets 87% in 3 Months: Is the Stock Still a Buy in 2026?,https://finance.yahoo.com/news/wdc-skyrockets-87-3-months-134100340.html
2026-01-13 14:00:00+00:00,CMCSA,Business Wire,"Reliable, High-Speed Internet from Xfinity Now Available in Northeast Madison County, Mississippi",https://finance.yahoo.com/news/reliable-high-speed-internet-xfinity-140000722.html
2026-01-13 14:00:00+00:00,CDNS,Business Wire,Cadence Delivers Enterprise-Level Reliability with Next-Gen Low-Power DRAM for AI Applications Featuring Microsoft RAIDDR ECC Technology,https://finance.yahoo.com/news/cadence-delivers-enterprise-level-reliability-140000429.html
2026-01-13 14:00:00+00:00,WDAY,CNW Group,Trintech Deepens Partnership with Workday by Launching Transaction Matching Insights,https://finance.yahoo.com/news/trintech-deepens-partnership-workday-launching-140000907.html
2026-01-13 14:00:00+00:00,NXPI,PR Newswire,Origin℠ AI and NXP Team Up to Accelerate Embedded WiFi Sensing for the Smart Home,https://finance.yahoo.com/news/origin-ai-nxp-team-accelerate-140000919.html
2026-01-13 14:00:00+00:00,CRWD,Business Wire,"CrowdStrike to Acquire Seraphic, Turning Any Browser into a Secure Enterprise Browser",https://finance.yahoo.com/news/crowdstrike-acquire-seraphic-turning-browser-140000532.html
2026-01-13 14:00:00+00:00,TRI,PR Newswire,Thomson Reuters Convenes Global AI Leaders to Advance Trust in the Age of Intelligent Systems,https://finance.yahoo.com/news/thomson-reuters-convenes-global-ai-140000095.html
2026-01-13 14:00:04+00:00,AMGN,Zacks,These 2 Medical Stocks Could Beat Earnings: Why They Should Be on Your Radar,https://finance.yahoo.com/news/2-medical-stocks-could-beat-140004194.html
2026-01-13 14:00:04+00:00,SBUX,Zacks,Is Trending Stock Starbucks Corporation (SBUX) a Buy Now?,https://finance.yahoo.com/news/trending-stock-starbucks-corporation-sbux-140004139.html
2026-01-13 14:00:19+00:00,CSX,Simply Wall St.,Investing in CSX (NASDAQ:CSX) five years ago would have delivered you a 22% gain,https://finance.yahoo.com/news/investing-csx-nasdaq-csx-five-140019341.html
2026-01-13 14:07:00+00:00,DASH,GlobeNewswire,"Park Place Technologies Announced as Official Technology Partner  of Pro Pickleball’s PPA and MLP, Merging Innovation and America’s  Fastest-Growing Sport",https://finance.yahoo.com/news/park-place-technologies-announced-official-140700242.html
2026-01-13 14:13:00+00:00,STX,Zacks,Seagate's 32TB HDDs Launch Expands Its Reach in AI Video Analytics,https://finance.yahoo.com/news/seagates-32tb-hdds-launch-expands-141300316.html
2026-01-13 14:20:00+00:00,CSCO,ACCESS Newswire,Behind the Pitch: Meet the Students Proposing Bold Ways To Use Cisco Technology for Good,https://finance.yahoo.com/news/behind-pitch-meet-students-proposing-142000491.html
2026-01-13 14:30:02+00:00,CRWD,Zacks,Brokers Suggest Investing in CrowdStrike (CRWD): Read This Before Placing a Bet,https://finance.yahoo.com/news/brokers-suggest-investing-crowdstrike-crwd-143002290.html
2026-01-13 14:31:16+00:00,VRTX,Barchart,Here's What to Expect From Vertex Pharmaceuticals' Next Earnings Report,https://finance.yahoo.com/news/heres-expect-vertex-pharmaceuticals-next-143116913.html
2026-01-13 14:35:00+00:00,MELI,Motley Fool,Could MercadoLibre Stock Set Patient Investors Up for Life?​,https://finance.yahoo.com/news/could-mercadolibre-stock-set-patient-143500757.html
2026-01-13 14:40:00+00:00,CSCO,Zacks,Allot Rises 21% in 6 Months: Should You Buy the Stock Right Now?,https://finance.yahoo.com/news/allot-rises-21-6-months-144000119.html
2026-01-13 14:40:08+00:00,ARM,The Fly,"AMD upgraded, Arm downgraded: Wall Street's top analyst calls",https://finance.yahoo.com/news/amd-upgraded-arm-downgraded-wall-144008117.html
2026-01-13 14:59:00+00:00,CTSH,GlobeNewswire,Auditoria Accelerates UK and European Momentum with Leadership Appointment and Infrastructure,https://finance.yahoo.com/news/auditoria-accelerates-uk-european-momentum-145900164.html
2026-01-13 15:00:00+00:00,CTSH,Business Wire,New DDN Report Reveals 65% of Organizations Are Struggling to Achieve AI Success,https://finance.yahoo.com/news/ddn-report-reveals-65-organizations-150000777.html
2026-01-13 15:00:07+00:00,FAST,Zacks,Fastenal (FAST) Earnings Expected to Grow: What to Know Ahead of Next Week's Release,https://finance.yahoo.com/news/fastenal-fast-earnings-expected-grow-150007062.html
2026-01-13 15:02:00+00:00,HON,GlobeNewswire,"Global Asset Management Market Intelligence Report 2025-2035 Featuring Strategic Profiles of ABB, Adobe, Honeywell International, IBM, WSP, Zebra Technologies and Other Key Players",https://finance.yahoo.com/news/global-asset-management-market-intelligence-150200455.html
2026-01-13 15:22:09+00:00,MELI,24/7 Wall St.,Best Growth Stocks to Buy in 2026,https://finance.yahoo.com/news/best-growth-stocks-buy-2026-152209226.html
2026-01-13 15:25:22+00:00,VRTX,Pharmaceutical Technology,JPM26: Vertex hopes to match cystic fibrosis success in pain and kidney disease,https://finance.yahoo.com/news/jpm26-vertex-hopes-match-cystic-152522248.html
2026-01-13 15:37:00+00:00,FANG,Zacks,Diamondback Energy Braces for Q4 Earnings Hit as Oil Prices Slide,https://finance.yahoo.com/news/diamondback-energy-braces-q4-earnings-153700554.html
2026-01-13 15:38:52+00:00,INTU,International Accounting Bulletin,"BDO Canada, Intuit team up to serve small and mid-sized businesses",https://finance.yahoo.com/news/bdo-canada-intuit-team-serve-153852324.html
2026-01-13 15:50:00+00:00,SHOP,Motley Fool,2 Growth Stocks That Could Double Your Money By 2032,https://finance.yahoo.com/news/2-growth-stocks-could-double-155000415.html
2026-01-13 16:16:00+00:00,STX,Zacks,SNDK Hits a 52-Week High: 3 Reasons Why the Stock is Worth Buying Now,https://finance.yahoo.com/news/sndk-hits-52-week-high-161600208.html
2026-01-13 16:29:00+00:00,ABNB,GlobeNewswire,"Key Trends in Online Travel Markets Report 2025 Featuring Skyscanner, Airbnb, Expedia, Trip.com, TripAdvisor, MakeMyTrip, Hilton, Booking, easyJet, Uber, Carnival, and Next Vacay",https://finance.yahoo.com/news/key-trends-online-travel-markets-162900438.html
2026-01-13 16:29:00+00:00,BKR,Barrons.com,Energy Stocks Break Their Slump. Which Charts Are Most Bullish?,https://www.barrons.com/articles/energy-stocks-break-their-slump-which-charts-are-most-bullish-d89e218f?siteid=yhoof2&yptr=yahoo
2026-01-13 16:30:50+00:00,ARM,Yahoo Finance,"Intel stock rises on analyst upgrade citing data center AI demand, 'significant progress' in manufacturing",https://finance.yahoo.com/news/intel-stock-rises-on-analyst-upgrade-citing-data-center-ai-demand-significant-progress-in-manufacturing-163050036.html
2026-01-13 17:00:04+00:00,ROST,Zacks,Ross Stores (ROST) is a Great Momentum Stock: Should You Buy?,https://finance.yahoo.com/news/ross-stores-rost-great-momentum-170004257.html
2026-01-13 17:00:04+00:00,ADI,Zacks,Are You Looking for a Top Momentum Pick? Why Analog Devices (ADI) is a Great Choice,https://finance.yahoo.com/news/looking-top-momentum-pick-why-170004836.html
2026-01-13 17:02:00+00:00,AZN,Business Wire,Modella AI Announces Acquisition by AstraZeneca to Advance AI-Driven Oncology R&D at Global Scale,https://finance.yahoo.com/news/modella-ai-announces-acquisition-astrazeneca-170200809.html
2026-01-13 17:06:57+00:00,IDXX,Investor's Business Daily,Dow Jones Retail Giant Amazon Stock Eyes Latest Buy Point,https://www.investors.com/stock-lists/stocks-near-a-buy-zone/dow-jones-amazon-amzn-stock-buy-point-eli-lilly/?src=A00220&yptr=yahoo
2026-01-13 17:09:43+00:00,AZN,Reuters,AstraZeneca to acquire Modella AI to speed oncology drug research,https://finance.yahoo.com/news/astrazeneca-acquire-modella-ai-speed-170943466.html
2026-01-13 17:10:04+00:00,FTNT,Zacks,Will Fortinet (FTNT) Beat Estimates Again in Its Next Earnings Report?,https://finance.yahoo.com/news/fortinet-ftnt-beat-estimates-again-171004334.html
2026-01-13 17:21:00+00:00,MRVL,Zacks,ALAB Benefits From Strong UALink Growth: Will the Momentum Continue?,https://finance.yahoo.com/news/alab-benefits-strong-ualink-growth-172100757.html
2026-01-13 17:31:02+00:00,HON,FreightWaves,OnTrac CEO Duffy leaves for UK pest control company,https://finance.yahoo.com/news/ontrac-ceo-duffy-leaves-uk-173102467.html
2026-01-13 17:38:27+00:00,DDOG,Simply Wall St.,Three Stocks That May Be Undervalued In January 2026,https://finance.yahoo.com/news/three-stocks-may-undervalued-january-173827323.html
2026-01-13 17:38:39+00:00,ZS,Simply Wall St.,High Growth US Tech Stocks To Watch In January 2026,https://finance.yahoo.com/news/high-growth-us-tech-stocks-173839143.html
2026-01-13 17:57:27+00:00,REGN,GuruFocus.com,"AbbVie Signs US Deal to Cut Drug Prices, Secure Tariff Exemptions",https://finance.yahoo.com/news/abbvie-signs-us-deal-cut-175727242.html
2026-01-13 18:01:09+00:00,GILD,GuruFocus.com,Ex-Lazard Banker Charged in Insider Trading Case Tied to Health-Care Deals,https://finance.yahoo.com/news/ex-lazard-banker-charged-insider-180109484.html
2026-01-13 18:05:00+00:00,ARM,Barrons.com,Arm Stock Is Falling. Its Biggest Customer Might Be Masking Larger Problems.,https://www.barrons.com/articles/arm-softbank-stock-price-9352cbfa?siteid=yhoof2&yptr=yahoo
2026-01-13 18:06:41+00:00,ADP,Simply Wall St.,How The Story Behind Automatic Data Processing (ADP) Is Shifting With New Analyst Targets,https://finance.yahoo.com/news/story-behind-automatic-data-processing-180641093.html
2026-01-13 18:20:00+00:00,MCHP,Zacks,MCHP Rises 29% in a Year: How Should You Approach the Stock in 2026?,https://finance.yahoo.com/news/mchp-rises-29-approach-stock-182000133.html
2026-01-13 19:36:00+00:00,AZN,Motley Fool,1 Quantum Computing Stock to Buy that Could Soar in 2026,https://finance.yahoo.com/news/1-quantum-computing-stock-buy-193600628.html
2026-01-13 19:38:19+00:00,SNPS,Investing.com,Piper Sandler cuts Synopsys and Bentley Systems on growth risks,https://finance.yahoo.com/news/piper-sandler-cuts-synopsys-bentley-193819212.html
2026-01-13 20:05:44+00:00,FTNT,Simply Wall St.,D&H Fortinet Security Partnership Expansion Might Change The Case For Investing In Fortinet (FTNT),https://finance.yahoo.com/news/d-h-fortinet-security-partnership-200544991.html
2026-01-13 20:22:35+00:00,REGN,Bloomberg,"Regeneron's Yancopoulos on Hearing Loss Gene Therapy, Weight Loss Drugs",https://finance.yahoo.com/video/regenerons-yancopoulos-hearing-loss-gene-202235189.html
2026-01-13 20:58:48+00:00,AEP,Insider Monkey,BMO Reiterates Market Perform on Bloom Energy (BE) After Grid-Scale Fuel Cell Deal,https://finance.yahoo.com/news/bmo-reiterates-market-perform-bloom-205848718.html
2026-01-13 21:05:00+00:00,MDLZ,GlobeNewswire,"Mondelēz International to Report Q4/FY 2025 Financial Results on February 03, 2026",https://finance.yahoo.com/news/mondel-z-international-report-q4-210500237.html
2026-01-13 21:05:00+00:00,STX,Business Wire,"Seagate Technology to Report Fiscal Second Quarter 2026 Financial Results on January 27, 2026",https://finance.yahoo.com/news/seagate-technology-report-fiscal-second-210500132.html
2026-01-13 21:05:00+00:00,EA,Business Wire,"EA to Release Third Quarter Fiscal Year 2026 Results on February 3, 2026",https://finance.yahoo.com/news/ea-release-third-quarter-fiscal-210500993.html
2026-01-13 21:05:00+00:00,TEAM,Business Wire,Atlassian Announces Date for Second Quarter of Fiscal Year 2026 Financial Results,https://finance.yahoo.com/news/atlassian-announces-date-second-quarter-210500145.html
2026-01-13 21:07:00+00:00,TMUS,PR Newswire,Array completes sale of select spectrum assets to AT&T for $1.018 billion,https://finance.yahoo.com/news/array-completes-sale-select-spectrum-210700702.html
2026-01-13 21:15:00+00:00,CHTR,PR Newswire,Charter Closes $3.0 Billion Senior Unsecured Notes,https://finance.yahoo.com/news/charter-closes-3-0-billion-211500072.html
2026-01-13 21:16:25+00:00,PEP,Simply Wall St.,Why Siemens (XTRA:SIE) Is Up 5.9% After Expanding Its NVIDIA AI Digital Twin Alliance,https://finance.yahoo.com/news/why-siemens-xtra-sie-5-211625247.html
2026-01-13 21:18:37+00:00,IDXX,Simply Wall St.,How IDEXX’s Diagnostics-Focused CEO Transition At IDEXX Laboratories (IDXX) Has Changed Its Investment Story,https://finance.yahoo.com/news/idexx-diagnostics-focused-ceo-transition-211837433.html
2026-01-13 21:51:37+00:00,AZN,Bloomberg,AstraZeneca CFO on M&A Strategy and Obesity Market,https://finance.yahoo.com/video/astrazeneca-cfo-m-strategy-obesity-215137528.html
2026-01-13 22:00:11+00:00,MCHP,Barchart,"Up 32% in the Past Year, Can Microchip Technologies Stock Keep Zooming Higher?",https://finance.yahoo.com/news/32-past-microchip-technologies-stock-220011651.html
2026-01-13 22:50:04+00:00,WDAY,Zacks,Workday (WDAY) Sees a More Significant Dip Than Broader Market: Some Facts to Know,https://finance.yahoo.com/news/workday-wday-sees-more-significant-225004417.html
2026-01-13 22:55:41+00:00,TEAM,StockStory,Why Atlassian (TEAM) Shares Are Plunging Today,https://finance.yahoo.com/news/why-atlassian-team-shares-plunging-225541930.html
2026-01-13 23:00:04+00:00,BKNG,Zacks,Booking Holdings (BKNG) Dips More Than Broader Market: What You Should Know,https://finance.yahoo.com/news/booking-holdings-bkng-dips-more-230004834.html
2026-01-13 23:15:06+00:00,FANG,Zacks,Diamondback Energy (FANG) Gains As Market Dips: What You Should Know,https://finance.yahoo.com/news/diamondback-energy-fang-gains-market-231506719.html
2026-01-13 23:26:00+00:00,STX,MarketBeat,Tech Wreck or Valuation Reset? Rotating to Value in 2026,https://finance.yahoo.com/news/tech-wreck-valuation-reset-rotating-232600862.html
2026-01-13 23:30:04+00:00,ALNY,Simply Wall St.,Alnylam Pharmaceuticals (ALNY) Is Down 9.0% After Ambitious 2026 Guidance And 2030 Plan Reveal,https://finance.yahoo.com/news/alnylam-pharmaceuticals-alny-down-9-233004540.html
2026-01-14 00:00:00+00:00,CHTR,SEC-EDGAR-8K,"(ITEM 1.01) . ENTRY INTO A MATERIAL DEFINITIVE AGREEMENT. Issuance of 7.000% Senior Notes due 2033 and 7.375% Senior Notes due 2036 On January 13, 2026 (the “Closing Date”), CCO Holdings, LLC (“CCO Holdings”) and CCO Holdings Capital Corp. (together with CCO Holdings, the “CCOH Issuers”), subsidiaries of Charter Communications, Inc. (the “Company”), issued (i) $ 1.75 billion aggregate principal amount of 7.000% Senior Notes due 2033 (the “2033 Notes”) and (ii) $1.25 billion aggregate principal amount

(Item 1.01) above is incorporated herein by reference.",
2026-01-14 00:00:00+00:00,ISRG,SEC-EDGAR-8K,"(Item 2.02) . Results of Operations and Financial Condition. On January 14, 2026 , Intuitive Surgical, Inc. (“Intuitive”) issued a press release announcing certain unaudited preliminary fourth quarter and full year 2025 financial results. A copy of the press release is furnished hereto as Exhibit 99.1. Additional unaudited preliminary revenue and procedure information is provided in the tables attached hereto as Exhibit 99.2, which has also been posted to the Investor Relations section of the Intuitive website",
2026-01-14 00:33:08+00:00,DXCM,Simply Wall St.,Is DexCom (DXCM) Pricing Justified After Recent Multi Year Share Price Weakness,https://finance.yahoo.com/news/dexcom-dxcm-pricing-justified-recent-003308631.html
2026-01-14 00:37:00+00:00,MAR,TheStreet,Marriott rolls out major deals for loyal members,https://finance.yahoo.com/news/marriott-rolls-major-deals-loyal-003700968.html
2026-01-14 01:12:17+00:00,BKNG,Simply Wall St.,Assessing Booking Holdings (BKNG) Valuation After Recent Share Price Consolidation,https://finance.yahoo.com/news/assessing-booking-holdings-bkng-valuation-011217282.html
2026-01-14 03:00:00+00:00,BKNG,PR Newswire,Discover Asia's Winter Magic: Agoda Recommends Snowy Escapes for 2026,https://finance.yahoo.com/news/discover-asias-winter-magic-agoda-030000054.html
2026-01-14 04:00:00+00:00,AZN,GlobeNewswire,HUTCHMED Highlights Publication of Phase III SACHI Results in The Lancet,https://finance.yahoo.com/news/hutchmed-highlights-publication-phase-iii-040000014.html
2026-01-14 04:26:54+00:00,DXCM,Simply Wall St.,How Investors May Respond To DexCom (DXCM) Strong 2025 Revenue Beat And 2026 Growth Outlook,https://finance.yahoo.com/news/investors-may-respond-dexcom-dxcm-042654044.html
2026-01-14 04:31:25+00:00,ZS,StockStory,1 Growth Stock with Explosive Upside and 2 We Avoid,https://finance.yahoo.com/news/1-growth-stock-explosive-upside-043125583.html
2026-01-14 04:31:42+00:00,CHTR,StockStory,1 Nasdaq 100 Stock to Consider Right Now and 2 Facing Headwinds,https://finance.yahoo.com/news/1-nasdaq-100-stock-consider-043142398.html
2026-01-14 06:11:28+00:00,ALNY,Simply Wall St.,A Look At Alnylam Pharmaceuticals (ALNY) Valuation After Unveiling Its Alnylam 2030 Growth Plan,https://finance.yahoo.com/news/look-alnylam-pharmaceuticals-alny-valuation-061128827.html
2026-01-14 08:30:00+00:00,AMGN,GlobeNewswire,"[Latest] Global T-Cell Engagers Market Size/Share Worth USD 18.8 Billion by 2034 at a 21.2% CAGR: Custom Market Insights (Analysis, Outlook, Leaders, Report, Trends, Forecast, Segmentation, Growth Rate, Value, SWOT Analysis)",https://finance.yahoo.com/news/latest-global-t-cell-engagers-083000218.html
2026-01-14 09:08:57+00:00,CTSH,Simply Wall St.,Is Cognizant (CTSH) Pricing Reflecting Its IT Services Strength And DCF Upside Potential,https://finance.yahoo.com/news/cognizant-ctsh-pricing-reflecting-services-090857450.html
2026-01-14 09:43:24+00:00,FTNT,Reuters,"Exclusive-Beijing tells Chinese firms to stop using US, Israeli cybersecurity software, sources say",https://finance.yahoo.com/news/exclusive-beijing-tells-chinese-firms-094036880.html
2026-01-14 10:20:56+00:00,CRWD,Verdict,CrowdStrike to acquire Seraphic Security for browser security boost,https://finance.yahoo.com/news/crowdstrike-acquire-seraphic-security-browser-102056856.html
2026-01-14 10:30:00+00:00,WDAY,PR Newswire,New Workday Research: Companies Are Leaving AI Gains on the Table,https://finance.yahoo.com/news/workday-research-companies-leaving-ai-103000680.html
2026-01-14 10:30:00+00:00,KHC,The Wall Street Journal,How Grocery Aisles Are Changing in the Age of MAHA and Ozempic,https://www.wsj.com/economy/consumers/how-grocery-aisles-are-changing-in-the-age-of-maha-and-ozempic-f1363374?siteid=yhoof2&yptr=yahoo
2026-01-14 10:30:00+00:00,ORLY,The Wall Street Journal,The Collapse of a Car-Parts Supplier Puts Spotlight on How Cash Flow Can Lie,https://www.wsj.com/finance/the-collapse-of-a-car-parts-supplier-puts-spotlight-on-how-cash-flow-can-lie-9c26452b?siteid=yhoof2&yptr=yahoo
2026-01-14 10:32:48+00:00,FTNT,Investing.com,Cybersecurity stocks fall after China software crackdown report,https://finance.yahoo.com/news/cybersecurity-stocks-fall-china-software-103248020.html
2026-01-14 11:00:00+00:00,TMUS,Business Wire,T-Mobile Expands Long-Term Partnership With Netcracker for Cloud Platform to Facilitate Digital-First Services,https://finance.yahoo.com/news/t-mobile-expands-long-term-110000729.html
