timestamp,ticker,source,text,url
2026-01-14 22:50:04+00:00,FTNT,Zacks,Fortinet (FTNT) Declines More Than Market: Some Information for Investors,https://finance.yahoo.com/news/fortinet-ftnt-declines-more-market-225004501.html
2026-01-14 22:50:05+00:00,MRVL,Zacks,Marvell Technology (MRVL) Registers a Bigger Fall Than the Market: Important Facts to Note,https://finance.yahoo.com/news/marvell-technology-mrvl-registers-bigger-225005755.html
2026-01-14 23:00:06+00:00,TXN,Zacks,Texas Instruments (TXN) Rises As Market Takes a Dip: Key Facts,https://finance.yahoo.com/news/texas-instruments-txn-rises-market-230006682.html
2026-01-14 23:00:06+00:00,AXON,Zacks,Axon Enterprise (AXON) Sees a More Significant Dip Than Broader Market: Some Facts to Know,https://finance.yahoo.com/news/axon-enterprise-axon-sees-more-230006473.html
2026-01-14 23:11:02+00:00,WBD,Motley Fool,Netflix's Bid to Acquire Warner Bros. Discovery Just Got a Boost From an Unlikely Source,https://finance.yahoo.com/news/netflixs-bid-acquire-warner-bros-231102650.html
2026-01-14 23:15:02+00:00,HON,Zacks,Honeywell International Inc. (HON) Gains As Market Dips: What You Should Know,https://finance.yahoo.com/news/honeywell-international-inc-hon-gains-231502984.html
2026-01-14 23:15:06+00:00,AZN,Zacks,Astrazeneca (AZN) Ascends While Market Falls: Some Facts to Note,https://finance.yahoo.com/news/astrazeneca-azn-ascends-while-market-231506316.html
2026-01-15 00:00:00+00:00,TEAM,SEC-EDGAR-8K,"(Item 5.02) . Departure of Directors or Certain Officers; Election of Directors; Appointment of Certain Officers; Compensatory Arrangements of Certain Officers . On January 15, 2026, the Board of Directors (the “ Board ”) of Atlassian Corporation (the “ Company ”) approved the appointment of Anil Sabharwal as a director of the Company, effective as of February 1, 2026 (the “ Start Date ”). Mr. Sabharwal is Vice President of Product at Alphabet, Inc. (“ Google ”).",
2026-01-15 00:00:00+00:00,CEG,SEC-EDGAR-8K,"(Item 1.01) . Entry into a Material Definitive Agreement Exchange Offers and Consent Solicitation As previously announced, on January 7, 2026, Constellation Energy Corporation (Nasdaq: CEG), a Pennsylvania corporation (“CEG Parent”) and Constellation Energy Generation, LLC, a Pennsylvania limited liability company (“Constellation”), completed the previously announced transactions contemplated by the Agreement and Plan of Merger, dated January 10, 2025 (the “Merger Agreement”), by and among CEG Parent, Calpine Corporation, a Delaware corporation (“Calpine”), CPN CS Holdco Corp.,

(Item 1.01) of this Current Report on Form 8-K is hereby incorporated by reference into this",
2026-01-15 00:00:00+00:00,ZS,SEC-EDGAR-8K,"(Item 5.07) Submission of Matters to a Vote of Security Holders. On January 12, 2026, Zscaler Inc., (the “Company”) held its annual meeting of stockholders (the “Annual Meeting”). Set forth below are the final voting results for each of the matters submitted to a vote of the stockholders at the Annual Meeting, as certified by the Inspector of Elections: (1) Election of Directors. The following nominees were elected to serve as the Class II directors, to hold",
2026-01-15 01:08:00+00:00,APP,Barrons.com,Review & Preview: Not So Magnificent,https://www.barrons.com/articles/stocks-today-rotation-mag-7-selloff-318554f9?siteid=yhoof2&yptr=yahoo
2026-01-15 02:31:15+00:00,WBD,Benzinga,"After Failed Hostile Takeover Bid, David Ellison's Paramount Skydance Sues Warner Bros. Over Netflix Deal",https://finance.yahoo.com/news/failed-hostile-takeover-bid-david-023115712.html
2026-01-15 03:05:00+00:00,BKNG,PR Newswire,BTS Kicks Off a 'New Era' in South Korea with World Tour - Agoda Reports 8x Increase in Searches to Goyang,https://finance.yahoo.com/news/bts-kicks-off-era-south-030500295.html
2026-01-15 03:31:16+00:00,DDOG,StockStory,Q3 Cloud Monitoring Earnings Review: First Prize Goes to Datadog (NASDAQ:DDOG),https://finance.yahoo.com/news/q3-cloud-monitoring-earnings-review-033116505.html
2026-01-15 03:35:04+00:00,PYPL,StockStory,Personal Loan Stocks Q3 Recap: Benchmarking Affirm (NASDAQ:AFRM),https://finance.yahoo.com/news/personal-loan-stocks-q3-recap-033504373.html
2026-01-15 04:02:16+00:00,META,reddit.com/r/stocks,Can someone please help understand META? - Ok so I just be missing something obvious here but I don’t get the moat with this stock? 98% of their revenue comes from advertisement on their platforms. Not good. There is revenue growth but there’s only so many ads and so many people you can show ads to. Metaverse failed and they wasted $73B. Cool. Raybans are a bright spot but haven’t moved revenue all THAT much.,
2026-01-15 04:30:00+00:00,HON,GlobeNewswire,"[Latest] Global Body Armor Plates Market Size/Share Worth USD 4.1 Billion by 2034 at a 5.1% CAGR: Custom Market Insights (Analysis, Outlook, Leaders, Report, Trends, Forecast, Segmentation, Growth Rate, Value, SWOT Analysis)",https://finance.yahoo.com/news/latest-global-body-armor-plates-043000444.html
2026-01-15 04:31:42+00:00,CSCO,StockStory,2 Growth Stocks Set to Flourishand 1 We Turn Down,https://finance.yahoo.com/news/2-growth-stocks-set-flourishand-043142936.html
2026-01-15 04:32:42+00:00,DASH,StockStory,3 Profitable Stocks to Target This Week,https://finance.yahoo.com/news/3-profitable-stocks-target-week-043242376.html
2026-01-15 05:01:00+00:00,CTSH,PR Newswire,"AI Can Unlock $4.5 Trillion in U.S. Labor Productivity Today, Reveals Cognizant's Latest ""New Work, New World 2026"" Report",https://finance.yahoo.com/news/ai-unlock-4-5-trillion-050100912.html
2026-01-15 06:14:44+00:00,META,reddit.com/r/stocks,TSMC Quarterly Revenue US $33.73 billion (up 25.5% YoY) - **TSMC Q4 2025 Quarterly Results** Revenue = US $33.73 billion (up 25.5% YoY) * *Guidance was US $32.2 to US $33.4 billion* Gross Margin = 62.3% (up 5.6% YoY) * *Guidance was 59% to 61%* Net Income = US $16.29 billion (up 40.6% YoY) * *Net Profit Margin = 48.3% (up 12.1% YoY)* Earnings Per Share = US $0.63 (up 40% YoY) Free Cash Flow,
2026-01-15 07:00:00+00:00,KDP,PR Newswire,Keurig Dr Pepper Launches Offer for JDE Peet's Shares,https://finance.yahoo.com/news/keurig-dr-pepper-launches-offer-070000632.html
2026-01-15 07:06:24+00:00,MDLZ,Simply Wall St.,Is Cocoa Inflation Forcing Mondelez (MDLZ) To Rethink Its Pricing Power And Brand Playbook?,https://finance.yahoo.com/news/cocoa-inflation-forcing-mondelez-mdlz-070624253.html
2026-01-15 07:31:51+00:00,META,reddit.com/r/stocks,Are we adding to positions in google - I have 50 share of google average at 264. I started a few months ago in the 240s. Would you still add to this position or hold? Im also dipping into Meta. Should i sell google and buy meta or hold and add to both. Thanks in advance,
2026-01-15 08:09:02+00:00,CMCSA,Simply Wall St.,Is Comcast (CMCSA) Pricing Offer A Genuine Opportunity After Multi Year Share Price Weakness,https://finance.yahoo.com/news/comcast-cmcsa-pricing-offer-genuine-080902460.html
2026-01-15 08:35:00+00:00,TEAM,Motley Fool,"2 Undervalued AI Stocks to Buy Before They Soar 105% and 130% in 2026, According to Wall Street Analysts",https://finance.yahoo.com/news/2-undervalued-ai-stocks-buy-083500208.html
2026-01-15 09:00:00+00:00,CSCO,GlobeNewswire,Asimily Advances Complete Cyber Asset and Exposure Management Platform with New Microsegmentation Capabilities,https://finance.yahoo.com/news/asimily-advances-complete-cyber-asset-090000436.html
2026-01-15 09:27:15+00:00,ABNB,Yahoo Finance UK,"Trending tickers: TSMC, Google, Airbnb, Schroders, BP",https://finance.yahoo.com/news/tsmc-google-airbnb-schroders-bp-trending-tickers-092715889.html
2026-01-15 10:00:00+00:00,WBD,PR Newswire,"Weiss Ratings Urges Investors to Sell Boeing, Warner Brothers, Cloudflare and Many Other Popular Stocks",https://finance.yahoo.com/news/weiss-ratings-urges-investors-sell-100000888.html
2026-01-15 10:07:55+00:00,INTU,Investing.com,"Intuit ""could bounce from here"" after early year slump - Jefferies",https://finance.yahoo.com/news/intuit-could-bounce-early-slump-100755088.html
2026-01-15 11:00:00+00:00,INTU,Business Wire,"Intuit TurboTax Opens NYC Flagship, Uniting AI and Human Expertise to Reinvent In-Person Tax Filing Nationwide",https://finance.yahoo.com/news/intuit-turbotax-opens-nyc-flagship-110000664.html
2026-01-15 11:00:23+00:00,MNST,Simply Wall St.,Should You Be Adding Monster Beverage (NASDAQ:MNST) To Your Watchlist Today?,https://finance.yahoo.com/news/adding-monster-beverage-nasdaq-mnst-110023588.html
2026-01-15 11:00:31+00:00,AXON,Simply Wall St.,Axon Enterprise's (NASDAQ:AXON) investors will be pleased with their strong 282% return over the last five years,https://finance.yahoo.com/news/axon-enterprises-nasdaq-axon-investors-110031291.html
2026-01-15 11:03:10+00:00,GEHC,Barchart,GE HealthCare’s Q4 2025 Earnings: What to Expect,https://finance.yahoo.com/news/ge-healthcare-q4-2025-earnings-110310572.html
2026-01-15 11:05:50+00:00,AZN,MarketBeat,"AstraZeneca Spotlights 2025 Growth, 2026 Launch Wave and $80B 2030 Goal at JPM Conference",https://finance.yahoo.com/news/astrazeneca-spotlights-2025-growth-2026-110550836.html
2026-01-15 11:06:20+00:00,CRWD,TipRanks,Palantir and CrowdStrike: Daniel Ives Reveals His Top AI Stocks for 2026,https://finance.yahoo.com/news/palantir-crowdstrike-daniel-ives-reveals-110620738.html
2026-01-15 11:09:34+00:00,ISRG,GuruFocus.com,Intuitive Surgical Sets Softer 2026 Outlook,https://finance.yahoo.com/news/intuitive-surgical-sets-softer-2026-110934192.html
2026-01-15 11:13:23+00:00,CSCO,Barchart,Cisco Systems Earnings Preview: What to Expect,https://finance.yahoo.com/news/cisco-systems-earnings-preview-expect-111323443.html
2026-01-15 11:25:00+00:00,SBUX,Restaurant Dive,Wingstop appoints first COO in over 3 years,https://finance.yahoo.com/news/wingstop-appoints-first-coo-over-112500659.html
2026-01-15 11:34:56+00:00,QCOM,GuruFocus.com,"Apple, Qualcomm Hit AI Supply Snag",https://finance.yahoo.com/news/apple-qualcomm-hit-ai-supply-113456357.html
2026-01-15 11:38:32+00:00,ZS,Simply Wall St.,High Growth Tech Stocks In The US For January 2026,https://finance.yahoo.com/news/high-growth-tech-stocks-us-113832517.html
2026-01-15 11:45:00+00:00,PEP,Motley Fool,Have $500? 2 Absurdly Cheap Stocks Long-Term Investors Should Buy Right Now,https://finance.yahoo.com/news/500-2-absurdly-cheap-stocks-114500617.html
2026-01-15 11:50:00+00:00,PYPL,Motley Fool,Here Are My Top 3 Fintech Stocks to Buy Now,https://finance.yahoo.com/news/top-3-fintech-stocks-buy-115000598.html
2026-01-15 11:52:50+00:00,QCOM,GuruFocus.com,"Chip Stocks Rally: NVIDIA, AMD, Micron Lifted by TSMC Q4 Beat",https://finance.yahoo.com/news/chip-stocks-nvidia-amd-micron-115250663.html
2026-01-15 12:00:00+00:00,IDXX,Business Wire,IDEXX Advances the Future of Veterinary Cancer Care with Comprehensive Mast Cell Tumor Testing for Dogs,https://finance.yahoo.com/news/idexx-advances-future-veterinary-cancer-120000365.html
2026-01-15 12:01:00+00:00,PEP,PR Newswire,EMERALD PACKAGING JOINS THE U.S. FLEXIBLE FILM INITIATIVE TO HELP SCALE RECYCLING OF FLEXIBLE PLASTICS,https://finance.yahoo.com/news/emerald-packaging-joins-u-flexible-120100573.html
2026-01-15 12:01:22+00:00,FAST,Simply Wall St.,Fastenal Company (NASDAQ:FAST) On An Uptrend: Could Fundamentals Be Driving The Stock?,https://finance.yahoo.com/news/fastenal-company-nasdaq-fast-uptrend-120122645.html
2026-01-15 12:15:00+00:00,IDXX,Business Wire,Lowest-Dose Radiography Meets Next-Level Imaging: IDEXX Launches ImageVue DR50 Plus,https://finance.yahoo.com/news/lowest-dose-radiography-meets-next-121500290.html
2026-01-15 12:15:56+00:00,FTNT,GuruFocus.com,Broadcom Shares Plunge After Report on China Software Curbs,https://finance.yahoo.com/news/broadcom-shares-plunge-report-china-121556714.html
2026-01-15 12:16:17+00:00,DXCM,Barchart,DexCom's Q4 2025 Earnings: What to Expect,https://finance.yahoo.com/news/dexcoms-q4-2025-earnings-expect-121617518.html
2026-01-15 12:18:58+00:00,PANW,GuruFocus.com,"China Pressure Weighs on Palo Alto, Fortinet",https://finance.yahoo.com/news/china-pressure-weighs-palo-alto-121858946.html
2026-01-15 12:27:00+00:00,ISRG,Medical Device Network,Intuitive Surgical expands platforms despite market headwind,https://finance.yahoo.com/news/intuitive-surgical-expands-platforms-despite-122700187.html
2026-01-15 12:35:00+00:00,FAST,Zacks,Fastenal to Report Q4 Earnings: Here's What Investors Should Know,https://finance.yahoo.com/news/fastenal-report-q4-earnings-heres-123500645.html
2026-01-15 12:35:00+00:00,SBUX,Motley Fool,Nike vs. Starbucks: Which Turnaround Effort Is More Likely to Succeed?,https://finance.yahoo.com/news/nike-vs-starbucks-turnaround-effort-123500620.html
2026-01-15 12:36:00+00:00,PYPL,Payments Dive,PayPal alums build fraud startup,https://finance.yahoo.com/news/paypal-alums-build-fraud-startup-123600428.html
2026-01-15 12:54:19+00:00,MPWR,Investing.com,Wells Fargo upgrades key chip names; AMD a top pick,https://finance.yahoo.com/news/wells-fargo-upgrades-key-chip-125419207.html
2026-01-15 12:59:00+00:00,MCHP,GlobeNewswire,SST and UMC Announce Immediate Availability of 28nm SuperFlash® Gen 4 Automotive Grade 1 Platform,https://finance.yahoo.com/news/sst-umc-announce-immediate-availability-125900527.html
2026-01-15 13:00:00+00:00,TMUS,Business Wire,"Wireless Network Quality Continues to Drive Competition as Customer Demands Grow, J.D. Power Finds",https://finance.yahoo.com/news/wireless-network-quality-continues-drive-130000779.html
2026-01-15 13:00:00+00:00,NXPI,GlobeNewswire,NXP Semiconductors Announces Conference Call to Review its Fourth Quarter and Full Year 2025 Financial Results,https://finance.yahoo.com/news/nxp-semiconductors-announces-conference-call-130000222.html
2026-01-15 13:00:45+00:00,APP,Investor's Business Daily,This Indicator Identified Strength In Rocket Lab Ahead Of Its Powerful Breakout,https://www.investors.com/how-to-invest/investors-corner/rocket-lab-stock-rklb-ants-indicator-investing-markets/?src=A00220&yptr=yahoo
2026-01-15 13:08:13+00:00,APP,Investor's Business Daily,"Dow Jones Futures: Nvidia Chipmaker Taiwan Semiconductor Jumps, Lifting Sector; Goldman Earnings Mixed",https://www.investors.com/market-trend/stock-market-today/dow-jones-futures-nvidia-chipmaker-taiwan-semiconductor-earnings-goldman-sachs-morgan-stanley-earnings/?src=A00220&yptr=yahoo
2026-01-15 13:09:37+00:00,DDOG,Investor's Business Daily,"Are Investors Panicking, Or Spot On, Over AI Threat To Software Makers?",https://www.investors.com/news/technology/software-stocks-retreat-anthropic-cowork-release-ai-threat/?src=A00220&yptr=yahoo
2026-01-15 13:15:12+00:00,CSGP,Insider Monkey,"CoStar Group, Inc. (CSGP) Price Target Slashed, But Analysts Still See Upside",https://finance.yahoo.com/news/costar-group-inc-csgp-price-131512289.html
2026-01-15 13:15:15+00:00,DDOG,Insider Monkey,"Why Analysts Are Closely Watching Datadog, Inc. (DDOG)",https://finance.yahoo.com/news/why-analysts-closely-watching-datadog-131515819.html
2026-01-15 13:15:22+00:00,ARM,Insider Monkey,Why BofA Just Turned Neutral on Arm Holdings plc (ARM),https://finance.yahoo.com/news/why-bofa-just-turned-neutral-131522456.html
2026-01-15 13:17:01+00:00,GEHC,24/7 Wall St.,"Here Are Thursday’s Top Wall Street Analyst Research Calls: Applied Materials, BankUnited, Broadcom, Dell Technologies, DraftKings, Lam Research, NVIDIA, and More",https://finance.yahoo.com/news/thursday-top-wall-street-analyst-131701272.html
2026-01-15 13:21:32+00:00,AZN,Insider Monkey,What Makes AstraZeneca (AZN) a Strong Growing Company?,https://finance.yahoo.com/news/makes-astrazeneca-azn-strong-growing-132132815.html
2026-01-15 13:25:00+00:00,CRWD,Motley Fool,"Got $3,000? 3 Artificial Intelligence (AI) Stocks to Buy and Hold for the Long Term",https://finance.yahoo.com/news/got-3-000-3-artificial-132500379.html
2026-01-15 13:26:53+00:00,ADP,Insider Monkey,"Automatic Data Processing, Inc. (ADP): A Bull Case Theory",https://finance.yahoo.com/news/automatic-data-processing-inc-adp-132653229.html
2026-01-15 13:30:00+00:00,MCHP,GlobeNewswire,GlobalFoundries Appoints Ganesh Moorthy to Board of Directors,https://finance.yahoo.com/news/globalfoundries-appoints-ganesh-moorthy-board-133000566.html
2026-01-15 13:31:04+00:00,AEP,Barchart,American Electric Power Earnings Preview: What to Expect,https://finance.yahoo.com/news/american-electric-power-earnings-preview-133104845.html
2026-01-15 13:44:11+00:00,ABNB,Barchart,Airbnb's Q4 2025 Earnings: What to Expect,https://finance.yahoo.com/news/airbnbs-q4-2025-earnings-expect-134411001.html
2026-01-15 13:48:00+00:00,TMUS,Zacks,Strength Seen in Array Digital (AD): Can Its 6.6% Jump Turn into More Strength?,https://finance.yahoo.com/news/strength-seen-array-digital-ad-134800769.html
2026-01-15 14:00:00+00:00,MAR,Business Wire,"Luxury Group, Marriott International Named Official Hotel Partner of the United States SailGP Team",https://finance.yahoo.com/news/luxury-group-marriott-international-named-140000030.html
2026-01-15 14:00:00+00:00,EA,Business Wire,EA SPORTS FC Team of the Year Revealed – Fans Crown Football’s Elite in the TOTYs,https://finance.yahoo.com/news/ea-sports-fc-team-revealed-140000720.html
2026-01-15 14:00:00+00:00,BKNG,PR Newswire,"KAYAK Predicts: Well-th trips, next gen destinations, and small-town escapes to define travel this year",https://finance.yahoo.com/news/kayak-predicts-well-th-trips-140000267.html
2026-01-15 14:00:00+00:00,ORLY,GlobeNewswire,Leverage Shares by Themes now offers XPEV and ORLY as part of its single stock Leveraged ETF suite.,https://finance.yahoo.com/news/leverage-shares-themes-now-offers-140000775.html
2026-01-15 14:00:00+00:00,CSCO,PR Newswire,Cisco Announces its Second Annual AI Summit Featuring the Builders of the AI Economy,https://finance.yahoo.com/news/cisco-announces-second-annual-ai-140000739.html
2026-01-15 14:00:00+00:00,PYPL,PR Newswire,"Pinch AI Raises $5M, Co-Led by Dynamo and Infinity Ventures to Give Retailers an AI Defense Against Exploding Return Fraud",https://finance.yahoo.com/news/pinch-ai-raises-5m-co-140000299.html
2026-01-15 14:00:03+00:00,BKNG,Zacks,Investors Heavily Search Booking Holdings Inc. (BKNG): Here is What You Need to Know,https://finance.yahoo.com/news/investors-heavily-search-booking-holdings-140003527.html
2026-01-15 14:00:04+00:00,MCHP,Zacks,How to Find Strong Computer and Technology Stocks Slated for Positive Earnings Surprises,https://finance.yahoo.com/news/strong-computer-technology-stocks-slated-140004345.html
2026-01-15 14:00:05+00:00,PANW,Zacks,How to Boost Your Portfolio with Top Computer and Technology Stocks Set to Beat Earnings,https://finance.yahoo.com/news/boost-portfolio-top-computer-technology-140005190.html
2026-01-15 14:01:46+00:00,ARM,Reuters,SiFive to adopt Nvidia technology for speedy links between chips,https://finance.yahoo.com/news/sifive-adopt-nvidia-technology-speedy-140146820.html
2026-01-15 14:05:00+00:00,TMUS,Business Wire,Customers Rate T-Mobile as the Network Quality Leader in the Most U.S. Regions,https://finance.yahoo.com/news/customers-rate-t-mobile-network-140500607.html
2026-01-15 14:05:00+00:00,PEP,PR Newswire,Association for Financial Professionals Welcomed 178 New Certified Corporate FP&A Professionals in 2025,https://finance.yahoo.com/news/association-financial-professionals-welcomed-178-140500590.html
2026-01-15 14:06:41+00:00,ADBE,Yahoo Finance,Why Salesforce stock is already down 10% this year,https://finance.yahoo.com/news/why-salesforce-stock-is-already-down-10-this-year-140641454.html
2026-01-15 14:13:00+00:00,MAR,PR Newswire,"THE RITZ-CARLTON, AMELIA ISLAND INTRODUCES NEW SIGNATURE EXPERIENCES",https://finance.yahoo.com/news/ritz-carlton-amelia-island-introduces-141300555.html
2026-01-15 14:15:50+00:00,KDP,MT Newswires,Sector Update: Consumer Stocks Mixed Premarket Thursday,https://finance.yahoo.com/news/sector-consumer-stocks-mixed-premarket-141550118.html
2026-01-15 14:21:19+00:00,ARM,Yahoo Finance,Chip stocks jump as Nvidia supplier TSMC dismisses bubble fears: 'AI is real',https://finance.yahoo.com/news/chip-stocks-jump-as-nvidia-supplier-tsmc-dismisses-bubble-fears-ai-is-real-142119829.html
2026-01-15 14:24:00+00:00,TXN,Motley Fool,5 Amazing Dividend-Paying Artificial Intelligence (AI) Stocks With Huge Growth Potential,https://finance.yahoo.com/news/5-amazing-dividend-paying-artificial-142400005.html
2026-01-15 14:30:00+00:00,ADBE,PR Newswire,CloudZero Announces Two Key Hires: Scott Castle As Chief Product Officer And Eric Weiss As SVP Of Engineering To Accelerate Cloud And AI Cost Optimization,https://finance.yahoo.com/news/cloudzero-announces-two-key-hires-143000405.html
2026-01-15 14:30:00+00:00,CHTR,Zacks,T vs CHTR: Which Telecom Stock Has More Upside Right Now?,https://finance.yahoo.com/news/t-vs-chtr-telecom-stock-143000970.html
2026-01-15 14:33:10+00:00,STX,Investing.com,Bernstein names winners and losers in the AI driven data explosion,https://finance.yahoo.com/news/bernstein-names-winners-losers-ai-143310844.html
2026-01-15 14:35:03+00:00,ROP,Zacks,"After Plunging 6.2% in 4 Weeks, Here's Why the Trend Might Reverse for Roper Technologies (ROP)",https://finance.yahoo.com/news/plunging-6-2-4-weeks-143503624.html
2026-01-15 14:36:00+00:00,GEHC,Zacks,3 Medical Device Companies in Focus for Monetizing Data and Analytics,https://finance.yahoo.com/news/3-medical-device-companies-focus-143600702.html
2026-01-15 14:41:00+00:00,FTNT,Zacks,"Company News for Jan 15, 2026",https://finance.yahoo.com/news/company-news-jan-15-2026-144100703.html
2026-01-15 14:48:00+00:00,SHOP,Zacks,"Shopify Trades 14% Below 52-Week High: Buy, Sell or Hold the Shares?",https://finance.yahoo.com/news/shopify-trades-14-below-52-144800118.html
2026-01-15 14:50:00+00:00,CSCO,Zacks,Cisco Stock Rises 8% in 3 Months: Will the Rally Continue in 2026?,https://finance.yahoo.com/news/cisco-stock-rises-8-3-145000882.html
2026-01-15 14:50:22+00:00,QCOM,Yahoo Finance Video,Trump places 25% tariff on AI chips with some exemptions,https://finance.yahoo.com/video/trump-places-25-tariff-ai-145022185.html
2026-01-15 14:53:00+00:00,MPWR,The Fly,"Nvidia initiated, DraftKings upgraded: Wall Street's top analyst calls",https://finance.yahoo.com/news/nvidia-initiated-draftkings-upgraded-wall-145300434.html
2026-01-15 15:00:00+00:00,MRVL,The Wall Street Journal,"Diosdado Banatao, Chip Designer, Investor and Entrepreneur, Dies at 79",https://www.wsj.com/business/entrepreneurship/diosdado-bantao-chip-designer-dead-79-f205c32b?siteid=yhoof2&yptr=yahoo
2026-01-15 15:00:03+00:00,CSX,Zacks,Analysts Estimate CSX (CSX) to Report a Decline in Earnings: What to Look Out for,https://finance.yahoo.com/news/analysts-estimate-csx-csx-report-150003870.html
2026-01-15 15:14:00+00:00,PANW,Zacks,CRWD to Acquire Seraphic: Is Browser Security the Next Growth Engine?,https://finance.yahoo.com/news/crwd-acquire-seraphic-browser-security-151400300.html
2026-01-15 15:18:00+00:00,ADBE,Yahoo Finance Video,Salesforce lags in 2026 as software stocks react to AI concerns,https://finance.yahoo.com/video/salesforce-lags-2026-software-stocks-151800666.html
2026-01-15 15:20:01+00:00,WDC,GuruFocus.com,"Soaring Memory Prices Lift Chipmakers, Pressure Apple and HP",https://finance.yahoo.com/news/soaring-memory-prices-lift-chipmakers-152001445.html
2026-01-15 15:24:00+00:00,WBD,Barrons.com,Netflix Is Ending Hollywood as We Know It. IMAX Stock Will Be Just Fine.,https://www.barrons.com/articles/netflix-hollywood-buy-imax-stock-f2850532?siteid=yhoof2&yptr=yahoo
2026-01-15 15:33:14+00:00,ADBE,24/7 Wall St.,1 Oversold Software Stock With Too Much AI Fear Priced In,https://finance.yahoo.com/news/1-oversold-software-stock-too-153314729.html
2026-01-15 15:35:37+00:00,TMUS,Bloomberg,Verizon Issues $20 Credits to Customers Affected by Outage,https://finance.yahoo.com/news/verizon-issues-20-credits-customers-153537234.html
2026-01-15 15:38:00+00:00,QCOM,Zacks,"The Zacks Analyst Blog Highlights Qualcomm Technologies, Advanced Micro Devices, Intel and NVIDIA",https://finance.yahoo.com/news/zacks-analyst-blog-highlights-qualcomm-153800690.html
2026-01-15 15:48:36+00:00,WBD,MT Newswires,"Netflix's Ad Revenue to Become Primary Revenue Driver in 2026, Wedbush Says",https://finance.yahoo.com/news/netflix-apos-ad-revenue-become-154836003.html
2026-01-15 15:53:01+00:00,LRCX,The Wall Street Journal,"Applied Materials, Lam Research and KLA Stocks Hit Record Highs",https://www.wsj.com/livecoverage/stock-market-today-dow-sp-500-nasdaq-01-15-2026/card/applied-materials-lam-research-and-kla-stocks-hit-record-highs-3RJnM1gp44w9gNia5rPy?siteid=yhoof2&yptr=yahoo
2026-01-15 15:56:27+00:00,REGN,Clinical Trials Arena,JPM26: Intellia Therapeutics hopeful on CRISPR safety despite patient death,https://finance.yahoo.com/news/jpm26-intellia-therapeutics-hopeful-crispr-155627347.html
2026-01-15 15:56:51+00:00,PDD,Investing.com,PDD stock is no longer a Top Pick at Morgan Stanley. Here’s why,https://finance.yahoo.com/news/pdd-stock-no-longer-top-155651522.html
2026-01-15 16:05:18+00:00,QCOM,MT Newswires,"Qualcomm Facing Smartphone Growth Pressure, Limited Data Center Progress, RBC Says",https://finance.yahoo.com/news/qualcomm-facing-smartphone-growth-pressure-160518841.html
2026-01-15 16:14:00+00:00,QCOM,Zacks,Can Intel's Upgradation in AI PCs Strengthen Its Business Growth?,https://finance.yahoo.com/news/intels-upgradation-ai-pcs-strengthen-161400884.html
2026-01-15 16:14:25+00:00,BKR,Yahoo Finance Video,"Oil cools on Iran de-escalations, Talen's $3.45B gas acquisitions",https://finance.yahoo.com/video/oil-cools-iran-escalations-talens-161425506.html
2026-01-15 16:16:50+00:00,GEHC,MT Newswires,"GE Healthcare Faces Earnings Downside Risks, UBS Says",https://finance.yahoo.com/news/ge-healthcare-faces-earnings-downside-161650370.html
2026-01-15 16:31:17+00:00,DDOG,Benzinga,3 Technology Stocks to Sell in 2026,https://finance.yahoo.com/news/3-technology-stocks-sell-2026-163117495.html
