timestamp,ticker,source,text,url
2026-05-14 10:37:52+00:00,CPRT,Barchart,"Stocks Rise Before the Open as Tech Rally Rolls On, U.S. Retail Sales Data and Trump-Xi Summit in Focus",https://finance.yahoo.com/markets/stocks/articles/stocks-rise-open-tech-rally-103752136.html
2026-05-14 11:00:02+00:00,PDD,Barchart,Options Outlook: Calendar Spread Screener Results for May 14,https://finance.yahoo.com/markets/options/articles/options-outlook-calendar-spread-screener-110002631.html
2026-05-14 11:01:32+00:00,AXON,Simply Wall St.,Axon Enterprise's (NASDAQ:AXON) Problems Go Beyond Poor Profit,https://finance.yahoo.com/markets/stocks/articles/axon-enterprises-nasdaq-axon-problems-110132606.html
2026-05-14 11:03:00+00:00,GILD,PR Newswire,Veeva Commercial Summit to Feature Biopharma's AI Successes and the Path to Agentic Commercial,https://finance.yahoo.com/sectors/healthcare/articles/veeva-commercial-summit-feature-biopharmas-110300209.html
2026-05-14 11:04:09+00:00,CEG,Simply Wall St.,Results: Constellation Energy Corporation Exceeded Expectations And The Consensus Has Updated Its Estimates,https://finance.yahoo.com/markets/stocks/articles/results-constellation-energy-corporation-exceeded-110409796.html
2026-05-14 11:05:48+00:00,GILD,MarketBeat,"Assembly Biosciences Touts HSV, Hepatitis D Catalysts at BofA Conference",https://finance.yahoo.com/sectors/healthcare/articles/assembly-biosciences-touts-hsv-hepatitis-110548032.html
2026-05-14 11:16:46+00:00,KHC,24/7 Wall St.,The Fed’s Worst-Case Scenario Is Quietly Unfolding,https://finance.yahoo.com/economy/articles/fed-worst-case-scenario-quietly-111646822.html
2026-05-14 11:21:34+00:00,GEHC,Healthcare Dive,Oracle adds Cleveland Clinic CEO to board of directors,https://finance.yahoo.com/sectors/healthcare/articles/oracle-adds-cleveland-clinic-ceo-112134387.html
2026-05-14 11:30:02+00:00,FTNT,Barchart,Wall Street Names 2 Cybersecurity Stocks Poised to Benefit From Post-Quantum Spending,https://finance.yahoo.com/markets/stocks/articles/wall-street-names-2-cybersecurity-113002042.html
2026-05-14 11:30:37+00:00,KHC,24/7 Wall St.,Trump Wants Rate Cuts. The Data Just Made That Nearly Impossible.,https://finance.yahoo.com/economy/policy/articles/trump-wants-rate-cuts-data-113037981.html
2026-05-14 11:38:11+00:00,APP,Simply Wall St.,High Growth Tech Stocks in US for May 2026,https://finance.yahoo.com/sectors/technology/articles/high-growth-tech-stocks-us-113811755.html
2026-05-14 12:00:00+00:00,MCHP,GlobeNewswire,New EX‑423 Evacuated Miniature Crystal Oscillator for Critical Timing in Low- and Battery-Powered Applications,https://finance.yahoo.com/sectors/technology/articles/ex-423-evacuated-miniature-crystal-120000854.html
2026-05-14 12:01:00+00:00,CMCSA,The Wall Street Journal,Versant Shares Surge Premarket as Company Beats Wall Street Expectations,https://finance.yahoo.com/markets/stocks/articles/versant-shares-surge-premarket-company-120100312.html
2026-05-14 12:12:08+00:00,FAST,Simply Wall St.,Assessing Fastenal (FAST) Valuation As Recent Share Gains Contrast With Softer Short Term Returns,https://finance.yahoo.com/markets/stocks/articles/assessing-fastenal-fast-valuation-recent-121208165.html
2026-05-14 12:15:39+00:00,BKNG,Simply Wall St.,A Look At Booking Holdings (BKNG) Valuation After Its 2026 Outlook Cut And Rising AI And Regulatory Risks,https://finance.yahoo.com/markets/stocks/articles/look-booking-holdings-bkng-valuation-121539560.html
2026-05-14 12:30:03+00:00,MCHP,Zacks,Here's How Much You'd Have If You Invested $1000 in Microchip Technology a Decade Ago,https://finance.yahoo.com/markets/stocks/articles/heres-much-youd-invested-1000-123003249.html
2026-05-14 12:31:39+00:00,APP,Simply Wall St.,Shareholders Will Be Pleased With The Quality of AppLovin's (NASDAQ:APP) Earnings,https://finance.yahoo.com/markets/stocks/articles/shareholders-pleased-quality-applovins-nasdaq-123139157.html
2026-05-14 12:52:55+00:00,KHC,StockStory,"Tyson Foods, Inter Parfums, and Estée Lauder Shares Plummet, What You Need To Know",https://finance.yahoo.com/markets/stocks/articles/tyson-foods-inter-parfums-est-125255630.html
2026-05-14 12:56:00+00:00,TXN,Zacks,Can Texas Instruments' Analog Unit Extend Its Strong Sales Growth Run?,https://finance.yahoo.com/markets/stocks/articles/texas-instruments-analog-unit-extend-125600311.html
2026-05-14 13:00:00+00:00,CEG,Business Wire,Constellation and Pine Creek RNG Announce Equity Purchase Agreement in RNG Facilities,https://finance.yahoo.com/sectors/energy/articles/constellation-pine-creek-rng-announce-130000927.html
2026-05-14 13:00:03+00:00,TXN,Zacks,Texas Instruments Incorporated (TXN) is Attracting Investor Attention: Here is What You Should Know,https://finance.yahoo.com/markets/stocks/articles/texas-instruments-incorporated-txn-attracting-130003713.html
2026-05-14 13:00:05+00:00,AXON,Zacks,"Axon Enterprise, Inc (AXON) Is a Trending Stock: Facts to Know Before Betting on It",https://finance.yahoo.com/markets/stocks/articles/axon-enterprise-inc-axon-trending-130005978.html
2026-05-14 13:00:06+00:00,ABNB,Zacks,"Airbnb, Inc. (ABNB) Is a Trending Stock: Facts to Know Before Betting on It",https://finance.yahoo.com/markets/stocks/articles/airbnb-inc-abnb-trending-stock-130006582.html
2026-05-14 13:00:55+00:00,KHC,StockStory,"MGP Ingredients, Freshpet, Energizer, and Coty Shares Are Falling, What You Need To Know",https://finance.yahoo.com/markets/stocks/articles/mgp-ingredients-freshpet-energizer-coty-130055410.html
2026-05-14 13:05:00+00:00,DDOG,PR Newswire,"Remote's Modern Payroll Platform Surpasses 300% Growth, Fueling Ambitious Next Chapter as the Leading Global Employment Infrastructure",https://finance.yahoo.com/sectors/technology/articles/remotes-modern-payroll-platform-surpasses-130500236.html
2026-05-14 13:07:48+00:00,TTWO,Investing.com,Take-Two stock jumps on GTA 6 pre-order speculation: What we know,https://finance.yahoo.com/markets/stocks/articles/two-stock-jumps-gta-6-130748857.html
2026-05-14 13:13:30+00:00,KHC,24/7 Wall St.,Grocery and Restaurant Prices Post Biggest Jump Since 2022,https://finance.yahoo.com/economy/articles/grocery-restaurant-prices-post-biggest-131330050.html
2026-05-14 13:30:05+00:00,PDD,Zacks,Is It Worth Investing in PDD Holdings Inc. Sponsored ADR (PDD) Based on Wall Street's Bullish Views?,https://finance.yahoo.com/markets/stocks/articles/worth-investing-pdd-holdings-inc-133005612.html
2026-05-14 13:45:00+00:00,FANG,Zacks,REPX After Q1 Earnings: Is This Permian Play Worth Buying?,https://finance.yahoo.com/markets/stocks/articles/repx-q1-earnings-permian-play-134500371.html
2026-05-14 13:55:03+00:00,ROP,Zacks,"Roper Technologies (ROP) May Find a Bottom Soon, Here's Why You Should Buy the Stock Now",https://finance.yahoo.com/markets/stocks/articles/roper-technologies-rop-may-bottom-135503532.html
2026-05-14 13:56:55+00:00,MPWR,StockStory,"Amtech, Skyworks Solutions, and Monolithic Power Systems Stocks Trade Up, What You Need To Know",https://finance.yahoo.com/markets/stocks/articles/amtech-skyworks-solutions-monolithic-power-135655549.html
2026-05-14 14:15:02+00:00,CEG,Barchart,Constellation Energy’s $13 Billion Cash Flow Outlook Shows AI’s Power Trade Is Just Beginning,https://finance.yahoo.com/sectors/energy/articles/constellation-energy-13-billion-cash-141502735.html
2026-05-14 14:22:09+00:00,ABNB,24/7 Wall St.,Trump Woo Xi? We’ll See. The Tired History of Big Tech’s Misadventures in China.,https://finance.yahoo.com/sectors/technology/articles/trump-woo-xi-ll-see-142209880.html
2026-05-14 14:33:48+00:00,APP,Barrons.com,Russell 1000 Is Hiding Some Big AI Winners,https://www.barrons.com/livecoverage/stock-market-news-today-051426/card/russell-1000-is-hiding-some-big-ai-winners-m7agggJx8Sir7Vd57iLs?siteid=yhoof2&yptr=yahoo
2026-05-14 14:39:33+00:00,IDXX,Insider Monkey,Do You Believe in the Long-Term Growth Potential of IDEXX Laboratories (IDXX)?,https://finance.yahoo.com/markets/stocks/articles/believe-long-term-growth-potential-143933432.html
2026-05-14 14:55:57+00:00,PYPL,Insider Monkey,Adobe (ADBE) Integrates Agentic AI With Major Tech Platforms to Automate Customer Workflows,https://finance.yahoo.com/markets/stocks/articles/adobe-adbe-integrates-agentic-ai-145557783.html
2026-05-14 15:00:00+00:00,BKNG,GlobeNewswire,"Patio season, served: OpenTable reveals Canada’s Top 100 Restaurants for Outdoor Dining in 2026",https://finance.yahoo.com/economy/articles/patio-season-served-opentable-reveals-150000388.html
2026-05-14 15:19:00+00:00,FER,PR Newswire,NextPass Expands Toll Payment Service to Highway 407 ETR in Toronto,https://finance.yahoo.com/sectors/technology/articles/nextpass-expands-toll-payment-highway-151900870.html
2026-05-14 15:40:02+00:00,MNST,Zacks,FMX or MNST: Which Is the Better Value Stock Right Now?,https://finance.yahoo.com/markets/stocks/articles/fmx-mnst-better-value-stock-154002040.html
2026-05-14 15:40:24+00:00,PEP,Insider Monkey,Jim Cramer Discusses the Reluctance to Buy More Procter & Gamble for the Charitable Trust,https://finance.yahoo.com/markets/stocks/articles/jim-cramer-discusses-reluctance-buy-154024004.html
2026-05-14 15:40:27+00:00,ISRG,Insider Monkey,Jim Cramer Discusses the Performance of Danaher and Its Peers,https://finance.yahoo.com/markets/stocks/articles/jim-cramer-discusses-performance-danaher-154027765.html
2026-05-14 15:42:00+00:00,EXC,Business Wire,Higher PJM Supply Costs Expected to Increase ComEd Customer Bills This Summer,https://finance.yahoo.com/sectors/energy/articles/higher-pjm-supply-costs-expected-154200927.html
2026-05-14 15:44:59+00:00,CEG,Exec Edge,Vinson & Elkins: Accelerating AI Infrastructure & Power Constraints Reshape the Market,https://finance.yahoo.com/sectors/technology/articles/vinson-elkins-accelerating-ai-infrastructure-154459380.html
2026-05-14 15:55:14+00:00,BKR,MT Newswires,"Oilfield Services Stocks Post Solid Q1 Results Amid Easing Middle East Concerns, Morgan Stanley Says",https://finance.yahoo.com/sectors/energy/articles/oilfield-services-stocks-post-solid-155514965.html
2026-05-14 15:55:22+00:00,FTNT,IPO-Edge.com,REPLAY: Fireside Chat with Fortinet COO John Whittle,https://finance.yahoo.com/markets/stocks/articles/replay-fireside-chat-fortinet-coo-155522145.html
2026-05-14 15:55:22+00:00,DDOG,IPO-Edge.com,REPLAY: Fireside Chat with Fortinet COO John Whittle,https://finance.yahoo.com/markets/stocks/articles/replay-fireside-chat-fortinet-coo-155522145.html
2026-05-14 16:11:00+00:00,MPWR,Zacks,Can Monolithic Power's Improved Automotive Solutions Drive Growth?,https://finance.yahoo.com/markets/stocks/articles/monolithic-powers-improved-automotive-solutions-161100486.html
2026-05-14 16:11:00+00:00,MCHP,Zacks,Can Monolithic Power's Improved Automotive Solutions Drive Growth?,https://finance.yahoo.com/markets/stocks/articles/monolithic-powers-improved-automotive-solutions-161100486.html
2026-05-14 16:12:00+00:00,CSX,Zacks,3 Railroad Stocks to Watch From the Challenging Industry,https://finance.yahoo.com/markets/stocks/articles/3-railroad-stocks-watch-challenging-161200544.html
2026-05-14 16:45:48+00:00,SNPS,Investing.com,"Trump revamps portfolio, adding Nvidia and other AI names",https://finance.yahoo.com/markets/stocks/articles/trump-revamps-portfolio-adding-nvidia-and-other-ai-names-164548378.html
2026-05-14 16:45:48+00:00,CDNS,Investing.com,"Trump revamps portfolio, adding Nvidia and other AI names",https://finance.yahoo.com/markets/stocks/articles/trump-revamps-portfolio-adding-nvidia-and-other-ai-names-164548378.html
2026-05-14 16:50:00+00:00,MCHP,Zacks,"CSCO Q3 Earnings Beat Estimates, Strong Networking Aids Top Line",https://finance.yahoo.com/markets/stocks/articles/csco-q3-earnings-beat-estimates-165000388.html
2026-05-14 16:59:00+00:00,TTWO,Barrons.com,Take-Two Stock Jumps on Buzz About GTA VI Preorders,https://www.barrons.com/articles/take-two-stock-price-grand-theft-auto-vi-preorder-86dd9aff?siteid=yhoof2&yptr=yahoo
2026-05-14 16:59:11+00:00,ISRG,Insider Monkey,Intuitive Surgical (ISRG) Is Among The Best Agentic AI Stocks To Buy Right Now,https://finance.yahoo.com/markets/stocks/articles/intuitive-surgical-isrg-among-best-165911714.html
2026-05-14 16:59:13+00:00,ADBE,Insider Monkey,Adobe (ADBE) Expands Its Agentic AI Push With New Acrobat Productivity Agent,https://finance.yahoo.com/sectors/technology/articles/adobe-adbe-expands-agentic-ai-165913484.html
2026-05-14 17:06:00+00:00,ISRG,Zacks,Can ISRG's da Vinci 5 Momentum Sustain Procedure and Utilization Gains?,https://finance.yahoo.com/sectors/healthcare/articles/isrgs-da-vinci-5-momentum-170600049.html
2026-05-14 17:36:05+00:00,APP,Simply Wall St.,3 Growth Companies With High Insider Ownership And Up To 71% Earnings Growth,https://finance.yahoo.com/markets/stocks/articles/3-growth-companies-high-insider-173605222.html
2026-05-14 17:37:53+00:00,MELI,Simply Wall St.,3 Stocks That May Be Trading At An Estimated Discount Of Up To 47.4%,https://finance.yahoo.com/markets/stocks/articles/3-stocks-may-trading-estimated-173753399.html
2026-05-14 17:50:00+00:00,MELI,Motley Fool,The Best Stocks to Buy Right Now on Sale,https://finance.yahoo.com/markets/stocks/articles/best-stocks-buy-now-sale-175000654.html
2026-05-14 17:50:00+00:00,TTWO,Motley Fool,The Best Stocks to Buy Right Now on Sale,https://finance.yahoo.com/markets/stocks/articles/best-stocks-buy-now-sale-175000654.html
2026-05-14 17:50:00+00:00,PYPL,Motley Fool,The Best Stocks to Buy Right Now on Sale,https://finance.yahoo.com/markets/stocks/articles/best-stocks-buy-now-sale-175000654.html
2026-05-14 18:00:15+00:00,CEG,MT Newswires,Sector Update: Energy Stocks Higher Thursday Afternoon,https://finance.yahoo.com/sectors/energy/articles/sector-energy-stocks-higher-thursday-180015892.html
2026-05-14 18:20:55+00:00,ODFL,StockStory,Unpacking Q1 Earnings: Old Dominion Freight Line (NASDAQ:ODFL) In The Context Of Other Ground Transportation Stocks,https://finance.yahoo.com/markets/stocks/articles/unpacking-q1-earnings-old-dominion-182055393.html
2026-05-14 18:21:30+00:00,BKNG,Simply Wall St.,Why Booking Holdings (BKNG) Is Down 7.9% After Cutting Guidance And Raising New Debt - And What's Next,https://finance.yahoo.com/markets/stocks/articles/why-booking-holdings-bkng-down-182130202.html
2026-05-14 18:36:32+00:00,CMCSA,Yahoo Personal Finance,Comcast is offering payouts in $117 million data breach settlement. See if you're eligible.,https://finance.yahoo.com/personal-finance/banking/article/comcast-is-offering-payouts-in-117-million-data-breach-settlement-see-if-youre-eligible-183632248.html
2026-05-14 18:43:00+00:00,CHTR,PR Newswire,DISCOVERY+ NOW AVAILABLE TO SPECTRUM TV CUSTOMERS AT NO EXTRA COST,https://finance.yahoo.com/sectors/technology/articles/discovery-now-available-spectrum-tv-184300075.html
2026-05-14 18:57:00+00:00,AMGN,Zacks,Are Options Traders Betting on a Big Move in Amgen Stock?,https://finance.yahoo.com/markets/options/articles/options-traders-betting-big-move-185700626.html
2026-05-14 19:00:02+00:00,FANG,Zacks,Diamondback (FANG) Q1 Earnings: How Key Metrics Compare to Wall Street Estimates,https://finance.yahoo.com/markets/stocks/articles/diamondback-fang-q1-earnings-key-190002010.html
2026-05-14 19:40:04+00:00,ABNB,Insider Monkey,Here’s Why Jim Cramer Is Happy With AirBnb (ABNB),https://finance.yahoo.com/markets/stocks/articles/why-jim-cramer-happy-airbnb-194004496.html
2026-05-14 19:48:55+00:00,PYPL,StockStory,2 Reasons PYPL is Risky and 1 Stock to Buy Instead,https://finance.yahoo.com/markets/stocks/articles/2-reasons-pypl-risky-1-194855312.html
2026-05-14 19:51:48+00:00,AEP,Insider Monkey,American Electric Power Company Inc. (AEP): Carl C. Icahn Admires This Power Firm,https://finance.yahoo.com/sectors/energy/articles/american-electric-power-company-inc-195148507.html
2026-05-14 19:52:26+00:00,WBD,MT Newswires,Sector Update: Consumer Stocks Advance Late Afternoon,https://finance.yahoo.com/markets/stocks/articles/sector-consumer-stocks-advance-afternoon-195226365.html
2026-05-14 19:55:28+00:00,CEG,MT Newswires,Sector Update: Energy Stocks Rise Late Afternoon,https://finance.yahoo.com/sectors/energy/articles/sector-energy-stocks-rise-afternoon-195528716.html
2026-05-14 19:59:33+00:00,APP,Insider Monkey,AppLovin (APP) Price Target Raised by Piper Sandler to $665,https://finance.yahoo.com/markets/stocks/articles/applovin-app-price-target-raised-195933383.html
2026-05-14 19:59:45+00:00,MELI,Insider Monkey,"Raymond James Cuts MercadoLibre (MELI) Price Target, Stays Bullish",https://finance.yahoo.com/markets/stocks/articles/raymond-james-cuts-mercadolibre-meli-195945077.html
2026-05-14 19:59:47+00:00,ALNY,Insider Monkey,Is Alnylam (ALNY) One of the Best Aggressive Growth Stocks to Buy?,https://finance.yahoo.com/markets/stocks/articles/alnylam-alny-one-best-aggressive-195947434.html
2026-05-14 20:18:00+00:00,HON,Barrons.com,2 Quantum Leaders Are Going Public. Their Paths to the Market Couldn’t Be More Different.,https://www.barrons.com/articles/quantum-computing-stock-ipos-531189ec?siteid=yhoof2&yptr=yahoo
2026-05-14 20:34:00+00:00,IDXX,Business Wire,IDEXX Laboratories to Present at Stifel Conference and Announces 2026 Investor Day,https://finance.yahoo.com/sectors/healthcare/articles/idexx-laboratories-present-stifel-conference-203400095.html
2026-05-14 20:34:59+00:00,TXN,Barrons.com,Chip Stocks Broadly Rising,https://www.barrons.com/livecoverage/stock-market-news-today-051426/card/chip-stocks-broadly-rising-YzWuAWSZLZOmOkNEZ8tF?siteid=yhoof2&yptr=yahoo
2026-05-14 20:35:00+00:00,ISRG,Motley Fool,Intuitive Surgical Has Dropped 20% This Year. Wall Street Says It's Time to Buy.,https://finance.yahoo.com/markets/stocks/articles/intuitive-surgical-dropped-20-wall-203500495.html
2026-05-14 20:40:22+00:00,LIN,Insider Monkey,Is Linde plc (LIN) A Good Stock To Buy Now?,https://finance.yahoo.com/markets/stocks/articles/linde-plc-lin-good-stock-204022521.html
2026-05-14 21:20:46+00:00,MCHP,Simply Wall St.,Microchip EMXO Launch Highlights High Reliability Growth And Valuation Tension,https://finance.yahoo.com/markets/stocks/articles/microchip-emxo-launch-highlights-high-212046402.html
2026-05-14 21:21:43+00:00,CEG,Simply Wall St.,Constellation Energy Deepens RNG Push With Pine Creek Deal After Calpine,https://finance.yahoo.com/sectors/energy/articles/constellation-energy-deepens-rng-push-212143853.html
2026-05-14 21:50:00+00:00,PYPL,Motley Fool,Is PayPal Stock Too Cheap to Ignore?,https://finance.yahoo.com/markets/stocks/articles/paypal-stock-too-cheap-ignore-215000715.html
2026-05-14 22:14:19+00:00,TXN,Simply Wall St.,How The Texas Instruments (TXN) Investment Story Is Shifting With New Street Assumptions,https://finance.yahoo.com/markets/stocks/articles/texas-instruments-txn-investment-story-221419165.html
2026-05-14 22:33:16+00:00,MNST,Insider Monkey,Morgan Stanley Raises its Price Target on Monster Beverage (MNST),https://finance.yahoo.com/markets/stocks/articles/morgan-stanley-raises-price-target-223316620.html
2026-05-14 22:33:40+00:00,PEP,Insider Monkey,Here’s Why Pepsi (PEP) is Among the 10 Best Stocks to Buy in Falling Markets According to Wall Street Analysts,https://finance.yahoo.com/markets/stocks/articles/why-pepsi-pep-among-10-223340685.html
2026-05-14 23:13:19+00:00,NXPI,Insider Monkey,Cantor Fitzgerald Raises its Price Target on NXP Semiconductors (NXPI),https://finance.yahoo.com/markets/stocks/articles/cantor-fitzgerald-raises-price-target-231319453.html
2026-05-14 23:43:36+00:00,WBD,Motley Fool,Why This Fund Made a $35 Million Bet on IHS Towers During a Major Shakeup,https://finance.yahoo.com/markets/stocks/articles/why-fund-made-35-million-234336714.html
2026-05-14 23:50:36+00:00,WBD,Motley Fool,Allied Gold Stock Has Soared 150%. One Fund Has Taken a Nearly 8% Portfolio Stake,https://finance.yahoo.com/markets/stocks/articles/allied-gold-stock-soared-150-235036934.html
2026-05-14 23:55:10+00:00,WBD,Motley Fool,BlackLine Stock Has Fallen 50%. One Fund Just Sold Its Entire $13 Million Position,https://finance.yahoo.com/markets/stocks/articles/blackline-stock-fallen-50-one-235510343.html
2026-05-15 00:00:00+00:00,INSM,SEC-EDGAR-8K,"(ITEM 5.07) – Submission of Matters to a Vote of Security Holders. The annual meeting of shareholders of Insmed Incorporated (the “Company”) was held on May 13, 2026 (the “Annual Meeting”). Set forth below are the voting results for each of the proposals submitted to a vote of the Company’s shareholders at the Annual Meeting: Proposal 1. Election of Two Class II Directors. By the following votes, shareholders elected Elizabeth McKee Anderson and Clarissa Desjardins, Ph.D., to",
2026-05-15 00:00:00+00:00,INTC,SEC-EDGAR-8K,"(Item 5.07) Submission of Matters to a Vote of Security Holders. At the annual meeting of stockholders (the ""Annual Meeting"") of Intel Corporation (the ""Company"") held on May 13, 2026, a total of 3,972,192,463 shares of the Company's common stock were present or represented by proxy, representing 79.11% of the 5,021,010,228 shares outstanding as of the close of business on March 16, 2026, the record date for the determination of stockholders entitled to vote at the Annual",
2026-05-15 00:00:00+00:00,IDXX,SEC-EDGAR-8K,"(Item 5.07) . Submission of Matters to a Vote of Security Holders. On May 12, 2026, the Corporation held its Annual Meeting. At the Annual Meeting, shareholders considered and voted on the following proposals, each of which is described in more detail in the Proxy Statement: (1) the election of Daniel M. Junius, Lawrence D. Kingsley and Sophie V. Vandebroek, PhD, each as a Class II director, for terms expiring at the 2029 annual meeting of shareholders;",
2026-05-15 00:00:00+00:00,PYPL,SEC-EDGAR-8K,"(Item 8.01) . Other Events Notes Offering On May 15, 2026, PayPal Holdings, Inc. (the “Company”) issued and sold $2.0 billion aggregate principal amount of senior notes, consisting of $650,000,000 aggregate principal amount of 4.550% notes due 2028 (the “2028 Notes”), $850,000,000 aggregate principal amount of 4.950% notes due 2031 (the “2031 Notes”) and $500,000,000 aggregate principal amount of 5.550% notes due 2036 (the “2036 Notes” and, together with the 2028 Notes and the 2031 Notes, the",
2026-05-15 00:00:00+00:00,DXCM,SEC-EDGAR-8K,"(ITEM 8.01) . OTHER EVENTS. On May 14, 2026, Dexcom announced that its Board of Directors authorized and approved a share repurchase program of up to $1.0 billion of Dexcom’s outstanding common stock, par value $0.001 per share (“Common Stock”), with a repurchase period ending no later than June 30, 2027 (the “Share Repurchase Program”). In connection with the approval of the Share Repurchase Program, the Board of Directors terminated its existing share repurchase program, of which",
2026-05-15 00:00:00+00:00,AMD,SEC-EDGAR-8K,"(Item 1.01) Entry into a Material Definitive Agreement. On May 14, 2026 (the “Closing Date”), Advanced Micro Devices, Inc. (the “Company”) entered into a Credit Agreement with the lenders named therein, JPMorgan Chase Bank, N.A., as administrative agent, and the other parties from time to time party thereto (the “Credit Agreement”). The Credit Agreement provides for a five-year, $5.0 billion unsecured revolving credit facility (the “Revolving Facility”) and replaces the Company’s existing Credit Agreement dated as of

(Item 1.01) “Entry into a Material Definitive Agreement” is incorporated into this

(Item 5.02) Departure of Directors or Certain Officers; Election of Directors; Appointment of Certain Officers; Compensatory Arrangements of Certain Officers. On May 13, 2026, the Company held its 2026 Annual Meeting of Stockholders (the “Annual Meeting”). As further described in

(Item 5.07) of this Current Report on Form 8-K, at the Annual Meeting, the Company’s stockholders approved the amendment and restatement of the Company’s 2023 Equity Incentive Plan (the “Amended and Restated Plan”). The Amended and Restated Plan was approved by the Board of Directors (the “Board”) of the Company on March 9, 2026 and became effective upon stockholder approval at the Annual Meeting. The Amended and Restated Plan (i) increased the number of shares authorized for

(Item 5.07) Submission of Matters to a Vote of Security Holders. The Company held its Annual Meeting on May 13, 2026. At the Annual Meeting, the Company’s stockholders voted on the following five proposals, each of which is described in detail in the Proxy Statement: Proposal No. 1: Election of Directors. All Directors were elected. The Company’s stockholders elected the eight director nominees listed below to serve on the Board: For Against Abstain Broker Non-Votes Nora M.",
2026-05-15 00:00:00+00:00,MNST,SEC-EDGAR-8K,"(Item 5.07) . Submission of Matters to a Vote of Security Holders. At the Annual Meeting of Stockholders of Monster Beverage Corporation (the “Company”) held on May 14, 2026, the following matters were submitted to a vote of the stockholders. For more information on the following proposals, see the Company’s definitive proxy statement on Schedule 14A filed with the Securities and Exchange Commission on March 27, 2026. Proposal No. 1. To elect ten directors of the Company

(Item 8.01) . Other Events. On May 14, 2026, the Board of Directors of the Company authorized a new repurchase program for the repurchase of up to an additional $500.0 million of the Company’s outstanding shares of common stock. As of May 14, 2026, approximately $400.0 million remained available for repurchase under the Company’s previously authorized repurchase program. The Company expects to make the share repurchases from time to time in the open market, through privately-negotiated transactions,",
