timestamp,ticker,source,text,url
2026-05-19 15:21:52+00:00,ADSK,Barchart,Rising Bond Yields Weigh on Stocks,https://finance.yahoo.com/markets/stocks/articles/rising-bond-yields-weigh-stocks-152152173.html
2026-05-19 15:21:52+00:00,TXN,Barchart,Rising Bond Yields Weigh on Stocks,https://finance.yahoo.com/markets/stocks/articles/rising-bond-yields-weigh-stocks-152152173.html
2026-05-19 15:21:52+00:00,DDOG,Barchart,Rising Bond Yields Weigh on Stocks,https://finance.yahoo.com/markets/stocks/articles/rising-bond-yields-weigh-stocks-152152173.html
2026-05-19 15:21:52+00:00,KLAC,Barchart,Rising Bond Yields Weigh on Stocks,https://finance.yahoo.com/markets/stocks/articles/rising-bond-yields-weigh-stocks-152152173.html
2026-05-19 15:21:52+00:00,WDAY,Barchart,Rising Bond Yields Weigh on Stocks,https://finance.yahoo.com/markets/stocks/articles/rising-bond-yields-weigh-stocks-152152173.html
2026-05-19 15:21:52+00:00,WDC,Barchart,Rising Bond Yields Weigh on Stocks,https://finance.yahoo.com/markets/stocks/articles/rising-bond-yields-weigh-stocks-152152173.html
2026-05-19 15:21:52+00:00,STX,Barchart,Rising Bond Yields Weigh on Stocks,https://finance.yahoo.com/markets/stocks/articles/rising-bond-yields-weigh-stocks-152152173.html
2026-05-19 15:40:01+00:00,SNPS,Zacks,PRGS or SNPS: Which Is the Better Value Stock Right Now?,https://finance.yahoo.com/markets/stocks/articles/prgs-snps-better-value-stock-154001384.html
2026-05-19 15:40:02+00:00,ROST,Zacks,DG or ROST: Which Is the Better Value Stock Right Now?,https://finance.yahoo.com/markets/stocks/articles/dg-rost-better-value-stock-154002395.html
2026-05-19 15:40:03+00:00,ROP,Zacks,ROP vs. JKHY: Which Stock Should Value Investors Buy Now?,https://finance.yahoo.com/markets/stocks/articles/rop-vs-jkhy-stock-value-154003550.html
2026-05-19 15:45:47+00:00,META,reddit.com/r/stocks,"Trump traded over $50 million in 'Magnificent 7' stocks last quarter, loading up on Apple and Google and selling Tesla - President Trump made 94 different trades of “Magnificent Seven” stocks in the first quarter of 2026, a new ethics disclosure shows, executing millions of dollars in transactions even as he was meeting with and often promoting these top tech companies. The trades were valued at between $50 million and $70 million across 64 buy",
2026-05-19 15:50:00+00:00,SHOP,Motley Fool,1 Outstanding Growth Stock That Is a No-Brainer Buy on the Dip,https://finance.yahoo.com/markets/stocks/articles/1-outstanding-growth-stock-no-155000162.html
2026-05-19 15:51:00+00:00,ADBE,Business Wire,"fal Scales the World's Largest Generative Media Platform with AWS, Serving 2.5 Million Developers",https://finance.yahoo.com/sectors/technology/articles/fal-scales-worlds-largest-generative-155100134.html
2026-05-19 15:51:38+00:00,WDC,Investor's Business Daily,Seagate Stock And Western Digital Slide Further As AI Infrastructure Rally Tested,https://www.investors.com/news/technology/seagate-stock-and-western-digital-slide-further-as-ai-infrastructure-rally-tested/?src=A00220&yptr=yahoo
2026-05-19 15:51:38+00:00,STX,Investor's Business Daily,Seagate Stock And Western Digital Slide Further As AI Infrastructure Rally Tested,https://www.investors.com/news/technology/seagate-stock-and-western-digital-slide-further-as-ai-infrastructure-rally-tested/?src=A00220&yptr=yahoo
2026-05-19 15:52:00+00:00,MPWR,Zacks,"Cirrus Logic Up 39% in 6 Months: Should Investors Buy, Hold or Fold?",https://finance.yahoo.com/markets/stocks/articles/cirrus-logic-39-6-months-155200865.html
2026-05-19 15:52:11+00:00,ISRG,Trefis,Is BSX Stock A Value Trap Or A Rebound Play?,https://finance.yahoo.com/markets/stocks/articles/bsx-stock-value-trap-rebound-155211005.html
2026-05-19 15:53:00+00:00,REGN,Zacks,Can Intellia's Pipeline Push Drive Long-Term Growth Amid Rivalry?,https://finance.yahoo.com/sectors/healthcare/articles/intellias-pipeline-push-drive-long-155300020.html
2026-05-19 15:54:14+00:00,PLTR,Barchart,Dell Teams Up with Nvidia to Scale AI Agents. DELL Stock May Already Be Overvalued.,https://finance.yahoo.com/markets/stocks/articles/dell-teams-nvidia-scale-ai-155414569.html
2026-05-19 16:04:40+00:00,ADP,MarketBeat,Automatic Data Processing CEO Says AI Marks ‘Defining Moment’ as Labor Market Stays Muted,https://finance.yahoo.com/sectors/technology/articles/automatic-data-processing-ceo-says-160440332.html
2026-05-19 16:05:00+00:00,PLTR,Motley Fool,"If You Can Only Buy 1 AI Stock for the Rest of 2026, Make It This One",https://finance.yahoo.com/sectors/technology/articles/only-buy-1-ai-stock-160500107.html
2026-05-19 16:05:02+00:00,ZS,Barchart,Zscaler Stock Rebounds Off Lows as Traders Position Ahead of May 26,https://finance.yahoo.com/markets/stocks/articles/zscaler-stock-rebounds-off-lows-160502449.html
2026-05-19 16:09:24+00:00,PLTR,Simply Wall St.,Should Ondas’ (ONDS) Profit Surge and Defense Pivot Reshape Its Previously Cautious Investment Narrative?,https://finance.yahoo.com/markets/stocks/articles/ondas-onds-profit-surge-defense-160924021.html
2026-05-19 16:10:00+00:00,ADBE,Barrons.com,The Software Rally May Still Have Legs. Buy ServiceNow and Adobe.,https://www.barrons.com/articles/servicenow-adobe-software-tech-stocks-1e3ba05b?siteid=yhoof2&yptr=yahoo
2026-05-19 16:10:00+00:00,CRWD,Barrons.com,The Software Rally May Still Have Legs. Buy ServiceNow and Adobe.,https://www.barrons.com/articles/servicenow-adobe-software-tech-stocks-1e3ba05b?siteid=yhoof2&yptr=yahoo
2026-05-19 16:10:00+00:00,DDOG,Barrons.com,The Software Rally May Still Have Legs. Buy ServiceNow and Adobe.,https://www.barrons.com/articles/servicenow-adobe-software-tech-stocks-1e3ba05b?siteid=yhoof2&yptr=yahoo
2026-05-19 16:12:12+00:00,CRWD,24/7 Wall St.,DZ Bank Just Slapped CrowdStrike With a Sell Rating. Is the $700 Bull Case Falling Apart?,https://finance.yahoo.com/markets/stocks/articles/dz-bank-just-slapped-crowdstrike-161212575.html
2026-05-19 16:14:00+00:00,CRWD,Barrons.com,"CrowdStrike Stock Isn’t Done Gaining, Analyst Says. AI Threats Offer Upside.",https://www.barrons.com/articles/crowdstrike-stock-ai-cybersecurity-3ea45d7c?siteid=yhoof2&yptr=yahoo
2026-05-19 16:18:47+00:00,CRWD,24/7 Wall St.,"Fortinet Cut to Hold at DZ Bank, Price Target Set at $125: Is Cybersecurity Losing Steam?",https://finance.yahoo.com/markets/stocks/articles/fortinet-cut-hold-dz-bank-161847177.html
2026-05-19 16:18:47+00:00,FTNT,24/7 Wall St.,"Fortinet Cut to Hold at DZ Bank, Price Target Set at $125: Is Cybersecurity Losing Steam?",https://finance.yahoo.com/markets/stocks/articles/fortinet-cut-hold-dz-bank-161847177.html
2026-05-19 16:18:47+00:00,ZS,24/7 Wall St.,"Fortinet Cut to Hold at DZ Bank, Price Target Set at $125: Is Cybersecurity Losing Steam?",https://finance.yahoo.com/markets/stocks/articles/fortinet-cut-hold-dz-bank-161847177.html
2026-05-19 16:18:47+00:00,PANW,24/7 Wall St.,"Fortinet Cut to Hold at DZ Bank, Price Target Set at $125: Is Cybersecurity Losing Steam?",https://finance.yahoo.com/markets/stocks/articles/fortinet-cut-hold-dz-bank-161847177.html
2026-05-19 16:21:56+00:00,ADBE,24/7 Wall St.,BofA Just Reinstated Zeta as a Buy With a $24 Price Target. Is AdTech Heating Up?,https://finance.yahoo.com/markets/stocks/articles/bofa-just-reinstated-zeta-buy-162156342.html
2026-05-19 16:22:00+00:00,MAR,Barrons.com,Agilysys Stock Surges as Earnings Shatter AI Disruption Fears,https://www.barrons.com/articles/agilysys-software-stock-earnings-ai-disruption-f2e5ca79?siteid=yhoof2&yptr=yahoo
2026-05-19 16:23:57+00:00,PEP,Motley Fool,Coca-Cola vs. PepsiCo: Scale vs. Stability in Revenue,https://finance.yahoo.com/markets/stocks/articles/coca-cola-vs-pepsico-scale-162357663.html
2026-05-19 16:43:32+00:00,AMAT,TheStreet,Morgan Stanley resets Applied Materials stock price forecast,https://finance.yahoo.com/markets/stocks/articles/morgan-stanley-resets-applied-materials-164332399.html
2026-05-19 16:50:00+00:00,COST,Motley Fool,"Costco's Stock Keeps Breaking the $1,000 Threshold -- Don't Expect a Stock Split",https://finance.yahoo.com/markets/stocks/articles/costcos-stock-keeps-breaking-1-165000260.html
2026-05-19 16:55:51+00:00,SBUX,TheStreet,Popular pasta chain closes 20 more restaurants,https://finance.yahoo.com/markets/stocks/articles/popular-pasta-chain-closes-20-165551374.html
2026-05-19 16:56:30+00:00,COST,Motley Fool,Walmart vs. Costco Wholesale: Comparing Revenue Scale and Consistency,https://finance.yahoo.com/markets/stocks/articles/walmart-vs-costco-wholesale-comparing-165630912.html
2026-05-19 16:57:00+00:00,CSCO,Zacks,TER vs. CSCO: Which AI Infrastructure Stock Is the Better Buy?,https://finance.yahoo.com/markets/stocks/articles/ter-vs-csco-ai-infrastructure-165700157.html
2026-05-19 17:00:55+00:00,SHOP,StockStory,"Shopify (SHOP) Stock Trades Up, Here Is Why",https://finance.yahoo.com/markets/stocks/articles/shopify-shop-stock-trades-why-170055913.html
2026-05-19 17:01:28+00:00,MSTR,TheStreet,Analyst predicts 140% upside for MicroStrategy stock,https://finance.yahoo.com/markets/stocks/articles/analyst-predicts-140-upside-microstrategy-170128516.html
2026-05-19 17:05:24+00:00,HON,24/7 Wall St.,Forget Vistra. One Quarter of Orders at GE Vernova Exceeded All of Last Year. That Is the AI Power Trade Worth Owning,https://finance.yahoo.com/sectors/technology/articles/forget-vistra-one-quarter-orders-170524858.html
2026-05-19 17:12:40+00:00,WBD,Simply Wall St.,Paramount Skydance Reorganization And Warner Bros Deal Scrutiny Create Valuation Question,https://finance.yahoo.com/markets/stocks/articles/paramount-skydance-reorganization-warner-bros-171240408.html
2026-05-19 17:13:59+00:00,SHOP,24/7 Wall St.,Shopify vs Amazon. One Just Beat Earnings by 60% at a Third of the Multiple. The Choice Is Clear,https://finance.yahoo.com/markets/stocks/articles/shopify-vs-amazon-one-just-171359812.html
2026-05-19 17:14:54+00:00,COST,24/7 Wall St.,Where Will Costco Stock Be In 2028?,https://finance.yahoo.com/markets/stocks/articles/where-costco-stock-2028-171454636.html
2026-05-19 17:14:55+00:00,QCOM,GuruFocus.com,"Intel, Qualcomm Eye AI Chip Startup in $5B+ Deal Hunt",https://finance.yahoo.com/sectors/technology/articles/intel-qualcomm-eye-ai-chip-171455492.html
2026-05-19 17:21:14+00:00,QCOM,GuruFocus.com,"Intel, Qualcomm Eye AI Chip Startup Tenstorrent",https://finance.yahoo.com/sectors/technology/articles/intel-qualcomm-eye-ai-chip-172114357.html
2026-05-19 17:30:00+00:00,HON,MarketBeat,Brady Corp Wires Up a Massive AI-Powered Breakout,https://finance.yahoo.com/markets/stocks/articles/brady-corp-wires-massive-ai-173000289.html
2026-05-19 17:33:43+00:00,MSTR,Benzinga,"Bitcoin Bears Are Dead Wrong, Analyst Says, But XRP Is Not On His Altcoin Shortlist",https://finance.yahoo.com/markets/crypto/articles/bitcoin-bears-dead-wrong-analyst-173343177.html
2026-05-19 17:35:58+00:00,APP,Simply Wall St.,3 Promising Growth Stocks With Insider Ownership Up To 22%,https://finance.yahoo.com/markets/stocks/articles/3-promising-growth-stocks-insider-173558418.html
2026-05-19 17:37:04+00:00,CSCO,Barchart,Nvidia Just Proved ‘AI Efficiency’ Is Fake as Layoffs Rise: ‘The Cost of Compute Is Far Beyond the Cost of Employees’,https://finance.yahoo.com/sectors/technology/articles/nvidia-just-proved-ai-efficiency-173704524.html
2026-05-19 17:40:55+00:00,MSTR,StockStory,Why Strategy (MSTR) Stock Is Nosediving,https://finance.yahoo.com/markets/stocks/articles/why-strategy-mstr-stock-nosediving-174055191.html
2026-05-19 17:45:00+00:00,NFLX,PR Newswire,Ferrero Group unveils new Wonka family of products alongside exclusive global partnership with Netflix,https://finance.yahoo.com/markets/stocks/articles/ferrero-group-unveils-wonka-family-174500160.html
2026-05-19 17:47:48+00:00,WBD,MT Newswires,Sector Update: Consumer Stocks Mixed Tuesday Afternoon,https://finance.yahoo.com/markets/stocks/articles/sector-consumer-stocks-mixed-tuesday-174748335.html
2026-05-19 17:50:00+00:00,MELI,Motley Fool,3 Reasons to Buy MercadoLibre Stock on the Dip,https://finance.yahoo.com/markets/stocks/articles/3-reasons-buy-mercadolibre-stock-175000749.html
2026-05-19 17:50:47+00:00,QCOM,GuruFocus.com,"AMD, Broadcom and Qualcomm Lead Chip Stock Sell-Off Ahead of Nvidia Earnings",https://finance.yahoo.com/markets/stocks/articles/amd-broadcom-qualcomm-lead-chip-175047695.html
2026-05-19 17:53:19+00:00,AVGO,GuruFocus.com,U.S Stocks fall as soaring yields crush tech rally and chip stocks lead brutal slide,https://finance.yahoo.com/markets/stocks/articles/u-stocks-fall-soaring-yields-175319765.html
2026-05-19 17:53:19+00:00,QCOM,GuruFocus.com,U.S Stocks fall as soaring yields crush tech rally and chip stocks lead brutal slide,https://finance.yahoo.com/markets/stocks/articles/u-stocks-fall-soaring-yields-175319765.html
2026-05-19 17:56:32+00:00,SNPS,24/7 Wall St.,Prediction: Synopsys Could Hit $600+ in 12 Months and Here’s Why,https://finance.yahoo.com/markets/stocks/articles/prediction-synopsys-could-hit-600-175632857.html
2026-05-19 18:00:00+00:00,CMCSA,Business Wire,Comcast to Participate in Evercore Investor Conference,https://finance.yahoo.com/markets/stocks/articles/comcast-participate-evercore-investor-conference-180000114.html
2026-05-19 18:05:00+00:00,LITE,MarketBeat,A Deep Dive Into NVIDIA’s Latest Portfolio Moves,https://finance.yahoo.com/markets/stocks/articles/deep-dive-nvidia-latest-portfolio-180500743.html
2026-05-19 18:05:00+00:00,SNPS,MarketBeat,A Deep Dive Into NVIDIA’s Latest Portfolio Moves,https://finance.yahoo.com/markets/stocks/articles/deep-dive-nvidia-latest-portfolio-180500743.html
2026-05-19 18:11:50+00:00,ZS,Simply Wall St.,Zscaler Targets Enterprise AI Security With Project AI Guardian And Google Cloud,https://finance.yahoo.com/markets/stocks/articles/zscaler-targets-enterprise-ai-security-181150745.html
2026-05-19 18:12:44+00:00,WDC,Simply Wall St.,Sandisk Rallies On AI NAND Demand And Capital Light Downside Shield,https://finance.yahoo.com/markets/stocks/articles/sandisk-rallies-ai-nand-demand-181244125.html
2026-05-19 18:15:00+00:00,WDC,Barrons.com,"Sandisk Stock Can Rise Another 52%, Says Citi. Why Investors Should Buy.",https://www.barrons.com/articles/sandisk-stock-price-buy-6709f126?siteid=yhoof2&yptr=yahoo
2026-05-19 18:15:00+00:00,STX,Barrons.com,"Sandisk Stock Can Rise Another 52%, Says Citi. Why Investors Should Buy.",https://www.barrons.com/articles/sandisk-stock-price-buy-6709f126?siteid=yhoof2&yptr=yahoo
2026-05-19 18:16:00+00:00,ROP,Business Wire,Illumia Names Laura Newell-McLaughlin Chief Operating Officer,https://finance.yahoo.com/sectors/technology/articles/illumia-names-laura-newell-mclaughlin-181600038.html
2026-05-19 18:17:00+00:00,COST,TheStreet,"Forget chicken fingers, Costco quietly adds new food court item",https://finance.yahoo.com/economy/articles/forget-chicken-fingers-costco-quietly-181700159.html
2026-05-19 18:17:14+00:00,WDC,24/7 Wall St.,Micron Is Up 6% Today: Is It Outperforming Other Memory Stocks Like SanDisk and Western Digital?,https://finance.yahoo.com/markets/stocks/articles/micron-6-today-outperforming-other-181714148.html
2026-05-19 18:29:00+00:00,REGN,Zacks,Regeneron & Parabilis Sign Oncology Collaboration Worth Up to $2.2B,https://finance.yahoo.com/sectors/healthcare/articles/regeneron-parabilis-sign-oncology-collaboration-182900406.html
2026-05-19 18:32:00+00:00,CRWD,Motley Fool,CrowdStrike's Falcon Has Its Shares Flying High at Over 100 Times Free Cash Flow,https://finance.yahoo.com/markets/stocks/articles/crowdstrikes-falcon-shares-flying-high-183200113.html
2026-05-19 18:52:55+00:00,ZS,StockStory,"Workday and Zscaler Shares Skyrocket, What You Need To Know",https://finance.yahoo.com/markets/stocks/articles/workday-zscaler-shares-skyrocket-know-185255492.html
2026-05-19 18:52:55+00:00,WDAY,StockStory,"Workday and Zscaler Shares Skyrocket, What You Need To Know",https://finance.yahoo.com/markets/stocks/articles/workday-zscaler-shares-skyrocket-know-185255492.html
2026-05-19 19:00:55+00:00,ADBE,StockStory,"Adobe and Salesforce Stocks Trade Up, What You Need To Know",https://finance.yahoo.com/markets/stocks/articles/adobe-salesforce-stocks-trade-know-190055688.html
2026-05-19 19:07:31+00:00,CEG,Simply Wall St.,Constellation Energy (CEG) Is Down 12.6% After EPS Surges And Buyback Completion – Has The Bull Case Changed?,https://finance.yahoo.com/markets/stocks/articles/constellation-energy-ceg-down-12-190731340.html
2026-05-19 19:09:00+00:00,ADSK,GlobeNewswire,Trunk Tools Enhances Jobsite AI Capabilities with new Autodesk Forma Integration,https://finance.yahoo.com/sectors/technology/articles/trunk-tools-enhances-jobsite-ai-190900037.html
2026-05-19 19:14:37+00:00,STX,Moby,Memory Stocks Tumble After Seagate CEO Raises Eyebrows,https://finance.yahoo.com/markets/stocks/articles/memory-stocks-tumble-seagate-ceo-191437146.html
2026-05-19 19:21:46+00:00,TXN,Barchart,Why This Analyst Thinks Texas Instruments Stock Is on the Path to $1 Trillion,https://finance.yahoo.com/markets/stocks/articles/why-analyst-thinks-texas-instruments-192146747.html
2026-05-19 19:24:55+00:00,AMAT,StockStory,AMAT Q1 Deep Dive: AI Demand Drives Growth in Semiconductor Equipment and Services,https://finance.yahoo.com/markets/stocks/articles/amat-q1-deep-dive-ai-192455890.html
2026-05-19 19:27:17+00:00,QCOM,24/7 Wall St.,"Arm Holdings Has Doubled in 2026. Is It Outperforming Other Chip-IP Stocks Like Synopsys, Cadence, and Qualcomm?",https://finance.yahoo.com/sectors/technology/articles/arm-holdings-doubled-2026-outperforming-192717021.html
2026-05-19 19:27:17+00:00,CDNS,24/7 Wall St.,"Arm Holdings Has Doubled in 2026. Is It Outperforming Other Chip-IP Stocks Like Synopsys, Cadence, and Qualcomm?",https://finance.yahoo.com/sectors/technology/articles/arm-holdings-doubled-2026-outperforming-192717021.html
2026-05-19 19:27:17+00:00,ARM,24/7 Wall St.,"Arm Holdings Has Doubled in 2026. Is It Outperforming Other Chip-IP Stocks Like Synopsys, Cadence, and Qualcomm?",https://finance.yahoo.com/sectors/technology/articles/arm-holdings-doubled-2026-outperforming-192717021.html
2026-05-19 19:27:17+00:00,SNPS,24/7 Wall St.,"Arm Holdings Has Doubled in 2026. Is It Outperforming Other Chip-IP Stocks Like Synopsys, Cadence, and Qualcomm?",https://finance.yahoo.com/sectors/technology/articles/arm-holdings-doubled-2026-outperforming-192717021.html
2026-05-19 19:40:00+00:00,TMUS,ACCESS Newswire,"Before, During and After: How T-Mobile Shows Up for First Responders and Communities Across America at Every Stage",https://finance.yahoo.com/sectors/technology/articles/during-t-mobile-shows-first-194000856.html
2026-05-19 19:49:51+00:00,TMUS,Barchart,SoftBank Just Dumped Circle Stock. Don’t Panic and Keep Adding CRCL Here.,https://finance.yahoo.com/markets/crypto/articles/softbank-just-dumped-circle-stock-194951522.html
2026-05-19 19:49:51+00:00,DASH,Barchart,SoftBank Just Dumped Circle Stock. Don’t Panic and Keep Adding CRCL Here.,https://finance.yahoo.com/markets/crypto/articles/softbank-just-dumped-circle-stock-194951522.html
2026-05-19 19:58:45+00:00,WDAY,Insider Monkey,"BWG Global Downgrades Workday, Inc. (WDAY)",https://finance.yahoo.com/markets/stocks/articles/bwg-global-downgrades-workday-inc-195845995.html
2026-05-19 19:59:31+00:00,COST,Barchart,Consumer Staples Are Losing Their Safe-Haven Status. Here's Why.,https://finance.yahoo.com/markets/stocks/articles/consumer-staples-losing-safe-haven-195931517.html
2026-05-19 20:00:00+00:00,WBD,MT Newswires,Sector Update: Consumer Stocks Mixed Late Afternoon,https://finance.yahoo.com/markets/stocks/articles/sector-consumer-stocks-mixed-afternoon-200000215.html
2026-05-19 20:05:00+00:00,AMGN,PR Newswire,AMGEN ANNOUNCES RETIREMENT OF CHIEF FINANCIAL OFFICER PETER GRIFFITH,https://finance.yahoo.com/sectors/healthcare/articles/amgen-announces-retirement-chief-financial-200500742.html
2026-05-19 20:10:49+00:00,CPRT,Simply Wall St.,How The Copart (CPRT) Story Is Shifting As Caution Rises On Fees And Execution,https://finance.yahoo.com/markets/stocks/articles/copart-cprt-story-shifting-caution-201049993.html
2026-05-19 20:14:46+00:00,LIN,Motley Fool,"SailingStone Capital Initiates West Fraser Timber Position, According to Recent SEC Filing",https://finance.yahoo.com/markets/stocks/articles/sailingstone-capital-initiates-west-fraser-201446661.html
2026-05-19 20:15:00+00:00,MCHP,GlobeNewswire,"Microchip Technology to Present at the JP Morgan 2026 Global Technology, Media and Communications Conference",https://finance.yahoo.com/sectors/technology/articles/microchip-technology-present-jp-morgan-201500932.html
2026-05-19 20:17:00+00:00,CRWD,Zacks,"Top Research Reports for Visa, IBM & CrowdStrike",https://finance.yahoo.com/markets/stocks/articles/top-research-reports-visa-ibm-201700509.html
2026-05-19 20:17:36+00:00,NFLX,Investor's Business Daily,Netflix Sentiment Improves After Video Streamer's Upfront Presentation,https://www.investors.com/news/technology/netflix-stock-sentiment-improves-after-upfront-presentation/?src=A00220&yptr=yahoo
2026-05-19 20:24:41+00:00,AVGO,Insider Monkey,How Broadcom (AVGO) Is Bringing VMware Into Production AI Infrastructure,https://finance.yahoo.com/markets/stocks/articles/broadcom-avgo-bringing-vmware-production-202441278.html
2026-05-19 20:25:23+00:00,AEP,Insider Monkey,How Vertiv (VRT) Is Expanding Its Role in AI Data Center Power and Cooling,https://finance.yahoo.com/markets/stocks/articles/vertiv-vrt-expanding-role-ai-202523078.html
2026-05-19 20:28:55+00:00,CRWD,StockStory,3 Software Stocks Worth Investigating,https://finance.yahoo.com/markets/stocks/articles/3-software-stocks-worth-investigating-202855733.html
2026-05-19 20:31:00+00:00,NFLX,Barrons.com,The Netflix Empire Is Expanding as It Makes ‘Major Moves’ Into Candy and Toys,https://www.barrons.com/articles/netflix-stock-price-candy-toys-c2f17a67?siteid=yhoof2&yptr=yahoo
2026-05-19 20:35:25+00:00,COST,reddit.com/r/stocks,"Gold has dipped and it’s time to buy - I’ve been reflecting on the gold market quite a bit lately, and the patterns that are emerging suggest we’re in for a substantial rise over the next 6-18 months. Real interest rates have been climbing, which explains some of the recent pressure on gold prices since it pays no yield. With inflation holding around 3.8 percent and nominal yields elevated, the opportunity cost argument has weighed",
2026-05-19 20:35:58+00:00,DASH,Barchart,Stocks Settle Lower on Rising Bond Yields,https://finance.yahoo.com/markets/stocks/articles/stocks-settle-lower-rising-bond-203558584.html
2026-05-19 20:35:58+00:00,LRCX,Barchart,Stocks Settle Lower on Rising Bond Yields,https://finance.yahoo.com/markets/stocks/articles/stocks-settle-lower-rising-bond-203558584.html
2026-05-19 20:35:58+00:00,AVGO,Barchart,Stocks Settle Lower on Rising Bond Yields,https://finance.yahoo.com/markets/stocks/articles/stocks-settle-lower-rising-bond-203558584.html
2026-05-19 20:35:58+00:00,MCHP,Barchart,Stocks Settle Lower on Rising Bond Yields,https://finance.yahoo.com/markets/stocks/articles/stocks-settle-lower-rising-bond-203558584.html
2026-05-19 20:35:58+00:00,MRVL,Barchart,Stocks Settle Lower on Rising Bond Yields,https://finance.yahoo.com/markets/stocks/articles/stocks-settle-lower-rising-bond-203558584.html
2026-05-19 20:35:58+00:00,ASML,Barchart,Stocks Settle Lower on Rising Bond Yields,https://finance.yahoo.com/markets/stocks/articles/stocks-settle-lower-rising-bond-203558584.html
2026-05-19 20:35:58+00:00,ARM,Barchart,Stocks Settle Lower on Rising Bond Yields,https://finance.yahoo.com/markets/stocks/articles/stocks-settle-lower-rising-bond-203558584.html
2026-05-19 20:35:58+00:00,AMAT,Barchart,Stocks Settle Lower on Rising Bond Yields,https://finance.yahoo.com/markets/stocks/articles/stocks-settle-lower-rising-bond-203558584.html
2026-05-19 20:35:58+00:00,STX,Barchart,Stocks Settle Lower on Rising Bond Yields,https://finance.yahoo.com/markets/stocks/articles/stocks-settle-lower-rising-bond-203558584.html
2026-05-19 20:35:58+00:00,QCOM,Barchart,Stocks Settle Lower on Rising Bond Yields,https://finance.yahoo.com/markets/stocks/articles/stocks-settle-lower-rising-bond-203558584.html
2026-05-19 20:49:28+00:00,MNST,Investor's Business Daily,"Monster Beverage, Stock Of The Day, Tests Buy Point As Growth Accelerates",https://www.investors.com/research/ibd-stock-of-the-day/monster-beverage-stock-buy-point-faster-growth-summer-energy-drinks/?src=A00220&yptr=yahoo
2026-05-19 20:50:35+00:00,LITE,Investor's Business Daily,"Stock Market Today: Dow, Nasdaq End In The Red As Yields Jump; Alphabet Drops On I/O Day (Live Coverage)",https://www.investors.com/market-trend/stock-market-today/dow-jones-sp500-nasdaq-micron-sandisk-home-depot-google-io/?src=A00220&yptr=yahoo
2026-05-19 20:50:49+00:00,CSCO,TheStreet,HSBC nearly doubles Cisco stock price target for 2026,https://finance.yahoo.com/markets/stocks/articles/hsbc-nearly-doubles-cisco-stock-205049076.html
2026-05-19 20:52:55+00:00,EA,StockStory,2 S&P 500 Stocks with Promising Prospects and 1 We Ignore,https://finance.yahoo.com/markets/stocks/articles/2-p-500-stocks-promising-205255852.html
2026-05-19 20:52:55+00:00,DDOG,StockStory,2 S&P 500 Stocks with Promising Prospects and 1 We Ignore,https://finance.yahoo.com/markets/stocks/articles/2-p-500-stocks-promising-205255852.html
2026-05-19 20:56:01+00:00,PLTR,Barchart,IBM Stock Leads Mega-Cap Stock Decliners as Market Volatility Triggers Steep Selloff. That Doesn’t Tell You the Whole Story.,https://finance.yahoo.com/markets/stocks/articles/ibm-stock-leads-mega-cap-205601120.html
2026-05-19 20:58:00+00:00,SNDK,Barrons.com,"These Stocks Are Today’s Movers: CoreWeave, Nvidia, Home Depot, Akamai, Agilysys, Micron, and More",https://www.barrons.com/articles/stock-movers-12487fe9?siteid=yhoof2&yptr=yahoo
2026-05-19 21:07:00+00:00,SNDK,Barrons.com,ServiceNow and Other Software Stocks Are Leading the Sector Out of the Abyss,https://www.barrons.com/articles/servicenow-stock-software-ai-eeadddf6?siteid=yhoof2&yptr=yahoo
