timestamp,ticker,source,text,url
2026-05-20 14:14:30+00:00,ADBE,Barchart,Stocks Climb on Lower Bond Yields and Chipmaker Strength,https://finance.yahoo.com/markets/stocks/articles/stocks-climb-lower-bond-yields-141430888.html
2026-05-20 14:14:30+00:00,DDOG,Barchart,Stocks Climb on Lower Bond Yields and Chipmaker Strength,https://finance.yahoo.com/markets/stocks/articles/stocks-climb-lower-bond-yields-141430888.html
2026-05-20 14:14:30+00:00,WDAY,Barchart,Stocks Climb on Lower Bond Yields and Chipmaker Strength,https://finance.yahoo.com/markets/stocks/articles/stocks-climb-lower-bond-yields-141430888.html
2026-05-20 14:14:30+00:00,AMAT,Barchart,Stocks Climb on Lower Bond Yields and Chipmaker Strength,https://finance.yahoo.com/markets/stocks/articles/stocks-climb-lower-bond-yields-141430888.html
2026-05-20 14:14:30+00:00,ADSK,Barchart,Stocks Climb on Lower Bond Yields and Chipmaker Strength,https://finance.yahoo.com/markets/stocks/articles/stocks-climb-lower-bond-yields-141430888.html
2026-05-20 14:14:30+00:00,KLAC,Barchart,Stocks Climb on Lower Bond Yields and Chipmaker Strength,https://finance.yahoo.com/markets/stocks/articles/stocks-climb-lower-bond-yields-141430888.html
2026-05-20 14:15:00+00:00,AMAT,Zacks,Best Momentum Stocks to Buy for May 20th,https://finance.yahoo.com/markets/stocks/articles/best-momentum-stocks-buy-may-141500857.html
2026-05-20 14:15:00+00:00,LITE,Zacks,Best Momentum Stocks to Buy for May 20th,https://finance.yahoo.com/markets/stocks/articles/best-momentum-stocks-buy-may-141500857.html
2026-05-20 14:15:08+00:00,ARM,Simply Wall St.,Arm (ARM) Faces FTC Probe and ESOP Expansion Is Its Licensing Edge at Risk?,https://finance.yahoo.com/markets/stocks/articles/arm-arm-faces-ftc-probe-141508245.html
2026-05-20 14:16:00+00:00,QCOM,GuruFocus.com,Microsoft Unveils New Surface Devices for Business Users,https://finance.yahoo.com/sectors/technology/articles/microsoft-unveils-surface-devices-business-141600388.html
2026-05-20 14:16:43+00:00,AAPL,Yahoo Finance Video,What analysts want to see from Nvidia earnings,https://finance.yahoo.com/video/what-analysts-want-to-see-from-nvidia-earnings-141643596.html
2026-05-20 14:16:43+00:00,NVDA,Yahoo Finance Video,What analysts want to see from Nvidia earnings,https://finance.yahoo.com/video/what-analysts-want-to-see-from-nvidia-earnings-141643596.html
2026-05-20 14:20:00+00:00,NFLX,Motley Fool,Why Netflix and the NFL Could Be a Perfect Match,https://finance.yahoo.com/markets/stocks/articles/why-netflix-nfl-could-perfect-142000981.html
2026-05-20 14:21:00+00:00,TXN,Barrons.com,Analog Devices Reports Stellar Earnings. It Also Made This $1.5 Billion Power-Chip Purchase.,https://www.barrons.com/articles/analog-devices-earnings-stock-price-23431df5?siteid=yhoof2&yptr=yahoo
2026-05-20 14:21:00+00:00,ADI,Barrons.com,Analog Devices Reports Stellar Earnings. It Also Made This $1.5 Billion Power-Chip Purchase.,https://www.barrons.com/articles/analog-devices-earnings-stock-price-23431df5?siteid=yhoof2&yptr=yahoo
2026-05-20 14:21:00+00:00,MCHP,Barrons.com,Analog Devices Reports Stellar Earnings. It Also Made This $1.5 Billion Power-Chip Purchase.,https://www.barrons.com/articles/analog-devices-earnings-stock-price-23431df5?siteid=yhoof2&yptr=yahoo
2026-05-20 14:22:01+00:00,MAR,Motley Fool,Is Marriott Stock a Buy After GMT Capital Initiated a Position Worth Over $66 Million?,https://finance.yahoo.com/markets/stocks/articles/marriott-stock-buy-gmt-capital-142201934.html
2026-05-20 14:29:54+00:00,COST,GuruFocus.com,"Costco Stock Tops $1,000 as Split Speculation Builds",https://finance.yahoo.com/markets/stocks/articles/costco-stock-tops-1-000-142954943.html
2026-05-20 14:31:00+00:00,PLTR,Zacks,PLTR's Customer Growth Momentum Strengthens Enterprise AI Expansion,https://finance.yahoo.com/markets/stocks/articles/pltrs-customer-growth-momentum-strengthens-143100078.html
2026-05-20 14:31:49+00:00,PLTR,GuruFocus.com,Palantir Faces AI Lab Threat Beyond Valuation,https://finance.yahoo.com/sectors/technology/articles/palantir-faces-ai-lab-threat-143149181.html
2026-05-20 14:37:04+00:00,WMT,Yahoo Finance,Walmart's Q1 earnings expected to deliver yet again as Americans seek out value,https://finance.yahoo.com/markets/stocks/article/walmarts-q1-earnings-expected-to-deliver-yet-again-as-americans-seek-out-value-143704270.html
2026-05-20 14:39:24+00:00,COST,Yahoo Finance Video,Target’s strategy wins across the K-shape economy,https://finance.yahoo.com/video/targets-strategy-wins-across-the-k-shape-economy-143924275.html
2026-05-20 14:39:24+00:00,WMT,Yahoo Finance Video,Target’s strategy wins across the K-shape economy,https://finance.yahoo.com/video/targets-strategy-wins-across-the-k-shape-economy-143924275.html
2026-05-20 14:45:14+00:00,CRWD,MT Newswires,"CrowdStrike Faces Strong Demand Across Falcon Platform, Morgan Stanley Says",https://finance.yahoo.com/sectors/technology/articles/crowdstrike-faces-strong-demand-across-144514413.html
2026-05-20 14:49:39+00:00,MRVL,Motley Fool,Why Marvell Technology Stock Is Moving On Up,https://finance.yahoo.com/markets/stocks/articles/why-marvell-technology-stock-moving-144939541.html
2026-05-20 14:51:13+00:00,TSLA,Yahoo Finance Video,"A deep dive into SpaceX ahead of its Starship launch, S-1 filing",https://finance.yahoo.com/video/a-deep-dive-into-spacex-ahead-of-its-starship-launch-s-1-filing-145113904.html
2026-05-20 14:52:03+00:00,MRVL,24/7 Wall St.,Marvell Price Target Vaults to $195 at Wells Fargo on AWS Trainium and Custom Silicon Momentum,https://finance.yahoo.com/markets/stocks/articles/marvell-price-target-vaults-195-145203692.html
2026-05-20 14:52:03+00:00,AVGO,24/7 Wall St.,Marvell Price Target Vaults to $195 at Wells Fargo on AWS Trainium and Custom Silicon Momentum,https://finance.yahoo.com/markets/stocks/articles/marvell-price-target-vaults-195-145203692.html
2026-05-20 14:58:23+00:00,STX,24/7 Wall St.,"Billionaire Stanley Druckenmiller Dumped Every Share of Alphabet. He Bought AI Memory Stocks Up 581% to 3,467% Instead",https://finance.yahoo.com/markets/stocks/articles/billionaire-stanley-druckenmiller-dumped-every-145823004.html
2026-05-20 14:58:23+00:00,SNDK,24/7 Wall St.,"Billionaire Stanley Druckenmiller Dumped Every Share of Alphabet. He Bought AI Memory Stocks Up 581% to 3,467% Instead",https://finance.yahoo.com/markets/stocks/articles/billionaire-stanley-druckenmiller-dumped-every-145823004.html
2026-05-20 14:59:03+00:00,CRWD,24/7 Wall St.,Stifel Just Crowned CrowdStrike With a $660 Price Target. The Bull Case Just Got Louder,https://finance.yahoo.com/markets/stocks/articles/stifel-just-crowned-crowdstrike-660-145903522.html
2026-05-20 14:59:03+00:00,PANW,24/7 Wall St.,Stifel Just Crowned CrowdStrike With a $660 Price Target. The Bull Case Just Got Louder,https://finance.yahoo.com/markets/stocks/articles/stifel-just-crowned-crowdstrike-660-145903522.html
2026-05-20 15:00:00+00:00,CRWD,Business Wire,CrowdStrike Celebrates Partner Award Winners at 2026 Europe Partner Symposium,https://finance.yahoo.com/markets/stocks/articles/crowdstrike-celebrates-partner-award-winners-150000512.html
2026-05-20 15:00:27+00:00,PLTR,GuruFocus.com,Palantir 5-Year Forecast: Can the AI Giant Justify Its Sky-High Valuation?,https://finance.yahoo.com/markets/stocks/articles/palantir-5-forecast-ai-giant-150027512.html
2026-05-20 15:00:55+00:00,CRWD,StockStory,Why CrowdStrike (CRWD) Stock Is Trading Up Today,https://finance.yahoo.com/markets/stocks/articles/why-crowdstrike-crwd-stock-trading-150055759.html
2026-05-20 15:04:31+00:00,COST,MT Newswires,"BJ's Wholesale Club Needs Sales Consistency, Improvement for Bullish Outlook, BofA Says",https://finance.yahoo.com/markets/stocks/articles/bj-apos-wholesale-club-needs-150431611.html
2026-05-20 15:08:00+00:00,PANW,MT Newswires,"Palo Alto Networks Set to Report 'Solid' Fiscal Q3 as Firewall Refresh Cycle Continues, Morgan Stanley Says",https://finance.yahoo.com/markets/stocks/articles/palo-alto-networks-set-report-150800384.html
2026-05-20 15:08:01+00:00,MELI,Motley Fool,Hedge Fund Bienville Capital Exited Its Position in Monday.com Stock. Here's What That Means for Investors.,https://finance.yahoo.com/markets/stocks/articles/hedge-fund-bienville-capital-exited-150801593.html
2026-05-20 15:10:00+00:00,ADSK,Zacks,Autodesk Enhances AI Capabilities: Can It Unlock More Revenues?,https://finance.yahoo.com/sectors/technology/articles/autodesk-enhances-ai-capabilities-unlock-151000027.html
2026-05-20 15:12:58+00:00,ADI,MarketBeat,Analog Devices Q2 Earnings Call Highlights,https://finance.yahoo.com/markets/stocks/articles/analog-devices-q2-earnings-call-151258237.html
2026-05-20 15:17:22+00:00,ADSK,Barchart,Stocks Rally as Crude Oil and Bond Yields Slump,https://finance.yahoo.com/markets/stocks/articles/stocks-rally-crude-oil-bond-151722712.html
2026-05-20 15:17:22+00:00,ADI,Barchart,Stocks Rally as Crude Oil and Bond Yields Slump,https://finance.yahoo.com/markets/stocks/articles/stocks-rally-crude-oil-bond-151722712.html
2026-05-20 15:17:22+00:00,QCOM,Barchart,Stocks Rally as Crude Oil and Bond Yields Slump,https://finance.yahoo.com/markets/stocks/articles/stocks-rally-crude-oil-bond-151722712.html
2026-05-20 15:17:22+00:00,NXPI,Barchart,Stocks Rally as Crude Oil and Bond Yields Slump,https://finance.yahoo.com/markets/stocks/articles/stocks-rally-crude-oil-bond-151722712.html
2026-05-20 15:17:22+00:00,ARM,Barchart,Stocks Rally as Crude Oil and Bond Yields Slump,https://finance.yahoo.com/markets/stocks/articles/stocks-rally-crude-oil-bond-151722712.html
2026-05-20 15:17:22+00:00,LRCX,Barchart,Stocks Rally as Crude Oil and Bond Yields Slump,https://finance.yahoo.com/markets/stocks/articles/stocks-rally-crude-oil-bond-151722712.html
2026-05-20 15:17:22+00:00,WDAY,Barchart,Stocks Rally as Crude Oil and Bond Yields Slump,https://finance.yahoo.com/markets/stocks/articles/stocks-rally-crude-oil-bond-151722712.html
2026-05-20 15:17:22+00:00,ASML,Barchart,Stocks Rally as Crude Oil and Bond Yields Slump,https://finance.yahoo.com/markets/stocks/articles/stocks-rally-crude-oil-bond-151722712.html
2026-05-20 15:17:22+00:00,ADBE,Barchart,Stocks Rally as Crude Oil and Bond Yields Slump,https://finance.yahoo.com/markets/stocks/articles/stocks-rally-crude-oil-bond-151722712.html
2026-05-20 15:17:22+00:00,MRVL,Barchart,Stocks Rally as Crude Oil and Bond Yields Slump,https://finance.yahoo.com/markets/stocks/articles/stocks-rally-crude-oil-bond-151722712.html
2026-05-20 15:17:22+00:00,AMAT,Barchart,Stocks Rally as Crude Oil and Bond Yields Slump,https://finance.yahoo.com/markets/stocks/articles/stocks-rally-crude-oil-bond-151722712.html
2026-05-20 15:17:22+00:00,KLAC,Barchart,Stocks Rally as Crude Oil and Bond Yields Slump,https://finance.yahoo.com/markets/stocks/articles/stocks-rally-crude-oil-bond-151722712.html
2026-05-20 15:17:35+00:00,QCOM,Simply Wall St.,Qualcomm Tenstorrent Interest Puts AI Data Center Ambitions In Focus,https://finance.yahoo.com/markets/stocks/articles/qualcomm-tenstorrent-interest-puts-ai-151735800.html
2026-05-20 15:19:39+00:00,TTWO,Simply Wall St.,Has Take-Two Interactive (TTWO) Run Ahead Of Its Value After Recent Share Price Rebound,https://finance.yahoo.com/markets/stocks/articles/two-interactive-ttwo-run-ahead-151939106.html
2026-05-20 15:22:00+00:00,AMAT,Zacks,Applied Materials Gains From Rising Operating Leverage: What's Ahead?,https://finance.yahoo.com/markets/stocks/articles/applied-materials-gains-rising-operating-152200292.html
2026-05-20 15:22:00+00:00,ASML,Zacks,Applied Materials Gains From Rising Operating Leverage: What's Ahead?,https://finance.yahoo.com/markets/stocks/articles/applied-materials-gains-rising-operating-152200292.html
2026-05-20 15:22:00+00:00,LRCX,Zacks,Applied Materials Gains From Rising Operating Leverage: What's Ahead?,https://finance.yahoo.com/markets/stocks/articles/applied-materials-gains-rising-operating-152200292.html
2026-05-20 15:22:38+00:00,ADI,Motley Fool,Analog Devices (ADI) Q2 2026 Earnings Transcript,https://finance.yahoo.com/markets/stocks/articles/analog-devices-adi-q2-2026-152238393.html
2026-05-20 15:24:43+00:00,PLTR,24/7 Wall St.,Forget Palantir: 2 Unstoppable AI Stocks to Buy Instead,https://finance.yahoo.com/sectors/technology/articles/forget-palantir-2-unstoppable-ai-152443521.html
2026-05-20 15:24:55+00:00,REGN,StockStory,Why Regeneron (REGN) Shares Are Trading Lower Today,https://finance.yahoo.com/markets/stocks/articles/why-regeneron-regn-shares-trading-152455570.html
2026-05-20 15:30:00+00:00,ADI,Zacks,"Analog Devices Q2 Earnings Beat Estimates, Revenues Rise Y/Y",https://finance.yahoo.com/markets/stocks/articles/analog-devices-q2-earnings-beat-153000996.html
2026-05-20 15:30:00+00:00,EA,Business Wire,Rewrite the Grid: EA SPORTS™ Reveals F1® 25: 2026 Season Pack,https://finance.yahoo.com/sectors/technology/articles/rewrite-grid-ea-sports-reveals-153000779.html
2026-05-20 15:32:22+00:00,PANW,MT Newswires,"Zscaler Likely to See Balanced Fiscal Q3 Results, Oppenheimer Says",https://finance.yahoo.com/markets/stocks/articles/zscaler-likely-see-balanced-fiscal-153222525.html
2026-05-20 15:32:22+00:00,ZS,MT Newswires,"Zscaler Likely to See Balanced Fiscal Q3 Results, Oppenheimer Says",https://finance.yahoo.com/markets/stocks/articles/zscaler-likely-see-balanced-fiscal-153222525.html
2026-05-20 15:35:44+00:00,MRVL,MT Newswires,"Marvell Technology Poised for Upside to Fiscal Q1 Results, Q2 Outlook on AI Networking, Custom Chips, Oppenheimer Says",https://finance.yahoo.com/markets/stocks/articles/marvell-technology-poised-upside-fiscal-153544940.html
2026-05-20 15:37:00+00:00,MRVL,Zacks,Can MRVL's AI Backlog Drive Revenues to Nearly $11B in FY27?,https://finance.yahoo.com/markets/stocks/articles/mrvls-ai-backlog-drive-revenues-153700025.html
2026-05-20 15:37:00+00:00,AVGO,Zacks,Can MRVL's AI Backlog Drive Revenues to Nearly $11B in FY27?,https://finance.yahoo.com/markets/stocks/articles/mrvls-ai-backlog-drive-revenues-153700025.html
2026-05-20 15:39:00+00:00,AXON,Zacks,Strength in Connected Devices Unit Drives Axon: Can the Momentum Sustain?,https://finance.yahoo.com/markets/stocks/articles/strength-connected-devices-unit-drives-153900833.html
2026-05-20 15:40:05+00:00,ABNB,Zacks,ATAT vs. ABNB: Which Stock Is the Better Value Option?,https://finance.yahoo.com/markets/stocks/articles/atat-vs-abnb-stock-better-154005287.html
2026-05-20 15:45:00+00:00,TMUS,Zacks,Can Rising Satellite-Based Telecom Services Boost ASTS' Future Profit?,https://finance.yahoo.com/markets/stocks/articles/rising-satellite-based-telecom-services-154500926.html
2026-05-20 15:45:00+00:00,FANG,Zacks,"4 Low-Beta Stocks for a Steadier Portfolio: LQDA, XOM, VLO & FANG",https://finance.yahoo.com/markets/stocks/articles/4-low-beta-stocks-steadier-154500971.html
2026-05-20 15:45:05+00:00,LRCX,GuruFocus.com,Lam Research Opens Austria Lab to Advance Panel-Level Chip Packaging,https://finance.yahoo.com/sectors/technology/articles/lam-research-opens-austria-lab-154505376.html
2026-05-20 15:46:00+00:00,FANG,Zacks,Oil Remains Above $100: Are Permian Stocks a Smart Bet Now?,https://finance.yahoo.com/sectors/energy/articles/oil-remains-above-100-permian-154600906.html
2026-05-20 15:46:00+00:00,QCOM,Proactive,Intel shares rise on reports of Tenstorrent acquisition talks,https://finance.yahoo.com/markets/stocks/articles/intel-shares-rise-reports-tenstorrent-154600745.html
2026-05-20 15:46:04+00:00,INTU,MT Newswires,"Top Midday Stories: Target Beats Q1 Estimates, Ups Sales Guidance, But Shares Fall; Intuit Laying Off 17% of Global Workforce",https://finance.yahoo.com/markets/stocks/articles/top-midday-stories-target-beats-154604731.html
2026-05-20 15:46:04+00:00,ADI,MT Newswires,"Top Midday Stories: Target Beats Q1 Estimates, Ups Sales Guidance, But Shares Fall; Intuit Laying Off 17% of Global Workforce",https://finance.yahoo.com/markets/stocks/articles/top-midday-stories-target-beats-154604731.html
2026-05-20 15:47:55+00:00,COST,GuruFocus.com,Costco Faces High Bar Ahead of Q3 Results,https://finance.yahoo.com/markets/stocks/articles/costco-faces-high-bar-ahead-154755691.html
2026-05-20 15:48:55+00:00,MSTR,StockStory,"Strategy (MSTR) Stock Trades Down, Here Is Why",https://finance.yahoo.com/markets/stocks/articles/strategy-mstr-stock-trades-down-154855839.html
2026-05-20 15:49:20+00:00,ASML,MT Newswires,"ASML Offers Attractive Risk/Reward in European Semiconductors, UBS Says",https://finance.yahoo.com/markets/stocks/articles/asml-offers-attractive-risk-reward-154920069.html
2026-05-20 15:51:09+00:00,ASML,GuruFocus.com,ASML Named Top Pick as UBS Lifts Price Target,https://finance.yahoo.com/markets/stocks/articles/asml-named-top-pick-ubs-155109453.html
2026-05-20 15:55:00+00:00,LRCX,24/7 Wall St.,Semiconductor Equipment Stocks Powering the AI Chip Manufacturing Boom: Etching,https://finance.yahoo.com/sectors/technology/articles/semiconductor-equipment-stocks-powering-ai-155500882.html
2026-05-20 15:56:55+00:00,WDC,StockStory,"Himax, Western Digital, and Amkor Shares Are Falling, What You Need To Know",https://finance.yahoo.com/markets/stocks/articles/himax-western-digital-amkor-shares-155655746.html
2026-05-20 15:56:58+00:00,COST,reddit.com/r/stocks,"Help finding highly volatile stocks - I'm looking to create a list of highly volatile stocks, or stocks that have massive swings in price over the long term. My ultimate goal is to put a small part of my portfolio into these stocks when they are at the lower end of their historical range (5-8 years) and patiently wait for them to hopefully skyrocket again. Then sell and repeat when they inevitably crumble again. My",
2026-05-20 15:58:00+00:00,AMAT,Zacks,LRCX Ups WFE View Amid AI Demand: Can It Lift Systems Revenues?,https://finance.yahoo.com/sectors/technology/articles/lrcx-ups-wfe-view-amid-155800959.html
2026-05-20 15:58:00+00:00,LRCX,Zacks,LRCX Ups WFE View Amid AI Demand: Can It Lift Systems Revenues?,https://finance.yahoo.com/sectors/technology/articles/lrcx-ups-wfe-view-amid-155800959.html
2026-05-20 15:58:00+00:00,ASML,Zacks,LRCX Ups WFE View Amid AI Demand: Can It Lift Systems Revenues?,https://finance.yahoo.com/sectors/technology/articles/lrcx-ups-wfe-view-amid-155800959.html
2026-05-20 16:00:02+00:00,WMT,Barchart,Walmart Stock Looks Quite Risky Heading Into Q1 Results,https://finance.yahoo.com/markets/stocks/articles/walmart-stock-looks-quite-risky-160002693.html
2026-05-20 16:00:04+00:00,LITE,Zacks,Are You Looking for a Top Momentum Pick? Why Lumentum (LITE) is a Great Choice,https://finance.yahoo.com/markets/stocks/articles/looking-top-momentum-pick-why-160004053.html
2026-05-20 16:00:37+00:00,ASML,MT Newswires,European Stocks Rise in Wednesday Trading; UK Inflation Cools in April,https://finance.yahoo.com/markets/world-indices/articles/european-stocks-rise-wednesday-trading-160037451.html
2026-05-20 16:04:55+00:00,AMAT,StockStory,"MACOM, Applied Materials, and Photronics Shares Are Falling, What You Need To Know",https://finance.yahoo.com/markets/stocks/articles/macom-applied-materials-photronics-shares-160455254.html
2026-05-20 16:04:55+00:00,WMT,GuruFocus.com,Walmart Guidance Takes Center Stage Ahead of Earnings,https://finance.yahoo.com/markets/stocks/articles/walmart-guidance-takes-center-stage-160455774.html
2026-05-20 16:05:00+00:00,NFLX,Motley Fool,Is Netflix the Next Trillion-Dollar Company?,https://finance.yahoo.com/markets/stocks/articles/netflix-next-trillion-dollar-company-160500409.html
2026-05-20 16:05:09+00:00,AAPL,Barchart,"Up 110% YTD, Why Nvidia’s Backing Could Keep Nokia Stock Rallying",https://finance.yahoo.com/markets/stocks/articles/110-ytd-why-nvidia-backing-160509720.html
2026-05-20 16:06:53+00:00,ASML,Motley Fool,Why ASML Holding Stock Just Popped,https://finance.yahoo.com/markets/stocks/articles/why-asml-holding-stock-just-160653843.html
2026-05-20 16:12:55+00:00,ZS,StockStory,Why Is Zscaler (ZS) Stock Soaring Today,https://finance.yahoo.com/markets/stocks/articles/why-zscaler-zs-stock-soaring-161255970.html
2026-05-20 16:14:36+00:00,CMCSA,Simply Wall St.,How The Story On Charter Communications (CHTR) Is Shifting After Price Target Cuts,https://finance.yahoo.com/markets/stocks/articles/story-charter-communications-chtr-shifting-161436810.html
2026-05-20 16:14:36+00:00,CHTR,Simply Wall St.,How The Story On Charter Communications (CHTR) Is Shifting After Price Target Cuts,https://finance.yahoo.com/markets/stocks/articles/story-charter-communications-chtr-shifting-161436810.html
2026-05-20 16:15:24+00:00,KHC,Simply Wall St.,Assessing Kraft Heinz (KHC) Valuation After Prolonged Share Price Weakness,https://finance.yahoo.com/markets/stocks/articles/assessing-kraft-heinz-khc-valuation-161524290.html
2026-05-20 16:20:00+00:00,BKNG,PR Newswire,Take the Trip: KAYAK Summer Travel Report Highlights Smart Ways to Save on Summer Travel,https://finance.yahoo.com/markets/articles/trip-kayak-summer-travel-report-162000773.html
2026-05-20 16:20:01+00:00,MCHP,Zacks,Earnings Estimates Rising for Microchip Tech (MCHP): Will It Gain?,https://finance.yahoo.com/markets/stocks/articles/earnings-estimates-rising-microchip-tech-162001329.html
2026-05-20 16:20:01+00:00,DDOG,Zacks,Why Datadog (DDOG) Might be Well Poised for a Surge,https://finance.yahoo.com/markets/stocks/articles/why-datadog-ddog-might-well-162001696.html
2026-05-20 16:20:55+00:00,STX,StockStory,"Seagate, Power Integrations, and FormFactor Shares Plummet, What You Need To Know",https://finance.yahoo.com/markets/stocks/articles/seagate-power-integrations-formfactor-shares-162055590.html
2026-05-20 16:26:06+00:00,MSTR,TheStreet,"Bank of America discloses exposure to Bitcoin, XRP, Ether, Solana",https://finance.yahoo.com/markets/crypto/articles/bank-america-discloses-exposure-bitcoin-162606305.html
2026-05-20 16:28:00+00:00,ADI,Proactive,Analog Devices snaps up AI power chip startup Empower Semiconductor for $1.5 billion,https://finance.yahoo.com/sectors/technology/articles/analog-devices-snaps-ai-power-162800475.html
2026-05-20 16:35:17+00:00,LRCX,Investing.com,Bernstein lifts price targets on LRCX and KLAC after lifting WFE forecasts,https://finance.yahoo.com/markets/stocks/articles/bernstein-lifts-price-targets-lrcx-163517344.html
2026-05-20 16:35:17+00:00,KLAC,Investing.com,Bernstein lifts price targets on LRCX and KLAC after lifting WFE forecasts,https://finance.yahoo.com/markets/stocks/articles/bernstein-lifts-price-targets-lrcx-163517344.html
2026-05-20 16:45:02+00:00,STX,Zacks,Here is Why Growth Investors Should Buy Seagate (STX) Now,https://finance.yahoo.com/markets/stocks/articles/why-growth-investors-buy-seagate-164502620.html
2026-05-20 16:46:06+00:00,ADI,Moby,"Analog Devices, Inc. Q2 2026 Earnings Call Summary",https://finance.yahoo.com/markets/stocks/articles/analog-devices-inc-q2-2026-164606619.html
2026-05-20 16:52:55+00:00,MRVL,StockStory,Why Marvell Technology (MRVL) Shares Are Sliding Today,https://finance.yahoo.com/markets/stocks/articles/why-marvell-technology-mrvl-shares-165255576.html
2026-05-20 16:56:29+00:00,KLAC,GuruFocus.com,"Nvidia, Micron and AMD Leads Chip Rally Samsung Strike Threat Shakes Chip Supply",https://finance.yahoo.com/sectors/technology/articles/nvidia-micron-amd-leads-chip-165629244.html
2026-05-20 16:56:29+00:00,AMAT,GuruFocus.com,"Nvidia, Micron and AMD Leads Chip Rally Samsung Strike Threat Shakes Chip Supply",https://finance.yahoo.com/sectors/technology/articles/nvidia-micron-amd-leads-chip-165629244.html
2026-05-20 16:56:29+00:00,WDC,GuruFocus.com,"Nvidia, Micron and AMD Leads Chip Rally Samsung Strike Threat Shakes Chip Supply",https://finance.yahoo.com/sectors/technology/articles/nvidia-micron-amd-leads-chip-165629244.html
2026-05-20 16:56:29+00:00,QCOM,GuruFocus.com,"Nvidia, Micron and AMD Leads Chip Rally Samsung Strike Threat Shakes Chip Supply",https://finance.yahoo.com/sectors/technology/articles/nvidia-micron-amd-leads-chip-165629244.html
2026-05-20 16:56:29+00:00,ASML,GuruFocus.com,"Nvidia, Micron and AMD Leads Chip Rally Samsung Strike Threat Shakes Chip Supply",https://finance.yahoo.com/sectors/technology/articles/nvidia-micron-amd-leads-chip-165629244.html
2026-05-20 16:56:29+00:00,SNDK,GuruFocus.com,"Nvidia, Micron and AMD Leads Chip Rally Samsung Strike Threat Shakes Chip Supply",https://finance.yahoo.com/sectors/technology/articles/nvidia-micron-amd-leads-chip-165629244.html
2026-05-20 16:56:29+00:00,AMD,GuruFocus.com,"Nvidia, Micron and AMD Leads Chip Rally Samsung Strike Threat Shakes Chip Supply",https://finance.yahoo.com/sectors/technology/articles/nvidia-micron-amd-leads-chip-165629244.html
2026-05-20 16:56:29+00:00,AVGO,GuruFocus.com,"Nvidia, Micron and AMD Leads Chip Rally Samsung Strike Threat Shakes Chip Supply",https://finance.yahoo.com/sectors/technology/articles/nvidia-micron-amd-leads-chip-165629244.html
2026-05-20 16:56:29+00:00,STX,GuruFocus.com,"Nvidia, Micron and AMD Leads Chip Rally Samsung Strike Threat Shakes Chip Supply",https://finance.yahoo.com/sectors/technology/articles/nvidia-micron-amd-leads-chip-165629244.html
2026-05-20 16:56:29+00:00,LRCX,GuruFocus.com,"Nvidia, Micron and AMD Leads Chip Rally Samsung Strike Threat Shakes Chip Supply",https://finance.yahoo.com/sectors/technology/articles/nvidia-micron-amd-leads-chip-165629244.html
2026-05-20 16:57:27+00:00,MU,GuruFocus.com,Chip Stocks Rise as Samsung Strike Risk Threatens Supply,https://finance.yahoo.com/sectors/technology/articles/chip-stocks-rise-samsung-strike-165727713.html
2026-05-20 16:57:27+00:00,AMD,GuruFocus.com,Chip Stocks Rise as Samsung Strike Risk Threatens Supply,https://finance.yahoo.com/sectors/technology/articles/chip-stocks-rise-samsung-strike-165727713.html
2026-05-20 16:58:00+00:00,AAPL,Zacks,"Alphabet Trades Close to 52-Week High: Buy, Sell, or Hold the Stock?",https://finance.yahoo.com/markets/stocks/articles/alphabet-trades-close-52-week-165800934.html
