timestamp,ticker,source,text,url
2025-08-15 19:39:34+00:00,MSTR,Bloomberg,Michael Saylor Bets on A $100B Bitcoin 'Credit' Dream,https://finance.yahoo.com/video/michael-saylor-bets-100b-bitcoin-193934577.html
2025-08-15 19:46:15+00:00,ON,reddit.com/r/stocks,"What is your opinion on MP Material following theie deal with Apple and the Pantagon? - As title says, the stock has been skyrocketing since the announcement and i wonder is it too late to buy or will it keep increasing, will it crash in your opinion? I know noone has a crystal ball but i hardly seen such spike",
2025-08-15 19:56:08+00:00,LRCX,Barchart,Should You Buy the Post-Earnings Plunge in Applied Materials Stock?,https://finance.yahoo.com/news/buy-post-earnings-plunge-applied-195608813.html
2025-08-15 19:56:08+00:00,AMAT,Barchart,Should You Buy the Post-Earnings Plunge in Applied Materials Stock?,https://finance.yahoo.com/news/buy-post-earnings-plunge-applied-195608813.html
2025-08-15 19:57:12+00:00,AMAT,MT Newswires,Sector Update: Tech Stocks Slide Late Afternoon,https://finance.yahoo.com/news/sector-tech-stocks-slide-afternoon-195712033.html
2025-08-15 20:00:05+00:00,MU,Investor's Business Daily,Insatiable Demand For AI Data Centers — And Space — Fuels This Stock,https://www.investors.com/research/ibd-stock-analysis/micron-stock-ai-data-centers-space-exploration/?src=A00220&yptr=yahoo
2025-08-15 20:00:05+00:00,AVGO,Investor's Business Daily,Insatiable Demand For AI Data Centers — And Space — Fuels This Stock,https://www.investors.com/research/ibd-stock-analysis/micron-stock-ai-data-centers-space-exploration/?src=A00220&yptr=yahoo
2025-08-15 20:00:27+00:00,AMAT,Yahoo Finance,"Stock market today: Dow, S&P 500, Nasdaq notch weekly wins as slew of data muddies rate-cut path",https://finance.yahoo.com/news/live/stock-market-today-dow-sp-500-nasdaq-notch-weekly-wins-as-slew-of-data-muddies-rate-cut-path-200027774.html
2025-08-15 20:02:59+00:00,BKR,MT Newswires,Oil Rig Count Rises by 1; Crude Falls as Trump-Putin Meeting Kicks Off,https://finance.yahoo.com/news/oil-rig-count-rises-1-200259591.html
2025-08-15 20:03:24+00:00,MU,Motley Fool,Why Micron Technologies Stock Was Flopping on Friday,https://finance.yahoo.com/news/why-micron-technologies-stock-flopping-200324059.html
2025-08-15 20:05:25+00:00,AMAT,Investor's Business Daily,Applied Materials Falls On Weak Outlook. CEO Sees 'Increased Uncertainty.',https://www.investors.com/news/technology/applied-materials-stock-amat-fiscal-q3-2025-earnings/?src=A00220&yptr=yahoo
2025-08-15 20:15:00+00:00,TMUS,PR Newswire,"QVC Group, Inc. Announces Semi-Annual Interest Payment and Regular Additional Distribution on 3.75% Senior Exchangeable Debentures Due 2030",https://finance.yahoo.com/news/qvc-group-inc-announces-semi-201500348.html
2025-08-15 20:16:04+00:00,AVGO,Investor's Business Daily,Trump Wants To Make Intel Great Again. What That Means For TSMC.,https://www.investors.com/news/technology/intel-stock-trump-plan-reshore-chipmaking/?src=A00220&yptr=yahoo
2025-08-15 20:16:04+00:00,QCOM,Investor's Business Daily,Trump Wants To Make Intel Great Again. What That Means For TSMC.,https://www.investors.com/news/technology/intel-stock-trump-plan-reshore-chipmaking/?src=A00220&yptr=yahoo
2025-08-15 20:16:13+00:00,AMAT,Bloomberg,Applied Materials Suffers Worst Rout Since 2020 on China Woes,https://finance.yahoo.com/news/applied-materials-tumbles-china-woes-103649551.html
2025-08-15 20:24:48+00:00,AMAT,Associated Press Finance,"How major US stock indexes fared Friday, 8/15/2025",https://finance.yahoo.com/news/major-us-stock-indexes-fared-202448783.html
2025-08-15 20:25:00+00:00,PEP,Barrons.com,This Meatpacker Stock Is a Quality Buy at a Discount Price,https://www.barrons.com/articles/buy-jbs-stock-price-pick-8f42f412?siteid=yhoof2&yptr=yahoo
2025-08-15 20:31:06+00:00,ABNB,Benzinga,Personal Finance Influencer Explains How You Can Dodge AirBnb Fees With A Google Reverse Image Search,https://finance.yahoo.com/news/personal-finance-influencer-explains-dodge-203106065.html
2025-08-15 20:35:24+00:00,INTU,MT Newswires,S&P 500 Advances on Week as Likelihood of September Fed Rate-Cut Keeps Bulls Engaged,https://finance.yahoo.com/news/p-500-advances-week-likelihood-203524579.html
2025-08-15 20:37:00+00:00,AMAT,Barrons.com,"These Stocks Moved the Most Today: UnitedHealth, Applied Materials, Intel, Quantum Computing, Opendoor, and More",https://www.barrons.com/articles/stock-movers-eb3061d3?siteid=yhoof2&yptr=yahoo
2025-08-15 20:42:52+00:00,AMAT,MT Newswires,"US Equity Markets End Mixed as Trump, Putin Meet",https://finance.yahoo.com/news/us-equity-markets-end-mixed-202131006.html
2025-08-15 20:50:08+00:00,SBUX,Insider Monkey,"Starbucks Corporation (SBUX): “I Have Been A Huge Beleiver,” Says Jim Cramer",https://finance.yahoo.com/news/starbucks-corporation-sbux-huge-beleiver-205008315.html
2025-08-15 20:51:43+00:00,COST,Insider Monkey,"Dollar General Corporation (DG) “Matters Tremendously,” Says Jim Cramer",https://finance.yahoo.com/news/dollar-general-corporation-dg-matters-205143826.html
2025-08-15 20:52:20+00:00,LULU,Investor's Business Daily,Stock Market Today: Dow Ekes Out A Gain; Chip Equipment Names Weigh On Tech,https://www.investors.com/market-trend/stock-market-today/dow-jones-sp500-nasdaq-unitedhealth-unh-warren-buffett/?src=A00220&yptr=yahoo
2025-08-15 20:52:20+00:00,AMAT,Investor's Business Daily,Stock Market Today: Dow Ekes Out A Gain; Chip Equipment Names Weigh On Tech,https://www.investors.com/market-trend/stock-market-today/dow-jones-sp500-nasdaq-unitedhealth-unh-warren-buffett/?src=A00220&yptr=yahoo
2025-08-15 20:59:06+00:00,AMAT,Investopedia,S&P 500 Gains & Losses Today: UnitedHealth Stock Climbs After News of Berkshire Stake,https://finance.yahoo.com/news/p-500-gains-losses-today-205906833.html
2025-08-15 21:07:47+00:00,AMAT,MT Newswires,S&P 500 Snaps 3-Day Record Run Following Macro Data; Wall Street Posts Back-to-Back Weekly Gains,https://finance.yahoo.com/news/p-500-snaps-3-day-210747274.html
2025-08-15 21:17:00+00:00,COST,Motley Fool,1 Green Flag for Costco Wholesale Right Now,https://finance.yahoo.com/news/1-green-flag-costco-wholesale-211700715.html
2025-08-15 21:24:00+00:00,ARM,MarketWatch,Intel has 18 months to determine its future — or Qualcomm and Arm will,https://finance.yahoo.com/news/intel-18-months-determine-future-211800572.html
2025-08-15 21:24:00+00:00,QCOM,MarketWatch,Intel has 18 months to determine its future — or Qualcomm and Arm will,https://finance.yahoo.com/news/intel-18-months-determine-future-211800572.html
2025-08-15 21:30:00+00:00,AZN,FastCompany,"America’s first needle-free, at-home flu vaccine is now available",https://finance.yahoo.com/news/america-first-needle-free-home-213000098.html
2025-08-15 21:45:01+00:00,WDAY,Zacks,Why the Market Dipped But Workday (WDAY) Gained Today,https://finance.yahoo.com/news/why-market-dipped-workday-wday-214501264.html
2025-08-15 21:50:00+00:00,WBD,ACCESS Newswire,"CBMJ (Patriot.TV) Stock Rockets: +400% Past Month, +300% Last 3 Weeks, +28% Today as Investor Confidence Surges",https://finance.yahoo.com/news/cbmj-patriot-tv-stock-rockets-215000347.html
2025-08-15 21:52:00+00:00,VRTX,Barrons.com,Vertex Pharma CEO Buys the Stock Dip,https://www.barrons.com/articles/vertex-pharma-stock-ceo-f72679ae?siteid=yhoof2&yptr=yahoo
2025-08-15 21:58:13+00:00,AMAT,The Wall Street Journal,Podcast: U.S. Stocks End Mixed After Dow's Intraday Record,https://www.wsj.com/livecoverage/stock-market-today-dow-sp-500-nasdaq-08-15-2025/card/podcast-u-s-stocks-end-mixed-after-dow-s-intraday-record-HJZ9QBiYlNpEH0vJtQuI?siteid=yhoof2&yptr=yahoo
2025-08-15 22:03:06+00:00,WDAY,GuruFocus.com,Workday Buys Flowise to Boost AI Agent Tools,https://finance.yahoo.com/news/workday-buys-flowise-boost-ai-220306141.html
2025-08-15 22:32:52+00:00,CSCO,Motley Fool,Why Cisco Systems Stock Slumped Today,https://finance.yahoo.com/news/why-cisco-systems-stock-slumped-223252219.html
2025-08-15 22:48:49+00:00,ON,reddit.com/r/stocks,"Novo Nordisk Wegovy® approved in the US for the treatment of MASH - **Bagsværd, Denmark, 15 August 2025** – Novo Nordisk today announced that the US Food and Drug Administration (FDA) has approved an additional indication for Wegovy^(®) (semaglutide 2.4 mg) based on a supplemental New Drug Application (sNDA) for treatment of noncirrhotic metabolic dysfunction-associated steatohepatitis (MASH) in adults with moderate to advanced liver fibrosis (consistent with stages F2 to F3 fibrosis), in combination with",
2025-08-15 22:53:47+00:00,CPRT,reddit.com/r/stocks,"Summarize your 2025 YTD: 1 thing done right vs 1 thing done wrong - Any one is interested in sharing your high level strategized tip YTD in that 1 right vs 1 wrong format. let me throw mine out there 1 right : take smaller losses quicker and had better down side protection 1 wrong: sold 1 mega tech to reposition to a little bit everything The stocks I’ve sold out, particularly at smaller losses",
2025-08-15 22:53:47+00:00,MSFT,reddit.com/r/stocks,"Summarize your 2025 YTD: 1 thing done right vs 1 thing done wrong - Any one is interested in sharing your high level strategized tip YTD in that 1 right vs 1 wrong format. let me throw mine out there 1 right : take smaller losses quicker and had better down side protection 1 wrong: sold 1 mega tech to reposition to a little bit everything The stocks I’ve sold out, particularly at smaller losses",
2025-08-15 23:05:00+00:00,AVGO,Motley Fool,"5 Unstoppable ""Ten Titans"" Growth Stocks to Buy Now and Hold Through at Least 2030",https://finance.yahoo.com/news/5-unstoppable-ten-titans-growth-230500494.html
2025-08-15 23:19:09+00:00,MU,Insider Monkey,Micron (MU) Stock: Analyst Sees AI Demand Driving Big Gains Ahead,https://finance.yahoo.com/news/micron-mu-stock-analyst-sees-231909418.html
2025-08-15 23:23:09+00:00,CEG,Insider Monkey,Hyperscaler Deals Could Power Constellation Energy (CEG) Stock Higher,https://finance.yahoo.com/news/hyperscaler-deals-could-power-constellation-232309074.html
2025-08-16 01:10:09+00:00,VRTX,TipRanks,Insiders Snap Up These 2 Stocks on the Dip — Here’s Why They Draw Plaudits from Goldman Sachs,https://finance.yahoo.com/news/insiders-snap-2-stocks-dip-011009343.html
2025-08-16 01:43:47+00:00,ISRG,Insider Monkey,"Baird Raises PT on Intuitive Surgical (ISRG) to $600 From $590, Keeps an Overweight Rating",https://finance.yahoo.com/news/baird-raises-pt-intuitive-surgical-014347721.html
2025-08-16 01:43:51+00:00,BKNG,Insider Monkey,"Susquehanna Lifts PT on Booking Holdings (BKNG) to $6,500 From $6,000",https://finance.yahoo.com/news/susquehanna-lifts-pt-booking-holdings-014351216.html
2025-08-16 01:44:07+00:00,HON,Insider Monkey,Benchmark Co. Maintains a Buy Rating on HNI Corporation (HNI),https://finance.yahoo.com/news/benchmark-co-maintains-buy-rating-014407422.html
2025-08-16 02:06:59+00:00,MRVL,Insider Monkey,Jim Cramer on Marvell: “I Want You to Buy More”,https://finance.yahoo.com/news/jim-cramer-marvell-want-buy-020659685.html
2025-08-16 02:12:51+00:00,CHTR,Insider Monkey,"Bernstein Reiterates a Buy Rating on Charter Communications (CHTR), Sets a $380 PT",https://finance.yahoo.com/news/bernstein-reiterates-buy-rating-charter-021251718.html
2025-08-16 02:12:57+00:00,MSTR,Insider Monkey,Mizuho Securities Lifts PT on Strategy Inc. (MSTR) to $586 From $563,https://finance.yahoo.com/news/mizuho-securities-lifts-pt-strategy-021257405.html
2025-08-16 02:58:44+00:00,KHC,Barchart,Warren Buffett’s Berkshire Hathaway Earns $25 Every Second Just From Coca-Cola Stock Dividends Alone,https://finance.yahoo.com/news/warren-buffett-berkshire-hathaway-earns-025844937.html
2025-08-16 04:24:20+00:00,ARM,reddit.com/r/stocks,"What might Trumpian meddling mean for Intel? - >What Intel needs more than new board members is customers for its manufacturing, or “foundry”, arm. They have not been forthcoming, partly because Intel’s chip-design business competes with would-be buyers such as AMD and Nvidia. A second transaction offers some clues as to how they might be persuaded. In July America’s Defence Department invested $400m in MP Materials, a producer of rare-earth metals, and will guarantee the",
2025-08-16 04:24:20+00:00,AMD,reddit.com/r/stocks,"What might Trumpian meddling mean for Intel? - >What Intel needs more than new board members is customers for its manufacturing, or “foundry”, arm. They have not been forthcoming, partly because Intel’s chip-design business competes with would-be buyers such as AMD and Nvidia. A second transaction offers some clues as to how they might be persuaded. In July America’s Defence Department invested $400m in MP Materials, a producer of rare-earth metals, and will guarantee the",
2025-08-16 04:24:20+00:00,ON,reddit.com/r/stocks,"What might Trumpian meddling mean for Intel? - >What Intel needs more than new board members is customers for its manufacturing, or “foundry”, arm. They have not been forthcoming, partly because Intel’s chip-design business competes with would-be buyers such as AMD and Nvidia. A second transaction offers some clues as to how they might be persuaded. In July America’s Defence Department invested $400m in MP Materials, a producer of rare-earth metals, and will guarantee the",
2025-08-16 04:51:42+00:00,ON,reddit.com/r/stocks,"Leap vs 100 shares - I'm experienced with options, and haven't tried a 2-3 year leap. I've picked my underlying, and my strike. I based my strike on the breakeven. The call option costs 70% vs owning the shares, but obviously way outperforms past the breakeven. The breakeven after 3 years is 15% over current price. Without telling you which underlying, other than it's not bitcoin, and that for this underlying, it blew 30% away",
2025-08-16 06:30:00+00:00,BKNG,Barrons.com,Uncertainty Isn’t Keeping Americans at Home. Travel Stocks Are Benefiting.,https://www.barrons.com/articles/travel-stocks-outlook-uncertainty-c725abae?siteid=yhoof2&yptr=yahoo
2025-08-16 07:43:00+00:00,ON,Motley Fool,Why Aren't More People Talking About This Big News About an Nvidia Partner?,https://finance.yahoo.com/news/why-arent-more-people-talking-074300725.html
2025-08-16 07:48:00+00:00,ORLY,Motley Fool,1 Unstoppable Growth Stock That's On Track to Double by 2030,https://finance.yahoo.com/news/1-unstoppable-growth-stock-thats-074800017.html
2025-08-16 08:50:00+00:00,AVGO,Motley Fool,5 Top Artificial Intelligence Stocks to Buy in August,https://finance.yahoo.com/news/5-top-artificial-intelligence-stocks-085000144.html
2025-08-16 09:27:47+00:00,ON,reddit.com/r/stocks,"Thomson Reuters Q1 Beat but Is It Really That Impressive? - Thomson Reuters just reported Q1 2025 results with total revenue up 1% and organic revenue up 6%. The so-called ""Big 3"" segments posted an even stronger 9% organic growth, which is getting a lot of the usual bullish headlines right now. But honestly, I’m not fully convinced this is as great as it sounds. Sure, organic growth looks good on paper, but a 1%",
2025-08-16 09:30:00+00:00,DXCM,Motley Fool,2 Stocks to Buy on the Dip and Hold for 10 Years,https://finance.yahoo.com/news/2-stocks-buy-dip-hold-093000764.html
2025-08-16 09:30:00+00:00,PYPL,Motley Fool,2 Stocks to Buy on the Dip and Hold for 10 Years,https://finance.yahoo.com/news/2-stocks-buy-dip-hold-093000764.html
2025-08-16 09:30:00+00:00,LULU,The Wall Street Journal,‘You’re a Boomer If You Wear Leggings’: The Rise of Big Workout Pants,https://www.wsj.com/style/fashion/baggy-workout-pants-fp-movement-leggings-53814676?siteid=yhoof2&yptr=yahoo
2025-08-16 09:30:31+00:00,ON,reddit.com/r/stocks,"/r/Stocks Weekend Discussion Saturday - Aug 16, 2025 - This is the weekend edition of our stickied discussion thread. Discuss your trades / moves from last week and what you're planning on doing for the week ahead. Some helpful links: * [Finviz](https://finviz.com/quote.ashx?t=spy) for charts, fundamentals, and aggregated news on individual stocks * [Bloomberg market news](https://www.bloomberg.com/markets) * StreetInsider news: * [Market Check](https://www.streetinsider.com/Market+Check) - Possibly why the market is doing what it's doing including sudden spikes/dips *",
2025-08-16 10:21:12+00:00,NVDA,reddit.com/r/stocks,"NVIDIA CEO is selling shares like crazy - Is the head of Nvidia, who has been selling shares for weeks, preparing to announce the results? Does he know something we don't? [http://openinsider.com/screener?s=NVDA&o=&pl=&ph=&ll=&lh=&fd=730&fdr=&td=0&tdr=&fdlyl=&fdlyh=&daysago=&xp=1&xs=1&vl=&vh=&ocl=&och=&sic1=-1&sicl=100&sich=9999&isceo=1&grp=0&nfl=&nfh=&nil=&nih=&nol=&noh=&v2l=&v2h=&oc2l=&oc2h=&sortcol=0&cnt=100&page=1](http://openinsider.com/screener?s=NVDA&o=&pl=&ph=&ll=&lh=&fd=730&fdr=&td=0&tdr=&fdlyl=&fdlyh=&daysago=&xp=1&xs=1&vl=&vh=&ocl=&och=&sic1=-1&sicl=100&sich=9999&isceo=1&grp=0&nfl=&nfh=&nil=&nih=&nol=&noh=&v2l=&v2h=&oc2l=&oc2h=&sortcol=0&cnt=100&page=1)",
2025-08-16 10:30:03+00:00,ADI,Investing.com,Will the U.S. be self-sufficient in analog semi?,https://finance.yahoo.com/news/u-self-sufficient-analog-semi-103003651.html
2025-08-16 10:30:03+00:00,TXN,Investing.com,Will the U.S. be self-sufficient in analog semi?,https://finance.yahoo.com/news/u-self-sufficient-analog-semi-103003651.html
2025-08-16 11:00:00+00:00,ASML,Fortune,Nvidia and AMD’s ‘special treatment’ from Trump is shaking up an already tangled global chip supply chain,https://finance.yahoo.com/news/nvidia-amd-special-treatment-trump-110000802.html
2025-08-16 11:00:00+00:00,AMD,Fortune,Nvidia and AMD’s ‘special treatment’ from Trump is shaking up an already tangled global chip supply chain,https://finance.yahoo.com/news/nvidia-amd-special-treatment-trump-110000802.html
2025-08-16 11:00:13+00:00,KDP,Simply Wall St.,Keurig Dr Pepper Inc.'s (NASDAQ:KDP) Stock Financial Prospects Look Bleak: Should Shareholders Be Prepared For A Share Price Correction?,https://finance.yahoo.com/news/keurig-dr-pepper-inc-nasdaq-110013876.html
2025-08-16 11:00:22+00:00,CDNS,Simply Wall St.,Does Cadence Design Systems (NASDAQ:CDNS) Have A Healthy Balance Sheet?,https://finance.yahoo.com/news/does-cadence-design-systems-nasdaq-110022246.html
2025-08-16 12:00:00+00:00,LULU,Motley Fool,3 Top Stocks That Could Double by 2028,https://finance.yahoo.com/news/3-top-stocks-could-double-120000313.html
2025-08-16 12:01:31+00:00,SBUX,Simply Wall St.,Returns At Starbucks (NASDAQ:SBUX) Are On The Way Up,https://finance.yahoo.com/news/returns-starbucks-nasdaq-sbux-way-120131072.html
2025-08-16 12:01:40+00:00,MRVL,Simply Wall St.,"What Does Marvell Technology, Inc.'s (NASDAQ:MRVL) Share Price Indicate?",https://finance.yahoo.com/news/does-marvell-technology-inc-nasdaq-120140745.html
2025-08-16 12:01:43+00:00,MDLZ,Simply Wall St.,Mondelez International (NASDAQ:MDLZ) Hasn't Managed To Accelerate Its Returns,https://finance.yahoo.com/news/mondelez-international-nasdaq-mdlz-hasnt-120143747.html
2025-08-16 12:30:00+00:00,PEP,Motley Fool,Best Stock to Buy Right Now: Coca-Cola vs. PepsiCo,https://finance.yahoo.com/news/best-stock-buy-now-coca-123000528.html
2025-08-16 12:31:24+00:00,MSTR,Benzinga,'Eventually There's Going To Be A Problem'—Expert Sees The Bitcoin And Ethereum Treasury Company Trend Triggering A Subprime Mortgage-Like Crisis,https://finance.yahoo.com/news/eventually-theres-going-problem-expert-123124500.html
2025-08-16 13:00:25+00:00,BKR,Simply Wall St.,Here's Why Baker Hughes (NASDAQ:BKR) Has Caught The Eye Of Investors,https://finance.yahoo.com/news/heres-why-baker-hughes-nasdaq-130025070.html
2025-08-16 13:00:35+00:00,TXN,Simply Wall St.,Are Texas Instruments Incorporated's (NASDAQ:TXN) Fundamentals Good Enough to Warrant Buying Given The Stock's Recent Weakness?,https://finance.yahoo.com/news/texas-instruments-incorporateds-nasdaq-txn-130035739.html
2025-08-16 13:15:48+00:00,AMAT,Simply Wall St.,There's A Lot To Like About Applied Materials' (NASDAQ:AMAT) Upcoming US$0.46 Dividend,https://finance.yahoo.com/news/theres-lot-applied-materials-nasdaq-131548211.html
2025-08-16 13:28:22+00:00,META,reddit.com/r/stocks,Anyone else surprised that 98% of Meta's revenue comes from advertising? - https://i.imgur.com/z6ZEBOJ.jpeg This quarter was the first time I really looked at Meta's financials in any detail and I was shocked to see that 98% of it comes from advertising. You frequently hear about Google's reliance on Search in investing subs across reddit but it's nowhere near 98% of their revenue ($46.6b of $47.5b) and yet I don't hear much about Meta's reliance. Is,
2025-08-16 13:28:22+00:00,ON,reddit.com/r/stocks,Anyone else surprised that 98% of Meta's revenue comes from advertising? - https://i.imgur.com/z6ZEBOJ.jpeg This quarter was the first time I really looked at Meta's financials in any detail and I was shocked to see that 98% of it comes from advertising. You frequently hear about Google's reliance on Search in investing subs across reddit but it's nowhere near 98% of their revenue ($46.6b of $47.5b) and yet I don't hear much about Meta's reliance. Is,
2025-08-16 14:00:00+00:00,MSTR,CoinDesk,Adam Back’s $2.1B Bitcoin Treasury Play Set to Challenge MARA in BTC Holdings,https://finance.yahoo.com/news/adam-back-2-1b-bitcoin-140000279.html
2025-08-16 14:00:25+00:00,ODFL,Simply Wall St.,"Will Weakness in Old Dominion Freight Line, Inc.'s (NASDAQ:ODFL) Stock Prove Temporary Given Strong Fundamentals?",https://finance.yahoo.com/news/weakness-old-dominion-freight-line-140025245.html
2025-08-16 14:15:01+00:00,GILD,Barchart,"The Saturday Spread: These 3 Stocks Statistically May Be Cooking Up Something Special (GILD, WMB, XPEV)",https://finance.yahoo.com/news/saturday-spread-3-stocks-statistically-141501663.html
2025-08-16 14:52:39+00:00,ON,reddit.com/r/stocks,"My picks for best companies under 15B market cap - THIS IS NOT FINANICAL ADVISE. JUST MY THOUGHTS AND OPINIONS. 1. Innodata $INOD What is Innodata? Innodata is a data engineering company that trains Ai. Ever heard of Alexander wangs company ScaleAi that teamed up with META? Or $NBIS’s Toloka? Or Google poaching windsurfs employees? They all do the same thing. Train Ai to learn. Innodata works with META, GOOGLE, APPLE, Xai, and more tech",
2025-08-16 14:52:39+00:00,META,reddit.com/r/stocks,"My picks for best companies under 15B market cap - THIS IS NOT FINANICAL ADVISE. JUST MY THOUGHTS AND OPINIONS. 1. Innodata $INOD What is Innodata? Innodata is a data engineering company that trains Ai. Ever heard of Alexander wangs company ScaleAi that teamed up with META? Or $NBIS’s Toloka? Or Google poaching windsurfs employees? They all do the same thing. Train Ai to learn. Innodata works with META, GOOGLE, APPLE, Xai, and more tech",
2025-08-16 15:00:00+00:00,SHOP,Motley Fool,"This Growth Stock Is Up 100% in the Last Year, but Still Down 15% From All-Time Highs: Should You Buy Today?",https://finance.yahoo.com/news/growth-stock-100-last-still-150000599.html
2025-08-16 15:50:11+00:00,ON,reddit.com/r/stocks,"VIX long calls smart? - Relatively new to investing so I don’t know much, but the sentiment from what I’ve gathered is that we’re in a “bubble”. Stocks have been rising despite multiple reasons why it shouldn’t (Tariffs, unemployment, inflation, etc). My theory is the wealth disparity is so large that it’s being held up by the top 20% who are unaffected by these things. With all that being said, would it be a good",
2025-08-16 16:00:35+00:00,ON,reddit.com/r/stocks,"r/Stocks Weekly Thread on Meme Stocks Saturday - Aug 16, 2025 - The meme stock scheduled posts will now run weekly and post Saturday afternoon and won't be a sticky; you're probably seeing this because automod sent you here! [Full list of meme stocks here.](https://www.reddit.com/r/stocks/wiki/meme-stocks) This will be updated every once in a while. ------ Welcome traders who just can't help them selves discuss the same exact stock that's been discussed 100s of times a",
2025-08-16 16:00:35+00:00,TEAM,reddit.com/r/stocks,"r/Stocks Weekly Thread on Meme Stocks Saturday - Aug 16, 2025 - The meme stock scheduled posts will now run weekly and post Saturday afternoon and won't be a sticky; you're probably seeing this because automod sent you here! [Full list of meme stocks here.](https://www.reddit.com/r/stocks/wiki/meme-stocks) This will be updated every once in a while. ------ Welcome traders who just can't help them selves discuss the same exact stock that's been discussed 100s of times a",
2025-08-16 16:57:32+00:00,ON,reddit.com/r/stocks,"2X Leverage on 401k - My work allows me to use BrokerageLink with Fidelity. Basically allowing me to invest in what I want in my 401k retirement plan. I’m young, 23 years old, so I have a lot of time and don’t really care for the 50-60% dips that come with these products as I know the indexes will recover. Over the past five years, QLD is up 184% while QQQ is up 110%. SPUU",
2025-08-16 17:00:00+00:00,AMD,Motley Fool,Better Artificial Intelligence Stock: SoundHound AI vs. BigBear.ai,https://finance.yahoo.com/news/better-artificial-intelligence-stock-soundhound-170000889.html
2025-08-16 17:13:12+00:00,AZN,Simply Wall St.,AstraZeneca (LSE:AZN) Launches FluMist Home For At-Home Influenza Vaccination,https://finance.yahoo.com/news/astrazeneca-lse-azn-launches-flumist-171312819.html
2025-08-16 17:57:43+00:00,ON,reddit.com/r/stocks,"When To Sell a Call? (If at all?) - Recently trying to learn calls and puts, and bought a single, very small BBai call. Strike $6 that expires 8-22. Now that the price has hit, I’m wondering what I do with it? Am I supposed to hold on to it until the 22nd, or wait until it maybe goes up more and then sell before the 22nd? Thanks for the advice! Edit to add: I’m",
2025-08-16 18:00:16+00:00,COST,Yahoo Finance Video,Retail trading trends: Top names investors are buying,https://finance.yahoo.com/video/retail-trading-trends-top-names-180016299.html
