timestamp,ticker,source,text,url
2026-05-11 13:00:00+00:00,CDNS,Business Wire,Aeva Adopts Cadence Tensilica Vision DSP to Advance Lidar Performance and Efficiency,https://finance.yahoo.com/sectors/technology/articles/aeva-adopts-cadence-tensilica-vision-130000901.html
2026-05-11 13:00:00+00:00,AMAT,GlobeNewswire,Applied Materials and TSMC Partner at the EPIC Center to Accelerate AI Scaling,https://finance.yahoo.com/sectors/technology/articles/applied-materials-tsmc-partner-epic-130000436.html
2026-05-11 13:00:00+00:00,FTNT,PR Newswire,/C O R R E C T I O N -- OneLayer/,https://finance.yahoo.com/sectors/technology/articles/onelayer-launches-technology-alliance-program-130000449.html
2026-05-11 13:00:00+00:00,PYPL,PR Newswire,Seattle Seahawks and PayPal announce PayPal as the team's Official Fan-to-Fan Payments & Exclusive Digital Ticket Payment Processing Partner,https://finance.yahoo.com/markets/crypto/articles/seattle-seahawks-paypal-announce-paypal-130000609.html
2026-05-11 13:00:02+00:00,PYPL,Zacks,"PayPal Holdings, Inc. (PYPL) is Attracting Investor Attention: Here is What You Should Know",https://finance.yahoo.com/markets/stocks/articles/paypal-holdings-inc-pypl-attracting-130002041.html
2026-05-11 13:00:02+00:00,SHOP,Zacks,Here is What to Know Beyond Why Shopify Inc. (SHOP) is a Trending Stock,https://finance.yahoo.com/markets/stocks/articles/know-beyond-why-shopify-inc-130002113.html
2026-05-11 13:00:03+00:00,DDOG,Zacks,"Datadog, Inc. (DDOG) is Attracting Investor Attention: Here is What You Should Know",https://finance.yahoo.com/markets/stocks/articles/datadog-inc-ddog-attracting-investor-130003787.html
2026-05-11 13:00:03+00:00,PLTR,Zacks,Investors Heavily Search Palantir Technologies Inc. (PLTR): Here is What You Need to Know,https://finance.yahoo.com/markets/stocks/articles/investors-heavily-search-palantir-technologies-130003071.html
2026-05-11 13:00:05+00:00,APP,Zacks,Investors Heavily Search AppLovin Corporation (APP): Here is What You Need to Know,https://finance.yahoo.com/markets/stocks/articles/investors-heavily-search-applovin-corporation-130005515.html
2026-05-11 13:00:56+00:00,ABNB,Simply Wall St.,"Airbnb, Inc. Just Missed EPS By 14%: Here's What Analysts Think Will Happen Next",https://finance.yahoo.com/markets/stocks/articles/airbnb-inc-just-missed-eps-130056786.html
2026-05-11 13:01:51+00:00,AMAT,MT Newswires,"US Equity Futures Slightly Lower Pre-Bell as Trump Rejects Iran's Response to Peace Proposal, Oil Prices Rise",https://finance.yahoo.com/markets/stocks/articles/us-equity-futures-slightly-lower-130151715.html
2026-05-11 13:01:51+00:00,CSCO,MT Newswires,"US Equity Futures Slightly Lower Pre-Bell as Trump Rejects Iran's Response to Peace Proposal, Oil Prices Rise",https://finance.yahoo.com/markets/stocks/articles/us-equity-futures-slightly-lower-130151715.html
2026-05-11 13:01:51+00:00,PLTR,MT Newswires,"US Equity Futures Slightly Lower Pre-Bell as Trump Rejects Iran's Response to Peace Proposal, Oil Prices Rise",https://finance.yahoo.com/markets/stocks/articles/us-equity-futures-slightly-lower-130151715.html
2026-05-11 13:01:51+00:00,CEG,MT Newswires,"US Equity Futures Slightly Lower Pre-Bell as Trump Rejects Iran's Response to Peace Proposal, Oil Prices Rise",https://finance.yahoo.com/markets/stocks/articles/us-equity-futures-slightly-lower-130151715.html
2026-05-11 13:02:15+00:00,MSTR,CCN,Strategy’s Software Arm Hits Best Quarter in a Decade as Saylor Signals Another Bitcoin Buy,https://finance.yahoo.com/markets/crypto/articles/strategy-software-arm-hits-best-130215017.html
2026-05-11 13:05:35+00:00,MSTR,decrypt,Strategy Resumes Bitcoin Buys as Saylor Shifts Focus to 'Never Be a Net Seller',https://finance.yahoo.com/markets/crypto/articles/strategy-resumes-bitcoin-buys-saylor-130535483.html
2026-05-11 13:09:00+00:00,TMUS,Business Wire,T-Mobile Is Changing How Fans Experience the PGA Championship,https://finance.yahoo.com/sectors/technology/articles/t-mobile-changing-fans-experience-130900457.html
2026-05-11 13:09:55+00:00,MSTR,BeInCrypto,"MicroStrategy’s Latest Bitcoin Buy Is Its Smallest of 2026, and the Slowdown May Be Structural",https://finance.yahoo.com/markets/crypto/articles/microstrategy-latest-bitcoin-buy-smallest-130955882.html
2026-05-11 13:10:03+00:00,AMGN,Zacks,3 Top Dividend Stocks to Maximize Your Retirement Income,https://finance.yahoo.com/markets/stocks/articles/3-top-dividend-stocks-maximize-131003543.html
2026-05-11 13:15:02+00:00,FTNT,Zacks,"Fortinet, Inc. (FTNT) Hits Fresh High: Is There Still Room to Run?",https://finance.yahoo.com/markets/stocks/articles/fortinet-inc-ftnt-hits-fresh-131502193.html
2026-05-11 13:15:02+00:00,AMAT,Zacks,Curious about Applied Materials (AMAT) Q2 Performance? Explore Wall Street Estimates for Key Metrics,https://finance.yahoo.com/markets/stocks/articles/curious-applied-materials-amat-q2-131502387.html
2026-05-11 13:15:02+00:00,FTNT,Zacks,International Markets and Fortinet (FTNT): A Deep Dive for Investors,https://finance.yahoo.com/markets/stocks/articles/international-markets-fortinet-ftnt-deep-131502082.html
2026-05-11 13:15:05+00:00,ABNB,Zacks,Don't Overlook Airbnb (ABNB) International Revenue Trends While Assessing the Stock,https://finance.yahoo.com/markets/stocks/articles/dont-overlook-airbnb-abnb-international-131505087.html
2026-05-11 13:17:00+00:00,PANW,Zacks,Zscaler Stock Soars 24% in a Month: Hold Tight or Book Profits?,https://finance.yahoo.com/markets/stocks/articles/zscaler-stock-soars-24-month-131700878.html
2026-05-11 13:17:00+00:00,FTNT,Zacks,Zscaler Stock Soars 24% in a Month: Hold Tight or Book Profits?,https://finance.yahoo.com/markets/stocks/articles/zscaler-stock-soars-24-month-131700878.html
2026-05-11 13:17:00+00:00,CRWD,Zacks,Zscaler Stock Soars 24% in a Month: Hold Tight or Book Profits?,https://finance.yahoo.com/markets/stocks/articles/zscaler-stock-soars-24-month-131700878.html
2026-05-11 13:17:00+00:00,ZS,Zacks,Zscaler Stock Soars 24% in a Month: Hold Tight or Book Profits?,https://finance.yahoo.com/markets/stocks/articles/zscaler-stock-soars-24-month-131700878.html
2026-05-11 13:23:34+00:00,MRVL,Insider Monkey,"Marvell Technology, Inc. (MRVL) Announces Acquisition of Polariton Technologies",https://finance.yahoo.com/markets/stocks/articles/marvell-technology-inc-mrvl-announces-132334061.html
2026-05-11 13:23:48+00:00,LRCX,Insider Monkey,BofA is Bullish on MKS Inc. (MKSI),https://finance.yahoo.com/markets/stocks/articles/bofa-bullish-mks-inc-mksi-132348655.html
2026-05-11 13:28:31+00:00,MSTR,Blockspace,"Strategy buys 535 bitcoin, opens vote on STRC semi-monthly dividend change",https://finance.yahoo.com/markets/crypto/articles/strategy-buys-535-bitcoin-opens-132831234.html
2026-05-11 13:30:03+00:00,MELI,Zacks,Is MercadoLibre (MELI) a Buy as Wall Street Analysts Look Optimistic?,https://finance.yahoo.com/markets/stocks/articles/mercadolibre-meli-buy-wall-street-133003051.html
2026-05-11 13:30:05+00:00,ISRG,Zacks,Brokers Suggest Investing in Intuitive Surgical (ISRG): Read This Before Placing a Bet,https://finance.yahoo.com/markets/stocks/articles/brokers-suggest-investing-intuitive-surgical-133005080.html
2026-05-11 13:38:47+00:00,MSFT,reddit.com/r/stocks,"Every big tech is green from the beginning of the year, except MSFT. And it crushed earnings twice this year. I just don't understand. - And I think that analyst do not either. Almost everybody talks about ""fears due to collaboration with OpenAI"" and ""cost of raising data centers for AI"". But those reasons are just so stupid. Even if OpenAI flips, it won't hurt microsoft a little bit. It's like their windows phone i",
2026-05-11 13:38:47+00:00,COST,reddit.com/r/stocks,"Every big tech is green from the beginning of the year, except MSFT. And it crushed earnings twice this year. I just don't understand. - And I think that analyst do not either. Almost everybody talks about ""fears due to collaboration with OpenAI"" and ""cost of raising data centers for AI"". But those reasons are just so stupid. Even if OpenAI flips, it won't hurt microsoft a little bit. It's like their windows phone i",
2026-05-11 13:42:04+00:00,AMAT,InvestorsHub,Applied Materials (AMAT) and TSMC Expand Partnership to Advance Next-Generation AI Chips,https://finance.yahoo.com/sectors/technology/articles/applied-materials-amat-tsmc-expand-134204521.html
2026-05-11 13:45:29+00:00,DASH,Insider Monkey,DoorDash (DASH) Results Reinforced Market Share Gains,https://finance.yahoo.com/markets/stocks/articles/doordash-dash-results-reinforced-market-134529851.html
2026-05-11 13:49:32+00:00,XEL,Barchart,Are Wall Street Analysts Predicting Xcel Energy Stock Will Climb or Sink?,https://finance.yahoo.com/markets/stocks/articles/wall-street-analysts-predicting-xcel-134932937.html
2026-05-11 13:50:00+00:00,PEP,Entrepreneur,Poppi’s Co-Founder Became a Megamillionaire by Rejecting Work-Life Balance: ‘It’s OK to Live in Chaos’,https://finance.yahoo.com/markets/stocks/articles/poppi-co-founder-became-megamillionaire-135000467.html
2026-05-11 13:53:19+00:00,AMD,InvestorsHub,Rackspace Technology (RXT) Extends Rally as Short Covering Accelerates Gains,https://finance.yahoo.com/markets/stocks/articles/rackspace-technology-rxt-extends-rally-135319617.html
2026-05-11 13:58:59+00:00,SBUX,Yahoo Finance Video,Dutch Bros offers incredible value to consumers amid high prices: CEO,https://finance.yahoo.com/video/dutch-bros-offers-incredible-value-to-consumers-amid-high-prices-ceo-135859425.html
2026-05-11 13:58:59+00:00,KHC,Yahoo Finance Video,Dutch Bros offers incredible value to consumers amid high prices: CEO,https://finance.yahoo.com/video/dutch-bros-offers-incredible-value-to-consumers-amid-high-prices-ceo-135859425.html
2026-05-11 14:00:49+00:00,FER,NYSE,Semafor World Economy: Ferrovial CEO Ignacio Madridejos on its Infrastructure,https://finance.yahoo.com/video/semafor-world-economy-ferrovial-ceo-140049327.html
2026-05-11 14:01:21+00:00,CEG,InvestorsHub,Constellation Energy (CEG) Shares Rise After Q1 Earnings and Revenue Beat Forecasts,https://finance.yahoo.com/markets/stocks/articles/constellation-energy-ceg-shares-rise-140121587.html
2026-05-11 14:03:44+00:00,APP,reddit.com/r/stocks,"Why I’m bullish on Uber - I wanted to lay out why I’m so high on Uber right now. I’m currently an analyst in the auto sector and worked on the fleet management side of an auto company for my first job after college. I don’t think Autonomous Vehicles (AV) will kill Uber, in fact, I think Uber will be in a much stronger position 5 years from now because of them. **1. The ""Asset",
2026-05-11 14:04:00+00:00,GEHC,Zacks,GEHC Launches MIM ComboTherapy for GYN Cancer Radiation Planning,https://finance.yahoo.com/sectors/healthcare/articles/gehc-launches-mim-combotherapy-gyn-140400712.html
2026-05-11 14:07:49+00:00,CSGP,InvestorsHub,Lumentum (LITE) Shares Advance Following Nasdaq-100 Inclusion,https://finance.yahoo.com/markets/stocks/articles/lumentum-lite-shares-advance-following-140749713.html
2026-05-11 14:10:12+00:00,STX,Barchart,Strong Earnings and AI Optimism Push the S&P 500 and Nasdaq 100 to Record Highs,https://finance.yahoo.com/markets/stocks/articles/strong-earnings-ai-optimism-push-141012463.html
2026-05-11 14:10:12+00:00,WDC,Barchart,Strong Earnings and AI Optimism Push the S&P 500 and Nasdaq 100 to Record Highs,https://finance.yahoo.com/markets/stocks/articles/strong-earnings-ai-optimism-push-141012463.html
2026-05-11 14:10:12+00:00,TXN,Barchart,Strong Earnings and AI Optimism Push the S&P 500 and Nasdaq 100 to Record Highs,https://finance.yahoo.com/markets/stocks/articles/strong-earnings-ai-optimism-push-141012463.html
2026-05-11 14:10:12+00:00,AMAT,Barchart,Strong Earnings and AI Optimism Push the S&P 500 and Nasdaq 100 to Record Highs,https://finance.yahoo.com/markets/stocks/articles/strong-earnings-ai-optimism-push-141012463.html
2026-05-11 14:10:12+00:00,LRCX,Barchart,Strong Earnings and AI Optimism Push the S&P 500 and Nasdaq 100 to Record Highs,https://finance.yahoo.com/markets/stocks/articles/strong-earnings-ai-optimism-push-141012463.html
2026-05-11 14:23:51+00:00,INTC,reddit.com/r/stocks,"Intel (INTC) Stock Rockets 14% After Apple Partnership and SK Hynix Negotiations Surface - https://blockonomi.com/intel-intc-stock-rockets-14-after-apple-partnership-and-sk-hynix-negotiations-surface/ Intel shares jumped approximately 14% on Friday, followed by an additional 6% gain in premarket trading Monday, reaching $130.13. A preliminary chip manufacturing agreement between Apple and Intel was reached, with support from the U.S. government playing a facilitating role. Separate reports indicate Intel is negotiating with SK Hynix regarding chip-packaging solutions, which could establish a second major foundry partnership.",
2026-05-11 14:32:36+00:00,DASH,CX Dive,Lyft’s loyalty partnerships are driving customer acquisition and frequency,https://finance.yahoo.com/markets/stocks/articles/lyft-loyalty-partnerships-driving-customer-143236161.html
2026-05-11 14:34:00+00:00,CSCO,Zacks,"Inflation Numbers Out This Week: CPI, PPI",https://finance.yahoo.com/economy/policy/articles/inflation-numbers-week-cpi-ppi-143400359.html
2026-05-11 14:38:05+00:00,MCHP,Insider Monkey,KeyBanc Raises its Price Target on Microchip Technology (MCHP) to $135,https://finance.yahoo.com/markets/stocks/articles/keybanc-raises-price-target-microchip-143805426.html
2026-05-11 14:38:13+00:00,AMD,Insider Monkey,Here is Why Advanced Micro Devices (AMD) is Among the 9 Best American Semiconductor Stocks to Buy According to Analysts,https://finance.yahoo.com/markets/stocks/articles/why-advanced-micro-devices-amd-143813826.html
2026-05-11 14:42:04+00:00,AMD,GuruFocus.com,Markets swing between AI optimism and oil fears,https://finance.yahoo.com/markets/stocks/articles/markets-swing-between-ai-optimism-144204412.html
2026-05-11 14:43:00+00:00,CSCO,Proactive,"Week Ahead: Inflation test, an AI IPO and US-China talks put Wall Street on edge",https://finance.yahoo.com/economy/policy/articles/week-ahead-inflation-test-ai-144300588.html
2026-05-11 14:48:00+00:00,CEG,Proactive,"Constellation Energy earnings beat driven by higher revenue, fleet expansion",https://finance.yahoo.com/sectors/energy/articles/constellation-energy-earnings-beat-driven-144800774.html
2026-05-11 14:50:31+00:00,PYPL,Benzinga,"CEOs Predicting AI Will Wipe Out Jobs Have 'A God Complex,' Nvidia's Jensen Huang Says",https://finance.yahoo.com/sectors/technology/articles/ceos-predicting-ai-wipe-jobs-145031422.html
2026-05-11 14:53:34+00:00,CSCO,Reuters,"Elon Musk, Apple's Cook and Boeing CEO going to China with Trump, official says",https://finance.yahoo.com/sectors/technology/articles/nvidia-ceo-huang-not-going-145334564.html
2026-05-11 14:54:22+00:00,TSLA,Yahoo Finance,"Tesla: Buying at these levels means you get Optimus for 'free', Piper Sandler says",https://finance.yahoo.com/sectors/technology/article/tesla-buying-at-these-levels-means-you-get-optimus-for-free-piper-sandler-says-145422275.html
2026-05-11 14:54:55+00:00,NVDA,Yahoo Finance Video,"Memory chip stocks hit record highs, pharma reacts to hantavirus concerns",https://finance.yahoo.com/video/memory-chip-stocks-hit-record-highs-pharma-reacts-to-hantavirus-concerns-145455399.html
2026-05-11 14:54:55+00:00,QCOM,Yahoo Finance Video,"Memory chip stocks hit record highs, pharma reacts to hantavirus concerns",https://finance.yahoo.com/video/memory-chip-stocks-hit-record-highs-pharma-reacts-to-hantavirus-concerns-145455399.html
2026-05-11 14:54:55+00:00,CEG,Yahoo Finance Video,"Memory chip stocks hit record highs, pharma reacts to hantavirus concerns",https://finance.yahoo.com/video/memory-chip-stocks-hit-record-highs-pharma-reacts-to-hantavirus-concerns-145455399.html
2026-05-11 14:54:55+00:00,AAPL,Yahoo Finance Video,"Memory chip stocks hit record highs, pharma reacts to hantavirus concerns",https://finance.yahoo.com/video/memory-chip-stocks-hit-record-highs-pharma-reacts-to-hantavirus-concerns-145455399.html
2026-05-11 14:54:55+00:00,INTC,Yahoo Finance Video,"Memory chip stocks hit record highs, pharma reacts to hantavirus concerns",https://finance.yahoo.com/video/memory-chip-stocks-hit-record-highs-pharma-reacts-to-hantavirus-concerns-145455399.html
2026-05-11 14:57:04+00:00,AMD,reddit.com/r/stocks,"TICKER VALU ? - I went to make a purchase on Schwab this morning for Valuline just a few shares and it was blocked as a restricted trade, so I had to call in and make a broker assisted trade for my 2 measly shares. I'm going thru corporate actions, insider buys and can't see an option chain on any of the brokerage account tools I have. IMHO it's a solid company and I've been",
2026-05-11 15:01:29+00:00,AMZN,24/7 Wall St.,BofA Just Picked FedEx Stock as One of Its Best Ideas: Logistics Giant Joins the US 1 List,https://finance.yahoo.com/markets/stocks/articles/bofa-just-crowned-fedex-one-150129905.html
2026-05-11 15:05:52+00:00,NFLX,24/7 Wall St.,Comcast vs Netflix: Which Is the Better Dip Buy Now?,https://finance.yahoo.com/markets/stocks/articles/comcast-vs-netflix-better-dip-150552506.html
2026-05-11 15:05:52+00:00,CMCSA,24/7 Wall St.,Comcast vs Netflix: Which Is the Better Dip Buy Now?,https://finance.yahoo.com/markets/stocks/articles/comcast-vs-netflix-better-dip-150552506.html
2026-05-11 15:07:00+00:00,CSCO,Zacks,Markets Await Key Inflation Data This Week,https://finance.yahoo.com/markets/stocks/articles/markets-await-key-inflation-data-150700844.html
2026-05-11 15:08:39+00:00,ABNB,Quartz,Airbnb CEO Brian Chesky says AI writes 60% of code,https://finance.yahoo.com/sectors/technology/articles/airbnb-ceo-brian-chesky-says-150839251.html
2026-05-11 15:09:33+00:00,PEP,Fortune,"Poppi cofounder maxed out credit cards and sold her car to fund the company—now, she’s a multimillionaire after a $1.95 billion sale",https://finance.yahoo.com/markets/stocks/articles/poppi-cofounder-maxed-credit-cards-150933390.html
2026-05-11 15:15:07+00:00,SHOP,Simply Wall St.,Shopify (SHOP) Is Down 13.4% After AI-Fueled Q1 Beat and Strong Q2 Growth Outlook - What's Changed,https://finance.yahoo.com/markets/stocks/articles/shopify-shop-down-13-4-151507322.html
2026-05-11 15:15:15+00:00,PLTR,decrypt,OpenAI Just Launched a Consulting Arm to Help Companies Deploy AI,https://finance.yahoo.com/sectors/technology/articles/openai-just-launched-consulting-arm-151515870.html
2026-05-11 15:15:28+00:00,AMAT,Barchart,Stocks Supported by Strong Earnings and AI Optimism,https://finance.yahoo.com/markets/stocks/articles/stocks-supported-strong-earnings-ai-151528850.html
2026-05-11 15:15:28+00:00,STX,Barchart,Stocks Supported by Strong Earnings and AI Optimism,https://finance.yahoo.com/markets/stocks/articles/stocks-supported-strong-earnings-ai-151528850.html
2026-05-11 15:15:28+00:00,KLAC,Barchart,Stocks Supported by Strong Earnings and AI Optimism,https://finance.yahoo.com/markets/stocks/articles/stocks-supported-strong-earnings-ai-151528850.html
2026-05-11 15:15:28+00:00,WDC,Barchart,Stocks Supported by Strong Earnings and AI Optimism,https://finance.yahoo.com/markets/stocks/articles/stocks-supported-strong-earnings-ai-151528850.html
2026-05-11 15:15:28+00:00,LRCX,Barchart,Stocks Supported by Strong Earnings and AI Optimism,https://finance.yahoo.com/markets/stocks/articles/stocks-supported-strong-earnings-ai-151528850.html
2026-05-11 15:15:28+00:00,TXN,Barchart,Stocks Supported by Strong Earnings and AI Optimism,https://finance.yahoo.com/markets/stocks/articles/stocks-supported-strong-earnings-ai-151528850.html
2026-05-11 15:19:57+00:00,FTNT,Insider Monkey,Fortinet (FTNT) Could Be A Stock Part Of The AI ‘Endgame’,https://finance.yahoo.com/markets/stocks/articles/fortinet-ftnt-could-stock-part-151957835.html
2026-05-11 15:28:36+00:00,MELI,Insider Monkey,MercadoLibre (MELI) Believed To Be Powering Commerce Across An Entire Continent,https://finance.yahoo.com/markets/stocks/articles/mercadolibre-meli-believed-powering-commerce-152836324.html
2026-05-11 15:29:48+00:00,AMZN,Insider Monkey,"Taiwan Semiconductor (TSM) Is Just Rolling In Billions Of Dollars, Says Newsletter",https://finance.yahoo.com/markets/stocks/articles/taiwan-semiconductor-tsm-just-rolling-152948583.html
2026-05-11 15:30:00+00:00,SBUX,Yahoo Finance Video,When will a Dutch Bros pop up in NYC? CEO talks chain's expansion,https://finance.yahoo.com/video/dutch-bros-pop-nyc-ceo-153000440.html
2026-05-11 15:30:55+00:00,SNDK,Investor's Business Daily,Chipmaker Cerebras Upsizes IPO Amid AI Stocks Boom,https://www.investors.com/news/technology/ai-stocks-cerebras-ipo-cbrs-stock/?src=A00220&yptr=yahoo
2026-05-11 15:30:55+00:00,AMD,Investor's Business Daily,Chipmaker Cerebras Upsizes IPO Amid AI Stocks Boom,https://www.investors.com/news/technology/ai-stocks-cerebras-ipo-cbrs-stock/?src=A00220&yptr=yahoo
2026-05-11 15:32:00+00:00,TMUS,Zacks,3 Wireless Stocks Likely to Thrive Despite Short-Term Challenges,https://finance.yahoo.com/markets/stocks/articles/3-wireless-stocks-likely-thrive-153200526.html
2026-05-11 15:34:34+00:00,DASH,Benzinga,"Meta, DoorDash Could Help Drive Stablecoins to $4 Trillion, Bitwise Investment Chief Says",https://finance.yahoo.com/markets/crypto/articles/meta-doordash-could-help-drive-153434694.html
2026-05-11 15:34:34+00:00,TSLA,Benzinga,"Meta, DoorDash Could Help Drive Stablecoins to $4 Trillion, Bitwise Investment Chief Says",https://finance.yahoo.com/markets/crypto/articles/meta-doordash-could-help-drive-153434694.html
2026-05-11 15:37:00+00:00,PLTR,Motley Fool,Palantir Technologies Has Just Created History. Here's Where the Stock Could Be in 5 Years,https://finance.yahoo.com/markets/stocks/articles/palantir-technologies-just-created-history-153700151.html
2026-05-11 15:45:00+00:00,AMZN,WSJ,Why Companies Are Racing to Put Satellites in Low-Earth Orbit,https://finance.yahoo.com/video/why-companies-racing-put-satellites-154500058.html
2026-05-11 15:47:50+00:00,NVDA,Yahoo Finance,Intel stock rises as CEO Lip-Bu Tan touts 'exciting new products' with Nvidia,https://finance.yahoo.com/news/intel-stock-rises-as-ceo-lip-bu-tan-touts-exciting-new-products-with-nvidia-154750079.html
2026-05-11 15:47:50+00:00,INTC,Yahoo Finance,Intel stock rises as CEO Lip-Bu Tan touts 'exciting new products' with Nvidia,https://finance.yahoo.com/news/intel-stock-rises-as-ceo-lip-bu-tan-touts-exciting-new-products-with-nvidia-154750079.html
2026-05-11 15:52:00+00:00,CSCO,Zacks,3 Stocks to Consider From a Flourishing Networking Industry,https://finance.yahoo.com/markets/stocks/articles/3-stocks-consider-flourishing-networking-155200433.html
2026-05-11 15:52:20+00:00,CSCO,Trefis,Arista Networks: Bridging the Gap To $200,https://finance.yahoo.com/markets/stocks/articles/arista-networks-bridging-gap-200-155220867.html
2026-05-11 15:59:00+00:00,AMAT,Zacks,"AMAT to Post Q2 Earnings: Time to Buy, Sell or Hold the Stock?",https://finance.yahoo.com/markets/stocks/articles/amat-post-q2-earnings-time-155900311.html
2026-05-11 15:59:00+00:00,KLAC,Zacks,"AMAT to Post Q2 Earnings: Time to Buy, Sell or Hold the Stock?",https://finance.yahoo.com/markets/stocks/articles/amat-post-q2-earnings-time-155900311.html
2026-05-11 15:59:00+00:00,LRCX,Zacks,"AMAT to Post Q2 Earnings: Time to Buy, Sell or Hold the Stock?",https://finance.yahoo.com/markets/stocks/articles/amat-post-q2-earnings-time-155900311.html
2026-05-11 15:59:25+00:00,AMZN,Barchart,"Dear Plug Power Stock Fans, Mark Your Calendars for May 11",https://finance.yahoo.com/markets/stocks/articles/dear-plug-power-stock-fans-155925350.html
2026-05-11 15:59:25+00:00,WMT,Barchart,"Dear Plug Power Stock Fans, Mark Your Calendars for May 11",https://finance.yahoo.com/markets/stocks/articles/dear-plug-power-stock-fans-155925350.html
2026-05-11 16:00:00+00:00,TSLA,TechCrunch,"‘Too early’ to talk IPO, Redwood Materials’ incoming CFO says",https://finance.yahoo.com/markets/stocks/articles/too-early-talk-ipo-redwood-160000892.html
2026-05-11 16:00:00+00:00,WMT,Business Wire,"Rogue Raises $2.5M and Secures Launch in 2,800 Walmart Stores Nationwide",https://finance.yahoo.com/markets/stocks/articles/rogue-raises-2-5m-secures-160000226.html
2026-05-11 16:00:17+00:00,PLTR,GuruFocus.com,Palantir faces renewed scrutiny over NHS data access,https://finance.yahoo.com/sectors/healthcare/articles/palantir-faces-renewed-scrutiny-over-160017296.html
2026-05-11 16:04:40+00:00,AMD,reddit.com/r/stocks,"AMD has gone up so much that I don’t even know what to do anymore. - I bought some AMD when it was still much lower. At the time, I didn’t overthink it. I just liked the company’s products and believed it had a real long-term chance to challenge bigger competitors, so I bought as much as I was comfortable holding. I didn’t expect it to keep climbing like this over the years. Now it",
2026-05-11 16:04:40+00:00,FAST,reddit.com/r/stocks,"AMD has gone up so much that I don’t even know what to do anymore. - I bought some AMD when it was still much lower. At the time, I didn’t overthink it. I just liked the company’s products and believed it had a real long-term chance to challenge bigger competitors, so I bought as much as I was comfortable holding. I didn’t expect it to keep climbing like this over the years. Now it",
2026-05-11 16:05:00+00:00,SNDK,Motley Fool,6 Billion Reasons to Buy This Dirt Cheap Artificial Intelligence (AI) Memory Stock Hand Over Fist,https://finance.yahoo.com/markets/stocks/articles/6-billion-reasons-buy-dirt-160500828.html
2026-05-11 16:13:02+00:00,AMD,MT Newswires,AI Chipmaker Cerebras Could Raise Up To $5.52 Billion in Upsized IPO,https://finance.yahoo.com/markets/stocks/articles/ai-chipmaker-cerebras-could-raise-161302800.html
2026-05-11 16:13:02+00:00,AMZN,MT Newswires,AI Chipmaker Cerebras Could Raise Up To $5.52 Billion in Upsized IPO,https://finance.yahoo.com/markets/stocks/articles/ai-chipmaker-cerebras-could-raise-161302800.html
