timestamp,ticker,source,text,url
2026-04-28 09:19:45+00:00,MAR,Hotel Dive,Driftwood Hospitality Management appoints new CEO,https://finance.yahoo.com/sectors/technology/articles/driftwood-hospitality-management-appoints-ceo-091945970.html
2026-04-28 09:30:00+00:00,WDAY,PR Newswire,Workday Government Unveils Personnel Action Request (PAR) Agent to Modernize Federal HR and Strengthen Mission Readiness,https://finance.yahoo.com/sectors/technology/articles/workday-government-unveils-personnel-action-093000777.html
2026-04-28 10:04:15+00:00,CHTR,Simply Wall St.,"Charter Communications, Inc. Earnings Missed Analyst Estimates: Here's What Analysts Are Forecasting Now",https://finance.yahoo.com/markets/stocks/articles/charter-communications-inc-earnings-missed-100415420.html
2026-04-28 10:25:23+00:00,CDNS,MT Newswires,Cadence Raises 2026 Revenue Outlook Following First-Quarter Beat,https://finance.yahoo.com/markets/stocks/articles/cadence-raises-2026-revenue-outlook-102523152.html
2026-04-28 11:00:00+00:00,HON,PR Newswire,Honeywell Announces Board of Directors for Honeywell Aerospace,https://finance.yahoo.com/markets/stocks/articles/honeywell-announces-board-directors-honeywell-110000902.html
2026-04-28 11:00:11+00:00,MPWR,Simply Wall St.,Monolithic Power Systems Insiders Sold US$383m Of Shares Suggesting Hesitancy,https://finance.yahoo.com/markets/stocks/articles/monolithic-power-systems-insiders-sold-110011491.html
2026-04-28 11:05:08+00:00,DXCM,Simply Wall St.,Is DexCom (DXCM) Now Fairly Priced After Recent Share Price Weakness?,https://finance.yahoo.com/markets/stocks/articles/dexcom-dxcm-now-fairly-priced-110508919.html
2026-04-28 11:12:00+00:00,MCHP,GlobeNewswire,Microchip Expands its Family of Post-Quantum‑Ready Root of Trust Controllers for Next‑Generation Systems,https://finance.yahoo.com/sectors/technology/articles/microchip-expands-family-post-quantum-111200788.html
2026-04-28 11:18:08+00:00,AXON,Investor's Business Daily,Investors Worry About Mounting Debt — 7 S&P 500 Companies Owe Most,https://www.investors.com/etfs-and-funds/sectors/sp500-investors-worry-about-mounting-debt-companies-owe-most/?src=A00220&yptr=yahoo
2026-04-28 11:21:24+00:00,CDNS,MT Newswires,Stocks Mostly Down Pre-Bell as Traders Monitor Developments on US-Iran Negotiations; Fed Policy Meeting on Deck,https://finance.yahoo.com/markets/stocks/articles/stocks-mostly-down-pre-bell-112124475.html
2026-04-28 11:38:16+00:00,ALNY,Simply Wall St.,Ligand Pharmaceuticals And 2 Other Stocks That May Be Trading At An Estimated Discount,https://finance.yahoo.com/markets/stocks/articles/ligand-pharmaceuticals-2-other-stocks-113816237.html
2026-04-28 11:51:28+00:00,WBD,Barchart,Warner Bros. Discovery Stock: Is Wall Street Bullish or Bearish?,https://finance.yahoo.com/markets/stocks/articles/warner-bros-discovery-stock-wall-115128266.html
2026-04-28 11:57:57+00:00,ODFL,24/7 Wall St.,"Here Are Tuesday’s Top Wall Street Analyst Research Calls: American Homes 4 Rent, BP, Fortis, International Business Machines, Micron Technology, Nucor, Opendoor Technologies, Rambus, and More",https://finance.yahoo.com/markets/stocks/articles/tuesday-top-wall-street-analyst-115757508.html
2026-04-28 11:58:00+00:00,MCHP,Zacks,AI and Earnings Set Semiconductor Stocks on Record Rally: 5 Top Picks,https://finance.yahoo.com/markets/stocks/articles/ai-earnings-set-semiconductor-stocks-115800619.html
2026-04-28 11:58:00+00:00,ADI,Zacks,AI and Earnings Set Semiconductor Stocks on Record Rally: 5 Top Picks,https://finance.yahoo.com/markets/stocks/articles/ai-earnings-set-semiconductor-stocks-115800619.html
2026-04-28 12:00:00+00:00,MAR,PR Newswire,Noble Acquires Ten-Hotel Upscale Select-Service and Upscale Extended-Stay Portfolio,https://finance.yahoo.com/markets/stocks/articles/noble-acquires-ten-hotel-upscale-120000204.html
2026-04-28 12:00:00+00:00,PCAR,Business Wire,PACCAR Achieves Good Financial Performance,https://finance.yahoo.com/markets/stocks/articles/paccar-achieves-good-financial-performance-120000603.html
2026-04-28 12:00:00+00:00,ROP,PR Newswire,PCS Software Integrates DAT One Load Board Directly into Cortex Opportunity Manager and Backhaul Booster,https://finance.yahoo.com/sectors/technology/articles/pcs-software-integrates-dat-one-120000672.html
2026-04-28 12:08:00+00:00,MELI,Motley Fool,3 Top Bargain Stocks Ready for a Bull Run in 2026,https://finance.yahoo.com/markets/stocks/articles/3-top-bargain-stocks-ready-120800842.html
2026-04-28 12:10:00+00:00,ISRG,GlobeNewswire,Medical Robotics Market Size to Grow USD 102.75 Billion by 2035 | Research by SNS Insider,https://finance.yahoo.com/sectors/healthcare/articles/medical-robotics-market-size-grow-121000276.html
2026-04-28 12:13:16+00:00,BKR,Euronews,Qatar pushes ahead with North Field expansion despite LNG disruptions,https://finance.yahoo.com/sectors/energy/articles/qatar-pushes-ahead-north-field-121316701.html
2026-04-28 12:13:29+00:00,MNST,24/7 Wall St.,Warren Buffett Owns 3 Strong Buy Dividend Aristocrat Giants—1 for Almost 40 Years,https://finance.yahoo.com/markets/stocks/articles/warren-buffett-owns-3-strong-121329827.html
2026-04-28 12:13:47+00:00,PCAR,StockStory,PACCAR (NASDAQ:PCAR) Misses Q1 CY2026 Revenue Estimates,https://finance.yahoo.com/markets/stocks/articles/paccar-nasdaq-pcar-misses-q1-121347774.html
2026-04-28 12:15:00+00:00,ADP,PR Newswire,"ADP National Employment Report Preliminary Estimate for April 28, 2026",https://finance.yahoo.com/economy/articles/adp-national-employment-report-preliminary-121500241.html
2026-04-28 12:15:00+00:00,CTSH,GlobeNewswire,ExamWorks Announces Appointment of Isabelle Winkles as Chief Financial Officer to Support Continued Growth and Strategic Execution,https://finance.yahoo.com/markets/stocks/articles/examworks-announces-appointment-isabelle-winkles-121500095.html
2026-04-28 12:25:44+00:00,MELI,Motley Fool,"Investment Advisor Exits $47.5 Million MercadoLibre Position, According to Latest SEC Filing",https://finance.yahoo.com/markets/stocks/articles/investment-advisor-exits-47-5-122544520.html
2026-04-28 12:30:00+00:00,CDNS,Moby,"Cadence Design Systems, Inc. Q1 2026 Earnings Call Summary",https://finance.yahoo.com/markets/stocks/articles/cadence-design-systems-inc-q1-123000194.html
2026-04-28 12:53:44+00:00,CCEP,MarketBeat,Coca-Cola Europacific Partners Q1 Earnings Call Highlights,https://finance.yahoo.com/markets/stocks/articles/coca-cola-europacific-partners-q1-125344279.html
2026-04-28 12:53:45+00:00,AEP,MarketBeat,"American Electric Power Shareholders Approve All Proposals, Re-Elect Directors at Annual Meeting",https://finance.yahoo.com/sectors/energy/articles/american-electric-power-shareholders-approve-125345703.html
2026-04-28 13:00:00+00:00,APP,GlobeNewswire,"New Engen Introduces “Camp New Engen,” Bringing Together Top Marketing Leaders for a Curated Summit at Calamigos Ranch",https://finance.yahoo.com/sectors/technology/articles/engen-introduces-camp-engen-bringing-130000306.html
2026-04-28 13:00:00+00:00,CMCSA,Business Wire,"Xfinity High-Speed Internet Coming to More Residents in Caroline County, Virginia",https://finance.yahoo.com/sectors/technology/articles/xfinity-high-speed-internet-coming-130000446.html
2026-04-28 13:00:00+00:00,FTNT,GlobeNewswire,Fortinet Report Reveals Cybersecurity Hiring Stalls as Nearly Half of IT Leaders Face Corporate Pushback,https://finance.yahoo.com/sectors/technology/articles/fortinet-report-reveals-cybersecurity-hiring-130000925.html
2026-04-28 13:00:00+00:00,EA,GlobeNewswire,iQor Gaming Veteran John Pompei to Lead Player Experience Panel at Live Service Gaming Summit North America,https://finance.yahoo.com/sectors/technology/articles/iqor-gaming-veteran-john-pompei-130000648.html
2026-04-28 13:00:05+00:00,KHC,Zacks,These 2 Consumer Staples Stocks Could Beat Earnings: Why They Should Be on Your Radar,https://finance.yahoo.com/markets/stocks/articles/2-consumer-staples-stocks-could-130005613.html
2026-04-28 13:03:00+00:00,ADBE,Business Wire,Alluvium and Adobe Partner to Advance Supply and Demand Intelligence for Health Systems,https://finance.yahoo.com/sectors/healthcare/articles/alluvium-adobe-partner-advance-supply-130300146.html
2026-04-28 13:06:43+00:00,ISRG,Simply Wall St.,How Strong Q1 2026 Results and Completed Buyback Will Impact Intuitive Surgical (ISRG) Investors,https://finance.yahoo.com/markets/stocks/articles/strong-q1-2026-results-completed-130643000.html
2026-04-28 13:14:51+00:00,VRTX,Insider Monkey,Conestoga Capital Advisors Exited Vertex (VRTX) as the Valuation No Longer Reflects a Favorable Risk-Reward,https://finance.yahoo.com/markets/stocks/articles/conestoga-capital-advisors-exited-vertex-131451479.html
2026-04-28 13:15:04+00:00,XEL,Zacks,Gear Up for Xcel (XEL) Q1 Earnings: Wall Street Estimates for Key Metrics,https://finance.yahoo.com/markets/stocks/articles/gear-xcel-xel-q1-earnings-131504098.html
2026-04-28 13:15:05+00:00,ODFL,Zacks,Countdown to Old Dominion (ODFL) Q1 Earnings: A Look at Estimates Beyond Revenue and EPS,https://finance.yahoo.com/markets/stocks/articles/countdown-old-dominion-odfl-q1-131505440.html
2026-04-28 13:17:00+00:00,CDNS,Zacks,"Cadence Q1 Earnings Top Estimates, 2026 Revenue Outlook Raised",https://finance.yahoo.com/markets/stocks/articles/cadence-q1-earnings-top-estimates-131700486.html
2026-04-28 13:20:00+00:00,KHC,Motley Fool,Is This Buffett‑Backed Monster Dividend Stock Going to $0?,https://finance.yahoo.com/markets/stocks/articles/buffett-backed-monster-dividend-stock-132000890.html
2026-04-28 13:30:02+00:00,SNPS,Barchart,Micron Has Been on an Explosive 557% Run Higher. It’s Still 1 of the Cheapest Semiconductor Stocks to Buy Now.,https://finance.yahoo.com/markets/stocks/articles/micron-explosive-557-run-higher-133002674.html
2026-04-28 13:30:09+00:00,PCAR,Zacks,Paccar (PCAR) Reports Q1 Earnings: What Key Metrics Have to Say,https://finance.yahoo.com/markets/stocks/articles/paccar-pcar-reports-q1-earnings-133009262.html
2026-04-28 13:40:00+00:00,WDAY,CNW Group,Workday Named a 2026 LinkedIn Top Company in Canada for the Fourth Consecutive Year,https://finance.yahoo.com/sectors/technology/articles/workday-named-2026-linkedin-top-134000566.html
2026-04-28 13:55:02+00:00,ROP,Zacks,Wall Street Analysts See a 27.9% Upside in Roper Technologies (ROP): Can the Stock Really Move This High?,https://finance.yahoo.com/markets/stocks/articles/wall-street-analysts-see-27-135502678.html
2026-04-28 14:00:08+00:00,AEP,Zacks,American Electric Power (AEP) Earnings Expected to Grow: What to Know Ahead of Next Week's Release,https://finance.yahoo.com/markets/stocks/articles/american-electric-power-aep-earnings-140008520.html
2026-04-28 14:00:16+00:00,TRI,Zacks,Thomson Reuters (TRI) Reports Next Week: Wall Street Expects Earnings Growth,https://finance.yahoo.com/markets/stocks/articles/thomson-reuters-tri-reports-next-140016518.html
2026-04-28 14:00:27+00:00,IDXX,Zacks,Idexx Laboratories (IDXX) Reports Next Week: Wall Street Expects Earnings Growth,https://finance.yahoo.com/markets/stocks/articles/idexx-laboratories-idxx-reports-next-140027793.html
2026-04-28 14:00:29+00:00,VRTX,Zacks,Analysts Estimate Myriad Genetics (MYGN) to Report a Decline in Earnings: What to Look Out for,https://finance.yahoo.com/markets/stocks/articles/analysts-estimate-myriad-genetics-mygn-140029313.html
2026-04-28 14:15:00+00:00,INTU,Motley Fool,PayPal Trades at Under 10X Earnings -- Is the Stock Cheap for a Reason?,https://finance.yahoo.com/markets/stocks/articles/paypal-trades-under-10x-earnings-141500546.html
2026-04-28 14:19:52+00:00,ODFL,The Fly,"Micron initiated, Rambus downgraded: Wall Street's top analyst calls",https://finance.yahoo.com/markets/stocks/articles/micron-initiated-rambus-downgraded-wall-141952763.html
2026-04-28 14:41:00+00:00,LIN,Zacks,Linde Gears Up to Report Q1 Earnings: What's in the Offing?,https://finance.yahoo.com/markets/stocks/articles/linde-gears-report-q1-earnings-144100379.html
2026-04-28 14:49:55+00:00,TXN,Trefis,Is Rambus Stock An AI Growth Mirage?,https://finance.yahoo.com/markets/stocks/articles/rambus-stock-ai-growth-mirage-144955297.html
2026-04-28 14:49:55+00:00,ADI,Trefis,Is Rambus Stock An AI Growth Mirage?,https://finance.yahoo.com/markets/stocks/articles/rambus-stock-ai-growth-mirage-144955297.html
2026-04-28 14:53:09+00:00,WBD,GuruFocus.com,Paramount Skydance Seeks FCC Approval for Foreign Backers,https://finance.yahoo.com/markets/stocks/articles/paramount-skydance-seeks-fcc-approval-145309810.html
2026-04-28 15:00:55+00:00,ODFL,StockStory,What To Expect From Old Dominion Freight Line’s (ODFL) Q1 Earnings,https://finance.yahoo.com/markets/stocks/articles/expect-old-dominion-freight-line-150055457.html
2026-04-28 15:04:58+00:00,ADBE,Simply Wall St.,Adobe Semrush Deal Aims To Recast AI Marketing And Search Workflows,https://finance.yahoo.com/markets/stocks/articles/adobe-semrush-deal-aims-recast-150458558.html
2026-04-28 15:06:27+00:00,TXN,Simply Wall St.,Is It Too Late To Consider Texas Instruments (TXN) After Its 71% One Year Rally?,https://finance.yahoo.com/markets/stocks/articles/too-consider-texas-instruments-txn-150627921.html
2026-04-28 15:08:00+00:00,XEL,Zacks,Xcel Energy to Post Q1 Earnings: What's in Store for the Stock?,https://finance.yahoo.com/markets/stocks/articles/xcel-energy-post-q1-earnings-150800160.html
2026-04-28 15:25:51+00:00,LIN,Trefis,What’s Really Behind Plug Power’s 40% Jump?,https://finance.yahoo.com/markets/stocks/articles/really-behind-plug-power-40-152551332.html
2026-04-28 15:29:00+00:00,WDAY,GlobeNewswire,"Employee Performance Management Market - Global Forecast to 2030 with Strategic Disruption Through Technology, Patents, Digital, and AI Adoption",https://finance.yahoo.com/sectors/technology/articles/employee-performance-management-market-global-152900781.html
2026-04-28 15:40:46+00:00,FTNT,Barchart,What Are Wall Street Analysts' Target Price for Fortinet Stock?,https://finance.yahoo.com/markets/stocks/articles/wall-street-analysts-target-price-154046784.html
2026-04-28 15:46:00+00:00,TXN,PR Newswire,Texas Instruments launches the TI-84 Evo Graphing Calculator -- the most advanced TI-84 ever built,https://finance.yahoo.com/sectors/technology/articles/texas-instruments-launches-ti-84-154600579.html
2026-04-28 15:46:28+00:00,ADP,MT Newswires,"Automatic Data Processing Poised for Modest Beat in Fiscal Q3, RBC Says",https://finance.yahoo.com/markets/stocks/articles/automatic-data-processing-poised-modest-154628686.html
2026-04-28 15:54:05+00:00,CDNS,MT Newswires,"Cadence Seen Delivering Stronger Growth After Guidance Raise, BofA Says",https://finance.yahoo.com/markets/stocks/articles/cadence-seen-delivering-stronger-growth-155405689.html
2026-04-28 16:00:00+00:00,MPWR,Zacks,Will Higher Y/Y Revenues Lift Monolithic Power's Q1 Earnings?,https://finance.yahoo.com/markets/stocks/articles/higher-y-y-revenues-lift-160000993.html
2026-04-28 16:02:00+00:00,PCAR,Zacks,PCAR Q1 Earnings Surpass Estimates on Higher Parts Profit,https://finance.yahoo.com/markets/stocks/articles/pcar-q1-earnings-surpass-estimates-160200091.html
2026-04-28 16:08:01+00:00,PCAR,MarketBeat,PACCAR Q1 Earnings Call Highlights,https://finance.yahoo.com/markets/stocks/articles/paccar-q1-earnings-call-highlights-160801008.html
2026-04-28 16:11:00+00:00,CTSH,PR Newswire,Cognizant's Innovation Network a Fast Track to Enterprise Value,https://finance.yahoo.com/sectors/technology/articles/cognizants-innovation-network-fast-track-161100385.html
2026-04-28 16:12:00+00:00,GILD,Zacks,Amgen to Report Q1 Earnings: Can It Keep the Beat Streak Alive?,https://finance.yahoo.com/sectors/healthcare/articles/amgen-report-q1-earnings-keep-161200283.html
2026-04-28 16:31:58+00:00,PCAR,Motley Fool,Paccar (PCAR) Q1 2026 Earnings Call Transcript,https://finance.yahoo.com/markets/stocks/articles/paccar-pcar-q1-2026-earnings-163158912.html
2026-04-28 16:34:00+00:00,VRTX,Zacks,Vertex Gears Up to Report Q1 Earnings: What Investors Can Expect,https://finance.yahoo.com/sectors/healthcare/articles/vertex-gears-report-q1-earnings-163400532.html
2026-04-28 16:34:00+00:00,ORLY,Motley Fool,Meet the Market Outperformer That Doubled the S&P 500's Total Return in the Past 5 Years (Hint: It's Not an AI Stock),https://finance.yahoo.com/markets/stocks/articles/meet-market-outperformer-doubled-p-163400458.html
2026-04-28 16:34:44+00:00,CMCSA,Barchart,Comcast Stock: Is Wall Street Bullish or Bearish?,https://finance.yahoo.com/markets/stocks/articles/comcast-stock-wall-street-bullish-163444925.html
2026-04-28 16:52:45+00:00,PCAR,Moby,PACCAR Inc Q1 2026 Earnings Call Summary,https://finance.yahoo.com/markets/stocks/articles/paccar-inc-q1-2026-earnings-165245419.html
2026-04-28 16:52:55+00:00,ISRG,StockStory,5 Revealing Analyst Questions From Intuitive Surgical’s Q1 Earnings Call,https://finance.yahoo.com/markets/stocks/articles/5-revealing-analyst-questions-intuitive-165255770.html
2026-04-28 17:07:24+00:00,WBD,Simply Wall St.,Warner Bros. Discovery (WBD) Valuation Check As Market Signals Clash With Cash Flow Estimates,https://finance.yahoo.com/markets/stocks/articles/warner-bros-discovery-wbd-valuation-170724225.html
2026-04-28 17:12:08+00:00,KHC,Just Food,Why tactical moves on price are no substitute for strategy,https://finance.yahoo.com/economy/policy/articles/why-tactical-moves-price-no-104954685.html
2026-04-28 17:16:55+00:00,ORLY,StockStory,O'Reilly Earnings: What To Look For From ORLY,https://finance.yahoo.com/markets/stocks/articles/oreilly-earnings-look-orly-171655544.html
2026-04-28 17:20:00+00:00,CRWD,Motley Fool,2 Glorious Growth Stocks to Buy Even With the S&P 500 at a Record High,https://finance.yahoo.com/markets/stocks/articles/2-glorious-growth-stocks-buy-172000267.html
2026-04-28 17:22:00+00:00,INTU,Zacks,Intuit vs. BILL Holdings: Which Fintech Stock is the Better Buy?,https://finance.yahoo.com/markets/stocks/articles/intuit-vs-bill-holdings-fintech-172200118.html
2026-04-28 17:22:00+00:00,CEG,Business Wire,Constellation Energy Corporation Declares Dividend,https://finance.yahoo.com/sectors/energy/articles/constellation-energy-corporation-declares-dividend-172200389.html
2026-04-28 17:35:58+00:00,APP,Simply Wall St.,Three Insider-Favored Growth Companies With High Ownership,https://finance.yahoo.com/markets/stocks/articles/three-insider-favored-growth-companies-173558668.html
2026-04-28 17:38:21+00:00,ALNY,Simply Wall St.,3 Stocks Estimated To Be Trading Up To 43% Below Intrinsic Value,https://finance.yahoo.com/markets/stocks/articles/3-stocks-estimated-trading-43-173821957.html
2026-04-28 17:39:33+00:00,KDP,24/7 Wall St.,"Coca-Cola Pops 6% on Q1 Beat: Are KO, PEP, and KDP the Best Defensive Plays Right Now?",https://finance.yahoo.com/markets/stocks/articles/coca-cola-pops-6-q1-173933514.html
2026-04-28 17:50:00+00:00,AEP,PR Newswire,AEP Declares Quarterly Dividend on Common Stock,https://finance.yahoo.com/markets/stocks/articles/aep-declares-quarterly-dividend-common-175000174.html
2026-04-28 18:03:00+00:00,TXN,TheStreet,Morgan Stanley sends blunt message on Texas Instruments' surge,https://finance.yahoo.com/markets/stocks/articles/morgan-stanley-sends-blunt-message-180300415.html
2026-04-28 18:07:42+00:00,CRWD,Simply Wall St.,A Look At CrowdStrike (CRWD) Valuation After Mizuho Upgrade And AI Cybersecurity Momentum,https://finance.yahoo.com/markets/stocks/articles/look-crowdstrike-crwd-valuation-mizuho-180742399.html
2026-04-28 18:13:03+00:00,BKR,Insider Monkey,Baker Hughes (BKR) Delivers Strong Q1 Results Despite Middle East Disruptions,https://finance.yahoo.com/sectors/energy/articles/baker-hughes-bkr-delivers-strong-181303473.html
2026-04-28 18:31:00+00:00,KHC,Motley Fool,Kraft Heinz Was a Rare Buffett Blunder. Now Berkshire's New Boss Looks Ready to Move On.,https://finance.yahoo.com/markets/stocks/articles/kraft-heinz-rare-buffett-blunder-183100302.html
2026-04-28 18:38:48+00:00,LRCX,Quartz,U.S. halts chip equipment shipments to China's Hua Hong,https://finance.yahoo.com/sectors/technology/articles/u-halts-chip-equipment-shipments-183848867.html
2026-04-28 18:44:52+00:00,AMAT,Barchart,"As OpenAI Drags Down Chip Stocks, Is Applied Materials Stock a Buy, Sell, or Hold?",https://finance.yahoo.com/markets/stocks/articles/openai-drags-down-chip-stocks-184452116.html
2026-04-28 19:28:00+00:00,TXN,Motley Fool,"Is AMD Stock Buy, Sell, or Hold?",https://finance.yahoo.com/markets/stocks/articles/amd-stock-buy-sell-hold-192800607.html
2026-04-28 19:45:11+00:00,AMAT,MT Newswires,Sector Update: Tech Stocks Fall Late Afternoon,https://finance.yahoo.com/markets/stocks/articles/sector-tech-stocks-fall-afternoon-194511362.html
2026-04-28 19:45:11+00:00,LRCX,MT Newswires,Sector Update: Tech Stocks Fall Late Afternoon,https://finance.yahoo.com/markets/stocks/articles/sector-tech-stocks-fall-afternoon-194511362.html
2026-04-28 19:47:00+00:00,TXN,TheStreet,Bank of America revamps Texas Instruments stock price target,https://finance.yahoo.com/markets/stocks/articles/bank-america-revamps-texas-instruments-194700860.html
2026-04-28 19:53:13+00:00,AMAT,MT Newswires,"US Equity Indexes Decline Amid Sharp Sell-Off in Semiconductors, Rising Crude Oil",https://finance.yahoo.com/markets/stocks/articles/us-equity-indexes-decline-amid-195313379.html
2026-04-28 19:57:15+00:00,WBD,LA Times,Paramount wants FCC to approve increased foreign ownership in Warner Bros. Discovery deal,https://finance.yahoo.com/economy/policy/articles/paramount-wants-fcc-approve-increased-195715279.html
2026-04-28 20:04:00+00:00,CSGP,Business Wire,"CoStar Group Q1 2026 Revenue Grows 23% Year-over-Year to $897 Million, Increases From $732 Million in Q1 2025, Annualized Net New Bookings of $67 Million, up 20% Year-over-Year",https://finance.yahoo.com/markets/stocks/articles/costar-group-q1-2026-revenue-200400629.html
2026-04-28 20:05:00+00:00,MDLZ,GlobeNewswire,Mondelēz International Reports Q1 2026 Results,https://finance.yahoo.com/markets/stocks/articles/mondel-z-international-reports-q1-200500104.html
2026-04-28 20:10:37+00:00,LRCX,MT Newswires,"US Equity Markets End Lower as Chipmakers Slide, Middle East Tensions Lift Oil",https://finance.yahoo.com/markets/stocks/articles/us-equity-markets-end-lower-201037663.html
2026-04-28 20:10:37+00:00,AMAT,MT Newswires,"US Equity Markets End Lower as Chipmakers Slide, Middle East Tensions Lift Oil",https://finance.yahoo.com/markets/stocks/articles/us-equity-markets-end-lower-201037663.html
2026-04-28 20:28:50+00:00,ASML,Motley Fool,Why ASML Holdings Fell Today,https://finance.yahoo.com/markets/stocks/articles/why-asml-holdings-fell-today-202850944.html
2026-04-28 20:30:00+00:00,TRI,CNW Group,Thomson Reuters Announces Voting Results of Return of Capital and Share Consolidation Transactions,https://finance.yahoo.com/markets/stocks/articles/thomson-reuters-announces-voting-results-203000526.html
2026-04-28 20:31:32+00:00,MDLZ,StockStory,Mondelez’s (NASDAQ:MDLZ) Q1 CY2026: Beats On Revenue,https://finance.yahoo.com/markets/stocks/articles/mondelez-nasdaq-mdlz-q1-cy2026-203132761.html
2026-04-28 20:34:00+00:00,EXC,Business Wire,Exelon Corporation Declares Dividend,https://finance.yahoo.com/markets/stocks/articles/exelon-corporation-declares-dividend-203400897.html
2026-04-28 20:36:55+00:00,CDNS,StockStory,"CDNS Q1 Deep Dive: AI Demand Drives Growth, Margin Guidance Adjusts Post-Hexagon Acquisition",https://finance.yahoo.com/markets/stocks/articles/cdns-q1-deep-dive-ai-203655079.html
2026-04-28 20:49:10+00:00,AMAT,MT Newswires,US Equity Indexes Retreat as Sell-Off in Semiconductors Coincides With Surge in Crude Oil,https://finance.yahoo.com/markets/stocks/articles/us-equity-indexes-retreat-sell-204910382.html
2026-04-28 20:59:20+00:00,TXN,Reuters,"NXP Semiconductors forecasts strong quarterly results, shares jump",https://finance.yahoo.com/markets/stocks/articles/nxp-semiconductors-forecasts-strong-quarterly-205920227.html
2026-04-28 21:06:58+00:00,CSGP,StockStory,CoStar (NASDAQ:CSGP) Reports Q1 CY2026 In Line With Expectations But Stock Drops,https://finance.yahoo.com/markets/stocks/articles/costar-nasdaq-csgp-reports-q1-210658175.html
2026-04-28 21:15:01+00:00,PDD,Zacks,Booking Holdings (BKNG) Surpasses Q1 Earnings and Revenue Estimates,https://finance.yahoo.com/markets/stocks/articles/booking-holdings-bkng-surpasses-q1-211501043.html
2026-04-28 21:18:00+00:00,LRCX,Zacks,"Top Research Reports for Lam Research, BlackRock & Corning",https://finance.yahoo.com/markets/stocks/articles/top-research-reports-lam-research-211800605.html
2026-04-28 21:44:00+00:00,PCAR,Business Wire,PACCAR Increases Regular Quarterly Dividend,https://finance.yahoo.com/markets/stocks/articles/paccar-increases-regular-quarterly-dividend-214400038.html
2026-04-28 21:45:03+00:00,CSGP,Zacks,CoStar Group (CSGP) Surpasses Q1 Earnings Estimates,https://finance.yahoo.com/markets/stocks/articles/costar-group-csgp-surpasses-q1-214503460.html
2026-04-28 21:45:04+00:00,SNPS,Zacks,Why Synopsys (SNPS) Dipped More Than Broader Market Today,https://finance.yahoo.com/markets/stocks/articles/why-synopsys-snps-dipped-more-214504518.html
2026-04-28 21:45:05+00:00,ZS,Zacks,Zscaler (ZS) Advances While Market Declines: Some Information for Investors,https://finance.yahoo.com/markets/stocks/articles/zscaler-zs-advances-while-market-214505767.html
2026-04-28 21:45:06+00:00,MDLZ,Zacks,Mondelez (MDLZ) Q1 Earnings and Revenues Surpass Estimates,https://finance.yahoo.com/markets/stocks/articles/mondelez-mdlz-q1-earnings-revenues-214506541.html
2026-04-28 21:45:07+00:00,ADI,Zacks,NXP Semiconductors (NXPI) Q1 Earnings and Revenues Top Estimates,https://finance.yahoo.com/markets/stocks/articles/nxp-semiconductors-nxpi-q1-earnings-214507000.html
2026-04-28 21:50:04+00:00,WDAY,Zacks,Workday (WDAY) Increases Despite Market Slip: Here's What You Need to Know,https://finance.yahoo.com/markets/stocks/articles/workday-wday-increases-despite-market-215004978.html
