timestamp,ticker,source,text,url
2026-05-05 20:04:59+00:00,PYPL,Investor's Business Daily,PayPal Earnings Beat But New CEO's Commentary Sends Down Shares,https://www.investors.com/news/technology/paypal-stock-pypl-paypal-earnings-news-q12026/?src=A00220&yptr=yahoo
2026-05-05 20:05:00+00:00,EA,Business Wire,Electronic Arts Reports Q4 and FY26 Results,https://finance.yahoo.com/markets/stocks/articles/electronic-arts-reports-q4-fy26-200500365.html
2026-05-05 20:06:40+00:00,ASML,TechCrunch,ASML CEO Christophe Fouquet on his company’s monopoly: no one is coming for us,https://finance.yahoo.com/sectors/technology/articles/asml-ceo-christophe-fouquet-no-200640845.html
2026-05-05 20:08:51+00:00,PEP,Simply Wall St.,PepsiCo’s Health Push And Human-Rights Scrutiny Might Change The Case For Investing In PEP,https://finance.yahoo.com/markets/stocks/articles/pepsico-health-push-human-rights-200851366.html
2026-05-05 20:11:39+00:00,DASH,Simply Wall St.,DoorDash AI And SNAP Expansion Deepen Grocery Presence And Investor Story,https://finance.yahoo.com/markets/stocks/articles/doordash-ai-snap-expansion-deepen-201139376.html
2026-05-05 20:20:09+00:00,PYPL,MarketBeat,PayPal Q1 Earnings Call Highlights,https://finance.yahoo.com/markets/stocks/articles/paypal-q1-earnings-call-highlights-202009732.html
2026-05-05 20:20:56+00:00,IDXX,Investor's Business Daily,How Fluffy's Testing Service Outplayed Slow Vet Visits — Again,https://www.investors.com/news/technology/idexx-stock-idexx-laboratories-earnings-q1-2026/?src=A00220&yptr=yahoo
2026-05-05 20:22:34+00:00,VRTX,Investor's Business Daily,Vertex Dips On Mixed First-Quarter Report; But There's A Silver Lining,https://www.investors.com/news/technology/vertex-stock-vertex-pharmaceuticals-earnings-q1-2026/?src=A00220&yptr=yahoo
2026-05-05 20:23:39+00:00,EA,StockStory,Electronic Arts’s (NASDAQ:EA) Q1 CY2026: Beats On Revenue,https://finance.yahoo.com/markets/stocks/articles/electronic-arts-nasdaq-ea-q1-202339599.html
2026-05-05 20:24:47+00:00,AMGN,Investor's Business Daily,"How This Amgen Rival, Up 33%, Plans To Shake Its Grip In Thyroid Eye Disease",https://www.investors.com/news/technology/viridian-therapeutics-stock-amgen-tepezza-thryoid-eye-disease/?src=A00220&yptr=yahoo
2026-05-05 20:33:31+00:00,QCOM,Quartz,"AMD Q1 2026 earnings: Revenue up 38%, stock jumps 18%",https://finance.yahoo.com/markets/stocks/articles/amd-q1-2026-earnings-revenue-203331768.html
2026-05-05 20:33:31+00:00,ARM,Quartz,"AMD Q1 2026 earnings: Revenue up 38%, stock jumps 18%",https://finance.yahoo.com/markets/stocks/articles/amd-q1-2026-earnings-revenue-203331768.html
2026-05-05 20:37:22+00:00,AVGO,Reuters,"Anthropic commits to spending $200 billion on Google's cloud and chips, the Information reports",https://finance.yahoo.com/sectors/technology/articles/anthropic-commits-spending-200-billion-203722528.html
2026-05-05 20:38:19+00:00,CSCO,MT Newswires,"Nasdaq, S&P 500 Hit Fresh Peaks as Oil Retreats",https://finance.yahoo.com/markets/stocks/articles/nasdaq-p-500-hit-fresh-203819719.html
2026-05-05 20:38:19+00:00,SHOP,MT Newswires,"Nasdaq, S&P 500 Hit Fresh Peaks as Oil Retreats",https://finance.yahoo.com/markets/stocks/articles/nasdaq-p-500-hit-fresh-203819719.html
2026-05-05 20:42:03+00:00,QCOM,Yahoo Finance Video,AMD Q1 earnings: What the chipmaker's growth could mean for Nvidia,https://finance.yahoo.com/video/amd-q1-earnings-what-the-chipmakers-growth-could-mean-for-nvidia-204203602.html
2026-05-05 20:51:00+00:00,ADBE,Motley Fool,Adobe's $25 Billion Buyback Sends a Clear Signal. Yet Shares Remain Dirt Cheap.,https://finance.yahoo.com/markets/stocks/articles/adobes-25-billion-buyback-sends-205100758.html
2026-05-05 20:52:55+00:00,MAR,StockStory,Marriott (MAR) Reports Earnings Tomorrow: What To Expect,https://finance.yahoo.com/markets/stocks/articles/marriott-mar-reports-earnings-tomorrow-205255368.html
2026-05-05 20:54:55+00:00,SHOP,Investor's Business Daily,"Stock Market Today: Nasdaq, S&P 500 End At Record Highs As Techs Rise; Intel Shares Surge (Live Coverage)",https://www.investors.com/market-trend/stock-market-today/dow-jones-sp500-nasdaq-us-iran-tensions-palantir-stock-pltr/?src=A00220&yptr=yahoo
2026-05-05 20:54:55+00:00,PYPL,Investor's Business Daily,"Stock Market Today: Nasdaq, S&P 500 End At Record Highs As Techs Rise; Intel Shares Surge (Live Coverage)",https://www.investors.com/market-trend/stock-market-today/dow-jones-sp500-nasdaq-us-iran-tensions-palantir-stock-pltr/?src=A00220&yptr=yahoo
2026-05-05 21:04:02+00:00,TTWO,Reuters,Electronic Arts misses bookings estimates as 'Battlefield' engagement falls,https://finance.yahoo.com/markets/stocks/articles/electronic-arts-misses-bookings-estimates-210402772.html
2026-05-05 21:04:02+00:00,EA,Reuters,Electronic Arts misses bookings estimates as 'Battlefield' engagement falls,https://finance.yahoo.com/markets/stocks/articles/electronic-arts-misses-bookings-estimates-210402772.html
2026-05-05 21:07:06+00:00,TRI,MarketBeat,Thomson Reuters Q1 Earnings Call Highlights,https://finance.yahoo.com/markets/stocks/articles/thomson-reuters-q1-earnings-call-210706658.html
2026-05-05 21:08:00+00:00,WDC,Barrons.com,Sandisk Spun Off From Western Digital Last Year. Now It’s a $200 Billion Company.,https://www.barrons.com/articles/sandisk-stock-price-ai-memory-c5af95ae?siteid=yhoof2&yptr=yahoo
2026-05-05 21:08:00+00:00,SNDK,Barrons.com,Sandisk Spun Off From Western Digital Last Year. Now It’s a $200 Billion Company.,https://www.barrons.com/articles/sandisk-stock-price-ai-memory-c5af95ae?siteid=yhoof2&yptr=yahoo
2026-05-05 21:08:00+00:00,PEP,Barrons.com,Sandisk Spun Off From Western Digital Last Year. Now It’s a $200 Billion Company.,https://www.barrons.com/articles/sandisk-stock-price-ai-memory-c5af95ae?siteid=yhoof2&yptr=yahoo
2026-05-05 21:12:00+00:00,PYPL,Barrons.com,"These Stocks Are Today’s Movers: Intel, PayPal, Palantir, Shopify, Micron, Duolingo, and More",https://www.barrons.com/articles/stock-movers-8b3b686f?siteid=yhoof2&yptr=yahoo
2026-05-05 21:12:00+00:00,MU,Barrons.com,"These Stocks Are Today’s Movers: Intel, PayPal, Palantir, Shopify, Micron, Duolingo, and More",https://www.barrons.com/articles/stock-movers-8b3b686f?siteid=yhoof2&yptr=yahoo
2026-05-05 21:12:00+00:00,SHOP,Barrons.com,"These Stocks Are Today’s Movers: Intel, PayPal, Palantir, Shopify, Micron, Duolingo, and More",https://www.barrons.com/articles/stock-movers-8b3b686f?siteid=yhoof2&yptr=yahoo
2026-05-05 21:16:52+00:00,QCOM,Simply Wall St.,QUALCOMM (QCOM) Is Up 12.1% After Hyperscaler AI Win And $20 Billion Buyback Announcement - Has The Bull Case Changed?,https://finance.yahoo.com/markets/stocks/articles/qualcomm-qcom-12-1-hyperscaler-211652827.html
2026-05-05 21:18:00+00:00,LIN,Barrons.com,Walmart and 8 More Old Economy Stocks for an AI Melt Up,https://www.barrons.com/articles/walmart-stock-price-ai-melt-up-buy-old-economy-40b6f750?siteid=yhoof2&yptr=yahoo
2026-05-05 21:18:00+00:00,WMT,Barrons.com,Walmart and 8 More Old Economy Stocks for an AI Melt Up,https://www.barrons.com/articles/walmart-stock-price-ai-melt-up-buy-old-economy-40b6f750?siteid=yhoof2&yptr=yahoo
2026-05-05 21:18:00+00:00,COST,Barrons.com,Walmart and 8 More Old Economy Stocks for an AI Melt Up,https://www.barrons.com/articles/walmart-stock-price-ai-melt-up-buy-old-economy-40b6f750?siteid=yhoof2&yptr=yahoo
2026-05-05 21:21:00+00:00,CPRT,Simply Wall St.,Is It Time To Reassess Copart (CPRT) After A 45% One Year Share Price Slide?,https://finance.yahoo.com/markets/stocks/articles/time-reassess-copart-cprt-45-212100750.html
2026-05-05 21:26:32+00:00,LRCX,Investor's Business Daily,"Lam Research, IBD Stock Of The Day, Clears Buy Point On Chip-Gear Investments",https://www.investors.com/research/ibd-stock-of-the-day/lrcx-stock-lam-research-buy-point-chip-gear-investments/?src=A00220&yptr=yahoo
2026-05-05 21:30:00+00:00,PANW,GlobeNewswire,"[Latest] Global Smart Grid Cybersecurity Market Size/Share Worth USD 67.02 Billion by 2035 at a 28.2% CAGR: Custom Market Insights (Analysis, Outlook, Leaders, Report, Trends, Forecast, Segmentation, Growth Rate, Value, SWOT Analysis)",https://finance.yahoo.com/sectors/energy/articles/latest-global-smart-grid-cybersecurity-213000019.html
2026-05-05 21:30:00+00:00,FTNT,GlobeNewswire,"[Latest] Global Smart Grid Cybersecurity Market Size/Share Worth USD 67.02 Billion by 2035 at a 28.2% CAGR: Custom Market Insights (Analysis, Outlook, Leaders, Report, Trends, Forecast, Segmentation, Growth Rate, Value, SWOT Analysis)",https://finance.yahoo.com/sectors/energy/articles/latest-global-smart-grid-cybersecurity-213000019.html
2026-05-05 21:30:00+00:00,CSCO,GlobeNewswire,"[Latest] Global Smart Grid Cybersecurity Market Size/Share Worth USD 67.02 Billion by 2035 at a 28.2% CAGR: Custom Market Insights (Analysis, Outlook, Leaders, Report, Trends, Forecast, Segmentation, Growth Rate, Value, SWOT Analysis)",https://finance.yahoo.com/sectors/energy/articles/latest-global-smart-grid-cybersecurity-213000019.html
2026-05-05 21:35:28+00:00,SHOP,Financial Post,"News of the day: Canada trade surplus, Shopify shares slump, Keyera acquisition, interest rate hikes, Carney's fiscal update and more",https://finance.yahoo.com/news/news-day-canada-trade-surplus-213528220.html
2026-05-05 21:36:53+00:00,SHOP,MT Newswires,"US Equity Indexes Advance, Crude Oil Drops as Rubio Says Combat Operation Against Iran 'Over'",https://finance.yahoo.com/markets/stocks/articles/us-equity-indexes-advance-crude-213653042.html
2026-05-05 21:37:02+00:00,MU,Motley Fool,"Stock Market Today, May 5: Stocks Rebound as U.S.-Iran Truce Holds",https://finance.yahoo.com/markets/stocks/articles/stock-market-today-may-5-213702797.html
2026-05-05 21:37:02+00:00,SHOP,Motley Fool,"Stock Market Today, May 5: Stocks Rebound as U.S.-Iran Truce Holds",https://finance.yahoo.com/markets/stocks/articles/stock-market-today-may-5-213702797.html
2026-05-05 21:37:56+00:00,QCOM,Motley Fool,Robinson Value Invests $3.6 Million in Beaten-Down Staffing Leader Amid AI Headwinds,https://finance.yahoo.com/markets/stocks/articles/robinson-value-invests-3-6-213756888.html
2026-05-05 21:45:03+00:00,WDAY,Zacks,Why Workday (WDAY) Outpaced the Stock Market Today,https://finance.yahoo.com/markets/stocks/articles/why-workday-wday-outpaced-stock-214503807.html
2026-05-05 21:45:03+00:00,MRVL,Zacks,Why Marvell Technology (MRVL) Outpaced the Stock Market Today,https://finance.yahoo.com/markets/stocks/articles/why-marvell-technology-mrvl-outpaced-214503178.html
2026-05-05 21:57:00+00:00,WMT,Motley Fool,Best Consumer Staples Stocks to Buy in 2026,https://finance.yahoo.com/markets/stocks/articles/best-consumer-staples-stocks-buy-215700661.html
2026-05-05 21:57:00+00:00,PEP,Motley Fool,Best Consumer Staples Stocks to Buy in 2026,https://finance.yahoo.com/markets/stocks/articles/best-consumer-staples-stocks-buy-215700661.html
2026-05-05 21:57:00+00:00,COST,Motley Fool,Best Consumer Staples Stocks to Buy in 2026,https://finance.yahoo.com/markets/stocks/articles/best-consumer-staples-stocks-buy-215700661.html
2026-05-05 22:00:01+00:00,ADI,Zacks,Analog Devices (ADI) Outpaces Stock Market Gains: What You Should Know,https://finance.yahoo.com/markets/stocks/articles/analog-devices-adi-outpaces-stock-220001979.html
2026-05-05 22:00:01+00:00,EA,Zacks,Electronic Arts (EA) Q4 Earnings: Taking a Look at Key Metrics Versus Estimates,https://finance.yahoo.com/markets/stocks/articles/electronic-arts-ea-q4-earnings-220001686.html
2026-05-05 22:05:08+00:00,EA,Zacks,Electronic Arts (EA) Q4 Earnings and Revenues Lag Estimates,https://finance.yahoo.com/markets/stocks/articles/electronic-arts-ea-q4-earnings-220508424.html
2026-05-05 22:05:08+00:00,TTWO,Zacks,Electronic Arts (EA) Q4 Earnings and Revenues Lag Estimates,https://finance.yahoo.com/markets/stocks/articles/electronic-arts-ea-q4-earnings-220508424.html
2026-05-05 22:05:16+00:00,PANW,Zacks,Qualys (QLYS) Q1 Earnings and Revenues Surpass Estimates,https://finance.yahoo.com/markets/stocks/articles/qualys-qlys-q1-earnings-revenues-220516027.html
2026-05-05 22:06:00+00:00,ASML,GlobeNewswire,The Tech Interactive Receives $1.65 Million ASML Grant to Expand STEM Access,https://finance.yahoo.com/sectors/technology/articles/tech-interactive-receives-1-65-220600550.html
2026-05-05 22:21:40+00:00,NXPI,IPO-Edge.com,MaxLinear Showcases Panther V for AI Inference at Dell Tech World 2026,https://finance.yahoo.com/sectors/technology/articles/maxlinear-showcases-panther-v-ai-222140075.html
2026-05-05 22:21:40+00:00,MCHP,IPO-Edge.com,MaxLinear Showcases Panther V for AI Inference at Dell Tech World 2026,https://finance.yahoo.com/sectors/technology/articles/maxlinear-showcases-panther-v-ai-222140075.html
2026-05-05 22:21:40+00:00,ADI,IPO-Edge.com,MaxLinear Showcases Panther V for AI Inference at Dell Tech World 2026,https://finance.yahoo.com/sectors/technology/articles/maxlinear-showcases-panther-v-ai-222140075.html
2026-05-05 22:23:15+00:00,SNPS,MarketBeat,Atomera Q1 Earnings Call Highlights,https://finance.yahoo.com/markets/stocks/articles/atomera-q1-earnings-call-highlights-222315790.html
2026-05-05 22:33:58+00:00,PYPL,reddit.com/r/stocks,PYPL time to say goodbye finally? - Yall! I am the certified PYPL bag holder. Been holding this shit since covid and my entry was @108. Since then there were zillions of ERs I’ve been waiting for it to hit and recover but this shit kept drilling further away from the moon. Is it finally say a goodbye? Whats the consensus? My loss is well over a six figure and I am contemplating perhaps it’s,
2026-05-05 22:33:58+00:00,INTC,reddit.com/r/stocks,PYPL time to say goodbye finally? - Yall! I am the certified PYPL bag holder. Been holding this shit since covid and my entry was @108. Since then there were zillions of ERs I’ve been waiting for it to hit and recover but this shit kept drilling further away from the moon. Is it finally say a goodbye? Whats the consensus? My loss is well over a six figure and I am contemplating perhaps it’s,
2026-05-05 22:40:21+00:00,AMD,reddit.com/r/stocks,"AMD’s stock soars as data center revenue jumps 57% - **•** Revenue $10.25B vs Est. $9.85B (up 38% YoY) **•** EPS $1.37 vs. Est. $1.29 (up 48% YoY) **•** Data Center Revenue $5.8B vs Est. $5.6B (up 57% YoY) **•** Gross Margin 55% vs. Est. 52% ***Q2 Guidance*** **•** Revenue $11.2B vs Est. $10.5B **•** Gross Margin 56% vs. Est. 55% “We delivered an outstanding first quarter, driven by accelerating demand for AI infrastructure, with",
2026-05-05 22:43:00+00:00,SNDK,Zacks,Still Time to Pay Up for Micron & Sandisk Stock?,https://finance.yahoo.com/markets/stocks/articles/still-time-pay-micron-sandisk-224300490.html
2026-05-05 22:43:00+00:00,MU,Zacks,Still Time to Pay Up for Micron & Sandisk Stock?,https://finance.yahoo.com/markets/stocks/articles/still-time-pay-micron-sandisk-224300490.html
2026-05-05 22:43:00+00:00,WDC,Zacks,Still Time to Pay Up for Micron & Sandisk Stock?,https://finance.yahoo.com/markets/stocks/articles/still-time-pay-micron-sandisk-224300490.html
2026-05-05 23:10:04+00:00,COST,reddit.com/r/stocks,"CBOE just reported 29% revenue growth and barely anyone is talking about it. Here's what the fundamentals show. - For context, Cboe Global Markets runs the exchanges where options, futures, and equities get traded. you've probably used their products without realizing it. The VIX index that everyone references when markets get volatile? Yea, that's Cboe. here's what my screen showed: ROIC: 58% (5yr average was 14.4%) FCF margin: 56.8% Gross margin: 43.4% Net margin: 25.8%",
2026-05-05 23:17:00+00:00,QCOM,MarketWatch,"The last time semiconductor stocks rose this far this quickly, the dot-com bubble burst",https://finance.yahoo.com/markets/stocks/articles/last-time-semiconductor-stocks-rose-231700204.html
2026-05-05 23:18:17+00:00,CMCSA,CorpGov.com,"The Dealmaking 3: LIV Golf Funding, UFC in Australia, ESPN & Disney Take Back Sports",https://finance.yahoo.com/markets/stocks/articles/dealmaking-3-liv-golf-funding-231817103.html
2026-05-05 23:18:17+00:00,WBD,CorpGov.com,"The Dealmaking 3: LIV Golf Funding, UFC in Australia, ESPN & Disney Take Back Sports",https://finance.yahoo.com/markets/stocks/articles/dealmaking-3-liv-golf-funding-231817103.html
2026-05-05 23:18:17+00:00,NFLX,CorpGov.com,"The Dealmaking 3: LIV Golf Funding, UFC in Australia, ESPN & Disney Take Back Sports",https://finance.yahoo.com/markets/stocks/articles/dealmaking-3-liv-golf-funding-231817103.html
2026-05-05 23:46:22+00:00,MRVL,Motley Fool,Why Marvell Stock Soared 67% in April,https://finance.yahoo.com/markets/stocks/articles/why-marvell-stock-soared-67-234622015.html
2026-05-06 00:00:00+00:00,DASH,SEC-EDGAR-8K,"(Item 2.02) Results of Operations and Financial Condition. On May 6, 2026 , DoorDash, Inc. (""DoorDash"") issued a press release announcing its financial results for the quarter ended March 31, 2026. A copy of the press release is attached as Exhibit 99.1 to this Current Report on Form 8-K and is incorporated herein by reference.

(Item 2.02) and",
2026-05-06 00:00:00+00:00,MAR,SEC-EDGAR-8K,"(Item 2.02) . Results of Operations and Financial Condition. Financial Results for the Quarter Ended March 31, 2026 On May 6, 2026, Marriott International, Inc. ( “ Marriott ” ) is issuing a press release reporting financial results for the quarter ended March 31, 2026. A copy of Marriott’s press release is attached as Exhibit 99 and incorporated by reference.",
2026-05-06 00:00:00+00:00,WBD,SEC-EDGAR-8K,"(Item 2.02) Results of Operations and Financial Condition. On May 6, 2026, Warner Bros. Discovery, Inc. (""we,"" “Warner Bros. Discovery” or the “Company”) released its earnings for the quarter ended March 31, 2026. A copy of Warner Bros. Discovery's earnings press release is furnished herewith as Exhibit 99.1 and is incorporated herein by reference. The information in this

(Item 2.02) , including Exhibit 99.1 attached hereto, is being furnished pursuant to

(Item 2.02) and shall not be deemed “filed” for purposes of Section 18 of the Securities Exchange Act of 1934, as amended (the “Exchange Act”), or otherwise subject to the liability of such section, nor shall it be deemed incorporated by reference in any filing under the Securities Act of 1933, as amended (the ""Securities Act""), or the Exchange Act, except as shall be expressly set forth by specific reference in such filing.",
2026-05-06 00:00:00+00:00,KHC,SEC-EDGAR-8K,"(Item 2.02) . Results of Operations and Financial Condition. On May 6, 2026, The Kraft Heinz Company issued a press release announcing results for the first quarter ended March 28, 2026. A copy of the press release is furnished as Exhibit 99.1 to this Current Report on Form 8-K. The information furnished pursuant to this

(Item 2.02) , including Exhibit 99.1, shall not be deemed to be “filed” for purposes of Section 18 of, or otherwise regarded as filed under, the Securities Exchange Act of 1934, as amended (the “Exchange Act”), nor shall it be deemed incorporated by reference into any filing under the Securities Act of 1933, as amended, or in the Exchange Act, except as shall be expressly set forth by specific reference in such filing.",
2026-05-06 00:00:00+00:00,FTNT,SEC-EDGAR-8K,"(Item 2.02) Results of Operations and Financial Condition. On May 6, 2026, Fortinet, Inc. issued a press release reporting its financial results for the first quarter ended March 31, 2026. A copy of the press release is furnished herewith as Exhibit 99.1 and is incorporated herein by reference. This information shall not be deemed “filed” for purposes of Section 18 of the Securities Exchange Act of 1934, as amended (the “Exchange Act”), or incorporated by reference in",
2026-05-06 00:00:00+00:00,AXON,SEC-EDGAR-8K,"(Item 2.02) Results of Operations and Financial Condition On May 6, 2026, Axon Enterprise, Inc. (the “Company”) issued a shareholder letter regarding the Company’s financial results for the three months ended March 31, 2026. The full text of the letter is attached hereto as Exhibit 99.1 and is incorporated herein by reference. The information pursuant to

(Item 2.02) in this report on Form 8-K is being furnished and shall not be deemed filed for purposes of Section 18 of the Securities Exchange Act of 1934, as amended (the “Exchange Act”), or otherwise subject to the liabilities of that section, and such information shall not be deemed incorporated by reference into any of the Company’s filings under the Securities Act of 1933, as amended (the “Securities Act”), or the Exchange Act, except as expressly",
2026-05-06 00:00:00+00:00,STX,SEC-EDGAR-8K,"(Item 5.02) Departure of Directors or Certain Officers; Election of Directors; Appointment of Certain Officers; Compensatory Arrangements of Certain Officers. On May 5, 2026, Mr. Michael R. Cannon notified the Board of Directors (the “Board”) of Seagate Technology Holdings, plc (the “Company”) that he has decided not to stand for re-election to the Board at the Company’s 2026 Annual General Meeting of Shareholders (the “Annual Meeting”). Mr. Cannon will continue to serve as a director until the",
2026-05-06 00:00:00+00:00,APP,SEC-EDGAR-8K,"(Item 2.02) Results of Operations and Financial Condition On May 6, 2026, AppLovin Corporation issued a press release announcing its financial results for the quarter ended March 31, 2026. A copy of the press release is attached as Exhibit 99.1 to this current report on Form 8-K and is incorporated by reference herein. The information in this

(Item 2.02) of this current report on Form 8-K and Exhibit 99.1 attached hereto shall not be deemed “filed” for purposes of Section 18 of the Securities Exchange Act of 1934, as amended (the “Exchange Act”) or otherwise subject to the liabilities of that section, nor shall it be deemed incorporated by reference in any filing under the Securities Act of 1933, as amended, or the Exchange Act, regardless of any general incorporation language in such filing.",
2026-05-06 00:00:00+00:00,EXC,SEC-EDGAR-8K,(Item 2.02) . Results of Operations and Financial Condition.,
2026-05-06 00:23:40+00:00,AVGO,Simply Wall St.,Is It Too Late To Consider Broadcom (AVGO) After Its 115% One Year Rally?,https://finance.yahoo.com/markets/stocks/articles/too-consider-broadcom-avgo-115-002340884.html
2026-05-06 00:23:49+00:00,STX,Simply Wall St.,Seagate’s New AI Storage Suite Meets Rapidly Rising STX Valuation,https://finance.yahoo.com/markets/stocks/articles/seagate-ai-storage-suite-meets-002349545.html
2026-05-06 00:30:06+00:00,APP,Zacks,"Cricut, Inc. (CRCT) Beats Q1 Earnings Estimates",https://finance.yahoo.com/markets/stocks/articles/cricut-inc-crct-beats-q1-003006781.html
2026-05-06 00:53:05+00:00,INTC,reddit.com/r/stocks,"30K of INTC hold or sell? - Hey yall, I have about 30K worth of vested INTC RSUs. I’ve held for about 5 years now and it’s getting to the point where it’s a sizeable amount that I’d rather not risk still being at INTC. If you were me would you continue holding or take the profits and invest in something else? If something else, what are the next options to buy in besides the",
2026-05-06 01:08:37+00:00,ASML,Simply Wall St.,Is It Too Late To Consider ASML Holding (ENXTAM:ASML) After 106% One-Year Surge?,https://finance.yahoo.com/markets/stocks/articles/too-consider-asml-holding-enxtam-010837281.html
2026-05-06 01:08:43+00:00,SNDK,Simply Wall St.,Tradr 2X Short Sandisk ETF Targets Overvalued Stock With Surging Gains,https://finance.yahoo.com/markets/options/articles/tradr-2x-short-sandisk-etf-010843582.html
2026-05-06 01:10:07+00:00,CTSH,Simply Wall St.,CrowdStrike Gartner Leader Status And QuiltWorks Expansion Deepen AI Security Role,https://finance.yahoo.com/markets/stocks/articles/crowdstrike-gartner-leader-status-quiltworks-011007711.html
2026-05-06 01:10:07+00:00,CRWD,Simply Wall St.,CrowdStrike Gartner Leader Status And QuiltWorks Expansion Deepen AI Security Role,https://finance.yahoo.com/markets/stocks/articles/crowdstrike-gartner-leader-status-quiltworks-011007711.html
2026-05-06 01:25:46+00:00,SNDK,Insider Monkey,Sandisk (SNDK) Hits All-Time High as Profits Soar 287%,https://finance.yahoo.com/markets/stocks/articles/sandisk-sndk-hits-time-high-012546757.html
2026-05-06 01:29:28+00:00,AMD,reddit.com/r/stocks,"Chip stocks are like vortexes sucking up all the money - So far this year, if you aren't in chip stocks then you've missed out. In the nasdaq 10 out of 10 top gainers for the year are chip stocks. For the s&p500 it's a similar story with 4/5 of the top gainers being chip stocks. And this isn't just a simple, oh yeah these companies are up 10-20% the past couple of months. These",
2026-05-06 02:00:00+00:00,BKNG,PR Newswire,Agoda Reports Rise in Domestic Weekend Travel Demand Ahead of Golden Week,https://finance.yahoo.com/economy/articles/agoda-reports-rise-domestic-weekend-020000860.html
2026-05-06 02:13:51+00:00,WMT,Simply Wall St.,Maryland Pricing Ban And BTS Tie Up Shape Walmart Outlook,https://finance.yahoo.com/markets/stocks/articles/maryland-pricing-ban-bts-tie-021351377.html
2026-05-06 02:14:02+00:00,PYPL,Simply Wall St.,Can PayPal’s AI Reset And Reorganization Revive Long Term Growth Potential,https://finance.yahoo.com/markets/stocks/articles/paypal-ai-reset-reorganization-revive-021402473.html
2026-05-06 02:38:25+00:00,NVDA,reddit.com/r/stocks,"Why do we chase 10x underdogs instead of proven winners for 1x or 2x upside? $GOOGL, $AMZN, $NVDA - Is it just anchoring bias? After the latest earnings, the outlook is clearer than ever for $GOOGL. The existential threat to the Search business didn't pan out the way the bears warned. They are getting massive traction in many bets and investments. It looks like it is on a clear path to becoming the first $10",
