timestamp,ticker,source,text,url
2026-04-30 10:05:00+00:00,XEL,Business Wire,Xcel Energy First Quarter 2026 Earnings Report,https://finance.yahoo.com/markets/stocks/articles/xcel-energy-first-quarter-2026-100500178.html
2026-04-30 10:15:43+00:00,TMUS,Simply Wall St.,Is It Time To Reassess T-Mobile US (TMUS) After Recent Share Price Volatility?,https://finance.yahoo.com/markets/stocks/articles/time-reassess-t-mobile-us-101543520.html
2026-04-30 11:00:00+00:00,INSM,PR Newswire,Insmed to Present at May 2026 Investor Conferences,https://finance.yahoo.com/sectors/healthcare/articles/insmed-present-may-2026-investor-110000013.html
2026-04-30 11:02:34+00:00,FTNT,Investor's Business Daily,"Check Point Earnings Beat, But Revenue, Billings Miss. Cybersecurity Stock Falls.",https://www.investors.com/news/technology/chkp-stock-check-point-earnings-q12026/?src=A00220&yptr=yahoo
2026-04-30 11:05:38+00:00,CMCSA,Simply Wall St.,Additional Considerations Required While Assessing Comcast's (NASDAQ:CMCSA) Strong Earnings,https://finance.yahoo.com/markets/stocks/articles/additional-considerations-required-while-assessing-110538637.html
2026-04-30 11:07:33+00:00,ADP,Simply Wall St.,Assessing Automatic Data Processing’s Valuation After Recent Share Price Rebound,https://finance.yahoo.com/markets/stocks/articles/assessing-automatic-data-processing-valuation-110733901.html
2026-04-30 11:30:03+00:00,XEL,Zacks,Xcel Energy (XEL) Matches Q1 Earnings Estimates,https://finance.yahoo.com/markets/stocks/articles/xcel-energy-xel-matches-q1-113003378.html
2026-04-30 11:34:20+00:00,MDLZ,Barchart,Are Wall Street Analysts Bullish on Mondelez International Stock?,https://finance.yahoo.com/markets/stocks/articles/wall-street-analysts-bullish-mondelez-113420027.html
2026-04-30 11:35:00+00:00,CEG,Motley Fool,The Best Utility Stocks of 2026,https://finance.yahoo.com/markets/stocks/articles/best-utility-stocks-2026-113500383.html
2026-04-30 11:35:49+00:00,WDAY,Simply Wall St.,Top Growth Stocks With Notable Insider Ownership,https://finance.yahoo.com/markets/stocks/articles/top-growth-stocks-notable-insider-113549467.html
2026-04-30 11:38:05+00:00,ALNY,Simply Wall St.,3 Companies That May Be Priced Below Their Estimated Value,https://finance.yahoo.com/markets/stocks/articles/3-companies-may-priced-below-113805207.html
2026-04-30 11:38:11+00:00,WDAY,Simply Wall St.,High Growth Tech Stocks in the US Market to Watch,https://finance.yahoo.com/markets/stocks/articles/high-growth-tech-stocks-us-113811628.html
2026-04-30 11:38:11+00:00,ZS,Simply Wall St.,High Growth Tech Stocks in the US Market to Watch,https://finance.yahoo.com/markets/stocks/articles/high-growth-tech-stocks-us-113811628.html
2026-04-30 11:42:40+00:00,CDNS,24/7 Wall St.,$1 Trillion in AI Capex Is Coming. Here Are 5 Stocks That Will Feast on the Buildout,https://finance.yahoo.com/markets/stocks/articles/1-trillion-ai-capex-coming-114240432.html
2026-04-30 11:49:34+00:00,GEHC,24/7 Wall St.,"Here Are Thursday’s Top Wall Street Analyst Research Calls: AbbVie, Equinix, GE Healthcare, Kratos Defense, Meta Platforms, Oneok, Palantir Technologies, Wingstop, and More",https://finance.yahoo.com/markets/stocks/articles/thursday-top-wall-street-analyst-114934817.html
2026-04-30 11:56:34+00:00,CTSH,Barchart,Are Wall Street Analysts Bullish on Cognizant Stock?,https://finance.yahoo.com/markets/stocks/articles/wall-street-analysts-bullish-cognizant-115634742.html
2026-04-30 12:00:00+00:00,ALNY,Business Wire,Alnylam Pharmaceuticals Reports First Quarter 2026 Financial Results and Highlights Recent Period Progress,https://finance.yahoo.com/sectors/healthcare/articles/alnylam-pharmaceuticals-reports-first-quarter-120000812.html
2026-04-30 12:01:44+00:00,CHTR,Simply Wall St.,Charter Communications President Acquires 3.2% More Stock,https://finance.yahoo.com/markets/stocks/articles/charter-communications-president-acquires-3-120144358.html
2026-04-30 12:05:35+00:00,GEHC,24/7 Wall St.,GE HealthCare Just Crashed 13% on a Guidance Cut. Here’s the Case for Buying the Dip,https://finance.yahoo.com/sectors/healthcare/articles/ge-healthcare-just-crashed-13-120535407.html
2026-04-30 12:06:14+00:00,MELI,Simply Wall St.,MercadoLibre Weighs Loan Sales To Balance Mercado Pago Growth And Risk,https://finance.yahoo.com/markets/stocks/articles/mercadolibre-weighs-loan-sales-balance-120614097.html
2026-04-30 12:30:00+00:00,CTSH,PR Newswire,Cognizant Named Aston Martin Aramco Formula One™ Team Global AI Services Partner,https://finance.yahoo.com/sectors/technology/articles/cognizant-named-aston-martin-aramco-123000924.html
2026-04-30 12:30:00+00:00,KLAC,Moby,KLA Corporation Q3 2026 Earnings Call Summary,https://finance.yahoo.com/markets/stocks/articles/kla-corporation-q3-2026-earnings-123000392.html
2026-04-30 12:30:00+00:00,ORLY,Moby,"O'Reilly Automotive, Inc. Q1 2026 Earnings Call Summary",https://finance.yahoo.com/markets/stocks/articles/oreilly-automotive-inc-q1-2026-123000265.html
2026-04-30 12:30:00+00:00,TRI,CNW Group,Thomson Reuters Receives Court Approval for Return of Capital and Share Consolidation Transactions,https://finance.yahoo.com/markets/stocks/articles/thomson-reuters-receives-court-approval-123000183.html
2026-04-30 12:30:12+00:00,INSM,Zacks,"Cartesian Therapeutics, Inc. (RNAC) Reports Q1 Loss, Lags Revenue Estimates",https://finance.yahoo.com/sectors/healthcare/articles/cartesian-therapeutics-inc-rnac-reports-123012092.html
2026-04-30 12:59:00+00:00,WDAY,PR Newswire,"Cresta Names Sequoia's Doug Leone as Board Chair, Carl Eschenbach Rejoins Board as Growth Accelerates",https://finance.yahoo.com/markets/stocks/articles/cresta-names-sequoias-doug-leone-125900694.html
2026-04-30 13:00:00+00:00,CSGP,Business Wire,CoStar Expects U.S. Industrial Vacancy to Peak in Early 2027,https://finance.yahoo.com/markets/stocks/articles/costar-expects-u-industrial-vacancy-130000394.html
2026-04-30 13:00:05+00:00,TTWO,Zacks,"Here is What to Know Beyond Why Take-Two Interactive Software, Inc. (TTWO) is a Trending Stock",https://finance.yahoo.com/markets/stocks/articles/know-beyond-why-two-interactive-130005534.html
2026-04-30 13:00:06+00:00,WDAY,Zacks,"Investors Heavily Search Workday, Inc. (WDAY): Here is What You Need to Know",https://finance.yahoo.com/markets/stocks/articles/investors-heavily-search-workday-inc-130006524.html
2026-04-30 13:00:09+00:00,LRCX,Zacks,Lam Research Corporation (LRCX) Is a Trending Stock: Facts to Know Before Betting on It,https://finance.yahoo.com/markets/stocks/articles/lam-research-corporation-lrcx-trending-130009028.html
2026-04-30 13:00:09+00:00,HON,Simply Wall St.,Honeywell International Insiders Sold US$2.0m Of Shares Suggesting Hesitancy,https://finance.yahoo.com/markets/stocks/articles/honeywell-international-insiders-sold-us-130009683.html
2026-04-30 13:09:00+00:00,FTNT,GlobeNewswire,"The Fortinet 2026 Global Threat Landscape Report Reveals a Surge in AI-Enabled Cybercrime, Contributing to a 389% Increase in Ransomware Victims Year-over-Year",https://finance.yahoo.com/sectors/technology/articles/fortinet-2026-global-threat-landscape-130900744.html
2026-04-30 13:15:05+00:00,IDXX,Zacks,What Analyst Projections for Key Metrics Reveal About Idexx (IDXX) Q1 Earnings,https://finance.yahoo.com/markets/stocks/articles/analyst-projections-key-metrics-reveal-131505831.html
2026-04-30 13:15:08+00:00,EA,Zacks,Gear Up for Electronic Arts (EA) Q4 Earnings: Wall Street Estimates for Key Metrics,https://finance.yahoo.com/markets/stocks/articles/gear-electronic-arts-ea-q4-131508462.html
2026-04-30 13:25:02+00:00,ALNY,Zacks,Alnylam Pharmaceuticals (ALNY) Tops Q1 Earnings and Revenue Estimates,https://finance.yahoo.com/sectors/healthcare/articles/alnylam-pharmaceuticals-alny-tops-q1-132502764.html
2026-04-30 13:30:06+00:00,XEL,Zacks,Here's What Key Metrics Tell Us About Xcel (XEL) Q1 Earnings,https://finance.yahoo.com/markets/stocks/articles/heres-key-metrics-tell-us-133006970.html
2026-04-30 13:31:00+00:00,MELI,Business Wire,"MercadoLibre, Inc. to Report First Quarter 2026 Financial Results",https://finance.yahoo.com/markets/stocks/articles/mercadolibre-inc-report-first-quarter-133100940.html
2026-04-30 13:36:40+00:00,GEHC,The Fly,"Meta downgraded, Qualcomm upgraded: Wall Street's top analyst calls",https://finance.yahoo.com/markets/stocks/articles/meta-downgraded-qualcomm-upgraded-wall-133640358.html
2026-04-30 14:00:02+00:00,ALNY,Zacks,Alnylam (ALNY) Reports Q1 Earnings: What Key Metrics Have to Say,https://finance.yahoo.com/markets/stocks/articles/alnylam-alny-reports-q1-earnings-140002863.html
2026-04-30 14:00:42+00:00,INSM,Zacks,Insmed (INSM) Expected to Beat Earnings Estimates: Can the Stock Move Higher?,https://finance.yahoo.com/markets/stocks/articles/insmed-insm-expected-beat-earnings-140042463.html
2026-04-30 14:10:00+00:00,ODFL,Trucking Dive,"Old Dominion notes retail improvement, early optimism with industrial",https://finance.yahoo.com/markets/stocks/articles/old-dominion-notes-retail-improvement-141000013.html
2026-04-30 14:22:08+00:00,CSGP,Insider Monkey,CoStar Group Inc. (CSGP): Bares Capital Is Bullish on This Stock,https://finance.yahoo.com/markets/stocks/articles/costar-group-inc-csgp-bares-142208015.html
2026-04-30 14:33:00+00:00,BKNG,Zacks,Merchant Model Strength Powers BKNG's Q1 Earnings & Revenue Growth,https://finance.yahoo.com/markets/stocks/articles/merchant-model-strength-powers-bkngs-143300005.html
2026-04-30 14:35:00+00:00,CMCSA,ACCESS Newswire,Comcast and Boys & Girls Clubs of Thurston County Open Lift Zones in Lacey to Help Youth Build Digital Skills,https://finance.yahoo.com/sectors/technology/articles/comcast-boys-girls-clubs-thurston-143500508.html
2026-04-30 14:44:10+00:00,TTWO,NYSE,Take-Two CEO Strauss Zelnick ‘Encouraged’ by AI Developments at Semafor Summit,https://finance.yahoo.com/video/two-ceo-strauss-zelnick-encouraged-144410585.html
2026-04-30 15:00:00+00:00,MNST,GlobeNewswire,"Monster Beverage to Report Financial Results for 2026 First Quarter on May 7, 2026",https://finance.yahoo.com/markets/stocks/articles/monster-beverage-report-financial-results-150000847.html
2026-04-30 15:05:06+00:00,BKNG,Simply Wall St.,Booking Holdings AI Push And Buybacks Meet Mixed Valuation Signals,https://finance.yahoo.com/markets/stocks/articles/booking-holdings-ai-push-buybacks-150506221.html
2026-04-30 15:23:48+00:00,GILD,Barchart,Gilead Sciences Stock Outlook: Is Wall Street Bullish or Bearish?,https://finance.yahoo.com/markets/stocks/articles/gilead-sciences-stock-outlook-wall-152348180.html
2026-04-30 15:35:49+00:00,VRSK,MT Newswires,"Verisk's Q1 Organic Revenue Tops Forecasts on Underwriting, Claims Strength, Morgan Stanley Says",https://finance.yahoo.com/markets/stocks/articles/verisk-apos-q1-organic-revenue-153549259.html
2026-04-30 15:40:02+00:00,SNPS,Zacks,PRGS vs. SNPS: Which Stock Is the Better Value Option?,https://finance.yahoo.com/markets/stocks/articles/prgs-vs-snps-stock-better-154002326.html
2026-04-30 16:00:00+00:00,CDNS,Business Wire,PsiQuantum Appoints Lip-Bu Tan to Board of Directors,https://finance.yahoo.com/sectors/technology/articles/psiquantum-appoints-lip-bu-tan-160000292.html
2026-04-30 16:00:03+00:00,ROP,Zacks,Roper Technologies (ROP) Upgraded to Strong Buy: Here's What You Should Know,https://finance.yahoo.com/markets/stocks/articles/roper-technologies-rop-upgraded-strong-160003664.html
2026-04-30 16:04:10+00:00,ALNY,MarketBeat,Alnylam Pharmaceuticals Q1 Earnings Call Highlights,https://finance.yahoo.com/sectors/healthcare/articles/alnylam-pharmaceuticals-q1-earnings-call-160410672.html
2026-04-30 16:26:00+00:00,PCAR,Zacks,"LKQ Q1 Earnings Match Estimates, Revenues Beat on Stronger Sales Mix",https://finance.yahoo.com/markets/stocks/articles/lkq-q1-earnings-match-estimates-162600620.html
2026-04-30 16:28:43+00:00,GEHC,Medical Device Network,GE HealthCare’s stock plunges 13% as supply chain costs bite,https://finance.yahoo.com/markets/stocks/articles/ge-healthcare-stock-plunges-13-162843853.html
2026-04-30 16:37:00+00:00,CTSH,Zacks,Cognizant Q1 Earnings Beat Estimates: Will Raised View Aid Shares?,https://finance.yahoo.com/markets/stocks/articles/cognizant-q1-earnings-beat-estimates-163700812.html
2026-04-30 16:43:00+00:00,KLAC,Zacks,"KLA Q3 Earnings Surpass Estimates, Revenues Increase Year over Year",https://finance.yahoo.com/markets/stocks/articles/kla-q3-earnings-surpass-estimates-164300463.html
2026-04-30 16:45:00+00:00,XEL,Zacks,"Xcel Energy Q1 Earnings Match Estimates, Revenues Miss, Both Up Y/Y",https://finance.yahoo.com/markets/stocks/articles/xcel-energy-q1-earnings-match-164500557.html
2026-04-30 16:45:03+00:00,ADI,Zacks,"Is Analog Devices (ADI) a Solid Growth Stock? 3 Reasons to Think ""Yes""",https://finance.yahoo.com/markets/stocks/articles/analog-devices-adi-solid-growth-164503622.html
2026-04-30 16:52:00+00:00,PANW,Motley Fool,"1 No-Brainer Artificial Intelligence (AI) Stock to Buy With $190, According to Wall Street",https://finance.yahoo.com/markets/stocks/articles/1-no-brainer-artificial-intelligence-165200111.html
2026-04-30 16:55:00+00:00,ORLY,Zacks,O'Reilly Q1 Earnings Surpass Estimates on Strong Comps Growth,https://finance.yahoo.com/markets/stocks/articles/oreilly-q1-earnings-surpass-estimates-165500459.html
2026-04-30 16:55:35+00:00,XEL,Moby,Xcel Energy Inc. Q1 2026 Earnings Call Summary,https://finance.yahoo.com/sectors/energy/articles/xcel-energy-inc-q1-2026-165535194.html
2026-04-30 16:59:47+00:00,ORLY,Motley Fool,O'Reilly (ORLY) Q1 2026 Earnings Call Transcript,https://finance.yahoo.com/markets/stocks/articles/oreilly-orly-q1-2026-earnings-165947615.html
2026-04-30 17:29:00+00:00,BKNG,Zacks,Carnival vs. Booking: Which Travel Stock Holds the Stronger Position?,https://finance.yahoo.com/markets/stocks/articles/carnival-vs-booking-travel-stock-172900401.html
2026-04-30 17:36:56+00:00,MPWR,Bloomberg,Apple Earnings Become Sideshow With New CEO Ready to Grab Reins,https://finance.yahoo.com/markets/stocks/articles/apple-earnings-become-sideshow-ceo-090053017.html
2026-04-30 17:38:27+00:00,ZS,Simply Wall St.,Exploring High Growth US Tech Stocks This April 2026,https://finance.yahoo.com/markets/stocks/articles/exploring-high-growth-us-tech-173827443.html
2026-04-30 17:39:06+00:00,BKNG,Barchart,"Travel Is Struggling, But Unusual Options Activity Shows Someone Just Bet Big on Booking Holdings Stock",https://finance.yahoo.com/markets/options/articles/travel-struggling-unusual-options-activity-173906950.html
2026-04-30 17:44:05+00:00,ALNY,Motley Fool,Alnylam (ALNY) Q1 2026 Earnings Transcript,https://finance.yahoo.com/sectors/healthcare/articles/alnylam-alny-q1-2026-earnings-174405380.html
2026-04-30 17:49:48+00:00,KDP,Barchart,Keurig Dr Pepper Stock: Analyst Estimates & Ratings,https://finance.yahoo.com/markets/stocks/articles/keurig-dr-pepper-stock-analyst-174948425.html
2026-04-30 17:57:00+00:00,REGN,MT Newswires,"Regeneron's Eylea Franchise on 'Solid Footing' Despite HD Sales Miss in Q1, Oppenheimer Says",https://finance.yahoo.com/sectors/healthcare/articles/regeneron-apos-eylea-franchise-apos-175700044.html
2026-04-30 18:04:00+00:00,WDAY,Business Wire,Jade Global Named Workday Partner,https://finance.yahoo.com/sectors/technology/articles/jade-global-named-workday-partner-180400874.html
2026-04-30 18:12:00+00:00,NXPI,Barrons.com,Is Qualcomm Ready for Primetime? What the Technicals Say.,https://www.barrons.com/articles/qualcomm-stock-qcom-technical-analysis-5c799062?siteid=yhoof2&yptr=yahoo
2026-04-30 18:19:01+00:00,MDLZ,Barchart,Cocoa Prices Jump as Chocolate Demand Remains Steady,https://finance.yahoo.com/markets/commodities/articles/cocoa-prices-jump-chocolate-demand-181901833.html
2026-04-30 18:24:55+00:00,FTNT,MarketBeat,Climb Global Solutions Q1 Earnings Call Highlights,https://finance.yahoo.com/markets/stocks/articles/climb-global-solutions-q1-earnings-182455471.html
2026-04-30 18:41:34+00:00,NXPI,Barchart,NXP Semiconductors Stock Is Surging as Automotive Chip Demand Returns. The Rebound May Just Be Getting Started.,https://finance.yahoo.com/markets/stocks/articles/nxp-semiconductors-stock-surging-automotive-184134840.html
2026-04-30 19:17:57+00:00,HON,Insider Monkey,Jim Cramer Says “People Don’t Respect Honeywell” and “They’re Making a Very Big Mistake”,https://finance.yahoo.com/markets/stocks/articles/jim-cramer-says-people-don-191757984.html
2026-04-30 19:18:00+00:00,MELI,Motley Fool,2 Monster Stocks to Hold for the Next 10 Years,https://finance.yahoo.com/markets/stocks/articles/2-monster-stocks-hold-next-191800595.html
2026-04-30 19:47:27+00:00,GILD,Insider Monkey,"Is Gilead Sciences, Inc. (GILD) A Good Stock To Buy Now?",https://finance.yahoo.com/markets/stocks/articles/gilead-sciences-inc-gild-good-194727762.html
2026-04-30 20:00:00+00:00,INTU,Business Wire,Intuit to Announce Third-Quarter Fiscal Year 2026 Results on May 20,https://finance.yahoo.com/markets/stocks/articles/intuit-announce-third-quarter-fiscal-200000764.html
2026-04-30 20:00:00+00:00,CMCSA,Business Wire,Comcast to Participate in MoffettNathanson Investor Conference,https://finance.yahoo.com/markets/stocks/articles/comcast-participate-moffettnathanson-investor-conference-200000711.html
2026-04-30 20:01:00+00:00,MPWR,GlobeNewswire,"Monolithic Power Systems Reports First Quarter Results on April 30, 2026",https://finance.yahoo.com/markets/stocks/articles/monolithic-power-systems-reports-first-200100739.html
2026-04-30 20:02:00+00:00,DXCM,Business Wire,Dexcom Reports First Quarter 2026 Financial Results,https://finance.yahoo.com/sectors/healthcare/articles/dexcom-reports-first-quarter-2026-200200140.html
2026-04-30 20:03:35+00:00,GILD,MarketBeat,Kymera Therapeutics Q1 Earnings Call Highlights,https://finance.yahoo.com/sectors/healthcare/articles/kymera-therapeutics-q1-earnings-call-200335841.html
2026-04-30 20:06:03+00:00,CEG,Simply Wall St.,A Look At Constellation Energy’s Valuation As AI Data Center Demand And Calpine Deal Draw Focus,https://finance.yahoo.com/markets/stocks/articles/look-constellation-energy-valuation-ai-200603673.html
2026-04-30 20:06:49+00:00,ALNY,Investor's Business Daily,Alnylam Surges After Its Pfizer-Rivaling Blockbuster Jumps Nearly 200%,https://www.investors.com/news/technology/alnylam-stock-alnylam-pharmaceuticals-earnings-q1-2026/?src=A00220&yptr=yahoo
2026-04-30 20:10:00+00:00,PANW,PR Newswire,Palo Alto Networks to Acquire Portkey to Secure the Rise of AI Agents,https://finance.yahoo.com/sectors/technology/articles/palo-alto-networks-acquire-portkey-201000148.html
2026-04-30 20:15:31+00:00,TXN,Yahoo Finance Video,Nasdaq leads US stocks in monthly gains following April rally,https://finance.yahoo.com/video/nasdaq-leads-us-stocks-in-monthly-gains-following-april-rally-201531873.html
2026-04-30 20:24:09+00:00,DXCM,StockStory,DexCom (NASDAQ:DXCM) Exceeds Q1 CY2026 Expectations But Stock Drops,https://finance.yahoo.com/markets/stocks/articles/dexcom-nasdaq-dxcm-exceeds-q1-202409010.html
2026-04-30 20:30:00+00:00,MPWR,GlobeNewswire,"Monolithic Power Systems Prevails in Patent Infringement Lawsuit Brought by Bel Power Solutions in West Texas, with Bel Power Solutions Paying Costs",https://finance.yahoo.com/markets/stocks/articles/monolithic-power-systems-prevails-patent-203000546.html
2026-04-30 20:42:55+00:00,ORLY,MarketBeat,O'Reilly Automotive Q1 Earnings Call Highlights,https://finance.yahoo.com/markets/stocks/articles/oreilly-automotive-q1-earnings-call-204255833.html
2026-04-30 20:42:56+00:00,GILD,MarketBeat,"Gilead Sciences Annual Meeting: Directors, Pay Win Big; Pipeline Launches and Acquisitions Highlighted",https://finance.yahoo.com/sectors/healthcare/articles/gilead-sciences-annual-meeting-directors-204256359.html
2026-04-30 20:43:49+00:00,MPWR,StockStory,Monolithic Power Systems (NASDAQ:MPWR) Surprises With Q1 Sales,https://finance.yahoo.com/markets/stocks/articles/monolithic-power-systems-nasdaq-mpwr-204349873.html
2026-04-30 20:45:05+00:00,ALNY,Moby,"Alnylam Pharmaceuticals, Inc. Q1 2026 Earnings Call Summary",https://finance.yahoo.com/sectors/healthcare/articles/alnylam-pharmaceuticals-inc-q1-2026-204505903.html
2026-04-30 20:49:00+00:00,BKNG,Zacks,"Top Analyst Reports for Visa, Booking & Seagate",https://finance.yahoo.com/markets/stocks/articles/top-analyst-reports-visa-booking-204900201.html
2026-04-30 21:05:00+00:00,ODFL,Motley Fool,"After Doubling in the Past Year, This Stock Is About To Hit Cruise Control. Time To Buy?",https://finance.yahoo.com/markets/stocks/articles/doubling-past-stock-hit-cruise-210500768.html
2026-04-30 21:15:02+00:00,MPWR,Zacks,Monolithic Power (MPWR) Beats Q1 Earnings and Revenue Estimates,https://finance.yahoo.com/markets/stocks/articles/monolithic-power-mpwr-beats-q1-211502701.html
2026-04-30 21:15:02+00:00,DXCM,Zacks,DexCom (DXCM) Q1 Earnings and Revenues Top Estimates,https://finance.yahoo.com/sectors/healthcare/articles/dexcom-dxcm-q1-earnings-revenues-211502254.html
2026-04-30 21:17:01+00:00,MELI,Motley Fool,"Stock Market Today, April 30: Amazon Rises on AWS AI Growth and an Earnings Beat",https://finance.yahoo.com/markets/stocks/articles/stock-market-today-april-30-211701089.html
2026-04-30 21:19:00+00:00,CEG,Barrons.com,Constellation Energy Stock Jumps on AI Boom. Why Power Producers Will Gain.,https://www.barrons.com/articles/constellation-energy-stock-ai-power-2cd76b5c?siteid=yhoof2&yptr=yahoo
2026-04-30 21:30:03+00:00,MPWR,Zacks,Here's What Key Metrics Tell Us About Monolithic (MPWR) Q1 Earnings,https://finance.yahoo.com/markets/stocks/articles/heres-key-metrics-tell-us-213003507.html
2026-04-30 21:45:02+00:00,PANW,Zacks,Palo Alto Networks (PANW) Stock Declines While Market Improves: Some Information for Investors,https://finance.yahoo.com/markets/stocks/articles/palo-alto-networks-panw-stock-214502969.html
2026-04-30 21:50:03+00:00,GILD,Zacks,Gilead Sciences (GILD) Outperforms Broader Market: What You Need to Know,https://finance.yahoo.com/markets/stocks/articles/gilead-sciences-gild-outperforms-broader-215003443.html
2026-04-30 21:50:03+00:00,FTNT,Zacks,Fortinet (FTNT) Stock Dips While Market Gains: Key Facts,https://finance.yahoo.com/markets/stocks/articles/fortinet-ftnt-stock-dips-while-215003410.html
2026-04-30 22:00:06+00:00,ROST,Zacks,Ross Stores (ROST) Laps the Stock Market: Here's Why,https://finance.yahoo.com/markets/stocks/articles/ross-stores-rost-laps-stock-220006552.html
2026-04-30 22:16:38+00:00,DXCM,MarketBeat,DexCom Q1 Earnings Call Highlights,https://finance.yahoo.com/sectors/healthcare/articles/dexcom-q1-earnings-call-highlights-221638551.html
2026-04-30 22:22:45+00:00,TXN,Insider Monkey,"Texas Instruments (TXN) Sees Stable Pricing in Q2, Signals Possible H2 Increases",https://finance.yahoo.com/markets/stocks/articles/texas-instruments-txn-sees-stable-222245650.html
2026-04-30 22:24:52+00:00,HON,Insider Monkey,"Jefferies, Barclays Cut Honeywell (HON) Targets After Q1, Flag Aerospace Concerns",https://finance.yahoo.com/markets/stocks/articles/jefferies-barclays-cut-honeywell-hon-222452907.html
2026-04-30 22:33:43+00:00,DXCM,Motley Fool,DexCom (DXCM) Q1 2026 Earnings Transcript,https://finance.yahoo.com/sectors/healthcare/articles/dexcom-dxcm-q1-2026-earnings-223343393.html
2026-04-30 22:54:34+00:00,AEP,Insider Monkey,"Bank of America Increases Atmos Energy (ATO) Target, Maintains Neutral Stance",https://finance.yahoo.com/markets/stocks/articles/bank-america-increases-atmos-energy-225434849.html
2026-04-30 23:05:29+00:00,AEP,Insider Monkey,Morgan Stanley Adjusts AEP Price Target Amid North America Utility Updates,https://finance.yahoo.com/markets/stocks/articles/morgan-stanley-adjusts-aep-price-230529413.html
2026-04-30 23:21:13+00:00,ISRG,MarketBeat,"Intuitive Surgical Shareholders Approve All Proposals at 2026 Annual Meeting, Elect 10 Directors",https://finance.yahoo.com/markets/stocks/articles/intuitive-surgical-shareholders-approve-proposals-232113311.html
2026-04-30 23:33:00+00:00,EA,PR Newswire,"Oak-Eagle AcquireCo, Inc. Announces Extension of the Expiration Time and Settlement Date for the Previously Announced Tender Offers and Consent Solicitations for Any and All of Electronic Arts Inc.'s 1.850% Senior Notes Due 2031 and 2.950% Senior Notes Due 2051",https://finance.yahoo.com/markets/stocks/articles/oak-eagle-acquireco-inc-announces-233300265.html
2026-05-01 00:00:00+00:00,CSCO,SEC-EDGAR-8K,"(Item 5.02) . Departure of Directors or Certain Officers; Election of Directors; Appointment of Certain Officers; Compensatory Arrangements of Certain Officers. Appointment of Officer; Departure of Officer On April 27, 2026, M. Victoria Wong notified Cisco Systems, Inc. (""Cisco"") of her decision to retire as Senior Vice President and Chief Accounting Officer of Cisco effective May 19, 2026. Ms. Wong will remain employed by Cisco as an Executive Advisor through July 25, 2026. On April 27 ,",
2026-05-01 00:00:00+00:00,CEG,SEC-EDGAR-8K,"(Item 5.07) . Submission of Matters to a Vote of Security Holders The Annual Meeting of Shareholders (“Annual Meeting”) of Constellation Energy Corporation (“Constellation”) was held on April 28, 2026. Shareholders of record as of March 4, 2026, were entitled to receive notice and vote at the Annual Meeting. At the Annual Meeting, the shareholders: 1. Elected eleven director nominees to the Board of Directors, each for a term of one year; 2. Approved, on an advisory",
