timestamp,ticker,source,text,url
2026-05-18 14:14:15+00:00,COST,reddit.com/r/stocks,"Mining vs. recycling - the edge of a proprietary recycling method - Investors looking at the antimony supply crisis are missing the ultimate asymmetric play. While traditional U.S. mines struggle to bring supply online by 2027/2028, **Campine NV** (Euronext: CAMB) is uniquely positioned to dominate the European (and global) market without digging a single hole in the ground. The primary mining thesis has a major flaw: high oil prices. A traditional Western mine must extract",
2026-05-18 14:21:40+00:00,META,reddit.com/r/stocks,"Flat index but risky stocks dumping. Bad news for longs. - Big corrections always start with risky high beta assets dumping quietly first. Markets are never flat, if it's not going up, it's going down. BREAKING: HUGE CHINA SLOWDOWN AND META LAYOFFS LOOMING AS AI REPLACES WHITE COLLAR JOBS China’s growth slowed across the board in April with investment resuming declines, calling into question the government’s reluctance to add stimulus to the economy as a",
2026-05-18 14:25:00+00:00,DDOG,Zacks,Should You Hold on to Autodesk Stock Despite Its 20% YTD Decline?,https://finance.yahoo.com/markets/stocks/articles/hold-autodesk-stock-despite-20-142500608.html
2026-05-18 14:25:00+00:00,ADSK,Zacks,Should You Hold on to Autodesk Stock Despite Its 20% YTD Decline?,https://finance.yahoo.com/markets/stocks/articles/hold-autodesk-stock-despite-20-142500608.html
2026-05-18 14:25:37+00:00,NVDA,reddit.com/r/stocks,"Going to take a break after NVDA Q1 earnings - It's been a crazy month. Did well on my general portfolio which was mostly bluechip tech and AI. Then read too much news and had FOMO and started trading options on memory and smaller semiconductor companies. I haven't exited all my positions yet, and had to do some options rollups to close positions but thinking with NVDA being one of the last companys to report",
2026-05-18 14:30:00+00:00,CHTR,PR Newswire,"SPECTRUM LAUNCHES ULTRA-LOW LATENCY INTERNET, DELIVERING FASTER REAL-TIME CONNECTIVITY",https://finance.yahoo.com/sectors/technology/articles/spectrum-launches-ultra-low-latency-143000035.html
2026-05-18 14:40:00+00:00,PANW,Zacks,CRWD vs. PANW: Which Cybersecurity Stock Has an Edge Right Now?,https://finance.yahoo.com/markets/stocks/articles/crwd-vs-panw-cybersecurity-stock-144000154.html
2026-05-18 14:40:10+00:00,SBUX,Barchart,Starbucks Layoffs: What to Know About the Latest SBUX Job Cuts,https://finance.yahoo.com/markets/stocks/articles/starbucks-layoffs-know-latest-sbux-144010805.html
2026-05-18 14:41:36+00:00,CHTR,Quartz,"Berkshire CEO Greg Abel sells 16 stocks, triples Alphabet",https://finance.yahoo.com/markets/stocks/articles/berkshire-ceo-greg-abel-sells-144136494.html
2026-05-18 14:42:00+00:00,TTWO,Zacks,Take-Two Before Q4 Earnings: What's in the Cards for the Stock?,https://finance.yahoo.com/markets/stocks/articles/two-q4-earnings-whats-cards-144200626.html
2026-05-18 14:45:59+00:00,TTWO,Insider Monkey,Jim Cramer Isn’t Buying The Negativity About Take-Two (TTWO),https://finance.yahoo.com/markets/stocks/articles/jim-cramer-isn-t-buying-144559557.html
2026-05-18 14:47:00+00:00,AMGN,GlobeNewswire,"Middle East and Africa Wearable Injectors Market Trends and Forecast Report 2026-2035 Featuring Amgen, BD, Biocon, Gerresheimer, Insulet, J&J, Medtronic, Roche, West Pharmaceutical, Ypsomed",https://finance.yahoo.com/sectors/healthcare/articles/middle-east-africa-wearable-injectors-144700339.html
2026-05-18 14:48:41+00:00,PANW,Insider Monkey,Jim Cramer Shares Why Palo Alto (PANW) Is Having The Last Laugh,https://finance.yahoo.com/markets/stocks/articles/jim-cramer-shares-why-palo-144841072.html
2026-05-18 14:52:00+00:00,KDP,Marketing Dive,Dr Pepper gets into microdramas for return of dirty soda-inspired flavor,https://finance.yahoo.com/sectors/technology/articles/dr-pepper-taps-microdrama-trend-145200705.html
2026-05-18 14:52:09+00:00,ADP,Insider Monkey,What Makes Automatic Data Processing (ADP) an Investment Bet?,https://finance.yahoo.com/markets/stocks/articles/makes-automatic-data-processing-adp-145209752.html
2026-05-18 14:53:45+00:00,ODFL,Barchart,Are Wall Street Analysts Predicting Old Dominion Freight Line Stock Will Climb or Sink?,https://finance.yahoo.com/markets/stocks/articles/wall-street-analysts-predicting-old-145345541.html
2026-05-18 14:54:00+00:00,SHOP,Zacks,"Shopify Stock Slips 26% in a Month: Should You Buy, Sell or Hold?",https://finance.yahoo.com/markets/stocks/articles/shopify-stock-slips-26-month-145400887.html
2026-05-18 14:59:52+00:00,CEG,MT Newswires,"NextEra, Dominion Merger Reinforces Power Infrastructure Supercycle Thesis, Wedbush Says",https://finance.yahoo.com/sectors/energy/articles/nextera-dominion-merger-reinforces-power-145952615.html
2026-05-18 15:00:00+00:00,TRI,PR Newswire,Thomson Reuters to Present at CIBC Technology & Innovation Conference,https://finance.yahoo.com/sectors/technology/articles/thomson-reuters-present-cibc-technology-150000609.html
2026-05-18 15:02:00+00:00,WDAY,Zacks,Can Healthy Revenue Growth Boost Workday's Q1 Earnings?,https://finance.yahoo.com/markets/stocks/articles/healthy-revenue-growth-boost-workdays-150200501.html
2026-05-18 15:02:47+00:00,ROST,Trefis,Why Berkshire’s $55M Macy's Bet Matters,https://finance.yahoo.com/markets/stocks/articles/why-berkshire-55m-macys-bet-150247714.html
2026-05-18 15:11:03+00:00,LITE,Insider Monkey,Lumentum (LITE) Joins Nasdaq-100 Index,https://finance.yahoo.com/markets/stocks/articles/lumentum-lite-joins-nasdaq-100-151103613.html
2026-05-18 15:12:43+00:00,ADSK,Simply Wall St.,Is Autodesk (ADSK) Offering Value After A 20% One Year Share Price Decline?,https://finance.yahoo.com/markets/stocks/articles/autodesk-adsk-offering-value-20-151243364.html
2026-05-18 15:18:00+00:00,TXN,Zacks,ON Semiconductor Stock Soars 60% in 3 Months: Still a Smart Bet?,https://finance.yahoo.com/markets/stocks/articles/semiconductor-stock-soars-60-3-151800063.html
2026-05-18 15:18:42+00:00,AMGN,Benzinga,Amgen Japanese Partner Urges Caution On Tavneos Use,https://finance.yahoo.com/sectors/healthcare/articles/amgen-japanese-partner-urges-caution-151842025.html
2026-05-18 15:21:00+00:00,LITE,Barrons.com,"Lumentum, Coherent Drop After Prominent AI Investor Sells Stakes",https://www.barrons.com/articles/umentum-coherent-stock-leopold-aschenbrenner-ai-11023a1b?siteid=yhoof2&yptr=yahoo
2026-05-18 15:22:19+00:00,PANW,24/7 Wall St.,KeyBanc Just Hiked CrowdStrike Price Target to $700. Is Mythos the Real Catalyst?,https://finance.yahoo.com/markets/stocks/articles/keybanc-just-hiked-crowdstrike-price-152219755.html
2026-05-18 15:23:33+00:00,HON,Insider Monkey,Why Could Honeywell International (HON) Spin-Off Plans Drive Significant Upside,https://finance.yahoo.com/markets/stocks/articles/why-could-honeywell-international-hon-152333392.html
2026-05-18 15:25:54+00:00,FTNT,Barchart,Stocks Pressured by a Rebound in Crude Prices and Bond Yields,https://finance.yahoo.com/markets/stocks/articles/stocks-pressured-rebound-crude-prices-152554871.html
2026-05-18 15:25:54+00:00,PANW,Barchart,Stocks Pressured by a Rebound in Crude Prices and Bond Yields,https://finance.yahoo.com/markets/stocks/articles/stocks-pressured-rebound-crude-prices-152554871.html
2026-05-18 15:25:54+00:00,REGN,Barchart,Stocks Pressured by a Rebound in Crude Prices and Bond Yields,https://finance.yahoo.com/markets/stocks/articles/stocks-pressured-rebound-crude-prices-152554871.html
2026-05-18 15:25:54+00:00,KLAC,Barchart,Stocks Pressured by a Rebound in Crude Prices and Bond Yields,https://finance.yahoo.com/markets/stocks/articles/stocks-pressured-rebound-crude-prices-152554871.html
2026-05-18 15:28:00+00:00,ROST,Zacks,Ross Stores Gears Up to Report Q1 Earnings: Is a Beat in Store?,https://finance.yahoo.com/markets/stocks/articles/ross-stores-gears-report-q1-152800882.html
2026-05-18 15:32:52+00:00,AMGN,MT Newswires,Update: Amgen Kidney Disease Drug Under Scrutiny in Japan,https://finance.yahoo.com/sectors/healthcare/articles/amgen-kidney-disease-drug-under-153252837.html
2026-05-18 15:34:00+00:00,GILD,GlobeNewswire,"Hepatic Cirrhosis Market Research and Forecast Report 2026-2036, Profiles of Abbott, Astellas Pharma, Gilead Sciences, Novartis, Takeda Pharma, Grifols Therapeutics, and Cellaion",https://finance.yahoo.com/sectors/healthcare/articles/hepatic-cirrhosis-market-research-forecast-153400684.html
2026-05-18 15:34:27+00:00,ROST,Investing.com,Truist sees strength in off-price leaders TJX and Ross Stores,https://finance.yahoo.com/markets/stocks/articles/truist-sees-strength-off-price-153427987.html
2026-05-18 15:40:02+00:00,ADBE,Zacks,ADBE or CDNS: Which Is the Better Value Stock Right Now?,https://finance.yahoo.com/markets/stocks/articles/adbe-cdns-better-value-stock-154002932.html
2026-05-18 15:40:02+00:00,CDNS,Zacks,ADBE or CDNS: Which Is the Better Value Stock Right Now?,https://finance.yahoo.com/markets/stocks/articles/adbe-cdns-better-value-stock-154002932.html
2026-05-18 15:40:05+00:00,ADSK,Zacks,PAYC vs. ADSK: Which Stock Is the Better Value Option?,https://finance.yahoo.com/markets/stocks/articles/payc-vs-adsk-stock-better-154005088.html
2026-05-18 15:49:00+00:00,SBUX,Zacks,Do Options Traders Know Something About Starbucks Stock We Don't?,https://finance.yahoo.com/markets/options/articles/options-traders-know-something-starbucks-154900985.html
2026-05-18 15:53:48+00:00,PEP,Exec Edge,Barfresh: Q1 Revenue Beats Expectations Amid Customer Recovery  – Quarterly Update Report,https://finance.yahoo.com/markets/stocks/articles/barfresh-q1-revenue-beats-expectations-155348778.html
2026-05-18 15:55:00+00:00,KLAC,MarketBeat,From High-Yield to High-Growth: 3 Stocks Boosting Dividends,https://finance.yahoo.com/markets/stocks/articles/high-yield-high-growth-3-155500042.html
2026-05-18 15:55:00+00:00,PEP,MarketBeat,From High-Yield to High-Growth: 3 Stocks Boosting Dividends,https://finance.yahoo.com/markets/stocks/articles/high-yield-high-growth-3-155500042.html
2026-05-18 16:03:00+00:00,SBUX,TheStreet,"Starbucks delivers tough update on regional offices, cuts 100s of jobs",https://finance.yahoo.com/markets/stocks/articles/starbucks-delivers-tough-regional-offices-160300653.html
2026-05-18 16:08:11+00:00,WDC,Motley Fool,Why Did Sandisk Stock Drop Today?,https://finance.yahoo.com/markets/stocks/articles/why-did-sandisk-stock-drop-160811384.html
2026-05-18 16:17:15+00:00,PANW,Barrons.com,Palo Alto Stock Staring at Its Longest Winning Streak in 3 Years,https://www.barrons.com/livecoverage/stock-market-news-today-051826/card/palo-alto-stock-staring-at-its-longest-winning-streak-in-3-years-iKZbYSymQeSYG42j3laJ?siteid=yhoof2&yptr=yahoo
2026-05-18 16:18:00+00:00,ADSK,Zacks,Intuit Gears Up to Report Q3 Earnings: What's in the Offing?,https://finance.yahoo.com/markets/stocks/articles/intuit-gears-report-q3-earnings-161800024.html
2026-05-18 16:38:29+00:00,PANW,Investor's Business Daily,"Cybersecurity Stocks: Rosenblatt Hikes CrowdStrike, Palo Alto Price Targets",https://www.investors.com/news/technology/rosenblatt-cybersecurity-stocks-crowdstrike-stock-palo-alto-stock/?src=A00220&yptr=yahoo
2026-05-18 16:39:43+00:00,WDC,Motley Fool,Why Did Micron Stock Drop Today?,https://finance.yahoo.com/markets/stocks/articles/why-did-micron-stock-drop-163943515.html
2026-05-18 16:41:30+00:00,LITE,24/7 Wall St.,"Applied Optoelectronics Slumps 10%, Lumentum Dives 9%, Coherent Drops 6% as AI Optics Profit-Takers Strike",https://finance.yahoo.com/markets/stocks/articles/applied-optoelectronics-slumps-10-lumentum-164130403.html
2026-05-18 16:47:34+00:00,FAST,reddit.com/r/stocks,"Sweetgreen SG strong breakout, squeeze analysis, wraps & sales rebound - Sweetgreen SG has finally broken out of a long term chop, put in a strong bottom, and is poised for a strong rebound driven by fundamentals including revenue and margin expansion from wraps addition, same store sales return to positivity, Spyce divestiture, and a marketing strategy pivot that is yielding positive social media results. Wraps are an easy win for SG in targeting cost-sensitive",
2026-05-18 16:47:34+00:00,COST,reddit.com/r/stocks,"Sweetgreen SG strong breakout, squeeze analysis, wraps & sales rebound - Sweetgreen SG has finally broken out of a long term chop, put in a strong bottom, and is poised for a strong rebound driven by fundamentals including revenue and margin expansion from wraps addition, same store sales return to positivity, Spyce divestiture, and a marketing strategy pivot that is yielding positive social media results. Wraps are an easy win for SG in targeting cost-sensitive",
2026-05-18 16:53:08+00:00,CEG,Trefis,Can NuScale Power Stock Grow 10x?,https://finance.yahoo.com/markets/stocks/articles/nuscale-power-stock-grow-10x-165308506.html
2026-05-18 16:57:00+00:00,CEG,Barrons.com,The Long Regulatory Road Ahead for the NextEra-Dominion Deal,https://www.barrons.com/articles/nextera-dominion-energy-merger-regulation-c223dbb0?siteid=yhoof2&yptr=yahoo
2026-05-18 17:10:00+00:00,KLAC,Zacks,"ASML Expands Globally, Joins Tata for India Semiconductor Hub",https://finance.yahoo.com/sectors/technology/articles/asml-expands-globally-joins-tata-171000538.html
2026-05-18 17:17:44+00:00,LIN,Trefis,Plug Power’s Hydrogen Bet Is Starting To Look Real Again,https://finance.yahoo.com/sectors/energy/articles/plug-power-hydrogen-bet-starting-171744898.html
2026-05-18 17:20:04+00:00,TTWO,Barchart,Take-Two Stock Popped on GTA 6 Updates. Its Investors Needed a New Dose of Optimism.,https://finance.yahoo.com/markets/stocks/articles/two-stock-popped-gta-6-172004223.html
2026-05-18 17:35:00+00:00,BKNG,Motley Fool,"3 Stocks That Have Turned $15,000 Into $4 Million in 20 Years",https://finance.yahoo.com/markets/stocks/articles/3-stocks-turned-15-000-173500464.html
2026-05-18 17:35:40+00:00,APP,Simply Wall St.,3 Growth Stocks Insiders Are Betting On,https://finance.yahoo.com/markets/stocks/articles/3-growth-stocks-insiders-betting-173540494.html
2026-05-18 17:38:03+00:00,MELI,Simply Wall St.,3 Stocks That May Be Priced Below Their Estimated Value In May 2026,https://finance.yahoo.com/markets/stocks/articles/3-stocks-may-priced-below-173803480.html
2026-05-18 17:40:55+00:00,DASH,StockStory,The Top 5 Analyst Questions From Lyft’s Q1 Earnings Call,https://finance.yahoo.com/markets/stocks/articles/top-5-analyst-questions-lyft-174055280.html
2026-05-18 17:41:00+00:00,ROST,Barrons.com,"Walmart, Target, and More Retail Earnings Are Coming. Look for Clues on How Gas Prices Are Hitting Consumers.",https://www.barrons.com/articles/walmart-target-retail-earnings-gas-prices-consumers-e94cd4e5?siteid=yhoof2&yptr=yahoo
2026-05-18 17:49:29+00:00,REGN,MT Newswires,"US Equity Indexes Mixed, Crude Oil Rises as Iran Reportedly Sends Revised Peace Proposal",https://finance.yahoo.com/markets/stocks/articles/us-equity-indexes-mixed-crude-174929335.html
2026-05-18 18:00:19+00:00,DASH,Bloomberg,"Uber Boosts Stake in Delivery Hero, Says No Takeover for Now",https://finance.yahoo.com/markets/stocks/articles/uber-boosts-stake-delivery-hero-180019384.html
2026-05-18 18:09:00+00:00,PEP,Barrons.com,Consumer Staples Are Back in Vogue. Revisiting Coca-Cola and Target.,https://www.barrons.com/articles/consumer-staples-coca-cola-target-stock-fc6f3774?siteid=yhoof2&yptr=yahoo
2026-05-18 18:14:19+00:00,ALNY,Simply Wall St.,How Investors Are Reacting To Alnylam Pharmaceuticals (ALNY) New HELIOS-B Vutrisiran Data And Real-World Study,https://finance.yahoo.com/sectors/healthcare/articles/investors-reacting-alnylam-pharmaceuticals-alny-181419488.html
2026-05-18 18:15:00+00:00,REGN,Zacks,Regeneron's Late-Stage Melanoma Study Misses Primary Goal,https://finance.yahoo.com/sectors/healthcare/articles/regenerons-stage-melanoma-study-misses-181500709.html
2026-05-18 18:32:12+00:00,WDC,Barchart,"Dear Sandisk Stock Fans, Mark Your Calendars for May 20",https://finance.yahoo.com/markets/stocks/articles/dear-sandisk-stock-fans-mark-183212393.html
2026-05-18 18:45:48+00:00,BKR,Rigzone.com,North America Adds More Rigs WoW,https://finance.yahoo.com/sectors/energy/articles/north-america-adds-more-rigs-184548053.html
2026-05-18 18:54:34+00:00,PEP,24/7 Wall St.,PepsiCo’s Next Big Rally Could Be Just Getting Started,https://finance.yahoo.com/markets/stocks/articles/pepsico-next-big-rally-could-185434165.html
2026-05-18 19:15:00+00:00,SBUX,Business Wire,Starbucks Corporation Announces Pricing Terms for its Upsized Tender Offers for Eight Series of Notes,https://finance.yahoo.com/markets/stocks/articles/starbucks-corporation-announces-pricing-terms-191500425.html
2026-05-18 19:32:55+00:00,DASH,StockStory,"DoorDash (DASH) Stock Is Up, What You Need To Know",https://finance.yahoo.com/markets/stocks/articles/doordash-dash-stock-know-193255620.html
2026-05-18 19:44:37+00:00,REGN,Barchart,Regeneron Sinks 10% on Failed Phase 3 Melanoma Trial. What Comes Next for REGN Stock.,https://finance.yahoo.com/sectors/healthcare/articles/regeneron-sinks-10-failed-phase-194437033.html
2026-05-18 19:55:51+00:00,LITE,Barchart,Lumentum Stock Is Up 163% in 2026. Tiger Global Added a New Stake in Q1.,https://finance.yahoo.com/markets/stocks/articles/lumentum-stock-163-2026-tiger-195551670.html
2026-05-18 19:56:39+00:00,CHTR,Motley Fool,Berkshire Hathaway's Greg Abel Thinks Alphabet Is a Better Magnificent Seven Stock Than Amazon. Here's Why He's Right.,https://finance.yahoo.com/markets/stocks/articles/berkshire-hathaways-greg-abel-thinks-195639394.html
2026-05-18 20:00:10+00:00,DASH,Insider Monkey,Wolfe Research Names DoorDash (DASH) As its Top Picks,https://finance.yahoo.com/markets/stocks/articles/wolfe-research-names-doordash-dash-200010641.html
2026-05-18 20:00:35+00:00,ARM,Insider Monkey,Evercore ISI Maintains Outperform Rating on Advanced Micro Devices (AMD),https://finance.yahoo.com/markets/stocks/articles/evercore-isi-maintains-outperform-rating-200035483.html
2026-05-18 20:01:58+00:00,WDAY,Insider Monkey,Workday (WDAY) Partners With Anthropic and the Local Initiatives Support Corporation,https://finance.yahoo.com/markets/stocks/articles/workday-wday-partners-anthropic-local-200158248.html
2026-05-18 20:04:16+00:00,REGN,MT Newswires,US Equity Markets Mixed as Investors Weigh Reports of Iran's Updated Peace Proposal,https://finance.yahoo.com/markets/stocks/articles/us-equity-markets-mixed-investors-200416416.html
2026-05-18 20:05:50+00:00,REGN,Investor's Business Daily,The Surprising Reason Regeneron Pharmaceuticals Just Dropped 10%,https://www.investors.com/news/technology/regeneron-stock-metastatic-melanoma-treatment-failure/?src=A00220&yptr=yahoo
2026-05-18 20:18:00+00:00,SHOP,Barrons.com,"BofA Reinstates Coverage of ServiceNow, Salesforce. It Says 1 Is an AI Beneficiary.",https://www.barrons.com/articles/servicenow-salesforce-stock-price-ai-7b109396?siteid=yhoof2&yptr=yahoo
2026-05-18 20:18:00+00:00,ADBE,Barrons.com,"BofA Reinstates Coverage of ServiceNow, Salesforce. It Says 1 Is an AI Beneficiary.",https://www.barrons.com/articles/servicenow-salesforce-stock-price-ai-7b109396?siteid=yhoof2&yptr=yahoo
2026-05-18 20:18:31+00:00,AEP,Reuters Videos,CIO touts 'AIR 7' as AI-heavy alternative to 'Magnificent 7',https://finance.yahoo.com/video/cio-touts-air-7-ai-201831728.html
2026-05-18 20:35:50+00:00,FTNT,Barchart,Stocks Settle Mixed as Iran War Remains Unresolved,https://finance.yahoo.com/markets/stocks/articles/stocks-settle-mixed-iran-war-203550868.html
2026-05-18 20:35:50+00:00,PANW,Barchart,Stocks Settle Mixed as Iran War Remains Unresolved,https://finance.yahoo.com/markets/stocks/articles/stocks-settle-mixed-iran-war-203550868.html
2026-05-18 20:35:50+00:00,KLAC,Barchart,Stocks Settle Mixed as Iran War Remains Unresolved,https://finance.yahoo.com/markets/stocks/articles/stocks-settle-mixed-iran-war-203550868.html
2026-05-18 20:35:50+00:00,WDC,Barchart,Stocks Settle Mixed as Iran War Remains Unresolved,https://finance.yahoo.com/markets/stocks/articles/stocks-settle-mixed-iran-war-203550868.html
2026-05-18 20:35:50+00:00,MCHP,Barchart,Stocks Settle Mixed as Iran War Remains Unresolved,https://finance.yahoo.com/markets/stocks/articles/stocks-settle-mixed-iran-war-203550868.html
2026-05-18 20:35:50+00:00,CTSH,Barchart,Stocks Settle Mixed as Iran War Remains Unresolved,https://finance.yahoo.com/markets/stocks/articles/stocks-settle-mixed-iran-war-203550868.html
2026-05-18 20:35:50+00:00,REGN,Barchart,Stocks Settle Mixed as Iran War Remains Unresolved,https://finance.yahoo.com/markets/stocks/articles/stocks-settle-mixed-iran-war-203550868.html
2026-05-18 20:45:44+00:00,SBUX,Yahoo Finance Video,Memorial Day travel demand set to break records despite higher costs,https://finance.yahoo.com/video/memorial-day-travel-demand-set-to-break-records-despite-higher-costs-204544072.html
2026-05-18 20:51:00+00:00,NFLX,Motley Fool,Is Now the Time to Buy Forgotten FAANG Stock Netflix?,https://finance.yahoo.com/markets/stocks/articles/now-time-buy-forgotten-faang-205100592.html
2026-05-18 20:54:00+00:00,LITE,Barrons.com,How Nvidia Stock Can Hit $300 After Earnings,https://www.barrons.com/articles/nvidia-stock-price-earnings-ai-chips-d8ad77b8?siteid=yhoof2&yptr=yahoo
2026-05-18 20:55:00+00:00,REGN,Barrons.com,Regeneron Stock Sinks as Key Melanoma Drug Trial Fails to Beat Merck’s Keytruda,https://www.barrons.com/articles/regeneron-stock-melanoma-drug-trial-merck-keytruda-99d0d160?siteid=yhoof2&yptr=yahoo
2026-05-18 21:10:35+00:00,AMGN,Insider Monkey,Amgen (AMGN) Gets Price Target Cut at Piper Sandler Despite Long-Term Growth Optimism,https://finance.yahoo.com/markets/stocks/articles/amgen-amgn-gets-price-target-211035381.html
2026-05-18 21:10:44+00:00,REGN,MT Newswires,US Equity Indexes Off Session Lows as Trump Postpones Iran Attack,https://finance.yahoo.com/markets/stocks/articles/us-equity-indexes-off-session-211044941.html
2026-05-18 21:14:40+00:00,WDC,Simply Wall St.,Why The Western Digital (WDC) Story Is Shifting On New Earnings And AI Storage Expectations,https://finance.yahoo.com/markets/stocks/articles/why-western-digital-wdc-story-211440009.html
2026-05-18 21:15:54+00:00,ISRG,Simply Wall St.,Assessing Intuitive Surgical (ISRG) Valuation After The Recent Share Price Pullback,https://finance.yahoo.com/markets/stocks/articles/assessing-intuitive-surgical-isrg-valuation-211554740.html
2026-05-18 21:19:01+00:00,LITE,IPO-Edge.com,POET Technologies Secures US$400M Strategic Investment,https://finance.yahoo.com/markets/stocks/articles/poet-technologies-secures-us-400m-211901619.html
2026-05-18 21:20:00+00:00,REGN,Barrons.com,"These Stocks Are Today’s Movers: Dominion Energy, ServiceNow, Ford, Tesla, Lumentum, Micron, UnitedHealth, and More",https://www.barrons.com/articles/stock-movers-28d5e3cc?siteid=yhoof2&yptr=yahoo
2026-05-18 21:30:00+00:00,MSTR,Coinage Coop,Crypto Still Facing Doomsday Scenario Despite A Big Senate Win,https://finance.yahoo.com/markets/crypto/articles/crypto-still-facing-doomsday-scenario-213000684.html
2026-05-18 21:45:04+00:00,PANW,Zacks,Palo Alto Networks (PANW) Advances While Market Declines: Some Information for Investors,https://finance.yahoo.com/markets/stocks/articles/palo-alto-networks-panw-advances-214504362.html
2026-05-18 21:56:03+00:00,WDC,IPO-Edge.com,The Spill: Apple (AAPL) Just Crushed It. Now What?,https://finance.yahoo.com/markets/stocks/articles/spill-apple-aapl-just-crushed-215603939.html
2026-05-18 22:36:55+00:00,ZS,StockStory,"Zscaler (ZS) Stock Is Up, What You Need To Know",https://finance.yahoo.com/markets/stocks/articles/zscaler-zs-stock-know-223655309.html
2026-05-18 22:52:55+00:00,MSTR,StockStory,"BlackLine, Upland Software, ServiceNow, Strategy, and AppLovin Stocks Trade Up, What You Need To Know",https://finance.yahoo.com/markets/stocks/articles/blackline-upland-software-servicenow-strategy-225255680.html
2026-05-18 22:52:55+00:00,PANW,StockStory,"Asana, Elastic, C3.ai, Palo Alto Networks, and RingCentral Shares Are Soaring, What You Need To Know",https://finance.yahoo.com/markets/stocks/articles/asana-elastic-c3-ai-palo-225255120.html
2026-05-18 22:52:55+00:00,APP,StockStory,"BlackLine, Upland Software, ServiceNow, Strategy, and AppLovin Stocks Trade Up, What You Need To Know",https://finance.yahoo.com/markets/stocks/articles/blackline-upland-software-servicenow-strategy-225255680.html
2026-05-18 23:17:00+00:00,SHOP,TheStreet,Cathie Wood buys 33M of Canadian tech stock,https://finance.yahoo.com/markets/stocks/articles/cathie-wood-buys-33m-canadian-231700418.html
2026-05-19 00:00:00+00:00,AMGN,SEC-EDGAR-8K,"(Item 5.02) Departure of Directors or Certain Officers; Election of Directors; Appointment of Certain Officers; Compensatory Arrangements of Certain Officers. Retirement of Peter H. Griffith, Chief Financial Officer On May 19, 2026, Amgen Inc. (the “Company”) publicly announced that Peter H. Griffith will retire from the role of the Company’s Executive Vice President and Chief Financial Officer, effective August 31, 2026. In connection with the transition of his role, Mr. Griffith will remain employed as an Executive",
