timestamp,ticker,source,text,url
2025-08-17 19:47:10+00:00,ON,reddit.com/r/stocks,Thoughts on Brinker? ticker EAT. Up 18% YTD and UP 139% past year? - Just from a consumer perspective I think Chillies is great value quality and service. It’s cheaper than fast food with the quality of a sit down restaurant. Is it too late did I miss the boat? I was debating investing in them a year ago at about $70 per share. Haven’t dipped to much into their finances. However I truly believe,
2025-08-17 20:13:00+00:00,EXC,Business Wire,ComEd Restores Power to 80 Percent of Customers Impacted by Pair of Weekend Storms,https://finance.yahoo.com/news/comed-restores-power-80-percent-201300093.html
2025-08-17 21:08:51+00:00,FTNT,Insider Monkey,"CrowdStrike Holdings, Inc. (CRWD)’s CEO Is “Incredibly Competitive,” Says Jim Cramer",https://finance.yahoo.com/news/crowdstrike-holdings-inc-crwd-ceo-210851595.html
2025-08-17 21:08:51+00:00,CRWD,Insider Monkey,"CrowdStrike Holdings, Inc. (CRWD)’s CEO Is “Incredibly Competitive,” Says Jim Cramer",https://finance.yahoo.com/news/crowdstrike-holdings-inc-crwd-ceo-210851595.html
2025-08-17 21:09:09+00:00,COST,Insider Monkey,Target Corporation (TGT): I Thought The Ulta Beauty Partnership Ending Was Very Significant,https://finance.yahoo.com/news/target-corporation-tgt-thought-ulta-210909799.html
2025-08-17 21:43:53+00:00,CEG,Insider Monkey,"Constellation Energy (CEG) Strikes 20-Year PPA with Meta, Boosts Nuclear Expansion Plans",https://finance.yahoo.com/news/constellation-energy-ceg-strikes-20-214353172.html
2025-08-17 23:39:03+00:00,ON,reddit.com/r/stocks,"BYD: The Tesla Killer Nobody Wants to Talk About? - Okay here me out BYD is the EV company of the future not Tesla... In 2024 BYD sold 4.27M cars worldwide, compared to tesla 1.79M, and in just Q2 2025 BYD moved 1.13M vehicles while Tesla moved 354K, so 3X the volume. There is also the tech and supply chain and BYD has it wrapped. They build their batteries, motors, electronics, the list goes on.",
2025-08-17 23:39:03+00:00,COST,reddit.com/r/stocks,"BYD: The Tesla Killer Nobody Wants to Talk About? - Okay here me out BYD is the EV company of the future not Tesla... In 2024 BYD sold 4.27M cars worldwide, compared to tesla 1.79M, and in just Q2 2025 BYD moved 1.13M vehicles while Tesla moved 354K, so 3X the volume. There is also the tech and supply chain and BYD has it wrapped. They build their batteries, motors, electronics, the list goes on.",
2025-08-18 00:00:00+00:00,BKR,SEC-EDGAR-8K,"(Item 1.01) Entry Into a Material Definitive Agreement. On August 15, 2025, Baker Hughes Holdings LLC (“BHH”), as borrower, and Baker Hughes Company (“BHC”), as parent guarantor, entered into a term loan credit agreement (the “Term Loan Credit Agreement”) with the lender parties thereto (the “Lenders”) and Goldman Sachs Bank USA (the “Administrative Agent”), as administrative agent, with aggregate lending commitments of $2.6 billion for a senior, unsecured delayed draw term loan facility in connection with BHC’s

(Item 1.01) above is hereby incorporated by reference in its entirety into this",
2025-08-18 00:00:00+00:00,NXPI,SEC-EDGAR-8K,"(Item 8.01) Other Events. On August 12, 2025, NXP B.V., NXP Funding LLC, NXP USA, Inc. (the “ Issuers ”) and NXP Semiconductors N.V. (the “ Company ”) executed and delivered an underwriting agreement (the “ Underwriting Agreement ”), by and among the Issuers, the Company and Barclays Capital Inc., Goldman Sachs & Co. LLC, J.P. Morgan Securities LLC, PNC Capital Markets LLC and UBS Securities LLC, as representatives of the several underwriters named therein (collectively, the",
2025-08-18 00:00:00+00:00,CHTR,SEC-EDGAR-8K,"(ITEM 8.01) . OTHER EVENTS. As previously disclosed, on May 16, 2025, Charter Communications, Inc., a Delaware corporation (“Charter”), entered into a Transaction Agreement (the “Transaction Agreement”) by and among Charter, Charter Communications Holdings, LLC, a Delaware limited liability company and subsidiary of Charter (“Charter Holdings”), and Cox Enterprises, Inc., a Delaware corporation (“Cox Enterprises”), pursuant to which (i) Cox Enterprises will sell and transfer to Charter 100% of the equity interests of certain subsidiaries of Cox",
2025-08-18 00:00:00+00:00,PANW,SEC-EDGAR-8K,"(Item 2.02) Results of Operations and Financial Condition. On August 18, 2025, Palo Alto Networks, Inc. (the “Company”) issued a press release announcing its financial results for its fourth quarter and fiscal year ended July 31, 2025. A copy of the press release is furnished herewith as Exhibit 99.1 and is incorporated herein by reference. The information contained in this

(Item 2.02) and in the accompanying Exhibit 99.1 shall not be deemed “filed” for purposes of Section 18 of the Securities Exchange Act of 1934, as amended (the “Exchange Act”), or incorporated by reference in any filing under the Securities Act of 1933, as amended, or the Exchange Act, regardless of any general incorporation language in such filing, unless expressly incorporated by specific reference in such filing.

(Item 5.02) Departure of Directors or Certain Officers; Election of Directors; Appointment of Certain Officers; Compensatory Arrangements of Certain Officers. Nir Zuk On August 13, 2025, Nir Zuk informed the Board of Directors (the “Board”) of the Company of his resignation as the Company’s Chief Technology Officer and as a director on the Board, effective August 14, 2025. Mr. Zuk is expected to continue to provide advisory services to the Company through November 2, 2026, in connection",
2025-08-18 00:00:00+00:00,MSTR,SEC-EDGAR-8K,"(Item 8.01) Other Events. ATM Updates On August 18, 2025, Strategy Inc (“Strategy” or the “Company”) announced updates with respect to its at-the-market offering programs: ATM Program Summary During Period August 11, 2025 to August 17, 2025 As of August 17, 2025 Shares Sold Notional Value (in millions) (1) Net Proceeds (in millions) (2) Available for Issuance and Sale (in millions) Common ATM - - - $17,042.7 $21 billion of class A common stock, $0.001 par value",
2025-08-18 01:05:00+00:00,BKNG,PR Newswire,Agoda Unveils Return Visitor Ranking of Asian Cities That Keep Travelers Coming Back for More,https://finance.yahoo.com/news/agoda-unveils-return-visitor-ranking-010500933.html
2025-08-18 02:05:00+00:00,BKNG,PR Newswire,Agoda's 2025 Return Visitor Rank Unveils Cities Across the Philippines That Keep Drawing Travelers Back,https://finance.yahoo.com/news/agodas-2025-return-visitor-rank-020500278.html
2025-08-18 02:28:43+00:00,ON,reddit.com/r/stocks,"Does value investing still work in this market? - Been watching names like TSLA, RDDT, APPL and COIN, but honestly it feels like earnings and fundamentals barely matter right now. Sometimes great numbers come out and the stock still tanks, or the opposite happens. Makes me wonder if the old-school way of picking stocks by digging into reports and waiting for “fair value” still works, or if it is time to focus more on sentiment,",
2025-08-18 02:28:43+00:00,TSLA,reddit.com/r/stocks,"Does value investing still work in this market? - Been watching names like TSLA, RDDT, APPL and COIN, but honestly it feels like earnings and fundamentals barely matter right now. Sometimes great numbers come out and the stock still tanks, or the opposite happens. Makes me wonder if the old-school way of picking stocks by digging into reports and waiting for “fair value” still works, or if it is time to focus more on sentiment,",
2025-08-18 03:39:58+00:00,NVDA,reddit.com/r/stocks,"$OSCR INSTITUTIONAL OWNERSHIP IS SKYROCKETING IN 2025. - IN Q2 MORGAN STANLEY INCREASED ITS STAKE BY 169%. SUSQUEHANNA INTERNATIONAL INCREASED ITS STAKE BY 176%. GOLDMAN SACHS INCREASED ITS STAKE BY 97%. D. E. SHAW & CO INCREASED ITS STAKE BY 516%. FARALLON CAPITAL MANAGEMENT INCREASED ITS STAKE BY 13318%. JUMP FINANCIAL INCREASED ITS STAKE BY 798%. Latest 13F filings show institutions are also piling into $UNH, $AMZN, $NVDA, $MSFT, $NFLX, $ORCL, $ARM, $DHI, $AIFU, $LEN,",
2025-08-18 03:39:58+00:00,NFLX,reddit.com/r/stocks,"$OSCR INSTITUTIONAL OWNERSHIP IS SKYROCKETING IN 2025. - IN Q2 MORGAN STANLEY INCREASED ITS STAKE BY 169%. SUSQUEHANNA INTERNATIONAL INCREASED ITS STAKE BY 176%. GOLDMAN SACHS INCREASED ITS STAKE BY 97%. D. E. SHAW & CO INCREASED ITS STAKE BY 516%. FARALLON CAPITAL MANAGEMENT INCREASED ITS STAKE BY 13318%. JUMP FINANCIAL INCREASED ITS STAKE BY 798%. Latest 13F filings show institutions are also piling into $UNH, $AMZN, $NVDA, $MSFT, $NFLX, $ORCL, $ARM, $DHI, $AIFU, $LEN,",
2025-08-18 03:39:58+00:00,MSFT,reddit.com/r/stocks,"$OSCR INSTITUTIONAL OWNERSHIP IS SKYROCKETING IN 2025. - IN Q2 MORGAN STANLEY INCREASED ITS STAKE BY 169%. SUSQUEHANNA INTERNATIONAL INCREASED ITS STAKE BY 176%. GOLDMAN SACHS INCREASED ITS STAKE BY 97%. D. E. SHAW & CO INCREASED ITS STAKE BY 516%. FARALLON CAPITAL MANAGEMENT INCREASED ITS STAKE BY 13318%. JUMP FINANCIAL INCREASED ITS STAKE BY 798%. Latest 13F filings show institutions are also piling into $UNH, $AMZN, $NVDA, $MSFT, $NFLX, $ORCL, $ARM, $DHI, $AIFU, $LEN,",
2025-08-18 03:39:58+00:00,ARM,reddit.com/r/stocks,"$OSCR INSTITUTIONAL OWNERSHIP IS SKYROCKETING IN 2025. - IN Q2 MORGAN STANLEY INCREASED ITS STAKE BY 169%. SUSQUEHANNA INTERNATIONAL INCREASED ITS STAKE BY 176%. GOLDMAN SACHS INCREASED ITS STAKE BY 97%. D. E. SHAW & CO INCREASED ITS STAKE BY 516%. FARALLON CAPITAL MANAGEMENT INCREASED ITS STAKE BY 13318%. JUMP FINANCIAL INCREASED ITS STAKE BY 798%. Latest 13F filings show institutions are also piling into $UNH, $AMZN, $NVDA, $MSFT, $NFLX, $ORCL, $ARM, $DHI, $AIFU, $LEN,",
2025-08-18 03:39:58+00:00,AMZN,reddit.com/r/stocks,"$OSCR INSTITUTIONAL OWNERSHIP IS SKYROCKETING IN 2025. - IN Q2 MORGAN STANLEY INCREASED ITS STAKE BY 169%. SUSQUEHANNA INTERNATIONAL INCREASED ITS STAKE BY 176%. GOLDMAN SACHS INCREASED ITS STAKE BY 97%. D. E. SHAW & CO INCREASED ITS STAKE BY 516%. FARALLON CAPITAL MANAGEMENT INCREASED ITS STAKE BY 13318%. JUMP FINANCIAL INCREASED ITS STAKE BY 798%. Latest 13F filings show institutions are also piling into $UNH, $AMZN, $NVDA, $MSFT, $NFLX, $ORCL, $ARM, $DHI, $AIFU, $LEN,",
2025-08-18 03:56:48+00:00,NFLX,Insider Monkey,"Netflix (NFLX) Keeps Momentum with Strong Content Pipeline, Says Piper Sandler",https://finance.yahoo.com/news/netflix-nflx-keeps-momentum-strong-035648899.html
2025-08-18 04:00:44+00:00,KHC,StockStory,3 Reasons to Sell KHC and 1 Stock to Buy Instead,https://finance.yahoo.com/news/3-reasons-sell-khc-1-040044495.html
2025-08-18 04:01:11+00:00,MAR,StockStory,3 Reasons MAR is Risky and 1 Stock to Buy Instead,https://finance.yahoo.com/news/3-reasons-mar-risky-1-040111872.html
2025-08-18 04:23:08+00:00,LULU,Insider Monkey,"Wells Fargo Lowered the Firm’s PT on Lululemon Athletica (LULU), Kept an Equal Weight Rating",https://finance.yahoo.com/news/wells-fargo-lowered-firm-pt-042308224.html
2025-08-18 04:23:09+00:00,LULU,Insider Monkey,Baird Reduces PT on lululemon athletica (LULU) Stock,https://finance.yahoo.com/news/baird-reduces-pt-lululemon-athletica-042309466.html
2025-08-18 04:31:39+00:00,AMAT,StockStory,1 Nasdaq 100 Stock with Exciting Potential and 2 Facing Headwinds,https://finance.yahoo.com/news/1-nasdaq-100-stock-exciting-043139545.html
2025-08-18 04:33:20+00:00,CDNS,StockStory,1 Volatile Stock with Competitive Advantages and 2 We Brush Off,https://finance.yahoo.com/news/1-volatile-stock-competitive-advantages-043320297.html
2025-08-18 04:34:01+00:00,CSGP,StockStory,1 S&P 500 Stock to Own for Decades and 2 We Avoid,https://finance.yahoo.com/news/1-p-500-stock-own-043401901.html
2025-08-18 04:36:47+00:00,ON,StockStory,3 Profitable Stocks We Steer Clear Of,https://finance.yahoo.com/news/3-profitable-stocks-steer-clear-043647820.html
2025-08-18 04:37:40+00:00,WBD,StockStory,3 Mid-Cap Stocks Walking a Fine Line,https://finance.yahoo.com/news/3-mid-cap-stocks-walking-043740988.html
2025-08-18 04:43:26+00:00,MNST,StockStory,2 Safe-and-Steady Stocks for Long-Term Investors and 1 We Brush Off,https://finance.yahoo.com/news/2-safe-steady-stocks-long-044326773.html
2025-08-18 04:45:27+00:00,APP,StockStory,2 Surging  Stocks with Competitive Advantages and 1 We Turn Down,https://finance.yahoo.com/news/2-surging-stocks-competitive-advantages-044527162.html
2025-08-18 05:31:25+00:00,TMUS,StockStory,Telephone and Data Systems’s Q2 Earnings Call: Our Top 5 Analyst Questions,https://finance.yahoo.com/news/telephone-data-systems-q2-earnings-053125544.html
2025-08-18 05:32:53+00:00,TMUS,StockStory,5 Must-Read Analyst Questions From U.S. Cellular’s Q2 Earnings Call,https://finance.yahoo.com/news/5-must-read-analyst-questions-053253202.html
2025-08-18 05:43:13+00:00,TEAM,Simply Wall St.,Google Cloud Partnership and AI Push Could Be a Game Changer for Atlassian (TEAM),https://finance.yahoo.com/news/google-cloud-partnership-ai-push-054313695.html
2025-08-18 07:00:00+00:00,DASH,Investor's Business Daily,Chewy Stock Fetches Higher RS Rating At 81,https://www.investors.com/news/chewy-stock-fetches-higher-rs-rating-at-81/?src=A00220&yptr=yahoo
2025-08-18 07:55:00+00:00,ARM,Motley Fool,Nvidia Has 95% of Its Portfolio Invested in 2 Brilliant AI Stocks,https://finance.yahoo.com/news/nvidia-95-portfolio-invested-2-075500473.html
2025-08-18 08:21:00+00:00,PYPL,GlobeNewswire,"QR Code Payment Market Trends Analysis Report 2025-2033, with Profiles of PaymentCloud, Clover Network, Revolut, Nearex, ACI, Ecentric Payment Systems, Block, UnionPay, LINE Pay, and PayPal",https://finance.yahoo.com/news/qr-code-payment-market-trends-082100042.html
2025-08-18 08:30:00+00:00,MELI,Motley Fool,Should You Forget Amazon? Why You Might Want to Buy This Unstoppable Growth Stock Instead,https://finance.yahoo.com/news/forget-amazon-why-might-want-083000757.html
2025-08-18 08:40:00+00:00,ORLY,Motley Fool,Is O'Reilly Automotive Stock a Buy?,https://finance.yahoo.com/news/oreilly-automotive-stock-buy-084000647.html
2025-08-18 09:00:00+00:00,PEP,Just Drinks,The road to net zero – the emissions targets of the world’s drinks giants,https://finance.yahoo.com/news/road-net-zero-emissions-targets-114226935.html
2025-08-18 09:42:00+00:00,INTU,Zacks,Zacks Investment Ideas feature highlights: Intuit and Microsoft,https://finance.yahoo.com/news/zacks-investment-ideas-feature-highlights-094200425.html
2025-08-18 10:00:00+00:00,ADBE,Motley Fool,Is Figma a Millionaire-Maker Stock?,https://finance.yahoo.com/news/figma-millionaire-maker-stock-100000098.html
2025-08-18 10:03:00+00:00,PYPL,Zacks,"The Zacks Analyst Blog Highlights PayPal, JPMorgan Chase, Intuit, ACI Worldwide and Remitly Global",https://finance.yahoo.com/news/zacks-analyst-blog-highlights-paypal-100300187.html
2025-08-18 10:03:00+00:00,INTU,Zacks,"The Zacks Analyst Blog Highlights PayPal, JPMorgan Chase, Intuit, ACI Worldwide and Remitly Global",https://finance.yahoo.com/news/zacks-analyst-blog-highlights-paypal-100300187.html
2025-08-18 10:19:00+00:00,AZN,Zacks,"The Zacks Analyst Blog Highlights D-Wave Quantum, Rigetti Computing, IonQ, AstraZeneca, AWS and NVIDIA",https://finance.yahoo.com/news/zacks-analyst-blog-highlights-d-101900698.html
2025-08-18 10:25:14+00:00,HON,Supply Chain Dive,"Honeywell, Stereolabs partner on AI-powered vision tool for warehouses",https://finance.yahoo.com/news/honeywell-stereolabs-partner-ai-powered-102514184.html
2025-08-18 10:25:37+00:00,COST,reddit.com/r/stocks,"Stocks Most at Risk From Rising Delinquencies and CRE Stress, and those Positioned to Benefit if the Fed Finally Pivots - Consumer credit is strained: card APRs are still 21–24%, student loan delinquencies are above 10% of balances, and office CMBS delinquency hit a record 11% in June. That environment puts pressure on lenders and borrowers who live in those channels. Capital One (COF) just printed a $4.3B Q2 loss with a $7.9B reserve build.",
2025-08-18 10:25:37+00:00,EXC,reddit.com/r/stocks,"Stocks Most at Risk From Rising Delinquencies and CRE Stress, and those Positioned to Benefit if the Fed Finally Pivots - Consumer credit is strained: card APRs are still 21–24%, student loan delinquencies are above 10% of balances, and office CMBS delinquency hit a record 11% in June. That environment puts pressure on lenders and borrowers who live in those channels. Capital One (COF) just printed a $4.3B Q2 loss with a $7.9B reserve build.",
2025-08-18 10:25:37+00:00,ON,reddit.com/r/stocks,"Stocks Most at Risk From Rising Delinquencies and CRE Stress, and those Positioned to Benefit if the Fed Finally Pivots - Consumer credit is strained: card APRs are still 21–24%, student loan delinquencies are above 10% of balances, and office CMBS delinquency hit a record 11% in June. That environment puts pressure on lenders and borrowers who live in those channels. Capital One (COF) just printed a $4.3B Q2 loss with a $7.9B reserve build.",
2025-08-18 10:25:37+00:00,PEP,reddit.com/r/stocks,"Stocks Most at Risk From Rising Delinquencies and CRE Stress, and those Positioned to Benefit if the Fed Finally Pivots - Consumer credit is strained: card APRs are still 21–24%, student loan delinquencies are above 10% of balances, and office CMBS delinquency hit a record 11% in June. That environment puts pressure on lenders and borrowers who live in those channels. Capital One (COF) just printed a $4.3B Q2 loss with a $7.9B reserve build.",
2025-08-18 10:30:00+00:00,COST,Motley Fool,Is Costco Stock an Obvious Buy Right Now?,https://finance.yahoo.com/news/costco-stock-obvious-buy-now-103000770.html
2025-08-18 10:30:00+00:00,BKR,The Daily Upside,"Oil Drilling Stuck Near 4-Year Lows, Thanks to Energy Policy Puzzle",https://finance.yahoo.com/news/oil-drilling-stuck-near-4-103000746.html
2025-08-18 10:33:28+00:00,PEP,Waste Dive,"Driven by EPR, brands to offer film and flexibles funding to California recyclers",https://finance.yahoo.com/news/driven-epr-brands-offer-film-103328884.html
2025-08-18 10:33:28+00:00,MDLZ,Waste Dive,"Driven by EPR, brands to offer film and flexibles funding to California recyclers",https://finance.yahoo.com/news/driven-epr-brands-offer-film-103328884.html
2025-08-18 10:34:09+00:00,CTSH,Simply Wall St.,Should You Be Adding Cognizant Technology Solutions (NASDAQ:CTSH) To Your Watchlist Today?,https://finance.yahoo.com/news/adding-cognizant-technology-solutions-nasdaq-103409687.html
2025-08-18 10:45:00+00:00,MELI,Motley Fool,Prediction: These 2 Stocks Will Outperform the Market in the Next Decade,https://finance.yahoo.com/news/prediction-2-stocks-outperform-market-104500881.html
2025-08-18 10:57:01+00:00,CRWD,Insider Monkey,NVIDIA (NVDA) Poised for More Upside With AI and China Tailwinds,https://finance.yahoo.com/news/nvidia-nvda-poised-more-upside-105701742.html
2025-08-18 11:00:00+00:00,AZN,GlobeNewswire,FibroGen Announces Approval of Sale of FibroGen China to AstraZeneca by the China State Administration for Market Regulation,https://finance.yahoo.com/news/fibrogen-announces-approval-sale-fibrogen-110000077.html
2025-08-18 11:00:00+00:00,QCOM,GlobeNewswire,"Lantronix Solution Powers U.S. Army-Approved Teal Drones, a Red Cat Holdings Co., Unlocking Secure Edge AI Growth Opportunity",https://finance.yahoo.com/news/lantronix-solution-powers-u-army-110000598.html
2025-08-18 11:00:38+00:00,ADBE,Simply Wall St.,When Should You Buy Adobe Inc. (NASDAQ:ADBE)?,https://finance.yahoo.com/news/buy-adobe-inc-nasdaq-adbe-110038968.html
2025-08-18 11:00:58+00:00,ADBE,MT Newswires,"CrowdStrike, Roblox, GE Vernova, Nebius Among 30 Firms That Will Define AI Future, Wedbush Says",https://finance.yahoo.com/news/crowdstrike-roblox-ge-vernova-nebius-110058296.html
2025-08-18 11:00:58+00:00,CRWD,MT Newswires,"CrowdStrike, Roblox, GE Vernova, Nebius Among 30 Firms That Will Define AI Future, Wedbush Says",https://finance.yahoo.com/news/crowdstrike-roblox-ge-vernova-nebius-110058296.html
2025-08-18 11:08:13+00:00,NFLX,Investor's Business Daily,S&P 500 Titans Amazon And Netflix Lead Five Stocks Near Buy Points,https://www.investors.com/news/sp-500-stock-market-amazon-netflix-near-buy-points/?src=A00220&yptr=yahoo
2025-08-18 11:15:14+00:00,ON,reddit.com/r/stocks,"Would you invest in RKLB, CRWV, and Xiaomi for one year with a five-year horizon? - Starting a new investment plan and wanna get your thoughts on my strategy for the next year. My plan is to make weekly buys totaling $750. I'm doing this for the long term, not planning to touch this for at least 5 years. Here's the plan: Rocket Lab $250 CoreWeave $250 Xiaomi $250 My main goal is to make",
2025-08-18 11:20:00+00:00,PEP,Packaging Dive,"PepsiCo, Bold Reuse partner on NFL stadium cups",https://finance.yahoo.com/news/pepsico-bold-reuse-partner-nfl-112000404.html
2025-08-18 11:20:37+00:00,ON,reddit.com/r/stocks,"Warren Buffett’s Berkshire Hathaway Invests $1.8B in Nucor, D.R. Horton and Lennar Here’s Why - Hold your breath, investors! Warren Buffett’s Berkshire Hathaway has just dropped a colossal $1.8 billion into Nucor, DR Horton, and Lennar, and the financial world is buzzing with speculation. But why these stocks? What secret insights is the Oracle of Omaha banking on that the rest of us are missing? Is this a signal of an impending boom in steel",
2025-08-18 11:30:00+00:00,ASML,Motley Fool,3 Genius Artificial Intelligence (AI) Stocks to Buy in August,https://finance.yahoo.com/news/3-genius-artificial-intelligence-ai-113000952.html
2025-08-18 11:30:00+00:00,PDD,GlobeNewswire,"PDD Holdings to Report Second Quarter 2025 Unaudited Financial Results on August 25, 2025",https://finance.yahoo.com/news/pdd-holdings-report-second-quarter-113000565.html
2025-08-18 11:35:37+00:00,WDAY,Simply Wall St.,3 Growth Companies Insiders Are Betting On,https://finance.yahoo.com/news/3-growth-companies-insiders-betting-113537754.html
2025-08-18 11:37:20+00:00,QCOM,Simply Wall St.,Latest News In AI Chips - Lantronix Advances AI Tech for Defense with Teal Drones,https://finance.yahoo.com/news/latest-news-ai-chips-lantronix-113720696.html
2025-08-18 11:37:20+00:00,ASML,Simply Wall St.,Latest News In AI Chips - Lantronix Advances AI Tech for Defense with Teal Drones,https://finance.yahoo.com/news/latest-news-ai-chips-lantronix-113720696.html
2025-08-18 11:45:32+00:00,MAR,Hotel Management Network,Marriott Executive Apartments launches ‘urban retreat’ in Kuala Lumpur,https://finance.yahoo.com/news/marriott-executive-apartments-launches-urban-114532906.html
2025-08-18 12:17:00+00:00,LULU,Motley Fool,These Undervalued Growth Stocks Could Surge 50% by 2026,https://finance.yahoo.com/news/undervalued-growth-stocks-could-surge-121700705.html
2025-08-18 12:23:53+00:00,WDAY,Investor's Business Daily,Dayforce Stock Jumps On Report Of Private Equity Suitor,https://www.investors.com/news/technology/dayforce-stock-thoma-bravo-acquisition-talks/?src=A00220&yptr=yahoo
2025-08-18 12:23:53+00:00,ADP,Investor's Business Daily,Dayforce Stock Jumps On Report Of Private Equity Suitor,https://www.investors.com/news/technology/dayforce-stock-thoma-bravo-acquisition-talks/?src=A00220&yptr=yahoo
2025-08-18 12:23:53+00:00,PAYX,Investor's Business Daily,Dayforce Stock Jumps On Report Of Private Equity Suitor,https://www.investors.com/news/technology/dayforce-stock-thoma-bravo-acquisition-talks/?src=A00220&yptr=yahoo
2025-08-18 12:24:00+00:00,FAST,Zacks,"Beat the Market the Zacks Way: CBRE, Acadian, Fastenal in Focus",https://finance.yahoo.com/news/beat-market-zacks-way-cbre-122400060.html
2025-08-18 12:25:00+00:00,COST,Zacks,Can Costco's Affirm Tie-Up Accelerate Digital Sales in Q4?,https://finance.yahoo.com/news/costcos-affirm-tie-accelerate-digital-122500953.html
2025-08-18 12:30:02+00:00,CDNS,Zacks,Here's How Much a $1000 Investment in Cadence Design Systems Made 10 Years Ago Would Be Worth Today,https://finance.yahoo.com/news/heres-much-1000-investment-cadence-123002025.html
2025-08-18 12:37:38+00:00,PYPL,Simply Wall St.,Digital Payment Update - QR Code Payment Market Growth Fueled By Smartphone Use,https://finance.yahoo.com/news/digital-payment-qr-code-payment-123738044.html
2025-08-18 12:48:00+00:00,CHTR,PR Newswire,Charter Offers Senior Secured Notes,https://finance.yahoo.com/news/charter-offers-senior-secured-notes-124800190.html
2025-08-18 13:00:00+00:00,MRVL,PR Newswire,Marvell LiquidSecurity Selected for Microsoft Azure Cloud HSM,https://finance.yahoo.com/news/marvell-liquidsecurity-selected-microsoft-azure-130000114.html
2025-08-18 13:00:00+00:00,WDAY,Business Wire,"The Jackson T. Stephens Cup Announces 2025 Sponsorship Lineup: Stephens, Workday, and Old National Bank",https://finance.yahoo.com/news/jackson-t-stephens-cup-announces-130000304.html
2025-08-18 13:00:00+00:00,COST,PR Newswire,"ASUS Announces Major Savings This Back-to-School Season, With Up to 40% Off a Wide Selection From Essential to Premium Tech!",https://finance.yahoo.com/news/asus-announces-major-savings-back-130000150.html
2025-08-18 13:00:03+00:00,PYPL,Zacks,"PayPal Holdings, Inc. (PYPL) is Attracting Investor Attention: Here is What You Should Know",https://finance.yahoo.com/news/paypal-holdings-inc-pypl-attracting-130003172.html
2025-08-18 13:00:04+00:00,SBUX,Zacks,Starbucks Corporation (SBUX) is Attracting Investor Attention: Here is What You Should Know,https://finance.yahoo.com/news/starbucks-corporation-sbux-attracting-investor-130004843.html
2025-08-18 13:00:05+00:00,CRWD,Zacks,CrowdStrike (CRWD) is Attracting Investor Attention: Here is What You Should Know,https://finance.yahoo.com/news/crowdstrike-crwd-attracting-investor-attention-130005332.html
2025-08-18 13:04:10+00:00,WDAY,TechCrunch,HR giant Workday says hackers stole personal data in recent breach,https://finance.yahoo.com/news/hr-giant-workday-says-hackers-130410698.html
