timestamp,ticker,source,text,url
2026-05-01 14:37:00+00:00,KLAC,TheStreet,Morgan Stanley resets KLA Corp stock forecast,https://finance.yahoo.com/markets/stocks/articles/morgan-stanley-resets-kla-corp-143700142.html
2026-05-01 14:47:39+00:00,LRCX,Insider Monkey,Forget Nvidia: This AI Semiconductor Stock in Billionaire Philippe Laffont Portfolio Is Winning in 2026,https://finance.yahoo.com/markets/stocks/articles/forget-nvidia-ai-semiconductor-stock-144739366.html
2026-05-01 14:51:57+00:00,WBD,CFO Dive,Warner Bros CFO awarded salary hike amid Paramount deal pushback,https://finance.yahoo.com/markets/stocks/articles/warner-bros-cfo-awarded-salary-145157597.html
2026-05-01 15:01:49+00:00,PYPL,Barchart,"As PayPal Plans to Make Venmo a Standalone Business Unit, Should You Buy, Sell, or Hold PYPL Stock?",https://finance.yahoo.com/markets/stocks/articles/paypal-plans-venmo-standalone-business-150149302.html
2026-05-01 15:07:32+00:00,WDC,24/7 Wall St.,The AI Gold Rush Just Hit a New Layer: Here’s Why Sandisk Is Printing Money,https://finance.yahoo.com/markets/stocks/articles/ai-gold-rush-just-hit-150732740.html
2026-05-01 15:13:37+00:00,EA,reddit.com/r/stocks,"EA (Electronic Arts) stock, why everyone is not selling now? - New (and probably dumb) investor here. I bought about 10 shares of EA stock right before the buyout announcement, so I’m currently up around 70%. From what I understand, it could take years for the deal to fully go through, and shareholders are expected to receive about $210 per share once it’s finalized. Right now the stock is hovering around $200–202. What I’m struggling",
2026-05-01 15:20:27+00:00,CSGP,Simply Wall St.,A Look At CoStar Group (CSGP) Valuation After Raised 2026 Guidance And Homes.com Growth,https://finance.yahoo.com/markets/stocks/articles/look-costar-group-csgp-valuation-152027725.html
2026-05-01 15:28:53+00:00,LIN,MarketBeat,Linde Q1 Earnings Call Highlights,https://finance.yahoo.com/markets/stocks/articles/linde-q1-earnings-call-highlights-152853896.html
2026-05-01 15:52:00+00:00,PCAR,Zacks,Rivian Q1 Earnings Beat on Higher Deliveries and Software Strength,https://finance.yahoo.com/markets/stocks/articles/rivian-q1-earnings-beat-higher-155200005.html
2026-05-01 15:57:14+00:00,ARM,Investor's Business Daily,"Palantir, Nvidia Partner CoreWeave Headline Earnings Calendar; Lithium Play In Spotlight",https://www.investors.com/research/earnings-preview/palantir-pltr-stock-earnings/?src=A00220&yptr=yahoo
2026-05-01 16:00:04+00:00,ADI,Zacks,Analog Devices (ADI) Is Up 7.57% in One Week: What You Should Know,https://finance.yahoo.com/markets/stocks/articles/analog-devices-adi-7-57-160004196.html
2026-05-01 16:00:06+00:00,MCHP,Zacks,Microchip Technology (MCHP) Is Up 13.56% in One Week: What You Should Know,https://finance.yahoo.com/markets/stocks/articles/microchip-technology-mchp-13-56-160006120.html
2026-05-01 16:05:48+00:00,FANG,24/7 Wall St.,The UAE’s OPEC Exit Changes the Oil Trade — Here’s the Stock to Buy Now,https://finance.yahoo.com/sectors/energy/articles/uae-opec-exit-changes-oil-160548990.html
2026-05-01 16:08:00+00:00,ALNY,Zacks,"Alnylam Q1 Earnings Beat Estimates, Amvuttra Sales Drive Y/Y Growth",https://finance.yahoo.com/sectors/healthcare/articles/alnylam-q1-earnings-beat-estimates-160800926.html
2026-05-01 16:10:02+00:00,CSCO,Zacks,Will Cisco (CSCO) Beat Estimates Again in Its Next Earnings Report?,https://finance.yahoo.com/markets/stocks/articles/cisco-csco-beat-estimates-again-161002227.html
2026-05-01 16:14:01+00:00,STX,Insider Monkey,Jim Cramer Says “Seagate’s Been a Horse for Ages Now”,https://finance.yahoo.com/markets/stocks/articles/jim-cramer-says-seagate-horse-161401124.html
2026-05-01 16:14:02+00:00,TXN,Insider Monkey,Jim Cramer on NXP Semiconductors: “NXP Is a Must””,https://finance.yahoo.com/markets/stocks/articles/jim-cramer-nxp-semiconductors-nxp-161402863.html
2026-05-01 16:14:02+00:00,NXPI,Insider Monkey,Jim Cramer on NXP Semiconductors: “NXP Is a Must””,https://finance.yahoo.com/markets/stocks/articles/jim-cramer-nxp-semiconductors-nxp-161402863.html
2026-05-01 16:15:00+00:00,MPWR,Barrons.com,This AI Stock Is Up 78% This Year. Why It Still Looks Like a Buy.,https://www.barrons.com/articles/monolithic-power-ai-stock-price-buy-2a51ecc3?siteid=yhoof2&yptr=yahoo
2026-05-01 16:17:45+00:00,ADBE,Simply Wall St.,Is Adobe (ADBE) Worth A Fresh Look After Its 26% Year To Date Share Price Slide?,https://finance.yahoo.com/markets/stocks/articles/adobe-adbe-worth-fresh-look-161745553.html
2026-05-01 16:19:52+00:00,KHC,Simply Wall St.,Should Capri Sun Hydrate’s Healthier Kids’ Drink Push Require Action From Kraft Heinz (KHC) Investors?,https://finance.yahoo.com/markets/stocks/articles/capri-sun-hydrate-healthier-kids-161952898.html
2026-05-01 16:19:52+00:00,WMT,Simply Wall St.,Should Capri Sun Hydrate’s Healthier Kids’ Drink Push Require Action From Kraft Heinz (KHC) Investors?,https://finance.yahoo.com/markets/stocks/articles/capri-sun-hydrate-healthier-kids-161952898.html
2026-05-01 16:20:26+00:00,AMGN,Barrons.com,The Dow's Early Gains Slipped Away. The S&P 500 and Nasdaq Are Still at Records.,https://www.barrons.com/livecoverage/stock-market-news-today-050126/card/the-dow-s-early-gains-slipped-away-the-s-p-500-and-nasdaq-are-still-at-records--AU2AuBLgmOh2Yc6x3Z82?siteid=yhoof2&yptr=yahoo
2026-05-01 16:28:52+00:00,NXPI,Motley Fool,Why NXP Semiconductors Stock Was Flying High This Week,https://finance.yahoo.com/markets/stocks/articles/why-nxp-semiconductors-stock-flying-162852832.html
2026-05-01 16:30:00+00:00,MRVL,Zacks,"Should You Buy, Sell or Hold ALAB Stock Before Q1 Earnings Release?",https://finance.yahoo.com/markets/stocks/articles/buy-sell-hold-alab-stock-163000739.html
2026-05-01 16:30:00+00:00,PAYX,Business Wire,Paychex Declares a 10% Increase to Quarterly Cash Dividend,https://finance.yahoo.com/markets/stocks/articles/paychex-declares-10-increase-quarterly-163000527.html
2026-05-01 16:30:00+00:00,CSCO,Zacks,"Should You Buy, Sell or Hold ALAB Stock Before Q1 Earnings Release?",https://finance.yahoo.com/markets/stocks/articles/buy-sell-hold-alab-stock-163000739.html
2026-05-01 16:41:18+00:00,WDC,24/7 Wall St.,Citi Raises Western Digital Price Target to $500: Is the HDD Bull Case Just Getting Stronger?,https://finance.yahoo.com/markets/stocks/articles/citi-raises-western-digital-price-164118796.html
2026-05-01 16:59:56+00:00,LIN,Moby,Linde plc Q1 2026 Earnings Call Summary,https://finance.yahoo.com/markets/stocks/articles/linde-plc-q1-2026-earnings-165956230.html
2026-05-01 17:07:53+00:00,AXON,Barchart,"Dear AppLovin Stock Fans, Mark Your Calendars for May 6",https://finance.yahoo.com/markets/stocks/articles/dear-applovin-stock-fans-mark-170753876.html
2026-05-01 17:07:53+00:00,APP,Barchart,"Dear AppLovin Stock Fans, Mark Your Calendars for May 6",https://finance.yahoo.com/markets/stocks/articles/dear-applovin-stock-fans-mark-170753876.html
2026-05-01 17:17:00+00:00,WMT,Barrons.com,The S&P 500 Just Had Its Best Month Since 2020. Don’t Let ‘Sell in May’ Spook You.,https://www.barrons.com/articles/s-p-500-best-month-since-2020-bef67ba3?siteid=yhoof2&yptr=yahoo
2026-05-01 17:36:11+00:00,APP,Simply Wall St.,3 Growth Stocks With High Insider Ownership Achieving 19% Revenue Growth,https://finance.yahoo.com/markets/stocks/articles/3-growth-stocks-high-insider-173611753.html
2026-05-01 17:38:09+00:00,STX,Simply Wall St.,Extreme Networks And 2 Additional Stocks Estimated To Be Trading Below Their Fair Value,https://finance.yahoo.com/markets/stocks/articles/extreme-networks-2-additional-stocks-173809526.html
2026-05-01 17:38:09+00:00,APP,Simply Wall St.,Extreme Networks And 2 Additional Stocks Estimated To Be Trading Below Their Fair Value,https://finance.yahoo.com/markets/stocks/articles/extreme-networks-2-additional-stocks-173809526.html
2026-05-01 17:38:09+00:00,ALNY,Simply Wall St.,Extreme Networks And 2 Additional Stocks Estimated To Be Trading Below Their Fair Value,https://finance.yahoo.com/markets/stocks/articles/extreme-networks-2-additional-stocks-173809526.html
2026-05-01 17:38:16+00:00,CRWD,Simply Wall St.,3 High Growth Tech Stocks In The US Market,https://finance.yahoo.com/sectors/technology/articles/3-high-growth-tech-stocks-173816316.html
2026-05-01 17:58:30+00:00,DXCM,MT Newswires,"DexCom Medicare Coverage NCD Remains Biggest 2026 Catalyst, RBC Says",https://finance.yahoo.com/sectors/healthcare/articles/dexcom-medicare-coverage-ncd-remains-175830935.html
2026-05-01 18:00:00+00:00,CSCO,Zacks,"National Quantum Policy Bill Advances: IBM, IonQ, Cisco in Focus",https://finance.yahoo.com/sectors/technology/articles/national-quantum-policy-bill-advances-180000194.html
2026-05-01 18:00:22+00:00,PYPL,GuruFocus.com,Yacktman Asset Management's Strategic Moves: A Closer Look at PayPal Holdings Inc.,https://finance.yahoo.com/markets/stocks/articles/yacktman-asset-managements-strategic-moves-180022915.html
2026-05-01 18:03:00+00:00,CEG,Motley Fool,The Best 3 Nuclear Energy Stocks to Buy and Hold for Decades,https://finance.yahoo.com/sectors/energy/articles/best-3-nuclear-energy-stocks-180300785.html
2026-05-01 18:06:00+00:00,GILD,Zacks,"Should You Buy, Hold, or Sell GILD Stock Ahead of Q1 Earnings?",https://finance.yahoo.com/sectors/healthcare/articles/buy-hold-sell-gild-stock-180600947.html
2026-05-01 18:07:00+00:00,GILD,Zacks,"KYMR Q1 Earnings Top Estimates, Revenues Gain on GILD Collaboration",https://finance.yahoo.com/sectors/healthcare/articles/kymr-q1-earnings-top-estimates-180700999.html
2026-05-01 18:07:14+00:00,ARM,24/7 Wall St.,"ARM, Marvell, or Vertiv: Which AI Infrastructure Stock Crushed It in April?",https://finance.yahoo.com/markets/stocks/articles/arm-marvell-vertiv-ai-infrastructure-180714232.html
2026-05-01 18:07:14+00:00,MRVL,24/7 Wall St.,"ARM, Marvell, or Vertiv: Which AI Infrastructure Stock Crushed It in April?",https://finance.yahoo.com/markets/stocks/articles/arm-marvell-vertiv-ai-infrastructure-180714232.html
2026-05-01 18:11:21+00:00,CSCO,MT Newswires,Equity Markets Mostly Rise Intraday as Apple Helps Lift Tech,https://finance.yahoo.com/markets/stocks/articles/equity-markets-mostly-rise-intraday-181121368.html
2026-05-01 18:14:20+00:00,GEHC,Simply Wall St.,Is GE HealthCare Technologies (GEHC) Now A Compelling Opportunity After Recent Share Price Weakness,https://finance.yahoo.com/markets/stocks/articles/ge-healthcare-technologies-gehc-now-181420172.html
2026-05-01 18:26:00+00:00,LIN,Zacks,"Linde Q1 Earnings Beat Estimates, Revenues Rise Y/Y, Dividend Raised",https://finance.yahoo.com/markets/stocks/articles/linde-q1-earnings-beat-estimates-182600419.html
2026-05-01 18:33:00+00:00,WMT,TheStreet,Walmart makes in-store move to challenge Target,https://finance.yahoo.com/sectors/technology/articles/walmart-makes-store-move-challenge-183300799.html
2026-05-01 19:09:26+00:00,LRCX,Simply Wall St.,How The Lam Research (LRCX) Story Is Shifting With New Analyst Targets And Risks,https://finance.yahoo.com/markets/stocks/articles/lam-research-lrcx-story-shifting-190926561.html
2026-05-01 19:10:57+00:00,LIN,Motley Fool,Linde (LIN) Q1 2026 Earnings Call Transcript,https://finance.yahoo.com/markets/stocks/articles/linde-lin-q1-2026-earnings-191057634.html
2026-05-01 19:25:00+00:00,NFLX,Motley Fool,3 Stocks That Could Be Your Easy Ticket to Creating Generational Wealth,https://finance.yahoo.com/markets/stocks/articles/3-stocks-could-easy-ticket-192500612.html
2026-05-01 19:35:00+00:00,CPRT,Barrons.com,Berkshire Has $373 Billion in Cash. These Experts Have Ideas How to Deploy It.,https://www.barrons.com/articles/berkshire-hathaway-abel-cash-acquisition-83ffcb77?siteid=yhoof2&yptr=yahoo
2026-05-01 19:53:45+00:00,STX,Barchart,Wall Street Can’t Get Enough of Seagate Technology Stock After Its Major Earnings Win,https://finance.yahoo.com/markets/stocks/articles/wall-street-t-enough-seagate-195345743.html
2026-05-01 19:54:00+00:00,SBUX,Zacks,"Top Research Reports for Philip Morris, Honeywell & Starbucks",https://finance.yahoo.com/markets/stocks/articles/top-research-reports-philip-morris-195400107.html
2026-05-01 20:10:00+00:00,MSTR,CryptoProwl,Canadian Pension Fund Buys Strategy Stock,https://finance.yahoo.com/markets/stocks/articles/canadian-pension-fund-buys-strategy-201000061.html
2026-05-01 20:11:00+00:00,WBD,Barrons.com,Paramount Skydance Stock Pops After Double Upgrade. Why Morgan Stanley Analyst Says It’s the ‘Riskiest’ Call.,https://www.barrons.com/articles/paramount-stock-price-double-upgrade-morgan-stanley-4b540f11?siteid=yhoof2&yptr=yahoo
2026-05-01 20:11:00+00:00,NFLX,Barrons.com,Paramount Skydance Stock Pops After Double Upgrade. Why Morgan Stanley Analyst Says It’s the ‘Riskiest’ Call.,https://www.barrons.com/articles/paramount-stock-price-double-upgrade-morgan-stanley-4b540f11?siteid=yhoof2&yptr=yahoo
2026-05-01 20:13:03+00:00,APP,reddit.com/r/stocks,"Can AAPL Sustain Its Rapid Growth? - In the wake of Apple’s latest earnings report, a single question keeps recurring in my mind, Can AAPL continue to sustain its rapid pace of growth? AAPL’s immense strength stems from far more than just the iPhone itself, it is rooted in its unique ecosystem. Apple’s rapid growth is inextricably linked to its suite of products and services, including the iPhone, AirPods, Apple Watch, Mac, iCloud, the App",
2026-05-01 20:13:03+00:00,AAPL,reddit.com/r/stocks,"Can AAPL Sustain Its Rapid Growth? - In the wake of Apple’s latest earnings report, a single question keeps recurring in my mind, Can AAPL continue to sustain its rapid pace of growth? AAPL’s immense strength stems from far more than just the iPhone itself, it is rooted in its unique ecosystem. Apple’s rapid growth is inextricably linked to its suite of products and services, including the iPhone, AirPods, Apple Watch, Mac, iCloud, the App",
2026-05-01 20:15:00+00:00,WDC,Barrons.com,"These Stocks Are Today’s Movers: Apple, Sandisk, Roblox, Intel, Ferrari, Atlassian, Western Digital, Clorox, Paramount Skydance, and More",https://www.barrons.com/articles/stock-movers-25cbda2e?siteid=yhoof2&yptr=yahoo
2026-05-01 20:15:01+00:00,AMGN,Investor's Business Daily,Amgen Is 'Aggressively Expanding' In Obesity Treatment; Here's What Investors Should Watch,https://www.investors.com/news/technology/amgen-stock-amgen-earnings-q1-2026/?src=A00220&yptr=yahoo
2026-05-01 20:25:00+00:00,SBUX,Motley Fool,"Starbucks' Same-Store Sales Roar Back, But Its Biggest Hurdle Remains",https://finance.yahoo.com/markets/stocks/articles/starbucks-same-store-sales-roar-202500567.html
2026-05-01 20:30:00+00:00,TRI,CNW Group,Thomson Reuters Announces Cash Distribution Per Share and Share Consolidation Ratio for Return of Capital and Share Consolidation Transactions,https://finance.yahoo.com/markets/stocks/articles/thomson-reuters-announces-cash-distribution-203000843.html
2026-05-01 20:30:00+00:00,CSCO,PR Newswire,Cisco Schedules Conference Call for Q3 Fiscal Year 2026 Financial Results,https://finance.yahoo.com/markets/stocks/articles/cisco-schedules-conference-call-q3-203000983.html
2026-05-01 20:42:00+00:00,WDC,Barrons.com,Western Digital Beats Earnings Estimates. The Stock Is Falling Anyway.,https://www.barrons.com/articles/western-digital-earnings-stock-price-f36bbc9c?siteid=yhoof2&yptr=yahoo
2026-05-01 20:52:10+00:00,SNDK,Motley Fool,"Why Sandisk Stock Snapped, Crackled, and Popped",https://finance.yahoo.com/markets/stocks/articles/why-sandisk-stock-snapped-crackled-205210669.html
2026-05-01 20:53:30+00:00,ABNB,Financial Post,2025 was record year for Canadian domestic travel: Airbnb,https://finance.yahoo.com/news/2025-record-canadian-domestic-travel-205330410.html
2026-05-01 21:13:13+00:00,GEHC,Simply Wall St.,GE HealthCare Technologies (GEHC) Is Down 12.9% After Profit Guidance Cut And Imaging Overhaul News,https://finance.yahoo.com/sectors/healthcare/articles/ge-healthcare-technologies-gehc-down-211313742.html
2026-05-01 21:15:13+00:00,CEG,Simply Wall St.,How The Constellation Energy (CEG) Investment Story Is Shifting With Reset Valuations And Growth Hopes,https://finance.yahoo.com/markets/stocks/articles/constellation-energy-ceg-investment-story-211513790.html
2026-05-01 21:16:00+00:00,EXC,Business Wire,ComEd Reconciliation Filing to Match Cost with Revenues for 2025 and Would Lead to Lower Monthly Bills for Customers,https://finance.yahoo.com/economy/policy/articles/comed-reconciliation-filing-match-cost-211600746.html
2026-05-01 21:21:00+00:00,SNDK,Zacks,Why These 3 Red Hot Tech Stocks Keep Climbing,https://finance.yahoo.com/markets/stocks/articles/why-3-red-hot-tech-212100459.html
2026-05-01 21:30:08+00:00,EA,Motley Fool,"Stock Market Today, May 1: Roblox Shares Plunge After Cutting Full Year and 2026 Bookings Guidance",https://finance.yahoo.com/markets/stocks/articles/stock-market-today-may-1-213008939.html
2026-05-01 21:30:08+00:00,TTWO,Motley Fool,"Stock Market Today, May 1: Roblox Shares Plunge After Cutting Full Year and 2026 Bookings Guidance",https://finance.yahoo.com/markets/stocks/articles/stock-market-today-may-1-213008939.html
2026-05-01 21:45:02+00:00,TTWO,Zacks,Take-Two Interactive (TTWO) Outpaces Stock Market Gains: What You Should Know,https://finance.yahoo.com/markets/stocks/articles/two-interactive-ttwo-outpaces-stock-214502957.html
2026-05-01 21:45:03+00:00,ABNB,Zacks,"Airbnb, Inc. (ABNB) Rises Higher Than Market: Key Facts",https://finance.yahoo.com/markets/stocks/articles/airbnb-inc-abnb-rises-higher-214503968.html
2026-05-01 21:45:03+00:00,FTNT,Zacks,Why Fortinet (FTNT) Outpaced the Stock Market Today,https://finance.yahoo.com/markets/stocks/articles/why-fortinet-ftnt-outpaced-stock-214503785.html
2026-05-01 22:17:47+00:00,PYPL,Simply Wall St.,PayPal Store Sync Links BigCommerce Merchants To AI Shopping And Valuation Story,https://finance.yahoo.com/markets/stocks/articles/paypal-store-sync-links-bigcommerce-221747770.html
2026-05-01 23:00:02+00:00,SBUX,Barchart,McDonald’s Is Down 4% and Starbucks Is Up 25% in 2026. The Better Dividend Stock Might Surprise You.,https://finance.yahoo.com/markets/stocks/articles/mcdonald-down-4-starbucks-25-230002584.html
2026-05-01 23:11:12+00:00,AMGN,Simply Wall St.,Assessing Amgen (AMGN) Valuation After Recent Share Price Weakness And Pipeline Expectations,https://finance.yahoo.com/sectors/healthcare/articles/assessing-amgen-amgn-valuation-recent-231112489.html
2026-05-01 23:11:12+00:00,TTWO,Simply Wall St.,Take-Two AI Focus And Stock Valuation Under Investor Spotlight,https://finance.yahoo.com/markets/stocks/articles/two-ai-focus-stock-valuation-231112197.html
2026-05-01 23:11:54+00:00,WDC,Simply Wall St.,Why Western Digital (WDC) Is Up 6.9% After Q3 Beat And Margin Surge On AI Storage Demand,https://finance.yahoo.com/markets/stocks/articles/why-western-digital-wdc-6-231154431.html
2026-05-01 23:12:39+00:00,SNDK,Simply Wall St.,Sandisk Reshapes Earnings With Long Term Deals And AI Data Center Pivot,https://finance.yahoo.com/markets/stocks/articles/sandisk-reshapes-earnings-long-term-231239966.html
2026-05-01 23:55:00+00:00,ADBE,Barrons.com,Review & Preview: All Good Now,https://www.barrons.com/articles/stocks-today-team-software-igv-rally-8a49875c?siteid=yhoof2&yptr=yahoo
2026-05-02 00:01:00+00:00,BKR,"Odessa American, Texas",Basin rig count down one as prices rise,https://finance.yahoo.com/sectors/energy/articles/basin-rig-count-down-one-000100287.html
2026-05-02 00:23:12+00:00,VRSK,Simply Wall St.,"AI Push, Buybacks and Steady Guidance Could Be A Game Changer For Verisk Analytics (VRSK)",https://finance.yahoo.com/markets/stocks/articles/ai-push-buybacks-steady-guidance-002312956.html
2026-05-02 01:13:10+00:00,AMAT,24/7 Wall St.,China’s Semiconductor Equipment Companies Gain Share Despite U.S. Sanctions,https://finance.yahoo.com/sectors/technology/articles/china-semiconductor-equipment-companies-gain-011310507.html
2026-05-02 01:13:10+00:00,KLAC,24/7 Wall St.,China’s Semiconductor Equipment Companies Gain Share Despite U.S. Sanctions,https://finance.yahoo.com/sectors/technology/articles/china-semiconductor-equipment-companies-gain-011310507.html
2026-05-02 01:13:10+00:00,LRCX,24/7 Wall St.,China’s Semiconductor Equipment Companies Gain Share Despite U.S. Sanctions,https://finance.yahoo.com/sectors/technology/articles/china-semiconductor-equipment-companies-gain-011310507.html
2026-05-02 01:13:10+00:00,ASML,24/7 Wall St.,China’s Semiconductor Equipment Companies Gain Share Despite U.S. Sanctions,https://finance.yahoo.com/sectors/technology/articles/china-semiconductor-equipment-companies-gain-011310507.html
2026-05-02 01:16:41+00:00,CRWD,Simply Wall St.,Assessing Dicker Data’s Valuation After New CrowdStrike AI Cybersecurity Partnership In Asia Pacific,https://finance.yahoo.com/markets/stocks/articles/assessing-dicker-data-valuation-crowdstrike-011641759.html
2026-05-02 01:17:33+00:00,PCAR,Simply Wall St.,Is It Time To Revisit PACCAR (PCAR) After Its Recent Share Price Pullback,https://finance.yahoo.com/markets/stocks/articles/time-revisit-paccar-pcar-recent-011733468.html
2026-05-02 01:20:00+00:00,WDC,PR Newswire,Asian American Engineer of the Year Award and Conference Announces First Phase of 2025-2026 Awardees,https://finance.yahoo.com/sectors/technology/articles/asian-american-engineer-award-conference-012000386.html
2026-05-02 01:21:23+00:00,MSTR,BeInCrypto,MicroStrategy’s STRC Trading Volume Hits $380 Million as Payment Vote Nears,https://finance.yahoo.com/markets/crypto/articles/microstrategy-strc-trading-volume-hits-012123457.html
2026-05-02 01:44:09+00:00,COST,reddit.com/r/stocks,Apple's unexpected Q2 revenue guidance - Turns out Apple is really just effectively raising prices. Cheapest mini mac up from $599 to $799 - [https://sg.finance.yahoo.com/news/demand-mac-mini-surging-apple-223237488.html](https://sg.finance.yahoo.com/news/demand-mac-mini-surging-apple-223237488.html) Article above seems to confirm my suspicions yesterday on why Apple's Q2 guidance was so far above expectations. Original thread: [https://www.reddit.com/r/stocks/comments/1t0d4id/question\_on\_apples\_guidance\_of\_1417\_q2\_revenue/](https://www.reddit.com/r/stocks/comments/1t0d4id/question_on_apples_guidance_of_1417_q2_revenue/) Q2 revenue guidance came in at 14-17% vs 9% expected with margin remaining constant at 48% despite noting a significant increase in memory cost. They didn't clearly illustrate how,
2026-05-02 03:05:19+00:00,MSFT,reddit.com/r/stocks,"why i think optic fibers still have more room to run: dd - around 3 months ago, i made a post explaining why i thought photonics and light related companies have so much room to run, despite the fact that they have already ran 300%+ at that point. Since then, these companies (i.e. lite and aaoi) have ran up even more. generally, i feel like these stocks are under-discussed (per say) on reddit. despite their",
2026-05-02 03:05:19+00:00,MU,reddit.com/r/stocks,"why i think optic fibers still have more room to run: dd - around 3 months ago, i made a post explaining why i thought photonics and light related companies have so much room to run, despite the fact that they have already ran 300%+ at that point. Since then, these companies (i.e. lite and aaoi) have ran up even more. generally, i feel like these stocks are under-discussed (per say) on reddit. despite their",
2026-05-02 03:05:19+00:00,NVDA,reddit.com/r/stocks,"why i think optic fibers still have more room to run: dd - around 3 months ago, i made a post explaining why i thought photonics and light related companies have so much room to run, despite the fact that they have already ran 300%+ at that point. Since then, these companies (i.e. lite and aaoi) have ran up even more. generally, i feel like these stocks are under-discussed (per say) on reddit. despite their",
2026-05-02 03:05:19+00:00,FAST,reddit.com/r/stocks,"why i think optic fibers still have more room to run: dd - around 3 months ago, i made a post explaining why i thought photonics and light related companies have so much room to run, despite the fact that they have already ran 300%+ at that point. Since then, these companies (i.e. lite and aaoi) have ran up even more. generally, i feel like these stocks are under-discussed (per say) on reddit. despite their",
2026-05-02 03:05:19+00:00,AMZN,reddit.com/r/stocks,"why i think optic fibers still have more room to run: dd - around 3 months ago, i made a post explaining why i thought photonics and light related companies have so much room to run, despite the fact that they have already ran 300%+ at that point. Since then, these companies (i.e. lite and aaoi) have ran up even more. generally, i feel like these stocks are under-discussed (per say) on reddit. despite their",
2026-05-02 03:05:19+00:00,GOOG,reddit.com/r/stocks,"why i think optic fibers still have more room to run: dd - around 3 months ago, i made a post explaining why i thought photonics and light related companies have so much room to run, despite the fact that they have already ran 300%+ at that point. Since then, these companies (i.e. lite and aaoi) have ran up even more. generally, i feel like these stocks are under-discussed (per say) on reddit. despite their",
2026-05-02 03:05:19+00:00,META,reddit.com/r/stocks,"why i think optic fibers still have more room to run: dd - around 3 months ago, i made a post explaining why i thought photonics and light related companies have so much room to run, despite the fact that they have already ran 300%+ at that point. Since then, these companies (i.e. lite and aaoi) have ran up even more. generally, i feel like these stocks are under-discussed (per say) on reddit. despite their",
2026-05-02 03:17:35+00:00,MCHP,Simply Wall St.,Microchip’s PQC Security Chips Raise Questions Around Rich Valuation,https://finance.yahoo.com/sectors/technology/articles/microchip-pqc-security-chips-raise-031735102.html
