timestamp,ticker,source,text,url
2026-05-05 09:48:55+00:00,WDAY,StockStory,2 Nasdaq 100 Stocks with Competitive Advantages and 1 We Question,https://finance.yahoo.com/markets/stocks/articles/2-nasdaq-100-stocks-competitive-094855120.html
2026-05-05 09:48:55+00:00,AMGN,StockStory,2 Nasdaq 100 Stocks with Competitive Advantages and 1 We Question,https://finance.yahoo.com/markets/stocks/articles/2-nasdaq-100-stocks-competitive-094855120.html
2026-05-05 10:00:00+00:00,LIN,Business Wire,Linde Earns Dow Jones Best-in-Class and S&P Global Recognition for Sustainability Leadership,https://finance.yahoo.com/sectors/energy/articles/linde-earns-dow-jones-best-100000597.html
2026-05-05 10:11:00+00:00,TXN,Zacks,"The Zacks Analyst Blog Highlights Shell, HSBC, Texas Instruments and ABB",https://finance.yahoo.com/markets/stocks/articles/zacks-analyst-blog-highlights-shell-101100132.html
2026-05-05 10:15:02+00:00,CPRT,Barchart,Do Wall Street Analysts Like Copart Stock?,https://finance.yahoo.com/markets/stocks/articles/wall-street-analysts-copart-stock-101502249.html
2026-05-05 10:27:00+00:00,CMCSA,Zacks,"The Zacks Analyst Blog Highlights Disney, Comcast, Netflix and Warner Bros",https://finance.yahoo.com/markets/stocks/articles/zacks-analyst-blog-highlights-disney-102700960.html
2026-05-05 10:30:00+00:00,TRI,PR Newswire,Thomson Reuters Reports First-Quarter 2026 Results,https://finance.yahoo.com/markets/stocks/articles/thomson-reuters-reports-first-quarter-103000501.html
2026-05-05 10:30:00+00:00,IDXX,Business Wire,IDEXX Laboratories Announces First Quarter Results,https://finance.yahoo.com/sectors/healthcare/articles/idexx-laboratories-announces-first-quarter-103000086.html
2026-05-05 10:57:00+00:00,AEP,PR Newswire,"AEP Reports First-Quarter 2026 Earnings, Reaffirms Guidance and Increases Five-Year Capital Plan",https://finance.yahoo.com/markets/stocks/articles/aep-reports-first-quarter-2026-105700737.html
2026-05-05 11:00:00+00:00,WDAY,Business Wire,Astrada Raises Seed Round to Build the Data Layer for Autonomous Finance,https://finance.yahoo.com/markets/stocks/articles/astrada-raises-seed-round-build-110000391.html
2026-05-05 11:00:00+00:00,REGN,GlobeNewswire,Dupixent® (dupilumab) Demonstrates Improved Esophageal Function in Eosinophilic Esophagitis (EoE) Phase 4 Trial,https://finance.yahoo.com/sectors/healthcare/articles/dupixent-dupilumab-demonstrates-improved-esophageal-110000370.html
2026-05-05 11:05:39+00:00,BKNG,MarketBeat,"Booking CFO Flags Middle East Travel Hit, Touts Strong Demand and New AI, Fintech Investments",https://finance.yahoo.com/markets/stocks/articles/booking-cfo-flags-middle-east-110539883.html
2026-05-05 11:14:01+00:00,NXPI,Simply Wall St.,NXP Semiconductors (NXPI) Is Up 22.8% After Strong Q1 Results And Upbeat Q2 Outlook,https://finance.yahoo.com/markets/stocks/articles/nxp-semiconductors-nxpi-22-8-111401642.html
2026-05-05 11:14:47+00:00,CHTR,Simply Wall St.,Charter Reshapes Connectivity Leadership As Investors Weigh Subscriber And Value Story,https://finance.yahoo.com/markets/stocks/articles/charter-reshapes-connectivity-leadership-investors-111447432.html
2026-05-05 11:17:51+00:00,AEP,MT Newswires,"Stocks Rise Pre-Bell as Investors Await More Earnings, Monitor Middle East Developments",https://finance.yahoo.com/markets/stocks/articles/stocks-rise-pre-bell-investors-111751265.html
2026-05-05 11:31:59+00:00,TRI,MT Newswires,"Thomson Reuters Q1 Adjusted Earnings, Revenue Climb",https://finance.yahoo.com/markets/stocks/articles/thomson-reuters-q1-adjusted-earnings-113159331.html
2026-05-05 11:39:21+00:00,GEHC,Insider Monkey,Is GE HealthCare (GEHC) the Best Healthcare AI Stock to Buy According to Analysts?,https://finance.yahoo.com/sectors/healthcare/articles/ge-healthcare-gehc-best-healthcare-113921223.html
2026-05-05 11:40:02+00:00,ISRG,Insider Monkey,Intuitive Surgical (ISRG): The Best Healthcare AI Stock to Buy According to Analysts,https://finance.yahoo.com/sectors/healthcare/articles/intuitive-surgical-isrg-best-healthcare-114002840.html
2026-05-05 11:45:02+00:00,IDXX,Zacks,Idexx Laboratories (IDXX) Q1 Earnings and Revenues Surpass Estimates,https://finance.yahoo.com/sectors/healthcare/articles/idexx-laboratories-idxx-q1-earnings-114502532.html
2026-05-05 11:50:12+00:00,TTWO,GuruFocus.com,Grand Theft Auto VI Faces 25 Million Day-One Sales Expectations,https://finance.yahoo.com/markets/stocks/articles/grand-theft-auto-vi-faces-115012076.html
2026-05-05 12:00:09+00:00,ADBE,Simply Wall St.,Adobe Insiders Sold US$19m Of Shares Suggesting Hesitancy,https://finance.yahoo.com/markets/stocks/articles/adobe-insiders-sold-us-19m-120009161.html
2026-05-05 12:04:48+00:00,AMGN,BioPharma Dive,Viridian data lift prospects for thyroid eye disease drug,https://finance.yahoo.com/sectors/healthcare/articles/viridian-data-lift-prospects-thyroid-120448782.html
2026-05-05 12:06:40+00:00,VRTX,MT Newswires,US Equity Futures Higher Pre-Bell as Traders Keep Eye on Potential Re-Escalation of Middle East Hostilities,https://finance.yahoo.com/markets/stocks/articles/us-equity-futures-higher-pre-120640792.html
2026-05-05 12:14:11+00:00,CSX,Simply Wall St.,How The CSX (CSX) Investment Story Is Shifting With New Targets And Freight Signals,https://finance.yahoo.com/markets/stocks/articles/csx-csx-investment-story-shifting-121411155.html
2026-05-05 12:19:00+00:00,VRTX,Zacks,"CRISPR Therapeutics' Q1 Loss Wider Than Expected, Sales Miss Estimates",https://finance.yahoo.com/sectors/healthcare/articles/crispr-therapeutics-q1-loss-wider-121900377.html
2026-05-05 12:22:41+00:00,IDXX,MT Newswires,"Exchange-Traded Funds, Equity Futures Higher Pre-Bell Tuesday Amid Corporate Earnings Rush",https://finance.yahoo.com/markets/stocks/articles/exchange-traded-funds-equity-futures-122241417.html
2026-05-05 12:25:02+00:00,AEP,Zacks,American Electric Power (AEP) Tops Q1 Earnings and Revenue Estimates,https://finance.yahoo.com/markets/stocks/articles/american-electric-power-aep-tops-122502647.html
2026-05-05 12:30:00+00:00,FANG,Moby,"Diamondback Energy, Inc. Q1 2026 Earnings Call Summary",https://finance.yahoo.com/sectors/energy/articles/diamondback-energy-inc-q1-2026-123000813.html
2026-05-05 12:30:00+00:00,PAYX,Business Wire,Pace of U.S. Small Business Employment Increases in April,https://finance.yahoo.com/economy/articles/pace-u-small-business-employment-123000983.html
2026-05-05 12:30:00+00:00,MAR,Moby,"Apple Hospitality REIT, Inc. Q1 2026 Earnings Call Summary",https://finance.yahoo.com/markets/stocks/articles/apple-hospitality-reit-inc-q1-123000663.html
2026-05-05 12:30:00+00:00,DXCM,Business Wire,"Dexcom to Host Investor Day on May 14, 2026",https://finance.yahoo.com/sectors/healthcare/articles/dexcom-host-investor-day-may-123000430.html
2026-05-05 12:39:00+00:00,TMUS,PR Newswire,The Dyrt Creates Comprehensive Pacific Coast Highway Road Trip and Camping Guide Presented by T-Mobile,https://finance.yahoo.com/sectors/technology/articles/dyrt-creates-comprehensive-pacific-coast-123900004.html
2026-05-05 12:50:00+00:00,CTSH,Business Wire,"CrowdStrike Expands Project QuiltWorks, the Cybersecurity Coalition for Securing Frontier AI Risk",https://finance.yahoo.com/sectors/technology/articles/crowdstrike-expands-project-quiltworks-cybersecurity-125000729.html
2026-05-05 12:56:42+00:00,VRTX,MT Newswires,US Equity Futures Gain Pre-Bell as Traders Keep Eye on Potential Re-Escalation of Middle East Hostilities,https://finance.yahoo.com/markets/stocks/articles/us-equity-futures-gain-pre-125642304.html
2026-05-05 12:57:45+00:00,NXPI,Insider Monkey,Needham Raises its Price Target on NXP Semiconductors (NXPI) to $300,https://finance.yahoo.com/markets/stocks/articles/needham-raises-price-target-nxp-125745893.html
2026-05-05 13:00:00+00:00,AEP,GlobeNewswire,Capital Power announces Board appointment,https://finance.yahoo.com/sectors/energy/articles/capital-power-announces-board-appointment-130000868.html
2026-05-05 13:00:00+00:00,CTSH,GlobeNewswire,SnapLogic Announces 2026 Partner Award Winners to Celebrate Excellence in Agentic Integration,https://finance.yahoo.com/sectors/technology/articles/snaplogic-announces-2026-partner-award-130000333.html
2026-05-05 13:00:00+00:00,REGN,PR Newswire,"Zifo's SiEE Boston Summit Charts New Roadmap for 'Practical AI' in Life Sciences, Bridging the Gap Between Business Vision and Lab Reality",https://finance.yahoo.com/sectors/healthcare/articles/zifos-siee-boston-summit-charts-130000432.html
2026-05-05 13:00:00+00:00,CMCSA,Business Wire,"Xfinity and Comcast Business High-Speed Internet Now Available to More Than 2,100 Previously Unserved Homes and Businesses in Central Indiana",https://finance.yahoo.com/sectors/technology/articles/xfinity-comcast-business-high-speed-130000638.html
2026-05-05 13:00:00+00:00,WDAY,Business Wire,QGenda Unlocks New Value for Healthcare Workforce Management with Certified Integration to Workday Human Capital Management,https://finance.yahoo.com/sectors/healthcare/articles/qgenda-unlocks-value-healthcare-workforce-130000152.html
2026-05-05 13:00:00+00:00,BKNG,PR Newswire,"Booking Holdings Inc. to Present at the J.P. Morgan Global Technology, Media and Communications Conference",https://finance.yahoo.com/sectors/technology/articles/booking-holdings-inc-present-j-130000329.html
2026-05-05 13:00:00+00:00,CSX,GlobeNewswire,"CSX Executive Vice President and Chief Financial Officer to Address Bank of America Industrials, Transportation & Airlines Key Leaders Conference",https://finance.yahoo.com/markets/stocks/articles/csx-executive-vice-president-chief-130000301.html
2026-05-05 13:12:00+00:00,VRTX,Zacks,Entrada Therapeutics (TRDA) Surges 8.9%: Is This an Indication of Further Gains?,https://finance.yahoo.com/markets/stocks/articles/entrada-therapeutics-trda-surges-8-131200601.html
2026-05-05 13:20:10+00:00,IDXX,Simply Wall St.,Is It Too Late To Consider IDEXX Laboratories (IDXX) After Its 18.5% One-Year Rally?,https://finance.yahoo.com/markets/stocks/articles/too-consider-idexx-laboratories-idxx-132010387.html
2026-05-05 13:25:52+00:00,TTWO,NYSE,Semafor World Economy: Take-Two Interactive CEO Strauss Zelnick's View on Media,https://finance.yahoo.com/video/semafor-world-economy-two-interactive-132552713.html
2026-05-05 13:30:00+00:00,TMUS,Business Wire,"Every Second Counts: T-Mobile Advances a Stronger, Smarter, More Resilient Network for Americans",https://finance.yahoo.com/sectors/technology/articles/every-second-counts-t-mobile-133000585.html
2026-05-05 13:30:03+00:00,WDAY,Zacks,Brokers Suggest Investing in Workday (WDAY): Read This Before Placing a Bet,https://finance.yahoo.com/markets/stocks/articles/brokers-suggest-investing-workday-wday-133003727.html
2026-05-05 13:30:03+00:00,INTU,Zacks,Intuit (INTU) Is Considered a Good Investment by Brokers: Is That True?,https://finance.yahoo.com/markets/stocks/articles/intuit-intu-considered-good-investment-133003113.html
2026-05-05 13:30:05+00:00,TRI,Zacks,Thomson Reuters (TRI) Q1 Earnings: Taking a Look at Key Metrics Versus Estimates,https://finance.yahoo.com/markets/stocks/articles/thomson-reuters-tri-q1-earnings-133005123.html
2026-05-05 13:30:06+00:00,IDXX,Zacks,Idexx (IDXX) Q1 Earnings: How Key Metrics Compare to Wall Street Estimates,https://finance.yahoo.com/markets/stocks/articles/idexx-idxx-q1-earnings-key-133006888.html
2026-05-05 13:30:15+00:00,AEP,Zacks,"Compared to Estimates, AEP (AEP) Q1 Earnings: A Look at Key Metrics",https://finance.yahoo.com/markets/stocks/articles/compared-estimates-aep-aep-q1-133015105.html
2026-05-05 14:00:00+00:00,CMCSA,Business Wire,Longboard Café Serves Up Success With Comcast Business Technology Solutions,https://finance.yahoo.com/sectors/technology/articles/longboard-caf-serves-success-comcast-140000986.html
2026-05-05 14:00:00+00:00,ADBE,Entrepreneur,I Helped Grow a Startup to a $1.8 Billion Acquisition by Adobe — Here’s the Secret to Scaling Successfully,https://finance.yahoo.com/sectors/technology/articles/helped-grow-startup-1-8-140000825.html
2026-05-05 14:00:00+00:00,CHTR,PR Newswire,SPECTRUM MOBILE SECOND LINE LETS CUSTOMERS DITCH THE EXTRA PHONE FOR GOOD,https://finance.yahoo.com/sectors/technology/articles/spectrum-mobile-second-line-lets-140000070.html
2026-05-05 14:00:00+00:00,CTSH,PR Newswire,"Fortune Announces Third-Annual COO Summit 2026, Convening Leading Chief Operating Officers in Scottsdale, Arizona June 1 - 2",https://finance.yahoo.com/sectors/technology/articles/fortune-announces-third-annual-coo-140000382.html
2026-05-05 14:00:02+00:00,EXC,Zacks,"Ballard Power Systems (BLDP) Reports Q1 Loss, Misses Revenue Estimates",https://finance.yahoo.com/markets/stocks/articles/ballard-power-systems-bldp-reports-140002773.html
2026-05-05 14:03:00+00:00,ZS,Zacks,CrowdStrike Stock Rises 19% in 3 Months: Time to Hold or Book Profits?,https://finance.yahoo.com/markets/stocks/articles/crowdstrike-stock-rises-19-3-140300281.html
2026-05-05 14:10:20+00:00,ADSK,Simply Wall St.,Autodesk (ADSK) Valuation Check As Small Business Initiative Draws Fresh Investor Attention,https://finance.yahoo.com/markets/stocks/articles/autodesk-adsk-valuation-check-small-141020000.html
2026-05-05 14:14:08+00:00,REGN,InvestorsHub,Regeneron (REGN) Dupixent Phase 4 Trial Results Show Improved Esophageal Function in EoE,https://finance.yahoo.com/sectors/healthcare/articles/regeneron-regn-dupixent-phase-4-141408182.html
2026-05-05 14:17:54+00:00,ADBE,Insider Monkey,Adobe (ADBE) Finalizes Acquisition of Semrush Holdings to Power Agentic AI Brand Visibility,https://finance.yahoo.com/markets/stocks/articles/adobe-adbe-finalizes-acquisition-semrush-141754350.html
2026-05-05 14:18:09+00:00,ADSK,Insider Monkey,Autodesk (ADSK) Completes Acquisition of Rhumbix to Enhance Real-Time Jobsite Data Capture,https://finance.yahoo.com/markets/stocks/articles/autodesk-adsk-completes-acquisition-rhumbix-141809088.html
2026-05-05 14:18:36+00:00,WDAY,Insider Monkey,Workday (WDAY) Launches AI-Powered Personnel Action Request Agent to Modernize Federal HR Operations,https://finance.yahoo.com/sectors/technology/articles/workday-wday-launches-ai-powered-141836316.html
2026-05-05 14:28:00+00:00,IDXX,Zacks,"IDEXX Stock Up on Q1 Earnings & Revenue Beat, Margins Rise, '26 View Up",https://finance.yahoo.com/markets/stocks/articles/idexx-stock-q1-earnings-revenue-142800790.html
2026-05-05 14:43:07+00:00,FANG,Investor's Business Daily,Diamondback Energy Hiking Shale Output. Oil Stocks Skid On Earnings.,https://www.investors.com/news/oil-stocks-buy-points-energy-earnings-diamondback-tidewater-transocean/?src=A00220&yptr=yahoo
2026-05-05 14:52:19+00:00,AEP,Motley Fool,AEP Q1 2026 Earnings Transcript,https://finance.yahoo.com/markets/stocks/articles/aep-q1-2026-earnings-transcript-145219094.html
2026-05-05 15:00:00+00:00,ADSK,PR Newswire,Nucleus Research Releases 2026 PLM Technology Value Matrix,https://finance.yahoo.com/sectors/technology/articles/nucleus-research-releases-2026-plm-150000611.html
2026-05-05 15:05:00+00:00,EA,Business Wire,"Fight Your Fight: EA SPORTS™ UFC® 6 Arrives June 19, Delivering Next-Level Fighter Individuality and Gameplay Depth",https://finance.yahoo.com/sectors/technology/articles/fight-fight-ea-sports-ufc-150500177.html
2026-05-05 15:09:02+00:00,TRI,InvestorsHub,Thomson Reuters tops estimates as AI-driven demand boosts growth,https://finance.yahoo.com/markets/stocks/articles/thomson-reuters-tops-estimates-ai-150902502.html
2026-05-05 15:26:00+00:00,AEP,Zacks,"American Electric's Q1 Earnings Beat Estimates, Revenues Increase Y/Y",https://finance.yahoo.com/markets/stocks/articles/american-electrics-q1-earnings-beat-152600941.html
2026-05-05 15:35:43+00:00,CMCSA,Quartz,"James Murdoch in talks to buy New York Magazine, Vox podcast unit",https://finance.yahoo.com/markets/stocks/articles/james-murdoch-talks-buy-york-153543441.html
2026-05-05 15:36:00+00:00,VRSK,GlobeNewswire,Verisk Brings Its Trusted Analytics and Generative AI Capabilities Directly into Anthropic’s Claude,https://finance.yahoo.com/sectors/technology/articles/verisk-brings-trusted-analytics-generative-153600264.html
2026-05-05 15:45:00+00:00,TRI,Barrons.com,Thomson Reuters Turned In Strong Earnings. How It’s Fighting AI Fears.,https://www.barrons.com/articles/thomson-reuters-earnings-stock-price-62c30161?siteid=yhoof2&yptr=yahoo
2026-05-05 15:47:02+00:00,AEP,MarketBeat,American Electric Power Q1 Earnings Call Highlights,https://finance.yahoo.com/sectors/energy/articles/american-electric-power-q1-earnings-154702902.html
2026-05-05 15:47:04+00:00,FANG,MarketBeat,Diamondback Energy Q1 Earnings Call Highlights,https://finance.yahoo.com/sectors/energy/articles/diamondback-energy-q1-earnings-call-154704238.html
2026-05-05 15:56:15+00:00,NXPI,Barchart,NXP Semiconductors Stock Nears All-Time High. Here's Why NXPI is a Buy Now.,https://finance.yahoo.com/markets/stocks/articles/nxp-semiconductors-stock-nears-time-155615916.html
2026-05-05 16:18:00+00:00,MAR,Zacks,DraftKings to Post Q1 Earnings: What's in the Cards for the Stock?,https://finance.yahoo.com/markets/stocks/articles/draftkings-post-q1-earnings-whats-161800612.html
2026-05-05 16:19:59+00:00,IDXX,Motley Fool,Idexx (IDXX) Q1 2026 Earnings Call Transcript,https://finance.yahoo.com/sectors/healthcare/articles/idexx-idxx-q1-2026-earnings-161959330.html
2026-05-05 16:43:46+00:00,AEP,Moby,"American Electric Power Company, Inc. Q1 2026 Earnings Call Summary",https://finance.yahoo.com/sectors/energy/articles/american-electric-power-company-inc-164346735.html
2026-05-05 16:44:00+00:00,KDP,Zacks,Coca-Cola Trades at Valuation Premium: Overvalued or Apt for Entry?,https://finance.yahoo.com/markets/stocks/articles/coca-cola-trades-valuation-premium-164400953.html
2026-05-05 16:44:00+00:00,SBUX,24/7 Wall St.,Brian Niccol Earned the ‘Retail Messi’ Nickname: Starbucks Same-Store Sales Jump 6.2% After 7 Quarters of Decline,https://finance.yahoo.com/markets/stocks/articles/brian-niccol-earned-retail-messi-164400702.html
2026-05-05 16:44:10+00:00,SNPS,Moby,GLOBALFOUNDRIES Inc. Q1 2026 Earnings Call Summary,https://finance.yahoo.com/markets/stocks/articles/globalfoundries-inc-q1-2026-earnings-164410886.html
2026-05-05 16:51:17+00:00,IDXX,Moby,"IDEXX Laboratories, Inc. Q1 2026 Earnings Call Summary",https://finance.yahoo.com/sectors/healthcare/articles/idexx-laboratories-inc-q1-2026-165117371.html
2026-05-05 16:53:00+00:00,AXON,Zacks,Axon Enterprise Gears Up to Post Q1 Earnings: Here's What to Expect,https://finance.yahoo.com/markets/stocks/articles/axon-enterprise-gears-post-q1-165300015.html
2026-05-05 16:53:00+00:00,TRI,Moby,Thomson Reuters Corporation Q1 2026 Earnings Call Summary,https://finance.yahoo.com/markets/stocks/articles/thomson-reuters-corporation-q1-2026-165300393.html
2026-05-05 16:57:00+00:00,VRTX,Zacks,"VRTX's Q1 Earnings Beat Estimates, New Products Aid Sales Growth",https://finance.yahoo.com/sectors/healthcare/articles/vrtxs-q1-earnings-beat-estimates-165700595.html
2026-05-05 17:12:45+00:00,INTU,Simply Wall St.,Is It Time To Reconsider Intuit (INTU) After A 35% One Year Share Price Fall,https://finance.yahoo.com/markets/stocks/articles/time-reconsider-intuit-intu-35-171245376.html
2026-05-05 17:15:00+00:00,FANG,Barrons.com,Diamondback Plans to Drill More. The Stock Pays the Price.,https://www.barrons.com/articles/diamondback-energy-is-boosting-oil-production-c4a36e05?siteid=yhoof2&yptr=yahoo
2026-05-05 17:38:13+00:00,ZS,Insider Monkey,"Why Zscaler, Inc. (ZS)’s Price Cut Isn’t the Full Story",https://finance.yahoo.com/markets/stocks/articles/why-zscaler-inc-zs-price-173813108.html
2026-05-05 17:38:48+00:00,ZS,Simply Wall St.,High Growth Tech Stocks To Watch In US May 2026,https://finance.yahoo.com/sectors/technology/articles/high-growth-tech-stocks-watch-173848171.html
2026-05-05 18:54:09+00:00,VRTX,MT Newswires,"Vertex Pharmaceuticals Confident in Emerging Renal Franchise, Oppenheimer Says",https://finance.yahoo.com/sectors/healthcare/articles/vertex-pharmaceuticals-confident-emerging-renal-185409763.html
2026-05-05 19:20:45+00:00,CTSH,Simply Wall St.,A Look At Cognizant Technology Solutions (CTSH) Valuation After Its Q1 Earnings Beat And Expanded AI Partnerships,https://finance.yahoo.com/markets/stocks/articles/look-cognizant-technology-solutions-ctsh-192045718.html
2026-05-05 19:27:17+00:00,IDXX,MarketBeat,IDEXX Laboratories Q1 Earnings Call Highlights,https://finance.yahoo.com/sectors/healthcare/articles/idexx-laboratories-q1-earnings-call-192717470.html
2026-05-05 20:04:11+00:00,FANG,MT Newswires,Sector Update: Energy Stocks Higher Late Afternoon,https://finance.yahoo.com/sectors/energy/articles/sector-energy-stocks-higher-afternoon-200411184.html
2026-05-05 20:05:00+00:00,EA,Business Wire,Electronic Arts Reports Q4 and FY26 Results,https://finance.yahoo.com/markets/stocks/articles/electronic-arts-reports-q4-fy26-200500365.html
2026-05-05 20:20:56+00:00,IDXX,Investor's Business Daily,How Fluffy's Testing Service Outplayed Slow Vet Visits — Again,https://www.investors.com/news/technology/idexx-stock-idexx-laboratories-earnings-q1-2026/?src=A00220&yptr=yahoo
2026-05-05 20:22:34+00:00,VRTX,Investor's Business Daily,Vertex Dips On Mixed First-Quarter Report; But There's A Silver Lining,https://www.investors.com/news/technology/vertex-stock-vertex-pharmaceuticals-earnings-q1-2026/?src=A00220&yptr=yahoo
2026-05-05 20:23:39+00:00,EA,StockStory,Electronic Arts’s (NASDAQ:EA) Q1 CY2026: Beats On Revenue,https://finance.yahoo.com/markets/stocks/articles/electronic-arts-nasdaq-ea-q1-202339599.html
2026-05-05 20:24:47+00:00,AMGN,Investor's Business Daily,"How This Amgen Rival, Up 33%, Plans To Shake Its Grip In Thyroid Eye Disease",https://www.investors.com/news/technology/viridian-therapeutics-stock-amgen-tepezza-thryoid-eye-disease/?src=A00220&yptr=yahoo
2026-05-05 20:51:00+00:00,ADBE,Motley Fool,Adobe's $25 Billion Buyback Sends a Clear Signal. Yet Shares Remain Dirt Cheap.,https://finance.yahoo.com/markets/stocks/articles/adobes-25-billion-buyback-sends-205100758.html
2026-05-05 20:52:55+00:00,MAR,StockStory,Marriott (MAR) Reports Earnings Tomorrow: What To Expect,https://finance.yahoo.com/markets/stocks/articles/marriott-mar-reports-earnings-tomorrow-205255368.html
2026-05-05 21:04:02+00:00,EA,Reuters,Electronic Arts misses bookings estimates as 'Battlefield' engagement falls,https://finance.yahoo.com/markets/stocks/articles/electronic-arts-misses-bookings-estimates-210402772.html
2026-05-05 21:04:02+00:00,TTWO,Reuters,Electronic Arts misses bookings estimates as 'Battlefield' engagement falls,https://finance.yahoo.com/markets/stocks/articles/electronic-arts-misses-bookings-estimates-210402772.html
2026-05-05 21:07:06+00:00,TRI,MarketBeat,Thomson Reuters Q1 Earnings Call Highlights,https://finance.yahoo.com/markets/stocks/articles/thomson-reuters-q1-earnings-call-210706658.html
2026-05-05 21:18:00+00:00,LIN,Barrons.com,Walmart and 8 More Old Economy Stocks for an AI Melt Up,https://www.barrons.com/articles/walmart-stock-price-ai-melt-up-buy-old-economy-40b6f750?siteid=yhoof2&yptr=yahoo
2026-05-05 21:21:00+00:00,CPRT,Simply Wall St.,Is It Time To Reassess Copart (CPRT) After A 45% One Year Share Price Slide?,https://finance.yahoo.com/markets/stocks/articles/time-reassess-copart-cprt-45-212100750.html
2026-05-05 21:30:00+00:00,PANW,GlobeNewswire,"[Latest] Global Smart Grid Cybersecurity Market Size/Share Worth USD 67.02 Billion by 2035 at a 28.2% CAGR: Custom Market Insights (Analysis, Outlook, Leaders, Report, Trends, Forecast, Segmentation, Growth Rate, Value, SWOT Analysis)",https://finance.yahoo.com/sectors/energy/articles/latest-global-smart-grid-cybersecurity-213000019.html
2026-05-05 21:45:03+00:00,WDAY,Zacks,Why Workday (WDAY) Outpaced the Stock Market Today,https://finance.yahoo.com/markets/stocks/articles/why-workday-wday-outpaced-stock-214503807.html
2026-05-05 21:57:00+00:00,PEP,Motley Fool,Best Consumer Staples Stocks to Buy in 2026,https://finance.yahoo.com/markets/stocks/articles/best-consumer-staples-stocks-buy-215700661.html
2026-05-05 22:00:01+00:00,EA,Zacks,Electronic Arts (EA) Q4 Earnings: Taking a Look at Key Metrics Versus Estimates,https://finance.yahoo.com/markets/stocks/articles/electronic-arts-ea-q4-earnings-220001686.html
2026-05-05 22:05:08+00:00,TTWO,Zacks,Electronic Arts (EA) Q4 Earnings and Revenues Lag Estimates,https://finance.yahoo.com/markets/stocks/articles/electronic-arts-ea-q4-earnings-220508424.html
2026-05-05 22:05:08+00:00,EA,Zacks,Electronic Arts (EA) Q4 Earnings and Revenues Lag Estimates,https://finance.yahoo.com/markets/stocks/articles/electronic-arts-ea-q4-earnings-220508424.html
2026-05-05 22:05:16+00:00,PANW,Zacks,Qualys (QLYS) Q1 Earnings and Revenues Surpass Estimates,https://finance.yahoo.com/markets/stocks/articles/qualys-qlys-q1-earnings-revenues-220516027.html
2026-05-05 22:21:40+00:00,NXPI,IPO-Edge.com,MaxLinear Showcases Panther V for AI Inference at Dell Tech World 2026,https://finance.yahoo.com/sectors/technology/articles/maxlinear-showcases-panther-v-ai-222140075.html
2026-05-05 22:23:15+00:00,SNPS,MarketBeat,Atomera Q1 Earnings Call Highlights,https://finance.yahoo.com/markets/stocks/articles/atomera-q1-earnings-call-highlights-222315790.html
2026-05-05 23:18:17+00:00,NFLX,CorpGov.com,"The Dealmaking 3: LIV Golf Funding, UFC in Australia, ESPN & Disney Take Back Sports",https://finance.yahoo.com/markets/stocks/articles/dealmaking-3-liv-golf-funding-231817103.html
2026-05-05 23:18:17+00:00,CMCSA,CorpGov.com,"The Dealmaking 3: LIV Golf Funding, UFC in Australia, ESPN & Disney Take Back Sports",https://finance.yahoo.com/markets/stocks/articles/dealmaking-3-liv-golf-funding-231817103.html
