timestamp,ticker,source,text,url
2025-08-18 04:31:39+00:00,AMAT,StockStory,1 Nasdaq 100 Stock with Exciting Potential and 2 Facing Headwinds,https://finance.yahoo.com/news/1-nasdaq-100-stock-exciting-043139545.html
2025-08-18 04:33:20+00:00,CDNS,StockStory,1 Volatile Stock with Competitive Advantages and 2 We Brush Off,https://finance.yahoo.com/news/1-volatile-stock-competitive-advantages-043320297.html
2025-08-18 04:33:55+00:00,PLTR,StockStory,1 Volatile Stock to Own for Decades and 2 That Underwhelm,https://finance.yahoo.com/news/1-volatile-stock-own-decades-043355523.html
2025-08-18 04:34:01+00:00,CSGP,StockStory,1 S&P 500 Stock to Own for Decades and 2 We Avoid,https://finance.yahoo.com/news/1-p-500-stock-own-043401901.html
2025-08-18 04:36:47+00:00,ON,StockStory,3 Profitable Stocks We Steer Clear Of,https://finance.yahoo.com/news/3-profitable-stocks-steer-clear-043647820.html
2025-08-18 04:37:40+00:00,WBD,StockStory,3 Mid-Cap Stocks Walking a Fine Line,https://finance.yahoo.com/news/3-mid-cap-stocks-walking-043740988.html
2025-08-18 04:43:26+00:00,MNST,StockStory,2 Safe-and-Steady Stocks for Long-Term Investors and 1 We Brush Off,https://finance.yahoo.com/news/2-safe-steady-stocks-long-044326773.html
2025-08-18 04:45:27+00:00,APP,StockStory,2 Surging  Stocks with Competitive Advantages and 1 We Turn Down,https://finance.yahoo.com/news/2-surging-stocks-competitive-advantages-044527162.html
2025-08-18 05:31:25+00:00,TMUS,StockStory,Telephone and Data Systems’s Q2 Earnings Call: Our Top 5 Analyst Questions,https://finance.yahoo.com/news/telephone-data-systems-q2-earnings-053125544.html
2025-08-18 05:32:53+00:00,TMUS,StockStory,5 Must-Read Analyst Questions From U.S. Cellular’s Q2 Earnings Call,https://finance.yahoo.com/news/5-must-read-analyst-questions-053253202.html
2025-08-18 05:43:13+00:00,TEAM,Simply Wall St.,Google Cloud Partnership and AI Push Could Be a Game Changer for Atlassian (TEAM),https://finance.yahoo.com/news/google-cloud-partnership-ai-push-054313695.html
2025-08-18 07:00:00+00:00,DASH,Investor's Business Daily,Chewy Stock Fetches Higher RS Rating At 81,https://www.investors.com/news/chewy-stock-fetches-higher-rs-rating-at-81/?src=A00220&yptr=yahoo
2025-08-18 07:27:00+00:00,PLTR,Motley Fool,"1 Standout Cryptocurrency to Buy Before It Rockets 2,975% Higher by 2030, According to Cathie Wood's Ark Invest",https://finance.yahoo.com/news/1-standout-cryptocurrency-buy-rockets-072700289.html
2025-08-18 07:55:00+00:00,ARM,Motley Fool,Nvidia Has 95% of Its Portfolio Invested in 2 Brilliant AI Stocks,https://finance.yahoo.com/news/nvidia-95-portfolio-invested-2-075500473.html
2025-08-18 08:21:00+00:00,PYPL,GlobeNewswire,"QR Code Payment Market Trends Analysis Report 2025-2033, with Profiles of PaymentCloud, Clover Network, Revolut, Nearex, ACI, Ecentric Payment Systems, Block, UnionPay, LINE Pay, and PayPal",https://finance.yahoo.com/news/qr-code-payment-market-trends-082100042.html
2025-08-18 08:30:00+00:00,MELI,Motley Fool,Should You Forget Amazon? Why You Might Want to Buy This Unstoppable Growth Stock Instead,https://finance.yahoo.com/news/forget-amazon-why-might-want-083000757.html
2025-08-18 08:40:00+00:00,ORLY,Motley Fool,Is O'Reilly Automotive Stock a Buy?,https://finance.yahoo.com/news/oreilly-automotive-stock-buy-084000647.html
2025-08-18 08:46:00+00:00,PLTR,Motley Fool,"Which Is the Better Choice for Investing $10,000 Right Now: Palantir or XRP (Ripple)?",https://finance.yahoo.com/news/better-choice-investing-10-000-084600734.html
2025-08-18 09:00:00+00:00,PEP,Just Drinks,The road to net zero – the emissions targets of the world’s drinks giants,https://finance.yahoo.com/news/road-net-zero-emissions-targets-114226935.html
2025-08-18 09:15:00+00:00,AMD,Motley Fool,Could Buying AMD Stock Today Help Set You Up For Life?,https://finance.yahoo.com/news/could-buying-amd-stock-today-091500821.html
2025-08-18 09:42:00+00:00,INTU,Zacks,Zacks Investment Ideas feature highlights: Intuit and Microsoft,https://finance.yahoo.com/news/zacks-investment-ideas-feature-highlights-094200425.html
2025-08-18 09:45:00+00:00,PLTR,Motley Fool,Should You Buy the Dip on BigBear.ai's Stock?,https://finance.yahoo.com/news/buy-dip-bigbear-ais-stock-094500393.html
2025-08-18 10:00:00+00:00,ADBE,Motley Fool,Is Figma a Millionaire-Maker Stock?,https://finance.yahoo.com/news/figma-millionaire-maker-stock-100000098.html
2025-08-18 10:00:00+00:00,PLTR,Motley Fool,Prediction: 1 Unstoppable Stock That Will Join the $1 Trillion Club by 2030 (Hint: Not Palantir),https://finance.yahoo.com/news/prediction-1-unstoppable-stock-join-100000536.html
2025-08-18 10:03:00+00:00,INTU,Zacks,"The Zacks Analyst Blog Highlights PayPal, JPMorgan Chase, Intuit, ACI Worldwide and Remitly Global",https://finance.yahoo.com/news/zacks-analyst-blog-highlights-paypal-100300187.html
2025-08-18 10:03:00+00:00,PYPL,Zacks,"The Zacks Analyst Blog Highlights PayPal, JPMorgan Chase, Intuit, ACI Worldwide and Remitly Global",https://finance.yahoo.com/news/zacks-analyst-blog-highlights-paypal-100300187.html
2025-08-18 10:19:00+00:00,AZN,Zacks,"The Zacks Analyst Blog Highlights D-Wave Quantum, Rigetti Computing, IonQ, AstraZeneca, AWS and NVIDIA",https://finance.yahoo.com/news/zacks-analyst-blog-highlights-d-101900698.html
2025-08-18 10:25:14+00:00,HON,Supply Chain Dive,"Honeywell, Stereolabs partner on AI-powered vision tool for warehouses",https://finance.yahoo.com/news/honeywell-stereolabs-partner-ai-powered-102514184.html
2025-08-18 10:25:37+00:00,ON,reddit.com/r/stocks,"Stocks Most at Risk From Rising Delinquencies and CRE Stress, and those Positioned to Benefit if the Fed Finally Pivots - Consumer credit is strained: card APRs are still 21–24%, student loan delinquencies are above 10% of balances, and office CMBS delinquency hit a record 11% in June. That environment puts pressure on lenders and borrowers who live in those channels. Capital One (COF) just printed a $4.3B Q2 loss with a $7.9B reserve build.",
2025-08-18 10:25:37+00:00,EXC,reddit.com/r/stocks,"Stocks Most at Risk From Rising Delinquencies and CRE Stress, and those Positioned to Benefit if the Fed Finally Pivots - Consumer credit is strained: card APRs are still 21–24%, student loan delinquencies are above 10% of balances, and office CMBS delinquency hit a record 11% in June. That environment puts pressure on lenders and borrowers who live in those channels. Capital One (COF) just printed a $4.3B Q2 loss with a $7.9B reserve build.",
2025-08-18 10:25:37+00:00,PEP,reddit.com/r/stocks,"Stocks Most at Risk From Rising Delinquencies and CRE Stress, and those Positioned to Benefit if the Fed Finally Pivots - Consumer credit is strained: card APRs are still 21–24%, student loan delinquencies are above 10% of balances, and office CMBS delinquency hit a record 11% in June. That environment puts pressure on lenders and borrowers who live in those channels. Capital One (COF) just printed a $4.3B Q2 loss with a $7.9B reserve build.",
2025-08-18 10:25:37+00:00,COST,reddit.com/r/stocks,"Stocks Most at Risk From Rising Delinquencies and CRE Stress, and those Positioned to Benefit if the Fed Finally Pivots - Consumer credit is strained: card APRs are still 21–24%, student loan delinquencies are above 10% of balances, and office CMBS delinquency hit a record 11% in June. That environment puts pressure on lenders and borrowers who live in those channels. Capital One (COF) just printed a $4.3B Q2 loss with a $7.9B reserve build.",
2025-08-18 10:28:00+00:00,MSTR,Zacks,"The Zacks Analyst Blog Highlights MicroStrategy, Grayscale Bitcoin Trust ETF, iShares Bitcoin Trust, Fidelity Wise Origin Bitcoin Trust, ARK 21Shares Bitcoin ETF and Bitwise Bitcoin ETF",https://finance.yahoo.com/news/zacks-analyst-blog-highlights-microstrategy-102800208.html
2025-08-18 10:30:00+00:00,COST,Motley Fool,Is Costco Stock an Obvious Buy Right Now?,https://finance.yahoo.com/news/costco-stock-obvious-buy-now-103000770.html
2025-08-18 10:30:00+00:00,BKR,The Daily Upside,"Oil Drilling Stuck Near 4-Year Lows, Thanks to Energy Policy Puzzle",https://finance.yahoo.com/news/oil-drilling-stuck-near-4-103000746.html
2025-08-18 10:33:28+00:00,MDLZ,Waste Dive,"Driven by EPR, brands to offer film and flexibles funding to California recyclers",https://finance.yahoo.com/news/driven-epr-brands-offer-film-103328884.html
2025-08-18 10:33:28+00:00,PEP,Waste Dive,"Driven by EPR, brands to offer film and flexibles funding to California recyclers",https://finance.yahoo.com/news/driven-epr-brands-offer-film-103328884.html
2025-08-18 10:34:09+00:00,CTSH,Simply Wall St.,Should You Be Adding Cognizant Technology Solutions (NASDAQ:CTSH) To Your Watchlist Today?,https://finance.yahoo.com/news/adding-cognizant-technology-solutions-nasdaq-103409687.html
2025-08-18 10:45:00+00:00,MELI,Motley Fool,Prediction: These 2 Stocks Will Outperform the Market in the Next Decade,https://finance.yahoo.com/news/prediction-2-stocks-outperform-market-104500881.html
2025-08-18 10:57:01+00:00,AMD,Insider Monkey,NVIDIA (NVDA) Poised for More Upside With AI and China Tailwinds,https://finance.yahoo.com/news/nvidia-nvda-poised-more-upside-105701742.html
2025-08-18 10:57:01+00:00,CRWD,Insider Monkey,NVIDIA (NVDA) Poised for More Upside With AI and China Tailwinds,https://finance.yahoo.com/news/nvidia-nvda-poised-more-upside-105701742.html
2025-08-18 10:57:08+00:00,AMD,Insider Monkey,"AMD (AMD) Stock Poised for More AI Upside, Says Wall Street",https://finance.yahoo.com/news/amd-amd-stock-poised-more-105708703.html
2025-08-18 10:57:14+00:00,PLTR,Insider Monkey,Snowflake (SNOW) Stock: What UBS Learned From Customers and Partners,https://finance.yahoo.com/news/snowflake-snow-stock-ubs-learned-105714438.html
2025-08-18 11:00:00+00:00,AZN,GlobeNewswire,FibroGen Announces Approval of Sale of FibroGen China to AstraZeneca by the China State Administration for Market Regulation,https://finance.yahoo.com/news/fibrogen-announces-approval-sale-fibrogen-110000077.html
2025-08-18 11:00:00+00:00,QCOM,GlobeNewswire,"Lantronix Solution Powers U.S. Army-Approved Teal Drones, a Red Cat Holdings Co., Unlocking Secure Edge AI Growth Opportunity",https://finance.yahoo.com/news/lantronix-solution-powers-u-army-110000598.html
2025-08-18 11:00:38+00:00,ADBE,Simply Wall St.,When Should You Buy Adobe Inc. (NASDAQ:ADBE)?,https://finance.yahoo.com/news/buy-adobe-inc-nasdaq-adbe-110038968.html
2025-08-18 11:00:58+00:00,CRWD,MT Newswires,"CrowdStrike, Roblox, GE Vernova, Nebius Among 30 Firms That Will Define AI Future, Wedbush Says",https://finance.yahoo.com/news/crowdstrike-roblox-ge-vernova-nebius-110058296.html
2025-08-18 11:00:58+00:00,ADBE,MT Newswires,"CrowdStrike, Roblox, GE Vernova, Nebius Among 30 Firms That Will Define AI Future, Wedbush Says",https://finance.yahoo.com/news/crowdstrike-roblox-ge-vernova-nebius-110058296.html
2025-08-18 11:08:13+00:00,NFLX,Investor's Business Daily,S&P 500 Titans Amazon And Netflix Lead Five Stocks Near Buy Points,https://www.investors.com/news/sp-500-stock-market-amazon-netflix-near-buy-points/?src=A00220&yptr=yahoo
2025-08-18 11:08:13+00:00,MU,Investor's Business Daily,S&P 500 Titans Amazon And Netflix Lead Five Stocks Near Buy Points,https://www.investors.com/news/sp-500-stock-market-amazon-netflix-near-buy-points/?src=A00220&yptr=yahoo
2025-08-18 11:15:00+00:00,AMD,Motley Fool,"2 Growth Stocks to Invest $1,000 In Right Now",https://finance.yahoo.com/news/2-growth-stocks-invest-1-111500121.html
2025-08-18 11:15:14+00:00,ON,reddit.com/r/stocks,"Would you invest in RKLB, CRWV, and Xiaomi for one year with a five-year horizon? - Starting a new investment plan and wanna get your thoughts on my strategy for the next year. My plan is to make weekly buys totaling $750. I'm doing this for the long term, not planning to touch this for at least 5 years. Here's the plan: Rocket Lab $250 CoreWeave $250 Xiaomi $250 My main goal is to make",
2025-08-18 11:20:00+00:00,PEP,Packaging Dive,"PepsiCo, Bold Reuse partner on NFL stadium cups",https://finance.yahoo.com/news/pepsico-bold-reuse-partner-nfl-112000404.html
2025-08-18 11:20:37+00:00,ON,reddit.com/r/stocks,"Warren Buffett’s Berkshire Hathaway Invests $1.8B in Nucor, D.R. Horton and Lennar Here’s Why - Hold your breath, investors! Warren Buffett’s Berkshire Hathaway has just dropped a colossal $1.8 billion into Nucor, DR Horton, and Lennar, and the financial world is buzzing with speculation. But why these stocks? What secret insights is the Oracle of Omaha banking on that the rest of us are missing? Is this a signal of an impending boom in steel",
2025-08-18 11:29:56+00:00,PLTR,MT Newswires,"Stocks Down Pre-Bell as Investors Await Fed Meeting Minutes, Powell's Remarks",https://finance.yahoo.com/news/stocks-down-pre-bell-investors-112956372.html
2025-08-18 11:30:00+00:00,ASML,Motley Fool,3 Genius Artificial Intelligence (AI) Stocks to Buy in August,https://finance.yahoo.com/news/3-genius-artificial-intelligence-ai-113000952.html
2025-08-18 11:30:00+00:00,PDD,GlobeNewswire,"PDD Holdings to Report Second Quarter 2025 Unaudited Financial Results on August 25, 2025",https://finance.yahoo.com/news/pdd-holdings-report-second-quarter-113000565.html
2025-08-18 11:35:37+00:00,WDAY,Simply Wall St.,3 Growth Companies Insiders Are Betting On,https://finance.yahoo.com/news/3-growth-companies-insiders-betting-113537754.html
2025-08-18 11:37:20+00:00,AMD,Simply Wall St.,Latest News In AI Chips - Lantronix Advances AI Tech for Defense with Teal Drones,https://finance.yahoo.com/news/latest-news-ai-chips-lantronix-113720696.html
2025-08-18 11:37:20+00:00,QCOM,Simply Wall St.,Latest News In AI Chips - Lantronix Advances AI Tech for Defense with Teal Drones,https://finance.yahoo.com/news/latest-news-ai-chips-lantronix-113720696.html
2025-08-18 11:37:20+00:00,ASML,Simply Wall St.,Latest News In AI Chips - Lantronix Advances AI Tech for Defense with Teal Drones,https://finance.yahoo.com/news/latest-news-ai-chips-lantronix-113720696.html
2025-08-18 11:45:32+00:00,MAR,Hotel Management Network,Marriott Executive Apartments launches ‘urban retreat’ in Kuala Lumpur,https://finance.yahoo.com/news/marriott-executive-apartments-launches-urban-114532906.html
2025-08-18 12:00:02+00:00,PLTR,Barchart,"Palantir Stock is ‘Anomalously Bullish’ Says CEO Alex Karp, Because Ongoing AI ‘Revolution’ Is Resulting In ‘a Perfect Time for Palantir’",https://finance.yahoo.com/news/palantir-stock-anomalously-bullish-says-120002811.html
2025-08-18 12:15:48+00:00,PLTR,Investor's Business Daily,"These AI Stocks Face 'Show Me' Moment: Palantir, CoreWeave, Nvidia, Snowflake",https://www.investors.com/news/technology/artificial-intelligence-stocks/?src=A00220&yptr=yahoo
2025-08-18 12:16:44+00:00,MSTR,CoinDesk,Michael Saylor's Strategy Added $51M of Bitcoin Last Week,https://finance.yahoo.com/news/michael-saylors-strategy-added-51m-121644797.html
2025-08-18 12:17:00+00:00,LULU,Motley Fool,These Undervalued Growth Stocks Could Surge 50% by 2026,https://finance.yahoo.com/news/undervalued-growth-stocks-could-surge-121700705.html
2025-08-18 12:23:53+00:00,ADP,Investor's Business Daily,Dayforce Stock Jumps On Report Of Private Equity Suitor,https://www.investors.com/news/technology/dayforce-stock-thoma-bravo-acquisition-talks/?src=A00220&yptr=yahoo
2025-08-18 12:23:53+00:00,PAYX,Investor's Business Daily,Dayforce Stock Jumps On Report Of Private Equity Suitor,https://www.investors.com/news/technology/dayforce-stock-thoma-bravo-acquisition-talks/?src=A00220&yptr=yahoo
2025-08-18 12:23:53+00:00,WDAY,Investor's Business Daily,Dayforce Stock Jumps On Report Of Private Equity Suitor,https://www.investors.com/news/technology/dayforce-stock-thoma-bravo-acquisition-talks/?src=A00220&yptr=yahoo
2025-08-18 12:24:00+00:00,FAST,Zacks,"Beat the Market the Zacks Way: CBRE, Acadian, Fastenal in Focus",https://finance.yahoo.com/news/beat-market-zacks-way-cbre-122400060.html
2025-08-18 12:25:00+00:00,COST,Zacks,Can Costco's Affirm Tie-Up Accelerate Digital Sales in Q4?,https://finance.yahoo.com/news/costcos-affirm-tie-accelerate-digital-122500953.html
2025-08-18 12:30:02+00:00,CDNS,Zacks,Here's How Much a $1000 Investment in Cadence Design Systems Made 10 Years Ago Would Be Worth Today,https://finance.yahoo.com/news/heres-much-1000-investment-cadence-123002025.html
2025-08-18 12:37:38+00:00,PYPL,Simply Wall St.,Digital Payment Update - QR Code Payment Market Growth Fueled By Smartphone Use,https://finance.yahoo.com/news/digital-payment-qr-code-payment-123738044.html
2025-08-18 12:38:58+00:00,MSTR,Benzinga,BitMine's Crypto Holdings Surpass 1.52 Million ETH To Become Second-Biggest Crypto Treasury,https://finance.yahoo.com/news/bitmines-crypto-holdings-surpass-1-123858320.html
2025-08-18 12:45:00+00:00,MU,Motley Fool,Here's Why Nvidia Outperforms Out to 2028,https://finance.yahoo.com/news/heres-why-nvidia-outperforms-2028-124500060.html
2025-08-18 12:45:00+00:00,AMD,Motley Fool,Here's Why Nvidia Outperforms Out to 2028,https://finance.yahoo.com/news/heres-why-nvidia-outperforms-2028-124500060.html
2025-08-18 12:48:00+00:00,CHTR,PR Newswire,Charter Offers Senior Secured Notes,https://finance.yahoo.com/news/charter-offers-senior-secured-notes-124800190.html
2025-08-18 12:53:41+00:00,MSTR,Investopedia,"Bitcoin, Ether, and Crypto-Tied Stocks Drop as Profit-Taking Persists",https://finance.yahoo.com/news/bitcoin-ether-crypto-tied-stocks-125341528.html
2025-08-18 13:00:00+00:00,MRVL,PR Newswire,Marvell LiquidSecurity Selected for Microsoft Azure Cloud HSM,https://finance.yahoo.com/news/marvell-liquidsecurity-selected-microsoft-azure-130000114.html
2025-08-18 13:00:00+00:00,WDAY,Business Wire,"The Jackson T. Stephens Cup Announces 2025 Sponsorship Lineup: Stephens, Workday, and Old National Bank",https://finance.yahoo.com/news/jackson-t-stephens-cup-announces-130000304.html
2025-08-18 13:00:00+00:00,COST,PR Newswire,"ASUS Announces Major Savings This Back-to-School Season, With Up to 40% Off a Wide Selection From Essential to Premium Tech!",https://finance.yahoo.com/news/asus-announces-major-savings-back-130000150.html
2025-08-18 13:00:00+00:00,AMD,Business Wire,"Liquid’s Edge AI Platform, LEAP, Expands Support to Laptops With Best-in-Class Performance on AMD Ryzen™ and Ryzen AI™ Processors",https://finance.yahoo.com/news/liquid-edge-ai-platform-leap-130000102.html
2025-08-18 13:00:03+00:00,AAPL,Zacks,Here is What to Know Beyond Why Apple Inc. (AAPL) is a Trending Stock,https://finance.yahoo.com/news/know-beyond-why-apple-inc-130003332.html
2025-08-18 13:00:03+00:00,PYPL,Zacks,"PayPal Holdings, Inc. (PYPL) is Attracting Investor Attention: Here is What You Should Know",https://finance.yahoo.com/news/paypal-holdings-inc-pypl-attracting-130003172.html
2025-08-18 13:00:04+00:00,SBUX,Zacks,Starbucks Corporation (SBUX) is Attracting Investor Attention: Here is What You Should Know,https://finance.yahoo.com/news/starbucks-corporation-sbux-attracting-investor-130004843.html
2025-08-18 13:00:04+00:00,MSTR,Zacks,Investors Heavily Search MicroStrategy Incorporated (MSTR): Here is What You Need to Know,https://finance.yahoo.com/news/investors-heavily-search-microstrategy-incorporated-130004031.html
2025-08-18 13:00:05+00:00,CRWD,Zacks,CrowdStrike (CRWD) is Attracting Investor Attention: Here is What You Should Know,https://finance.yahoo.com/news/crowdstrike-crwd-attracting-investor-attention-130005332.html
2025-08-18 13:04:10+00:00,WDAY,TechCrunch,HR giant Workday says hackers stole personal data in recent breach,https://finance.yahoo.com/news/hr-giant-workday-says-hackers-130410698.html
2025-08-18 13:04:10+00:00,CSCO,TechCrunch,HR giant Workday says hackers stole personal data in recent breach,https://finance.yahoo.com/news/hr-giant-workday-says-hackers-130410698.html
2025-08-18 13:07:04+00:00,MSTR,Bloomberg,Ethereum’s Big Backers Unleash Billions to Push Into Wall Street,https://finance.yahoo.com/news/ethereum-big-backers-unleash-billions-130704758.html
2025-08-18 13:07:22+00:00,GOOG,reddit.com/r/stocks,"(08/18) Interesting Stocks Today- Wegocy Weworks on Liver Fibrosis?? - This is a daily watchlist for short-term trading: I might trade all/none of the stocks listed, and even stocks not listed! I am targeting potentially good candidates for short-term trading; I have no opinion on them as investments. The potential of the stock moving today is what makes it interesting, everything else is secondary. News: [Comcast's Most Significant Business Is The Internet But Subscribers Are",
2025-08-18 13:07:22+00:00,ON,reddit.com/r/stocks,"(08/18) Interesting Stocks Today- Wegocy Weworks on Liver Fibrosis?? - This is a daily watchlist for short-term trading: I might trade all/none of the stocks listed, and even stocks not listed! I am targeting potentially good candidates for short-term trading; I have no opinion on them as investments. The potential of the stock moving today is what makes it interesting, everything else is secondary. News: [Comcast's Most Significant Business Is The Internet But Subscribers Are",
2025-08-18 13:13:32+00:00,WDAY,Insider Monkey,RGA Investment Advisors Added Workday (WDAY) due to Mixed Growth Drivers,https://finance.yahoo.com/news/rga-investment-advisors-added-workday-131332150.html
2025-08-18 13:14:46+00:00,TEAM,reddit.com/r/stocks,"Comcast Gets Serious About Subscriber Losses - A Long Fight Looms - Comcast Corp. has a problem - the company is losing customers in its most significant business, providing internet access to nearly 30 million American households. The Philadelphia-based telecom and media conglomerate has reported record losses of broadband subscribers for three straight quarters, more than half a million accounts in total, after pandemic-related federal subsidies for low-income customers ended and telecom companies like T-Mobile",
2025-08-18 13:14:46+00:00,ON,reddit.com/r/stocks,"Comcast Gets Serious About Subscriber Losses - A Long Fight Looms - Comcast Corp. has a problem - the company is losing customers in its most significant business, providing internet access to nearly 30 million American households. The Philadelphia-based telecom and media conglomerate has reported record losses of broadband subscribers for three straight quarters, more than half a million accounts in total, after pandemic-related federal subsidies for low-income customers ended and telecom companies like T-Mobile",
2025-08-18 13:15:02+00:00,AMAT,Zacks,Don't Overlook Applied Materials (AMAT) International Revenue Trends While Assessing the Stock,https://finance.yahoo.com/news/dont-overlook-applied-materials-amat-131502821.html
2025-08-18 13:15:02+00:00,AMD,The Wall Street Journal,The Interventionist-In-Chief: Heard on the Street,https://www.wsj.com/livecoverage/stock-market-today-dow-sp-500-nasdaq-08-18-2025/card/the-interventionist-in-chief-heard-on-the-street-d2dyhqWqDeX4YWyOPGkK?siteid=yhoof2&yptr=yahoo
2025-08-18 13:15:02+00:00,ROST,Zacks,Gear Up for Ross Stores (ROST) Q2 Earnings: Wall Street Estimates for Key Metrics,https://finance.yahoo.com/news/gear-ross-stores-rost-q2-131502597.html
2025-08-18 13:15:02+00:00,CSCO,Zacks,Why Cisco (CSCO) International Revenue Trends Deserve Your Attention,https://finance.yahoo.com/news/why-cisco-csco-international-revenue-131502416.html
2025-08-18 13:15:02+00:00,INTU,Zacks,"Exploring Analyst Estimates for Intuit (INTU) Q4 Earnings, Beyond Revenue and EPS",https://finance.yahoo.com/news/exploring-analyst-estimates-intuit-intu-131502173.html
2025-08-18 13:15:03+00:00,WDAY,Zacks,"Exploring Analyst Estimates for Workday (WDAY) Q2 Earnings, Beyond Revenue and EPS",https://finance.yahoo.com/news/exploring-analyst-estimates-workday-wday-131503903.html
2025-08-18 13:16:00+00:00,ROST,Barrons.com,This Is the Real Threat to Retailers This Earnings Season,https://www.barrons.com/articles/walmart-target-retail-earnings-e3a19f6c?siteid=yhoof2&yptr=yahoo
2025-08-18 13:18:40+00:00,PYPL,Insider Monkey,Here’s Why RGA Investment Advisors Sold PayPal Holdings Inc (PYPL),https://finance.yahoo.com/news/why-rga-investment-advisors-sold-131840314.html
2025-08-18 13:20:48+00:00,CRWD,GuruFocus.com,Wedbush Picks New AI Winners: CrowdStrike and Roblox Take the Lead,https://finance.yahoo.com/news/wedbush-picks-ai-winners-crowdstrike-132048705.html
2025-08-18 13:21:00+00:00,AMD,Zacks,"Stock Market News for Aug 18, 2025",https://finance.yahoo.com/news/stock-market-news-aug-18-132100673.html
2025-08-18 13:21:00+00:00,AVGO,Zacks,"Stock Market News for Aug 18, 2025",https://finance.yahoo.com/news/stock-market-news-aug-18-132100673.html
2025-08-18 13:21:00+00:00,AMAT,Zacks,"Company News for Aug 18, 2025",https://finance.yahoo.com/news/company-news-aug-18-2025-132100466.html
2025-08-18 13:22:00+00:00,AAPL,Zacks,Buffett's Shot in the Arm Sends UnitedHealth Soaring Against the Odds,https://finance.yahoo.com/news/buffetts-shot-arm-sends-unitedhealth-132200528.html
2025-08-18 13:25:00+00:00,GILD,Zacks,GILD Stock Up 7% Post Q2 Earnings: Should You Buy Now or Wait?,https://finance.yahoo.com/news/gild-stock-7-post-q2-132500964.html
2025-08-18 13:30:00+00:00,IDXX,PR Newswire,National Veterinary Associates Welcomes Brian McKeon to Board of Directors,https://finance.yahoo.com/news/national-veterinary-associates-welcomes-brian-133000074.html
2025-08-18 13:30:03+00:00,AVGO,Zacks,Is It Worth Investing in Broadcom Inc. (AVGO) Based on Wall Street's Bullish Views?,https://finance.yahoo.com/news/worth-investing-broadcom-inc-avgo-133003875.html
2025-08-18 13:30:03+00:00,NFLX,Zacks,Should You Invest in Netflix (NFLX) Based on Bullish Wall Street Views?,https://finance.yahoo.com/news/invest-netflix-nflx-based-bullish-133003916.html
2025-08-18 13:33:33+00:00,CSX,The Fly,"CVS Health upgraded, Occidental downgraded: Wall Street's top analyst calls",https://finance.yahoo.com/news/cvs-health-upgraded-occidental-downgraded-133333408.html
