timestamp,ticker,source,text,url
2026-05-06 14:55:05+00:00,WMT,MarketBeat,Angi Q1 Earnings Call Highlights,https://finance.yahoo.com/markets/stocks/articles/angi-q1-earnings-call-highlights-145505954.html
2026-05-06 14:56:33+00:00,META,reddit.com/r/stocks,"The Perpetual War - Anyone else get the feeling that Trump ironically needs the war to continue indefinitely to prop the market up? He can announce the war has ended weekly for that little pump, and no one wants to sell or short the market because of the upside risk of a big move up the day the war actually ends. Ironically, I can imagine the war ending as the catalyst for the market to",
2026-05-06 14:56:55+00:00,PCAR,TechCrunch,Aurora lands McLane deal to run driverless truck routes in Texas,https://finance.yahoo.com/sectors/technology/articles/aurora-lands-mclane-deal-run-145655506.html
2026-05-06 14:59:33+00:00,MSTR,Insider Monkey,Conestoga Capital Advisors Sold Paylocity Holding Corp. (PCTY) in Q1,https://finance.yahoo.com/markets/stocks/articles/conestoga-capital-advisors-sold-paylocity-145933997.html
2026-05-06 15:00:00+00:00,PLTR,Benzinga,Palantir's Alex Karp Says PLTR Prioritizes US Warfighters Over Commercial Clients: 'We Just Cannot Meet Demand',https://finance.yahoo.com/markets/stocks/articles/palantirs-alex-karp-says-pltr-150000954.html
2026-05-06 15:00:00+00:00,ADBE,PR Newswire,NYC'S Largest Small Business Event Returns To Javits Center During National Small Business Week,https://finance.yahoo.com/economy/articles/nycs-largest-small-business-event-150000995.html
2026-05-06 15:00:37+00:00,PLTR,GuruFocus.com,"Palantir Stock Set for Explosive AI Run, Says Wedbush Analyst Dan Ives",https://finance.yahoo.com/markets/stocks/articles/palantir-stock-set-explosive-ai-150037913.html
2026-05-06 15:03:37+00:00,WMT,Moneywise,Maryland is moving to ban companies like Walmart and Kroger from ‘surveillance pricing’ — what it is and how to avoid it,https://finance.yahoo.com/economy/policy/articles/maryland-moving-ban-companies-walmart-150337817.html
2026-05-06 15:05:00+00:00,AVGO,Motley Fool,This Is the Part of the AI Boom Nobody Is Talking About -- and the Stock Sitting at the Center of It,https://finance.yahoo.com/markets/stocks/articles/part-ai-boom-nobody-talking-150500578.html
2026-05-06 15:06:00+00:00,MAR,Zacks,Marriott Q1 Earnings Beat Estimates on Higher RevPAR & Fees,https://finance.yahoo.com/markets/stocks/articles/marriott-q1-earnings-beat-estimates-150600833.html
2026-05-06 15:09:31+00:00,AVGO,24/7 Wall St.,AI Chip Packaging Constraints Create an Opening for Intel’s EMIB Technology,https://finance.yahoo.com/sectors/technology/articles/ai-chip-packaging-constraints-create-150931768.html
2026-05-06 15:20:00+00:00,PEP,Motley Fool,Retirees: 3 High-Yielding Dividend Stocks That Can Add Plenty of Passive Income and Reduce Your Portfolio's Risk,https://finance.yahoo.com/markets/stocks/articles/retirees-3-high-yielding-dividend-152000848.html
2026-05-06 15:21:20+00:00,PANW,Barchart,Palo Alto Is Buying Portkey. That Makes PANW Stock Even More of a Bet on AI Agents.,https://finance.yahoo.com/sectors/technology/articles/palo-alto-buying-portkey-makes-152120126.html
2026-05-06 15:21:46+00:00,PYPL,Simply Wall St.,A Look At PayPal Holdings (PYPL) Valuation As Earnings Beat But Guidance Resets Expectations,https://finance.yahoo.com/markets/stocks/articles/look-paypal-holdings-pypl-valuation-152146219.html
2026-05-06 15:22:33+00:00,SHOP,Simply Wall St.,Assessing Shopify (SHOP) Valuation After Recent Share Price Weakness,https://finance.yahoo.com/markets/stocks/articles/assessing-shopify-shop-valuation-recent-152233523.html
2026-05-06 15:25:00+00:00,EA,Zacks,"Electronic Arts Q4 Earnings Miss Estimates, Revenues Increase Y/Y",https://finance.yahoo.com/markets/stocks/articles/electronic-arts-q4-earnings-miss-152500380.html
2026-05-06 15:27:02+00:00,TTWO,Fortune,"The CEO behind Grand Theft Auto VI doesn’t play video games, but is staking $1.5 billion on the biggest game launch of the decade",https://finance.yahoo.com/markets/stocks/articles/ceo-behind-grand-theft-auto-152702094.html
2026-05-06 15:30:00+00:00,TSLA,Benzinga,Jim Chanos Drops Reality Check On Cathie Wood's ARK Robotaxi Prediction: 'Isn't That 100%…',https://finance.yahoo.com/markets/stocks/articles/jim-chanos-drops-reality-check-153132973.html
2026-05-06 15:30:00+00:00,MSFT,Yahoo Finance Video,Anthropic CEO warns software companies can 'go bust' without AI,https://finance.yahoo.com/video/anthropic-ceo-warns-software-companies-can-go-bust-without-ai-153000062.html
2026-05-06 15:30:09+00:00,PYPL,24/7 Wall St.,PYPY Has Already Lost 50% Because Its Design Captures Losses But Caps Gains,https://finance.yahoo.com/markets/options/articles/pypy-already-lost-50-because-153009325.html
2026-05-06 15:31:04+00:00,PLTR,24/7 Wall St.,Argus Just Upgraded Palantir to Buy After the Sell-Off. Is $190 the New Floor?,https://finance.yahoo.com/markets/stocks/articles/argus-just-upgraded-palantir-buy-153104800.html
2026-05-06 15:32:00+00:00,TSLA,Zacks,Why Tesla's Optimus Story Is More Promise Than Progress,https://finance.yahoo.com/markets/stocks/articles/why-teslas-optimus-story-more-153200371.html
2026-05-06 15:34:00+00:00,EXC,Motley Fool,Exelon (EXC) Q1 2026 Earnings Transcript,https://finance.yahoo.com/markets/stocks/articles/exelon-exc-q1-2026-earnings-153400704.html
2026-05-06 15:36:00+00:00,TSLA,Zacks,What Tesla's Massive $25B+ Capex Means for Investors Now,https://finance.yahoo.com/markets/stocks/articles/teslas-massive-25b-capex-means-153600657.html
2026-05-06 15:40:03+00:00,AMGN,Zacks,RPRX vs. AMGN: Which Stock Is the Better Value Option?,https://finance.yahoo.com/markets/stocks/articles/rprx-vs-amgn-stock-better-154003071.html
2026-05-06 15:40:26+00:00,MSTR,decrypt,Strategy Yield ETN Gives UK Investors Exposure to Bitcoin Giant's STRC Shares,https://finance.yahoo.com/markets/crypto/articles/strategy-yield-etn-gives-uk-154026998.html
2026-05-06 15:43:00+00:00,ADBE,Motley Fool,The Best AI Stocks Wall Street Is Sleeping On in 2026,https://finance.yahoo.com/markets/stocks/articles/best-ai-stocks-wall-street-154300883.html
2026-05-06 15:43:00+00:00,PLTR,Motley Fool,The Best AI Stocks Wall Street Is Sleeping On in 2026,https://finance.yahoo.com/markets/stocks/articles/best-ai-stocks-wall-street-154300883.html
2026-05-06 15:43:00+00:00,MSTR,Zacks,"Strategy Q1 Loss Wider Than Expected, Revenues Rise Y/Y",https://finance.yahoo.com/markets/stocks/articles/strategy-q1-loss-wider-expected-154300047.html
2026-05-06 15:46:54+00:00,EA,MT Newswires,"Electronic Arts Deal Still on Track Despite Lower Forecasts, Wedbush Says",https://finance.yahoo.com/markets/stocks/articles/electronic-arts-deal-still-track-154654138.html
2026-05-06 15:47:53+00:00,INTC,reddit.com/r/stocks,"Is Intel's rally actually sustainable or is this a geopolitical spike? - $INTC more than doubled in April, best month in their history on the Nasdaq. Apple chip deal news just dropped this week pushing it to 110. The deal makes more sense now than it ever has. Apple's entire chip supply runs through TSMC in Taiwan, one company on one geopolitically sensitive island. Add the Iran war disrupting global shipping, Trump tariffs that can",
2026-05-06 15:48:36+00:00,ZS,24/7 Wall St.,BTIG Just Got Bullish on Palo Alto Networks: Price Target Climbs to $216 on Improving Channel Checks,https://finance.yahoo.com/markets/stocks/articles/btig-just-got-bullish-palo-154836491.html
2026-05-06 15:48:36+00:00,FTNT,24/7 Wall St.,BTIG Just Got Bullish on Palo Alto Networks: Price Target Climbs to $216 on Improving Channel Checks,https://finance.yahoo.com/markets/stocks/articles/btig-just-got-bullish-palo-154836491.html
2026-05-06 15:48:36+00:00,CRWD,24/7 Wall St.,BTIG Just Got Bullish on Palo Alto Networks: Price Target Climbs to $216 on Improving Channel Checks,https://finance.yahoo.com/markets/stocks/articles/btig-just-got-bullish-palo-154836491.html
2026-05-06 15:48:36+00:00,PANW,24/7 Wall St.,BTIG Just Got Bullish on Palo Alto Networks: Price Target Climbs to $216 on Improving Channel Checks,https://finance.yahoo.com/markets/stocks/articles/btig-just-got-bullish-palo-154836491.html
2026-05-06 15:49:34+00:00,ADP,MT Newswires,"April Private Sector Hiring Logs Fastest Growth Pace Since January 2025, ADP Says",https://finance.yahoo.com/economy/articles/april-private-sector-hiring-logs-154934821.html
2026-05-06 15:49:44+00:00,PYPL,Quartz,PayPal layoffs: New CEO cuts 20% of workforce in Q1 2026,https://finance.yahoo.com/markets/stocks/articles/paypal-layoffs-ceo-cuts-20-154944985.html
2026-05-06 15:54:14+00:00,COST,MarketBeat,Maplebear Q1 Earnings Call Highlights,https://finance.yahoo.com/markets/stocks/articles/maplebear-q1-earnings-call-highlights-155414010.html
2026-05-06 15:54:15+00:00,EXC,MarketBeat,Exelon Q1 Earnings Call Highlights,https://finance.yahoo.com/sectors/energy/articles/exelon-q1-earnings-call-highlights-155415570.html
2026-05-06 15:54:34+00:00,PLTR,TheStreet,Bank of America sends clear message on Palantir stock after earnings,https://finance.yahoo.com/markets/stocks/articles/bank-america-sends-clear-message-155434009.html
2026-05-06 15:55:00+00:00,KHC,Zacks,Kraft Heinz Q1 Earnings Beat Estimates Despite Organic Sales Dip,https://finance.yahoo.com/markets/stocks/articles/kraft-heinz-q1-earnings-beat-155500804.html
2026-05-06 15:57:00+00:00,FTNT,Zacks,Palo Alto Networks Trades at Premium Valuation: How to Play the Stock,https://finance.yahoo.com/markets/stocks/articles/palo-alto-networks-trades-premium-155700706.html
2026-05-06 15:57:00+00:00,PANW,Zacks,Palo Alto Networks Trades at Premium Valuation: How to Play the Stock,https://finance.yahoo.com/markets/stocks/articles/palo-alto-networks-trades-premium-155700706.html
2026-05-06 16:00:00+00:00,TMUS,Business Wire,"T-Mobile US, Inc. to Present at the MoffettNathanson Media, Internet & Communications & J.P. Morgan Global Technology, Media and Communications Conferences",https://finance.yahoo.com/markets/stocks/articles/t-mobile-us-inc-present-160000733.html
2026-05-06 16:00:00+00:00,AMZN,Yahoo Finance Video,Josh D'Amaro's 'super app' could be Disney's next big catalyst,https://finance.yahoo.com/video/josh-damaros-super-app-could-160000514.html
2026-05-06 16:00:00+00:00,REGN,Zacks,"RARE Q1 Loss Wider Than Expected, Sales Down Y/Y on Seasonal Effect",https://finance.yahoo.com/sectors/healthcare/articles/rare-q1-loss-wider-expected-160000522.html
2026-05-06 16:00:05+00:00,APP,Zacks,AppLovin (APP) Upgraded to Buy: Here's What You Should Know,https://finance.yahoo.com/markets/stocks/articles/applovin-app-upgraded-buy-heres-160005636.html
2026-05-06 16:03:00+00:00,AVGO,TheStreet,Broadcom guidance reveals one signal getting unusual attention,https://finance.yahoo.com/markets/stocks/articles/broadcom-guidance-reveals-one-signal-160300361.html
2026-05-06 16:07:00+00:00,STX,Motley Fool,Meet the Artificial Intelligence (AI) Infrastructure Stock Crushing Micron Technology in 2026. Its Red-Hot Earnings Growth Could Send It Even Higher,https://finance.yahoo.com/markets/stocks/articles/meet-artificial-intelligence-ai-infrastructure-160700899.html
2026-05-06 16:07:00+00:00,MU,Motley Fool,Meet the Artificial Intelligence (AI) Infrastructure Stock Crushing Micron Technology in 2026. Its Red-Hot Earnings Growth Could Send It Even Higher,https://finance.yahoo.com/markets/stocks/articles/meet-artificial-intelligence-ai-infrastructure-160700899.html
2026-05-06 16:11:44+00:00,MNST,MT Newswires,"Monster Beverage Seen Posting Strong Q1 Revenue, But Margins Impacted by Cost Pressures, RBC Says",https://finance.yahoo.com/markets/stocks/articles/monster-beverage-seen-posting-strong-161144729.html
2026-05-06 16:12:41+00:00,AMGN,Simply Wall St.,Amgen’s US$300m Biologics Push And What It Means For AMGN Stock,https://finance.yahoo.com/markets/stocks/articles/amgen-us-300m-biologics-push-161241597.html
2026-05-06 16:13:45+00:00,PLTR,Simply Wall St.,Palantir Revenue Surges As AI Demand Outstrips Supply And Guidance Rises,https://finance.yahoo.com/markets/stocks/articles/palantir-revenue-surges-ai-demand-161345633.html
2026-05-06 16:14:37+00:00,MSTR,Yahoo Finance Video,Bitcoin rallies above $82K as Michael Saylor considers selling,https://finance.yahoo.com/video/bitcoin-rallies-above-82k-as-michael-saylor-considers-selling-161437060.html
2026-05-06 16:15:00+00:00,NVDA,Yahoo Finance Video,The space ETFs prepping for liftoff ahead of SpaceX IPO,https://finance.yahoo.com/video/space-etfs-prepping-liftoff-ahead-161500971.html
2026-05-06 16:15:00+00:00,AAPL,Yahoo Finance Video,The space ETFs prepping for liftoff ahead of SpaceX IPO,https://finance.yahoo.com/video/space-etfs-prepping-liftoff-ahead-161500971.html
2026-05-06 16:15:42+00:00,ADI,Simply Wall St.,Analog Devices (ADI) Is Up 5.6% After Analyst Upgrades Ahead Of Earnings - What's Changed,https://finance.yahoo.com/markets/stocks/articles/analog-devices-adi-5-6-161542157.html
2026-05-06 16:19:43+00:00,ARM,Motley Fool,Why Arm Holdings Stock Was Jumping Today,https://finance.yahoo.com/markets/stocks/articles/why-arm-holdings-stock-jumping-161943035.html
2026-05-06 16:20:02+00:00,FANG,Zacks,Earnings Estimates Moving Higher for Diamondback (FANG): Time to Buy?,https://finance.yahoo.com/markets/stocks/articles/earnings-estimates-moving-higher-diamondback-162002053.html
2026-05-06 16:20:14+00:00,ASML,WWD,Verneek Bolsters Its Advisory Board,https://finance.yahoo.com/sectors/technology/articles/verneek-bolsters-advisory-board-162014075.html
2026-05-06 16:20:14+00:00,WMT,WWD,Verneek Bolsters Its Advisory Board,https://finance.yahoo.com/sectors/technology/articles/verneek-bolsters-advisory-board-162014075.html
2026-05-06 16:21:00+00:00,KLAC,Zacks,"Should You Buy, Sell or Hold AMAT Stock at a P/S Valuation of 9.39X?",https://finance.yahoo.com/markets/stocks/articles/buy-sell-hold-amat-stock-162100236.html
2026-05-06 16:21:00+00:00,LRCX,Zacks,"Should You Buy, Sell or Hold AMAT Stock at a P/S Valuation of 9.39X?",https://finance.yahoo.com/markets/stocks/articles/buy-sell-hold-amat-stock-162100236.html
2026-05-06 16:21:00+00:00,AMAT,Zacks,"Should You Buy, Sell or Hold AMAT Stock at a P/S Valuation of 9.39X?",https://finance.yahoo.com/markets/stocks/articles/buy-sell-hold-amat-stock-162100236.html
2026-05-06 16:28:30+00:00,INTC,reddit.com/r/stocks,"Intel trading at a ~119x forward P/E and nobody is talking about this - So Intel just had a blowout Q1 and the stock ripped 27%+ in a single session. Great quarter, sure. Six consecutive beats, AI chip demand, Apple partnership rumors, all that noise. I get it. But can we talk about the valuation for a second? INTC is currently sitting at a forward P/E of \~119x. For context, the semiconductor industry median forward",
2026-05-06 16:28:30+00:00,AMD,reddit.com/r/stocks,"Intel trading at a ~119x forward P/E and nobody is talking about this - So Intel just had a blowout Q1 and the stock ripped 27%+ in a single session. Great quarter, sure. Six consecutive beats, AI chip demand, Apple partnership rumors, all that noise. I get it. But can we talk about the valuation for a second? INTC is currently sitting at a forward P/E of \~119x. For context, the semiconductor industry median forward",
2026-05-06 16:28:34+00:00,MSTR,Trefis,How MSTR Stock Rises To $370,https://finance.yahoo.com/markets/stocks/articles/mstr-stock-rises-370-162834175.html
2026-05-06 16:29:00+00:00,AMAT,Zacks,Mercury Systems Q3 Earnings Beat on Record Bookings & Backlog,https://finance.yahoo.com/markets/stocks/articles/mercury-systems-q3-earnings-beat-162900177.html
2026-05-06 16:29:00+00:00,ADI,Zacks,Mercury Systems Q3 Earnings Beat on Record Bookings & Backlog,https://finance.yahoo.com/markets/stocks/articles/mercury-systems-q3-earnings-beat-162900177.html
2026-05-06 16:33:43+00:00,ARM,MT Newswires,"Advanced Micro Devices CPU Momentum Strong, GPU Upside Key for Outperformance, RBC Says",https://finance.yahoo.com/sectors/technology/articles/advanced-micro-devices-cpu-momentum-163343231.html
2026-05-06 16:37:34+00:00,TSLA,Investor's Business Daily,Tesla-SpaceX File $55 Billion Estimate For Their Joint Semiconductor Factory,https://www.investors.com/news/tesla-spacex-elon-musk-terafab-ai-chip-factory-55-billion/?src=A00220&yptr=yahoo
2026-05-06 16:42:00+00:00,PLTR,Motley Fool,"Owning AI Stocks Doesn't Have to Be Risky -- at Least, Not With Alphabet",https://finance.yahoo.com/markets/stocks/articles/owning-ai-stocks-doesnt-risky-164200124.html
2026-05-06 16:44:00+00:00,KHC,Proactive,Kraft Heinz beats profit and sales forecasts despite soft organic growth in Q1,https://finance.yahoo.com/markets/stocks/articles/kraft-heinz-beats-profit-sales-164400537.html
2026-05-06 16:44:01+00:00,MAR,Motley Fool,Marriott (MAR) Q1 2026 Earnings Transcript,https://finance.yahoo.com/markets/stocks/articles/marriott-mar-q1-2026-earnings-164401658.html
2026-05-06 16:44:53+00:00,KHC,Moby,The Kraft Heinz Company Q1 2026 Earnings Call Summary,https://finance.yahoo.com/markets/stocks/articles/kraft-heinz-company-q1-2026-164453013.html
2026-05-06 16:45:03+00:00,PLTR,Zacks,3 Reasons Why Growth Investors Shouldn't Overlook Palantir Technologies (PLTR),https://finance.yahoo.com/markets/stocks/articles/3-reasons-why-growth-investors-164503169.html
2026-05-06 16:46:33+00:00,MSTR,Yahoo Finance Video,Bitcoin hits $82k: Follow Michael Saylor or hold?,https://finance.yahoo.com/video/bitcoin-hits-82k-follow-michael-saylor-or-hold-164633623.html
2026-05-06 16:51:27+00:00,COST,Moby,Elanco Animal Health Incorporated Q1 2026 Earnings Call Summary,https://finance.yahoo.com/sectors/healthcare/articles/elanco-animal-health-incorporated-q1-165127832.html
2026-05-06 16:52:40+00:00,SNDK,Insider Monkey,Jim Cramer on Seagate: “They’re Practically Printing Money”,https://finance.yahoo.com/markets/stocks/articles/jim-cramer-seagate-practically-printing-165240769.html
2026-05-06 16:52:40+00:00,STX,Insider Monkey,Jim Cramer on Seagate: “They’re Practically Printing Money”,https://finance.yahoo.com/markets/stocks/articles/jim-cramer-seagate-practically-printing-165240769.html
2026-05-06 16:52:40+00:00,WDC,Insider Monkey,Jim Cramer on Seagate: “They’re Practically Printing Money”,https://finance.yahoo.com/markets/stocks/articles/jim-cramer-seagate-practically-printing-165240769.html
2026-05-06 16:52:42+00:00,SNDK,Insider Monkey,Jim Cramer on Sandisk: “That’s Extremely Cheap for a Growth Stock”,https://finance.yahoo.com/markets/stocks/articles/jim-cramer-sandisk-extremely-cheap-165242536.html
2026-05-06 16:52:42+00:00,WDC,Insider Monkey,Jim Cramer on Sandisk: “That’s Extremely Cheap for a Growth Stock”,https://finance.yahoo.com/markets/stocks/articles/jim-cramer-sandisk-extremely-cheap-165242536.html
2026-05-06 16:55:55+00:00,MAR,Moby,"Marriott International, Inc. Q1 2026 Earnings Call Summary",https://finance.yahoo.com/markets/stocks/articles/marriott-international-inc-q1-2026-165555634.html
2026-05-06 16:58:47+00:00,MRVL,Trefis,A Smarter Way To Look At Broadcom Stock,https://finance.yahoo.com/markets/stocks/articles/smarter-way-look-broadcom-stock-165847276.html
2026-05-06 16:58:47+00:00,AVGO,Trefis,A Smarter Way To Look At Broadcom Stock,https://finance.yahoo.com/markets/stocks/articles/smarter-way-look-broadcom-stock-165847276.html
2026-05-06 16:59:17+00:00,QCOM,Investopedia,AMD's Stock Soars to a Fresh Record as AI Demand Drives Up Sales,https://finance.yahoo.com/markets/stocks/articles/amds-stock-soars-fresh-record-165917388.html
2026-05-06 17:04:46+00:00,FANG,MT Newswires,"Diamondback Energy Can Pursue More Growth Opportunities if Elevated Oil Macro Persists, RBC Says",https://finance.yahoo.com/sectors/energy/articles/diamondback-energy-pursue-more-growth-170446996.html
2026-05-06 17:05:00+00:00,MU,Barrons.com,5 Signs the Semiconductor Rally Is Getting Silly,https://www.barrons.com/articles/semiconductor-rally-ai-chips-021ef0d9?siteid=yhoof2&yptr=yahoo
2026-05-06 17:07:50+00:00,WMT,Investor's Business Daily,Walmart's Chart Shows Buy Signs. Is It A Growth Stock Or A Defensive Play?,https://www.investors.com/news/walmart-stock-chart-dow-jones-stock-amazon-is-walmart-a-growth-stock/?src=A00220&yptr=yahoo
2026-05-06 17:09:04+00:00,PLTR,24/7 Wall St.,Palantir Grew Revenue 85% but Is Down 23% This Year. Our Model Has a Price Prediction That May Surprise You,https://finance.yahoo.com/markets/stocks/articles/palantir-grew-revenue-85-down-170904003.html
2026-05-06 17:16:00+00:00,ASML,Barrons.com,Quantum’s Risks Are Overstated—and the Investment Opportunity May Be Underestimated,https://www.barrons.com/articles/quantum-computing-stocks-risks-rewards-opportunity-8dd2b24f?siteid=yhoof2&yptr=yahoo
2026-05-06 17:16:12+00:00,PLTR,24/7 Wall St.,"Nvidia Is a Buy, AMD Is a Hold and Palantir Is a Sell. Here Is the Math Behind Each Call",https://finance.yahoo.com/markets/stocks/articles/nvidia-buy-amd-hold-palantir-171612467.html
2026-05-06 17:16:56+00:00,CRWD,Simply Wall St.,Should CrowdStrike’s AI-driven OverWatch Expansion to Defender Users Require Action From CrowdStrike Holdings (CRWD) Investors?,https://finance.yahoo.com/markets/stocks/articles/crowdstrike-ai-driven-overwatch-expansion-171656997.html
2026-05-06 17:23:08+00:00,TSLA,TechCrunch,SpaceX may spend up to $119B on ‘Terafab’ chip factory in Texas,https://finance.yahoo.com/sectors/technology/articles/spacex-may-spend-119-billion-172308114.html
2026-05-06 17:26:43+00:00,CEG,24/7 Wall St.,Oklo Advances 12% on NRC Aurora Approval: Is This the AI Infrastructure Nuclear Play?,https://finance.yahoo.com/sectors/energy/articles/oklo-advances-12-nrc-aurora-172643927.html
2026-05-06 17:27:00+00:00,KLAC,Zacks,Teradyne Stock Trades at a Premium: Should You Buy Now or Wait?,https://finance.yahoo.com/markets/stocks/articles/teradyne-stock-trades-premium-buy-172700802.html
2026-05-06 17:29:00+00:00,AMAT,Zacks,"Astera Labs Q1 Earnings Beat Estimates, Revenues Increase Y/Y",https://finance.yahoo.com/markets/stocks/articles/astera-labs-q1-earnings-beat-172900570.html
2026-05-06 17:29:00+00:00,ADI,Zacks,"Astera Labs Q1 Earnings Beat Estimates, Revenues Increase Y/Y",https://finance.yahoo.com/markets/stocks/articles/astera-labs-q1-earnings-beat-172900570.html
2026-05-06 17:30:02+00:00,SHOP,Barchart,Shopify's Strong Q1 FCF Growth Sparks Unusual Buying of SHOP Calls,https://finance.yahoo.com/markets/options/articles/shopifys-strong-q1-fcf-growth-173002768.html
2026-05-06 17:31:04+00:00,KHC,Benzinga,How To Earn $500 A Month From Kraft Heinz Stock Ahead Of Q1 Earnings,https://finance.yahoo.com/markets/stocks/articles/earn-500-month-kraft-heinz-173104077.html
2026-05-06 17:34:00+00:00,WMT,GlobeNewswire,"Walmart Canada and Children’s Miracle Network Rally Canadians to Support Kids’ Health, Kick Off Annual Fundraising Campaign",https://finance.yahoo.com/sectors/healthcare/articles/walmart-canada-children-miracle-network-173400831.html
2026-05-06 17:34:23+00:00,SHOP,24/7 Wall St.,Shopify Eyes 7% Upside After Brutal 2026 Selloff,https://finance.yahoo.com/markets/stocks/articles/shopify-eyes-7-upside-brutal-173423864.html
2026-05-06 17:36:06+00:00,PYPL,GuruFocus.com,AI Layoffs Hit Crypto And Payments As Block Cuts 50%,https://finance.yahoo.com/markets/crypto/articles/ai-layoffs-hit-crypto-payments-173606377.html
2026-05-06 17:36:17+00:00,APP,Simply Wall St.,3 Growth Companies With Insider Ownership Up To 15%,https://finance.yahoo.com/markets/stocks/articles/3-growth-companies-insider-ownership-173617250.html
2026-05-06 17:40:52+00:00,MSTR,Bankless,Saylor's Strategy Contemplates BTC Sales to Fund Swelling Dividend Obligations,https://finance.yahoo.com/markets/stocks/articles/saylors-strategy-contemplates-btc-sales-174052474.html
2026-05-06 17:45:00+00:00,DASH,Zacks,"Grab Holdings Incurs Loss in Q1, Surpasses Revenue Estimates",https://finance.yahoo.com/markets/stocks/articles/grab-holdings-incurs-loss-q1-174500656.html
2026-05-06 17:51:02+00:00,PYPL,Fortune,The ‘PayPal Mafia’ built a $1.5 billion fintech pioneer. The company they left behind is on life support,https://finance.yahoo.com/markets/stocks/articles/paypal-mafia-built-1-5-175102356.html
2026-05-06 17:51:02+00:00,PLTR,Fortune,The ‘PayPal Mafia’ built a $1.5 billion fintech pioneer. The company they left behind is on life support,https://finance.yahoo.com/markets/stocks/articles/paypal-mafia-built-1-5-175102356.html
2026-05-06 17:51:02+00:00,TSLA,Fortune,The ‘PayPal Mafia’ built a $1.5 billion fintech pioneer. The company they left behind is on life support,https://finance.yahoo.com/markets/stocks/articles/paypal-mafia-built-1-5-175102356.html
2026-05-06 17:58:11+00:00,AAPL,GuruFocus.com,Apple Opens AI Platform To Rivals Across 2 Billion Devices,https://finance.yahoo.com/sectors/technology/articles/apple-opens-ai-platform-rivals-175811422.html
2026-05-06 17:58:17+00:00,ADP,MT Newswires,Sector Update: Financial Stocks Higher Wednesday Afternoon,https://finance.yahoo.com/markets/stocks/articles/sector-financial-stocks-higher-wednesday-175817722.html
2026-05-06 18:00:05+00:00,DASH,MT Newswires,"Equity Markets Rise Intraday, Oil Plunges Amid US-Iran Peace Deal Optimism",https://finance.yahoo.com/markets/stocks/articles/equity-markets-rise-intraday-oil-180005905.html
2026-05-06 18:00:05+00:00,WBD,MT Newswires,"Equity Markets Rise Intraday, Oil Plunges Amid US-Iran Peace Deal Optimism",https://finance.yahoo.com/markets/stocks/articles/equity-markets-rise-intraday-oil-180005905.html
2026-05-06 18:00:05+00:00,ADP,MT Newswires,"Equity Markets Rise Intraday, Oil Plunges Amid US-Iran Peace Deal Optimism",https://finance.yahoo.com/markets/stocks/articles/equity-markets-rise-intraday-oil-180005905.html
2026-05-06 18:00:05+00:00,ARM,MT Newswires,"Equity Markets Rise Intraday, Oil Plunges Amid US-Iran Peace Deal Optimism",https://finance.yahoo.com/markets/stocks/articles/equity-markets-rise-intraday-oil-180005905.html
