timestamp,ticker,source,text,url
2026-05-07 14:50:00+00:00,PANW,Motley Fool,"This Small-Cap Growth Stock Is Down 65%, but Should You Buy the Dip? Here's What Wall Street Thinks.",https://finance.yahoo.com/markets/stocks/articles/small-cap-growth-stock-down-145000536.html
2026-05-07 14:50:00+00:00,CRWD,Motley Fool,"This Small-Cap Growth Stock Is Down 65%, but Should You Buy the Dip? Here's What Wall Street Thinks.",https://finance.yahoo.com/markets/stocks/articles/small-cap-growth-stock-down-145000536.html
2026-05-07 14:52:00+00:00,PEP,Zacks,PepsiCo Stock Rises 9.4% in 6 Months: Buy Now or Stay Focused?,https://finance.yahoo.com/markets/stocks/articles/pepsico-stock-rises-9-4-145200969.html
2026-05-07 14:52:00+00:00,MNST,Zacks,PepsiCo Stock Rises 9.4% in 6 Months: Buy Now or Stay Focused?,https://finance.yahoo.com/markets/stocks/articles/pepsico-stock-rises-9-4-145200969.html
2026-05-07 15:04:05+00:00,MRVL,24/7 Wall St.,"Marvell Reaches All Time Highs: Buy, Sell or Hold?",https://finance.yahoo.com/markets/stocks/articles/marvell-reaches-time-highs-buy-150405382.html
2026-05-07 15:05:26+00:00,BKR,Investing.com,"Barclays sees the best setup for energy services in 20 years, names best stocks",https://finance.yahoo.com/sectors/energy/articles/barclays-sees-best-setup-energy-150526444.html
2026-05-07 15:09:37+00:00,PYPL,InvestorsHub,AI-Driven Commerce Momentum Lifts Commerce.com (CMRC) Results as Profitability Improves,https://finance.yahoo.com/markets/stocks/articles/ai-driven-commerce-momentum-lifts-150937784.html
2026-05-07 15:15:00+00:00,AXON,Zacks,AXON Q1 Earnings Miss Estimates on Tariff-Driven Margins,https://finance.yahoo.com/markets/stocks/articles/axon-q1-earnings-miss-estimates-151500621.html
2026-05-07 15:21:53+00:00,SBUX,Exec Edge,Krispy Kreme 1Q Adjusted EBITDA Jumps 38% Amid Turnaround,https://finance.yahoo.com/markets/stocks/articles/krispy-kreme-1q-adjusted-ebitda-152153705.html
2026-05-07 15:24:00+00:00,FTNT,Zacks,"Fortinet Q1 Earnings & Revenues Beat Estimates, Increase Y/Y",https://finance.yahoo.com/markets/stocks/articles/fortinet-q1-earnings-revenues-beat-152400692.html
2026-05-07 15:30:02+00:00,AXON,MT Newswires,"Axon Enterprise's Q1 Outperformance Strengthens Case for Durable Growth, Morgan Stanley Says",https://finance.yahoo.com/markets/stocks/articles/axon-enterprise-apos-q1-outperformance-153002266.html
2026-05-07 15:34:00+00:00,ADI,Barrons.com,"Why This Income Pro Likes Banks, Chip-Equipment Companies, and More",https://www.barrons.com/articles/columbia-dividend-income-fund-stocks-ae6106d1?siteid=yhoof2&yptr=yahoo
2026-05-07 15:35:04+00:00,LRCX,24/7 Wall St.,Lam Research Has Surged 300% in a Year. Wall Street Sees More Gains Still Ahead,https://finance.yahoo.com/markets/stocks/articles/lam-research-surged-300-wall-153504119.html
2026-05-07 15:35:13+00:00,APP,MT Newswires,"AppLovin Retains Strong Mobile Gaming Advertising Moat, Wedbush Says",https://finance.yahoo.com/markets/stocks/articles/applovin-retains-strong-mobile-gaming-153513833.html
2026-05-07 15:35:13+00:00,AXON,MT Newswires,"AppLovin Retains Strong Mobile Gaming Advertising Moat, Wedbush Says",https://finance.yahoo.com/markets/stocks/articles/applovin-retains-strong-mobile-gaming-153513833.html
2026-05-07 15:36:00+00:00,EXC,Business Wire,ComEd Energy Efficiency Program Receives National Recognition From Energy Coalition,https://finance.yahoo.com/sectors/energy/articles/comed-energy-efficiency-program-receives-153600263.html
2026-05-07 15:40:02+00:00,FAST,Zacks,LZ vs. FAST: Which Stock Is the Better Value Option?,https://finance.yahoo.com/markets/stocks/articles/lz-vs-fast-stock-better-154002335.html
2026-05-07 15:43:03+00:00,PYPL,MarketBeat,Bigcommerce Q1 Earnings Call Highlights,https://finance.yahoo.com/markets/stocks/articles/bigcommerce-q1-earnings-call-highlights-154303285.html
2026-05-07 15:53:00+00:00,MRVL,Zacks,"MRVL Climbs 50% in a Month: Time to Buy, Sell or Hold the Stock?",https://finance.yahoo.com/markets/stocks/articles/mrvl-climbs-50-month-time-155300902.html
2026-05-07 16:00:00+00:00,MAR,PR Newswire,The Ritz-Carlton Redefines Race Weekend Luxury with the U.S. SailGP Team in New York City,https://finance.yahoo.com/sectors/technology/articles/ritz-carlton-redefines-race-weekend-160000386.html
2026-05-07 16:02:00+00:00,AXON,Barrons.com,Axon Enterprise Stock Jumps After Earnings. Tasers Are Going International.,https://www.barrons.com/articles/axon-enterprise-earnings-stock-price-82a5a2a2?siteid=yhoof2&yptr=yahoo
2026-05-07 16:17:00+00:00,FTNT,Proactive,Fortinet raises full-year outlook as strong cybersecurity demand drives Q1 outperformance,https://finance.yahoo.com/sectors/technology/articles/fortinet-raises-full-outlook-strong-161700176.html
2026-05-07 16:20:02+00:00,MPWR,Zacks,Surging Earnings Estimates Signal Upside for Monolithic (MPWR) Stock,https://finance.yahoo.com/markets/stocks/articles/surging-earnings-estimates-signal-upside-162002028.html
2026-05-07 16:38:12+00:00,DASH,MT Newswires,"DoorDash Re-Platforming On Track, Execution Intact, RBC Says",https://finance.yahoo.com/markets/stocks/articles/doordash-platforming-track-execution-intact-163812090.html
2026-05-07 16:39:04+00:00,STX,Insider Monkey,Morgan Stanley Calls Seagate Technology Holdings (STX) a “Top Pick”,https://finance.yahoo.com/markets/stocks/articles/morgan-stanley-calls-seagate-technology-163904538.html
2026-05-07 16:40:59+00:00,CHTR,Insider Monkey,"Why Charter Communications, Inc. (CHTR) is One of the Top Cheap Stocks to Buy With the Biggest Upside Potential",https://finance.yahoo.com/markets/stocks/articles/why-charter-communications-inc-chtr-164059831.html
2026-05-07 16:42:00+00:00,MPWR,Zacks,Monolithic Stock Rises 158.2% in the Past Year: How to Play the Stock,https://finance.yahoo.com/markets/stocks/articles/monolithic-stock-rises-158-2-164200760.html
2026-05-07 16:42:00+00:00,MCHP,Zacks,Monolithic Stock Rises 158.2% in the Past Year: How to Play the Stock,https://finance.yahoo.com/markets/stocks/articles/monolithic-stock-rises-158-2-164200760.html
2026-05-07 16:42:00+00:00,ADI,Zacks,Monolithic Stock Rises 158.2% in the Past Year: How to Play the Stock,https://finance.yahoo.com/markets/stocks/articles/monolithic-stock-rises-158-2-164200760.html
2026-05-07 16:50:15+00:00,LRCX,Trefis,"Intel, Lam, KLA: Will Musk’s $120B Terafab Boost These Stocks?",https://finance.yahoo.com/markets/stocks/articles/intel-lam-kla-musk-120b-165015775.html
2026-05-07 16:50:15+00:00,KLAC,Trefis,"Intel, Lam, KLA: Will Musk’s $120B Terafab Boost These Stocks?",https://finance.yahoo.com/markets/stocks/articles/intel-lam-kla-musk-120b-165015775.html
2026-05-07 17:00:00+00:00,DXCM,CNW Group,Ivy Parks of BD-Canada Appointed Chair of the Medtech Canada Board of Directors,https://finance.yahoo.com/sectors/healthcare/articles/ivy-parks-bd-canada-appointed-170000554.html
2026-05-07 17:00:45+00:00,SBUX,MT Newswires,"Dutch Bros' Limited-Time Offers Contributed to Q1 Beat, But Competitive Overhang Remains, RBC Says",https://finance.yahoo.com/markets/stocks/articles/dutch-bros-apos-limited-time-170045058.html
2026-05-07 17:03:13+00:00,SBUX,Yahoo Finance,"After a big win in the burger showdown, Burger King eyes taking on McDonald's Egg McMuffin",https://finance.yahoo.com/markets/article/after-a-big-win-in-the-burger-showdown-burger-king-eyes-taking-on-mcdonalds-egg-mcmuffin-170313988.html
2026-05-07 17:11:34+00:00,CRWD,Simply Wall St.,Does CrowdStrike (CRWD) Still Offer Value After Its Recent Share Price Climb?,https://finance.yahoo.com/markets/stocks/articles/does-crowdstrike-crwd-still-offer-171134848.html
2026-05-07 17:14:00+00:00,MRVL,Zacks,"Should Investors Buy, Hold, or Sell ALAB Stock Post Q1 Earnings?",https://finance.yahoo.com/markets/stocks/articles/investors-buy-hold-sell-alab-171400096.html
2026-05-07 17:26:21+00:00,LRCX,Insider Monkey,BofA Remains Bullish on Applied Materials (AMAT),https://finance.yahoo.com/markets/stocks/articles/bofa-remains-bullish-applied-materials-172621481.html
2026-05-07 17:27:00+00:00,APP,Barrons.com,AppLovin Beats Quarterly Revenue Expectations. The Stock Is Rising.,https://www.barrons.com/articles/applovin-earnings-stock-price-78ec614a?siteid=yhoof2&yptr=yahoo
2026-05-07 17:30:00+00:00,ADBE,Zacks,"Adobe Falls 27% YTD, Trades at a Discount: What Should Investors Do?",https://finance.yahoo.com/markets/stocks/articles/adobe-falls-27-ytd-trades-173000464.html
2026-05-07 17:30:02+00:00,SHOP,Barchart,Unusual Shopify Stock Options Activity Signals a Unique Trade for Income and Upside,https://finance.yahoo.com/markets/options/articles/unusual-shopify-stock-options-activity-173002403.html
2026-05-07 17:35:59+00:00,APP,Simply Wall St.,3 Growth Stocks Insiders Are Betting On,https://finance.yahoo.com/markets/stocks/articles/3-growth-stocks-insiders-betting-173559125.html
2026-05-07 17:50:00+00:00,CHTR,Motley Fool,Where Are Comcast and Charter's Internet Customers Going? Here.,https://finance.yahoo.com/markets/stocks/articles/where-comcast-charters-internet-customers-175000604.html
2026-05-07 17:50:00+00:00,CMCSA,Motley Fool,Where Are Comcast and Charter's Internet Customers Going? Here.,https://finance.yahoo.com/markets/stocks/articles/where-comcast-charters-internet-customers-175000604.html
2026-05-07 18:01:30+00:00,APP,Investor's Business Daily,AppLovin Stock Rises As AI Platform's Earnings Report Triggers Volatile Trading,https://www.investors.com/news/technology/applovin-stock-q1-earnings-2026-app/?src=A00220&yptr=yahoo
2026-05-07 18:04:47+00:00,FTNT,GuruFocus.com,Fortinet Gains AI Momentum With Data Center Wins,https://finance.yahoo.com/sectors/technology/articles/fortinet-gains-ai-momentum-data-180447523.html
2026-05-07 18:08:10+00:00,GILD,MT Newswires,"Equities Fall Intraday, Oil Rises as Traders Monitor Middle East Developments",https://finance.yahoo.com/markets/stocks/articles/equities-fall-intraday-oil-rises-180810980.html
2026-05-07 18:08:10+00:00,MNST,MT Newswires,"Equities Fall Intraday, Oil Rises as Traders Monitor Middle East Developments",https://finance.yahoo.com/markets/stocks/articles/equities-fall-intraday-oil-rises-180810980.html
2026-05-07 18:09:00+00:00,ADI,Zacks,"DoorDash Q1 Earnings Top Estimates, Revenues Increase Y/Y, Shares Up",https://finance.yahoo.com/markets/stocks/articles/doordash-q1-earnings-top-estimates-180900576.html
2026-05-07 18:09:00+00:00,DASH,Zacks,"DoorDash Q1 Earnings Top Estimates, Revenues Increase Y/Y, Shares Up",https://finance.yahoo.com/markets/stocks/articles/doordash-q1-earnings-top-estimates-180900576.html
2026-05-07 18:11:00+00:00,ADI,Zacks,"NICE Q1 Earnings Beat Estimates on Strong Cloud Revenues, Shares Up",https://finance.yahoo.com/markets/stocks/articles/nice-q1-earnings-beat-estimates-181100352.html
2026-05-07 18:16:00+00:00,ADI,Zacks,"MKSI Q1 Earnings Beat Estimates, Revenue Increase Y/Y, Shares Up",https://finance.yahoo.com/markets/stocks/articles/mksi-q1-earnings-beat-estimates-181600759.html
2026-05-07 18:19:04+00:00,ADP,Simply Wall St.,ADP Jobs Surge And New Debt Issue Reframe Long Term Investment Story,https://finance.yahoo.com/markets/stocks/articles/adp-jobs-surge-debt-issue-181904957.html
2026-05-07 18:20:50+00:00,LRCX,Simply Wall St.,Lam Research (LRCX) Is Up 19.5% After AI-Fab Orders Beat Expectations Has The Bull Case Changed?,https://finance.yahoo.com/markets/stocks/articles/lam-research-lrcx-19-5-182050880.html
2026-05-07 18:22:24+00:00,ADP,Yahoo Finance,"April jobs report: Economy adds 115,000 jobs, far better than expected",https://finance.yahoo.com/economy/article/april-jobs-report-economy-adds-115000-jobs-far-better-than-expected-182224225.html
2026-05-07 18:48:00+00:00,PAYX,GlobeNewswire,2026 ChicagoCISO ORBIE Awards Recognize Top Security Executives,https://finance.yahoo.com/sectors/technology/articles/2026-chicagociso-orbie-awards-recognize-184800567.html
2026-05-07 18:51:24+00:00,IDXX,Simply Wall St.,"Analyst Estimates: Here's What Brokers Think Of IDEXX Laboratories, Inc. (NASDAQ:IDXX) After Its First-Quarter Report",https://finance.yahoo.com/markets/stocks/articles/analyst-estimates-heres-brokers-think-185124453.html
2026-05-07 18:57:03+00:00,LRCX,24/7 Wall St.,"EWT, EWY, and SOXX: The Only 3 ETFs You Need for Semiconductor Dominance",https://finance.yahoo.com/markets/stocks/articles/ewt-ewy-soxx-only-3-185703029.html
2026-05-07 18:57:03+00:00,KLAC,24/7 Wall St.,"EWT, EWY, and SOXX: The Only 3 ETFs You Need for Semiconductor Dominance",https://finance.yahoo.com/markets/stocks/articles/ewt-ewy-soxx-only-3-185703029.html
2026-05-07 19:13:00+00:00,TMUS,TheStreet,T-Mobile quietly updates internet prices amid rising pressure,https://finance.yahoo.com/markets/stocks/articles/t-mobile-quietly-revamps-internet-191300750.html
2026-05-07 19:13:00+00:00,CMCSA,TheStreet,T-Mobile quietly updates internet prices amid rising pressure,https://finance.yahoo.com/markets/stocks/articles/t-mobile-quietly-revamps-internet-191300750.html
2026-05-07 19:18:13+00:00,ASML,Investing.com,ASML to reap benefits from demand from Low-NA EUV adoption,https://finance.yahoo.com/markets/stocks/articles/asml-reap-benefits-demand-low-191813993.html
2026-05-07 19:39:09+00:00,TMUS,Insider Monkey,Here’s What the Street Thinks About ​T-Mobile (TMUS),https://finance.yahoo.com/markets/stocks/articles/street-thinks-t-mobile-tmus-193909390.html
2026-05-07 19:39:24+00:00,PDD,Insider Monkey,"PDD Holdings (PDD) To Release FQ1 2026 Earnings on May 19, Here’s What to Know",https://finance.yahoo.com/markets/stocks/articles/pdd-holdings-pdd-release-fq1-193924401.html
2026-05-07 19:47:00+00:00,SHOP,TheStreet,Cathie Wood buys $32M of e-commerce goliath after strong earnings,https://finance.yahoo.com/markets/stocks/articles/cathie-wood-buys-32m-e-194700559.html
2026-05-07 20:00:00+00:00,GILD,GlobeNewswire,Assembly Biosciences Reports First Quarter 2026 Financial Results and Recent Highlights,https://finance.yahoo.com/sectors/healthcare/articles/assembly-biosciences-reports-first-quarter-200000703.html
2026-05-07 20:00:07+00:00,WBD,IPO-Edge.com,IPO Edge NYSE Firesides Scheduled for June 2 & July 28,https://finance.yahoo.com/news/ipo-edge-nyse-firesides-scheduled-211107368.html
2026-05-07 20:01:00+00:00,ROST,PR Newswire,"Ross Stores, Inc. Announces First Quarter 2026 Earnings Release and Conference Call",https://finance.yahoo.com/markets/stocks/articles/ross-stores-inc-announces-first-200100159.html
2026-05-07 20:01:00+00:00,GILD,Business Wire,Gilead Sciences Announces First Quarter Financial Results,https://finance.yahoo.com/sectors/healthcare/articles/gilead-sciences-announces-first-quarter-200100629.html
2026-05-07 20:01:00+00:00,AMGN,PR Newswire,AMGEN TO PRESENT AT THE BANK OF AMERICA MERRILL LYNCH GLOBAL HEALTHCARE CONFERENCE,https://finance.yahoo.com/sectors/healthcare/articles/amgen-present-bank-america-merrill-200100907.html
2026-05-07 20:03:18+00:00,INSM,Investor's Business Daily,Insmed Tanks On Its Most Important Launch; Why Analysts Remain Bullish,https://www.investors.com/news/technology/insmed-stock-insmed-earnings-q1-2026/?src=A00220&yptr=yahoo
2026-05-07 20:05:35+00:00,WBD,IPO-Edge.com,IPO Edge Nasdaq Firesides Scheduled for June 1 & July 27,https://finance.yahoo.com/news/ipo-edge-nasdaq-firesides-scheduled-211235888.html
2026-05-07 20:10:00+00:00,MNST,GlobeNewswire,Monster Beverage Reports 2026 First Quarter Financial Results,https://finance.yahoo.com/markets/stocks/articles/monster-beverage-reports-2026-first-201000369.html
2026-05-07 20:13:49+00:00,GILD,StockStory,Gilead Sciences’s (NASDAQ:GILD) Q1 CY2026: Beats On Revenue,https://finance.yahoo.com/sectors/healthcare/articles/gilead-sciences-nasdaq-gild-q1-201349979.html
2026-05-07 20:14:03+00:00,PYPL,Simply Wall St.,FCA Probe Tests PayPal’s UK Wallet Economics And Growth Narrative,https://finance.yahoo.com/economy/policy/articles/fca-probe-tests-paypal-uk-201403343.html
2026-05-07 20:15:00+00:00,MCHP,GlobeNewswire,Microchip Technology Announces Quarterly Cash Dividend on Common Stock of 45.5 Cents Per Share,https://finance.yahoo.com/markets/stocks/articles/microchip-technology-announces-quarterly-cash-201500167.html
2026-05-07 20:15:00+00:00,KLAC,PR Newswire,KLA Corporation Announces Ten-to-One Stock Split and Quarterly Cash Dividend Payment,https://finance.yahoo.com/markets/stocks/articles/kla-corporation-announces-ten-one-201500799.html
2026-05-07 20:15:00+00:00,MCHP,GlobeNewswire,Microchip Technology Announces Financial Results for Fourth Quarter and Fiscal Year 2026,https://finance.yahoo.com/markets/stocks/articles/microchip-technology-announces-financial-results-201500966.html
2026-05-07 20:41:12+00:00,MCHP,Reuters,Microchip Tech forecasts quarterly revenue above estimates on strong chip demand,https://finance.yahoo.com/sectors/technology/articles/microchip-tech-forecasts-quarterly-revenue-204112346.html
2026-05-07 20:43:16+00:00,PEP,Moby,"Celsius Holdings, Inc. Q1 2026 Earnings Call Summary",https://finance.yahoo.com/markets/stocks/articles/celsius-holdings-inc-q1-2026-204316752.html
2026-05-07 20:50:37+00:00,SBUX,Yahoo Finance Video,Fast food chains brace for wary consumers,https://finance.yahoo.com/video/fast-food-chains-brace-for-wary-consumers-205037862.html
2026-05-07 20:50:37+00:00,KHC,Yahoo Finance Video,Fast food chains brace for wary consumers,https://finance.yahoo.com/video/fast-food-chains-brace-for-wary-consumers-205037862.html
2026-05-07 20:51:00+00:00,ARM,Barrons.com,"These Stocks Are Today’s Movers: IonQ, Arm, Datadog, Fortinet, Nvidia, Whirlpool, Planet Fitness, Fastly, and More",https://www.barrons.com/articles/stock-movers-4a18446f?siteid=yhoof2&yptr=yahoo
2026-05-07 20:51:00+00:00,FTNT,Barrons.com,"These Stocks Are Today’s Movers: IonQ, Arm, Datadog, Fortinet, Nvidia, Whirlpool, Planet Fitness, Fastly, and More",https://www.barrons.com/articles/stock-movers-4a18446f?siteid=yhoof2&yptr=yahoo
2026-05-07 20:51:13+00:00,MCHP,Investor's Business Daily,"Microchip Technology Stock Jumps On Quarterly Beat, Rosy Outlook",https://www.investors.com/news/technology/mchp-stock-microchip-technology-q4-2026-earnings/?src=A00220&yptr=yahoo
2026-05-07 20:58:04+00:00,MCHP,StockStory,"Microchip Technology (NASDAQ:MCHP) Beats Expectations in Strong Q1, Inventory Levels Improve",https://finance.yahoo.com/markets/stocks/articles/microchip-technology-nasdaq-mchp-beats-205804082.html
2026-05-07 20:58:25+00:00,INSM,Moby,Insmed Incorporated Q1 2026 Earnings Call Summary,https://finance.yahoo.com/sectors/healthcare/articles/insmed-incorporated-q1-2026-earnings-205825110.html
2026-05-07 20:58:37+00:00,GILD,MarketBeat,Galapagos Q1 Earnings Call Highlights,https://finance.yahoo.com/sectors/healthcare/articles/galapagos-q1-earnings-call-highlights-205837168.html
2026-05-07 21:00:56+00:00,BKNG,Investor's Business Daily,"Expedia Stock Falls, Airbnb Wavers After Q1 Results. Here's How The Travel Sites Fared.",https://www.investors.com/news/technology/airbnb-stock-expedia-stock-q1-travel-earnings-2026/?src=A00220&yptr=yahoo
2026-05-07 21:07:31+00:00,FER,Investing.com,Ferrovial rises after Q1 earnings beat on toll roads strength,https://finance.yahoo.com/markets/stocks/articles/frerrovial-posts-strong-q1-growth-210731672.html
2026-05-07 21:13:27+00:00,ADP,MT Newswires,"S&P 500, Nasdaq Snap 2-Day Record Run as Oil Prices Rise in Volatile Session",https://finance.yahoo.com/markets/stocks/articles/p-500-nasdaq-snap-2-211327416.html
2026-05-07 21:15:02+00:00,GILD,Zacks,Gilead Sciences (GILD) Tops Q1 Earnings and Revenue Estimates,https://finance.yahoo.com/sectors/healthcare/articles/gilead-sciences-gild-tops-q1-211502049.html
2026-05-07 21:21:43+00:00,STX,Simply Wall St.,Seagate (STX) Is Up 22.2% After Strong Q3 Results And AI Storage Push Has The Bull Case Changed?,https://finance.yahoo.com/markets/stocks/articles/seagate-stx-22-2-strong-212143174.html
2026-05-07 21:25:03+00:00,MNST,Zacks,Monster Beverage (MNST) Surpasses Q1 Earnings and Revenue Estimates,https://finance.yahoo.com/markets/stocks/articles/monster-beverage-mnst-surpasses-q1-212503489.html
2026-05-07 21:30:00+00:00,WDAY,PR Newswire,Pharma Just Got Its Workday Moment: Doceree's Daily Command Defines a New $30 Billion Software Category,https://finance.yahoo.com/sectors/healthcare/articles/pharma-just-got-workday-moment-213000217.html
2026-05-07 21:32:00+00:00,MELI,Business Wire,Mercado Libre Kicks Off 2026 with Fastest Revenue Growth in Almost Four Years as Strategic Investments Drive Market Share Gains,https://finance.yahoo.com/markets/stocks/articles/mercado-libre-kicks-off-2026-213200130.html
2026-05-07 21:36:26+00:00,ABNB,StockStory,Airbnb (NASDAQ:ABNB) Surprises With Q1 CY2026 Sales,https://finance.yahoo.com/markets/stocks/articles/airbnb-nasdaq-abnb-surprises-q1-213626630.html
2026-05-07 21:46:03+00:00,MELI,StockStory,MercadoLibre (NASDAQ:MELI) Exceeds Q1 CY2026 Expectations But Stock Drops,https://finance.yahoo.com/markets/stocks/articles/mercadolibre-nasdaq-meli-exceeds-q1-214603294.html
2026-05-07 21:47:00+00:00,MCHP,TheStreet,Morgan Stanley raises price targets across semiconductor sector,https://finance.yahoo.com/markets/stocks/articles/morgan-stanley-raises-price-targets-214700120.html
2026-05-07 21:47:08+00:00,ARM,Motley Fool,"Stock Market Today, May 7: Rally Falters as Oil Prices Rise Again",https://finance.yahoo.com/markets/stocks/articles/stock-market-today-may-7-214708507.html
2026-05-07 21:55:06+00:00,ADI,Zacks,Microchip Technology (MCHP) Q4 Earnings and Revenues Surpass Estimates,https://finance.yahoo.com/markets/stocks/articles/microchip-technology-mchp-q4-earnings-215506879.html
2026-05-07 21:55:06+00:00,MCHP,Zacks,Microchip Technology (MCHP) Q4 Earnings and Revenues Surpass Estimates,https://finance.yahoo.com/markets/stocks/articles/microchip-technology-mchp-q4-earnings-215506879.html
2026-05-07 21:55:06+00:00,MELI,Zacks,MercadoLibre (MELI) Lags Q1 Earnings Estimates,https://finance.yahoo.com/markets/stocks/articles/mercadolibre-meli-lags-q1-earnings-215506607.html
2026-05-07 22:00:01+00:00,ROST,Zacks,Ross Stores (ROST) Declines More Than Market: Some Information for Investors,https://finance.yahoo.com/markets/stocks/articles/ross-stores-rost-declines-more-220001740.html
2026-05-07 22:00:02+00:00,GILD,Zacks,Gilead (GILD) Q1 Earnings: Taking a Look at Key Metrics Versus Estimates,https://finance.yahoo.com/sectors/healthcare/articles/gilead-gild-q1-earnings-taking-220002562.html
2026-05-07 22:03:20+00:00,ASML,Reuters,Exclusive-SK Hynix flooded with unprecedented offers from big tech firms to secure chip supplies,https://finance.yahoo.com/sectors/technology/articles/exclusive-sk-hynix-flooded-unprecedented-220320399.html
2026-05-07 22:15:01+00:00,CPRT,Zacks,"Copart, Inc. (CPRT) Gains As Market Dips: What You Should Know",https://finance.yahoo.com/markets/stocks/articles/copart-inc-cprt-gains-market-221501879.html
2026-05-07 22:19:00+00:00,FER,PR Newswire,Ferrovial kicks off 2026 with robust operating results,https://finance.yahoo.com/markets/stocks/articles/ferrovial-kicks-off-2026-robust-221900168.html
2026-05-07 22:19:42+00:00,MNST,StockStory,"Monster (NASDAQ:MNST) Beats Expectations in Strong Q1 CY2026, Stock Soars",https://finance.yahoo.com/markets/stocks/articles/monster-nasdaq-mnst-beats-expectations-221942018.html
2026-05-07 22:26:49+00:00,ARM,Reuters Videos,Wall Street ends lower as chip stocks give up gains,https://finance.yahoo.com/video/wall-street-ends-lower-chip-222649552.html
2026-05-07 22:29:33+00:00,ABNB,Investing.com,Airbnb misses profit estimates despite revenue beat,https://finance.yahoo.com/markets/stocks/articles/airbnb-misses-profit-estimates-despite-222933870.html
2026-05-07 22:30:04+00:00,MELI,Zacks,MercadoLibre (MELI) Q1 Earnings: Taking a Look at Key Metrics Versus Estimates,https://finance.yahoo.com/markets/stocks/articles/mercadolibre-meli-q1-earnings-taking-223004400.html
2026-05-07 22:31:14+00:00,ASML,Benzinga,ASML CEO Says Jensen Huang 'Totally Right' On Exporting Products With An Eight-Generation Gap— Denies Top Chip Access To China,https://finance.yahoo.com/sectors/technology/articles/asml-ceo-says-jensen-huang-223114497.html
2026-05-07 22:33:38+00:00,MELI,Investing.com,MercadoLibre falls 7% as earnings miss overshadows revenue beat,https://finance.yahoo.com/markets/stocks/articles/mercadolibre-falls-7-earnings-miss-223338890.html
2026-05-07 22:39:02+00:00,ABNB,MarketBeat,Airbnb Q1 Earnings Call Highlights,https://finance.yahoo.com/markets/stocks/articles/airbnb-q1-earnings-call-highlights-223902972.html
2026-05-07 22:39:03+00:00,SHOP,MarketBeat,Affirm Q3 Earnings Call Highlights,https://finance.yahoo.com/markets/stocks/articles/affirm-q3-earnings-call-highlights-223903037.html
2026-05-07 22:49:20+00:00,WBD,24/7 Wall St.,Ted Turner Watched CNN Go From “World Peace Through Hard News” to “Dumbed Down” Infotainment. Warner Bros. Discovery Shareholders Are Now Funding the Decline.,https://finance.yahoo.com/markets/stocks/articles/ted-turner-watched-cnn-world-224920148.html
2026-05-07 23:02:53+00:00,MCHP,Motley Fool,Microchip (MCHP) Q4 2026 Earnings Transcript,https://finance.yahoo.com/markets/stocks/articles/microchip-mchp-q4-2026-earnings-230253424.html
2026-05-07 23:05:06+00:00,WDAY,Zacks,Power Integrations (POWI) Q1 Earnings and Revenues Top Estimates,https://finance.yahoo.com/markets/stocks/articles/power-integrations-powi-q1-earnings-230506253.html
2026-05-07 23:05:27+00:00,ADSK,Zacks,"Inseego (INSG) Reports Q1 Loss, Lags Revenue Estimates",https://finance.yahoo.com/markets/stocks/articles/inseego-insg-reports-q1-loss-230527285.html
2026-05-07 23:05:27+00:00,TTWO,Zacks,DraftKings (DKNG) Q1 Earnings Lag Estimates,https://finance.yahoo.com/markets/stocks/articles/draftkings-dkng-q1-earnings-lag-230527757.html
2026-05-07 23:18:55+00:00,MRVL,Simply Wall St.,POET Technologies (POET) Is Up 34.6% After Marvell Cancels Orders And Lawsuits Mount - What's Changed,https://finance.yahoo.com/markets/stocks/articles/poet-technologies-poet-34-6-231855327.html
