timestamp,ticker,source,text,url
2025-08-20 11:12:18+00:00,ADI,StockStory,"Analog Devices (NASDAQ:ADI) Beats Expectations in Strong Q2, Provides Optimistic Revenue Guidance for Next Quarter",https://finance.yahoo.com/news/analog-devices-nasdaq-adi-beats-111218116.html
2025-08-20 11:30:00+00:00,AMAT,ACCESS Newswire,"Lightwave Logic, Inc. Announces Appointment of Dr. Sundar Ramamurthy to Technical Advisory Board",https://finance.yahoo.com/news/lightwave-logic-inc-announces-appointment-113000041.html
2025-08-20 11:30:00+00:00,AMGN,GlobeNewswire,Cytokinetics Names Jim Daly to Board of Directors,https://finance.yahoo.com/news/cytokinetics-names-jim-daly-board-113000718.html
2025-08-20 11:30:02+00:00,AZN,Barchart,The Quantum Computing Race Is On: These 2 Stocks Appear Poised to Lead,https://finance.yahoo.com/news/quantum-computing-race-2-stocks-113002339.html
2025-08-20 11:32:40+00:00,COST,WWD,Change in Command: Target Names Michael Fiddelke Its Next CEO,https://finance.yahoo.com/news/change-command-target-names-michael-113240901.html
2025-08-20 11:37:20+00:00,ASML,Simply Wall St.,AI Chips Update - Metasurface Tech Revolutionizes Biometrics With Metalenz Innovations,https://finance.yahoo.com/news/ai-chips-metasurface-tech-revolutionizes-113720134.html
2025-08-20 11:40:00+00:00,PYPL,Zacks,3 Crypto-Centric Stocks to Grab Before the Next Bitcoin Rally,https://finance.yahoo.com/news/3-crypto-centric-stocks-grab-114000019.html
2025-08-20 11:41:22+00:00,ROST,Reuters,TJX raises annual profit forecast on strong demand for off-price goods,https://finance.yahoo.com/news/tjx-raises-annual-profit-forecast-114122760.html
2025-08-20 11:45:28+00:00,ADI,Investing.com,"Analog Devices jumps as Q3 results, guidance top expectations",https://finance.yahoo.com/news/analog-devices-jumps-q3-results-114528584.html
2025-08-20 11:46:04+00:00,MSTR,Benzinga,Tom Lee's $5 Billion Ethereum Bet Puts Bitcoin Maximalists On Notice,https://finance.yahoo.com/news/tom-lees-5-billion-ethereum-114604680.html
2025-08-20 11:49:00+00:00,SHOP,Motley Fool,Should You Buy Shopify Stock After Its Post-Earnings Pop?,https://finance.yahoo.com/news/buy-shopify-stock-post-earnings-114900554.html
2025-08-20 11:52:58+00:00,MSTR,CoinDesk,How Two Bitcoiners 'Tripped' Into Opaque BTC Treasuries Market and Built Massive Information Hub,https://finance.yahoo.com/news/two-bitcoiners-tripped-opaque-btc-115258600.html
2025-08-20 11:53:59+00:00,MSTR,Financial Times,US tech stocks hit by concerns over future of AI boom,https://finance.yahoo.com/news/us-tech-stocks-hit-concerns-013856176.html
2025-08-20 11:59:44+00:00,ADI,Reuters,Analog Devices forecasts upbeat results on strong industrial demand,https://finance.yahoo.com/news/analog-devices-forecasts-upbeat-results-115944091.html
2025-08-20 12:00:00+00:00,GILD,Business Wire,BTS and clients recognized with 59 Brandon Hall Group Excellence Awards in 2025,https://finance.yahoo.com/news/bts-clients-recognized-59-brandon-120000318.html
2025-08-20 12:00:00+00:00,CRWD,GlobeNewswire,Zscaler and CrowdStrike Expand Partnership to Strengthen AI-Driven Security Operations,https://finance.yahoo.com/news/zscaler-crowdstrike-expand-partnership-strengthen-120000174.html
2025-08-20 12:00:00+00:00,MELI,Business Wire,BTS and clients recognized with 59 Brandon Hall Group Excellence Awards in 2025,https://finance.yahoo.com/news/bts-clients-recognized-59-brandon-120000318.html
2025-08-20 12:00:00+00:00,ISRG,Business Wire,BTS and clients recognized with 59 Brandon Hall Group Excellence Awards in 2025,https://finance.yahoo.com/news/bts-clients-recognized-59-brandon-120000318.html
2025-08-20 12:00:00+00:00,CDW,Business Wire,CDW to Participate in the Citi 2025 Global TMT Conference,https://finance.yahoo.com/news/cdw-participate-citi-2025-global-120000545.html
2025-08-20 12:00:00+00:00,INTU,Business Wire,New Report from Intuit Mailchimp Outlines Strategies for the Expanded Holiday Shopping Cycle,https://finance.yahoo.com/news/report-intuit-mailchimp-outlines-strategies-120000126.html
2025-08-20 12:00:00+00:00,ZS,GlobeNewswire,Zscaler and CrowdStrike Expand Partnership to Strengthen AI-Driven Security Operations,https://finance.yahoo.com/news/zscaler-crowdstrike-expand-partnership-strengthen-120000174.html
2025-08-20 12:00:14+00:00,SBUX,Simply Wall St.,Is Starbucks Corporation (NASDAQ:SBUX) Expensive For A Reason? A Look At Its Intrinsic Value,https://finance.yahoo.com/news/starbucks-corporation-nasdaq-sbux-expensive-120014199.html
2025-08-20 12:00:26+00:00,CDNS,Simply Wall St.,Investing in Cadence Design Systems (NASDAQ:CDNS) five years ago would have delivered you a 212% gain,https://finance.yahoo.com/news/investing-cadence-design-systems-nasdaq-120026086.html
2025-08-20 12:00:34+00:00,EXC,Simply Wall St.,Exelon Corporation (NASDAQ:EXC) is largely controlled by institutional shareholders who own 87% of the company,https://finance.yahoo.com/news/exelon-corporation-nasdaq-exc-largely-120034765.html
2025-08-20 12:10:00+00:00,HON,PR Newswire,HONEYWELL ACQUIRES SPARKMETER'S DATA PLATFORM AND SOFTWARE TECHNOLOGIES TO STRENGTHEN ITS PORTFOLIO OF UTILITY SOLUTIONS,https://finance.yahoo.com/news/honeywell-acquires-sparkmeters-data-platform-121000448.html
2025-08-20 12:14:37+00:00,MU,Investor's Business Daily,"Dow Jones Futures: Palantir, Oracle, Other Growth Leaders Keep Falling; What To Do Now",https://www.investors.com/market-trend/stock-market-today/dow-jones-futures-palantir-oracle-amd-growth-sell-off/?src=A00220&yptr=yahoo
2025-08-20 12:14:37+00:00,APP,Investor's Business Daily,"Dow Jones Futures: Palantir, Oracle, Other Growth Leaders Keep Falling; What To Do Now",https://www.investors.com/market-trend/stock-market-today/dow-jones-futures-palantir-oracle-amd-growth-sell-off/?src=A00220&yptr=yahoo
2025-08-20 12:15:01+00:00,ADI,Zacks,Analog Devices (ADI) Beats Q3 Earnings and Revenue Estimates,https://finance.yahoo.com/news/analog-devices-adi-beats-q3-121501068.html
2025-08-20 12:18:32+00:00,TTD,Insider Monkey,Does The Trade Desk (TTD) Have a Substantial Runway For Future Growth?,https://finance.yahoo.com/news/does-trade-desk-ttd-substantial-121832424.html
2025-08-20 12:18:46+00:00,AVGO,GuruFocus.com,NVDA: Nvidia Gets Price Target Raised to $235 Ahead of Earnings,https://finance.yahoo.com/news/nvda-nvidia-gets-price-target-121846018.html
2025-08-20 12:19:56+00:00,BKNG,Schaeffer's Investment Research,Consumer Strength Signal Flashing Short-Term Caution Sign,https://finance.yahoo.com/news/consumer-strength-signal-flashing-short-121956952.html
2025-08-20 12:19:56+00:00,COST,Schaeffer's Investment Research,Consumer Strength Signal Flashing Short-Term Caution Sign,https://finance.yahoo.com/news/consumer-strength-signal-flashing-short-121956952.html
2025-08-20 12:21:15+00:00,AVGO,Insider Monkey,Mix of Bullish Forces Boosted Broadcom (AVGO) in Q2,https://finance.yahoo.com/news/mix-bullish-forces-boosted-broadcom-122115322.html
2025-08-20 12:32:55+00:00,ADI,Benzinga,"Analog Devices Eyes Solid Finish To 2025 Fueled By Strong Industrial, Auto Sales",https://finance.yahoo.com/news/analog-devices-eyes-solid-finish-123255387.html
2025-08-20 12:34:00+00:00,PLTR,Yahoo Finance Video,"Palantir, James Hardie, Labubu: Trending Stocks",https://finance.yahoo.com/video/palantir-james-hardie-labubu-trending-123400521.html
2025-08-20 12:34:00+00:00,CEG,Zacks,A Nuclear Showdown: OKLO's Bold Vision vs. CEG's Proven Power,https://finance.yahoo.com/news/nuclear-showdown-oklos-bold-vision-123400144.html
2025-08-20 12:39:00+00:00,SBUX,Zacks,Robinhood Markets and Goodyear Tire have been highlighted as Zacks Bull and Bear of the Day,https://finance.yahoo.com/news/robinhood-markets-goodyear-tire-highlighted-123900914.html
2025-08-20 12:40:00+00:00,ORLY,Motley Fool,"If You Buy O'Reilly Automotive With $10,000 in 2025, Will You Become a Millionaire in 10 Years?",https://finance.yahoo.com/news/buy-oreilly-automotive-10-000-124000837.html
2025-08-20 12:42:00+00:00,TSLA,PR Newswire,Silent Thunder 2025: Gas vs. Electric Motorsports Showdown Comes to Atlanta,https://finance.yahoo.com/news/silent-thunder-2025-gas-vs-124200481.html
2025-08-20 12:44:00+00:00,PCAR,PR Newswire,G2 Diesel Products Launches Direct-to-Consumer Sales of Premium Remanufactured Diesel Injectors,https://finance.yahoo.com/news/g2-diesel-products-launches-direct-124400201.html
2025-08-20 12:50:09+00:00,ON,reddit.com/r/stocks,"Think I’m gonna sell half of my SOXX for some BATT - Brand new to this, have been lurking here and keeping up with yahoo finance, chatgpt, friends who know more than me, etc. I have very very little in anything rn, just hoping to contribute $5k each year (insert laugh track), really just trying to learn and hoping for my money to grow. Portfolio is roughly: 60% FXAIX 25% SOXX 5% ASML 5% GOOGL",
2025-08-20 12:50:09+00:00,AAPL,reddit.com/r/stocks,"Think I’m gonna sell half of my SOXX for some BATT - Brand new to this, have been lurking here and keeping up with yahoo finance, chatgpt, friends who know more than me, etc. I have very very little in anything rn, just hoping to contribute $5k each year (insert laugh track), really just trying to learn and hoping for my money to grow. Portfolio is roughly: 60% FXAIX 25% SOXX 5% ASML 5% GOOGL",
2025-08-20 12:50:09+00:00,GOOGL,reddit.com/r/stocks,"Think I’m gonna sell half of my SOXX for some BATT - Brand new to this, have been lurking here and keeping up with yahoo finance, chatgpt, friends who know more than me, etc. I have very very little in anything rn, just hoping to contribute $5k each year (insert laugh track), really just trying to learn and hoping for my money to grow. Portfolio is roughly: 60% FXAIX 25% SOXX 5% ASML 5% GOOGL",
2025-08-20 12:50:09+00:00,ASML,reddit.com/r/stocks,"Think I’m gonna sell half of my SOXX for some BATT - Brand new to this, have been lurking here and keeping up with yahoo finance, chatgpt, friends who know more than me, etc. I have very very little in anything rn, just hoping to contribute $5k each year (insert laugh track), really just trying to learn and hoping for my money to grow. Portfolio is roughly: 60% FXAIX 25% SOXX 5% ASML 5% GOOGL",
2025-08-20 12:55:00+00:00,COST,Barrons.com,Target Stock Tumbles. Why a CEO Change Is Overshadowing an Earnings Beat.,https://www.barrons.com/articles/target-stock-price-earnings-ceo-stepping-down-52498bc0?siteid=yhoof2&yptr=yahoo
2025-08-20 13:00:00+00:00,FTNT,GlobeNewswire,Fortinet Connects Tepper Sports & Entertainment Teams with Unified SASE Solution,https://finance.yahoo.com/news/fortinet-connects-tepper-sports-entertainment-130000245.html
2025-08-20 13:00:00+00:00,ORLY,Business Wire,O’Reilly to Host Second AI Codecon on Coding for the Agentic World,https://finance.yahoo.com/news/o-reilly-host-second-ai-130000881.html
2025-08-20 13:00:00+00:00,FTNT,ACCESS Newswire,"Exclusive Networks North America Strengthens its Services Business, Adding Justin Crotty as VP of Services and GM of Cloudrise",https://finance.yahoo.com/news/exclusive-networks-north-america-strengthens-130000183.html
2025-08-20 13:00:00+00:00,HON,PR Newswire,HONEYWELL ANNOUNCES PARTICIPATION AT UPCOMING INVESTOR CONFERENCES,https://finance.yahoo.com/news/honeywell-announces-participation-upcoming-investor-130000864.html
2025-08-20 13:00:00+00:00,WBD,PR Newswire,Warner Bros. Discovery Announces Conference Participation for the Month of September,https://finance.yahoo.com/news/warner-bros-discovery-announces-conference-130000678.html
2025-08-20 13:00:00+00:00,LULU,PR Newswire,It's a 10 Haircare Appoints Ulta Beauty Veteran Ashley Schauer as Vice President of Sales & Marketing to Accelerate Retail & Professional Distribution Growth,https://finance.yahoo.com/news/10-haircare-appoints-ulta-beauty-130000340.html
2025-08-20 13:00:03+00:00,SNPS,Zacks,"Investors Heavily Search Synopsys, Inc. (SNPS): Here is What You Need to Know",https://finance.yahoo.com/news/investors-heavily-search-synopsys-inc-130003696.html
2025-08-20 13:00:05+00:00,ASML,Zacks,Is Trending Stock ASML Holding N.V. (ASML) a Buy Now?,https://finance.yahoo.com/news/trending-stock-asml-holding-n-130005139.html
2025-08-20 13:00:05+00:00,AXON,Zacks,"Axon Enterprise, Inc (AXON) Is a Trending Stock: Facts to Know Before Betting on It",https://finance.yahoo.com/news/axon-enterprise-inc-axon-trending-130005365.html
2025-08-20 13:00:17+00:00,BKR,Simply Wall St.,Is Baker Hughes Company (NASDAQ:BKR) Trading At A 27% Discount?,https://finance.yahoo.com/news/baker-hughes-company-nasdaq-bkr-130017605.html
2025-08-20 13:02:00+00:00,PEP,Business Wire,LRN Corporation Wins Seven Brandon Hall Group Awards,https://finance.yahoo.com/news/lrn-corporation-wins-seven-brandon-130200244.html
2025-08-20 13:04:00+00:00,MU,Zacks,Micron Trades Near 52-Week High: Is the Stock Still Worth Buying?,https://finance.yahoo.com/news/micron-trades-near-52-week-130400619.html
2025-08-20 13:04:00+00:00,AVGO,Zacks,Micron Trades Near 52-Week High: Is the Stock Still Worth Buying?,https://finance.yahoo.com/news/micron-trades-near-52-week-130400619.html
2025-08-20 13:08:16+00:00,AMZN,Yahoo Finance,Hertz stock jumps on deal to sell its used cars on Amazon,https://finance.yahoo.com/news/hertz-stock-jumps-on-deal-to-sell-its-used-cars-on-amazon-130816260.html
2025-08-20 13:14:42+00:00,ON,reddit.com/r/stocks,"Is $ORR a good ETF? - Hey fellow investors, I'm considering a small allocation to the ORR Militia Long/Short Equity ETF ($ORR) as a way to get some active long/short exposure without the day-to-day stress of running my own hedges. Most of my stock portfolio is buy-and-hold, so this would be a satellite position rather than a core holding. My quick take: • Performance looks decent on a risk-adjusted basis (from what I can see",
2025-08-20 13:20:00+00:00,CSCO,ACCESS Newswire,Cisco - Sustainability 101: What Is Clean Energy?,https://finance.yahoo.com/news/cisco-sustainability-101-clean-energy-132000759.html
2025-08-20 13:20:00+00:00,PANW,Zacks,"Company News for Aug 20, 2025",https://finance.yahoo.com/news/company-news-aug-20-2025-132000197.html
2025-08-20 13:20:04+00:00,MSTR,Insider Monkey,Polen Global Growth Strategy Reestablished a Position in Starbucks (SBUX). Here’s Why,https://finance.yahoo.com/news/polen-global-growth-strategy-reestablished-132004540.html
2025-08-20 13:20:04+00:00,SBUX,Insider Monkey,Polen Global Growth Strategy Reestablished a Position in Starbucks (SBUX). Here’s Why,https://finance.yahoo.com/news/polen-global-growth-strategy-reestablished-132004540.html
2025-08-20 13:22:09+00:00,MSTR,Insider Monkey,Polen Global Growth Sold Globant (GLOB) Due to Weak Performance and Poor Guidance,https://finance.yahoo.com/news/polen-global-growth-sold-globant-132209231.html
2025-08-20 13:30:00+00:00,COST,Business Wire,Mountaingate Capital Partners with Podean and Commerce Canal to Form the Largest Independent Global Marketplace Focused Agency,https://finance.yahoo.com/news/mountaingate-capital-partners-podean-commerce-133000298.html
2025-08-20 13:30:00+00:00,MELI,Business Wire,Mountaingate Capital Partners with Podean and Commerce Canal to Form the Largest Independent Global Marketplace Focused Agency,https://finance.yahoo.com/news/mountaingate-capital-partners-podean-commerce-133000298.html
2025-08-20 13:30:02+00:00,ADI,Zacks,Analog Devices (ADI) Reports Q3 Earnings: What Key Metrics Have to Say,https://finance.yahoo.com/news/analog-devices-adi-reports-q3-133002559.html
2025-08-20 13:34:37+00:00,ROP,The Fly,"Nu double upgraded, Novavax downgraded: Wall Street's top analyst calls",https://finance.yahoo.com/news/nu-double-upgraded-novavax-downgraded-133437292.html
2025-08-20 13:40:02+00:00,NFLX,Zacks,This Top Consumer Discretionary Stock is a #1 (Strong Buy): Why It Should Be on Your Radar,https://finance.yahoo.com/news/top-consumer-discretionary-stock-1-134002724.html
2025-08-20 13:40:02+00:00,MU,Zacks,How to Find Strong Buy Computer and Technology Stocks Using the Zacks Rank,https://finance.yahoo.com/news/strong-buy-computer-technology-stocks-134002271.html
2025-08-20 13:45:02+00:00,LRCX,Zacks,Why Lam Research (LRCX) is a Top Growth Stock for the Long-Term,https://finance.yahoo.com/news/why-lam-research-lrcx-top-134502420.html
2025-08-20 13:45:56+00:00,TSLA,Barchart,Stock Market Warning: This Magnificent 7 Red Flag Could Signal an S&P Rollover,https://finance.yahoo.com/news/stock-market-warning-magnificent-7-134556061.html
2025-08-20 13:46:04+00:00,ABNB,Benzinga,"Airbnb Investors Once Counted Easy Profits. Now One Says, 'Last Year, It Paid For Itself And Made Us $8k—This Year We're $6k In The Hole'",https://finance.yahoo.com/news/airbnb-investors-once-counted-easy-134604252.html
2025-08-20 13:50:02+00:00,AZN,Zacks,Are You a Momentum Investor? This 1 Stock Could Be the Perfect Pick,https://finance.yahoo.com/news/momentum-investor-1-stock-could-135002518.html
2025-08-20 13:56:48+00:00,NVDA,Yahoo Finance Video,Nvidia earnings: What one analyst is watching for in the guidance,https://finance.yahoo.com/video/nvidia-earnings-one-analyst-watching-135648845.html
2025-08-20 13:56:59+00:00,MSFT,Yahoo Finance Video,Tech sell-off: Big Tech will 'win when it counts',https://finance.yahoo.com/video/tech-sell-off-big-tech-135659692.html
2025-08-20 13:56:59+00:00,GOOGL,Yahoo Finance Video,Tech sell-off: Big Tech will 'win when it counts',https://finance.yahoo.com/video/tech-sell-off-big-tech-135659692.html
2025-08-20 13:56:59+00:00,AAPL,Yahoo Finance Video,Tech sell-off: Big Tech will 'win when it counts',https://finance.yahoo.com/video/tech-sell-off-big-tech-135659692.html
2025-08-20 13:56:59+00:00,GOOG,Yahoo Finance Video,Tech sell-off: Big Tech will 'win when it counts',https://finance.yahoo.com/video/tech-sell-off-big-tech-135659692.html
2025-08-20 13:56:59+00:00,AMZN,Yahoo Finance Video,Tech sell-off: Big Tech will 'win when it counts',https://finance.yahoo.com/video/tech-sell-off-big-tech-135659692.html
2025-08-20 13:59:31+00:00,AMD,Yahoo Finance Video,Trump admin weighs stake in Intel & other chipmakers: Reuters,https://finance.yahoo.com/video/trump-admin-weighs-stake-intel-135931191.html
2025-08-20 13:59:31+00:00,INTC,Yahoo Finance Video,Trump admin weighs stake in Intel & other chipmakers: Reuters,https://finance.yahoo.com/video/trump-admin-weighs-stake-intel-135931191.html
2025-08-20 14:00:00+00:00,AVGO,PR Newswire,Vectara Selected by Broadcom to Provide Agentic Conversational AI Customer Service Solution to Support Enterprise Clients,https://finance.yahoo.com/news/vectara-selected-broadcom-agentic-conversational-140000059.html
2025-08-20 14:00:31+00:00,MDLZ,Simply Wall St.,Does Mondelez International (NASDAQ:MDLZ) Have A Healthy Balance Sheet?,https://finance.yahoo.com/news/does-mondelez-international-nasdaq-mdlz-140031189.html
2025-08-20 14:01:55+00:00,ARM,Barchart,Tech Weakness and Negative Corporate News Weigh on Stocks,https://finance.yahoo.com/news/tech-weakness-negative-corporate-news-140155233.html
2025-08-20 14:01:55+00:00,TSLA,Barchart,Tech Weakness and Negative Corporate News Weigh on Stocks,https://finance.yahoo.com/news/tech-weakness-negative-corporate-news-140155233.html
2025-08-20 14:01:55+00:00,AMAT,Barchart,Tech Weakness and Negative Corporate News Weigh on Stocks,https://finance.yahoo.com/news/tech-weakness-negative-corporate-news-140155233.html
2025-08-20 14:01:55+00:00,MRVL,Barchart,Tech Weakness and Negative Corporate News Weigh on Stocks,https://finance.yahoo.com/news/tech-weakness-negative-corporate-news-140155233.html
2025-08-20 14:01:55+00:00,ADI,Barchart,Tech Weakness and Negative Corporate News Weigh on Stocks,https://finance.yahoo.com/news/tech-weakness-negative-corporate-news-140155233.html
2025-08-20 14:01:55+00:00,AVGO,Barchart,Tech Weakness and Negative Corporate News Weigh on Stocks,https://finance.yahoo.com/news/tech-weakness-negative-corporate-news-140155233.html
2025-08-20 14:01:55+00:00,MU,Barchart,Tech Weakness and Negative Corporate News Weigh on Stocks,https://finance.yahoo.com/news/tech-weakness-negative-corporate-news-140155233.html
2025-08-20 14:04:50+00:00,QCOM,Reuters,"Trump buys more than $100 million in bonds since inauguration, disclosure shows",https://finance.yahoo.com/news/trump-buys-more-100-million-140450170.html
2025-08-20 14:10:00+00:00,HON,Zacks,Honeywell's Industrial Automation Unit Hit by Weak Sales: Recovery Ahead?,https://finance.yahoo.com/news/honeywells-industrial-automation-unit-hit-141000324.html
2025-08-20 14:11:12+00:00,MU,Barrons.com,Tech Selling Picks Up Again. Nasdaq Slides for Second Straight Day.,https://www.barrons.com/livecoverage/stock-market-news-today-082025/card/tech-selling-picks-up-again-nasdaq-slides-for-second-straight-day--t1a8EPp964Utgm3aHcty?siteid=yhoof2&yptr=yahoo
2025-08-20 14:17:00+00:00,AMD,PR Newswire,Somite.ai Announces Strategic Investment from AMD Ventures to Accelerate Foundation Models for Cell Therapy,https://finance.yahoo.com/news/somite-ai-announces-strategic-investment-141700843.html
2025-08-20 14:25:00+00:00,QCOM,Business Wire,Form 8.3 - Aqua Acquisition Sub LLC (subsidiary of Qualcomm Incorporated),https://finance.yahoo.com/news/form-8-3-aqua-acquisition-142500772.html
2025-08-20 14:26:00+00:00,AMD,Barrons.com,Trump’s Push for Intel Stake Raises Concerns for Tech Stocks,https://www.barrons.com/articles/trump-intel-stake-tech-stocks-655dc2f6?siteid=yhoof2&yptr=yahoo
2025-08-20 14:30:06+00:00,ADI,TheStreet,Stock Market Today: Nasdaq and S&P dive on AI bubble jitters,https://finance.yahoo.com/news/stock-market-today-targets-man-143006553.html
2025-08-20 14:30:18+00:00,AMD,Associated Press Finance,BC-Most Active Stocks,https://finance.yahoo.com/news/bc-most-active-stocks-143018859.html
2025-08-20 14:30:18+00:00,TSLA,Associated Press Finance,BC-Most Active Stocks,https://finance.yahoo.com/news/bc-most-active-stocks-143018859.html
2025-08-20 14:37:08+00:00,ON,reddit.com/r/stocks,"Breaking! Hertz partners with Amazon Auto | turnaround play? - Hertz this morning just announced a partnership with Amazon Auto. the stock was up as high as 17.5% this morning. Amazon just recently launch Amazon auto, and on a first glance they only sell Hyundai cars at the moment. that list is now growing to include Hertz. Amazon doesn't offer an insurance option at the moment, and so insurance options seem to be diverted to",
2025-08-20 14:37:08+00:00,COST,reddit.com/r/stocks,"Breaking! Hertz partners with Amazon Auto | turnaround play? - Hertz this morning just announced a partnership with Amazon Auto. the stock was up as high as 17.5% this morning. Amazon just recently launch Amazon auto, and on a first glance they only sell Hyundai cars at the moment. that list is now growing to include Hertz. Amazon doesn't offer an insurance option at the moment, and so insurance options seem to be diverted to",
2025-08-20 14:39:32+00:00,ADI,Yahoo Finance Video,"Analog Devices earnings, Guess going private, La-Z-Boy results",https://finance.yahoo.com/video/analog-devices-earnings-guess-going-143932137.html
2025-08-20 14:42:00+00:00,CRWD,Zacks,CrowdStrike Expands Into Agentic AI Security: Will it Fuel Growth?,https://finance.yahoo.com/news/crowdstrike-expands-agentic-ai-security-144200524.html
2025-08-20 14:43:00+00:00,TSLA,Motley Fool,Think It's Too Late to Buy Rivian? Here's the No. 1 Reason Why There's Still Time.,https://finance.yahoo.com/news/think-too-buy-rivian-heres-144300852.html
2025-08-20 14:47:25+00:00,NVDA,Yahoo Finance,Why Target's new CEO won't have a honeymoon period: Opening Bid top takeaway,https://finance.yahoo.com/news/why-targets-new-ceo-wont-have-a-honeymoon-period-opening-bid-top-takeaway-144725734.html
2025-08-20 14:47:25+00:00,PEP,Yahoo Finance,Why Target's new CEO won't have a honeymoon period: Opening Bid top takeaway,https://finance.yahoo.com/news/why-targets-new-ceo-wont-have-a-honeymoon-period-opening-bid-top-takeaway-144725734.html
2025-08-20 14:56:44+00:00,MU,Motley Fool,Why Micron Stock Got Clobbered Today,https://finance.yahoo.com/news/why-micron-stock-got-clobbered-145644638.html
2025-08-20 14:56:57+00:00,PAYX,MT Newswires,"Paychex Fiscal Q1 Earnings Expected To Top Forecasts, RBC Says",https://finance.yahoo.com/news/paychex-fiscal-q1-earnings-expected-145657730.html
2025-08-20 15:00:00+00:00,CHTR,PR Newswire,SPECTRUM MOBILE LAUNCHES REPAIR AND REPLACEMENT PREMIUM,https://finance.yahoo.com/news/spectrum-mobile-launches-repair-replacement-150000706.html
2025-08-20 15:00:00+00:00,DXCM,PR Newswire,"Signos Unveils First Ever FDA-Cleared Glucose Monitoring Breakthrough for Weight Management, Enabling Millions of Americans to Take Control of Their Health",https://finance.yahoo.com/news/signos-unveils-first-ever-fda-150000736.html
2025-08-20 15:01:10+00:00,ON,reddit.com/r/stocks,"Trump is pressuring yet another top Fed official to resign - https://www.cnn.com/2025/08/20/economy/trump-pushes-for-fed-governor-lisa-cook-resignation > President Donald Trump on Wednesday called on a top policymaker at the Federal Reserve to resign, after one of his allies alleged that she committed mortgage fraud. In a letter dated August 15, Federal Housing Finance Agency director Bill Pulte urged the Justice Department to investigate a pair of mortgages taken out in recent years by Fed Governor Lisa Cook. On Wednesday,",
2025-08-20 15:04:00+00:00,ADI,Zacks,"Analog Devices Q3 Earnings Beat Estimates, Revenues Rise Y/Y",https://finance.yahoo.com/news/analog-devices-q3-earnings-beat-150400548.html
2025-08-20 15:04:45+00:00,ADI,Motley Fool,Analog Devices (ADI) Q3 2025 Earnings Transcript,https://finance.yahoo.com/news/analog-devices-adi-q3-2025-150445384.html
2025-08-20 15:07:28+00:00,AMZN,Yahoo Finance,Why this is a must-watch in Nvidia's earnings report,https://finance.yahoo.com/news/why-this-is-a-must-watch-in-nvidias-earnings-report-150728435.html
2025-08-20 15:07:28+00:00,GOOGL,Yahoo Finance,Why this is a must-watch in Nvidia's earnings report,https://finance.yahoo.com/news/why-this-is-a-must-watch-in-nvidias-earnings-report-150728435.html
