timestamp,ticker,source,text,url
2025-08-19 13:45:13+00:00,EA,TipRanks,Oppenheimer hikes estimate for Electronic Arts’ BF6 open beta player base,https://finance.yahoo.com/news/oppenheimer-hikes-estimate-electronic-arts-134513452.html
2025-08-19 13:47:07+00:00,ON,reddit.com/r/stocks,"What do you think of the current market valuation? - There have been some stocks that I was interested in but where ever I look I see a big dip that happened in April and then most stocks have skyrocketed. These are mostly known stocks such as NBIS, ASTS, RKLB, OKLO, SMR and so on... Thats why I think its time to just wait for an another dip to happen. There are also others like",
2025-08-19 13:49:52+00:00,APP,Investor's Business Daily,"Analysts Boost Profit Estimates On E-Commerce Giant, App Design Name. Both Stocks Are In Buy Zones.",https://www.investors.com/research/ecommerce-platform-sea-limited-stock-se-applovin-app/?src=A00220&yptr=yahoo
2025-08-19 13:50:11+00:00,ON,reddit.com/r/stocks,Everything is going down in my portfolio. - Whats going on today? I guess I could read some news... but i was wondering if anyone could just tell me whats going on? Just about everything I own had a huge dip around the same time with high volume. They know something is coming..,
2025-08-19 13:51:43+00:00,SBUX,Bloomberg,Starbucks Will Give All Salaried Workers the Same 2% Raise,https://finance.yahoo.com/news/starbucks-salaried-workers-2-raises-183135877.html
2025-08-19 14:00:00+00:00,CMCSA,Business Wire,"Comcast Supports American Small Business Growth, Awarding 500 Grant Packages to Entrepreneurs in Five Regions",https://finance.yahoo.com/news/comcast-supports-american-small-business-140000517.html
2025-08-19 14:00:00+00:00,CSCO,ACCESS Newswire,Striving for Sustainability at Cisco: Meet Nicole,https://finance.yahoo.com/news/striving-sustainability-cisco-meet-nicole-140000120.html
2025-08-19 14:00:11+00:00,HON,Simply Wall St.,Estimating The Fair Value Of Honeywell International Inc. (NASDAQ:HON),https://finance.yahoo.com/news/estimating-fair-value-honeywell-international-140011889.html
2025-08-19 14:03:06+00:00,ZS,Barchart,Stocks Slightly Lower as Retailer Earnings Arrive,https://finance.yahoo.com/news/stocks-slightly-lower-retailer-earnings-140306937.html
2025-08-19 14:03:06+00:00,CRWD,Barchart,Stocks Slightly Lower as Retailer Earnings Arrive,https://finance.yahoo.com/news/stocks-slightly-lower-retailer-earnings-140306937.html
2025-08-19 14:05:00+00:00,CMCSA,PR Newswire,"Comcast Supports American Small Business Growth Awarding 100 Grant Packages to Entrepreneurs in Nashville, TN",https://finance.yahoo.com/news/comcast-supports-american-small-business-140500779.html
2025-08-19 14:05:00+00:00,CMCSA,PR Newswire,Comcast Supports American Small Business Growth Awarding 100 Grant Packages to Entrepreneurs in Grand Rapids & Muskegon,https://finance.yahoo.com/news/comcast-supports-american-small-business-140500889.html
2025-08-19 14:07:00+00:00,PYPL,Zacks,"AFRM Trades at Premium: Too Much Affirm-ation, or Still Time to Buy?",https://finance.yahoo.com/news/afrm-trades-premium-too-much-140700864.html
2025-08-19 14:12:27+00:00,FTNT,reddit.com/r/stocks,"Can anyone give me some good advice on PANW? - Sharing my thoughts on PANW and looking for feedback. Security spending seems resilient, and AI risks could push demand higher. Subscriptions seem to help ARR and cash flow, and cross-selling boosts customer value. PANW’s edge seems to be integration and full coverage compared to CRWD, ZS, and FTNT. I’m keeping an eye on ARR growth, product penetration, margins, and free cash flow. Are there any",
2025-08-19 14:12:27+00:00,PANW,reddit.com/r/stocks,"Can anyone give me some good advice on PANW? - Sharing my thoughts on PANW and looking for feedback. Security spending seems resilient, and AI risks could push demand higher. Subscriptions seem to help ARR and cash flow, and cross-selling boosts customer value. PANW’s edge seems to be integration and full coverage compared to CRWD, ZS, and FTNT. I’m keeping an eye on ARR growth, product penetration, margins, and free cash flow. Are there any",
2025-08-19 14:12:27+00:00,ON,reddit.com/r/stocks,"Can anyone give me some good advice on PANW? - Sharing my thoughts on PANW and looking for feedback. Security spending seems resilient, and AI risks could push demand higher. Subscriptions seem to help ARR and cash flow, and cross-selling boosts customer value. PANW’s edge seems to be integration and full coverage compared to CRWD, ZS, and FTNT. I’m keeping an eye on ARR growth, product penetration, margins, and free cash flow. Are there any",
2025-08-19 14:12:27+00:00,CRWD,reddit.com/r/stocks,"Can anyone give me some good advice on PANW? - Sharing my thoughts on PANW and looking for feedback. Security spending seems resilient, and AI risks could push demand higher. Subscriptions seem to help ARR and cash flow, and cross-selling boosts customer value. PANW’s edge seems to be integration and full coverage compared to CRWD, ZS, and FTNT. I’m keeping an eye on ARR growth, product penetration, margins, and free cash flow. Are there any",
2025-08-19 14:12:27+00:00,ZS,reddit.com/r/stocks,"Can anyone give me some good advice on PANW? - Sharing my thoughts on PANW and looking for feedback. Security spending seems resilient, and AI risks could push demand higher. Subscriptions seem to help ARR and cash flow, and cross-selling boosts customer value. PANW’s edge seems to be integration and full coverage compared to CRWD, ZS, and FTNT. I’m keeping an eye on ARR growth, product penetration, margins, and free cash flow. Are there any",
2025-08-19 14:13:00+00:00,CRWD,Barrons.com,Palo Alto Stock Jumps. Why It Can Dominate Cybersecurity.,https://www.barrons.com/articles/palo-alto-networks-stock-price-cybersecurity-stocks-2341760c?siteid=yhoof2&yptr=yahoo
2025-08-19 14:29:03+00:00,SBUX,Bloomberg,US Roasters Shun Coffee From Brazil After 50% Tariffs Kick In,https://finance.yahoo.com/news/us-roasters-shun-coffee-brazil-142903098.html
2025-08-19 14:29:33+00:00,ON,reddit.com/r/stocks,"Thoughts on Rivian heading in 2026 - Rivian has been inching towards profitability posing two quarters of gross profit and securing investments in VW to give them runway in terms of cash. They still have some headwinds but their strategy seems solid. Some people may have noticed that Rivian showrooms are being set up a few steps away from Tesla showrooms. Additionally, in their recent earnings call Rivian announced later this year they were supposed",
2025-08-19 14:35:00+00:00,SBUX,Zacks,Will New Beverage Innovation Revive Starbucks' U.S. Comparable Sales?,https://finance.yahoo.com/news/beverage-innovation-revive-starbucks-u-143500636.html
2025-08-19 14:38:00+00:00,ARM,Barrons.com,Intel Stock Soars After SoftBank’s $2 Billion Investment. Why It’s About More than Money.,https://www.barrons.com/articles/intel-stock-price-softbank-investment-71f2c1fd?siteid=yhoof2&yptr=yahoo
2025-08-19 14:40:05+00:00,PANW,Yahoo Finance Video,"Palo Alto, Viking Holdings, Viking Therapeutics: Trending Tickers",https://finance.yahoo.com/video/palo-alto-viking-holdings-viking-144005399.html
2025-08-19 14:42:53+00:00,ADBE,Yahoo Finance Video,AI models are 'not a recipe' for high equity returns: Strategist,https://finance.yahoo.com/video/ai-models-not-recipe-high-144253314.html
2025-08-19 14:47:00+00:00,COST,Zacks,Costco vs. Walmart: Which Retail Stock Should You Buy Now?,https://finance.yahoo.com/news/costco-vs-walmart-retail-stock-144700279.html
2025-08-19 14:50:00+00:00,CMCSA,ACCESS Newswire,"Comcast Supports American Small Business Growth, Awarding 100 Grant Packages to Entrepreneurs in Salt Lake",https://finance.yahoo.com/news/comcast-supports-american-small-business-145000782.html
2025-08-19 14:54:00+00:00,PANW,Zacks,Palo Alto Networks Q4 Earnings and Revenues Surpass Estimates,https://finance.yahoo.com/news/palo-alto-networks-q4-earnings-145400894.html
2025-08-19 15:00:00+00:00,CMCSA,ACCESS Newswire,"Comcast Supports American Small Business Growth, Awarding 100 Grant Packages to Entrepreneurs in King County",https://finance.yahoo.com/news/comcast-supports-american-small-business-150000791.html
2025-08-19 15:04:00+00:00,GFS,Zacks,TSM's Overseas Fabrication Push Ramps Up: Are Margins Sustainable?,https://finance.yahoo.com/news/tsms-overseas-fabrication-push-ramps-150400351.html
2025-08-19 15:05:00+00:00,QCOM,PR Newswire,"AI Infra Summit Brings Global AI Leaders to Santa Clara, Sept. 9-11",https://finance.yahoo.com/news/ai-infra-summit-brings-global-150500933.html
2025-08-19 15:10:19+00:00,CSCO,Fortune,Brooks CEO Dan Sheridan says the top job drives him ‘nuts’ 20% of the time—but one mindset mantra keeps him sane,https://finance.yahoo.com/news/ceo-warren-buffett-backed-venture-151019895.html
2025-08-19 15:18:03+00:00,ODFL,Barchart,Stocks Pressured by Weakness in Tech,https://finance.yahoo.com/news/stocks-pressured-weakness-tech-151803928.html
2025-08-19 15:18:03+00:00,QCOM,Barchart,Stocks Pressured by Weakness in Tech,https://finance.yahoo.com/news/stocks-pressured-weakness-tech-151803928.html
2025-08-19 15:18:03+00:00,CSX,Barchart,Stocks Pressured by Weakness in Tech,https://finance.yahoo.com/news/stocks-pressured-weakness-tech-151803928.html
2025-08-19 15:18:03+00:00,PANW,Barchart,Stocks Pressured by Weakness in Tech,https://finance.yahoo.com/news/stocks-pressured-weakness-tech-151803928.html
2025-08-19 15:18:03+00:00,ARM,Barchart,Stocks Pressured by Weakness in Tech,https://finance.yahoo.com/news/stocks-pressured-weakness-tech-151803928.html
2025-08-19 15:18:03+00:00,MRVL,Barchart,Stocks Pressured by Weakness in Tech,https://finance.yahoo.com/news/stocks-pressured-weakness-tech-151803928.html
2025-08-19 15:26:00+00:00,LRCX,Zacks,"AMAT Stock Trades at a P/E of 16.69X: Should You Buy, Sell or Hold?",https://finance.yahoo.com/news/amat-stock-trades-p-e-152600970.html
2025-08-19 15:26:00+00:00,KLAC,Zacks,"AMAT Stock Trades at a P/E of 16.69X: Should You Buy, Sell or Hold?",https://finance.yahoo.com/news/amat-stock-trades-p-e-152600970.html
2025-08-19 15:26:00+00:00,AMAT,Zacks,"AMAT Stock Trades at a P/E of 16.69X: Should You Buy, Sell or Hold?",https://finance.yahoo.com/news/amat-stock-trades-p-e-152600970.html
2025-08-19 15:26:00+00:00,ASML,Zacks,"AMAT Stock Trades at a P/E of 16.69X: Should You Buy, Sell or Hold?",https://finance.yahoo.com/news/amat-stock-trades-p-e-152600970.html
2025-08-19 15:30:00+00:00,CSCO,Zacks,Zoom Video Gears Up to Report Q2 Earnings: What's in the Cards?,https://finance.yahoo.com/news/zoom-video-gears-report-q2-153000593.html
2025-08-19 15:34:00+00:00,FTNT,Zacks,FTNT vs. QLYS: Which Cybersecurity Stock Deserves Your Investment?,https://finance.yahoo.com/news/ftnt-vs-qlys-cybersecurity-stock-153400647.html
2025-08-19 15:35:46+00:00,BKNG,Reuters,Booking.com parent in $9.5 million 'junk fee' settlement with Texas,https://finance.yahoo.com/news/booking-com-parent-enters-9-153546560.html
2025-08-19 15:36:00+00:00,PANW,Zacks,FTNT Rides on Strong Billings Trend: Will the Momentum Sustain?,https://finance.yahoo.com/news/ftnt-rides-strong-billings-trend-153600577.html
2025-08-19 15:36:00+00:00,FTNT,Zacks,FTNT Rides on Strong Billings Trend: Will the Momentum Sustain?,https://finance.yahoo.com/news/ftnt-rides-strong-billings-trend-153600577.html
2025-08-19 15:39:25+00:00,CSX,Reuters,"Exclusive-Toms Capital seeks CSX meeting after buying stake, sources say",https://finance.yahoo.com/news/exclusive-toms-capital-seeks-csx-153925479.html
2025-08-19 15:40:00+00:00,PYPL,Zacks,PayPal vs. Block: Which Fintech Stock Is the Better Buy Right Now?,https://finance.yahoo.com/news/paypal-vs-block-fintech-stock-154000622.html
2025-08-19 15:41:00+00:00,TXN,Zacks,TXN's Top Line Rebounds: Is Semiconductor Recovery the Catalyst?,https://finance.yahoo.com/news/txns-top-line-rebounds-semiconductor-154100082.html
2025-08-19 15:49:10+00:00,PANW,Investopedia,"Top Stock Movers Now: Intel, Palo Alto Networks, Nvidia, and More",https://finance.yahoo.com/news/top-stock-movers-now-intel-154910030.html
2025-08-19 15:55:25+00:00,PANW,Barchart,Palo Alto Networks Stock is a Favorite of Value Investors After Its Latest Results,https://finance.yahoo.com/news/palo-alto-networks-stock-favorite-155525857.html
2025-08-19 15:55:40+00:00,PANW,Bloomberg,Palo Alto Gains on Strong Results After Cyberark Deal,https://finance.yahoo.com/video/palo-alto-gains-strong-results-155540901.html
2025-08-19 15:57:01+00:00,COST,Barchart,"Dear Target Stock Fans, Mark Your Calendars for August 20",https://finance.yahoo.com/news/dear-target-stock-fans-mark-155701726.html
2025-08-19 16:00:00+00:00,TMUS,Business Wire,MCE Adds Ex-T-Mobile Executive Aleeta Willcuts to its Advisory Board to Help Redefine Telco Retail-Digital Customer Experience in U.S.,https://finance.yahoo.com/news/mce-adds-ex-t-mobile-160000426.html
2025-08-19 16:02:12+00:00,ON,reddit.com/r/stocks,"China's Pop Mart, maker of the Labubu doll, says profit soars nearly 400% in first half - [https://www.reuters.com/world/china/chinas-pop-mart-maker-labubu-doll-says-profit-soars-nearly-400-first-half-2025-08-19/](https://www.reuters.com/world/china/chinas-pop-mart-maker-labubu-doll-says-profit-soars-nearly-400-first-half-2025-08-19/) SHANGHAI, Aug 19 (Reuters) - China's Pop Mart [(9992.HK), opens new tab](https://www.reuters.com/markets/companies/9992.HK), which has taken the world by storm with its ugly-cute Labubu doll, reported a nearly 400% first-half net profit on Tuesday on high demand for the toys and a shift towards higher-margin overseas [markets.Net](http://markets.Net) profit of 396.5% and a 204.4% jump in revenues exceeded numbers",
2025-08-19 16:03:50+00:00,FANG,Reuters,"US oil and gas M&A activity quadrupled last year, report says",https://finance.yahoo.com/news/us-oil-gas-m-activity-160350271.html
2025-08-19 16:07:06+00:00,ON,reddit.com/r/stocks,"Commerce Secretary Lutnick says Intel has to give government equity in return for CHIPS Act funds - https://www.cnbc.com/2025/08/19/lutnick-intel-stock-chips-trump.html > Commerce Secretary Howard Lutnick said Tuesday that Intel must give the U.S. government an equity stake in the company in return for CHIPS Act funds. > > “We should get an equity stake for our money,” Lutnick said on CNBC’s “Squawk on the Street” Tuesday. “So we’ll deliver the money, which was already committed under the",
2025-08-19 16:07:06+00:00,INTC,reddit.com/r/stocks,"Commerce Secretary Lutnick says Intel has to give government equity in return for CHIPS Act funds - https://www.cnbc.com/2025/08/19/lutnick-intel-stock-chips-trump.html > Commerce Secretary Howard Lutnick said Tuesday that Intel must give the U.S. government an equity stake in the company in return for CHIPS Act funds. > > “We should get an equity stake for our money,” Lutnick said on CNBC’s “Squawk on the Street” Tuesday. “So we’ll deliver the money, which was already committed under the",
2025-08-19 16:07:18+00:00,SBUX,Nation's Restaurant News,"Starbucks gives 2% raises to all salaried employees, including store managers",https://finance.yahoo.com/news/starbucks-gives-2-raises-salaried-160718990.html
2025-08-19 16:11:01+00:00,ARM,Benzinga,What's Going On With AMD Stock Tuesday?,https://finance.yahoo.com/news/whats-going-amd-stock-tuesday-161108636.html
2025-08-19 16:17:53+00:00,NXPI,GuruFocus.com,"NVDA: Nvidia, Broadcom Lead as Citi Bets on More Upside in Chip Sector",https://finance.yahoo.com/news/nvda-nvidia-broadcom-lead-citi-161753224.html
2025-08-19 16:23:00+00:00,MSTR,Zacks,Strategy Falls 15% in a Month: Hold or Fold the MSTR Stock?,https://finance.yahoo.com/news/strategy-falls-15-month-hold-162300910.html
2025-08-19 16:30:00+00:00,CMCSA,ACCESS Newswire,Comcast Donates 200 New Backpacks Filled with Back to School Supplies to Spokane Youth at American Indian Community Center,https://finance.yahoo.com/news/comcast-donates-200-backpacks-filled-163000126.html
2025-08-19 16:35:00+00:00,WDAY,Zacks,Workday Set to Report Q2 Results: Will Revenue Growth Boost Earnings?,https://finance.yahoo.com/news/workday-set-report-q2-results-163500764.html
2025-08-19 16:45:00+00:00,MSTR,DLNews,Michael Saylor drops no dilution pledge less than one month later,https://finance.yahoo.com/news/michael-saylor-drops-no-dilution-164500472.html
2025-08-19 16:51:02+00:00,PANW,Motley Fool,Why Palo Alto Networks Stock Is Soaring Today,https://finance.yahoo.com/news/why-palo-alto-networks-stock-165102280.html
2025-08-19 16:51:13+00:00,CSCO,Insider Monkey,Cisco (CSCO) Price Target Lowered to $64 Despite Strong AI Narrative,https://finance.yahoo.com/news/cisco-csco-price-target-lowered-165113606.html
2025-08-19 16:58:29+00:00,META,reddit.com/r/stocks,"Meta is planning to downsize its AI division overall, in latest shake up - https://www.nytimes.com/2025/08/19/technology/mark-zuckerberg-meta-ai.html > > On Tuesday, Meta is expected to announce that it will split its A.I. division - which is known as Meta Superintelligence Labs - into four groups, two people with knowledge of the plans said. One will focus on A.I. research; one on a potentially powerful A.I. called “superintelligence”; another on products; and one on infrastructure such as data",
2025-08-19 16:58:29+00:00,ON,reddit.com/r/stocks,"Meta is planning to downsize its AI division overall, in latest shake up - https://www.nytimes.com/2025/08/19/technology/mark-zuckerberg-meta-ai.html > > On Tuesday, Meta is expected to announce that it will split its A.I. division - which is known as Meta Superintelligence Labs - into four groups, two people with knowledge of the plans said. One will focus on A.I. research; one on a potentially powerful A.I. called “superintelligence”; another on products; and one on infrastructure such as data",
2025-08-19 17:05:15+00:00,WBD,reddit.com/r/stocks,"Why is pretty much everything going down today? - I've been looking at the stock market today and pretty much everything is going down, mostly starting at the same time. HAG, PLTR, GOOG, RXRX, BA, RDDT, TSM, HOOD, MSTR, WBD, NVDA are just some of the stocks. Is there a specific reason for this?",
2025-08-19 17:05:15+00:00,PLTR,reddit.com/r/stocks,"Why is pretty much everything going down today? - I've been looking at the stock market today and pretty much everything is going down, mostly starting at the same time. HAG, PLTR, GOOG, RXRX, BA, RDDT, TSM, HOOD, MSTR, WBD, NVDA are just some of the stocks. Is there a specific reason for this?",
2025-08-19 17:05:15+00:00,NVDA,reddit.com/r/stocks,"Why is pretty much everything going down today? - I've been looking at the stock market today and pretty much everything is going down, mostly starting at the same time. HAG, PLTR, GOOG, RXRX, BA, RDDT, TSM, HOOD, MSTR, WBD, NVDA are just some of the stocks. Is there a specific reason for this?",
2025-08-19 17:05:15+00:00,MSTR,reddit.com/r/stocks,"Why is pretty much everything going down today? - I've been looking at the stock market today and pretty much everything is going down, mostly starting at the same time. HAG, PLTR, GOOG, RXRX, BA, RDDT, TSM, HOOD, MSTR, WBD, NVDA are just some of the stocks. Is there a specific reason for this?",
2025-08-19 17:05:15+00:00,GOOG,reddit.com/r/stocks,"Why is pretty much everything going down today? - I've been looking at the stock market today and pretty much everything is going down, mostly starting at the same time. HAG, PLTR, GOOG, RXRX, BA, RDDT, TSM, HOOD, MSTR, WBD, NVDA are just some of the stocks. Is there a specific reason for this?",
2025-08-19 17:09:37+00:00,CMCSA,Akron Beacon Journal,"Nexstar to buy Tegna, owner of Cleveland’s WKYC, in $3.54B deal to expand TV reach",https://finance.yahoo.com/news/nexstar-buy-tegna-owner-cleveland-170937096.html
2025-08-19 17:16:00+00:00,CSX,The Wall Street Journal,Activist Ancora Pressures Railroad Operator CSX to Explore Deal,https://www.wsj.com/business/deals/activist-ancora-pressures-railroad-operator-csx-to-explore-deal-51df0dda?siteid=yhoof2&yptr=yahoo
2025-08-19 17:18:31+00:00,MRVL,Simply Wall St.,Marvell Technology (MRVL) Expands Cloud Security With Microsoft Azure Collaboration,https://finance.yahoo.com/news/marvell-technology-mrvl-expands-cloud-171831900.html
2025-08-19 17:22:25+00:00,WDAY,Cybersecurity Dive,Hackers target Workday in social engineering attack,https://finance.yahoo.com/news/hackers-target-workday-social-engineering-172225314.html
2025-08-19 17:27:16+00:00,KHC,Simply Wall St.,Kraft Heinz (KHC) Expands With New Plant-Based Hot Dogs And Mayo Flavours,https://finance.yahoo.com/news/kraft-heinz-khc-expands-plant-172716443.html
2025-08-19 17:30:00+00:00,BKR,GlobeNewswire,"[Latest] Global Pipeline Safety Market Size/Share Worth USD 17.84 Billion by 2034 at a 8.97% CAGR: Custom Market Insights (Analysis, Outlook, Leaders, Report, Trends, Forecast, Segmentation, Growth Rate, Value, SWOT Analysis)",https://finance.yahoo.com/news/latest-global-pipeline-safety-market-173000668.html
2025-08-19 17:30:00+00:00,HON,GlobeNewswire,"[Latest] Global Pipeline Safety Market Size/Share Worth USD 17.84 Billion by 2034 at a 8.97% CAGR: Custom Market Insights (Analysis, Outlook, Leaders, Report, Trends, Forecast, Segmentation, Growth Rate, Value, SWOT Analysis)",https://finance.yahoo.com/news/latest-global-pipeline-safety-market-173000668.html
2025-08-19 17:31:05+00:00,PYPL,CoinDesk,Bullish's $1.15B in IPO Proceeds Was Entirely in Stablecoins—A First for Public Market,https://finance.yahoo.com/news/bullishs-1-15b-ipo-proceeds-173105171.html
2025-08-19 17:32:04+00:00,PAYX,Simply Wall St.,Top Dividend Stocks To Watch In August 2025,https://finance.yahoo.com/news/top-dividend-stocks-watch-august-173204635.html
2025-08-19 17:33:58+00:00,MSTR,Yahoo Finance,"Bitcoin could reach $200,000 within 6 months during 'long, exhausting' crypto bull market",https://finance.yahoo.com/news/bitcoin-could-reach-200000-within-6-months-during-long-exhausting-crypto-bull-market-173358527.html
2025-08-19 17:38:10+00:00,TTD,Simply Wall St.,August 2025's Top Three Stocks That May Be Priced Below Their Estimated Value,https://finance.yahoo.com/news/august-2025s-top-three-stocks-173810746.html
2025-08-19 17:38:16+00:00,WDAY,Simply Wall St.,High Growth US Tech Stocks To Watch In August 2025,https://finance.yahoo.com/news/high-growth-us-tech-stocks-173816004.html
2025-08-19 17:38:58+00:00,PANW,Simply Wall St.,Palo Alto Networks (PANW) Founder Retires As Revenue Climbs To US$9 Billion,https://finance.yahoo.com/news/palo-alto-networks-panw-founder-173858315.html
2025-08-19 17:40:00+00:00,DASH,Zacks,DASH's Total Orders Growth Momentum Continues: A Sign of More Upside?,https://finance.yahoo.com/news/dashs-total-orders-growth-momentum-174000354.html
2025-08-19 17:55:27+00:00,CSX,Investing.com,Activist Ancora reportedly pressuring CSX to explore a deal or fire CEO,https://finance.yahoo.com/news/activist-ancora-reportedly-pressuring-csx-175527655.html
2025-08-19 18:08:49+00:00,CSX,MT Newswires,Market Chatter: Activist Investor Ancora Pressures CSX to Pursue Merger,https://finance.yahoo.com/news/market-chatter-activist-investor-ancora-180849045.html
2025-08-19 18:15:00+00:00,CSX,Business Wire,Ancora Issues Letter to CSX’s Board of Directors Regarding the Need to Avert a Permanent Impairment of Value and Aggressively Pursue a Value-Maximizing Merger,https://finance.yahoo.com/news/ancora-issues-letter-csx-board-181500294.html
2025-08-19 18:16:55+00:00,INTU,Yahoo Finance,"Nvidia is the most underowned megacap stock, Morgan Stanley says",https://finance.yahoo.com/news/nvidia-is-the-most-underowned-megacap-stock-morgan-stanley-says-181655265.html
2025-08-19 18:31:23+00:00,CSX,FreightWaves,Activist investor urges CSX to engage in alternative merger discussions,https://finance.yahoo.com/news/activist-investor-urges-csx-engage-183123977.html
2025-08-19 18:35:32+00:00,MSTR,Barchart,This Cannabis Stock Just Transformed Into a Bitcoin Treasury Play. Should You Buy Shares Now?,https://finance.yahoo.com/news/cannabis-stock-just-transformed-bitcoin-183532907.html
2025-08-19 18:50:00+00:00,EXC,Business Wire,"18 Illinois Communities Receive a Total of $150,000 in Environmental Grants from ComEd, Openlands",https://finance.yahoo.com/news/18-illinois-communities-receive-total-185000741.html
2025-08-19 19:00:00+00:00,CMCSA,Business Wire,Comcast to Participate in BofA Securities Investor Conference,https://finance.yahoo.com/news/comcast-participate-bofa-securities-investor-190000243.html
2025-08-19 19:00:00+00:00,CMCSA,Business Wire,Comcast to Participate in Goldman Sachs Investor Conference,https://finance.yahoo.com/news/comcast-participate-goldman-sachs-investor-190000312.html
2025-08-19 19:00:00+00:00,CMCSA,Business Wire,Comcast to Participate in Citi Investor Conference,https://finance.yahoo.com/news/comcast-participate-citi-investor-conference-190000251.html
2025-08-19 19:05:22+00:00,ON,reddit.com/r/stocks,"AMC Q2 results: revenue up 36%, Wedbush issues first Buy rating since 2020 - AMC’s Q2 2025 earnings came in stronger than expected and show signs of a real turnaround. * Revenue climbed 36% year-over-year to **$1.4B** (AMC Entertainment Holdings) * Adjusted EBITDA hit **$189M**, nearly 4× last year * Free cash flow swung positive to **$88.9M** * Attendance grew 26% to **62.8M guests** * Record per-guest spending of **$22.26** (tickets + concessions) * Premium",
2025-08-19 19:18:37+00:00,PANW,Benzinga,"Palo Alto Stock Pops As Analysts Say Strong Growth, CyberArk Deal Could Power Next Leg Higher",https://finance.yahoo.com/news/palo-alto-stock-pops-analysts-191846251.html
2025-08-19 19:36:28+00:00,CSX,Reuters,Ancora urges CSX to pursue merger or replace CEO amid rail industry shakeup,https://finance.yahoo.com/news/ancora-urges-csx-pursue-merger-193628902.html
2025-08-19 19:41:10+00:00,BKNG,MT Newswires,Sector Update: Consumer Stocks Mixed in Late Afternoon Trading,https://finance.yahoo.com/news/sector-consumer-stocks-mixed-afternoon-194110225.html
