timestamp,ticker,source,text,url
2025-08-12 07:21:27+00:00,APP,StockStory,APP Q2 Deep Dive: Platform Expansion and Self-Service Strategy Drive Future Growth,https://finance.yahoo.com/news/app-q2-deep-dive-platform-072127530.html
2025-08-12 07:23:13+00:00,ABNB,StockStory,ABNB Q2 Deep Dive: Product Expansion and International Markets Shape Outlook,https://finance.yahoo.com/news/abnb-q2-deep-dive-product-072313330.html
2025-08-12 07:25:23+00:00,MNST,StockStory,"MNST Q2 Deep Dive: Global Growth, Innovation Pipeline, and Margin Expansion",https://finance.yahoo.com/news/mnst-q2-deep-dive-global-072523840.html
2025-08-12 07:26:30+00:00,MCHP,StockStory,MCHP Q2 Deep Dive: Inventory Correction and Demand Recovery Shape Results,https://finance.yahoo.com/news/mchp-q2-deep-dive-inventory-072630474.html
2025-08-12 07:28:24+00:00,DDOG,StockStory,"DDOG Q2 Deep Dive: AI Customer Growth, Product Expansion, and Guidance Raise",https://finance.yahoo.com/news/ddog-q2-deep-dive-ai-072824879.html
2025-08-12 07:29:18+00:00,GILD,StockStory,"GILD Q2 Deep Dive: HIV Franchise Drives Growth, New Launches and Pipeline in Focus",https://finance.yahoo.com/news/gild-q2-deep-dive-hiv-072918920.html
2025-08-12 07:30:00+00:00,DXCM,PR Newswire,ViCentra to Bring Smartphone-Based Closed Loop Therapy to People with Diabetes in Early 2026,https://finance.yahoo.com/news/vicentra-bring-smartphone-based-closed-073000331.html
2025-08-12 09:00:00+00:00,DDOG,Motley Fool,2 Growth Stocks to Buy With $200 and Hold Forever,https://finance.yahoo.com/news/2-growth-stocks-buy-200-090000288.html
2025-08-12 09:04:00+00:00,PEP,Motley Fool,Pepsi vs. Coke: Which Soda Stock Fizzes With Value?,https://finance.yahoo.com/news/pepsi-vs-coke-soda-stock-090400330.html
2025-08-12 10:00:21+00:00,WBD,Yahoo Finance,Media musical chairs are reshaping the sports landscape,https://finance.yahoo.com/news/media-musical-chairs-are-reshaping-the-sports-landscape-100021607.html
2025-08-12 10:18:56+00:00,KLAC,Simply Wall St.,KLA Corporation (NASDAQ:KLAC) Released Earnings Last Week And Analysts Lifted Their Price Target To US$929,https://finance.yahoo.com/news/kla-corporation-nasdaq-klac-released-101856874.html
2025-08-12 10:20:00+00:00,DXCM,The Wall Street Journal,Health Care Roundup: Market Talk,https://www.wsj.com/health/health-care-roundup-market-talk-db885d2e?siteid=yhoof2&yptr=yahoo
2025-08-12 10:30:00+00:00,NFLX,The Daily Upside,Ford Crosses into Fast Lane With $2 Billion Affordable EV Plan,https://finance.yahoo.com/news/ford-crosses-fast-lane-2-103000241.html
2025-08-12 10:36:12+00:00,REGN,Investing.com,Sanofi halts Praluent supply in China due to limited availability,https://finance.yahoo.com/news/sanofi-halts-praluent-supply-china-103612306.html
2025-08-12 10:38:50+00:00,BIIB,Clinical Trials Arena,First patient dosed in Phase III trial of zorevunersen for Dravet syndrome,https://finance.yahoo.com/news/first-patient-dosed-phase-iii-103850100.html
2025-08-12 10:46:00+00:00,DDOG,PR Newswire,Tradr Launches First-to-Market Leveraged ETFs on Datadog & Astera Labs,https://finance.yahoo.com/news/tradr-launches-first-market-leveraged-104600253.html
2025-08-12 10:50:42+00:00,VRTX,Simply Wall St.,Vertex Pharmaceuticals' (NASDAQ:VRTX) Earnings May Just Be The Starting Point,https://finance.yahoo.com/news/vertex-pharmaceuticals-nasdaq-vrtx-earnings-105042116.html
2025-08-12 10:53:59+00:00,CDNS,Associated Press Finance,Trump says Intel CEO has an 'amazing story' days after calling for his resignation,https://finance.yahoo.com/news/trump-says-intel-ceo-amazing-105359752.html
2025-08-12 11:00:00+00:00,MNST,Food Dive,Monster Energy executives aim to revitalize Thrifty Ice Cream,https://finance.yahoo.com/news/monster-energy-executives-aim-revitalize-110000329.html
2025-08-12 11:00:26+00:00,MDLZ,Simply Wall St.,Mondelez International (NASDAQ:MDLZ) investors are sitting on a loss of 10.0% if they invested a year ago,https://finance.yahoo.com/news/mondelez-international-nasdaq-mdlz-investors-110026317.html
2025-08-12 11:00:29+00:00,TXN,Simply Wall St.,"With 88% institutional ownership, Texas Instruments Incorporated (NASDAQ:TXN) is a favorite amongst the big guns",https://finance.yahoo.com/news/88-institutional-ownership-texas-instruments-110029125.html
2025-08-12 11:15:01+00:00,FTNT,Barchart,Fortinet Stock Is Plunging on Refresh Cycle Woes. Should You Buy the FTNT Dip?,https://finance.yahoo.com/news/fortinet-stock-plunging-refresh-cycle-111501563.html
2025-08-12 11:38:55+00:00,LIN,Barchart,Are Wall Street Analysts Predicting Linde Stock Will Climb or Sink?,https://finance.yahoo.com/news/wall-street-analysts-predicting-linde-113855907.html
2025-08-12 12:00:00+00:00,AZN,Business Wire,Eureka Therapeutics Appoints Dr. Reginald Seeto and William S. Solari III to Board of Directors,https://finance.yahoo.com/news/eureka-therapeutics-appoints-dr-reginald-120000618.html
2025-08-12 12:18:00+00:00,ISRG,Zacks,ISRG's Post-Earnings Slide: Margin Worries Overshadow Growth Story,https://finance.yahoo.com/news/isrgs-post-earnings-slide-margin-121800587.html
2025-08-12 12:26:00+00:00,GEHC,Zacks,Tutor Perini and Crocs have been highlighted as Zacks Bull and Bear of the Day,https://finance.yahoo.com/news/tutor-perini-crocs-highlighted-zacks-122600354.html
2025-08-12 12:30:03+00:00,IDXX,Zacks,Here's How Much a $1000 Investment in Idexx Laboratories Made 10 Years Ago Would Be Worth Today,https://finance.yahoo.com/news/heres-much-1000-investment-idexx-123003695.html
2025-08-12 12:32:48+00:00,ARM,GuruFocus.com,CoreWeave Stock Soars as JPMorgan Hikes Target Ahead of Earnings,https://finance.yahoo.com/news/coreweave-stock-soars-jpmorgan-hikes-123248144.html
2025-08-12 12:43:00+00:00,PCAR,Trucking Dive,Truck manufacturers sue CARB over zero-emission vehicle plan,https://finance.yahoo.com/news/truck-manufacturers-sue-carb-over-124300741.html
2025-08-12 12:48:00+00:00,BIIB,PR Newswire,"New .med Domain Names Surpass 40,000 Pre-Orders in July",https://finance.yahoo.com/news/med-domain-names-surpass-40-124800189.html
2025-08-12 13:00:00+00:00,FTNT,GlobeNewswire,Fortinet Enhances FortiRecon to Align with Continuous Threat Exposure Management (CTEM) Framework to Help Organizations Stay Ahead of Threats,https://finance.yahoo.com/news/fortinet-enhances-fortirecon-align-continuous-130000246.html
2025-08-12 13:00:00+00:00,SNPS,PR Newswire,Ansys Announces Agreement to Offer Access to NVIDIA Omniverse Technology from within Simulation Solutions,https://finance.yahoo.com/news/ansys-announces-agreement-offer-access-130000944.html
2025-08-12 13:00:03+00:00,DDOG,Zacks,"Datadog, Inc. (DDOG) is Attracting Investor Attention: Here is What You Should Know",https://finance.yahoo.com/news/datadog-inc-ddog-attracting-investor-130003213.html
2025-08-12 13:00:03+00:00,WBD,Zacks,"Here is What to Know Beyond Why Warner Bros. Discovery, Inc. (WBD) is a Trending Stock",https://finance.yahoo.com/news/know-beyond-why-warner-bros-130003465.html
2025-08-12 13:00:03+00:00,CDNS,Zacks,"Is Trending Stock Cadence Design Systems, Inc. (CDNS) a Buy Now?",https://finance.yahoo.com/news/trending-stock-cadence-design-systems-130003722.html
2025-08-12 13:00:19+00:00,BKR,Simply Wall St.,Baker Hughes (NASDAQ:BKR) shareholders have earned a 24% CAGR over the last five years,https://finance.yahoo.com/news/baker-hughes-nasdaq-bkr-shareholders-130019336.html
2025-08-12 13:00:24+00:00,KDP,Simply Wall St.,An Intrinsic Calculation For Keurig Dr Pepper Inc. (NASDAQ:KDP) Suggests It's 47% Undervalued,https://finance.yahoo.com/news/intrinsic-calculation-keurig-dr-pepper-130024502.html
2025-08-12 13:00:26+00:00,NFLX,Yahoo Finance,TKO delivers a 'knockout' with UFC and WWE deals as Wall Street sees more upside ahead,https://finance.yahoo.com/news/tko-delivers-a-knockout-with-ufc-and-wwe-deals-as-wall-street-sees-more-upside-ahead-130026007.html
2025-08-12 13:06:00+00:00,TTD,Zacks,TTD Stock Crashes Post Q2 Earnings: Stay Invested or Make an Exit?,https://finance.yahoo.com/news/ttd-stock-crashes-post-q2-130600375.html
2025-08-12 13:10:52+00:00,REGN,Insider Monkey,Guggenheim Lifts PT on Regeneron Pharmaceuticals (REGN) to $815 From $810,https://finance.yahoo.com/news/guggenheim-lifts-pt-regeneron-pharmaceuticals-131052393.html
2025-08-12 13:16:00+00:00,EA,PR Newswire,Madden NFL 26 Championship Series Competitions Return to Full Sail University Orlando Health Fortress for Second Consecutive Year,https://finance.yahoo.com/news/madden-nfl-26-championship-series-131600523.html
2025-08-12 13:18:13+00:00,NXPI,Barchart,NXP Semiconductors Stock: Analyst Estimates & Ratings,https://finance.yahoo.com/news/nxp-semiconductors-stock-analyst-estimates-131813296.html
2025-08-12 13:20:00+00:00,TMUS,Business Wire,T-Mobile Introduces New Revvl 8 Smartphone Packed with Power and Perks,https://finance.yahoo.com/news/t-mobile-introduces-revvl-8-132000460.html
2025-08-12 13:23:00+00:00,PEP,Business Wire,"Pickering Energy Partners Advises Heliogen, Inc. in Merger with Zeo Energy Corp.",https://finance.yahoo.com/news/pickering-energy-partners-advises-heliogen-132300467.html
2025-08-12 13:27:00+00:00,ADI,Zacks,Here's What Investors Should Expect From RADCOM's Q2 Earnings,https://finance.yahoo.com/news/heres-investors-expect-radcoms-q2-132700964.html
2025-08-12 13:30:00+00:00,NXPI,GlobeNewswire,"Supply Chain Security Market Surges to $5.14 Billion by 2030 - Led by IBM (US), Emerson (US), Oracle (US) | MarketsandMarkets™",https://finance.yahoo.com/news/supply-chain-security-market-surges-133000116.html
2025-08-12 13:30:04+00:00,ADI,Zacks,Is It Worth Investing in Analog Devices (ADI) Based on Wall Street's Bullish Views?,https://finance.yahoo.com/news/worth-investing-analog-devices-adi-133004958.html
2025-08-12 13:33:27+00:00,GEHC,Barchart,GE HealthCare Technologies Stock: Is Wall Street Bullish or Bearish?,https://finance.yahoo.com/news/ge-healthcare-technologies-stock-wall-133327172.html
2025-08-12 13:50:03+00:00,MNST,Zacks,Why Monster Beverage (MNST) is a Top Momentum Stock for the Long-Term,https://finance.yahoo.com/news/why-monster-beverage-mnst-top-135003002.html
2025-08-12 13:52:00+00:00,LRCX,Zacks,LRCX's ALD Moly Adoption Ramps Up: Will it be a Key Growth Driver?,https://finance.yahoo.com/news/lrcxs-ald-moly-adoption-ramps-135200466.html
2025-08-12 13:52:00+00:00,ASML,Zacks,LRCX's ALD Moly Adoption Ramps Up: Will it be a Key Growth Driver?,https://finance.yahoo.com/news/lrcxs-ald-moly-adoption-ramps-135200466.html
2025-08-12 13:53:00+00:00,CHTR,Barrons.com,Sinclair Stock Soars 16%. What’s Giving the TV Station Operator a Boost.,https://www.barrons.com/articles/sinclair-stock-price-news-21168172?siteid=yhoof2&yptr=yahoo
2025-08-12 13:54:00+00:00,LRCX,Zacks,LRCX vs. AMAT: Which Chip-Equipment Stock Is a Better Buy Right Now?,https://finance.yahoo.com/news/lrcx-vs-amat-chip-equipment-135400592.html
2025-08-12 13:59:39+00:00,CPRT,StockStory,1 Cash-Producing Stock Worth Your Attention and 2 We Find Risky,https://finance.yahoo.com/news/1-cash-producing-stock-worth-135939976.html
2025-08-12 14:00:00+00:00,MAR,GlobeNewswire,HHM Hotels Builds Out Senior Executive Team Hiring Jeremiah Galvin,https://finance.yahoo.com/news/hhm-hotels-builds-senior-executive-140000853.html
2025-08-12 14:00:17+00:00,FAST,Simply Wall St.,Fastenal Company's (NASDAQ:FAST) Stock Has Seen Strong Momentum: Does That Call For Deeper Study Of Its Financial Prospects?,https://finance.yahoo.com/news/fastenal-companys-nasdaq-fast-stock-140017006.html
2025-08-12 14:00:55+00:00,BKNG,StockStory,3 Market-Beating Stocks with Solid Fundamentals,https://finance.yahoo.com/news/3-market-beating-stocks-solid-140055560.html
2025-08-12 14:07:00+00:00,ASML,Zacks,ASML Aims 30% EUV Revenue Growth in FY25: Can it Hit the Target?,https://finance.yahoo.com/news/asml-aims-30-euv-revenue-140700034.html
2025-08-12 14:07:00+00:00,KLAC,Zacks,ASML Aims 30% EUV Revenue Growth in FY25: Can it Hit the Target?,https://finance.yahoo.com/news/asml-aims-30-euv-revenue-140700034.html
2025-08-12 14:34:04+00:00,MELI,GuruFocus.com,"Margins Are Falling, Yet Mercado Libre's Moat Keeps Growing",https://finance.yahoo.com/news/margins-falling-yet-mercado-libres-143404437.html
2025-08-12 14:40:34+00:00,CDNS,Motley Fool,President Trump Now Supports Intel CEO Lip-Bu Tan -- What It Means for Investors,https://finance.yahoo.com/news/president-trump-now-supports-intel-144034566.html
2025-08-12 14:44:00+00:00,ADSK,Zacks,4 GARP Stocks That Investors Can Scoop Up for Maximum Returns,https://finance.yahoo.com/news/4-garp-stocks-investors-scoop-144400144.html
2025-08-12 14:45:34+00:00,ASML,Barrons.com,"S&P 500, Nasdaq Back on Record Track",https://www.barrons.com/livecoverage/stock-market-news-today-081225/card/s-p-500-nasdaq-back-on-record-track-OExatSpN4ONrfHoHhVY1?siteid=yhoof2&yptr=yahoo
2025-08-12 14:45:34+00:00,TXN,Barrons.com,"S&P 500, Nasdaq Back on Record Track",https://www.barrons.com/livecoverage/stock-market-news-today-081225/card/s-p-500-nasdaq-back-on-record-track-OExatSpN4ONrfHoHhVY1?siteid=yhoof2&yptr=yahoo
2025-08-12 14:46:00+00:00,KHC,GlobeNewswire,"Saudi Arabia Frozen Vegetables Market Forecast and Competitive Analysis Report 2025-2033 Featuring Conagra Brands, Hormel Foods, Unilever, Kraft Heinz, Nomad Foods, B&G Foods, Greenyard",https://finance.yahoo.com/news/saudi-arabia-frozen-vegetables-market-144600374.html
2025-08-12 14:54:00+00:00,CMCSA,PR Newswire,"Comcast Brings High-Speed Internet and Lift Zone to Gordon County, Celebrates with Laptop Giveaway and Block Party",https://finance.yahoo.com/news/comcast-brings-high-speed-internet-145400252.html
2025-08-12 14:59:00+00:00,PEP,Zacks,PepsiCo Stock Shows Renewed Momentum: Buy the Rally or Step Back?,https://finance.yahoo.com/news/pepsico-stock-shows-renewed-momentum-145900353.html
2025-08-12 15:08:00+00:00,EA,GlobeNewswire,"Saudi Arabia Online Gaming Market Growth and Competitive Analysis Report 2025-2033 Featuring Activision Blizzard, Apple, Capcom, Electronic Arts, Microsoft, Nintendo, Sony, Tencent",https://finance.yahoo.com/news/saudi-arabia-online-gaming-market-150800549.html
2025-08-12 15:40:00+00:00,VRTX,Zacks,Can Rising Casgevy Sales Aid CRISPR Therapeutics Post Q2 Earnings?,https://finance.yahoo.com/news/rising-casgevy-sales-aid-crispr-154000554.html
2025-08-12 16:04:00+00:00,ADSK,Zacks,Cleanspark Share Price Dips 8% Despite Strong Q3 Earnings Growth,https://finance.yahoo.com/news/cleanspark-share-price-dips-8-160400073.html
2025-08-12 16:15:39+00:00,ODFL,StockStory,"Terex, Atkore, Wabash, Old Dominion Freight Line, and Alta Shares Skyrocket, What You Need To Know",https://finance.yahoo.com/news/terex-atkore-wabash-old-dominion-161539714.html
2025-08-12 16:17:00+00:00,ADSK,Zacks,"Nova Shares Jump 4% on Q2 Earnings Beat, Robust Q3 Guidance",https://finance.yahoo.com/news/nova-shares-jump-4-q2-161700753.html
2025-08-12 16:20:02+00:00,APP,Zacks,Earnings Estimates Rising for AppLovin (APP): Will It Gain?,https://finance.yahoo.com/news/earnings-estimates-rising-applovin-app-162002583.html
2025-08-12 16:30:00+00:00,NFLX,Zacks,Netflix's Content Strength Drives Engagement: What's the Path Forward?,https://finance.yahoo.com/news/netflixs-content-strength-drives-engagement-163000983.html
2025-08-12 16:45:02+00:00,APP,Zacks,AppLovin (APP) is an Incredible Growth Stock: 3 Reasons Why,https://finance.yahoo.com/news/applovin-app-incredible-growth-stock-164502034.html
2025-08-12 16:51:50+00:00,FAST,Barchart,Fastenal Stock: Is Wall Street Bullish or Bearish?,https://finance.yahoo.com/news/fastenal-stock-wall-street-bullish-165150293.html
2025-08-12 16:55:01+00:00,CMCSA,Verdict,US ISPs lean into cybersecurity as a VAS,https://finance.yahoo.com/news/us-isps-lean-cybersecurity-vas-165501755.html
2025-08-12 16:57:51+00:00,ZS,Investing.com,Corn futures tumble following WASDE report,https://finance.yahoo.com/news/corn-futures-tumble-following-wasde-165751385.html
2025-08-12 17:26:32+00:00,TMUS,Simply Wall St.,T-Mobile US (TMUS) Launches Feature-Packed Revvl 8 Smartphone With Exclusive Offers,https://finance.yahoo.com/news/t-mobile-us-tmus-launches-172632380.html
2025-08-12 17:53:14+00:00,BIIB,MT Newswires,Sector Update: Health Care Stocks Advance in Afternoon Trading,https://finance.yahoo.com/news/sector-health-care-stocks-advance-175314106.html
2025-08-12 17:57:07+00:00,LRCX,Investor's Business Daily,"Dow Jones Leader Cisco, Magnificent Seven Stock Alphabet In New Buy Zones",https://www.investors.com/stock-lists/stocks-near-a-buy-zone/dow-jones-cisco-csco-googl-stock/?src=A00220&yptr=yahoo
2025-08-12 17:57:07+00:00,MNST,Investor's Business Daily,"Dow Jones Leader Cisco, Magnificent Seven Stock Alphabet In New Buy Zones",https://www.investors.com/stock-lists/stocks-near-a-buy-zone/dow-jones-cisco-csco-googl-stock/?src=A00220&yptr=yahoo
2025-08-12 18:07:35+00:00,HON,Benzinga,Resideo Technologies Pops As Honeywell Indemnity Buyout Boosts Growth Story,https://finance.yahoo.com/news/resideo-technologies-pops-honeywell-indemnity-180735165.html
2025-08-12 18:11:10+00:00,CMCSA,StockStory,"Cushman & Wakefield, Comcast, and MGM Resorts Shares Are Soaring, What You Need To Know",https://finance.yahoo.com/news/cushman-wakefield-comcast-mgm-resorts-181110073.html
2025-08-12 18:20:53+00:00,REGN,StockStory,"Amphastar Pharmaceuticals, QuidelOrtho, Integra LifeSciences, Select Medical, and Regeneron Stocks Trade Up, What You Need To Know",https://finance.yahoo.com/news/amphastar-pharmaceuticals-quidelortho-integra-lifesciences-182053189.html
2025-08-12 18:25:44+00:00,TEAM,StockStory,"Palo Alto Networks, Rapid7, Monday.com, GitLab, and Atlassian Stocks Trade Up, What You Need To Know",https://finance.yahoo.com/news/palo-alto-networks-rapid7-monday-182544319.html
2025-08-12 18:33:49+00:00,ARM,Simply Wall St.,Arm Holdings' (NASDAQ:ARM) Promising Earnings May Rest On Soft Foundations,https://finance.yahoo.com/news/arm-holdings-nasdaq-arm-promising-183349027.html
2025-08-12 19:45:42+00:00,TXN,StockStory,Why Texas Instruments (TXN) Stock Is Up Today,https://finance.yahoo.com/news/why-texas-instruments-txn-stock-194542003.html
2025-08-12 19:46:13+00:00,HON,StockStory,Why Resideo (REZI) Stock Is Trading Up Today,https://finance.yahoo.com/news/why-resideo-rezi-stock-trading-194613331.html
2025-08-12 19:48:10+00:00,LRCX,Investor's Business Daily,These Are The 5 Best Stocks To Buy Now Or Watch,https://www.investors.com/research/best-stocks-to-buy-now/?src=A00220&yptr=yahoo
2025-08-12 19:50:52+00:00,MCHP,StockStory,"Magnachip, Intel, Microchip Technology, NXP Semiconductors, and onsemi Shares Skyrocket, What You Need To Know",https://finance.yahoo.com/news/magnachip-intel-microchip-technology-nxp-195052593.html
2025-08-12 19:50:52+00:00,NXPI,StockStory,"Magnachip, Intel, Microchip Technology, NXP Semiconductors, and onsemi Shares Skyrocket, What You Need To Know",https://finance.yahoo.com/news/magnachip-intel-microchip-technology-nxp-195052593.html
2025-08-12 19:50:52+00:00,ON,StockStory,"Magnachip, Intel, Microchip Technology, NXP Semiconductors, and onsemi Shares Skyrocket, What You Need To Know",https://finance.yahoo.com/news/magnachip-intel-microchip-technology-nxp-195052593.html
2025-08-12 19:51:05+00:00,LRCX,StockStory,"Entegris, IPG Photonics, Universal Display, Kulicke and Soffa, and Lam Research Shares Skyrocket, What You Need To Know",https://finance.yahoo.com/news/entegris-ipg-photonics-universal-display-195105522.html
2025-08-12 19:51:06+00:00,ADI,StockStory,"Analog Devices, Monolithic Power Systems, MACOM, Qualcomm, and Photronics Shares Skyrocket, What You Need To Know",https://finance.yahoo.com/news/analog-devices-monolithic-power-systems-195106827.html
2025-08-12 19:53:51+00:00,BIIB,MT Newswires,Sector Update: Health Care Stocks Rise Late Afternoon,https://finance.yahoo.com/news/sector-health-care-stocks-rise-195351191.html
2025-08-12 20:00:05+00:00,LRCX,Investor's Business Daily,"Breakout Watch: Nvidia, Broadcom In Focus, But Don't Forget This Semiconductor Stock",https://www.investors.com/research/how-to-find-the-best-stocks-to-buy/lam-research-lrcx-joins-nvidia-broadcom-among-new-buys-best-mutual-funds/?src=A00220&yptr=yahoo
2025-08-12 20:00:05+00:00,KLAC,Investor's Business Daily,"Breakout Watch: Nvidia, Broadcom In Focus, But Don't Forget This Semiconductor Stock",https://www.investors.com/research/how-to-find-the-best-stocks-to-buy/lam-research-lrcx-joins-nvidia-broadcom-among-new-buys-best-mutual-funds/?src=A00220&yptr=yahoo
2025-08-12 20:05:00+00:00,GFS,PR Newswire,QuickLogic Reports Fiscal Second Quarter 2025 Financial Results,https://finance.yahoo.com/news/quicklogic-reports-fiscal-second-quarter-200500586.html
2025-08-12 20:06:18+00:00,CEG,Investor's Business Daily,Nuclear Play Oklo Reported Another Quarterly Loss But Analysts Are Still Bullish,https://www.investors.com/news/nuclear-play-oklo-q2-earnings-trump-ai-stock-market/?src=A00220&yptr=yahoo
2025-08-12 20:09:17+00:00,NFLX,Yahoo Finance,Big Tech is driving the stock market to new records,https://finance.yahoo.com/news/big-tech-is-driving-the-stock-market-to-new-records-200917939.html
2025-08-12 20:12:44+00:00,EA,Investor's Business Daily,EA Stock Hits Record High On Buzz For New Video Game,https://www.investors.com/news/technology/ea-stock-record-high-buzz-battlefield-6-game/?src=A00220&yptr=yahoo
2025-08-12 20:50:00+00:00,NXPI,GlobeNewswire,NXP Semiconductors Announces Pricing of Senior Unsecured Notes Offering,https://finance.yahoo.com/news/nxp-semiconductors-announces-pricing-senior-205000416.html
2025-08-12 21:27:21+00:00,PCAR,FreightWaves,‘Impossible position’ cited by truck manufacturers in lawsuit against California,https://finance.yahoo.com/news/impossible-position-cited-truck-manufacturers-212721848.html
2025-08-12 21:30:00+00:00,ADSK,PR Newswire,"Autodesk launches freemium access to Autodesk Flow Studio, with new pricing tiers making world-class VFX AI more affordable to all creators",https://finance.yahoo.com/news/autodesk-launches-freemium-access-autodesk-213000301.html
2025-08-12 21:30:02+00:00,MRVL,Zacks,"Pixelworks (PXLW) Reports Q2 Loss, Misses Revenue Estimates",https://finance.yahoo.com/news/pixelworks-pxlw-reports-q2-loss-213002045.html
2025-08-12 21:45:02+00:00,SNPS,Zacks,Synopsys (SNPS) Beats Stock Market Upswing: What Investors Need to Know,https://finance.yahoo.com/news/synopsys-snps-beats-stock-market-214502983.html
2025-08-12 21:45:03+00:00,CRWD,Zacks,Why CrowdStrike Holdings (CRWD) Outpaced the Stock Market Today,https://finance.yahoo.com/news/why-crowdstrike-holdings-crwd-outpaced-214503512.html
2025-08-12 22:00:02+00:00,ROST,Zacks,Ross Stores (ROST) Rises But Trails Market: What Investors Should Know,https://finance.yahoo.com/news/ross-stores-rost-rises-trails-220002348.html
2025-08-13 00:00:00+00:00,CSCO,SEC-EDGAR-8K,"(Item 2.02) . Results of Operations and Financial Condition. On August 13, 2025, Cisco Systems, Inc. (“Cisco”) reported its results of operations for its fiscal fourth quarter and fiscal year 2025 ended July 26, 2025. A copy of the press release issued by Cisco concerning the foregoing results is furnished herewith as Exhibit 99.1. The information contained herein and in the accompanying exhibit shall not be incorporated by reference into any filing of Cisco, whether made before",
2025-08-13 01:00:00+00:00,HON,GlobeNewswire,"Functional Safety Market Set to Surpass $7,896.7 Million by 2029 Amid Rising Demand for Risk Mitigation",https://finance.yahoo.com/news/functional-safety-market-set-surpass-010000972.html
2025-08-13 02:30:00+00:00,BIIB,GlobeNewswire,"[Latest] US Personalized Medicine Market Size/Share Worth USD 252.93 Billion by 2034 at a 17.32% CAGR: Custom Market Insights (Analysis, Outlook, Leaders, Report, Trends, Forecast, Segmentation, Growth Rate, Value, SWOT Analysis)",https://finance.yahoo.com/news/latest-us-personalized-medicine-market-023000015.html
2025-08-13 02:56:11+00:00,KLAC,StockStory,KLAC Q2 Deep Dive: AI Demand and Advanced Packaging Fuel Growth Amid Tariff Headwinds,https://finance.yahoo.com/news/klac-q2-deep-dive-ai-025611037.html
2025-08-13 02:56:46+00:00,CDNS,StockStory,The Top 5 Analyst Questions From Cadence’s Q2 Earnings Call,https://finance.yahoo.com/news/top-5-analyst-questions-cadence-025646376.html
2025-08-13 02:56:48+00:00,ON,StockStory,ON Q2 Deep Dive: Market Reacts to Weak Margins Despite Automotive and AI Data Center Momentum,https://finance.yahoo.com/news/q2-deep-dive-market-reacts-025648724.html
2025-08-13 02:58:20+00:00,LRCX,StockStory,Lam Research’s Q2 Earnings Call: Our Top 5 Analyst Questions,https://finance.yahoo.com/news/lam-research-q2-earnings-call-025820534.html
2025-08-13 02:58:57+00:00,CDNS,StockStory,CDNS Q2 Deep Dive: AI Demand and Product Expansion Drive Upbeat Outlook,https://finance.yahoo.com/news/cdns-q2-deep-dive-ai-025857419.html
2025-08-13 02:59:24+00:00,QCOM,StockStory,"QCOM Q2 Deep Dive: Broad-Based Growth, AI Strategy, and Market Skepticism",https://finance.yahoo.com/news/qcom-q2-deep-dive-broad-025924872.html
2025-08-13 02:59:42+00:00,KLAC,StockStory,The Top 5 Analyst Questions From KLA Corporation’s Q2 Earnings Call,https://finance.yahoo.com/news/top-5-analyst-questions-kla-025942993.html
2025-08-13 03:02:04+00:00,QCOM,StockStory,5 Revealing Analyst Questions From Qualcomm’s Q2 Earnings Call,https://finance.yahoo.com/news/5-revealing-analyst-questions-qualcomm-030204752.html
2025-08-13 03:02:19+00:00,MELI,StockStory,"MELI Q2 Deep Dive: E-commerce Initiatives Drive Top-Line Strength, Margin Pressures Persist",https://finance.yahoo.com/news/meli-q2-deep-dive-e-030219950.html
2025-08-13 03:03:55+00:00,LRCX,StockStory,LRCX Q2 Deep Dive: AI Demand and China Upside Shape Guidance Amid Margin Caution,https://finance.yahoo.com/news/lrcx-q2-deep-dive-ai-030355835.html
2025-08-13 03:04:40+00:00,ON,StockStory,5 Must-Read Analyst Questions From onsemi’s Q2 Earnings Call,https://finance.yahoo.com/news/5-must-read-analyst-questions-030440781.html
