timestamp,ticker,source,text,url
2025-08-14 08:08:08+00:00,CTSH,Reuters,"Cognizant to hike wages of 80% employees in November after three-month delay, company says",https://finance.yahoo.com/news/cognizant-hike-wages-80-employees-080808033.html
2025-08-14 08:25:00+00:00,MELI,Motley Fool,"If I Could Only Buy and Hold a Single Stock, This Would Be It",https://finance.yahoo.com/news/could-only-buy-hold-single-082500451.html
2025-08-14 09:53:49+00:00,ADSK,StockStory,1 S&P 500 Stock with Solid Fundamentals and 2 Facing Headwinds,https://finance.yahoo.com/news/1-p-500-stock-solid-095349634.html
2025-08-14 10:05:00+00:00,REGN,GlobeNewswire,Students Earn Top Awards at 42nd Annual Research Science Institute at MIT,https://finance.yahoo.com/news/students-earn-top-awards-42nd-100500443.html
2025-08-14 10:07:35+00:00,NXPI,Barchart,Stocks Muted Before the Open With Key U.S. PPI Data in Focus,https://finance.yahoo.com/news/stocks-muted-open-key-u-100735344.html
2025-08-14 10:21:26+00:00,WBD,Simply Wall St.,We Think You Should Be Aware Of Some Concerning Factors In Warner Bros. Discovery's (NASDAQ:WBD) Earnings,https://finance.yahoo.com/news/think-aware-concerning-factors-warner-102126433.html
2025-08-14 10:30:00+00:00,HON,Motley Fool,1 Dividend-Paying Dow Jones Stock to Buy in August,https://finance.yahoo.com/news/1-dividend-paying-dow-jones-103000720.html
2025-08-14 10:30:30+00:00,TTD,Yahoo Finance Video,4 trends among retail investors according to Robinhood's CIO,https://finance.yahoo.com/video/4-trends-among-retail-investors-103030097.html
2025-08-14 10:38:57+00:00,KLAC,Simply Wall St.,Here's What We Like About KLA's (NASDAQ:KLAC) Upcoming Dividend,https://finance.yahoo.com/news/heres-klas-nasdaq-klac-upcoming-103857486.html
2025-08-14 10:54:51+00:00,AZN,The Telegraph,UK prices for weight-loss jab jump by up to 170pc after Trump demands,https://finance.yahoo.com/news/uk-prices-weight-loss-jab-105451376.html
2025-08-14 10:56:35+00:00,GILD,Simply Wall St.,We Think Gilead Sciences' (NASDAQ:GILD) Profit Is Only A Baseline For What They Can Achieve,https://finance.yahoo.com/news/think-gilead-sciences-nasdaq-gild-105635393.html
2025-08-14 11:00:00+00:00,ADSK,PR Newswire,"Buildots Expands Autodesk Integration to Deliver Streamlined, AI-Powered Construction Issue Management",https://finance.yahoo.com/news/buildots-expands-autodesk-integration-deliver-110000676.html
2025-08-14 11:06:00+00:00,PEP,GlobeNewswire,The Rise of Functional Beverages in the USA | Major Brands Transforming the US Functional Beverages Landscape,https://finance.yahoo.com/news/rise-functional-beverages-usa-major-110600291.html
2025-08-14 11:12:39+00:00,MAR,World Construction Network,Construction commences on The Dunes Fort Lauderdale hotel,https://finance.yahoo.com/news/construction-commences-dunes-fort-lauderdale-111239251.html
2025-08-14 11:59:44+00:00,KLAC,Investor's Business Daily,"Dow Jones Futures: Is Stock Market Rotating? This Cathie Wood, Nancy Pelosi Pick Is A Buy",https://www.investors.com/market-trend/stock-market-today/dow-jones-futures-rotation-cisco-earnings-cathie-wood-nancy-pelosi-tempus-ai/?src=A00220&yptr=yahoo
2025-08-14 12:00:00+00:00,VRTX,GlobeNewswire,Vortex Energy Successfully Deploys ANT Sensors at Robinsons River Salt Project,https://finance.yahoo.com/news/vortex-energy-successfully-deploys-ant-120000582.html
2025-08-14 12:00:00+00:00,HON,GlobeNewswire,SmartSilk Corp. Announces Legal Filing Related to Unfulfilled Pandemic-Era PPE Order,https://finance.yahoo.com/news/smartsilk-corp-announces-legal-filing-120000336.html
2025-08-14 12:00:00+00:00,HON,NewMediaWire,Integrated Cyber Solutions Appoints Veteran Data & AI Scientist Jeremy J. Samuelson to Cyber Future Advisory Board,https://finance.yahoo.com/news/integrated-cyber-solutions-appoints-veteran-120000162.html
2025-08-14 12:00:00+00:00,GFS,GlobeNewswire,GlobalFoundries Completes Acquisition of MIPS,https://finance.yahoo.com/news/globalfoundries-completes-acquisition-mips-120000142.html
2025-08-14 12:20:00+00:00,NFLX,Zacks,5 Discretionary Stocks to Boost Your Portfolio on Rising Rate Cut Hopes,https://finance.yahoo.com/news/5-discretionary-stocks-boost-portfolio-122000894.html
2025-08-14 12:21:00+00:00,LULU,PR Newswire,A Great Day in the Stoke Presented by Lexus Returns to Surf City USA for Fourth Annual Celebration of Black Surf Culture on September 27,https://finance.yahoo.com/news/great-day-stoke-presented-lexus-122100248.html
2025-08-14 12:32:00+00:00,CEG,Zacks,How Should You Play Constellation Energy Stock Post Q2 Earnings Beat?,https://finance.yahoo.com/news/play-constellation-energy-stock-post-123200394.html
2025-08-14 12:32:00+00:00,CSX,PR Newswire,Invictus Foundation™ Receives Grant from CSX to Install a Behavioral Telehealth Platform in its Southeastern Regional Welcome Home Network and Continue the Capital Construction Planning for Eight Regional TBI & Behavioral Health Centers Across the Nation,https://finance.yahoo.com/news/invictus-foundation-receives-grant-csx-123200441.html
2025-08-14 12:52:00+00:00,ON,GlobeNewswire,Enovix Appoints Veteran Semiconductor Leader J. Daniel “Dan” McCranie to its Board of Directors,https://finance.yahoo.com/news/enovix-appoints-veteran-semiconductor-leader-125200982.html
2025-08-14 12:54:00+00:00,MRVL,PR Newswire,Marvell Completes Divestiture of Automotive Ethernet Business to Infineon for $2.5 Billion in All-Cash Transaction,https://finance.yahoo.com/news/marvell-completes-divestiture-automotive-ethernet-125400578.html
2025-08-14 13:00:00+00:00,MAR,PR Newswire,"Marriott Executive Apartments Expands in Malaysia, Introducing an Enriching Urban Retreat in the Heart of Kuala Lumpur",https://finance.yahoo.com/news/marriott-executive-apartments-expands-malaysia-130000984.html
2025-08-14 13:00:00+00:00,FTNT,GlobeNewswire,"Next-Generation Firewall Market Surges to $8.6 billion by 2028 - Dominated by Palo Alto Networks (US), Cisco (US), Fortinet (US)",https://finance.yahoo.com/news/next-generation-firewall-market-surges-130000956.html
2025-08-14 13:00:00+00:00,FTNT,PR Newswire,Malwarebytes Appoints Kendra Krause as General Manager of ThreatDown Business Unit,https://finance.yahoo.com/news/malwarebytes-appoints-kendra-krause-general-130000076.html
2025-08-14 13:00:00+00:00,ABNB,TechCrunch,Airbnb will allow US users to book stays without paying up front,https://finance.yahoo.com/news/airbnb-allow-us-users-book-130000282.html
2025-08-14 13:00:00+00:00,ORLY,Business Wire,O'Reilly Achieves Workday Certified Integration and Joins the Workday Marketplace to Support Workforces in Building Critical Tech and Business Skills,https://finance.yahoo.com/news/oreilly-achieves-workday-certified-integration-130000575.html
2025-08-14 13:00:00+00:00,CHTR,Business Wire,Introducing Hisense Channels: A New Streaming Service for Hisense Smart TVs Powered by Xumo Enterprise,https://finance.yahoo.com/news/introducing-hisense-channels-streaming-hisense-130000062.html
2025-08-14 13:00:00+00:00,ZS,GlobeNewswire,"Next-Generation Firewall Market Surges to $8.6 billion by 2028 - Dominated by Palo Alto Networks (US), Cisco (US), Fortinet (US)",https://finance.yahoo.com/news/next-generation-firewall-market-surges-130000956.html
2025-08-14 13:00:03+00:00,TTD,Zacks,Here is What to Know Beyond Why The Trade Desk (TTD) is a Trending Stock,https://finance.yahoo.com/news/know-beyond-why-trade-desk-130003012.html
2025-08-14 13:04:29+00:00,ARM,Investing.com,AMD/ARM continue to gain share over INTC- report,https://finance.yahoo.com/news/amd-arm-continue-gain-share-130429734.html
2025-08-14 13:19:00+00:00,ASML,Motley Fool,3 Top Tech Stocks to Buy in August,https://finance.yahoo.com/news/3-top-tech-stocks-buy-131900047.html
2025-08-14 13:30:01+00:00,DDOG,Zacks,Is It Worth Investing in Datadog (DDOG) Based on Wall Street's Bullish Views?,https://finance.yahoo.com/news/worth-investing-datadog-ddog-based-133001871.html
2025-08-14 13:30:03+00:00,PDD,Zacks,Is It Worth Investing in PDD Holdings Inc. Sponsored ADR (PDD) Based on Wall Street's Bullish Views?,https://finance.yahoo.com/news/worth-investing-pdd-holdings-inc-133003472.html
2025-08-14 13:32:00+00:00,MRVL,PR Newswire,Infineon successfully completes acquisition of Marvell's Automotive Ethernet business,https://finance.yahoo.com/news/infineon-successfully-completes-acquisition-marvells-133200674.html
2025-08-14 13:35:02+00:00,DDOG,Zacks,"Datadog (DDOG) Loses 7.6% in 4 Weeks, Here's Why a Trend Reversal May be Around the Corner",https://finance.yahoo.com/news/datadog-ddog-loses-7-6-133502277.html
2025-08-14 13:40:02+00:00,AMGN,Zacks,Why Amgen (AMGN) is a Top Value Stock for the Long-Term,https://finance.yahoo.com/news/why-amgen-amgn-top-value-134002964.html
2025-08-14 13:40:04+00:00,WBD,Zacks,Are You a Value Investor? This 1 Stock Could Be the Perfect Pick,https://finance.yahoo.com/news/value-investor-1-stock-could-134004988.html
2025-08-14 13:40:39+00:00,LRCX,The Fly,"Kratos, CVS Health upgraded: Wall Street's top analyst calls",https://finance.yahoo.com/news/kratos-cvs-health-upgraded-wall-134039760.html
2025-08-14 13:40:39+00:00,FTNT,The Fly,"Kratos, CVS Health upgraded: Wall Street's top analyst calls",https://finance.yahoo.com/news/kratos-cvs-health-upgraded-wall-134039760.html
2025-08-14 13:45:28+00:00,ORLY,TipRanks,"C3 AI downgraded, Capri upgraded: Wall Street’s top analyst calls",https://finance.yahoo.com/news/c3-ai-downgraded-capri-upgraded-134528564.html
2025-08-14 13:47:00+00:00,HON,GlobeNewswire,"Personal Protective Equipment Company Evaluation Report 2025 | Honeywell, DuPont, and 3M Lead with Innovations Across Advanced Materials, Industrial Technologies, and Sustainability Solutions",https://finance.yahoo.com/news/personal-protective-equipment-company-evaluation-134700031.html
2025-08-14 14:00:00+00:00,BKNG,PR Newswire,Booking.com Launches Credit Card That Makes It Easier to Earn and Use Rewards for Travel,https://finance.yahoo.com/news/booking-com-launches-credit-card-140000892.html
2025-08-14 14:00:02+00:00,ROST,Zacks,Ross Stores (ROST) Expected to Beat Earnings Estimates: Should You Buy?,https://finance.yahoo.com/news/ross-stores-rost-expected-beat-140002453.html
2025-08-14 14:01:00+00:00,PEP,PR Newswire,"Functional Foods Market Surges to USD 654.45 Billion by 2033, Propelled by 10.4% CAGR - Verified Market Reports®",https://finance.yahoo.com/news/functional-foods-market-surges-usd-140100548.html
2025-08-14 14:04:11+00:00,MCHP,Barchart,Stocks Fall Back on Hot PPI Report,https://finance.yahoo.com/news/stocks-fall-back-hot-ppi-140411273.html
2025-08-14 14:04:11+00:00,NXPI,Barchart,Stocks Fall Back on Hot PPI Report,https://finance.yahoo.com/news/stocks-fall-back-hot-ppi-140411273.html
2025-08-14 14:04:11+00:00,ON,Barchart,Stocks Fall Back on Hot PPI Report,https://finance.yahoo.com/news/stocks-fall-back-hot-ppi-140411273.html
2025-08-14 14:10:00+00:00,ZS,Zacks,Palo Alto Networks' Pre-Q4 Earnings Analysis: Hold or Fold the Stock?,https://finance.yahoo.com/news/palo-alto-networks-pre-q4-141000692.html
2025-08-14 14:12:00+00:00,CDNS,Zacks,"RADCOM Q2 Earnings Beat on Robust Top-Line Traction, View Reiterated",https://finance.yahoo.com/news/radcom-q2-earnings-beat-robust-141200494.html
2025-08-14 14:15:00+00:00,LULU,Motley Fool,3 Absurdly Cheap Stocks That Haven't Been Trading This Low in Years,https://finance.yahoo.com/news/3-absurdly-cheap-stocks-havent-141500838.html
2025-08-14 14:15:00+00:00,CDNS,Zacks,"CDNS, NVDA Team Up to Advance Billion-Gate AI Design Power Analysis",https://finance.yahoo.com/news/cdns-nvda-team-advance-billion-141500491.html
2025-08-14 14:25:00+00:00,NFLX,Zacks,NFLX vs. ROKU: Which Ad-Supported Streaming Stock is the Better Buy?,https://finance.yahoo.com/news/nflx-vs-roku-ad-supported-142500791.html
2025-08-14 14:29:00+00:00,TEAM,GlobeNewswire,"Application Lifecycle Management Company Evaluation Report | Microsoft, Atlassian, and IBM Lead with Cloud-Driven, Secure, and Scalable Solutions",https://finance.yahoo.com/news/application-lifecycle-management-company-evaluation-142900654.html
2025-08-14 14:38:00+00:00,ORLY,Barrons.com,Advance Auto Parts Stock Skids After Earnings Beat. Here’s Why.,https://www.barrons.com/articles/advance-auto-parts-earnings-stock-price-85480cc1?siteid=yhoof2&yptr=yahoo
2025-08-14 14:43:17+00:00,LRCX,TheStreet,Stock Market Today: Stocks punished after disappointing PPI delivers gut punch,https://finance.yahoo.com/news/stock-market-today-stocks-gyrate-144317096.html
2025-08-14 14:50:00+00:00,MELI,Zacks,MercadoLibre Faces Margin Strain: Should You Hold or Fold the Stock?,https://finance.yahoo.com/news/mercadolibre-faces-margin-strain-hold-145000011.html
2025-08-14 14:58:55+00:00,DASH,Yahoo Finance,Amazon could seize market share and drive down fees with its latest grocery bet,https://finance.yahoo.com/news/amazon-could-seize-market-share-and-drive-down-fees-with-its-latest-grocery-bet-145855380.html
2025-08-14 15:02:00+00:00,SNPS,Zacks,CDNS Stock Gains 25% in a Year: Stay Invested or Book Profits?,https://finance.yahoo.com/news/cdns-stock-gains-25-stay-150200106.html
2025-08-14 15:02:00+00:00,CDNS,Zacks,CDNS Stock Gains 25% in a Year: Stay Invested or Book Profits?,https://finance.yahoo.com/news/cdns-stock-gains-25-stay-150200106.html
2025-08-14 15:05:38+00:00,TTD,Investing.com,Trade Desk shares drop on report of Walmart advertising deal change,https://finance.yahoo.com/news/trade-desk-shares-drop-report-150538782.html
2025-08-14 15:07:00+00:00,WBD,PR Newswire,"Salute the Troops Announces October Vetrepreneur Project Cohort with $8,500 in Awards for Veteran Business Owners",https://finance.yahoo.com/news/salute-troops-announces-october-vetrepreneur-150700331.html
2025-08-14 15:28:57+00:00,NFLX,Barchart,This Turnaround Stock Has Tripled from Its 52-Week Lows: Is It Still a Buy?,https://finance.yahoo.com/news/turnaround-stock-tripled-52-week-152857435.html
2025-08-14 15:40:02+00:00,SHOP,Zacks,LYFT vs. SHOP: Which Stock Should Value Investors Buy Now?,https://finance.yahoo.com/news/lyft-vs-shop-stock-value-154002865.html
2025-08-14 15:42:03+00:00,TTD,MT Newswires,Top Midday Stories: Stocks Fall on Hot July PPI Print; Deere Lowers Top-End Guidance for Full-Year Net Income,https://finance.yahoo.com/news/top-midday-stories-stocks-fall-154203107.html
2025-08-14 15:49:48+00:00,DASH,Yahoo Finance,Cisco remains under pressure as it hops on the AI train: Opening Bid top takeaway,https://finance.yahoo.com/news/cisco-remains-under-pressure-as-it-hops-on-the-ai-train-opening-bid-top-takeaway-154948242.html
2025-08-14 15:50:55+00:00,MCHP,Barchart,Stocks Are Mixed After Hot PPI Report,https://finance.yahoo.com/news/stocks-mixed-hot-ppi-report-155055508.html
2025-08-14 15:50:55+00:00,ON,Barchart,Stocks Are Mixed After Hot PPI Report,https://finance.yahoo.com/news/stocks-mixed-hot-ppi-report-155055508.html
2025-08-14 15:50:55+00:00,MRVL,Barchart,Stocks Are Mixed After Hot PPI Report,https://finance.yahoo.com/news/stocks-mixed-hot-ppi-report-155055508.html
2025-08-14 16:00:00+00:00,EA,Business Wire,"EA SPORTS™ Madden NFL 26 Launches Worldwide Today—Powered by Real NFL Data, and Unleashing the Most Explosive and Immersive NFL Experience Yet",https://finance.yahoo.com/news/ea-sports-madden-nfl-26-160000630.html
2025-08-14 16:13:06+00:00,DXCM,Barchart,DexCom Stock: Analyst Estimates & Ratings,https://finance.yahoo.com/news/dexcom-stock-analyst-estimates-ratings-161306866.html
2025-08-14 17:06:00+00:00,ARM,Zacks,"Arm Holdings Shares Up 15% in 2025: Is it Time to Buy, Hold, or Sell?",https://finance.yahoo.com/news/arm-holdings-shares-15-2025-170600645.html
2025-08-14 17:18:56+00:00,EA,Simply Wall St.,Electronic Arts (EA) Launches EA SPORTS FC 26 ICONs Including Zlatan Ibrahimovic,https://finance.yahoo.com/news/electronic-arts-ea-launches-ea-171856852.html
2025-08-14 17:22:00+00:00,APP,Barrons.com,"Software Stocks Feel the Blues, But Some Look Set To Rebound",https://www.barrons.com/articles/software-stocks-feel-the-blues-gitlab-fortinet-circle-applovin-8a13b252?siteid=yhoof2&yptr=yahoo
2025-08-14 17:22:00+00:00,FTNT,Barrons.com,"Software Stocks Feel the Blues, But Some Look Set To Rebound",https://www.barrons.com/articles/software-stocks-feel-the-blues-gitlab-fortinet-circle-applovin-8a13b252?siteid=yhoof2&yptr=yahoo
2025-08-14 17:26:55+00:00,CMCSA,Simply Wall St.,Comcast (CMCSA) Unveils New Florida Headquarters And Launches Soccer-Centric Package,https://finance.yahoo.com/news/comcast-cmcsa-unveils-florida-headquarters-172655800.html
2025-08-14 17:36:00+00:00,AEP,GlobeNewswire,Hope Utilities to Construct Natural Gas Pipeline in Ohio to Power Data Center Project,https://finance.yahoo.com/news/hope-utilities-construct-natural-gas-173600096.html
2025-08-14 17:38:29+00:00,AXON,Simply Wall St.,Axon Enterprise (AXON) Reports Q2 Revenue Climb To US$669 Million,https://finance.yahoo.com/news/axon-enterprise-axon-reports-q2-173829096.html
2025-08-14 17:39:00+00:00,NXPI,Simply Wall St.,NXP Semiconductors (NXPI) Updates Buyback Program with 1.1 Million Shares Repurchased,https://finance.yahoo.com/news/nxp-semiconductors-nxpi-updates-buyback-173900361.html
2025-08-14 17:42:27+00:00,DASH,Simply Wall St.,DoorDash (DASH) Strengthens Partnerships With Ace Pickleball Club And McDonald's,https://finance.yahoo.com/news/doordash-dash-strengthens-partnerships-ace-174227528.html
2025-08-14 18:06:15+00:00,DASH,Investor's Business Daily,Vipshop Holdings Stock Earns RS Rating Upgrade,https://www.investors.com/news/vipshop-holdings-stock-earns-rs-rating-upgrade/?src=A00220&yptr=yahoo
2025-08-14 18:46:00+00:00,MAR,Business Wire,Cinnamon Beach Vacations Now Offers Luxury and Premium Rental Properties on Homes & Villas by Marriott Bonvoy,https://finance.yahoo.com/news/cinnamon-beach-vacations-now-offers-184600047.html
2025-08-14 19:00:00+00:00,CDNS,Zacks,Should You Buy Intel Stock After President Trump's CEO Praise?,https://finance.yahoo.com/news/buy-intel-stock-president-trumps-190000364.html
2025-08-14 19:37:44+00:00,DASH,GuruFocus.com,Why Amazon (AMZN) Stock Is Climbing Today,https://finance.yahoo.com/news/why-amazon-amzn-stock-climbing-193744566.html
2025-08-14 19:40:11+00:00,SHOP,Financial Post,"Blackstone's purchase of Enverus a wager that data will drive new era in energy, CEO says",https://finance.yahoo.com/news/blackstones-purchase-enverus-wager-data-194011873.html
2025-08-14 19:51:15+00:00,TTD,MT Newswires,Sector Update: Tech Stocks Retreat Late Afternoon,https://finance.yahoo.com/news/sector-tech-stocks-retreat-afternoon-195115061.html
2025-08-14 20:05:00+00:00,DDOG,PR Newswire,Yanbing Li Appointed to Equinix Board of Directors,https://finance.yahoo.com/news/yanbing-li-appointed-equinix-board-200500360.html
2025-08-14 20:15:00+00:00,MCHP,GlobeNewswire,Microchip Technology to Webcast Annual Meeting of Shareholders,https://finance.yahoo.com/news/microchip-technology-webcast-annual-meeting-201500812.html
2025-08-14 20:15:26+00:00,FTNT,Insider Monkey,"Fortinet, Inc. (FTNT): No Was Excited About The New Iteration, Says Jim Cramer",https://finance.yahoo.com/news/fortinet-inc-ftnt-no-excited-201526799.html
2025-08-14 20:17:42+00:00,ASML,Reuters,"Applied Materials' forecast hit by China pause, export‑license woes; shares down 13%",https://finance.yahoo.com/news/applied-materials-forecasts-quarterly-revenue-201742663.html
2025-08-14 20:30:41+00:00,SHOP,StockStory,"Unity, Domo, Five9, LiveRamp, and Shopify Shares Plummet, What You Need To Know",https://finance.yahoo.com/news/unity-domo-five9-liveramp-shopify-203041238.html
2025-08-14 20:30:41+00:00,DDOG,StockStory,"PubMatic, Zeta, SoundHound AI, MicroStrategy, and Datadog Shares Plummet, What You Need To Know",https://finance.yahoo.com/news/pubmatic-zeta-soundhound-ai-microstrategy-203041325.html
2025-08-14 20:30:43+00:00,TTD,StockStory,"The Trade Desk, Wix, Yext, UiPath, and 8x8 Stocks Trade Down, What You Need To Know",https://finance.yahoo.com/news/trade-desk-wix-yext-uipath-203043273.html
2025-08-14 20:45:39+00:00,LULU,StockStory,"Sportsman's Warehouse, Lululemon, Williams-Sonoma, Bath and Body Works, and America's Car-Mart Shares Are Falling, What You Need To Know",https://finance.yahoo.com/news/sportsmans-warehouse-lululemon-williams-sonoma-204539928.html
2025-08-14 20:55:42+00:00,DASH,Investor's Business Daily,"Amazon, IBD Stock Of The Day, Delivers Early Entry As Grocery Move Hits Rivals",https://www.investors.com/research/ibd-stock-of-the-day/amazon-stock-walmart-grocery-instacart/?src=A00220&yptr=yahoo
2025-08-14 21:33:59+00:00,LULU,The Wall Street Journal,"Stocks to Watch Recap: Bullish, Cisco, Deere, Lululemon",https://www.wsj.com/livecoverage/stock-market-today-dow-sp-500-nasdaq-08-14-2025/card/stocks-to-watch-thursday-cisco-coherent-bullish-carlsberg-Sn4RK4hOEUZKJy9lsjhV?siteid=yhoof2&yptr=yahoo
2025-08-14 21:45:02+00:00,ZS,Zacks,Zscaler (ZS) Stock Sinks As Market Gains: Here's Why,https://finance.yahoo.com/news/zscaler-zs-stock-sinks-market-214502197.html
2025-08-14 21:45:03+00:00,LULU,Zacks,Lululemon (LULU) Stock Sinks As Market Gains: Here's Why,https://finance.yahoo.com/news/lululemon-lulu-stock-sinks-market-214503689.html
2025-08-14 21:58:41+00:00,LULU,Reuters,'Big Short' investor Burry turned more bullish on second quarter,https://finance.yahoo.com/news/big-short-investor-burry-turned-215841945.html
2025-08-14 21:58:41+00:00,ASML,Reuters,'Big Short' investor Burry turned more bullish on second quarter,https://finance.yahoo.com/news/big-short-investor-burry-turned-215841945.html
2025-08-14 21:58:41+00:00,REGN,Reuters,'Big Short' investor Burry turned more bullish on second quarter,https://finance.yahoo.com/news/big-short-investor-burry-turned-215841945.html
2025-08-14 22:13:36+00:00,CEG,Insider Monkey,Constellation Energy (CEG) Price Target Raised to $375 After Q2 Beat and Strong Outlook,https://finance.yahoo.com/news/constellation-energy-ceg-price-target-221336041.html
2025-08-14 22:42:43+00:00,TMUS,Investopedia,Berkshire Hathaway 13F Filing Reveals Warren Buffett's Secret Stock,https://finance.yahoo.com/news/berkshire-hathaway-13f-filing-reveals-224243462.html
2025-08-14 22:42:43+00:00,CHTR,Investopedia,Berkshire Hathaway 13F Filing Reveals Warren Buffett's Secret Stock,https://finance.yahoo.com/news/berkshire-hathaway-13f-filing-reveals-224243462.html
2025-08-14 22:50:50+00:00,TEAM,Insider Monkey,Stephens Lowers Atlassian (TEAM) PT but Says AI Fears Are Overblown,https://finance.yahoo.com/news/stephens-lowers-atlassian-team-pt-225050857.html
2025-08-14 22:52:51+00:00,FTNT,Insider Monkey,Fortinet Price (FTNT) Target Cut to $80 Despite Strong Q2 and Guidance Raise,https://finance.yahoo.com/news/fortinet-price-ftnt-target-cut-225251179.html
2025-08-14 22:58:36+00:00,CEG,Insider Monkey,Analyst Sees More Upside for Constellation Energy (CEG) After Strong YTD Rally,https://finance.yahoo.com/news/analyst-sees-more-upside-constellation-225836496.html
2025-08-14 23:35:24+00:00,ARM,Reuters,Hedge funds shift bets to double down on Big Tech amid AI boom,https://finance.yahoo.com/news/hedge-funds-shift-bets-double-233524300.html
2025-08-14 23:35:24+00:00,LRCX,Reuters,Hedge funds shift bets to double down on Big Tech amid AI boom,https://finance.yahoo.com/news/hedge-funds-shift-bets-double-233524300.html
2025-08-15 00:00:00+00:00,KDP,SEC-EDGAR-8K,"(Item 8.01) . Other Events. On August 15, 2025, U.S. Bank Trust Company, N.A. (“US Bank”) was appointed as trustee, paying agent and registrar under Keurig Dr Pepper Inc.’s (the “Company”) indenture, dated as of December 15, 2009, including with respect to each supplemental indenture thereto, and the Company’s indenture, dated as of May 25, 2018, including with respect to each supplemental indenture thereto. US Bank replaces Computershare Trust Company, N.A. (“Computershare”) as the trustee, paying agent",
2025-08-15 00:00:00+00:00,EA,SEC-EDGAR-8K,"(Item 5.02) Departure of Directors or Certain Officers; Election of Directors; Appointment of Certain Officers; Compensatory Arrangements of Certain Officers. On August 14, 2025, the Board of Directors (the ""Board"") of Electronic Arts Inc. (the ""Company"") approved an amendment and restatement of the Company’s Change in Control Severance Plan following a review of the plan. The material amendments include: (i) providing as severance a pro rata bonus for the year of termination of employment (all other severance

(Item 5.07) Submission of Matters to a Vote of Security Holders. At the Company's annual meeting of stockholders, held on August 14, 2025, the stockholders of the Company voted on the following proposals and cast their votes as described below: 1. Election of Directors. The individuals listed below were elected to serve on the Board of the Company until the next annual meeting of stockholders or until his or her successor is elected and qualified. For Against",
2025-08-15 03:33:18+00:00,PCAR,StockStory,Q2 Earnings Outperformers: PACCAR (NASDAQ:PCAR) And The Rest Of The Heavy Transportation Equipment Stocks,https://finance.yahoo.com/news/q2-earnings-outperformers-paccar-nasdaq-033318301.html
2025-08-15 03:35:08+00:00,EA,StockStory,Consumer Internet Stocks Q2 Highlights: Electronic Arts (NASDAQ:EA),https://finance.yahoo.com/news/consumer-internet-stocks-q2-highlights-033508033.html
2025-08-15 04:31:13+00:00,PAYX,StockStory,1 Software Stock to Research Further and 2 Facing Headwinds,https://finance.yahoo.com/news/1-software-stock-research-further-043113575.html
2025-08-15 04:33:47+00:00,CMCSA,StockStory,1 S&P 500 Stock with Impressive Fundamentals and 2 We Question,https://finance.yahoo.com/news/1-p-500-stock-impressive-043347435.html
2025-08-15 04:35:10+00:00,DASH,StockStory,1 Volatile Stock on Our Buy List and 2 That Underwhelm,https://finance.yahoo.com/news/1-volatile-stock-buy-list-043510061.html
2025-08-15 04:37:37+00:00,ZS,StockStory,1 Cash-Producing Stock with Solid Fundamentals and 2 We Turn Down,https://finance.yahoo.com/news/1-cash-producing-stock-solid-043737136.html
