timestamp,ticker,source,text,url
2026-05-09 00:07:41+00:00,MRVL,MarketBeat,B. Riley Financial Q1 Earnings Call Highlights,https://finance.yahoo.com/markets/stocks/articles/b-riley-financial-q1-earnings-000741846.html
2026-05-09 00:24:48+00:00,LIN,Insider Monkey,BMO Capital Stays Bullish on Linde (LIN) as RBC Capital Sees Room for Guidance Upside,https://finance.yahoo.com/markets/stocks/articles/bmo-capital-stays-bullish-linde-002448106.html
2026-05-09 00:32:38+00:00,COST,Insider Monkey,"Costco Posts Strong April Sales Growth, Digital Sales Rise Nearly 19%",https://finance.yahoo.com/markets/stocks/articles/costco-posts-strong-april-sales-003238867.html
2026-05-09 00:43:37+00:00,BKR,Insider Monkey,BofA Reiterates Buy on Baker Hughes (BKR) Following Higher EBITDA Forecasts,https://finance.yahoo.com/markets/stocks/articles/bofa-reiterates-buy-baker-hughes-004337242.html
2026-05-09 00:45:45+00:00,MCHP,Insider Monkey,Is Microchip Technology (MCHP) One of the Best Stocks to Buy to Beat the S&P 500?,https://finance.yahoo.com/markets/stocks/articles/microchip-technology-mchp-one-best-004545577.html
2026-05-09 00:57:58+00:00,AMD,reddit.com/r/stocks,"Is Celestica still a good long-term investment after its recent run-up? - Hi everyone, I’m trying to get a more grounded view on Celestica (CLS) and would appreciate perspectives from long-term investors here. CLS has had a strong run over the past year due to AI infrastructure demand (servers, networking, hyperscaler supply chain exposure), but recently the stock has been quite volatile and consolidating despite continued AI tailwinds. CLS operates in the same broader AI",
2026-05-09 00:57:58+00:00,SNDK,reddit.com/r/stocks,"Is Celestica still a good long-term investment after its recent run-up? - Hi everyone, I’m trying to get a more grounded view on Celestica (CLS) and would appreciate perspectives from long-term investors here. CLS has had a strong run over the past year due to AI infrastructure demand (servers, networking, hyperscaler supply chain exposure), but recently the stock has been quite volatile and consolidating despite continued AI tailwinds. CLS operates in the same broader AI",
2026-05-09 00:57:58+00:00,MU,reddit.com/r/stocks,"Is Celestica still a good long-term investment after its recent run-up? - Hi everyone, I’m trying to get a more grounded view on Celestica (CLS) and would appreciate perspectives from long-term investors here. CLS has had a strong run over the past year due to AI infrastructure demand (servers, networking, hyperscaler supply chain exposure), but recently the stock has been quite volatile and consolidating despite continued AI tailwinds. CLS operates in the same broader AI",
2026-05-09 00:57:58+00:00,AVGO,reddit.com/r/stocks,"Is Celestica still a good long-term investment after its recent run-up? - Hi everyone, I’m trying to get a more grounded view on Celestica (CLS) and would appreciate perspectives from long-term investors here. CLS has had a strong run over the past year due to AI infrastructure demand (servers, networking, hyperscaler supply chain exposure), but recently the stock has been quite volatile and consolidating despite continued AI tailwinds. CLS operates in the same broader AI",
2026-05-09 01:06:26+00:00,MAR,MarketBeat,Marriott International Stockholders Reelect Board as CEO Addresses Global Outlook,https://finance.yahoo.com/markets/stocks/articles/marriott-international-stockholders-reelect-board-010626604.html
2026-05-09 01:09:32+00:00,COST,Sourcing Journal,Nike Faces Class Action Over Tariff Refunds,https://finance.yahoo.com/economy/policy/articles/nike-faces-class-action-over-010932167.html
2026-05-09 01:18:16+00:00,ASML,Insider Monkey,Is Applied Materials (AMAT) One of the Best Inflation-Hedge Stocks to Buy for 2026?,https://finance.yahoo.com/markets/stocks/articles/applied-materials-amat-one-best-011816289.html
2026-05-09 01:20:07+00:00,WMT,Insider Monkey,Walmart (WMT) – Among the 10 Best Inflation-Hedge Stocks to Buy for 2026,https://finance.yahoo.com/markets/stocks/articles/walmart-wmt-among-10-best-012007127.html
2026-05-09 04:26:36+00:00,CHTR,Simply Wall St.,A Look At Charter Communications (CHTR) Valuation After Prolonged Share Price Weakness,https://finance.yahoo.com/markets/stocks/articles/look-charter-communications-chtr-valuation-042636568.html
2026-05-09 04:26:46+00:00,MELI,reddit.com/r/stocks,"When will the vortex ofAI/memory/chip stocks sucking money out of other stocks end? - AI stocks have gone parabolic in the past couple of months. It seems everything remotely is related (such as ai infrastructure, construction related, cooling systems) has been going straight up. Meanwhile other stocks that are posting great results are doing nothing (eg. MELI, SOFI). Memory seems crowded now, everyone piling on smaller stocks that have been flat for ages, and now",
2026-05-09 04:27:26+00:00,HON,Simply Wall St.,Assessing Honeywell International (HON) After The Planned Three-Way Breakup Announcement,https://finance.yahoo.com/markets/stocks/articles/assessing-honeywell-international-hon-planned-042726788.html
2026-05-09 04:56:40+00:00,SHOP,Insider Monkey,Nu Holdings’ (NU) Nubank Appoints Carl Rivera as Chief Product Officer,https://finance.yahoo.com/markets/stocks/articles/nu-holdings-nu-nubank-appoints-045640954.html
2026-05-09 05:00:29+00:00,GOOG,reddit.com/r/stocks,"AI materials vs. AI companies - It seems a safer bet with AI is not to bet on AI-centric companies like AMZN, GOOG, META, ORCL, etc but on the materials for AI hyper scaling centers. Materials companies like Memory (sanddisk) Disk (eg. western digital) Chips (eg. Smc) Power Those materials are always in demand but surging in very high demand due to data center roll outs. What other AI materials companies are you holding and",
2026-05-09 05:00:29+00:00,META,reddit.com/r/stocks,"AI materials vs. AI companies - It seems a safer bet with AI is not to bet on AI-centric companies like AMZN, GOOG, META, ORCL, etc but on the materials for AI hyper scaling centers. Materials companies like Memory (sanddisk) Disk (eg. western digital) Chips (eg. Smc) Power Those materials are always in demand but surging in very high demand due to data center roll outs. What other AI materials companies are you holding and",
2026-05-09 05:00:29+00:00,AMZN,reddit.com/r/stocks,"AI materials vs. AI companies - It seems a safer bet with AI is not to bet on AI-centric companies like AMZN, GOOG, META, ORCL, etc but on the materials for AI hyper scaling centers. Materials companies like Memory (sanddisk) Disk (eg. western digital) Chips (eg. Smc) Power Those materials are always in demand but surging in very high demand due to data center roll outs. What other AI materials companies are you holding and",
2026-05-09 05:06:13+00:00,DXCM,MarketBeat,Tandem Diabetes Care Q1 Earnings Call Highlights,https://finance.yahoo.com/sectors/healthcare/articles/tandem-diabetes-care-q1-earnings-050613316.html
2026-05-09 05:14:26+00:00,COST,reddit.com/r/stocks,Google is the best stock on the market and it’s not even close - Google is absolutely positively the best stock on the market right now and it isn’t even close. One year ago Google was getting torn up given reports of AI taking over search and them lagging in the AI chatbot space. Although that has all changed as now Gemini has emerged as the favorite in the space. This is due to a,
2026-05-09 05:14:26+00:00,AMD,reddit.com/r/stocks,Google is the best stock on the market and it’s not even close - Google is absolutely positively the best stock on the market right now and it isn’t even close. One year ago Google was getting torn up given reports of AI taking over search and them lagging in the AI chatbot space. Although that has all changed as now Gemini has emerged as the favorite in the space. This is due to a,
2026-05-09 05:21:34+00:00,ADSK,Simply Wall St.,Is Autodesk (ADSK) Using Small-Business Flex Pricing To Quietly Redefine Its Competitive Moat?,https://finance.yahoo.com/markets/stocks/articles/autodesk-adsk-using-small-business-052134355.html
2026-05-09 05:26:31+00:00,XEL,Insider Monkey,Mizuho Raises its Price Target on Xcel Energy (XEL) to $94,https://finance.yahoo.com/sectors/energy/articles/mizuho-raises-price-target-xcel-052631093.html
2026-05-09 05:27:02+00:00,AEP,Insider Monkey,Scotiabank Raises its Price Target on American Electric (AEP) to $140,https://finance.yahoo.com/markets/stocks/articles/scotiabank-raises-price-target-american-052702297.html
2026-05-09 06:07:54+00:00,VRTX,MarketBeat,"Entrada Therapeutics DMD Trial Shows Early Functional Gains, Clean Safety Profile",https://finance.yahoo.com/sectors/healthcare/articles/entrada-therapeutics-dmd-trial-shows-060754533.html
2026-05-09 06:57:51+00:00,MU,reddit.com/r/stocks,"How can the market accepts such a low forward P/E for MU? - I don’t get it. What is so different for RAM compared to GPUs to justify such a gap in multiples? I get that the technology is less complex but I don’t see commoditization coming soon. The technology is just starting into a new era, where RAM in the range of >250gb will be a standard. Alone the consumer market is huge for",
2026-05-09 07:10:50+00:00,TRI,MarketBeat,Thomson Reuters Defends AI Moat as Compliance Complexity Fuels Growth,https://finance.yahoo.com/sectors/technology/articles/thomson-reuters-defends-ai-moat-071050082.html
2026-05-09 07:45:13+00:00,PYPL,Investing.com,U.S. Senate Banking Committee moves to advance “Clarity Act” crypto framework,https://finance.yahoo.com/markets/crypto/articles/u-senate-banking-committee-moves-074513426.html
2026-05-09 07:45:13+00:00,MSTR,Investing.com,U.S. Senate Banking Committee moves to advance “Clarity Act” crypto framework,https://finance.yahoo.com/markets/crypto/articles/u-senate-banking-committee-moves-074513426.html
2026-05-09 08:56:05+00:00,SNDK,reddit.com/r/stocks,"Is the current AI-driven memory cycle different this time, or are stocks like SNDK still likely to follow the usual boom-bust pattern? - Hi everyone, I’ve been following the recent rally in SanDisk (SNDK) and other memory-related AI plays, and I’m trying to understand whether this cycle is genuinely different from past memory cycles or if it’s still likely to follow the traditional boom-bust pattern that memory stocks are known for. The bull case seems",
2026-05-09 09:12:08+00:00,DASH,Simply Wall St.,"How Investors Are Reacting To DoorDash (DASH) Earnings Beat, AI Push And Share Buybacks",https://finance.yahoo.com/markets/stocks/articles/investors-reacting-doordash-dash-earnings-091208410.html
2026-05-09 09:18:13+00:00,INTC,reddit.com/r/stocks,"$INTC owns Majority stake in $MBLY - Elon Musk has been banging on the table about Robotics, Jensen Huang views robotics as the next massive growth Frontier after Ai, which will integrate into every industry. Jenson recent said ""billions of robots, hundreds of millions of autonomous vehicles, and hundreds of thousands of robotic factories."" ""Everything that moves will be robotic someday, and it will be soon."" Musk has repeatedly called Optimus (and humanoid robotics) potentially",
2026-05-09 09:41:25+00:00,MCHP,Insider Monkey,Why Everspin Technologies (MRAM) Is Expanding Its U.S. MRAM Manufacturing Base,https://finance.yahoo.com/markets/stocks/articles/why-everspin-technologies-mram-expanding-094125113.html
2026-05-09 10:12:21+00:00,AVGO,Simply Wall St.,Broadcom’s VMware Cloud Foundation 9.1 Targets Enterprise AI And Revenue Mix,https://finance.yahoo.com/markets/stocks/articles/broadcom-vmware-cloud-foundation-9-101221775.html
2026-05-09 10:13:37+00:00,SHOP,Insider Monkey,Oppenheimer Maintains Outperform Rating on Shopify (SHOP),https://finance.yahoo.com/markets/stocks/articles/oppenheimer-maintains-outperform-rating-shopify-101337740.html
2026-05-09 10:13:51+00:00,MPWR,Insider Monkey,Raymond James Raises its Price Target on Monolithic Power (MPWR),https://finance.yahoo.com/markets/stocks/articles/raymond-james-raises-price-target-101351245.html
2026-05-09 11:06:11+00:00,CMCSA,MarketBeat,Arlo Technologies Q1 Earnings Call Highlights,https://finance.yahoo.com/markets/stocks/articles/arlo-technologies-q1-earnings-call-110611385.html
2026-05-09 11:10:31+00:00,HON,Simply Wall St.,Honeywell Investors Weigh Quantinuum IPO And Quantum Exposure Valuation,https://finance.yahoo.com/markets/stocks/articles/honeywell-investors-weigh-quantinuum-ipo-111031895.html
2026-05-09 11:12:18+00:00,TMUS,Simply Wall St.,How Investors May Respond To T-Mobile US (TMUS) Fiber JVs And Satellite-Powered Broadband Expansion,https://finance.yahoo.com/markets/stocks/articles/investors-may-respond-t-mobile-111218930.html
2026-05-09 11:35:00+00:00,FANG,Motley Fool,Market Crash: The 2 Best Energy Stocks I'd Buy Without Hesitation,https://finance.yahoo.com/sectors/energy/articles/market-crash-2-best-energy-113500393.html
2026-05-09 12:00:10+00:00,CSX,Simply Wall St.,"CSX Insider Ups Holding By 1,701% During Year",https://finance.yahoo.com/markets/stocks/articles/csx-insider-ups-holding-1-120010860.html
2026-05-09 12:02:58+00:00,ROP,Simply Wall St.,Roper Technologies' (NASDAQ:ROP) Profits Appear To Have Quality Issues,https://finance.yahoo.com/markets/stocks/articles/roper-technologies-nasdaq-rop-profits-120258084.html
2026-05-09 12:12:09+00:00,ODFL,Simply Wall St.,Old Dominion Freight Line (ODFL) Is Down 6.8% After Q1 Earnings Decline Amid Heavy Buybacks - What's Changed,https://finance.yahoo.com/markets/stocks/articles/old-dominion-freight-line-odfl-121209365.html
2026-05-09 12:27:15+00:00,CTSH,Yahoo Finance,The Nasdaq's top winners are now running hotter than in 2000: Chart of the Day,https://finance.yahoo.com/markets/article/the-nasdaqs-top-winners-are-now-running-hotter-than-in-2000-chart-of-the-day-122715863.html
2026-05-09 12:27:15+00:00,REGN,Yahoo Finance,The Nasdaq's top winners are now running hotter than in 2000: Chart of the Day,https://finance.yahoo.com/markets/article/the-nasdaqs-top-winners-are-now-running-hotter-than-in-2000-chart-of-the-day-122715863.html
2026-05-09 12:27:15+00:00,LRCX,Yahoo Finance,The Nasdaq's top winners are now running hotter than in 2000: Chart of the Day,https://finance.yahoo.com/markets/article/the-nasdaqs-top-winners-are-now-running-hotter-than-in-2000-chart-of-the-day-122715863.html
2026-05-09 12:27:15+00:00,MSTR,Yahoo Finance,The Nasdaq's top winners are now running hotter than in 2000: Chart of the Day,https://finance.yahoo.com/markets/article/the-nasdaqs-top-winners-are-now-running-hotter-than-in-2000-chart-of-the-day-122715863.html
2026-05-09 12:27:15+00:00,ADBE,Yahoo Finance,The Nasdaq's top winners are now running hotter than in 2000: Chart of the Day,https://finance.yahoo.com/markets/article/the-nasdaqs-top-winners-are-now-running-hotter-than-in-2000-chart-of-the-day-122715863.html
2026-05-09 12:27:15+00:00,ADI,Yahoo Finance,The Nasdaq's top winners are now running hotter than in 2000: Chart of the Day,https://finance.yahoo.com/markets/article/the-nasdaqs-top-winners-are-now-running-hotter-than-in-2000-chart-of-the-day-122715863.html
2026-05-09 12:35:26+00:00,INSM,Simply Wall St.,Here's What Analysts Are Forecasting For Insmed Incorporated (NASDAQ:INSM) After Its First-Quarter Results,https://finance.yahoo.com/markets/stocks/articles/heres-analysts-forecasting-insmed-incorporated-123526607.html
2026-05-09 13:00:24+00:00,ARM,24/7 Wall St.,ARM vs. INTC: Which AI-Era Semiconductor Stock Will Reward Patient Investors?,https://finance.yahoo.com/markets/stocks/articles/arm-vs-intc-ai-era-130024725.html
2026-05-09 13:10:28+00:00,WDC,Simply Wall St.,Western Digital's (NASDAQ:WDC) Shareholders Should Assess Earnings With Caution,https://finance.yahoo.com/markets/stocks/articles/western-digitals-nasdaq-wdc-shareholders-131028322.html
2026-05-09 13:15:02+00:00,PYPL,Barchart,PayPal Faces a Brutal Reality: 3 Real Problems Hurting the Stock Now,https://finance.yahoo.com/markets/stocks/articles/paypal-faces-brutal-reality-3-131502822.html
2026-05-09 13:27:14+00:00,STX,Simply Wall St.,Seagate Technology Holdings (NASDAQ:STX) Posted Healthy Earnings But There Are Some Other Factors To Be Aware Of,https://finance.yahoo.com/markets/stocks/articles/seagate-technology-holdings-nasdaq-stx-132714520.html
2026-05-09 13:30:02+00:00,COST,Barchart,Costco Stock Is Benefiting from a Jump in April Sales. It Can Thank the Strait of Hormuz.,https://finance.yahoo.com/markets/stocks/articles/costco-stock-benefiting-jump-april-133002926.html
2026-05-09 14:07:25+00:00,ISRG,MarketBeat,"Becton, Dickinson and Company Q2 Earnings Call Highlights",https://finance.yahoo.com/sectors/healthcare/articles/becton-dickinson-company-q2-earnings-140725211.html
2026-05-09 14:19:08+00:00,GILD,Simply Wall St.,Stronger HIV Pipeline And Acquisition Charges Might Change The Case For Investing In Gilead Sciences (GILD),https://finance.yahoo.com/sectors/healthcare/articles/stronger-hiv-pipeline-acquisition-charges-141908747.html
2026-05-09 14:21:19+00:00,LRCX,Simply Wall St.,Is It Too Late To Consider Lam Research (LRCX) After Its Huge 1 Year Surge?,https://finance.yahoo.com/markets/stocks/articles/too-consider-lam-research-lrcx-142119229.html
2026-05-09 14:27:43+00:00,DDOG,Simply Wall St.,"Datadog, Inc. Just Beat EPS By 103%: Here's What Analysts Think Will Happen Next",https://finance.yahoo.com/markets/stocks/articles/datadog-inc-just-beat-eps-142743863.html
2026-05-09 14:44:15+00:00,APP,Simply Wall St.,AppLovin Corporation (NASDAQ:APP) First-Quarter Results Just Came Out: Here's What Analysts Are Forecasting For This Year,https://finance.yahoo.com/markets/stocks/articles/applovin-corporation-nasdaq-app-first-144415375.html
2026-05-09 14:49:34+00:00,INTU,Insider Monkey,Is Intuit Inc. (INTU) One of the Best American AI Stocks to Buy Now?,https://finance.yahoo.com/markets/stocks/articles/intuit-inc-intu-one-best-144934970.html
2026-05-09 14:49:40+00:00,CTSH,Insider Monkey,CrowdStrike Holdings (CRWD) Expands Cybersecurity Coalition with Additional Partners,https://finance.yahoo.com/markets/stocks/articles/crowdstrike-holdings-crwd-expands-cybersecurity-144940925.html
2026-05-09 14:49:40+00:00,CRWD,Insider Monkey,CrowdStrike Holdings (CRWD) Expands Cybersecurity Coalition with Additional Partners,https://finance.yahoo.com/markets/stocks/articles/crowdstrike-holdings-crwd-expands-cybersecurity-144940925.html
2026-05-09 15:00:12+00:00,SBUX,Benzinga,"A Mom Complains Her College Graduate Daughter Is Wasting Money On Starbucks. Dave Ramsey Asks, 'In 30 Days, You Want To Fix 4 Years Of Damage?'",https://finance.yahoo.com/markets/articles/mom-complains-her-college-graduate-150012946.html
2026-05-09 15:07:00+00:00,TMUS,TheStreet,T-Mobile lifts a frustrating perk restriction for Costco members,https://finance.yahoo.com/markets/stocks/articles/t-mobile-lifts-frustrating-perk-150700606.html
2026-05-09 15:07:00+00:00,COST,TheStreet,T-Mobile lifts a frustrating perk restriction for Costco members,https://finance.yahoo.com/markets/stocks/articles/t-mobile-lifts-frustrating-perk-150700606.html
2026-05-09 15:07:26+00:00,SBUX,MarketBeat,Dutch Bros Q1 Earnings Call Highlights,https://finance.yahoo.com/markets/stocks/articles/dutch-bros-q1-earnings-call-150726256.html
2026-05-09 15:09:51+00:00,LIN,Simply Wall St.,Assessing Linde (LIN) Valuation After Recent Share Price Softness And Modest Undervaluation Signals,https://finance.yahoo.com/markets/stocks/articles/assessing-linde-lin-valuation-recent-150951918.html
2026-05-09 15:10:56+00:00,PCAR,Simply Wall St.,How Dividend Hike Amid Softer Sales Will Impact PACCAR (PCAR) Investors,https://finance.yahoo.com/markets/stocks/articles/dividend-hike-amid-softer-sales-151056143.html
2026-05-09 16:00:00+00:00,MSTR,TheStreet,America’s oldest bank raises stake at MicroStrategy,https://finance.yahoo.com/markets/crypto/articles/america-oldest-bank-raises-stake-160000992.html
2026-05-09 16:16:49+00:00,REGN,Simply Wall St.,Regeneron’s Otarmeni Win Links Gene Therapy Ambition With ESG Commitments,https://finance.yahoo.com/sectors/healthcare/articles/regeneron-otarmeni-win-links-gene-161649671.html
2026-05-09 16:34:52+00:00,TXN,reddit.com/r/stocks,"$TXN - Analog manufacturer is raising prices on their products - ""Texas Instruments May 7, 2026 Dear Valued Partner: We are writing to inform you of upcoming adjustments to our product pricing. The new prices will apply to all orders and shipments, effective July 1, 2026. We are sharing this notice with you in advance to maintain transparency and ensure consistency in pricing for subsequent orders and payments. This price adjustment will impact multiple products",
2026-05-09 17:24:26+00:00,META,reddit.com/r/stocks,"""Tokenmaxxing"" - How AI demand is inflated by deliberately wasteful & subsidized usage. At least $6 Billion+ a year in waste - At many large companies, AI usage is tracked, and has become a metric/target to measure employee productivity. In a weak job market for knowledge workers, performance reviews tied to AI usage, and frequent mass layoffs, this has led to substantial waste and artificial demand by employees seeking to appear productive. **Notable examples:** **Disney/ESPN**:",
2026-05-09 17:24:26+00:00,COST,reddit.com/r/stocks,"""Tokenmaxxing"" - How AI demand is inflated by deliberately wasteful & subsidized usage. At least $6 Billion+ a year in waste - At many large companies, AI usage is tracked, and has become a metric/target to measure employee productivity. In a weak job market for knowledge workers, performance reviews tied to AI usage, and frequent mass layoffs, this has led to substantial waste and artificial demand by employees seeking to appear productive. **Notable examples:** **Disney/ESPN**:",
2026-05-09 18:13:25+00:00,WDAY,Simply Wall St.,How The Workday (WDAY) Story Is Shifting As AI Ambitions Meet Slower Growth Concerns,https://finance.yahoo.com/markets/stocks/articles/workday-wday-story-shifting-ai-181325057.html
2026-05-09 18:19:48+00:00,META,reddit.com/r/stocks,"Could Meta be a fad? - This may get a bit sociological, but when I’m looking at the longterm health of Meta, I wonder whether Facebook/Instagram may fall out of popularity. In discussions of Insta/FB, I see a prevailing opinion that: “they kinda suck but they’re ingrained in society forever” and I wonder whether this is actually true. Is it not entirely possible that people will increasingly recognize the negatives of posting/scrolling (thus seeing ads)",
2026-05-09 18:36:21+00:00,SNDK,Insider Monkey,Jim Cramer Highlights Stocks Like Sandisk Are “Making You So Much Money”,https://finance.yahoo.com/markets/stocks/articles/jim-cramer-highlights-stocks-sandisk-183621371.html
2026-05-09 18:36:27+00:00,DDOG,Insider Monkey,Jim Cramer Says “You Can’t Really Teach an Old Dog New Tricks Unless It’s a Datadog”,https://finance.yahoo.com/markets/stocks/articles/jim-cramer-says-t-really-183627769.html
2026-05-09 18:36:38+00:00,ADBE,Insider Monkey,Jim Cramer on Salesforce: “It’s Tough Because the Market Hates Software”,https://finance.yahoo.com/markets/stocks/articles/jim-cramer-salesforce-tough-because-183638905.html
2026-05-09 18:36:38+00:00,WDAY,Insider Monkey,Jim Cramer on Salesforce: “It’s Tough Because the Market Hates Software”,https://finance.yahoo.com/markets/stocks/articles/jim-cramer-salesforce-tough-because-183638905.html
2026-05-09 18:36:41+00:00,KHC,Insider Monkey,Jim Cramer Discusses Kraft Heinz Rally After Better Than Expected Earnings,https://finance.yahoo.com/markets/stocks/articles/jim-cramer-discusses-kraft-heinz-183641577.html
2026-05-09 18:36:46+00:00,ARM,Insider Monkey,Jim Cramer on Taiwan Semi: “They Have More Business Than They Can Handle”,https://finance.yahoo.com/markets/stocks/articles/jim-cramer-taiwan-semi-more-183646491.html
2026-05-09 18:47:00+00:00,TXN,TheStreet,Analysts turn heads with AMD stock forecast after massive rally,https://finance.yahoo.com/markets/stocks/articles/analysts-turn-heads-amd-stock-184700616.html
2026-05-09 18:47:54+00:00,SHOP,Insider Monkey,Jim Cramer on Shopify: “You Want to Buy It When the Stock’s Ice Cold”,https://finance.yahoo.com/markets/stocks/articles/jim-cramer-shopify-want-buy-184754746.html
2026-05-09 19:04:30+00:00,AVGO,24/7 Wall St.,BlackRock’s Larry Fink Says AI Is Creating a New Trillion Dollar Asset Class — And Trump’s Policies May Accelerate It,https://finance.yahoo.com/sectors/technology/articles/blackrock-larry-fink-says-ai-190430516.html
2026-05-09 19:05:30+00:00,VRSK,TechCrunch,GM agrees to pay $12.75M in California driver privacy settlement,https://finance.yahoo.com/sectors/technology/articles/gm-agrees-pay-12-75m-190530221.html
2026-05-09 19:06:13+00:00,CTAS,MarketBeat,"AMETEK Shareholders Back Board as Company Highlights Record 2025, Strong Q1",https://finance.yahoo.com/markets/stocks/articles/ametek-shareholders-back-board-company-190613717.html
2026-05-09 19:11:24+00:00,ARM,Simply Wall St.,Arm Holdings (NasdaqGS:ARM) Valuation Check After Record AI-Driven Earnings And Post-Results Volatility,https://finance.yahoo.com/markets/stocks/articles/arm-holdings-nasdaqgs-arm-valuation-191124818.html
2026-05-09 19:29:26+00:00,ABNB,Skift,"Expedia Spent $279 Million on Acquisitions in Q1, Airbnb Gained $70 Million on Tiqets Deal: Scoop",https://finance.yahoo.com/markets/stocks/articles/expedia-spent-279-million-acquisitions-192926831.html
2026-05-09 20:04:32+00:00,CTAS,MarketBeat,AMETEK Bets $5 Billion on Indicor Deal to Boost Industrial Tech Portfolio,https://finance.yahoo.com/markets/stocks/articles/ametek-bets-5-billion-indicor-200432724.html
2026-05-09 20:07:44+00:00,TTWO,Simply Wall St.,Did GTA VI’s Premium Pricing and 2026 Outlook Just Shift Take-Two Interactive’s (TTWO) Investment Narrative?,https://finance.yahoo.com/markets/stocks/articles/did-gta-vi-premium-pricing-200744524.html
