timestamp,ticker,source,text,url
2025-08-14 12:01:00+00:00,CRWD,Business Wire,"CrowdStrike Unveils Falcon Next-Gen Identity Security, the First Unified Solution to Protect Every Identity Across the Attack Chain",https://finance.yahoo.com/news/crowdstrike-unveils-falcon-next-gen-120100444.html
2025-08-14 12:02:15+00:00,SBUX,Fox Business,Starbucks CEO sets new time goal for baristas making your order,https://finance.yahoo.com/news/starbucks-ceo-sets-time-goal-120215592.html
2025-08-14 12:03:45+00:00,ON,reddit.com/r/stocks,"Bill ackman is looking to make a 1-3B acquisition and it can be announced soon. Any guesses? - on a recent CC Bill Ackman for HHH mentioned that he was looking to acquire a 1-3B+ insurance co following the model of Warren Buffett. It is expected that an announcement can happen anytime soon/weeks prior to his annual meeting on Sep 30. the reason why Warren outperforms the market & loves insurance, is because insurers reinvests",
2025-08-14 12:20:00+00:00,NFLX,Zacks,5 Discretionary Stocks to Boost Your Portfolio on Rising Rate Cut Hopes,https://finance.yahoo.com/news/5-discretionary-stocks-boost-portfolio-122000894.html
2025-08-14 12:21:00+00:00,LULU,PR Newswire,A Great Day in the Stoke Presented by Lexus Returns to Surf City USA for Fourth Annual Celebration of Black Surf Culture on September 27,https://finance.yahoo.com/news/great-day-stoke-presented-lexus-122100248.html
2025-08-14 12:24:30+00:00,COST,MT Newswires,Market Chatter: Costco Wholesale Chooses Not to Sell Abortion Pill,https://finance.yahoo.com/news/market-chatter-costco-wholesale-chooses-122430933.html
2025-08-14 12:32:00+00:00,CSX,PR Newswire,Invictus Foundation™ Receives Grant from CSX to Install a Behavioral Telehealth Platform in its Southeastern Regional Welcome Home Network and Continue the Capital Construction Planning for Eight Regional TBI & Behavioral Health Centers Across the Nation,https://finance.yahoo.com/news/invictus-foundation-receives-grant-csx-123200441.html
2025-08-14 12:32:00+00:00,CEG,Zacks,How Should You Play Constellation Energy Stock Post Q2 Earnings Beat?,https://finance.yahoo.com/news/play-constellation-energy-stock-post-123200394.html
2025-08-14 12:35:11+00:00,ON,reddit.com/r/stocks,"PPI for final demand advances 0.9% in July; services rise 1.1%, goods increase 0.7% - [PPI for final demand advances 0.9% in July; services rise 1.1%, goods increase 0.7%](https://www.bls.gov/news.release/ppi.nr0.htm) 08/14/2025 The Producer Price Index for final demand rose 0.9 percent in July. Prices for final demand services advanced 1.1 percent, and the index for final demand goods increased 0.7 percent. On an unadjusted basis, the index for final demand moved up 3.3 percent for the",
2025-08-14 12:37:38+00:00,ADBE,Simply Wall St.,E-Commerce Update - ECommerce Market Growth Driven By Technology And Consumer Trends,https://finance.yahoo.com/news/e-commerce-ecommerce-market-growth-123738345.html
2025-08-14 12:52:00+00:00,ON,GlobeNewswire,Enovix Appoints Veteran Semiconductor Leader J. Daniel “Dan” McCranie to its Board of Directors,https://finance.yahoo.com/news/enovix-appoints-veteran-semiconductor-leader-125200982.html
2025-08-14 12:54:00+00:00,MRVL,PR Newswire,Marvell Completes Divestiture of Automotive Ethernet Business to Infineon for $2.5 Billion in All-Cash Transaction,https://finance.yahoo.com/news/marvell-completes-divestiture-automotive-ethernet-125400578.html
2025-08-14 13:00:00+00:00,FTNT,GlobeNewswire,"Next-Generation Firewall Market Surges to $8.6 billion by 2028 - Dominated by Palo Alto Networks (US), Cisco (US), Fortinet (US)",https://finance.yahoo.com/news/next-generation-firewall-market-surges-130000956.html
2025-08-14 13:00:00+00:00,ABNB,TechCrunch,Airbnb will allow US users to book stays without paying up front,https://finance.yahoo.com/news/airbnb-allow-us-users-book-130000282.html
2025-08-14 13:00:00+00:00,CHTR,Business Wire,Introducing Hisense Channels: A New Streaming Service for Hisense Smart TVs Powered by Xumo Enterprise,https://finance.yahoo.com/news/introducing-hisense-channels-streaming-hisense-130000062.html
2025-08-14 13:00:00+00:00,FTNT,PR Newswire,Malwarebytes Appoints Kendra Krause as General Manager of ThreatDown Business Unit,https://finance.yahoo.com/news/malwarebytes-appoints-kendra-krause-general-130000076.html
2025-08-14 13:00:00+00:00,COST,GlobeNewswire,"74% OF U.S. CONSUMERS VALUE “CLEAN LIVING,” NUMERATOR REPORTS",https://finance.yahoo.com/news/74-u-consumers-value-clean-130000054.html
2025-08-14 13:00:00+00:00,WDAY,Business Wire,O'Reilly Achieves Workday Certified Integration and Joins the Workday Marketplace to Support Workforces in Building Critical Tech and Business Skills,https://finance.yahoo.com/news/oreilly-achieves-workday-certified-integration-130000575.html
2025-08-14 13:00:00+00:00,CMCSA,Business Wire,Introducing Hisense Channels: A New Streaming Service for Hisense Smart TVs Powered by Xumo Enterprise,https://finance.yahoo.com/news/introducing-hisense-channels-streaming-hisense-130000062.html
2025-08-14 13:00:00+00:00,ORLY,Business Wire,O'Reilly Achieves Workday Certified Integration and Joins the Workday Marketplace to Support Workforces in Building Critical Tech and Business Skills,https://finance.yahoo.com/news/oreilly-achieves-workday-certified-integration-130000575.html
2025-08-14 13:00:00+00:00,ZS,GlobeNewswire,"Next-Generation Firewall Market Surges to $8.6 billion by 2028 - Dominated by Palo Alto Networks (US), Cisco (US), Fortinet (US)",https://finance.yahoo.com/news/next-generation-firewall-market-surges-130000956.html
2025-08-14 13:00:00+00:00,MAR,PR Newswire,"Marriott Executive Apartments Expands in Malaysia, Introducing an Enriching Urban Retreat in the Heart of Kuala Lumpur",https://finance.yahoo.com/news/marriott-executive-apartments-expands-malaysia-130000984.html
2025-08-14 13:00:03+00:00,TTD,Zacks,Here is What to Know Beyond Why The Trade Desk (TTD) is a Trending Stock,https://finance.yahoo.com/news/know-beyond-why-trade-desk-130003012.html
2025-08-14 13:04:29+00:00,ARM,Investing.com,AMD/ARM continue to gain share over INTC- report,https://finance.yahoo.com/news/amd-arm-continue-gain-share-130429734.html
2025-08-14 13:05:00+00:00,DASH,PR Newswire,DoorDash and Ace Pickleball Club Announce Multi-Year Partnership to Bring On-Demand Convenience to Club Members Nationwide,https://finance.yahoo.com/news/doordash-ace-pickleball-club-announce-130500035.html
2025-08-14 13:10:02+00:00,WDAY,Zacks,"Lifeward (LFWD) Reports Q2 Loss, Lags Revenue Estimates",https://finance.yahoo.com/news/lifeward-lfwd-reports-q2-loss-131002708.html
2025-08-14 13:19:00+00:00,CRWD,Motley Fool,3 Top Tech Stocks to Buy in August,https://finance.yahoo.com/news/3-top-tech-stocks-buy-131900047.html
2025-08-14 13:19:00+00:00,ASML,Motley Fool,3 Top Tech Stocks to Buy in August,https://finance.yahoo.com/news/3-top-tech-stocks-buy-131900047.html
2025-08-14 13:30:00+00:00,WDAY,GlobeNewswire,"Cloud Computing Market Surges to $2,281.1 billion by 2030 - Dominated by Microsoft (US), Google (US), IBM (US)",https://finance.yahoo.com/news/cloud-computing-market-surges-2-133000144.html
2025-08-14 13:30:00+00:00,ADBE,GlobeNewswire,"Cloud Computing Market Surges to $2,281.1 billion by 2030 - Dominated by Microsoft (US), Google (US), IBM (US)",https://finance.yahoo.com/news/cloud-computing-market-surges-2-133000144.html
2025-08-14 13:30:01+00:00,DDOG,Zacks,Is It Worth Investing in Datadog (DDOG) Based on Wall Street's Bullish Views?,https://finance.yahoo.com/news/worth-investing-datadog-ddog-based-133001871.html
2025-08-14 13:30:03+00:00,PDD,Zacks,Is It Worth Investing in PDD Holdings Inc. Sponsored ADR (PDD) Based on Wall Street's Bullish Views?,https://finance.yahoo.com/news/worth-investing-pdd-holdings-inc-133003472.html
2025-08-14 13:32:00+00:00,MRVL,PR Newswire,Infineon successfully completes acquisition of Marvell's Automotive Ethernet business,https://finance.yahoo.com/news/infineon-successfully-completes-acquisition-marvells-133200674.html
2025-08-14 13:35:02+00:00,DDOG,Zacks,"Datadog (DDOG) Loses 7.6% in 4 Weeks, Here's Why a Trend Reversal May be Around the Corner",https://finance.yahoo.com/news/datadog-ddog-loses-7-6-133502277.html
2025-08-14 13:40:02+00:00,AMGN,Zacks,Why Amgen (AMGN) is a Top Value Stock for the Long-Term,https://finance.yahoo.com/news/why-amgen-amgn-top-value-134002964.html
2025-08-14 13:40:04+00:00,WBD,Zacks,Are You a Value Investor? This 1 Stock Could Be the Perfect Pick,https://finance.yahoo.com/news/value-investor-1-stock-could-134004988.html
2025-08-14 13:40:39+00:00,FTNT,The Fly,"Kratos, CVS Health upgraded: Wall Street's top analyst calls",https://finance.yahoo.com/news/kratos-cvs-health-upgraded-wall-134039760.html
2025-08-14 13:40:39+00:00,LRCX,The Fly,"Kratos, CVS Health upgraded: Wall Street's top analyst calls",https://finance.yahoo.com/news/kratos-cvs-health-upgraded-wall-134039760.html
2025-08-14 13:45:28+00:00,ORLY,TipRanks,"C3 AI downgraded, Capri upgraded: Wall Street’s top analyst calls",https://finance.yahoo.com/news/c3-ai-downgraded-capri-upgraded-134528564.html
2025-08-14 13:46:15+00:00,SBUX,Benzinga,"'If I Passed Away Tomorrow, That Debt Disappears'—A 23-Year-Old With $300K In Debt Isn't Stressed As Long As She Gets Her Daily Starbucks",https://finance.yahoo.com/news/passed-away-tomorrow-debt-disappears-134615222.html
2025-08-14 13:47:00+00:00,HON,GlobeNewswire,"Personal Protective Equipment Company Evaluation Report 2025 | Honeywell, DuPont, and 3M Lead with Innovations Across Advanced Materials, Industrial Technologies, and Sustainability Solutions",https://finance.yahoo.com/news/personal-protective-equipment-company-evaluation-134700031.html
2025-08-14 14:00:00+00:00,BKNG,PR Newswire,Booking.com Launches Credit Card That Makes It Easier to Earn and Use Rewards for Travel,https://finance.yahoo.com/news/booking-com-launches-credit-card-140000892.html
2025-08-14 14:00:00+00:00,CMCSA,Sportico,LA28 Selling Venue Naming Rights in Push for $2.5B Sponsorship Goal,https://finance.yahoo.com/news/la28-selling-venue-naming-rights-140000413.html
2025-08-14 14:00:00+00:00,SHOP,GlobeNewswire,Omnisend Named “Best Overall Email Marketing Company” By MarTech Breakthrough,https://finance.yahoo.com/news/omnisend-named-best-overall-email-140000519.html
2025-08-14 14:00:00+00:00,CMCSA,PR Newswire,Comcast Unveils New $5.9 Million Florida Region Headquarters in West Palm Beach,https://finance.yahoo.com/news/comcast-unveils-5-9-million-140000397.html
2025-08-14 14:00:02+00:00,ROST,Zacks,Ross Stores (ROST) Expected to Beat Earnings Estimates: Should You Buy?,https://finance.yahoo.com/news/ross-stores-rost-expected-beat-140002453.html
2025-08-14 14:01:00+00:00,PEP,PR Newswire,"Functional Foods Market Surges to USD 654.45 Billion by 2033, Propelled by 10.4% CAGR - Verified Market Reports®",https://finance.yahoo.com/news/functional-foods-market-surges-usd-140100548.html
2025-08-14 14:02:46+00:00,CMCSA,Associated Press Finance,LA Olympics to sell naming rights to some venues in game-changing deal for 2028,https://finance.yahoo.com/news/la-olympics-sell-naming-rights-140246177.html
2025-08-14 14:02:46+00:00,INTU,Associated Press Finance,LA Olympics to sell naming rights to some venues in game-changing deal for 2028,https://finance.yahoo.com/news/la-olympics-sell-naming-rights-140246177.html
2025-08-14 14:04:11+00:00,ON,Barchart,Stocks Fall Back on Hot PPI Report,https://finance.yahoo.com/news/stocks-fall-back-hot-ppi-140411273.html
2025-08-14 14:04:11+00:00,NXPI,Barchart,Stocks Fall Back on Hot PPI Report,https://finance.yahoo.com/news/stocks-fall-back-hot-ppi-140411273.html
2025-08-14 14:04:11+00:00,MCHP,Barchart,Stocks Fall Back on Hot PPI Report,https://finance.yahoo.com/news/stocks-fall-back-hot-ppi-140411273.html
2025-08-14 14:05:00+00:00,ADBE,Business Wire,"Anoki Named ""Best Overall CTV Solution Provider"" in 2025 MarTech Breakthrough Awards",https://finance.yahoo.com/news/anoki-named-best-overall-ctv-140500952.html
2025-08-14 14:10:00+00:00,ZS,Zacks,Palo Alto Networks' Pre-Q4 Earnings Analysis: Hold or Fold the Stock?,https://finance.yahoo.com/news/palo-alto-networks-pre-q4-141000692.html
2025-08-14 14:10:00+00:00,CRWD,Zacks,Palo Alto Networks' Pre-Q4 Earnings Analysis: Hold or Fold the Stock?,https://finance.yahoo.com/news/palo-alto-networks-pre-q4-141000692.html
2025-08-14 14:12:00+00:00,CDNS,Zacks,"RADCOM Q2 Earnings Beat on Robust Top-Line Traction, View Reiterated",https://finance.yahoo.com/news/radcom-q2-earnings-beat-robust-141200494.html
2025-08-14 14:15:00+00:00,ADBE,Zacks,"CDNS, NVDA Team Up to Advance Billion-Gate AI Design Power Analysis",https://finance.yahoo.com/news/cdns-nvda-team-advance-billion-141500491.html
2025-08-14 14:15:00+00:00,CDNS,Zacks,"CDNS, NVDA Team Up to Advance Billion-Gate AI Design Power Analysis",https://finance.yahoo.com/news/cdns-nvda-team-advance-billion-141500491.html
2025-08-14 14:15:00+00:00,LULU,Motley Fool,3 Absurdly Cheap Stocks That Haven't Been Trading This Low in Years,https://finance.yahoo.com/news/3-absurdly-cheap-stocks-havent-141500838.html
2025-08-14 14:24:11+00:00,SHOP,TheStreet,Bitcoin miner alleges Stripe cut them off as Trump bans crypto debanking,https://finance.yahoo.com/news/bitcoin-miner-alleges-stripe-cut-142411235.html
2025-08-14 14:25:00+00:00,NFLX,Zacks,NFLX vs. ROKU: Which Ad-Supported Streaming Stock is the Better Buy?,https://finance.yahoo.com/news/nflx-vs-roku-ad-supported-142500791.html
2025-08-14 14:29:00+00:00,TEAM,GlobeNewswire,"Application Lifecycle Management Company Evaluation Report | Microsoft, Atlassian, and IBM Lead with Cloud-Driven, Secure, and Scalable Solutions",https://finance.yahoo.com/news/application-lifecycle-management-company-evaluation-142900654.html
2025-08-14 14:38:00+00:00,ORLY,Barrons.com,Advance Auto Parts Stock Skids After Earnings Beat. Here’s Why.,https://www.barrons.com/articles/advance-auto-parts-earnings-stock-price-85480cc1?siteid=yhoof2&yptr=yahoo
2025-08-14 14:42:07+00:00,ON,reddit.com/r/stocks,CoreWeave plays? - Is anyone else watching CoreWeave (CRWV) right now? Just dropped 20% yesterday and there is some volatility surrounding a lockup that expires today. I have a buy limit set right now but was curious on others thoughts or if anyone holds this currently,
2025-08-14 14:43:00+00:00,CRWD,Zacks,Will ARR Surge & Customer Migration Drive CYBR Subscription Revenues?,https://finance.yahoo.com/news/arr-surge-customer-migration-drive-144300098.html
2025-08-14 14:43:17+00:00,LRCX,TheStreet,Stock Market Today: Stocks punished after disappointing PPI delivers gut punch,https://finance.yahoo.com/news/stock-market-today-stocks-gyrate-144317096.html
2025-08-14 14:48:30+00:00,GOOGL,reddit.com/r/stocks,"Bridgewater Retreats From China, Shifts Billions Into US Mega-Cap Tech - Bridgewater Associates exited its holdings in U.S.-listed Chinese companies in the second quarter, signaling a decisive retreat as geopolitical tensions and shifting sentiment darkened the outlook for the world’s second-largest economy. According to its August 13 13F filing, the hedge fund sold positions in 16 Chinese stocks worth $1.41 billion, including e-commerce giants Alibaba Group BABA -3.42% , JD.com JD -2.98% , and PDD",
2025-08-14 14:48:30+00:00,META,reddit.com/r/stocks,"Bridgewater Retreats From China, Shifts Billions Into US Mega-Cap Tech - Bridgewater Associates exited its holdings in U.S.-listed Chinese companies in the second quarter, signaling a decisive retreat as geopolitical tensions and shifting sentiment darkened the outlook for the world’s second-largest economy. According to its August 13 13F filing, the hedge fund sold positions in 16 Chinese stocks worth $1.41 billion, including e-commerce giants Alibaba Group BABA -3.42% , JD.com JD -2.98% , and PDD",
2025-08-14 14:48:30+00:00,MSFT,reddit.com/r/stocks,"Bridgewater Retreats From China, Shifts Billions Into US Mega-Cap Tech - Bridgewater Associates exited its holdings in U.S.-listed Chinese companies in the second quarter, signaling a decisive retreat as geopolitical tensions and shifting sentiment darkened the outlook for the world’s second-largest economy. According to its August 13 13F filing, the hedge fund sold positions in 16 Chinese stocks worth $1.41 billion, including e-commerce giants Alibaba Group BABA -3.42% , JD.com JD -2.98% , and PDD",
2025-08-14 14:48:30+00:00,ON,reddit.com/r/stocks,"Bridgewater Retreats From China, Shifts Billions Into US Mega-Cap Tech - Bridgewater Associates exited its holdings in U.S.-listed Chinese companies in the second quarter, signaling a decisive retreat as geopolitical tensions and shifting sentiment darkened the outlook for the world’s second-largest economy. According to its August 13 13F filing, the hedge fund sold positions in 16 Chinese stocks worth $1.41 billion, including e-commerce giants Alibaba Group BABA -3.42% , JD.com JD -2.98% , and PDD",
2025-08-14 14:48:30+00:00,PDD,reddit.com/r/stocks,"Bridgewater Retreats From China, Shifts Billions Into US Mega-Cap Tech - Bridgewater Associates exited its holdings in U.S.-listed Chinese companies in the second quarter, signaling a decisive retreat as geopolitical tensions and shifting sentiment darkened the outlook for the world’s second-largest economy. According to its August 13 13F filing, the hedge fund sold positions in 16 Chinese stocks worth $1.41 billion, including e-commerce giants Alibaba Group BABA -3.42% , JD.com JD -2.98% , and PDD",
2025-08-14 14:48:30+00:00,NVDA,reddit.com/r/stocks,"Bridgewater Retreats From China, Shifts Billions Into US Mega-Cap Tech - Bridgewater Associates exited its holdings in U.S.-listed Chinese companies in the second quarter, signaling a decisive retreat as geopolitical tensions and shifting sentiment darkened the outlook for the world’s second-largest economy. According to its August 13 13F filing, the hedge fund sold positions in 16 Chinese stocks worth $1.41 billion, including e-commerce giants Alibaba Group BABA -3.42% , JD.com JD -2.98% , and PDD",
2025-08-14 14:50:00+00:00,MELI,Zacks,MercadoLibre Faces Margin Strain: Should You Hold or Fold the Stock?,https://finance.yahoo.com/news/mercadolibre-faces-margin-strain-hold-145000011.html
2025-08-14 14:57:00+00:00,DASH,Zacks,"DASH Benefits From Expanding Clientele: Buy, Hold, or Sell the Stock?",https://finance.yahoo.com/news/dash-benefits-expanding-clientele-buy-145700024.html
2025-08-14 14:58:55+00:00,COST,Yahoo Finance,Amazon could seize market share and drive down fees with its latest grocery bet,https://finance.yahoo.com/news/amazon-could-seize-market-share-and-drive-down-fees-with-its-latest-grocery-bet-145855380.html
2025-08-14 14:58:55+00:00,DASH,Yahoo Finance,Amazon could seize market share and drive down fees with its latest grocery bet,https://finance.yahoo.com/news/amazon-could-seize-market-share-and-drive-down-fees-with-its-latest-grocery-bet-145855380.html
2025-08-14 15:02:00+00:00,INTU,Zacks,CDNS Stock Gains 25% in a Year: Stay Invested or Book Profits?,https://finance.yahoo.com/news/cdns-stock-gains-25-stay-150200106.html
2025-08-14 15:02:00+00:00,CDNS,Zacks,CDNS Stock Gains 25% in a Year: Stay Invested or Book Profits?,https://finance.yahoo.com/news/cdns-stock-gains-25-stay-150200106.html
2025-08-14 15:02:00+00:00,SNPS,Zacks,CDNS Stock Gains 25% in a Year: Stay Invested or Book Profits?,https://finance.yahoo.com/news/cdns-stock-gains-25-stay-150200106.html
2025-08-14 15:05:38+00:00,TTD,Investing.com,Trade Desk shares drop on report of Walmart advertising deal change,https://finance.yahoo.com/news/trade-desk-shares-drop-report-150538782.html
2025-08-14 15:07:00+00:00,WBD,PR Newswire,"Salute the Troops Announces October Vetrepreneur Project Cohort with $8,500 in Awards for Veteran Business Owners",https://finance.yahoo.com/news/salute-troops-announces-october-vetrepreneur-150700331.html
2025-08-14 15:13:00+00:00,PYPL,Zacks,Fiserv Stock Plummets 42% in 6 Months: Should You Play or Let It Go?,https://finance.yahoo.com/news/fiserv-stock-plummets-42-6-151300228.html
2025-08-14 15:28:57+00:00,NFLX,Barchart,This Turnaround Stock Has Tripled from Its 52-Week Lows: Is It Still a Buy?,https://finance.yahoo.com/news/turnaround-stock-tripled-52-week-152857435.html
2025-08-14 15:40:02+00:00,SHOP,Zacks,LYFT vs. SHOP: Which Stock Should Value Investors Buy Now?,https://finance.yahoo.com/news/lyft-vs-shop-stock-value-154002865.html
2025-08-14 15:42:03+00:00,TTD,MT Newswires,Top Midday Stories: Stocks Fall on Hot July PPI Print; Deere Lowers Top-End Guidance for Full-Year Net Income,https://finance.yahoo.com/news/top-midday-stories-stocks-fall-154203107.html
2025-08-14 15:49:48+00:00,DASH,Yahoo Finance,Cisco remains under pressure as it hops on the AI train: Opening Bid top takeaway,https://finance.yahoo.com/news/cisco-remains-under-pressure-as-it-hops-on-the-ai-train-opening-bid-top-takeaway-154948242.html
2025-08-14 15:49:48+00:00,COST,Yahoo Finance,Cisco remains under pressure as it hops on the AI train: Opening Bid top takeaway,https://finance.yahoo.com/news/cisco-remains-under-pressure-as-it-hops-on-the-ai-train-opening-bid-top-takeaway-154948242.html
2025-08-14 15:50:55+00:00,MCHP,Barchart,Stocks Are Mixed After Hot PPI Report,https://finance.yahoo.com/news/stocks-mixed-hot-ppi-report-155055508.html
2025-08-14 15:50:55+00:00,MRVL,Barchart,Stocks Are Mixed After Hot PPI Report,https://finance.yahoo.com/news/stocks-mixed-hot-ppi-report-155055508.html
2025-08-14 15:50:55+00:00,ON,Barchart,Stocks Are Mixed After Hot PPI Report,https://finance.yahoo.com/news/stocks-mixed-hot-ppi-report-155055508.html
2025-08-14 16:00:00+00:00,EA,Business Wire,"EA SPORTS™ Madden NFL 26 Launches Worldwide Today—Powered by Real NFL Data, and Unleashing the Most Explosive and Immersive NFL Experience Yet",https://finance.yahoo.com/news/ea-sports-madden-nfl-26-160000630.html
2025-08-14 16:13:06+00:00,DXCM,Barchart,DexCom Stock: Analyst Estimates & Ratings,https://finance.yahoo.com/news/dexcom-stock-analyst-estimates-ratings-161306866.html
2025-08-14 17:06:00+00:00,ARM,Zacks,"Arm Holdings Shares Up 15% in 2025: Is it Time to Buy, Hold, or Sell?",https://finance.yahoo.com/news/arm-holdings-shares-15-2025-170600645.html
2025-08-14 17:06:00+00:00,QCOM,Zacks,"Arm Holdings Shares Up 15% in 2025: Is it Time to Buy, Hold, or Sell?",https://finance.yahoo.com/news/arm-holdings-shares-15-2025-170600645.html
2025-08-14 17:14:28+00:00,MU,Investor's Business Daily,"Nvidia, AMD, Other AI Stocks Score Price-Target Hikes Amid Strong AI Server Demand",https://www.investors.com/news/technology/ai-stocks-score-price-target-hikes-strong-server-sales/?src=A00220&yptr=yahoo
2025-08-14 17:18:56+00:00,EA,Simply Wall St.,Electronic Arts (EA) Launches EA SPORTS FC 26 ICONs Including Zlatan Ibrahimovic,https://finance.yahoo.com/news/electronic-arts-ea-launches-ea-171856852.html
2025-08-14 17:22:00+00:00,FTNT,Barrons.com,"Software Stocks Feel the Blues, But Some Look Set To Rebound",https://www.barrons.com/articles/software-stocks-feel-the-blues-gitlab-fortinet-circle-applovin-8a13b252?siteid=yhoof2&yptr=yahoo
2025-08-14 17:22:00+00:00,APP,Barrons.com,"Software Stocks Feel the Blues, But Some Look Set To Rebound",https://www.barrons.com/articles/software-stocks-feel-the-blues-gitlab-fortinet-circle-applovin-8a13b252?siteid=yhoof2&yptr=yahoo
2025-08-14 17:26:55+00:00,CMCSA,Simply Wall St.,Comcast (CMCSA) Unveils New Florida Headquarters And Launches Soccer-Centric Package,https://finance.yahoo.com/news/comcast-cmcsa-unveils-florida-headquarters-172655800.html
2025-08-14 17:31:36+00:00,ON,reddit.com/r/stocks,"Coherent Corp announces sale of Aerospace and Defense unit, stock immediately drops 25% - For a company already 3.7 billion in debt they must be getting desperate for funds if they’re willing to sell their entire military arm. There definitely seemed like a pre news release pump rising almost 40% in the preceding 3 months. Seems fishy, is this company on its way out? They just brought in a new CEO pulling in 104m a",
2025-08-14 17:31:36+00:00,ARM,reddit.com/r/stocks,"Coherent Corp announces sale of Aerospace and Defense unit, stock immediately drops 25% - For a company already 3.7 billion in debt they must be getting desperate for funds if they’re willing to sell their entire military arm. There definitely seemed like a pre news release pump rising almost 40% in the preceding 3 months. Seems fishy, is this company on its way out? They just brought in a new CEO pulling in 104m a",
2025-08-14 17:36:00+00:00,AEP,GlobeNewswire,Hope Utilities to Construct Natural Gas Pipeline in Ohio to Power Data Center Project,https://finance.yahoo.com/news/hope-utilities-construct-natural-gas-173600096.html
2025-08-14 17:38:29+00:00,AXON,Simply Wall St.,Axon Enterprise (AXON) Reports Q2 Revenue Climb To US$669 Million,https://finance.yahoo.com/news/axon-enterprise-axon-reports-q2-173829096.html
2025-08-14 17:39:00+00:00,NXPI,Simply Wall St.,NXP Semiconductors (NXPI) Updates Buyback Program with 1.1 Million Shares Repurchased,https://finance.yahoo.com/news/nxp-semiconductors-nxpi-updates-buyback-173900361.html
2025-08-14 17:42:27+00:00,DASH,Simply Wall St.,DoorDash (DASH) Strengthens Partnerships With Ace Pickleball Club And McDonald's,https://finance.yahoo.com/news/doordash-dash-strengthens-partnerships-ace-174227528.html
2025-08-14 17:57:37+00:00,TTD,reddit.com/r/stocks,TTD dieing out. May be going much lower - Here we are a week out from the big drop and this stock hasnt had any strength. Im one to love to catch knifes but this one's sliced so hard I needed to drop it. Not only did we see that their losing a potential marketing war with amazon meta etc.. We see that with much lower growth next qtr (14%). To add salt to the,
