timestamp,ticker,source,text,url
2026-05-04 15:50:00+00:00,PCAR,MarketBeat,"Dividend Boosters: Qualcomm, Southern , PACCAR Add Juice to Yields",https://finance.yahoo.com/markets/stocks/articles/dividend-boosters-qualcomm-southern-paccar-155000833.html
2026-05-04 15:50:50+00:00,SBUX,Entrepreneur,Subway Had to Close 729 More Stores — But Executives Say It’s About Finding ‘the Right Locations’,https://finance.yahoo.com/markets/stocks/articles/subway-had-close-729-more-155050414.html
2026-05-04 15:55:00+00:00,MPWR,Zacks,Cirrus Logic to Release Q4 Earnings: Here's What to Expect,https://finance.yahoo.com/markets/stocks/articles/cirrus-logic-release-q4-earnings-155500113.html
2026-05-04 15:55:00+00:00,ADI,Zacks,Cirrus Logic to Release Q4 Earnings: Here's What to Expect,https://finance.yahoo.com/markets/stocks/articles/cirrus-logic-release-q4-earnings-155500113.html
2026-05-04 15:56:00+00:00,PEP,Zacks,Can Productivity Savings Shield PepsiCo From Inflation Pressures?,https://finance.yahoo.com/markets/stocks/articles/productivity-savings-shield-pepsico-inflation-155600777.html
2026-05-04 15:58:00+00:00,DDOG,Barrons.com,Datadog Builds Strong Base As Technical Setup Favors Breakout,https://www.barrons.com/articles/datadog-stock-builds-strong-base-technical-setup-favors-breakout-1ba40dbb?siteid=yhoof2&yptr=yahoo
2026-05-04 16:00:02+00:00,NXPI,Zacks,NXP (NXPI) Upgraded to Buy: What Does It Mean for the Stock?,https://finance.yahoo.com/markets/stocks/articles/nxp-nxpi-upgraded-buy-does-160002840.html
2026-05-04 16:00:05+00:00,NXPI,Zacks,Here's Why NXP Semiconductors (NXPI) is a Great Momentum Stock to Buy,https://finance.yahoo.com/markets/stocks/articles/heres-why-nxp-semiconductors-nxpi-160005674.html
2026-05-04 16:04:00+00:00,MAR,Zacks,Marriott to Report Q1 Earnings: What's in the Offing for the Stock?,https://finance.yahoo.com/markets/stocks/articles/marriott-report-q1-earnings-whats-160400019.html
2026-05-04 16:09:27+00:00,PEP,MT Newswires,"UTZ Brands Set for In-Line Q1 Amid Noisy Quarter, Tough Environment Persists, RBC Says",https://finance.yahoo.com/markets/stocks/articles/utz-brands-set-line-q1-160927949.html
2026-05-04 16:10:02+00:00,CRWD,Zacks,Will CrowdStrike (CRWD) Beat Estimates Again in Its Next Earnings Report?,https://finance.yahoo.com/markets/stocks/articles/crowdstrike-crwd-beat-estimates-again-161002568.html
2026-05-04 16:12:31+00:00,DDOG,Schaeffer's Investment Research,Datadog Stock Crosses Over Key Trendline Before Earnings,https://finance.yahoo.com/markets/stocks/articles/datadog-stock-crosses-over-key-161231741.html
2026-05-04 16:13:00+00:00,TMUS,Barrons.com,Why AT&T Stock Is (Still) a Top Pick for J.P. Morgan,https://www.barrons.com/articles/att-stock-price-jpmorgan-pick-524a3552?siteid=yhoof2&yptr=yahoo
2026-05-04 16:15:17+00:00,PAYX,Simply Wall St.,Assessing Paychex (PAYX) Valuation After Dividend Hike And AI Focused HCM Expansion,https://finance.yahoo.com/markets/stocks/articles/assessing-paychex-payx-valuation-dividend-161517533.html
2026-05-04 16:17:39+00:00,SBUX,Insider Monkey,"Jim Cramer Big, Explosive Prediction About Starbucks (SBUX)",https://finance.yahoo.com/markets/stocks/articles/jim-cramer-big-explosive-prediction-161739857.html
2026-05-04 16:20:03+00:00,STX,Zacks,Earnings Estimates Moving Higher for Seagate (STX): Time to Buy?,https://finance.yahoo.com/markets/stocks/articles/earnings-estimates-moving-higher-seagate-162003873.html
2026-05-04 16:20:45+00:00,STX,Insider Monkey,"Seagate (STX) is Enjoying the Current Environment, Says Jim Cramer",https://finance.yahoo.com/markets/stocks/articles/seagate-stx-enjoying-current-environment-162045283.html
2026-05-04 16:21:06+00:00,GEHC,Insider Monkey,Jim Cramer Can’t Believe What’s Happening With GE Healthcare (GEHC),https://finance.yahoo.com/sectors/healthcare/articles/jim-cramer-t-believe-happening-162106541.html
2026-05-04 16:31:00+00:00,ABNB,WSJ,Redesigning America's Digital Infrastructure,https://finance.yahoo.com/video/redesigning-americas-digital-infrastructure-163100411.html
2026-05-04 16:34:00+00:00,CMCSA,HR Dive,"Coca-Cola, Comcast advance long-time employees into top HR roles",https://finance.yahoo.com/sectors/healthcare/articles/coca-cola-comcast-advance-long-163400624.html
2026-05-04 16:39:57+00:00,SBUX,Insider Monkey,Jim Cramer Makes Big Prediction About Alphabet (GOOGL),https://finance.yahoo.com/markets/stocks/articles/jim-cramer-makes-big-prediction-163957880.html
2026-05-04 16:45:02+00:00,STX,Zacks,Looking for a Growth Stock? 3 Reasons Why Seagate (STX) is a Solid Choice,https://finance.yahoo.com/markets/stocks/articles/looking-growth-stock-3-reasons-164502987.html
2026-05-04 17:01:32+00:00,MRVL,Trefis,Marvell Stock: A 16% Yield Trade With A 46% Margin of Safety,https://finance.yahoo.com/markets/options/articles/marvell-stock-16-yield-trade-170132526.html
2026-05-04 17:02:27+00:00,VRTX,Motley Fool,Vertex (VRTX) Q2 2025 Earnings Call Transcript,https://finance.yahoo.com/sectors/healthcare/articles/vertex-vrtx-q2-2025-earnings-170227066.html
2026-05-04 17:15:00+00:00,PEP,Motley Fool,"Activist Pressure Is Growing on Consumer Staples Giants. Is General Mills a Buy, Sell, or Hold?",https://finance.yahoo.com/markets/stocks/articles/activist-pressure-growing-consumer-staples-171500037.html
2026-05-04 17:20:14+00:00,WDC,Barchart,Seagate and Western Digital Are a Hard Disk Drive Duopoly. Barchart Ranks the Storage Stocks Here.,https://finance.yahoo.com/markets/stocks/articles/seagate-western-digital-hard-disk-172014167.html
2026-05-04 17:20:14+00:00,STX,Barchart,Seagate and Western Digital Are a Hard Disk Drive Duopoly. Barchart Ranks the Storage Stocks Here.,https://finance.yahoo.com/markets/stocks/articles/seagate-western-digital-hard-disk-172014167.html
2026-05-04 17:31:21+00:00,MCHP,GuruFocus.com,Morgan Stanley Lifts Targets on Semiconductor Stocks,https://finance.yahoo.com/sectors/technology/articles/morgan-stanley-lifts-targets-semiconductor-173121215.html
2026-05-04 17:35:00+00:00,NFLX,MarketBeat,"Netflix, Pulte, and Mobileye Are Buying Their Own Dips—Should You?",https://finance.yahoo.com/markets/stocks/articles/netflix-pulte-mobileye-buying-own-173500111.html
2026-05-04 17:35:00+00:00,WBD,MarketBeat,"Netflix, Pulte, and Mobileye Are Buying Their Own Dips—Should You?",https://finance.yahoo.com/markets/stocks/articles/netflix-pulte-mobileye-buying-own-173500111.html
2026-05-04 17:36:59+00:00,TXN,24/7 Wall St.,Texas Instruments or ON Semiconductor: Which Analog Chip Stock Won in April?,https://finance.yahoo.com/markets/stocks/articles/texas-instruments-semiconductor-analog-chip-173659745.html
2026-05-04 17:38:07+00:00,MELI,Simply Wall St.,MercadoLibre And 2 Other Stocks That May Be Priced Below Their Estimated Value,https://finance.yahoo.com/markets/stocks/articles/mercadolibre-2-other-stocks-may-173807878.html
2026-05-04 17:39:00+00:00,IDXX,Zacks,DENTSPLY SIRONA to Post Q1 Earnings: What's in Store for the Stock?,https://finance.yahoo.com/markets/stocks/articles/dentsply-sirona-post-q1-earnings-173900340.html
2026-05-04 17:53:01+00:00,CSCO,MT Newswires,Sector Update: Tech Stocks Edge Higher Monday Afternoon,https://finance.yahoo.com/sectors/technology/articles/sector-tech-stocks-edge-higher-175301203.html
2026-05-04 17:58:59+00:00,AMGN,MT Newswires,Sector Update: Health Care Stocks Softer in Afternoon Trading,https://finance.yahoo.com/sectors/healthcare/articles/sector-health-care-stocks-softer-175859856.html
2026-05-04 18:00:00+00:00,CSX,GlobeNewswire,Revised Filing Does Not Address Competitive Balance Issues Created By UP-NS Merger,https://finance.yahoo.com/economy/policy/articles/revised-filing-does-not-address-180000217.html
2026-05-04 18:13:05+00:00,ABNB,MT Newswires,"Equities Fall Intraday, Oil Prices Climb as Traders Monitor Middle East Developments",https://finance.yahoo.com/markets/stocks/articles/equities-fall-intraday-oil-prices-181305437.html
2026-05-04 18:13:40+00:00,CSCO,24/7 Wall St.,"Want $2,200 in Passive Income? Invest $50,000 Into These 3 Dividend Stocks",https://finance.yahoo.com/markets/stocks/articles/want-2-200-passive-income-181340580.html
2026-05-04 18:14:39+00:00,ISRG,Simply Wall St.,Assessing Intuitive Surgical (ISRG) Valuation As Recent Share Price Weakness Meets Strong Long Term Returns,https://finance.yahoo.com/markets/stocks/articles/assessing-intuitive-surgical-isrg-valuation-181439294.html
2026-05-04 18:21:08+00:00,NXPI,Insider Monkey,Jim Cramer Discusses Market Momentum for On Semi,https://finance.yahoo.com/markets/stocks/articles/jim-cramer-discusses-market-momentum-182108813.html
2026-05-04 18:21:28+00:00,SBUX,Insider Monkey,Jim Cramer on Dutch Bros: “It’s Been a Serial Upside Surpriser”,https://finance.yahoo.com/markets/stocks/articles/jim-cramer-dutch-bros-serial-182128809.html
2026-05-04 18:25:47+00:00,PANW,Trefis,Cisco’s Path To $106,https://finance.yahoo.com/markets/stocks/articles/cisco-path-106-182547017.html
2026-05-04 18:25:47+00:00,CSCO,Trefis,Cisco’s Path To $106,https://finance.yahoo.com/markets/stocks/articles/cisco-path-106-182547017.html
2026-05-04 18:38:23+00:00,CSX,Barchart,What Are Wall Street Analysts' Target Price for CSX Corporation Stock?,https://finance.yahoo.com/markets/stocks/articles/wall-street-analysts-target-price-183823888.html
2026-05-04 18:51:53+00:00,XEL,Simply Wall St.,The Xcel Energy Inc. (NASDAQ:XEL) First-Quarter Results Are Out And Analysts Have Published New Forecasts,https://finance.yahoo.com/markets/stocks/articles/xcel-energy-inc-nasdaq-xel-185153029.html
2026-05-04 19:11:09+00:00,BKR,Simply Wall St.,Equinor Supplier Extensions Support Offshore Output But Valuation Signals Caution,https://finance.yahoo.com/sectors/energy/articles/equinor-supplier-extensions-support-offshore-191109090.html
2026-05-04 19:34:45+00:00,CSGP,Investing.com,CoStar CEO boosts stake after activist exit and earnings beat,https://finance.yahoo.com/markets/stocks/articles/costar-ceo-boosts-stake-activist-193445514.html
2026-05-04 19:52:06+00:00,LRCX,24/7 Wall St.,KLA Is Gaining Share as AI Chip Complexity Drives Up Yield Costs,https://finance.yahoo.com/sectors/technology/articles/kla-gaining-share-ai-chip-195206327.html
2026-05-04 19:52:06+00:00,AMAT,24/7 Wall St.,KLA Is Gaining Share as AI Chip Complexity Drives Up Yield Costs,https://finance.yahoo.com/sectors/technology/articles/kla-gaining-share-ai-chip-195206327.html
2026-05-04 19:52:06+00:00,KLAC,24/7 Wall St.,KLA Is Gaining Share as AI Chip Complexity Drives Up Yield Costs,https://finance.yahoo.com/sectors/technology/articles/kla-gaining-share-ai-chip-195206327.html
2026-05-04 19:52:52+00:00,AMD,Yahoo Finance,"AMD stock soars on Q1 earnings beat, better-than-expected outlook amid strong AI chip demand",https://finance.yahoo.com/sectors/technology/article/amd-stock-soars-on-q1-earnings-beat-better-than-expected-outlook-amid-strong-ai-chip-demand-195252267.html
2026-05-04 19:53:37+00:00,CSCO,MT Newswires,Sector Update: Tech Stocks Mixed Late Afternoon,https://finance.yahoo.com/markets/stocks/articles/sector-tech-stocks-mixed-afternoon-195337088.html
2026-05-04 19:58:38+00:00,FAST,reddit.com/r/stocks,"US considering AI regulation, does this change the trade? - The US government is discussing potential regulation for new AI models, including setting up a dedicated working group and possibly introducing a formal review process. That alone feels like a pretty clear shift in tone, moving from mostly encouraging growth to something more like “grow, but with oversight.” From a long term perspective, some level of regulation probably isn’t a bad thing. AI touches on",
2026-05-04 20:01:00+00:00,FANG,GlobeNewswire,"Diamondback Energy, Inc. Announces First Quarter 2026 Financial and Operating Results; Increases Base Dividend and Production Guidance",https://finance.yahoo.com/sectors/energy/articles/diamondback-energy-inc-announces-first-200100460.html
2026-05-04 20:01:00+00:00,FANG,GlobeNewswire,"Viper Energy, Inc., a Subsidiary of Diamondback Energy, Inc., Reports First Quarter 2026 Financial and Operating Results",https://finance.yahoo.com/markets/stocks/articles/viper-energy-inc-subsidiary-diamondback-200100659.html
2026-05-04 20:05:00+00:00,MRVL,Business Wire,"Marvell Technology, Inc. Announces Conference Call to Review First Quarter of Fiscal Year 2027 Financial Results",https://finance.yahoo.com/markets/stocks/articles/marvell-technology-inc-announces-conference-200500901.html
2026-05-04 20:05:00+00:00,STX,Business Wire,Seagate to Participate in Upcoming Investor Events,https://finance.yahoo.com/markets/stocks/articles/seagate-participate-upcoming-investor-events-200500077.html
2026-05-04 20:06:36+00:00,COST,Bloomberg,Trump Administration Targets Dismantling of Already-Weakened DEI,https://finance.yahoo.com/economy/policy/articles/dei-programs-dwindling-trump-administration-101518951.html
2026-05-04 20:07:49+00:00,WDC,Barchart,"Dear Western Digital Stock Fans, Mark Your Calendars for June 5",https://finance.yahoo.com/markets/stocks/articles/dear-western-digital-stock-fans-200749174.html
2026-05-04 20:11:31+00:00,FANG,StockStory,Diamondback Energy (NASDAQ:FANG) Posts Better-Than-Expected Sales In Q1 CY2026,https://finance.yahoo.com/sectors/energy/articles/diamondback-energy-nasdaq-fang-posts-201131447.html
2026-05-04 20:12:06+00:00,TTWO,Investing.com,Take-Two CEO calls Grand Theft Auto VI launch exciting and terrifying,https://finance.yahoo.com/markets/stocks/articles/two-ceo-calls-grand-theft-201206638.html
2026-05-04 20:14:24+00:00,PLTR,reddit.com/r/stocks,"Palantir Q1 revenue jumps 85% to record on booming US business - From yahoo finance Palantir Technologies ([PLTR](https://finance.yahoo.com/quote/PLTR)) stock rose in after-hours trading after the company reported record Q1 revenue and profit that topped analyst estimates, driven by surging sales to commercial clients and the US government sector. The company’s revenue jumped 85% in the first three months of this year to $1.63 billion, beating the consensus estimate of $1.53 billion, according to Bloomberg data.",
2026-05-04 20:20:55+00:00,CDNS,StockStory,The Top 5 Analyst Questions From Cadence Design Systems’s Q1 Earnings Call,https://finance.yahoo.com/markets/stocks/articles/top-5-analyst-questions-cadence-202055029.html
2026-05-04 20:21:44+00:00,VRTX,StockStory,Vertex Pharmaceuticals (NASDAQ:VRTX) Beats Q1 CY2026 Sales Expectations,https://finance.yahoo.com/markets/stocks/articles/vertex-pharmaceuticals-nasdaq-vrtx-beats-202144667.html
2026-05-04 20:24:00+00:00,ODFL,Barrons.com,Amazon Opens Shipping Business to All Comers. FedEx Stock Tumbles.,https://www.barrons.com/articles/fedex-stock-price-amazon-supply-chain-solutions-shipping-ups-d25855a9?siteid=yhoof2&yptr=yahoo
2026-05-04 20:31:23+00:00,WBD,Quartz,"Paramount Q1 2026 earnings beat estimates, streaming profits rise",https://finance.yahoo.com/markets/stocks/articles/paramount-q1-2026-earnings-beat-203123396.html
2026-05-04 20:34:05+00:00,WDC,Investor's Business Daily,These Nine S&P 500 Stocks Have Doubled In 2026. No. 3 Reports On Tuesday.,https://www.investors.com/news/sp-500-stocks-doubled-in-2026-sandisk-intel-lumentum/?src=A00220&yptr=yahoo
2026-05-04 20:34:05+00:00,STX,Investor's Business Daily,These Nine S&P 500 Stocks Have Doubled In 2026. No. 3 Reports On Tuesday.,https://www.investors.com/news/sp-500-stocks-doubled-in-2026-sandisk-intel-lumentum/?src=A00220&yptr=yahoo
2026-05-04 20:44:38+00:00,ABNB,MT Newswires,"S&P 500, Nasdaq Retreat From Record, Oil Jumps Amid Renewed US-Iran Tensions",https://finance.yahoo.com/markets/stocks/articles/p-500-nasdaq-retreat-record-204438005.html
2026-05-04 20:48:28+00:00,SBUX,Yahoo Finance Video,Roz Brewer on bridging college and corporate America at Milken 2026,https://finance.yahoo.com/video/roz-brewer-on-bridging-college-and-corporate-america-at-milken-2026-204828621.html
2026-05-04 21:07:40+00:00,LRCX,24/7 Wall St.,"Bernstein Analyst: AI Agents Drive Chip Demand ‘Off the Charts,’ Supply Can’t Keep Up",https://finance.yahoo.com/sectors/technology/articles/bernstein-analyst-ai-agents-drive-210740589.html
2026-05-04 21:07:40+00:00,KLAC,24/7 Wall St.,"Bernstein Analyst: AI Agents Drive Chip Demand ‘Off the Charts,’ Supply Can’t Keep Up",https://finance.yahoo.com/sectors/technology/articles/bernstein-analyst-ai-agents-drive-210740589.html
2026-05-04 21:07:40+00:00,ASML,24/7 Wall St.,"Bernstein Analyst: AI Agents Drive Chip Demand ‘Off the Charts,’ Supply Can’t Keep Up",https://finance.yahoo.com/sectors/technology/articles/bernstein-analyst-ai-agents-drive-210740589.html
2026-05-04 21:10:01+00:00,FANG,Zacks,Diamondback Energy (FANG) Q1 Earnings and Revenues Beat Estimates,https://finance.yahoo.com/sectors/energy/articles/diamondback-energy-fang-q1-earnings-211001228.html
2026-05-04 21:11:52+00:00,SNPS,Simply Wall St.,Assessing Synopsys (SNPS) Valuation After Recent Share Price Momentum And Ansys Integration Story,https://finance.yahoo.com/markets/stocks/articles/assessing-synopsys-snps-valuation-recent-211152571.html
2026-05-04 21:20:04+00:00,VRTX,Zacks,Vertex Pharmaceuticals (VRTX) Q1 Earnings and Revenues Beat Estimates,https://finance.yahoo.com/markets/stocks/articles/vertex-pharmaceuticals-vrtx-q1-earnings-212004762.html
2026-05-04 21:26:53+00:00,FANG,Motley Fool,"Stock Market Today, May 4: Oil Spikes and Stocks Fall as Geopolitical Tensions Flare",https://finance.yahoo.com/markets/stocks/articles/stock-market-today-may-4-212653408.html
2026-05-04 21:30:01+00:00,FANG,Zacks,"Compared to Estimates, Diamondback (FANG) Q1 Earnings: A Look at Key Metrics",https://finance.yahoo.com/markets/stocks/articles/compared-estimates-diamondback-fang-q1-213001454.html
2026-05-04 21:36:55+00:00,SBUX,Fortune,"Starbucks CEO gets roasted for $9 ‘premium experience’ remarks, but Wall Street toasts his tariff-era turnaround strategy",https://finance.yahoo.com/markets/stocks/articles/starbucks-ceo-gets-roasted-9-213655784.html
2026-05-04 21:38:00+00:00,WBD,Barrons.com,GameStop Is Smaller Than eBay. Little Fish Have Gobbled Up Big Ones Before.,https://www.barrons.com/articles/gamestop-ebay-stock-merger-35e078ae?siteid=yhoof2&yptr=yahoo
2026-05-04 21:38:00+00:00,CHTR,Barrons.com,GameStop Is Smaller Than eBay. Little Fish Have Gobbled Up Big Ones Before.,https://www.barrons.com/articles/gamestop-ebay-stock-merger-35e078ae?siteid=yhoof2&yptr=yahoo
2026-05-04 21:42:08+00:00,INTU,Motley Fool,3 Absurdly Cheap Growth Stocks to Buy in May 2026,https://finance.yahoo.com/markets/stocks/articles/3-absurdly-cheap-growth-stocks-214208293.html
2026-05-04 21:45:03+00:00,ZS,Zacks,Zscaler (ZS) Ascends While Market Falls: Some Facts to Note,https://finance.yahoo.com/markets/stocks/articles/zscaler-zs-ascends-while-market-214503626.html
2026-05-04 21:45:03+00:00,PDD,Zacks,PDD Holdings Inc. Sponsored ADR (PDD) Dips More Than Broader Market: What You Should Know,https://finance.yahoo.com/markets/stocks/articles/pdd-holdings-inc-sponsored-adr-214503610.html
2026-05-04 21:45:03+00:00,SNPS,Zacks,Synopsys (SNPS) Increases Despite Market Slip: Here's What You Need to Know,https://finance.yahoo.com/markets/stocks/articles/synopsys-snps-increases-despite-market-214503096.html
2026-05-04 21:45:05+00:00,INTU,Zacks,Intuit (INTU) Advances While Market Declines: Some Information for Investors,https://finance.yahoo.com/markets/stocks/articles/intuit-intu-advances-while-market-214505402.html
2026-05-04 21:50:06+00:00,AMAT,Zacks,Lattice Semiconductor (LSCC) Q1 Earnings and Revenues Beat Estimates,https://finance.yahoo.com/markets/stocks/articles/lattice-semiconductor-lscc-q1-earnings-215006750.html
2026-05-04 22:00:02+00:00,VRTX,Zacks,Vertex (VRTX) Reports Q1 Earnings: What Key Metrics Have to Say,https://finance.yahoo.com/markets/stocks/articles/vertex-vrtx-reports-q1-earnings-220002626.html
2026-05-04 22:05:15+00:00,FANG,Fortune,Top U.S. oil producer declares ‘green’ light on drilling for more oil amid Iran war,https://finance.yahoo.com/sectors/energy/articles/top-u-oil-producer-declares-220515614.html
2026-05-04 22:09:02+00:00,PEP,Simply Wall St.,PepsiCo Balances Human Rights Scrutiny With Health Focused Product Expansion,https://finance.yahoo.com/markets/stocks/articles/pepsico-balances-human-rights-scrutiny-220902761.html
2026-05-04 22:10:03+00:00,FANG,Simply Wall St.,How The Diamondback Energy (FANG) Narrative Is Shifting With New Oil Assumptions And Valuation Calls,https://finance.yahoo.com/sectors/energy/articles/diamondback-energy-fang-narrative-shifting-221003119.html
2026-05-04 22:15:02+00:00,ADSK,Zacks,Autodesk (ADSK) Increases Despite Market Slip: Here's What You Need to Know,https://finance.yahoo.com/markets/stocks/articles/autodesk-adsk-increases-despite-market-221502944.html
2026-05-04 22:17:50+00:00,VRTX,Motley Fool,Vertex (VRTX) Q1 2026 Earnings Call Transcript,https://finance.yahoo.com/sectors/healthcare/articles/vertex-vrtx-q1-2026-earnings-221750774.html
2026-05-04 22:26:27+00:00,PANW,Motley Fool,"Stock Market Today, May 4: BlackBerry Jumps After QNX Software Momentum Boosts Turnaround Optimism",https://finance.yahoo.com/markets/stocks/articles/stock-market-today-may-4-222627781.html
2026-05-04 22:26:27+00:00,CSCO,Motley Fool,"Stock Market Today, May 4: BlackBerry Jumps After QNX Software Momentum Boosts Turnaround Optimism",https://finance.yahoo.com/markets/stocks/articles/stock-market-today-may-4-222627781.html
2026-05-04 22:59:07+00:00,ISRG,Motley Fool,UFP Tech (UFPT) Q2 2025 Earnings Transcript,https://finance.yahoo.com/sectors/healthcare/articles/ufp-tech-ufpt-q2-2025-225907931.html
2026-05-04 23:15:55+00:00,WBD,LA Times,Paramount's Ellison underscores his pledge to make 30 films a year when his company buys Warner Bros.,https://finance.yahoo.com/markets/stocks/articles/paramounts-ellison-underscores-pledge-30-231555878.html
2026-05-04 23:39:42+00:00,SBUX,Yahoo Finance,"Former Walgreens CEO Roz Brewer: Don't 'AI proof' higher education, embrace it",https://finance.yahoo.com/markets/article/former-walgreens-ceo-roz-brewer-dont-ai-proof-higher-education-embrace-it-233942264.html
2026-05-05 00:00:00+00:00,CTSH,PR Newswire,JG Summit selects Cognizant for ServiceNow implementation and managed services engagement,https://finance.yahoo.com/sectors/technology/articles/jg-summit-selects-cognizant-servicenow-000000464.html
2026-05-05 00:00:00+00:00,XEL,SEC-EDGAR-8K,"(Item 8.01) . Other Events In November 2025, Southwestern Public Service Company (SPS), a New Mexico corporation, and a wholly owned subsidiary of Xcel Energy Inc. filed an electric rate case with the New Mexico Public Regulation Commission (NMPRC) seeking a revenue increase of $168 million (16.0%) as updated in March 2026. The request is based on a future test year period ending Nov. 30, 2027, a return on equity (ROE) of 10.5%, an equity ratio of",
2026-05-05 00:00:00+00:00,MSTR,SEC-EDGAR-8K,"(Item 2.02) . Results of Operations and Financial Condition. On May 5, 2026, Strategy Inc (the “Company”) issued a press release announcing the Company’s financial results for the quarter ended March 31, 2026. A copy of this press release is attached as Exhibit 99.1 to this Current Report on Form 8-K.",
2026-05-05 00:00:00+00:00,EA,SEC-EDGAR-8K,"(Item 2.02) Result of Operations and Financial Condition. On May 5, 2026, Electronic Arts Inc. (""Electronic Arts"" or “EA”) issued a press release announcing its financial results for the fourth quarter and fiscal year ended March 31, 2026. A copy of the press release is attached hereto as Exhibit 99.1. Neither the information in this Form 8-K nor the information in the press release attached hereto as Exhibit 99.1 shall be deemed “filed” for purposes of Section

(Item 8.01) Other Events. On May 1, 2026, the Audit Committee of EA, on behalf of EA’s full Board of Directors declared a cash dividend of $0.19 per share of EA's common stock. The dividend is payable on June 17, 2026 to stockholders of record as of the close of business on May 27, 2026.",
2026-05-05 00:00:00+00:00,IDXX,SEC-EDGAR-8K,"(Item 2.02) Results of Operations and Financial Condition. On May 5, 2026, IDEXX Laboratories, Inc. (the “Company”) announced its financial results for the quarter ended March 31, 2026. The full text of the press release issued in connection with the announcement is furnished as Exhibit 99.1 to this Current Report on Form 8-K. In accordance with general instructions to Form 8-K, the information in this Form 8-K and the Exhibit 99.1 attached hereto is being furnished under

(Item 2.02) and shall not be deemed “filed” for purposes of Section 18 of the Securities Exchange Act of 1934 (the “Exchange Act”) or otherwise subject to the liabilities of that section, nor shall it be deemed incorporated by reference in any filing under the Securities Act of 1933 or the Exchange Act, except as expressly set forth by specific reference in such a filing.

(Item 2.02) shall be deemed to be furnished, and not filed. Exhibit No. Description of Exhibit 99.1 Press Release entitled “IDEXX Laboratories Announces First Quarter Results,” issued by the Company on May 5, 2026. 104 Cover Page Interactive Data File (embedded within the Inline XBRL document)",
2026-05-05 00:00:00+00:00,SHOP,SEC-EDGAR-8K,"(Item 2.02) . Results of Operations and Financial Condition. On May 5, 2026, Shopify Inc. (the ""Company"") issued a press release announcing its financial results for the quarter ended March 31, 2026. A copy of the press release is furnished as Exhibit 99.1 to this report. The information furnished with this

(Item 2.02) , including Exhibit 99.1, shall not be deemed ""filed"" for the purposes of Section 18 of the Securities Exchange Act of 1934, as amended (the ""Exchange Act""), or otherwise subject to the liabilities of that section, nor shall it be deemed incorporated by reference into any other filing under the Securities Act of 1933, as amended, or the Exchange Act, except as expressly set forth by specific reference in such a filing.",
