timestamp,ticker,source,text,url
2026-04-30 09:06:29+00:00,NFLX,Simply Wall St.,Netflix Shareholder Activism Puts Governance And Valuation In Focus,https://finance.yahoo.com/markets/stocks/articles/netflix-shareholder-activism-puts-governance-090629409.html
2026-04-30 09:13:53+00:00,TMUS,Insider Monkey,Why T-Mobile (TMUS) Just Made A Long-Term Growth Bet,https://finance.yahoo.com/markets/stocks/articles/why-t-mobile-tmus-just-091353575.html
2026-04-30 09:14:24+00:00,CTSH,Verdict,Cognizant to acquire Astreya to bolster enterprise AI infrastructure,https://finance.yahoo.com/sectors/technology/articles/cognizant-acquire-astreya-bolster-enterprise-091424925.html
2026-04-30 09:24:41+00:00,REGN,Pharmaceutical Technology,Regeneron Q1 2026 net income falls 10% to $727m,https://finance.yahoo.com/sectors/healthcare/articles/regeneron-q1-2026-net-income-092441249.html
2026-04-30 09:28:40+00:00,XEL,Insider Monkey,Why Xcel Energy (XEL) Remains On Wall Street’s Radar,https://finance.yahoo.com/sectors/energy/articles/why-xcel-energy-xel-remains-092840338.html
2026-04-30 09:53:36+00:00,NFLX,Insider Monkey,"Netflix, Inc. (NFLX) Expands Buyback Capacity with New $25B Authorization",https://finance.yahoo.com/markets/stocks/articles/netflix-inc-nflx-expands-buyback-095336338.html
2026-04-30 10:05:00+00:00,XEL,Business Wire,Xcel Energy First Quarter 2026 Earnings Report,https://finance.yahoo.com/markets/stocks/articles/xcel-energy-first-quarter-2026-100500178.html
2026-04-30 10:14:39+00:00,GILD,Simply Wall St.,Is It Time To Revisit Gilead Sciences (GILD) After Recent Share Price Pullback,https://finance.yahoo.com/markets/stocks/articles/time-revisit-gilead-sciences-gild-101439419.html
2026-04-30 10:15:43+00:00,TMUS,Simply Wall St.,Is It Time To Reassess T-Mobile US (TMUS) After Recent Share Price Volatility?,https://finance.yahoo.com/markets/stocks/articles/time-reassess-t-mobile-us-101543520.html
2026-04-30 10:47:00+00:00,KHC,Food Dive,Food giants hit with consumer lawsuit calling ultraprocessed ingredients addictive,https://finance.yahoo.com/sectors/healthcare/articles/food-giants-hit-consumer-lawsuit-104700900.html
2026-04-30 10:47:00+00:00,PEP,Food Dive,Food giants hit with consumer lawsuit calling ultraprocessed ingredients addictive,https://finance.yahoo.com/sectors/healthcare/articles/food-giants-hit-consumer-lawsuit-104700900.html
2026-04-30 11:00:00+00:00,INSM,PR Newswire,Insmed to Present at May 2026 Investor Conferences,https://finance.yahoo.com/sectors/healthcare/articles/insmed-present-may-2026-investor-110000013.html
2026-04-30 11:00:00+00:00,DASH,Business Wire,Matternet Appoints Sanjay Kotte to Board of Directors,https://finance.yahoo.com/sectors/technology/articles/matternet-appoints-sanjay-kotte-board-110000747.html
2026-04-30 11:00:00+00:00,GILD,GlobeNewswire,Kymera Therapeutics Announces First Quarter 2026 Financial Results and Provides a Business Update,https://finance.yahoo.com/sectors/healthcare/articles/kymera-therapeutics-announces-first-quarter-110000728.html
2026-04-30 11:02:34+00:00,PANW,Investor's Business Daily,"Check Point Earnings Beat, But Revenue, Billings Miss. Cybersecurity Stock Falls.",https://www.investors.com/news/technology/chkp-stock-check-point-earnings-q12026/?src=A00220&yptr=yahoo
2026-04-30 11:02:34+00:00,FTNT,Investor's Business Daily,"Check Point Earnings Beat, But Revenue, Billings Miss. Cybersecurity Stock Falls.",https://www.investors.com/news/technology/chkp-stock-check-point-earnings-q12026/?src=A00220&yptr=yahoo
2026-04-30 11:05:38+00:00,CMCSA,Simply Wall St.,Additional Considerations Required While Assessing Comcast's (NASDAQ:CMCSA) Strong Earnings,https://finance.yahoo.com/markets/stocks/articles/additional-considerations-required-while-assessing-110538637.html
2026-04-30 11:07:33+00:00,ADP,Simply Wall St.,Assessing Automatic Data Processing’s Valuation After Recent Share Price Rebound,https://finance.yahoo.com/markets/stocks/articles/assessing-automatic-data-processing-valuation-110733901.html
2026-04-30 11:10:02+00:00,PANW,Zacks,Check Point Software (CHKP) Beats Q1 Earnings Estimates,https://finance.yahoo.com/markets/stocks/articles/check-point-software-chkp-beats-111002517.html
2026-04-30 11:12:00+00:00,COST,Grocery Dive,Albertsons and its CEO face a ‘make or break’ 2026,https://finance.yahoo.com/markets/stocks/articles/albertsons-ceo-face-break-2026-111200245.html
2026-04-30 11:30:03+00:00,XEL,Zacks,Xcel Energy (XEL) Matches Q1 Earnings Estimates,https://finance.yahoo.com/markets/stocks/articles/xcel-energy-xel-matches-q1-113003378.html
2026-04-30 11:34:20+00:00,MDLZ,Barchart,Are Wall Street Analysts Bullish on Mondelez International Stock?,https://finance.yahoo.com/markets/stocks/articles/wall-street-analysts-bullish-mondelez-113420027.html
2026-04-30 11:35:00+00:00,CEG,Motley Fool,The Best Utility Stocks of 2026,https://finance.yahoo.com/markets/stocks/articles/best-utility-stocks-2026-113500383.html
2026-04-30 11:35:49+00:00,APP,Simply Wall St.,Top Growth Stocks With Notable Insider Ownership,https://finance.yahoo.com/markets/stocks/articles/top-growth-stocks-notable-insider-113549467.html
2026-04-30 11:35:49+00:00,WDAY,Simply Wall St.,Top Growth Stocks With Notable Insider Ownership,https://finance.yahoo.com/markets/stocks/articles/top-growth-stocks-notable-insider-113549467.html
2026-04-30 11:38:05+00:00,ALNY,Simply Wall St.,3 Companies That May Be Priced Below Their Estimated Value,https://finance.yahoo.com/markets/stocks/articles/3-companies-may-priced-below-113805207.html
2026-04-30 11:38:05+00:00,APP,Simply Wall St.,3 Companies That May Be Priced Below Their Estimated Value,https://finance.yahoo.com/markets/stocks/articles/3-companies-may-priced-below-113805207.html
2026-04-30 11:38:11+00:00,PANW,Simply Wall St.,High Growth Tech Stocks in the US Market to Watch,https://finance.yahoo.com/markets/stocks/articles/high-growth-tech-stocks-us-113811628.html
2026-04-30 11:38:11+00:00,ZS,Simply Wall St.,High Growth Tech Stocks in the US Market to Watch,https://finance.yahoo.com/markets/stocks/articles/high-growth-tech-stocks-us-113811628.html
2026-04-30 11:38:11+00:00,WDAY,Simply Wall St.,High Growth Tech Stocks in the US Market to Watch,https://finance.yahoo.com/markets/stocks/articles/high-growth-tech-stocks-us-113811628.html
2026-04-30 11:42:40+00:00,CDNS,24/7 Wall St.,$1 Trillion in AI Capex Is Coming. Here Are 5 Stocks That Will Feast on the Buildout,https://finance.yahoo.com/markets/stocks/articles/1-trillion-ai-capex-coming-114240432.html
2026-04-30 11:49:34+00:00,GEHC,24/7 Wall St.,"Here Are Thursday’s Top Wall Street Analyst Research Calls: AbbVie, Equinix, GE Healthcare, Kratos Defense, Meta Platforms, Oneok, Palantir Technologies, Wingstop, and More",https://finance.yahoo.com/markets/stocks/articles/thursday-top-wall-street-analyst-114934817.html
2026-04-30 11:56:34+00:00,CTSH,Barchart,Are Wall Street Analysts Bullish on Cognizant Stock?,https://finance.yahoo.com/markets/stocks/articles/wall-street-analysts-bullish-cognizant-115634742.html
2026-04-30 12:00:00+00:00,VRTX,GlobeNewswire,Vortex Energy Announces Intent to Advance Next Phase of Technical Work at the Robinsons River Salt Project and Engages Lonquist,https://finance.yahoo.com/sectors/energy/articles/vortex-energy-announces-intent-advance-120000263.html
2026-04-30 12:00:00+00:00,ALNY,Business Wire,Alnylam Pharmaceuticals Reports First Quarter 2026 Financial Results and Highlights Recent Period Progress,https://finance.yahoo.com/sectors/healthcare/articles/alnylam-pharmaceuticals-reports-first-quarter-120000812.html
2026-04-30 12:00:00+00:00,DASH,Business Wire,DoorDash Expands DashPass Beyond Delivery in Canada with Lyft Partnership,https://finance.yahoo.com/markets/stocks/articles/doordash-expands-dashpass-beyond-delivery-120000441.html
2026-04-30 12:00:00+00:00,PANW,GlobeNewswire,"Kaltura Announces ""Connect on the Road 2026 – The Enterprise is Breaking the Fourth Wall"" Conference: Join Experts from IBM, AWS, Morgan Stanley, Palo Alto Networks, MetLife, and more in Exploring the End of the Enterprise Monologue",https://finance.yahoo.com/sectors/technology/articles/kaltura-announces-connect-road-2026-120000472.html
2026-04-30 12:01:44+00:00,CHTR,Simply Wall St.,Charter Communications President Acquires 3.2% More Stock,https://finance.yahoo.com/markets/stocks/articles/charter-communications-president-acquires-3-120144358.html
2026-04-30 12:05:35+00:00,GEHC,24/7 Wall St.,GE HealthCare Just Crashed 13% on a Guidance Cut. Here’s the Case for Buying the Dip,https://finance.yahoo.com/sectors/healthcare/articles/ge-healthcare-just-crashed-13-120535407.html
2026-04-30 12:06:14+00:00,MELI,Simply Wall St.,MercadoLibre Weighs Loan Sales To Balance Mercado Pago Growth And Risk,https://finance.yahoo.com/markets/stocks/articles/mercadolibre-weighs-loan-sales-balance-120614097.html
2026-04-30 12:30:00+00:00,TRI,CNW Group,Thomson Reuters Receives Court Approval for Return of Capital and Share Consolidation Transactions,https://finance.yahoo.com/markets/stocks/articles/thomson-reuters-receives-court-approval-123000183.html
2026-04-30 12:30:00+00:00,CTSH,PR Newswire,Cognizant Named Aston Martin Aramco Formula One™ Team Global AI Services Partner,https://finance.yahoo.com/sectors/technology/articles/cognizant-named-aston-martin-aramco-123000924.html
2026-04-30 12:30:00+00:00,ORLY,Moby,"O'Reilly Automotive, Inc. Q1 2026 Earnings Call Summary",https://finance.yahoo.com/markets/stocks/articles/oreilly-automotive-inc-q1-2026-123000265.html
2026-04-30 12:30:00+00:00,KLAC,Moby,KLA Corporation Q3 2026 Earnings Call Summary,https://finance.yahoo.com/markets/stocks/articles/kla-corporation-q3-2026-earnings-123000392.html
2026-04-30 12:30:12+00:00,INSM,Zacks,"Cartesian Therapeutics, Inc. (RNAC) Reports Q1 Loss, Lags Revenue Estimates",https://finance.yahoo.com/sectors/healthcare/articles/cartesian-therapeutics-inc-rnac-reports-123012092.html
2026-04-30 12:38:20+00:00,ADBE,Simply Wall St.,E-Commerce Today - CoastalPay Resolve Partnership Enhances B2B Payment Flexibility,https://finance.yahoo.com/markets/stocks/articles/e-commerce-today-coastalpay-resolve-123820976.html
2026-04-30 12:43:36+00:00,PEP,GuruFocus.com,Tesla finally gets Semi production moving at scale,https://finance.yahoo.com/markets/stocks/articles/tesla-finally-gets-semi-production-124336920.html
2026-04-30 12:52:44+00:00,COST,24/7 Wall St.,I Can’t Stop Buying COST Stock. Here’s Why.,https://finance.yahoo.com/markets/stocks/articles/t-stop-buying-cost-stock-125244164.html
2026-04-30 12:59:00+00:00,WDAY,PR Newswire,"Cresta Names Sequoia's Doug Leone as Board Chair, Carl Eschenbach Rejoins Board as Growth Accelerates",https://finance.yahoo.com/markets/stocks/articles/cresta-names-sequoias-doug-leone-125900694.html
2026-04-30 12:59:00+00:00,MAR,PR Newswire,"Cresta Names Sequoia's Doug Leone as Board Chair, Carl Eschenbach Rejoins Board as Growth Accelerates",https://finance.yahoo.com/markets/stocks/articles/cresta-names-sequoias-doug-leone-125900694.html
2026-04-30 13:00:00+00:00,CSGP,Business Wire,CoStar Expects U.S. Industrial Vacancy to Peak in Early 2027,https://finance.yahoo.com/markets/stocks/articles/costar-expects-u-industrial-vacancy-130000394.html
2026-04-30 13:00:00+00:00,CRWD,PR Newswire,Armadin Announces Partnership with CrowdStrike to Defend Against AI Hyperattacks,https://finance.yahoo.com/sectors/technology/articles/armadin-announces-partnership-crowdstrike-defend-130000502.html
2026-04-30 13:00:00+00:00,PANW,PR Newswire,Armadin and Palo Alto Networks Partner to Deliver Autonomous External Attack Validation Inside Unit 42 Frontier AI Defense,https://finance.yahoo.com/sectors/technology/articles/armadin-palo-alto-networks-partner-130000510.html
2026-04-30 13:00:05+00:00,TTWO,Zacks,"Here is What to Know Beyond Why Take-Two Interactive Software, Inc. (TTWO) is a Trending Stock",https://finance.yahoo.com/markets/stocks/articles/know-beyond-why-two-interactive-130005534.html
2026-04-30 13:00:06+00:00,WDAY,Zacks,"Investors Heavily Search Workday, Inc. (WDAY): Here is What You Need to Know",https://finance.yahoo.com/markets/stocks/articles/investors-heavily-search-workday-inc-130006524.html
2026-04-30 13:00:07+00:00,GILD,Zacks,"Gilead Sciences, Inc. (GILD) is Attracting Investor Attention: Here is What You Should Know",https://finance.yahoo.com/markets/stocks/articles/gilead-sciences-inc-gild-attracting-130007275.html
2026-04-30 13:00:08+00:00,PEP,Zacks,"PepsiCo, Inc. (PEP) Is a Trending Stock: Facts to Know Before Betting on It",https://finance.yahoo.com/markets/stocks/articles/pepsico-inc-pep-trending-stock-130008164.html
2026-04-30 13:00:08+00:00,ABNB,Zacks,"Investors Heavily Search Airbnb, Inc. (ABNB): Here is What You Need to Know",https://finance.yahoo.com/markets/stocks/articles/investors-heavily-search-airbnb-inc-130008300.html
2026-04-30 13:00:09+00:00,HON,Simply Wall St.,Honeywell International Insiders Sold US$2.0m Of Shares Suggesting Hesitancy,https://finance.yahoo.com/markets/stocks/articles/honeywell-international-insiders-sold-us-130009683.html
2026-04-30 13:00:09+00:00,LRCX,Zacks,Lam Research Corporation (LRCX) Is a Trending Stock: Facts to Know Before Betting on It,https://finance.yahoo.com/markets/stocks/articles/lam-research-corporation-lrcx-trending-130009028.html
2026-04-30 13:09:00+00:00,FTNT,GlobeNewswire,"The Fortinet 2026 Global Threat Landscape Report Reveals a Surge in AI-Enabled Cybercrime, Contributing to a 389% Increase in Ransomware Victims Year-over-Year",https://finance.yahoo.com/sectors/technology/articles/fortinet-2026-global-threat-landscape-130900744.html
2026-04-30 13:15:05+00:00,IDXX,Zacks,What Analyst Projections for Key Metrics Reveal About Idexx (IDXX) Q1 Earnings,https://finance.yahoo.com/markets/stocks/articles/analyst-projections-key-metrics-reveal-131505831.html
2026-04-30 13:15:06+00:00,AEP,Zacks,Countdown to AEP (AEP) Q1 Earnings: A Look at Estimates Beyond Revenue and EPS,https://finance.yahoo.com/markets/stocks/articles/countdown-aep-aep-q1-earnings-131506383.html
2026-04-30 13:15:07+00:00,PYPL,Zacks,Countdown to Paypal (PYPL) Q1 Earnings: Wall Street Forecasts for Key Metrics,https://finance.yahoo.com/markets/stocks/articles/countdown-paypal-pypl-q1-earnings-131507527.html
2026-04-30 13:15:08+00:00,EA,Zacks,Gear Up for Electronic Arts (EA) Q4 Earnings: Wall Street Estimates for Key Metrics,https://finance.yahoo.com/markets/stocks/articles/gear-electronic-arts-ea-q4-131508462.html
2026-04-30 13:15:48+00:00,COST,reddit.com/r/stocks,"Meta shares slide as plan to spend billions more on AI spooks investors - Meta took the brunt of investor concerns on Wednesday over how the biggest US tech firms are spending massive sums on artificial intelligence (AI). Shares in the company, which owns Facebook and Instagram, dropped 7% in extended trading, after saying it would spend billions more on AI projects than it had initially planned. Meta, Google-owner Alphabet, Microsoft, and Amazon all reported",
2026-04-30 13:15:48+00:00,META,reddit.com/r/stocks,"Meta shares slide as plan to spend billions more on AI spooks investors - Meta took the brunt of investor concerns on Wednesday over how the biggest US tech firms are spending massive sums on artificial intelligence (AI). Shares in the company, which owns Facebook and Instagram, dropped 7% in extended trading, after saying it would spend billions more on AI projects than it had initially planned. Meta, Google-owner Alphabet, Microsoft, and Amazon all reported",
2026-04-30 13:25:02+00:00,ALNY,Zacks,Alnylam Pharmaceuticals (ALNY) Tops Q1 Earnings and Revenue Estimates,https://finance.yahoo.com/sectors/healthcare/articles/alnylam-pharmaceuticals-alny-tops-q1-132502764.html
2026-04-30 13:30:05+00:00,ASML,Zacks,Is ASML (ASML) a Buy as Wall Street Analysts Look Optimistic?,https://finance.yahoo.com/markets/stocks/articles/asml-asml-buy-wall-street-133005345.html
2026-04-30 13:30:06+00:00,XEL,Zacks,Here's What Key Metrics Tell Us About Xcel (XEL) Q1 Earnings,https://finance.yahoo.com/markets/stocks/articles/heres-key-metrics-tell-us-133006970.html
2026-04-30 13:31:00+00:00,MELI,Business Wire,"MercadoLibre, Inc. to Report First Quarter 2026 Financial Results",https://finance.yahoo.com/markets/stocks/articles/mercadolibre-inc-report-first-quarter-133100940.html
2026-04-30 13:31:56+00:00,META,reddit.com/r/stocks,"The 145 billion gamble: should I buy the Meta dip? - Are investors punishing Meta because it lacks the ""landlord"" status of Alphabet and Amazon? While they rent out their AI infrastructure to the world via Cloud services, Meta is spending $140 billion on internal tools just to keep people doom scrolling longer. Meta is still a cash-printing machine with record engagement, but without a Cloud revenue stream to offset this massive CapEx, is this",
2026-04-30 13:35:00+00:00,NFLX,Motley Fool,1 Reason Netflix's Sell-Off Is a Gift for Investors,https://finance.yahoo.com/markets/stocks/articles/1-reason-netflixs-sell-off-133500261.html
2026-04-30 13:36:40+00:00,GEHC,The Fly,"Meta downgraded, Qualcomm upgraded: Wall Street's top analyst calls",https://finance.yahoo.com/markets/stocks/articles/meta-downgraded-qualcomm-upgraded-wall-133640358.html
2026-04-30 13:39:12+00:00,SHOP,Insider Monkey,Is Shopify Inc. (SHOP) A Good Stock To Buy Now?,https://finance.yahoo.com/markets/stocks/articles/shopify-inc-shop-good-stock-133912941.html
2026-04-30 13:39:29+00:00,CRWD,Insider Monkey,"Is CrowdStrike Holdings, Inc. (CRWD) A Good Stock To Buy Now?",https://finance.yahoo.com/markets/stocks/articles/crowdstrike-holdings-inc-crwd-good-133929521.html
2026-04-30 13:54:07+00:00,APP,reddit.com/r/stocks,"Uber Expands into Travel with Hotel Bookings and New In-App Features - >NEW YORK--([BUSINESS WIRE](https://www.businesswire.com))--Uber Technologies, Inc. (NYSE: UBER), the world’s leading mobility and delivery platform, announced a new set of products and features at its annual [GO–GET product event](https://cts.businesswire.com/ct/CT?id=smartlink&url=http%3A%2F%2Fwww.uber.com%2Fgo-get&esheet=54524818&newsitemid=20260429280841&lan=en-US&anchor=GO%26%238211%3BGET+product+event&index=1&md5=81dd7b24872e960fa37c4c0235073203), including hotel bookings and new travel tools. >Among the new offerings, Uber introduced a partnership with Expedia Group (NYSE: EXPE) that allows Uber customers to book hotels directly in the Uber app, unlocking immense value",
2026-04-30 14:00:00+00:00,MAR,PR Newswire,W Hotels Continues Its Italian Expansion with the Debut of W Sardinia - Poltu Quatu,https://finance.yahoo.com/sectors/technology/articles/w-hotels-continues-italian-expansion-140000388.html
2026-04-30 14:00:00+00:00,ADBE,PR Newswire,Los Angeles Convention Center Sets New Connectivity Standard with Wi‑Fi 7 Deployment by Boldyn Networks,https://finance.yahoo.com/sectors/technology/articles/los-angeles-convention-center-sets-140000251.html
2026-04-30 14:00:02+00:00,ALNY,Zacks,Alnylam (ALNY) Reports Q1 Earnings: What Key Metrics Have to Say,https://finance.yahoo.com/markets/stocks/articles/alnylam-alny-reports-q1-earnings-140002863.html
2026-04-30 14:00:31+00:00,ABNB,Zacks,"Airbnb, Inc. (ABNB) Earnings Expected to Grow: What to Know Ahead of Next Week's Release",https://finance.yahoo.com/markets/stocks/articles/airbnb-inc-abnb-earnings-expected-140031380.html
2026-04-30 14:00:32+00:00,DASH,Zacks,Akamai Technologies (AKAM) Expected to Beat Earnings Estimates: Can the Stock Move Higher?,https://finance.yahoo.com/markets/stocks/articles/akamai-technologies-akam-expected-beat-140032513.html
2026-04-30 14:00:39+00:00,GILD,Zacks,Gilead Sciences (GILD) Reports Next Week: Wall Street Expects Earnings Growth,https://finance.yahoo.com/markets/stocks/articles/gilead-sciences-gild-reports-next-140039892.html
2026-04-30 14:00:42+00:00,INSM,Zacks,Insmed (INSM) Expected to Beat Earnings Estimates: Can the Stock Move Higher?,https://finance.yahoo.com/markets/stocks/articles/insmed-insm-expected-beat-earnings-140042463.html
2026-04-30 14:03:43+00:00,KHC,Bloomberg,Berkshire’s Ailing Share Price Clouds Abel’s First Annual Meeting as CEO,https://finance.yahoo.com/markets/stocks/articles/berkshire-ailing-share-price-clouds-100000023.html
2026-04-30 14:10:00+00:00,ODFL,Trucking Dive,"Old Dominion notes retail improvement, early optimism with industrial",https://finance.yahoo.com/markets/stocks/articles/old-dominion-notes-retail-improvement-141000013.html
2026-04-30 14:21:24+00:00,GOOGL,reddit.com/r/stocks,"AAPL has beaten earnings expectations for several quarters in a row, today’s report is definitely going to be impressive - Everyone knows that Tim Cook will step down on September 1, 2026, with John Ternus taking over. There’s no denying Tim Cook’s contributions to AAPL. Lately, some people have been throwing out strange signals, claiming he’s made Apple a joke, but they forget he’s taken AAPL to become one of the most successful and profitable",
2026-04-30 14:21:24+00:00,AAPL,reddit.com/r/stocks,"AAPL has beaten earnings expectations for several quarters in a row, today’s report is definitely going to be impressive - Everyone knows that Tim Cook will step down on September 1, 2026, with John Ternus taking over. There’s no denying Tim Cook’s contributions to AAPL. Lately, some people have been throwing out strange signals, claiming he’s made Apple a joke, but they forget he’s taken AAPL to become one of the most successful and profitable",
2026-04-30 14:22:08+00:00,CSGP,Insider Monkey,CoStar Group Inc. (CSGP): Bares Capital Is Bullish on This Stock,https://finance.yahoo.com/markets/stocks/articles/costar-group-inc-csgp-bares-142208015.html
2026-04-30 14:33:00+00:00,BKNG,Zacks,Merchant Model Strength Powers BKNG's Q1 Earnings & Revenue Growth,https://finance.yahoo.com/markets/stocks/articles/merchant-model-strength-powers-bkngs-143300005.html
2026-04-30 14:35:00+00:00,CMCSA,ACCESS Newswire,Comcast and Boys & Girls Clubs of Thurston County Open Lift Zones in Lacey to Help Youth Build Digital Skills,https://finance.yahoo.com/sectors/technology/articles/comcast-boys-girls-clubs-thurston-143500508.html
2026-04-30 14:44:10+00:00,TTWO,NYSE,Take-Two CEO Strauss Zelnick ‘Encouraged’ by AI Developments at Semafor Summit,https://finance.yahoo.com/video/two-ceo-strauss-zelnick-encouraged-144410585.html
2026-04-30 15:00:00+00:00,MNST,GlobeNewswire,"Monster Beverage to Report Financial Results for 2026 First Quarter on May 7, 2026",https://finance.yahoo.com/markets/stocks/articles/monster-beverage-report-financial-results-150000847.html
2026-04-30 15:05:06+00:00,BKNG,Simply Wall St.,Booking Holdings AI Push And Buybacks Meet Mixed Valuation Signals,https://finance.yahoo.com/markets/stocks/articles/booking-holdings-ai-push-buybacks-150506221.html
2026-04-30 15:23:48+00:00,GILD,Barchart,Gilead Sciences Stock Outlook: Is Wall Street Bullish or Bearish?,https://finance.yahoo.com/markets/stocks/articles/gilead-sciences-stock-outlook-wall-152348180.html
2026-04-30 15:35:49+00:00,VRSK,MT Newswires,"Verisk's Q1 Organic Revenue Tops Forecasts on Underwriting, Claims Strength, Morgan Stanley Says",https://finance.yahoo.com/markets/stocks/articles/verisk-apos-q1-organic-revenue-153549259.html
2026-04-30 15:40:02+00:00,NFLX,Zacks,SIRI vs. NFLX: Which Stock Is the Better Value Option?,https://finance.yahoo.com/markets/stocks/articles/siri-vs-nflx-stock-better-154002978.html
2026-04-30 15:40:02+00:00,SNPS,Zacks,PRGS vs. SNPS: Which Stock Is the Better Value Option?,https://finance.yahoo.com/markets/stocks/articles/prgs-vs-snps-stock-better-154002326.html
2026-04-30 15:41:53+00:00,KHC,Barchart,Do Wall Street Analysts Like Kraft Heinz Stock?,https://finance.yahoo.com/markets/stocks/articles/wall-street-analysts-kraft-heinz-154153232.html
2026-04-30 15:52:00+00:00,CRWD,Barrons.com,Anthropic Rattled Software Stocks. How the White House Rode to the Rescue.,https://www.barrons.com/articles/software-stocks-anthropic-mythos-crowdstrike-palo-alto-e34092d1?siteid=yhoof2&yptr=yahoo
2026-04-30 15:52:00+00:00,PANW,Barrons.com,Anthropic Rattled Software Stocks. How the White House Rode to the Rescue.,https://www.barrons.com/articles/software-stocks-anthropic-mythos-crowdstrike-palo-alto-e34092d1?siteid=yhoof2&yptr=yahoo
2026-04-30 15:55:43+00:00,NFLX,24/7 Wall St.,"Buy, Sell or Hold NFLX Stock After the Dip?",https://finance.yahoo.com/markets/stocks/articles/buy-sell-hold-nflx-stock-155543942.html
2026-04-30 15:58:00+00:00,AEP,Zacks,American Electric Power to Release Q1 Earnings: What's in the Cards?,https://finance.yahoo.com/markets/stocks/articles/american-electric-power-release-q1-155800740.html
2026-04-30 16:00:00+00:00,CDNS,Business Wire,PsiQuantum Appoints Lip-Bu Tan to Board of Directors,https://finance.yahoo.com/sectors/technology/articles/psiquantum-appoints-lip-bu-tan-160000292.html
2026-04-30 16:00:03+00:00,ROP,Zacks,Roper Technologies (ROP) Upgraded to Strong Buy: Here's What You Should Know,https://finance.yahoo.com/markets/stocks/articles/roper-technologies-rop-upgraded-strong-160003664.html
2026-04-30 16:00:03+00:00,ASML,Zacks,ASML (ASML) Upgraded to Buy: Here's Why,https://finance.yahoo.com/markets/stocks/articles/asml-asml-upgraded-buy-heres-160003903.html
2026-04-30 16:03:40+00:00,PYPL,Sourcing Journal,Field Notes: PayPal Reorganizes as AI and Quantum Reshape Commerce,https://finance.yahoo.com/sectors/technology/articles/field-notes-paypal-reorganizes-ai-160340853.html
2026-04-30 16:04:10+00:00,ALNY,MarketBeat,Alnylam Pharmaceuticals Q1 Earnings Call Highlights,https://finance.yahoo.com/sectors/healthcare/articles/alnylam-pharmaceuticals-q1-earnings-call-160410672.html
2026-04-30 16:11:00+00:00,PEP,PR Newswire,GENYOUTH AND TASTE OF THE NFL EXPAND ACCESS TO 75 MILLION SCHOOL MEALS FOR STUDENTS NATIONWIDE,https://finance.yahoo.com/sectors/healthcare/articles/genyouth-taste-nfl-expand-access-161100552.html
