timestamp,ticker,source,text,url
2026-05-04 10:00:00+00:00,ARM,Yahoo Finance,"Tech stocks today: Semiconductor company earnings in focus amid AI boom, Musk vs. Altman fight continues",https://finance.yahoo.com/sectors/technology/live/tech-stocks-today-semiconductor-earnings-ai-boom-musk-altman-fight-100000447.html
2026-05-04 10:00:00+00:00,AAPL,Yahoo Finance,"Tech stocks today: Semiconductor company earnings in focus amid AI boom, Musk vs. Altman fight continues",https://finance.yahoo.com/sectors/technology/live/tech-stocks-today-semiconductor-earnings-ai-boom-musk-altman-fight-100000447.html
2026-05-04 10:00:00+00:00,GOOG,Yahoo Finance,"Tech stocks today: Semiconductor company earnings in focus amid AI boom, Musk vs. Altman fight continues",https://finance.yahoo.com/sectors/technology/live/tech-stocks-today-semiconductor-earnings-ai-boom-musk-altman-fight-100000447.html
2026-05-04 10:00:00+00:00,META,Yahoo Finance,"Tech stocks today: Semiconductor company earnings in focus amid AI boom, Musk vs. Altman fight continues",https://finance.yahoo.com/sectors/technology/live/tech-stocks-today-semiconductor-earnings-ai-boom-musk-altman-fight-100000447.html
2026-05-04 10:00:00+00:00,MSFT,Yahoo Finance,"Tech stocks today: Semiconductor company earnings in focus amid AI boom, Musk vs. Altman fight continues",https://finance.yahoo.com/sectors/technology/live/tech-stocks-today-semiconductor-earnings-ai-boom-musk-altman-fight-100000447.html
2026-05-04 10:00:00+00:00,GOOGL,Yahoo Finance,"Tech stocks today: Semiconductor company earnings in focus amid AI boom, Musk vs. Altman fight continues",https://finance.yahoo.com/sectors/technology/live/tech-stocks-today-semiconductor-earnings-ai-boom-musk-altman-fight-100000447.html
2026-05-04 10:07:32+00:00,WMT,Simply Wall St.,Walmart Tightens Supply Chain And Beauty Offering To Support Growth Narrative,https://finance.yahoo.com/markets/stocks/articles/walmart-tightens-supply-chain-beauty-100732185.html
2026-05-04 10:08:25+00:00,ARM,MT Newswires,"US Equity Investors to Focus on Risk of Iran Ceasefire Falling Apart, Quarterly Earnings, Nonfarm Payrolls",https://finance.yahoo.com/markets/stocks/articles/us-equity-investors-focus-risk-100825908.html
2026-05-04 10:09:10+00:00,REGN,Simply Wall St.,"How The Regeneron (REGN) Narrative Is Shifting With Dupixent, Eylea And Pipeline Developments",https://finance.yahoo.com/markets/stocks/articles/regeneron-regn-narrative-shifting-dupixent-100910398.html
2026-05-04 10:16:34+00:00,ARM,MT Newswires,"Update: US Equity Investors to Focus This Week on Risk of Iran Ceasefire Falling Apart, Earnings, Nonfarm Payrolls",https://finance.yahoo.com/markets/stocks/articles/us-equity-investors-focus-week-101634033.html
2026-05-04 10:18:29+00:00,WMT,CNN Business,"GameStop makes daring $56 billion bid for eBay, hoping to rival Amazon",https://finance.yahoo.com/markets/stocks/articles/gamestop-makes-daring-56-billion-101829182.html
2026-05-04 10:20:00+00:00,QCOM,Zacks,Bear of the Day: Qualcomm (QCOM),https://finance.yahoo.com/markets/stocks/articles/bear-day-qualcomm-qcom-102000126.html
2026-05-04 10:20:00+00:00,AVGO,Motley Fool,2 Unstoppable AI Stocks Headed to $3 Trillion,https://finance.yahoo.com/markets/stocks/articles/2-unstoppable-ai-stocks-headed-102000826.html
2026-05-04 10:21:00+00:00,DASH,Marketing Dive,"DoorDash delivers memes, reality TV moms for Mother’s Day campaign",https://finance.yahoo.com/markets/stocks/articles/doordash-delivers-memes-reality-tv-102100148.html
2026-05-04 10:39:44+00:00,TSLA,Simply Wall St.,Electric Vehicles Today - Tellus Power Unveils High-Power Charging System For Fleets,https://finance.yahoo.com/sectors/energy/articles/electric-vehicles-today-tellus-power-103944481.html
2026-05-04 10:44:38+00:00,FAST,reddit.com/r/stocks,"Opnions on Hexatronic Group AB (HTRO) for Fiber + Data Centres - I would like to get a second opinion on $HTRO. It reported softer Q1 earnings last week, which led to a sharp sell-off, but the stock has since bounced as the market digested the news and is trading higher. The company is positioned downstream as a pure passive fibre infrastructure play: cables, microducts, connectors, closures, cabinets, racks + high-density data centre assemblies &",
2026-05-04 11:00:00+00:00,INSM,PR Newswire,"Insmed to Present Data Across Its Respiratory Portfolio, Including Late-Breaking ARIKAYCE® Results from Phase 3b ENCORE Study, at the American Thoracic Society International Conference 2026",https://finance.yahoo.com/sectors/healthcare/articles/insmed-present-data-across-respiratory-110000286.html
2026-05-04 11:00:02+00:00,SHOP,Barchart,Option Volatility And Earnings Report For May 4 - 8,https://finance.yahoo.com/markets/options/articles/option-volatility-earnings-report-may-110002436.html
2026-05-04 11:00:02+00:00,ARM,Barchart,Option Volatility And Earnings Report For May 4 - 8,https://finance.yahoo.com/markets/options/articles/option-volatility-earnings-report-may-110002436.html
2026-05-04 11:00:15+00:00,HON,Simply Wall St.,Is Now An Opportune Moment To Examine Honeywell International Inc. (NASDAQ:HON)?,https://finance.yahoo.com/markets/stocks/articles/now-opportune-moment-examine-honeywell-110015270.html
2026-05-04 11:23:00+00:00,SHOP,MT Newswires,"Stocks Mostly Down Pre-Bell as Traders Assess Middle East Developments, Await Fresh Labor Data",https://finance.yahoo.com/markets/stocks/articles/stocks-mostly-down-pre-bell-112300773.html
2026-05-04 11:33:00+00:00,DASH,Zacks,Crexendo (CXDO) Stock Jumps 15.3%: Will It Continue to Soar?,https://finance.yahoo.com/markets/stocks/articles/crexendo-cxdo-stock-jumps-15-113300562.html
2026-05-04 11:36:17+00:00,APP,Simply Wall St.,High Insider Ownership Growth Stocks To Consider In May 2026,https://finance.yahoo.com/markets/stocks/articles/high-insider-ownership-growth-stocks-113617111.html
2026-05-04 11:36:59+00:00,ADP,MT Newswires,"US Dollar Rises Early Monday, Focus This Week on April Employment Data",https://finance.yahoo.com/markets/currencies/articles/us-dollar-rises-early-monday-113659376.html
2026-05-04 11:38:09+00:00,DDOG,Simply Wall St.,Datadog And Two Other Stocks That Could Be Trading Below Fair Value Estimates,https://finance.yahoo.com/markets/stocks/articles/datadog-two-other-stocks-could-113809023.html
2026-05-04 11:38:14+00:00,WDC,Simply Wall St.,High Growth Tech Stocks In US With Promising Potential,https://finance.yahoo.com/sectors/technology/articles/high-growth-tech-stocks-us-113814117.html
2026-05-04 11:38:14+00:00,ZS,Simply Wall St.,High Growth Tech Stocks In US With Promising Potential,https://finance.yahoo.com/sectors/technology/articles/high-growth-tech-stocks-us-113814117.html
2026-05-04 11:44:08+00:00,MNST,24/7 Wall St.,Warren Buffett Owns 2 of the Small Dogs of the Dow: Here’s Why You Need to Own All 5,https://finance.yahoo.com/markets/stocks/articles/warren-buffett-owns-2-small-114408952.html
2026-05-04 11:45:44+00:00,AMD,reddit.com/r/stocks,"AMD: Still undervalued or fairly priced after long term run? - I bought AMD at $28 (small position, 10 shares) and have held since. I’m trying to evaluate whether it still fits a long term value thesis or if it’s now closer to fair value. How do you currently value AMD? What assumptions (growth, margins, TAM) justify holding? What would make you sell? I am still young, so I need to determine what stocks are",
2026-05-04 11:45:49+00:00,MPWR,24/7 Wall St.,"XSD Delivers 1,138% in Ten Years, Yet Trails SOXX in the AI Boom",https://finance.yahoo.com/markets/stocks/articles/xsd-delivers-1-138-ten-114549103.html
2026-05-04 11:45:49+00:00,AVGO,24/7 Wall St.,"XSD Delivers 1,138% in Ten Years, Yet Trails SOXX in the AI Boom",https://finance.yahoo.com/markets/stocks/articles/xsd-delivers-1-138-ten-114549103.html
2026-05-04 11:45:49+00:00,MRVL,24/7 Wall St.,"XSD Delivers 1,138% in Ten Years, Yet Trails SOXX in the AI Boom",https://finance.yahoo.com/markets/stocks/articles/xsd-delivers-1-138-ten-114549103.html
2026-05-04 11:45:49+00:00,ADI,24/7 Wall St.,"XSD Delivers 1,138% in Ten Years, Yet Trails SOXX in the AI Boom",https://finance.yahoo.com/markets/stocks/articles/xsd-delivers-1-138-ten-114549103.html
2026-05-04 11:48:55+00:00,PYPL,StockStory,PayPal (PYPL) Reports Q1: Everything You Need To Know Ahead Of Earnings,https://finance.yahoo.com/markets/stocks/articles/paypal-pypl-reports-q1-everything-114855481.html
2026-05-04 11:49:57+00:00,AMGN,Insider Monkey,Baron Health Care Fund’s Performance Impacted by Amgen (AMGN) Omission,https://finance.yahoo.com/sectors/healthcare/articles/baron-health-care-fund-performance-114957551.html
2026-05-04 11:54:25+00:00,ABNB,24/7 Wall St.,"Here Are Monday’s Top Wall Street Analyst Research Calls: Advanced Micro Devices, Airbnb, Alphabet, Check Point Software, GlobalFoundries, Internatioinal Paper, Trade Desk, and More",https://finance.yahoo.com/markets/stocks/articles/monday-top-wall-street-analyst-115425322.html
2026-05-04 11:56:20+00:00,ARM,MT Newswires,"US Equity Futures Slip as Middle East Conflict Enters Third Month, Oil Prices Rise",https://finance.yahoo.com/markets/stocks/articles/us-equity-futures-slip-middle-115620495.html
2026-05-04 12:00:00+00:00,WDAY,PR Newswire,Pinnacle Group Launches PinnacleSI to Provide Advisory Services with Technology Expertise,https://finance.yahoo.com/sectors/technology/articles/pinnacle-group-launches-pinnaclesi-advisory-120000390.html
2026-05-04 12:00:00+00:00,AVGO,PR Newswire,"Broadcom Inc. to Announce Second Quarter Fiscal Year 2026 Financial Results on Wednesday, June 3, 2026",https://finance.yahoo.com/markets/stocks/articles/broadcom-inc-announce-second-quarter-120000209.html
2026-05-04 12:00:00+00:00,PEP,PR Newswire,"Gatorade Unveils ""Body of Science"" - a Multi-Year Research Commitment to Help Close the Gap in Women's Hydration Science Across Life Stages",https://finance.yahoo.com/sectors/healthcare/articles/gatorade-unveils-body-science-multi-120000297.html
2026-05-04 12:00:00+00:00,ADSK,PR Newswire,Autodesk extends invitation to join financial results conference call,https://finance.yahoo.com/markets/stocks/articles/autodesk-extends-invitation-join-financial-120000194.html
2026-05-04 12:00:00+00:00,ASML,GlobeNewswire,ASML reports transactions under its current share buyback program,https://finance.yahoo.com/markets/stocks/articles/asml-reports-transactions-under-current-120000601.html
2026-05-04 12:00:13+00:00,CDNS,Simply Wall St.,"If EPS Growth Is Important To You, Cadence Design Systems (NASDAQ:CDNS) Presents An Opportunity",https://finance.yahoo.com/markets/stocks/articles/eps-growth-important-cadence-design-120013684.html
2026-05-04 12:00:33+00:00,BKR,Simply Wall St.,Baker Hughes Insider Lowered Holding By 100% During Last Year,https://finance.yahoo.com/markets/stocks/articles/baker-hughes-insider-lowered-holding-120033758.html
2026-05-04 12:00:40+00:00,ADP,Simply Wall St.,"At US$214, Is Automatic Data Processing, Inc. (NASDAQ:ADP) Worth Looking At Closely?",https://finance.yahoo.com/markets/stocks/articles/us-214-automatic-data-processing-120040540.html
2026-05-04 12:01:16+00:00,TSLA,Benzinga,"Lithium Could Be Setting Up For A ""Bull Cycle 3.0"" Scenario – What Does This Mean For Investors?",https://finance.yahoo.com/markets/commodities/articles/lithium-could-setting-bull-cycle-120116121.html
2026-05-04 12:01:34+00:00,SBUX,24/7 Wall St.,"Ditch Starbucks and DoorDash, George Kamel Says. How Cheap Appliances Can Replace Your Takeout Budget",https://finance.yahoo.com/economy/articles/ditch-starbucks-doordash-george-kamel-120134723.html
2026-05-04 12:01:34+00:00,DASH,24/7 Wall St.,"Ditch Starbucks and DoorDash, George Kamel Says. How Cheap Appliances Can Replace Your Takeout Budget",https://finance.yahoo.com/economy/articles/ditch-starbucks-doordash-george-kamel-120134723.html
2026-05-04 12:05:06+00:00,TMUS,Trefis,"Verizon Stock: Cheap Multiple, Complicated Story",https://finance.yahoo.com/markets/stocks/articles/verizon-stock-cheap-multiple-complicated-120506515.html
2026-05-04 12:23:00+00:00,CSX,Supply Chain Dive,CSX sees volume uptick from spike in truck-to-rail conversions,https://finance.yahoo.com/sectors/energy/articles/csx-sees-volume-uptick-spike-122300758.html
2026-05-04 12:25:00+00:00,MRVL,Motley Fool,Nvidia Is Up 7% in 2026 While Marvell Technology Has Nearly Doubled. Here's Why.,https://finance.yahoo.com/markets/stocks/articles/nvidia-7-2026-while-marvell-122500481.html
2026-05-04 12:30:00+00:00,ALNY,Business Wire,Alnylam to Present New Analyses at Heart Failure 2026 Underscoring Consistent Clinical Profile of Vutrisiran in ATTR-CM,https://finance.yahoo.com/sectors/healthcare/articles/alnylam-present-analyses-heart-failure-123000231.html
2026-05-04 12:30:00+00:00,WDAY,Business Wire,Gloo Completes Acquisition of EnterpriseMarketdesk (EMD) Bringing AI-enabled Workday Services and Expertise to the Gloo Platform,https://finance.yahoo.com/sectors/technology/articles/gloo-completes-acquisition-enterprisemarketdesk-emd-123000174.html
2026-05-04 12:30:00+00:00,MDLZ,PR Newswire,"The LUNA Brand Debuts New ""Easy to Love"" Campaign Starring Jessica Alba as Brand Fan Turned Ambassador",https://finance.yahoo.com/sectors/healthcare/articles/luna-brand-debuts-easy-love-123000699.html
2026-05-04 12:30:04+00:00,STX,Zacks,Here's How Much a $1000 Investment in Seagate Made 10 Years Ago Would Be Worth Today,https://finance.yahoo.com/markets/stocks/articles/heres-much-1000-investment-seagate-123004105.html
2026-05-04 12:34:00+00:00,MU,Zacks,AI Enthusiasm Powers Nasdaq to All-Time High: 3 Stocks to Grab,https://finance.yahoo.com/markets/stocks/articles/ai-enthusiasm-powers-nasdaq-time-123400575.html
2026-05-04 12:34:00+00:00,AVGO,Zacks,AI Enthusiasm Powers Nasdaq to All-Time High: 3 Stocks to Grab,https://finance.yahoo.com/markets/stocks/articles/ai-enthusiasm-powers-nasdaq-time-123400575.html
2026-05-04 12:36:00+00:00,MSTR,Barrons.com,"Coinbase Stock, Strategy Gain. It’s Not Just Rising Bitcoin Lifting Crypto Companies.",https://www.barrons.com/articles/coinbase-stock-strategy-robinhood-crypto-c97d863f?siteid=yhoof2&yptr=yahoo
2026-05-04 12:38:00+00:00,WMT,PR Newswire,A 2oz Bottle. An 11-Foot Margarita. Drizz is Making The Largest Mocktail Margarita on Record,https://finance.yahoo.com/sectors/technology/articles/2oz-bottle-11-foot-margarita-123800827.html
2026-05-04 12:38:23+00:00,PYPL,Simply Wall St.,This Week In Digital Payment - Glass Partners With Mastercard To Revolutionize Government Transactions,https://finance.yahoo.com/markets/stocks/articles/week-digital-payment-glass-partners-123823361.html
2026-05-04 12:39:00+00:00,AVGO,Barrons.com,Latest Iran Flare-Up Challenges Stock Market’s Record Run and AI Momentum,https://www.barrons.com/articles/iran-war-stock-market-record-ai-5c4c0555?siteid=yhoof2&yptr=yahoo
2026-05-04 12:49:44+00:00,ARM,MT Newswires,"US Equity Futures Slip Pre-Bell as Middle East Conflict Enters Third Month, Oil Prices Rise",https://finance.yahoo.com/markets/stocks/articles/us-equity-futures-slip-pre-124944839.html
2026-05-04 12:54:00+00:00,IDXX,Zacks,Can Strong Growth Aid INNV's Q3 Earnings Amid Margin Seasonality?,https://finance.yahoo.com/sectors/healthcare/articles/strong-growth-aid-innvs-q3-125400109.html
2026-05-04 12:55:12+00:00,PEP,24/7 Wall St.,"10 Years, Zero Regrets: The Dividend Stocks I Keep Buying",https://finance.yahoo.com/markets/stocks/articles/10-years-zero-regrets-dividend-125512160.html
2026-05-04 12:56:54+00:00,TSLA,Barchart,Taiwan Semi Just Dumped Its Stake in ARM Stock. Why Investors Don’t Seem to Care.,https://finance.yahoo.com/markets/stocks/articles/taiwan-semi-just-dumped-stake-125654602.html
2026-05-04 12:56:54+00:00,ARM,Barchart,Taiwan Semi Just Dumped Its Stake in ARM Stock. Why Investors Don’t Seem to Care.,https://finance.yahoo.com/markets/stocks/articles/taiwan-semi-just-dumped-stake-125654602.html
2026-05-04 13:00:00+00:00,AMGN,PR Newswire,"AMGEN ANNOUNCES ADDITIONAL $300 MILLION U.S. MANUFACTURING INVESTMENT, TOTALING NEARLY $2 BILLION OVER THE LAST YEAR",https://finance.yahoo.com/sectors/healthcare/articles/amgen-announces-additional-300-million-130000056.html
2026-05-04 13:00:00+00:00,CSGP,Business Wire,CoStar’s U.S. Retail Forecast Remains Balanced Through 2026,https://finance.yahoo.com/economy/articles/costar-u-retail-forecast-remains-130000148.html
2026-05-04 13:00:00+00:00,SHOP,PR Newswire,"P3 Media Launches New Shopify Experience for Hartville Hardware, Powering the Nation's Largest Independent Hardware Store",https://finance.yahoo.com/sectors/technology/articles/p3-media-launches-shopify-experience-130000307.html
2026-05-04 13:00:00+00:00,BKNG,PR Newswire,Booking.com Makes it Easier Than Ever to Star in Your Own Movie-Inspired Route 66 Road Trip for the Iconic Highway's 100th Anniversary,https://finance.yahoo.com/markets/stocks/articles/booking-com-makes-easier-ever-130000128.html
2026-05-04 13:00:03+00:00,AMGN,Zacks,Amgen Inc. (AMGN) is Attracting Investor Attention: Here is What You Should Know,https://finance.yahoo.com/markets/stocks/articles/amgen-inc-amgn-attracting-investor-130003809.html
2026-05-04 13:00:04+00:00,WDC,Zacks,Is Trending Stock Western Digital Corporation (WDC) a Buy Now?,https://finance.yahoo.com/markets/stocks/articles/trending-stock-western-digital-corporation-130004509.html
2026-05-04 13:00:05+00:00,PANW,Zacks,"Palo Alto Networks, Inc. (PANW) is Attracting Investor Attention: Here is What You Should Know",https://finance.yahoo.com/markets/stocks/articles/palo-alto-networks-inc-panw-130005086.html
2026-05-04 13:00:07+00:00,QCOM,Zacks,Here is What to Know Beyond Why QUALCOMM Incorporated (QCOM) is a Trending Stock,https://finance.yahoo.com/markets/stocks/articles/know-beyond-why-qualcomm-incorporated-130007346.html
2026-05-04 13:00:07+00:00,WMT,Zacks,Walmart Inc. (WMT) is Attracting Investor Attention: Here is What You Should Know,https://finance.yahoo.com/markets/stocks/articles/walmart-inc-wmt-attracting-investor-130007651.html
2026-05-04 13:00:08+00:00,ADBE,Zacks,Adobe Inc. (ADBE) Is a Trending Stock: Facts to Know Before Betting on It,https://finance.yahoo.com/markets/stocks/articles/adobe-inc-adbe-trending-stock-130008942.html
2026-05-04 13:01:27+00:00,TSLA,GuruFocus.com,Tesla Model X Becomes Fastest-Selling Used Car in U.S.,https://finance.yahoo.com/markets/stocks/articles/tesla-model-x-becomes-fastest-130127966.html
2026-05-04 13:05:04+00:00,MU,24/7 Wall St.,Think It’s Too Late to Buy Micron? Here’s the Case for Getting In Now,https://finance.yahoo.com/markets/stocks/articles/think-too-buy-micron-case-130504937.html
2026-05-04 13:10:03+00:00,AMGN,Zacks,3 Top Dividend Stocks to Maximize Your Retirement Income,https://finance.yahoo.com/markets/stocks/articles/3-top-dividend-stocks-maximize-131003203.html
2026-05-04 13:15:00+00:00,WMT,PR Newswire,Mama's Creations Redefines the Modern Deli Experience with Major National Retail Expansion,https://finance.yahoo.com/markets/stocks/articles/mamas-creations-redefines-modern-deli-131500140.html
2026-05-04 13:15:02+00:00,ABNB,Zacks,Ahead of Airbnb (ABNB) Q1 Earnings: Get Ready With Wall Street Estimates for Key Metrics,https://finance.yahoo.com/markets/stocks/articles/ahead-airbnb-abnb-q1-earnings-131502240.html
2026-05-04 13:15:02+00:00,GILD,Zacks,Curious about Gilead (GILD) Q1 Performance? Explore Wall Street Estimates for Key Metrics,https://finance.yahoo.com/sectors/healthcare/articles/curious-gilead-gild-q1-performance-131502549.html
2026-05-04 13:15:03+00:00,CTSH,Zacks,International Markets and Cognizant (CTSH): A Deep Dive for Investors,https://finance.yahoo.com/markets/stocks/articles/international-markets-cognizant-ctsh-deep-131503163.html
2026-05-04 13:15:03+00:00,AXON,Zacks,Seeking Clues to Axon (AXON) Q1 Earnings? A Peek Into Wall Street Projections for Key Metrics,https://finance.yahoo.com/markets/stocks/articles/seeking-clues-axon-axon-q1-131503833.html
2026-05-04 13:15:05+00:00,MDLZ,Zacks,Investing in Mondelez (MDLZ)? Don't Miss Assessing Its International Revenue Trends,https://finance.yahoo.com/markets/stocks/articles/investing-mondelez-mdlz-dont-miss-131505964.html
2026-05-04 13:15:05+00:00,KLAC,Zacks,KLA (KLAC) International Revenue in Focus: Trends and Expectations,https://finance.yahoo.com/markets/stocks/articles/kla-klac-international-revenue-focus-131505525.html
2026-05-04 13:15:05+00:00,MCHP,Zacks,Stay Ahead of the Game With Microchip Tech (MCHP) Q4 Earnings: Wall Street's Insights on Key Metrics,https://finance.yahoo.com/markets/stocks/articles/stay-ahead-game-microchip-tech-131505721.html
2026-05-04 13:16:00+00:00,APP,Zacks,Teradyne and Qualcomm have been highlighted as Zacks Bull and Bear of the Day,https://finance.yahoo.com/markets/stocks/articles/teradyne-qualcomm-highlighted-zacks-bull-131600343.html
2026-05-04 13:16:00+00:00,QCOM,Zacks,Teradyne and Qualcomm have been highlighted as Zacks Bull and Bear of the Day,https://finance.yahoo.com/markets/stocks/articles/teradyne-qualcomm-highlighted-zacks-bull-131600343.html
2026-05-04 13:17:00+00:00,CMCSA,Business Wire,"High-Speed, Reliable Internet from Xfinity Coming to Nassau County, Florida",https://finance.yahoo.com/sectors/technology/articles/high-speed-reliable-internet-xfinity-131700590.html
2026-05-04 13:17:16+00:00,ARM,Simply Wall St.,How The AI CPU Debate Is Rewriting The Story For Arm Holdings (ARM),https://finance.yahoo.com/markets/stocks/articles/ai-cpu-debate-rewriting-story-131716778.html
2026-05-04 13:21:10+00:00,WMT,Trefis,What GameStop’s $55B Bid For eBay Means For Investors,https://finance.yahoo.com/markets/stocks/articles/gamestop-55b-bid-ebay-means-132110012.html
2026-05-04 13:23:00+00:00,CRWD,Business Wire,CrowdStrike Named a Leader in the Inaugural 2026 Gartner® Magic Quadrant™ for Cyberthreat Intelligence Technologies,https://finance.yahoo.com/sectors/technology/articles/crowdstrike-named-leader-inaugural-2026-132300420.html
2026-05-04 13:25:15+00:00,MSTR,BeInCrypto,Will AI Save Bitcoin Miners? Q1 Crypto Earnings Preview,https://finance.yahoo.com/markets/crypto/articles/ai-save-bitcoin-miners-q1-132515593.html
2026-05-04 13:26:00+00:00,TXN,Zacks,Texas Instruments Soars 62% YTD: Is TXN Stock Still Worth Buying?,https://finance.yahoo.com/markets/stocks/articles/texas-instruments-soars-62-ytd-132600331.html
2026-05-04 13:26:00+00:00,AVGO,Zacks,Texas Instruments Soars 62% YTD: Is TXN Stock Still Worth Buying?,https://finance.yahoo.com/markets/stocks/articles/texas-instruments-soars-62-ytd-132600331.html
2026-05-04 13:28:05+00:00,ASML,24/7 Wall St.,Forget Palantir — Serious Investors Are Placing Their Bets on the AI Chokepoints Right Now,https://finance.yahoo.com/markets/stocks/articles/forget-palantir-serious-investors-placing-132805956.html
2026-05-04 13:30:02+00:00,SNPS,Zacks,Wall Street Analysts Think Synopsys (SNPS) Is a Good Investment: Is It?,https://finance.yahoo.com/markets/stocks/articles/wall-street-analysts-think-synopsys-133002820.html
2026-05-04 13:30:03+00:00,PANW,Zacks,Wall Street Bulls Look Optimistic About Palo Alto (PANW): Should You Buy?,https://finance.yahoo.com/markets/stocks/articles/wall-street-bulls-look-optimistic-133003599.html
2026-05-04 13:30:04+00:00,MU,Zacks,Is Micron (MU) a Buy as Wall Street Analysts Look Optimistic?,https://finance.yahoo.com/markets/stocks/articles/micron-mu-buy-wall-street-133004872.html
2026-05-04 13:30:04+00:00,MRVL,Zacks,Is It Worth Investing in Marvell (MRVL) Based on Wall Street's Bullish Views?,https://finance.yahoo.com/markets/stocks/articles/worth-investing-marvell-mrvl-based-133004965.html
2026-05-04 13:30:04+00:00,AVGO,Zacks,Wall Street Bulls Look Optimistic About Broadcom Inc. (AVGO): Should You Buy?,https://finance.yahoo.com/markets/stocks/articles/wall-street-bulls-look-optimistic-133004514.html
2026-05-04 13:33:30+00:00,GOOGL,Yahoo Finance,Big Tech profits are being inflated by stakes in private startups,https://finance.yahoo.com/markets/article/big-tech-profits-are-being-inflated-by-stakes-in-private-startups-133330415.html
2026-05-04 13:33:30+00:00,GOOG,Yahoo Finance,Big Tech profits are being inflated by stakes in private startups,https://finance.yahoo.com/markets/article/big-tech-profits-are-being-inflated-by-stakes-in-private-startups-133330415.html
2026-05-04 13:36:35+00:00,AAPL,Yahoo Finance Video,Did Berkshire's annual meeting feel the same without Buffett?,https://finance.yahoo.com/video/did-berkshires-annual-meeting-feel-the-same-without-buffett-133635512.html
2026-05-04 13:38:58+00:00,MSTR,BeInCrypto,MicroStrategy Halts Preferred-Share Sales That Powered April’s Bitcoin Buying,https://finance.yahoo.com/markets/crypto/articles/microstrategy-halts-preferred-share-sales-133858572.html
2026-05-04 13:40:03+00:00,CTSH,Zacks,Why Cognizant (CTSH) is a Top Value Stock for the Long-Term,https://finance.yahoo.com/markets/stocks/articles/why-cognizant-ctsh-top-value-134003795.html
2026-05-04 13:42:04+00:00,TSLA,Barchart,"Ignore the OpenAI Panic and Keep Buying Oracle Stock, Says Wedbush",https://finance.yahoo.com/markets/stocks/articles/ignore-openai-panic-keep-buying-134204857.html
2026-05-04 13:43:08+00:00,ABNB,The Fly,"AMD downgraded, Airbnb upgraded: Wall Street's top analyst calls",https://finance.yahoo.com/markets/stocks/articles/airbnb-upgraded-zscaler-downgraded-wall-133507400.html
2026-05-04 13:45:00+00:00,COST,Zacks,Why Costco's Financial Strength Could Outpace Retail Challenges,https://finance.yahoo.com/markets/stocks/articles/why-costcos-financial-strength-could-134500694.html
2026-05-04 13:47:00+00:00,ADSK,PR Newswire,Michael Baker International Named to Autodesk Digital Twin Solution Provider Program,https://finance.yahoo.com/sectors/technology/articles/michael-baker-international-named-autodesk-134700363.html
2026-05-04 14:00:00+00:00,ROP,GlobeNewswire,DAT Brings Shipper-Focused Freight Intelligence to Gartner Supply Chain Symposium/Xpo™,https://finance.yahoo.com/markets/commodities/articles/dat-brings-shipper-focused-freight-140000409.html
