timestamp,ticker,source,text,url,SentimentScore
2026-04-14 08:30:03+00:00,INTU,StockStory,1 Cash-Producing Stock Worth Your Attention and 2 We Avoid,https://finance.yahoo.com/markets/stocks/articles/1-cash-producing-stock-worth-083003798.html,0.2
2026-04-14 08:55:00+00:00,REGN,BioPharma Dive,Novo teams with OpenAI; Ideaya gets muted response to eye drug data,https://finance.yahoo.com/sectors/healthcare/articles/novo-teams-openai-ideaya-gets-085500443.html,0.1
2026-04-14 08:55:00+00:00,FAST,Zacks,"Stock Market News for Apr 14, 2026",https://finance.yahoo.com/markets/stocks/articles/stock-market-news-apr-14-085500787.html,0.0
2026-04-14 09:18:03+00:00,KHC,StockStory,1 Stock Under $50 to Target This Week and 2 We Find Risky,https://finance.yahoo.com/markets/stocks/articles/1-stock-under-50-target-091803866.html,0.2
2026-04-14 09:40:00+00:00,ODFL,Zacks,"Zacks Industry Outlook Highlights Old Dominion Freight, J.B. Hunt and Knight-Swift Transportation",https://finance.yahoo.com/markets/stocks/articles/zacks-industry-outlook-highlights-old-094000240.html,0.5
2026-04-14 09:50:00+00:00,ABNB,Motley Fool,Airbnb Is Testing Airport Pickups. What's the Next Big Move for the Company?,https://finance.yahoo.com/markets/stocks/articles/airbnb-testing-airport-pickups-whats-095000503.html,0.2
2026-04-14 10:05:55+00:00,NXPI,Simply Wall St.,Is NXP Semiconductors (NXPI) Fairly Priced After Recent 24% One Year Gain?,https://finance.yahoo.com/markets/stocks/articles/nxp-semiconductors-nxpi-fairly-priced-100555179.html,0.2
2026-04-14 10:06:22+00:00,FAST,Simply Wall St.,US Stock Market Today: S&P 500 Futures Edge Higher As Energy Inflation Jitters Linger,https://finance.yahoo.com/markets/stocks/articles/us-stock-market-today-p-100622590.html,0.2
2026-04-14 10:14:03+00:00,GILD,StockStory,1 Profitable Stock for Long-Term Investors and 2 Facing Challenges,https://finance.yahoo.com/markets/stocks/articles/1-profitable-stock-long-term-101403673.html,0.5
2026-04-14 10:27:00+00:00,DASH,Zacks,New Strong Sell Stocks for April 14th,https://finance.yahoo.com/markets/stocks/articles/strong-sell-stocks-april-14th-102700777.html,-0.8
2026-04-14 10:33:00+00:00,ADI,Zacks,"The Zacks Analyst Blog Highlights NVIDIA, Analog Devices, NXP Semiconductors and ACM Research",https://finance.yahoo.com/markets/stocks/articles/zacks-analyst-blog-highlights-nvidia-103300994.html,0.5
2026-04-14 11:04:26+00:00,REGN,Simply Wall St.,Why Telix Pharmaceuticals (ASX:TLX) Is Up 13.8% After Regeneron Radiopharma Alliance Announcement And What’s Next,https://finance.yahoo.com/sectors/healthcare/articles/why-telix-pharmaceuticals-asx-tlx-110426180.html,0.6
2026-04-14 11:26:03+00:00,KDP,StockStory,2 S&P 500 Stocks with Solid Fundamentals and 1 We Brush Off,https://finance.yahoo.com/markets/stocks/articles/2-p-500-stocks-solid-112603549.html,0.2
2026-04-14 11:42:00+00:00,KDP,Zacks,North America Demand Weakens: Can KO Offset it With Global Growth?,https://finance.yahoo.com/markets/stocks/articles/north-america-demand-weakens-ko-114200067.html,0.1
2026-04-14 11:44:19+00:00,REGN,Barchart,Earnings Preview: What to Expect From Regeneron Pharmaceuticals' Report,https://finance.yahoo.com/markets/stocks/articles/earnings-preview-expect-regeneron-pharmaceuticals-114419544.html,0.5
2026-04-14 11:44:58+00:00,CEG,Insider Monkey,Is Constellation Energy Corporation (CEG) A Top Growth Stock in Billionaire Philippe Laffont’s Portfolio?,https://finance.yahoo.com/sectors/energy/articles/constellation-energy-corporation-ceg-top-114458902.html,0.5
2026-04-14 11:45:00+00:00,CRWD,MarketBeat,"From CrowdStrike to Chewy, These Tanking Stocks Are Announcing Buybacks",https://finance.yahoo.com/markets/stocks/articles/crowdstrike-chewy-tanking-stocks-announcing-114500408.html,0.2
2026-04-14 11:45:40+00:00,DASH,Insider Monkey,DoorDash Inc. (DASH) Expands Fuel Relief for Dashers amid Costs Concerns,https://finance.yahoo.com/markets/stocks/articles/doordash-inc-dash-expands-fuel-114540374.html,0.5
2026-04-14 11:47:04+00:00,MNST,Insider Monkey,Is Monster Beverage Corporation (MNST) a Top Consumer Defensive Stock to Buy?,https://finance.yahoo.com/markets/stocks/articles/monster-beverage-corporation-mnst-top-114704377.html,0.2
2026-04-14 12:16:21+00:00,WBD,GuruFocus.com,Netflix's Next Chapter Looks Different,https://finance.yahoo.com/markets/stocks/articles/netflixs-next-chapter-looks-different-121621677.html,0.5
2026-04-14 12:18:27+00:00,FANG,24/7 Wall St.,Oil Will Stay Higher Regardless of Iran Outcome: 5 High-Yield Dividend Energy Buys,https://finance.yahoo.com/sectors/energy/articles/oil-stay-higher-regardless-iran-121827916.html,0.5
2026-04-14 12:21:01+00:00,MNST,24/7 Wall St.,McDonald’s Puts Red Bull On The Menu,https://finance.yahoo.com/sectors/energy/articles/mcdonald-puts-red-bull-menu-122101807.html,0.2
2026-04-14 12:23:00+00:00,TXN,Zacks,Top Wide-Moat Stocks to Buy for Long-Term Wealth and Stability,https://finance.yahoo.com/markets/stocks/articles/top-wide-moat-stocks-buy-122300163.html,0.8
2026-04-14 12:24:07+00:00,FANG,24/7 Wall St.,Why VNOM Is the Closest Thing to a Royalty on $100 Oil,https://finance.yahoo.com/sectors/energy/articles/why-vnom-closest-thing-royalty-122407048.html,0.5
2026-04-14 12:30:00+00:00,KDP,Zacks,4 Low-Beta Defensive Stocks to Take Refuge in Amid Sky-High Inflation,https://finance.yahoo.com/markets/stocks/articles/4-low-beta-defensive-stocks-123000932.html,-0.5
2026-04-14 12:30:34+00:00,MELI,24/7 Wall St.,MercadoLibre Stock Is Down 9% in 2026 but Wall Street Still Sees 36% Upside,https://finance.yahoo.com/markets/stocks/articles/mercadolibre-stock-down-9-2026-123034871.html,0.5
2026-04-14 12:39:51+00:00,WDC,Investing.com,Sandisk shares are up 2740% in a year. Evercore sees ’a favorable risk/reward’,https://finance.yahoo.com/markets/stocks/articles/sandisk-shares-2740-evercore-sees-123951381.html,0.8
2026-04-14 12:45:40+00:00,CRWD,24/7 Wall St.,AI Just Put Cybersecurity Back in Rally Mode—and CrowdStrike and Palo Alto Are Leading the Breakout,https://finance.yahoo.com/markets/stocks/articles/ai-just-put-cybersecurity-back-124540769.html,0.8
2026-04-14 12:46:03+00:00,CSX,StockStory,3 Reasons to Avoid CSX and 1 Stock to Buy Instead,https://finance.yahoo.com/news/3-reasons-avoid-csx-1-124603118.html,-0.5
2026-04-14 12:48:53+00:00,BKNG,Barchart,Here's What to Expect From Booking Holdings' Next Earnings Report,https://finance.yahoo.com/markets/stocks/articles/heres-expect-booking-holdings-next-124853540.html,0.2
2026-04-14 12:55:00+00:00,ROST,Zacks,Dollar General Strengthens Ad Business With AI Audio Push,https://finance.yahoo.com/markets/stocks/articles/dollar-general-strengthens-ad-business-125500309.html,0.5
2026-04-14 12:59:34+00:00,MELI,Insider Monkey,What Makes Mercado Libre (MELI) a Classic Survivor & Thriver Business?,https://finance.yahoo.com/markets/stocks/articles/makes-mercado-libre-meli-classic-125934565.html,0.6
2026-04-14 13:00:02+00:00,STX,Zacks,These 2 Computer and Technology Stocks Could Beat Earnings: Why They Should Be on Your Radar,https://finance.yahoo.com/markets/stocks/articles/2-computer-technology-stocks-could-130002130.html,0.6
2026-04-14 13:00:02+00:00,CMCSA,Zacks,Here is What to Know Beyond Why Comcast Corporation (CMCSA) is a Trending Stock,https://finance.yahoo.com/markets/stocks/articles/know-beyond-why-comcast-corporation-130002118.html,0.2
2026-04-14 13:00:03+00:00,IDXX,Zacks,These 2 Medical Stocks Could Beat Earnings: Why They Should Be on Your Radar,https://finance.yahoo.com/markets/stocks/articles/2-medical-stocks-could-beat-130003721.html,0.6
2026-04-14 13:00:03+00:00,CDNS,Zacks,"Cadence Design Systems, Inc. (CDNS) Is a Trending Stock: Facts to Know Before Betting on It",https://finance.yahoo.com/markets/stocks/articles/cadence-design-systems-inc-cdns-130003601.html,0.5
2026-04-14 13:00:04+00:00,GILD,Zacks,Looking for Stocks with Positive Earnings Momentum? Check Out These 2 Medical Names,https://finance.yahoo.com/markets/stocks/articles/looking-stocks-positive-earnings-momentum-130004932.html,0.8
2026-04-14 13:00:06+00:00,CRWD,Zacks,Here is What to Know Beyond Why CrowdStrike (CRWD) is a Trending Stock,https://finance.yahoo.com/markets/stocks/articles/know-beyond-why-crowdstrike-crwd-130006424.html,0.2
2026-04-14 13:07:33+00:00,TMUS,Simply Wall St.,Is T-Mobile US (TMUS) Now At An Attractive Price After Recent Share Price Pullback,https://finance.yahoo.com/markets/stocks/articles/t-mobile-us-tmus-now-130733780.html,0.5
2026-04-14 13:29:50+00:00,BKNG,Insider Monkey,Booking Holding (BKNG) Holds Enduring Profitability in the Travel Industry,https://finance.yahoo.com/markets/stocks/articles/booking-holding-bkng-holds-enduring-132950511.html,0.8
2026-04-14 13:30:05+00:00,ADI,Zacks,Brokers Suggest Investing in Analog Devices (ADI): Read This Before Placing a Bet,https://finance.yahoo.com/markets/stocks/articles/brokers-suggest-investing-analog-devices-133005922.html,0.5
2026-04-14 13:47:00+00:00,GEHC,Zacks,Here's Why You Should Retain Ecolab Stock in Your Portfolio Now,https://finance.yahoo.com/markets/stocks/articles/heres-why-retain-ecolab-stock-134700752.html,0.6
2026-04-14 13:53:31+00:00,MDLZ,The Fly,"Tesla upgraded, AppLovin initiated: Wall Street's top analyst calls",https://finance.yahoo.com/markets/stocks/articles/tesla-upgraded-applovin-initiated-wall-135331262.html,0.5
2026-04-14 13:55:00+00:00,ADSK,Zacks,Globant Expands Autodesk Partnership to Advance Digital Twins,https://finance.yahoo.com/markets/stocks/articles/globant-expands-autodesk-partnership-advance-135500204.html,0.5
2026-04-14 13:58:15+00:00,ROP,Insider Monkey,Oakmark Fund Picks Roper Technologies (ROP) on Varied Growth Drivers,https://finance.yahoo.com/markets/stocks/articles/oakmark-fund-picks-roper-technologies-135815808.html,0.5
2026-04-14 14:00:41+00:00,MCHP,24/7 Wall St.,Why retirees are buying this closed-end fund yielding 8% on venture-stage tech,https://finance.yahoo.com/markets/stocks/articles/why-retirees-buying-closed-end-140041383.html,0.2
2026-04-14 14:01:00+00:00,ROST,Zacks,Is Costco Stock a Buy Now After Strong March Retail Sales?,https://finance.yahoo.com/markets/stocks/articles/costco-stock-buy-now-strong-140100968.html,0.5
2026-04-14 14:02:00+00:00,DASH,Zacks,Can SERV's Monetization Expansion Drive a Step Change in Revenue Mix?,https://finance.yahoo.com/markets/stocks/articles/servs-monetization-expansion-drive-step-140200920.html,0.5
2026-04-14 14:02:00+00:00,CSX,Zacks,CSX to Report Q1 Earnings: What's in the Offing Amid Cost Pressures?,https://finance.yahoo.com/markets/stocks/articles/csx-report-q1-earnings-whats-140200861.html,0.1
2026-04-14 14:04:02+00:00,PDD,Simply Wall St.,Assessing PDD Holdings (PDD) Valuation After Regulatory Pressure And Earnings Miss,https://finance.yahoo.com/markets/stocks/articles/assessing-pdd-holdings-pdd-valuation-140402174.html,-0.5
2026-04-14 14:15:37+00:00,FAST,Barchart,Should You Buy the Dip in Fastenal Stock Today?,https://finance.yahoo.com/markets/stocks/articles/buy-dip-fastenal-stock-today-141537526.html,0.2
2026-04-14 14:34:00+00:00,GEHC,Zacks,"Stryker to Acquire AVS, Adding IVL Capabilities to Vascular Portfolio",https://finance.yahoo.com/sectors/healthcare/articles/stryker-acquire-avs-adding-ivl-143400500.html,0.5
2026-04-14 15:17:11+00:00,WDC,Motley Fool,Western Digital (WDC) Q1 2026 Earnings Transcript,https://finance.yahoo.com/markets/stocks/articles/western-digital-wdc-q1-2026-151711675.html,0.1
2026-04-14 15:20:00+00:00,ARM,Motley Fool,Prediction: The Biggest Winner From Agentic AI Won't Be Nvidia. It Will Be This Other Chip Stock That No One Talks About.,https://finance.yahoo.com/sectors/technology/articles/prediction-biggest-winner-agentic-ai-152000603.html,0.6
2026-04-14 15:36:35+00:00,KLAC,Motley Fool,KLA (KLAC) Q4 2025 Earnings Call Transcript,https://finance.yahoo.com/markets/stocks/articles/kla-klac-q4-2025-earnings-153635722.html,0.0
2026-04-14 15:40:02+00:00,INTU,Zacks,PRGS or INTU: Which Is the Better Value Stock Right Now?,https://finance.yahoo.com/markets/stocks/articles/prgs-intu-better-value-stock-154002181.html,0.5
2026-04-14 15:44:00+00:00,HON,Zacks,Howmet Gains From Strength in Defense Aerospace: Can the Momentum Last?,https://finance.yahoo.com/markets/stocks/articles/howmet-gains-strength-defense-aerospace-154400669.html,0.5
2026-04-14 15:49:00+00:00,CMCSA,Zacks,AT&T vs Comcast: Which Telecom Stock is the Smarter Pick Now?,https://finance.yahoo.com/markets/stocks/articles/t-vs-comcast-telecom-stock-154900411.html,0.5
2026-04-14 15:50:00+00:00,FAST,MarketBeat,Fastenal Stock Slips After Earnings: 5 Reasons To Buy the Dip,https://finance.yahoo.com/markets/stocks/articles/fastenal-stock-slips-earnings-5-155000495.html,0.6
2026-04-14 15:56:06+00:00,TMUS,Insider Monkey,T-Mobile (TMUS) To Fulfill Its 5G Ambitions Together With Nvidia,https://finance.yahoo.com/sectors/technology/articles/t-mobile-tmus-fulfill-5g-155606527.html,0.5
2026-04-14 15:56:09+00:00,SNPS,Insider Monkey,Here’s Why Synopsys Inc’s (SNPS) Partnership With Nvidia Is Important,https://finance.yahoo.com/markets/stocks/articles/why-synopsys-inc-snps-partnership-155609045.html,0.5
2026-04-14 15:56:12+00:00,CRWD,Insider Monkey,What Are Analysts Saying About CrowdStrike (CRWD) Stock?,https://finance.yahoo.com/markets/stocks/articles/analysts-saying-crowdstrike-crwd-stock-155612328.html,0.0
2026-04-14 15:59:00+00:00,EXC,Zacks,EXC vs. FE: Which Utility Stock Offers Stronger Potential in 2026?,https://finance.yahoo.com/markets/stocks/articles/exc-vs-fe-utility-stock-155900787.html,0.2
2026-04-14 16:04:00+00:00,SHOP,Zacks,Shopify Trades 37% Below 52-Week High: Is the Stock Still a Buy?,https://finance.yahoo.com/markets/stocks/articles/shopify-trades-37-below-52-160400879.html,0.2
2026-04-14 16:05:12+00:00,KLAC,Simply Wall St.,Has KLA (KLAC) Rallied Too Far After Its Recent Share Price Surge?,https://finance.yahoo.com/markets/stocks/articles/kla-klac-rallied-too-far-160512152.html,-0.5
2026-04-14 16:05:40+00:00,WBD,Simply Wall St.,Hollywood Pushback And Regulators Test Warner Bros. Discovery Deal Risks,https://finance.yahoo.com/markets/stocks/articles/hollywood-pushback-regulators-test-warner-160540401.html,-0.5
2026-04-14 16:06:00+00:00,NXPI,Zacks,Can Qualcomm's Deepen Long-Term Tie-Up With Bosch Drive Its Shares?,https://finance.yahoo.com/markets/stocks/articles/qualcomms-deepen-long-term-tie-160600032.html,0.2
2026-04-14 16:10:03+00:00,HON,Zacks,Why Honeywell International (HON) Could Beat Earnings Estimates Again,https://finance.yahoo.com/markets/stocks/articles/why-honeywell-international-hon-could-161003486.html,0.6
2026-04-14 16:16:42+00:00,CEG,Barchart,Constellation Energy's Q1 2026 Earnings: What to Expect,https://finance.yahoo.com/markets/stocks/articles/constellation-energys-q1-2026-earnings-161642549.html,0.0
2026-04-14 16:23:47+00:00,CRWD,Yahoo Finance,Software stocks are finally joining the tech rally,https://finance.yahoo.com/news/software-stocks-are-finally-joining-the-tech-rally-162347655.html,0.8
2026-04-14 16:28:00+00:00,AMGN,Zacks,"J&J Beats Q1 Earnings & Sales Estimates, Raises 2026 Outlook",https://finance.yahoo.com/sectors/healthcare/articles/j-j-beats-q1-earnings-162800681.html,0.8
2026-04-14 16:43:00+00:00,DASH,Zacks,UBER Stock Plunges 23.4% in 6 Months:Time to Hold or Fold?,https://finance.yahoo.com/markets/stocks/articles/uber-stock-plunges-23-4-164300474.html,-0.6
2026-04-14 16:45:01+00:00,ADI,Zacks,Analog Devices (ADI) is an Incredible Growth Stock: 3 Reasons Why,https://finance.yahoo.com/markets/stocks/articles/analog-devices-adi-incredible-growth-164501565.html,0.8
2026-04-14 17:00:00+00:00,REGN,Zacks,Regeneron Boosts Cancer Pipeline Through Telix Collaboration,https://finance.yahoo.com/sectors/healthcare/articles/regeneron-boosts-cancer-pipeline-telix-170000200.html,0.5
2026-04-14 17:01:00+00:00,IDXX,Zacks,Is it a Prudent Move to Retain IDXX Stock in Your Portfolio Now?,https://finance.yahoo.com/markets/stocks/articles/prudent-move-retain-idxx-stock-170100299.html,0.2
2026-04-14 17:03:09+00:00,AMGN,Simply Wall St.,Amgen And Zai Lab Trial Tests DLL3 Combo As Valuation Looks Undemanding,https://finance.yahoo.com/sectors/healthcare/articles/amgen-zai-lab-trial-tests-170309166.html,0.6
2026-04-14 17:04:08+00:00,ISRG,Simply Wall St.,Assessing Intuitive Surgical (ISRG) Valuation After Strong Earnings And Growing Recurring Revenue,https://finance.yahoo.com/markets/stocks/articles/assessing-intuitive-surgical-isrg-valuation-170408931.html,0.6
2026-04-14 17:13:55+00:00,BKNG,Skift,Booking CEO Glenn Fogel Took Pay Cut in 2025 After 2 Big Years,https://finance.yahoo.com/markets/stocks/articles/booking-ceo-glenn-fogel-took-171355122.html,0.2
2026-04-14 17:30:20+00:00,MELI,Motley Fool,"Pictet Loads Up MercadoLibre With 3,500 Shares Worth $6.8 Million",https://finance.yahoo.com/markets/stocks/articles/pictet-loads-mercadolibre-3-500-173020303.html,0.5
2026-04-14 17:36:41+00:00,APP,Simply Wall St.,Top Growth Companies With Strong Insider Ownership April 2026,https://finance.yahoo.com/markets/stocks/articles/top-growth-companies-strong-insider-173641408.html,0.5
2026-04-14 17:41:01+00:00,WBD,Reuters,"Theater group says Paramount, Warner Bros merger 'harmful' to industry",https://finance.yahoo.com/sectors/technology/articles/theater-group-says-paramount-warner-174101588.html,-0.6
2026-04-14 18:09:57+00:00,STX,Simply Wall St.,Is It Too Late To Consider Seagate (STX) After Its Rapid Share Price Surge?,https://finance.yahoo.com/markets/stocks/articles/too-consider-seagate-stx-rapid-180957429.html,-0.5
2026-04-14 19:04:48+00:00,CRWD,Simply Wall St.,Is CrowdStrike (CRWD) Pricing Reflect Its Recent Pullback And Growth Expectations?,https://finance.yahoo.com/markets/stocks/articles/crowdstrike-crwd-pricing-reflect-recent-190448564.html,0.2
2026-04-14 19:44:11+00:00,TTWO,GuruFocus.com,Take-Two Gets A Reminder Of What GTA Is Really Worth,https://finance.yahoo.com/markets/stocks/articles/two-gets-reminder-gta-really-194411049.html,0.5
2026-04-14 19:45:34+00:00,PANW,BeInCrypto,Coinbase Reportedly Courts Anthropic to Bolster Exchange Security Infrastructure,https://finance.yahoo.com/markets/crypto/articles/coinbase-reportedly-courts-anthropic-bolster-194534621.html,0.5
2026-04-14 20:02:52+00:00,MDLZ,Investing.com,U.S. food sector faces uncertain growth despite attractive valuations,https://finance.yahoo.com/sectors/healthcare/articles/u-food-sector-faces-uncertain-200252959.html,-0.5
2026-04-14 20:04:40+00:00,CSCO,Simply Wall St.,Is Cisco Systems (CSCO) Fairly Priced After Strong 1 Year Share Price Run?,https://finance.yahoo.com/markets/stocks/articles/cisco-systems-csco-fairly-priced-200440690.html,0.5
2026-04-14 20:06:03+00:00,SHOP,StockStory,Why Shopify (SHOP) Stock Is Trading Up Today,https://finance.yahoo.com/markets/stocks/articles/why-shopify-shop-stock-trading-200603268.html,0.5
2026-04-14 20:14:07+00:00,PAYX,Insider Monkey,TD Cowen Assigns Hold Rating on Paychex (PAYX) Stock,https://finance.yahoo.com/markets/stocks/articles/td-cowen-assigns-hold-rating-201407382.html,0.1
2026-04-14 20:22:36+00:00,WDC,Insider Monkey,Analysts Positive on Western Digital (WDC) as AI Boosts Memory Demand,https://finance.yahoo.com/markets/stocks/articles/analysts-positive-western-digital-wdc-202236801.html,0.8
2026-04-14 21:44:11+00:00,MELI,Motley Fool,"Stock Market Today, April 14: Amazon Rises After $11.6 Billion Globalstar Deal Fuels Satellite Internet Ambitions",https://finance.yahoo.com/markets/stocks/articles/stock-market-today-april-14-214411050.html,0.8
2026-04-14 21:45:02+00:00,PDD,Zacks,Why PDD Holdings Inc. Sponsored ADR (PDD) Outpaced the Stock Market Today,https://finance.yahoo.com/markets/stocks/articles/why-pdd-holdings-inc-sponsored-214502290.html,0.5
2026-04-14 21:45:03+00:00,SHOP,Zacks,Why Shopify (SHOP) Outpaced the Stock Market Today,https://finance.yahoo.com/markets/stocks/articles/why-shopify-shop-outpaced-stock-214503128.html,0.5
2026-04-14 21:50:03+00:00,WDAY,Zacks,Workday (WDAY) Stock Sinks As Market Gains: Here's Why,https://finance.yahoo.com/markets/stocks/articles/workday-wday-stock-sinks-market-215003816.html,-0.5
2026-04-14 22:00:03+00:00,GILD,Zacks,Here's Why Gilead Sciences (GILD) Gained But Lagged the Market Today,https://finance.yahoo.com/markets/stocks/articles/heres-why-gilead-sciences-gild-220003516.html,0.1
2026-04-14 22:00:04+00:00,KLAC,Zacks,KLA (KLAC) Surpasses Market Returns: Some Facts Worth Knowing,https://finance.yahoo.com/markets/stocks/articles/kla-klac-surpasses-market-returns-220004162.html,0.5
2026-04-14 22:00:04+00:00,ISRG,Zacks,"Why Intuitive Surgical, Inc. (ISRG) Outpaced the Stock Market Today",https://finance.yahoo.com/markets/stocks/articles/why-intuitive-surgical-inc-isrg-220004227.html,0.5
2026-04-14 22:00:06+00:00,PCAR,Zacks,Paccar (PCAR) Stock Declines While Market Improves: Some Information for Investors,https://finance.yahoo.com/markets/stocks/articles/paccar-pcar-stock-declines-while-220006533.html,-0.5
2026-04-14 22:04:56+00:00,WDAY,MarketBeat,Gloo Q4 Earnings Call Highlights,https://finance.yahoo.com/markets/stocks/articles/gloo-q4-earnings-call-highlights-220456310.html,0.5
2026-04-14 22:05:39+00:00,TMUS,Bloomberg,Amazon-Globalstar Deal Is Poised to Boost Apple’s Satellite Ambitions,https://finance.yahoo.com/sectors/technology/articles/amazon-globalstar-deal-poised-boost-220539925.html,0.5
2026-04-14 22:05:50+00:00,CEG,Simply Wall St.,Assessing Constellation Energy (CEG) Valuation After Strong Long Term Returns And Recent Share Price Pullback,https://finance.yahoo.com/markets/stocks/articles/assessing-constellation-energy-ceg-valuation-220550497.html,0.5
2026-04-14 22:15:05+00:00,FANG,Zacks,Diamondback Energy (FANG) Stock Falls Amid Market Uptick: What Investors Need to Know,https://finance.yahoo.com/markets/stocks/articles/diamondback-energy-fang-stock-falls-221505554.html,0.1
2026-04-15 00:00:00+00:00,MRVL,SEC-EDGAR-8K,"(Item 1.01) Entry into a Material Definitive Agreement. Fifth Supplemental Indenture On April 15, 2026, Marvell Technology, Inc. (the “Company”) completed a public offering of $1,000,000,000 aggregate principal amount of its 5.300% Senior Notes due 2036 (the “Notes”). The Notes were offered and sold pursuant to the Company’s shelf registration statement on Form S-3 (No. 333-285742) (the “Registration Statement”) filed with the Securities and Exchange Commission (the “SEC”) under the Securities Act of 1933, as amended (the

(Item 8.01) Other Events. The Notes were offered pursuant to an underwriting agreement, dated April 6, 2026 (the “Underwriting Agreement”), among the Company and Wells Fargo Securities, LLC, BofA Securities, Inc., J.P. Morgan Securities LLC and Mizuho Securities USA LLC, as representatives of the several underwriters identified on Schedule 1 thereto (collectively, the “Underwriters”). The Company sold the Notes to the Underwriters at a price of 99.235% of the principal amount thereof, and the Underwriters offered the",,0.1
2026-04-15 00:00:00+00:00,AXON,Oilprice.com,The Rare Earth Trap: How China Outmaneuvered the Entire Western Defense Industry,https://finance.yahoo.com/sectors/energy/articles/rare-earth-trap-china-outmaneuvered-000000878.html,-0.8
2026-04-15 00:00:00+00:00,COST,SEC-EDGAR-8K,"(Item 8.01) . Other Events The Board of Directors declared a quarterly cash dividend on the Company's common stock and approved a quarterly increase from $1.30 to $1.47 per share, $5.88 on an annualized basis. The dividend was declared on April 15, 2026, and is payable May 15, 2026, to shareholders of record at the close of business on May 1, 2026.",,0.8
2026-04-15 01:10:52+00:00,TMUS,Bloomberg,Amazon’s $11.6 Billion Globalstar Deal Amps Up Musk Rivalry,https://finance.yahoo.com/markets/stocks/articles/amazon-11-6-billion-globalstar-011052479.html,0.5
2026-04-15 01:43:49+00:00,TMUS,TheStreet,T-Mobile's free in-flight Wi-Fi might be going away: Here's the better replacement,https://finance.yahoo.com/sectors/technology/articles/t-mobiles-free-flight-wi-014349860.html,0.5
2026-04-15 06:25:00+00:00,SHOP,Motley Fool,Amazon vs. Shopify: Which E-Commerce Giant Will Make You Richer?,https://finance.yahoo.com/markets/stocks/articles/amazon-vs-shopify-e-commerce-062500167.html,0.5
2026-04-15 07:09:54+00:00,CEG,Insider Monkey,Barclays Raises PT on Constellation Energy (CEG) Amid Positive Earnings Estimates,https://finance.yahoo.com/markets/stocks/articles/barclays-raises-pt-constellation-energy-070954414.html,0.8
2026-04-15 07:10:00+00:00,KDP,Zacks,"Zacks.com featured highlights include Atmos Energy, American States Water, Keurig Dr Pepper and Entergy",https://finance.yahoo.com/markets/stocks/articles/zacks-com-featured-highlights-atmos-071000558.html,0.5
2026-04-15 08:05:07+00:00,LIN,Simply Wall St.,Linde Expands North Carolina Footprint With New Air Separation Facility,https://finance.yahoo.com/markets/stocks/articles/linde-expands-north-carolina-footprint-080507030.html,0.5
2026-04-15 08:05:47+00:00,SHOP,Simply Wall St.,Avenue Z Platinum Partner Status Tests Shopify AI Commerce Expectations,https://finance.yahoo.com/markets/stocks/articles/avenue-z-platinum-partner-status-080547386.html,0.2
2026-04-15 08:06:25+00:00,WDAY,Simply Wall St.,Assessing Workday (WDAY) Valuation After Recent Share Price Weakness,https://finance.yahoo.com/markets/stocks/articles/assessing-workday-wday-valuation-recent-080625512.html,0.2
2026-04-15 08:26:27+00:00,FAST,StockStory,FAST Q1 Deep Dive: Market Share Gains and Pricing Challenges Shape Outlook,https://finance.yahoo.com/markets/stocks/articles/fast-q1-deep-dive-market-082627208.html,0.5
2026-04-15 09:00:00+00:00,MDLZ,Marketing Dive,How Mondelēz is engaging with ‘mini Super Bowl moments’ during World Cup,https://finance.yahoo.com/news/mondel-z-engaging-mini-super-090000708.html,0.5
2026-04-15 09:22:00+00:00,ADI,Zacks,Best Income Stocks to Buy for April 15th,https://finance.yahoo.com/markets/stocks/articles/best-income-stocks-buy-april-092200271.html,0.5
