timestamp,ticker,source,text,url,SentimentScore
2026-04-20 13:14:09+00:00,META,Yahoo Finance,"CEOs should be 'ringing the fire alarm' on AI reorganization, Writer co-founder says",https://finance.yahoo.com/news/ceos-should-be-ringing-the-fire-alarm-on-ai-reorganization-writer-co-founder-says-131409292.html,0.2
2026-04-20 13:15:01+00:00,ADI,Zacks,"Analog Devices, Inc. (ADI) Hits Fresh High: Is There Still Room to Run?",https://finance.yahoo.com/markets/stocks/articles/analog-devices-inc-adi-hits-131501216.html,0.5
2026-04-20 13:15:01+00:00,NFLX,Zacks,Why Netflix (NFLX) International Revenue Trends Deserve Your Attention,https://finance.yahoo.com/markets/stocks/articles/why-netflix-nflx-international-revenue-131501710.html,0.5
2026-04-20 13:15:02+00:00,CMCSA,Zacks,Countdown to Comcast (CMCSA) Q1 Earnings: Wall Street Forecasts for Key Metrics,https://finance.yahoo.com/markets/stocks/articles/countdown-comcast-cmcsa-q1-earnings-131502488.html,0.2
2026-04-20 13:15:03+00:00,KDP,Zacks,Stay Ahead of the Game With Keurig Dr Pepper (KDP) Q1 Earnings: Wall Street's Insights on Key Metrics,https://finance.yahoo.com/markets/stocks/articles/stay-ahead-game-keurig-dr-131503857.html,0.5
2026-04-20 13:15:04+00:00,ROP,Zacks,Roper Technologies (ROP) Q1 Earnings Preview: What You Should Know Beyond the Headline Estimates,https://finance.yahoo.com/markets/stocks/articles/roper-technologies-rop-q1-earnings-131504944.html,0.5
2026-04-20 13:15:05+00:00,HON,Zacks,What Analyst Projections for Key Metrics Reveal About Honeywell International (HON) Q1 Earnings,https://finance.yahoo.com/markets/stocks/articles/analyst-projections-key-metrics-reveal-131505541.html,0.2
2026-04-20 13:15:42+00:00,FANG,24/7 Wall St.,VNOM’s $100 Oil Windfall Revives Dividend Safety After 2025 Price Collapse,https://finance.yahoo.com/sectors/energy/articles/vnom-100-oil-windfall-revives-131542927.html,0.6
2026-04-20 13:16:11+00:00,BKNG,24/7 Wall St.,Wall Street’s Ratings on Booking Stock Align With Our $257.28 Price Target,https://finance.yahoo.com/markets/stocks/articles/wall-street-ratings-booking-stock-131611563.html,0.5
2026-04-20 13:17:00+00:00,MSTR,CryptoProwl,"Strategy Buys $2.5 Billion Of Bitcoin, Its Third-Largest Purchase Ever",https://finance.yahoo.com/markets/crypto/articles/strategy-buys-2-5-billion-131700151.html,0.5
2026-04-20 13:17:40+00:00,AVGO,Insider Monkey,Is Broadcom (AVGO) The Best AI Chip Stock Pick of Motley Fool?,https://finance.yahoo.com/markets/stocks/articles/broadcom-avgo-best-ai-chip-131740989.html,0.5
2026-04-20 13:19:12+00:00,MSTR,Blockspace,"Michael Saylor’s Strategy raises $2.5B, buys 34,164 Bitcoin",https://finance.yahoo.com/markets/crypto/articles/michael-saylor-8217-strategy-raises-131912237.html,0.8
2026-04-20 13:20:00+00:00,GEHC,Zacks,"10x Genomics Stock Up on Atera Launch, Spatial Biology Scale Enhanced",https://finance.yahoo.com/markets/stocks/articles/10x-genomics-stock-atera-launch-132000581.html,0.6
2026-04-20 13:20:37+00:00,NFLX,24/7 Wall St.,Cathie Wood Is Buying Netflix Again. Here’s Her Rocky History With the Stock.,https://finance.yahoo.com/markets/stocks/articles/cathie-wood-buying-netflix-again-132037133.html,0.1
2026-04-20 13:27:00+00:00,PLTR,Motley Fool,Is Palantir Stock Overvalued or Undervalued? The Answer May Surprise You.,https://finance.yahoo.com/markets/stocks/articles/palantir-stock-overvalued-undervalued-answer-132700518.html,0.2
2026-04-20 13:28:38+00:00,MSTR,decrypt,Strategy Adds $2.5 Billion in Bitcoin as STRC Dividend Traders Drive Largest Buy Since 2024,https://finance.yahoo.com/markets/crypto/articles/strategy-adds-2-5-billion-132838729.html,0.8
2026-04-20 13:30:00+00:00,NFLX,Benzinga,Trump Goes After Reed Hastings Amid Netflix Stock Rout— 'Forced' To Leave?,https://finance.yahoo.com/markets/stocks/articles/trump-goes-reed-hastings-amid-133000036.html,-0.6
2026-04-20 13:30:03+00:00,GEHC,Zacks,Earnings Growth & Price Strength Make GE HealthCare Technologies (GEHC) a Stock to Watch,https://finance.yahoo.com/markets/stocks/articles/earnings-growth-price-strength-ge-133003222.html,0.8
2026-04-20 13:30:04+00:00,DDOG,Zacks,Is Datadog (DDOG) a Buy as Wall Street Analysts Look Optimistic?,https://finance.yahoo.com/markets/stocks/articles/datadog-ddog-buy-wall-street-133004027.html,0.5
2026-04-20 13:30:05+00:00,CSCO,Zacks,Is Cisco (CSCO) a Buy as Wall Street Analysts Look Optimistic?,https://finance.yahoo.com/markets/stocks/articles/cisco-csco-buy-wall-street-133005764.html,0.6
2026-04-20 13:33:54+00:00,NXPI,The Fly,"Qorvo downgraded, Ulta Beauty upgraded: Wall Street's top analyst calls",https://finance.yahoo.com/markets/stocks/articles/qorvo-downgraded-ulta-beauty-upgraded-133354484.html,0.2
2026-04-20 13:34:37+00:00,WDC,Insider Monkey,Western Digital Corp (WDC) Gained from Increased Investment in Hyperscaler Data Centers and Growing Data Volumes,https://finance.yahoo.com/markets/stocks/articles/western-digital-corp-wdc-gained-133437135.html,0.6
2026-04-20 13:35:00+00:00,BKR,Motley Fool,"As Trump Pushes for ""Energy Dominance,"" 3 Core Energy Holdings Stand Out for Patient Investors",https://finance.yahoo.com/sectors/energy/articles/trump-pushes-energy-dominance-3-133500763.html,0.5
2026-04-20 13:36:33+00:00,LRCX,24/7 Wall St.,Nasdaq Composite Battles Oil Price Fears Ahead of High-Stakes Tech Earnings,https://finance.yahoo.com/markets/stocks/articles/nasdaq-composite-battles-oil-price-133633592.html,0.2
2026-04-20 13:40:03+00:00,GEHC,Zacks,Here's Why GE HealthCare Technologies (GEHC) is a Strong Value Stock,https://finance.yahoo.com/markets/stocks/articles/heres-why-ge-healthcare-technologies-134003258.html,0.8
2026-04-20 13:42:44+00:00,PDD,Insider Monkey,PDD Holdings (PDD): The Best Profitable Undervalued Stock to Buy Now,https://finance.yahoo.com/markets/stocks/articles/pdd-holdings-pdd-best-profitable-134244939.html,0.8
2026-04-20 13:42:59+00:00,PYPL,Insider Monkey,Mizuho Downgrades PayPal (PYPL) to Neutral,https://finance.yahoo.com/markets/stocks/articles/mizuho-downgrades-paypal-pypl-neutral-134259359.html,-0.5
2026-04-20 13:43:00+00:00,HON,Zacks,Honeywell Gears Up to Post Q1 Earnings: What Lies Ahead for the Stock?,https://finance.yahoo.com/markets/stocks/articles/honeywell-gears-post-q1-earnings-134300813.html,0.5
2026-04-20 13:43:06+00:00,ADBE,Insider Monkey,RBC Capital Maintains Outperform Rating on Adobe (ADBE),https://finance.yahoo.com/markets/stocks/articles/rbc-capital-maintains-outperform-rating-134306830.html,0.5
2026-04-20 13:43:16+00:00,MRVL,GuruFocus.com,Marvell Stock Pops on Reports of Google AI Chip Deal to Challenge Nvidia,https://finance.yahoo.com/markets/stocks/articles/marvell-stock-pops-reports-google-134316098.html,0.6
2026-04-20 13:44:00+00:00,CHTR,Zacks,Does T Stock Deserve a Spot in Your Portfolio Ahead of Q1 Earnings?,https://finance.yahoo.com/markets/stocks/articles/does-t-stock-deserve-spot-134400736.html,0.2
2026-04-20 13:45:01+00:00,AMD,Zacks,Here's Why Advanced Micro Devices (AMD) is a Strong Growth Stock,https://finance.yahoo.com/markets/stocks/articles/heres-why-advanced-micro-devices-134501854.html,0.8
2026-04-20 13:49:00+00:00,MAR,Zacks,Boyd Gaming to Post Q1 Earnings: What's in Store for the Stock?,https://finance.yahoo.com/markets/stocks/articles/boyd-gaming-post-q1-earnings-134900046.html,0.2
2026-04-20 13:57:11+00:00,APP,Insider Monkey,Should You Be Constructive on AppLovin Corp’s (APP) Long-Term Trajectory?,https://finance.yahoo.com/markets/stocks/articles/constructive-applovin-corp-app-long-135711472.html,0.2
2026-04-20 14:00:08+00:00,MNST,Simply Wall St.,"If EPS Growth Is Important To You, Monster Beverage (NASDAQ:MNST) Presents An Opportunity",https://finance.yahoo.com/markets/stocks/articles/eps-growth-important-monster-beverage-140008954.html,0.5
2026-04-20 14:01:00+00:00,MAR,Zacks,Las Vegas Sands' Gears Up for Q1 Earnings: What's in Store?,https://finance.yahoo.com/markets/stocks/articles/las-vegas-sands-gears-q1-140100067.html,0.5
2026-04-20 14:06:00+00:00,TXN,Zacks,TXN to Report Q1 Earnings: What's in the Cards for the Stock?,https://finance.yahoo.com/markets/stocks/articles/txn-report-q1-earnings-whats-140600179.html,0.2
2026-04-20 14:07:00+00:00,COST,Zacks,Can Dollar General Sustain Margin Expansion in Fiscal 2026?,https://finance.yahoo.com/markets/stocks/articles/dollar-general-sustain-margin-expansion-140700827.html,0.1
2026-04-20 14:09:00+00:00,COST,Zacks,Walmart Expands and Modernizes Stores to Support Omnichannel Growth,https://finance.yahoo.com/markets/stocks/articles/walmart-expands-modernizes-stores-support-140900217.html,0.5
2026-04-20 14:10:34+00:00,MSTR,Bloomberg,"Strategy Buys $2.54 Billion of Bitcoin, Most Since Late 2024",https://finance.yahoo.com/news/strategy-buys-2-54-billion-141034963.html,0.5
2026-04-20 14:13:00+00:00,ADBE,Reuters,Adobe launches AI suite for corporate clients as competition heats up,https://finance.yahoo.com/sectors/technology/articles/adobe-launches-ai-suite-corporate-141300542.html,0.5
2026-04-20 14:16:20+00:00,MSTR,Barchart,MicroStrategy Just Entered Overbought Territory. How Should You Trade MSTR Stock Here?,https://finance.yahoo.com/markets/stocks/articles/microstrategy-just-entered-overbought-territory-141620371.html,0.2
2026-04-20 14:17:00+00:00,REGN,Zacks,ANIP's Cortrophin Gel Surge Powers 2026 Growth Outlook,https://finance.yahoo.com/sectors/healthcare/articles/anips-cortrophin-gel-surge-powers-141700749.html,0.5
2026-04-20 14:18:00+00:00,REGN,Zacks,Is ANIP Stock Undervalued at 10x Forward Earnings and $93 Target?,https://finance.yahoo.com/markets/stocks/articles/anip-stock-undervalued-10x-forward-141800818.html,0.5
2026-04-20 14:18:51+00:00,MSTR,BeInCrypto,"MicroStrategy Makes Biggest Bitcoin Buy Since 2024, Will It Move BTC Price?",https://finance.yahoo.com/markets/crypto/articles/microstrategy-makes-biggest-bitcoin-buy-141851431.html,0.5
2026-04-20 14:19:00+00:00,REGN,Zacks,ANI Pharmaceuticals' 2026 Catalysts Include Gout Push and New Generics,https://finance.yahoo.com/sectors/healthcare/articles/ani-pharmaceuticals-2026-catalysts-gout-141900904.html,0.5
2026-04-20 14:19:00+00:00,TMUS,Zacks,Can AT&T's Modern Automotive Connectivity Features Buoy Growth?,https://finance.yahoo.com/sectors/technology/articles/ts-modern-automotive-connectivity-features-141900363.html,0.5
2026-04-20 14:20:00+00:00,AVGO,MoneyShow,"Market Minute 4-20-26- Oil Pops, Stocks Slide on Fading Peace Hopes",https://finance.yahoo.com/markets/stocks/articles/market-minute-4-20-26-142000235.html,-0.6
2026-04-20 14:28:00+00:00,MPWR,Zacks,STMicroelectronics to Post Q1 Earnings: What's in Store for the Stock?,https://finance.yahoo.com/markets/stocks/articles/stmicroelectronics-post-q1-earnings-whats-142800751.html,0.2
2026-04-20 14:28:00+00:00,STX,Zacks,Can Western Digital's Strong Cash Flow Outweigh its Leverage Concerns?,https://finance.yahoo.com/markets/stocks/articles/western-digitals-strong-cash-flow-142800978.html,0.2
2026-04-20 14:33:04+00:00,TSLA,24/7 Wall St.,Intel Finally Has a Shot at a Comeback—If It Can Execute,https://finance.yahoo.com/markets/stocks/articles/intel-finally-shot-comeback-execute-143304014.html,0.5
2026-04-20 14:43:00+00:00,BKR,Zacks,Baker Hughes to Report Q1 Earnings: What's in Store for the Stock?,https://finance.yahoo.com/markets/stocks/articles/baker-hughes-report-q1-earnings-144300224.html,0.0
2026-04-20 14:45:35+00:00,AMZN,Yahoo Finance,Why the tech stock rally may only be starting,https://finance.yahoo.com/news/why-the-tech-stock-rally-may-only-be-starting-144535609.html,0.5
2026-04-20 14:48:54+00:00,TSLA,Insider Monkey,Here’s Why Rowan Street Capital Holds Steady on Tesla (TSLA),https://finance.yahoo.com/markets/stocks/articles/why-rowan-street-capital-holds-144854252.html,0.2
2026-04-20 14:49:00+00:00,ROP,Zacks,Roper Technologies Set to Report Q1 Earnings: What's in the Cards?,https://finance.yahoo.com/markets/stocks/articles/roper-technologies-set-report-q1-144900780.html,0.2
2026-04-20 14:50:52+00:00,SHOP,Insider Monkey,Shopify (SHOP) Surged Over 40% CAGR Since IPO,https://finance.yahoo.com/markets/stocks/articles/shopify-shop-surged-over-40-145052373.html,0.8
2026-04-20 14:55:16+00:00,INTU,24/7 Wall St.,3 Criminally Undervalued Software Stocks to Back Up the Truck On,https://finance.yahoo.com/markets/stocks/articles/3-criminally-undervalued-software-stocks-145516831.html,0.5
2026-04-20 15:00:00+00:00,ARM,Zacks,ARM Appears Expensive to Its Industry: Is the Premium Warranted?,https://finance.yahoo.com/markets/stocks/articles/arm-appears-expensive-industry-premium-150000037.html,-0.5
2026-04-20 15:02:54+00:00,META,Yahoo Finance Video,"Marvell–Google AI talks, Trump EO boosts psychedelic stocks",https://finance.yahoo.com/video/marvell-google-ai-talks-trump-eo-boosts-psychedelic-stocks-150254801.html,0.2
2026-04-20 15:06:13+00:00,ARM,Simply Wall St.,Why Arm Holdings (ARM) Is Up 5.8% After New Telco-Focused AI Server Collaboration Announcement,https://finance.yahoo.com/markets/stocks/articles/why-arm-holdings-arm-5-150613558.html,0.6
2026-04-20 15:06:23+00:00,AMD,24/7 Wall St.,Stifel Raises AMD Target to $320: Is the AI Chip Rally Just Getting Started?,https://finance.yahoo.com/markets/stocks/articles/stifel-raises-amd-target-320-150623365.html,0.8
2026-04-20 15:07:19+00:00,MRVL,Simply Wall St.,Alphabet’s Marvell AI Chip Talks Put Google Cloud Efficiency In Focus,https://finance.yahoo.com/sectors/technology/articles/alphabet-marvell-ai-chip-talks-150719822.html,0.6
2026-04-20 15:11:05+00:00,TSLA,Yahoo Finance,2 charts show why Magnificent 7 stocks are being loved again,https://finance.yahoo.com/news/2-charts-show-why-magnificent-7-stocks-are-being-loved-again-151105348.html,0.6
2026-04-20 15:12:51+00:00,COST,reddit.com/r/stocks,37yrs old. Medium to long-term investing horizon. I'd love advice on if/how I should rebalance my portfolio. - Here are my current holdings and average costs: | Description | Percent Of Account | Average Cost Basis | |:---------------------------|---------------------:|---------------------:| | NVIDIA | 0.4283 | 14.6 | | SANDISK | 0.1664 | 709.45 | | MICRON TECHNOLOGY INC | 0.1448 | 300.82 | | ALPHA TAU MEDICAL | 0.113 | 7.41 | | MICROSOFT CORP | 0.107,,0.0
2026-04-20 15:13:01+00:00,ROP,Motley Fool,Vita Coco's CEO Sold Company Shares Worth $1.25 Million. Here's What That Means for Investors.,https://finance.yahoo.com/markets/stocks/articles/vita-cocos-ceo-sold-company-151301005.html,-0.2
2026-04-20 15:16:27+00:00,PLTR,24/7 Wall St.,Palantir Technologies Is About to Control the Skies With AI,https://finance.yahoo.com/sectors/technology/articles/palantir-technologies-control-skies-ai-151627134.html,0.8
2026-04-20 15:16:47+00:00,MSTR,Exec Edge,"AlphaTON Capital Rebrands to Alpha Compute, Expands AI Computing Business",https://finance.yahoo.com/sectors/technology/articles/alphaton-capital-rebrands-alpha-compute-151647225.html,0.5
2026-04-20 15:18:11+00:00,TSLA,Barchart,Can Q1 Earnings Push Tesla Stock Toward $600?,https://finance.yahoo.com/markets/stocks/articles/q1-earnings-push-tesla-stock-151811218.html,0.5
2026-04-20 15:20:00+00:00,MRVL,Proactive,Marvell falls back after reports on Google AI chip talks disputed by analysts,https://finance.yahoo.com/markets/stocks/articles/marvell-falls-back-reports-google-152000573.html,-0.5
2026-04-20 15:20:00+00:00,AEP,Motley Fool,Better Utility Stock: American Electric Power vs. NextEra Energy,https://finance.yahoo.com/sectors/energy/articles/better-utility-stock-american-electric-152000418.html,0.5
2026-04-20 15:33:21+00:00,PLTR,Barchart,Morgan Stanley Says Palantir Stock Can Keep Accelerating Revenue Growth. Load Up on PLTR Here.,https://finance.yahoo.com/markets/stocks/articles/morgan-stanley-says-palantir-stock-153321510.html,0.6
2026-04-20 15:33:23+00:00,NFLX,Fortune,Italian court rules every Netflix price hike from 2017 to 2024 unlawful and orders the company to refund subscribers up to 500 euros,https://finance.yahoo.com/economy/policy/articles/italian-court-rules-every-netflix-153323196.html,0.5
2026-04-20 15:36:00+00:00,PYPL,Zacks,MA vs. PYPL: Which Digital Payments Stock Has More Room to Run?,https://finance.yahoo.com/markets/stocks/articles/ma-vs-pypl-digital-payments-153600659.html,0.2
2026-04-20 15:36:00+00:00,COST,Zacks,Costco's Digital Investments Drive Sales Growth: What Comes Next?,https://finance.yahoo.com/markets/stocks/articles/costcos-digital-investments-drive-sales-153600437.html,0.5
2026-04-20 15:40:04+00:00,ABNB,Zacks,DUFRY vs. ABNB: Which Stock Is the Better Value Option?,https://finance.yahoo.com/markets/stocks/articles/dufry-vs-abnb-stock-better-154004381.html,0.2
2026-04-20 15:42:50+00:00,QCOM,Barchart,Qualcomm Just Increased Its Dividend. Should You Buy QCOM Stock Here?,https://finance.yahoo.com/markets/stocks/articles/qualcomm-just-increased-dividend-buy-154250918.html,0.5
2026-04-20 15:44:18+00:00,TSLA,24/7 Wall St.,Tesla May Have a Big Surprise in Store for Investors on April 22,https://finance.yahoo.com/markets/stocks/articles/tesla-may-big-surprise-store-154418793.html,0.6
2026-04-20 15:48:09+00:00,MRVL,Investopedia,Google Deal Talks Send This AI Chip Designer's Stock to New Highs,https://finance.yahoo.com/markets/stocks/articles/google-deal-talks-send-ai-154809337.html,0.8
2026-04-20 15:49:06+00:00,AMGN,Barchart,What to Expect From Amgen's Next Quarterly Earnings Report,https://finance.yahoo.com/sectors/healthcare/articles/expect-amgens-next-quarterly-earnings-154906289.html,0.2
2026-04-20 15:50:00+00:00,AVGO,Motley Fool,"Up Nearly 800% in 5 Years, How Much Higher Can Broadcom Stock Go?",https://finance.yahoo.com/markets/stocks/articles/nearly-800-5-years-much-155000921.html,0.8
2026-04-20 15:50:34+00:00,ADBE,Yahoo Finance Video,How Adobe is setting a good example for the software sector,https://finance.yahoo.com/video/how-adobe-is-setting-a-good-example-for-the-software-sector-155034367.html,0.8
2026-04-20 16:05:27+00:00,TSLA,Barchart,Tesla Q1 Earnings Are Due April 22. Is TSLA Stock a Buy Before the Report?,https://finance.yahoo.com/markets/stocks/articles/tesla-q1-earnings-due-april-160527491.html,0.5
2026-04-20 16:10:02+00:00,LIN,Zacks,Will Linde (LIN) Beat Estimates Again in Its Next Earnings Report?,https://finance.yahoo.com/markets/stocks/articles/linde-lin-beat-estimates-again-161002293.html,0.2
2026-04-20 16:10:03+00:00,MPWR,Zacks,Will Monolithic (MPWR) Beat Estimates Again in Its Next Earnings Report?,https://finance.yahoo.com/markets/stocks/articles/monolithic-mpwr-beat-estimates-again-161003696.html,0.2
2026-04-20 16:30:57+00:00,AVGO,GuruFocus.com,Why Intel Stock Is Sliding Today,https://finance.yahoo.com/markets/stocks/articles/why-intel-stock-sliding-today-163057260.html,-0.5
2026-04-20 16:39:52+00:00,ADBE,GuruFocus.com,Why Adobe Stock Is Climbing Today,https://finance.yahoo.com/markets/stocks/articles/why-adobe-stock-climbing-today-163952603.html,0.5
2026-04-20 17:00:26+00:00,WMT,LA Times,"Amazon pressured Levi's, other retailers to hike prices, California A.G. says",https://finance.yahoo.com/economy/policy/articles/atty-gen-bonta-says-evidence-170026491.html,-0.8
2026-04-20 17:01:41+00:00,MSFT,reddit.com/r/stocks,"I need advice for a 2k portfolio - I have a portfolio of $2,000 put into JEPI, SPHD, ARCC, VOO, and some smaller amounts in INTC and MSFT. Is this good for High dividend yield and growth overtime? I'm looking for the best stocks to invest into with Low volatility, and high yield. What should I invest this into? Any advice is welcome and appreciated I was looking for something with at least 5% yield",,0.5
2026-04-20 17:03:27+00:00,COST,GuruFocus.com,Costco and FedEx Face Lawsuits Over Tariff Refunds,https://finance.yahoo.com/economy/policy/articles/costco-fedex-face-lawsuits-over-170327793.html,-0.5
2026-04-20 17:04:42+00:00,PLTR,Simply Wall St.,Palantir Tax Debate Puts Political Risk And Cash Flow In Focus,https://finance.yahoo.com/markets/stocks/articles/palantir-tax-debate-puts-political-170442139.html,0.2
2026-04-20 17:05:00+00:00,TSLA,Motley Fool,Bull vs Bear: Is Tesla Stock a Buy or Sell?,https://finance.yahoo.com/markets/stocks/articles/bull-vs-bear-tesla-stock-170500427.html,0.0
2026-04-20 17:05:35+00:00,TSLA,Simply Wall St.,Tesla Terafab AI Chips Add New Layer To High Valuation Debate,https://finance.yahoo.com/markets/stocks/articles/tesla-terafab-ai-chips-add-170535955.html,0.5
2026-04-20 17:10:58+00:00,TSLA,Barchart,"As Tesla Tapes Out the AI5 Chip, Should You Buy, Sell, or Hold TSLA Stock?",https://finance.yahoo.com/markets/stocks/articles/tesla-tapes-ai5-chip-buy-171058012.html,0.2
2026-04-20 17:11:00+00:00,TXN,Motley Fool,Here Are 2 Chip Stocks Reporting Earnings This Week That You Won't Want to Miss,https://finance.yahoo.com/markets/stocks/articles/2-chip-stocks-reporting-earnings-171100971.html,0.5
2026-04-20 17:16:07+00:00,META,Social Media Today,"Meta plans large-scale job cuts beginning in May, says Reuters",https://finance.yahoo.com/sectors/technology/articles/meta-plans-large-scale-job-171607089.html,-0.8
2026-04-20 17:17:32+00:00,BKNG,StockStory,"Booking (BKNG): Buy, Sell, or Hold Post Q4 Earnings?",https://finance.yahoo.com/markets/stocks/articles/booking-bkng-buy-sell-hold-171732167.html,0.2
2026-04-20 17:20:00+00:00,MU,Motley Fool,Here's Why Analysts Think Micron Technologies Stock Can Hit $600,https://finance.yahoo.com/markets/stocks/articles/heres-why-analysts-think-micron-172000817.html,0.8
2026-04-20 17:23:08+00:00,GOOG,reddit.com/r/stocks,"Market and traders are vastly underestimating the risks here with mega cap tech earnings coming up. Specifically the software names. - I've been doing research in free time for the last week or two and have learned a lot about exactly how much GOOG, AMZN, and MSFT are spending on AI buildout. And what their current revenue growth rates are expected to be in 2026. First off, as many have been saying, they are spending",,-0.5
2026-04-20 17:25:32+00:00,MRVL,StockStory,2 Surging  Stocks to Consider Right Now and 1 That Underwhelm,https://finance.yahoo.com/markets/stocks/articles/2-surging-stocks-consider-now-172532162.html,0.2
2026-04-20 17:36:17+00:00,APP,Simply Wall St.,April 2026's Top Growth Stocks With Strong Insider Ownership,https://finance.yahoo.com/markets/stocks/articles/april-2026s-top-growth-stocks-173617948.html,0.5
2026-04-20 17:37:26+00:00,MRVL,GuruFocus.com,Marvell Gains on Report of Google AI Chip Talks,https://finance.yahoo.com/sectors/technology/articles/marvell-gains-report-google-ai-173726609.html,0.5
2026-04-20 17:38:02+00:00,SNDK,GuruFocus.com,Wells Fargo revamps Sandisk stock price target for rest of year,https://finance.yahoo.com/markets/stocks/articles/wells-fargo-revamps-sandisk-stock-173802223.html,0.5
2026-04-20 17:44:00+00:00,COST,TheStreet,Costco ramps up expansion plans,https://finance.yahoo.com/markets/stocks/articles/costco-ramps-expansion-plans-174400493.html,0.5
2026-04-20 17:49:00+00:00,STX,Proactive,Seagate Technology price target boosted by Bank of America ahead of quarterly report,https://finance.yahoo.com/markets/stocks/articles/seagate-technology-price-target-boosted-174900351.html,0.5
2026-04-20 17:50:00+00:00,NFLX,Motley Fool,Netflix's Durable Competitive Advantage: What Investors Need to Know,https://finance.yahoo.com/markets/stocks/articles/netflixs-durable-competitive-advantage-investors-175000293.html,0.5
2026-04-20 17:57:32+00:00,KLAC,StockStory,1 Mooning  Stock on Our Buy List and 2 We Turn Down,https://finance.yahoo.com/markets/stocks/articles/1-mooning-stock-buy-list-175732783.html,0.2
2026-04-20 18:01:41+00:00,MU,GuruFocus.com,"Intel, AMD Rally Faces Quiet Challenge",https://finance.yahoo.com/markets/stocks/articles/intel-amd-rally-faces-quiet-180141441.html,0.1
2026-04-20 18:01:52+00:00,GOOGL,reddit.com/r/stocks,"I'm Bullish GOOGL ,what do you think of GOOGL - I’d like to share my current thesis and position on Googl,I’ve been adding to my position recently around the $300 mark, tbh, I see a clear path for the stock to double over the long term. We’ve seen a solid run for tech over the past year, and the pullback Cuz of the war,we saw in late February provided a necessary cooling off period for",,0.8
2026-04-20 18:04:17+00:00,ADBE,GuruFocus.com,Adobe Tries To Stay In The AI Race,https://finance.yahoo.com/sectors/technology/articles/adobe-tries-stay-ai-race-180417290.html,0.1
2026-04-20 18:04:54+00:00,TMUS,TipRanks,Morgan Stanley Taps 2 Stocks as Its Top Picks for 2026,https://finance.yahoo.com/markets/stocks/articles/morgan-stanley-taps-2-stocks-180454908.html,0.5
2026-04-20 18:05:28+00:00,META,Barchart,"Snap Just Announced Major Layoffs: What Do 1,000 (16%) Job Cuts Mean for SNAP Stock?",https://finance.yahoo.com/markets/stocks/articles/snap-just-announced-major-layoffs-180528697.html,-0.6
2026-04-20 18:05:40+00:00,MSTR,CoinDesk,Strategy’s STRC dividend move and tokenizing the $70T U.S. equity market,https://finance.yahoo.com/video/strategy-strc-dividend-move-tokenizing-180540809.html,0.2
2026-04-20 18:07:43+00:00,META,Benzinga,"Ramit Sethi Tells Bill Ackman, 'Wealthy People Used To Build Libraries, Not Post 40,000-Word Incoherent Rants On Twitter.' Here's Why",https://finance.yahoo.com/economy/policy/articles/ramit-sethi-tells-bill-ackman-180743152.html,0.2
2026-04-20 18:29:32+00:00,FANG,StockStory,3 Market-Beating Stocks on Our Buy List,https://finance.yahoo.com/markets/stocks/articles/3-market-beating-stocks-buy-182932567.html,0.5
2026-04-20 18:30:50+00:00,DASH,Schaeffer's Investment Research,3 Reasons to Stay Away From Surging DoorDash Stock,https://finance.yahoo.com/markets/stocks/articles/3-reasons-stay-away-surging-183050640.html,-0.8
2026-04-20 18:37:45+00:00,MSFT,GuruFocus.com,Microsoft Looks Ready To Flip The Script,https://finance.yahoo.com/markets/stocks/articles/microsoft-looks-ready-flip-script-183745299.html,0.8
2026-04-20 18:39:15+00:00,MU,GuruFocus.com,Micron Quietly Powers S&P Earnings Surge,https://finance.yahoo.com/markets/stocks/articles/micron-quietly-powers-p-earnings-183915070.html,0.6
