timestamp,ticker,source,text,url,SentimentScore
2026-03-19 09:00:00+00:00,HON,Oilprice.com,A New U.S. Facility Could Break China’s Grip on Critical Materials,https://finance.yahoo.com/sectors/energy/articles/u-facility-could-break-china-090000240.html,0.5
2026-03-19 09:38:00+00:00,MDLZ,Food Dive,How Mondelēz identifies the next disruptive snacking trends,https://finance.yahoo.com/sectors/healthcare/articles/mondel-z-identifies-next-disruptive-093800569.html,0.2
2026-03-19 10:00:00+00:00,HON,The Wall Street Journal,Why Companies Are Chopping Up Big Bond Deals Into Smaller Pieces,https://www.wsj.com/business/c-suite/why-companies-are-chopping-up-big-bond-deals-into-smaller-pieces-e00719fb?siteid=yhoof2&yptr=yahoo,0.1
2026-03-19 10:02:00+00:00,ADI,PR Newswire,Analog Devices Strengthens Global Manufacturing Resilience with New Thailand Facility,https://finance.yahoo.com/sectors/technology/articles/analog-devices-strengthens-global-manufacturing-100200759.html,0.6
2026-03-19 11:12:00+00:00,INTU,Zacks,Globant Expands Adyen Partnership to Enhance Payment Ecosystems,https://finance.yahoo.com/markets/stocks/articles/globant-expands-adyen-partnership-enhance-111200474.html,0.5
2026-03-19 11:24:30+00:00,CTSH,Reuters,Accenture beats quarterly revenue estimates on strong AI demand,https://finance.yahoo.com/markets/stocks/articles/accenture-forecasts-quarterly-revenue-below-112430221.html,0.8
2026-03-19 11:25:38+00:00,KHC,StockStory,Q4 Earnings Highlights: Kraft Heinz (NASDAQ:KHC) Vs The Rest Of The Shelf-Stable Food Stocks,https://finance.yahoo.com/markets/stocks/articles/q4-earnings-highlights-kraft-heinz-112538769.html,0.2
2026-03-19 12:00:00+00:00,MCHP,GlobeNewswire,New BZPACK mSiC® Power Modules Are Designed for Demanding Applications in Harsh Environments,https://finance.yahoo.com/sectors/technology/articles/bzpack-msic-power-modules-designed-120000705.html,0.6
2026-03-19 12:06:22+00:00,STX,Investor's Business Daily,Dow Jones Futures Fall As Global Oil Prices Jump; Micron Falls Despite Blowout Earnings,https://www.investors.com/market-trend/stock-market-today/dow-jones-futures-global-oil-prices-micron-earnings-guidance/?src=A00220&yptr=yahoo,-0.5
2026-03-19 12:06:40+00:00,ZS,Simply Wall St.,Reassessing Zscaler (ZS) After Recent Share Price Weakness And Cash Flow Forecasts,https://finance.yahoo.com/markets/stocks/articles/reassessing-zscaler-zs-recent-share-120640407.html,0.2
2026-03-19 12:20:38+00:00,MNST,StockStory,3 Quality Compounders with Impressive Fundamentals,https://finance.yahoo.com/markets/stocks/articles/3-quality-compounders-impressive-fundamentals-122038014.html,0.6
2026-03-19 12:25:00+00:00,ADP,Motley Fool,1 Magnificent S&P 500 Dividend Stock Down 36% to Buy and Hold Forever,https://finance.yahoo.com/markets/stocks/articles/1-magnificent-p-500-dividend-122500343.html,0.8
2026-03-19 12:30:00+00:00,TXN,Zacks,Texas Instruments Introduces 800V Power Tech for AI Data Centers,https://finance.yahoo.com/sectors/technology/articles/texas-instruments-introduces-800v-power-123000056.html,0.5
2026-03-19 12:30:38+00:00,EA,StockStory,1 S&P 500 Stock to Consider Right Now and 2 We Avoid,https://finance.yahoo.com/markets/stocks/articles/1-p-500-stock-consider-123038329.html,0.2
2026-03-19 12:43:00+00:00,KLAC,Zacks,Can Lam Research's Systems Business Sustain Growth Amid AI Capex Boom?,https://finance.yahoo.com/sectors/technology/articles/lam-researchs-systems-business-sustain-124300350.html,0.2
2026-03-19 13:00:00+00:00,HON,GlobeNewswire,SBA Celebrates Success of First-Ever Made In America Matchmaking Expo for Suppliers and Manufacturers,https://finance.yahoo.com/economy/policy/articles/sba-celebrates-success-first-ever-130000303.html,0.8
2026-03-19 13:00:00+00:00,CMCSA,Business Wire,"Ultra-Fast, Reliable Internet from Xfinity Now Available in Miami-Dade’s Coastal Communities",https://finance.yahoo.com/sectors/technology/articles/ultra-fast-reliable-internet-xfinity-130000398.html,0.8
2026-03-19 13:00:00+00:00,WDAY,PR Newswire,PairSoft Acquires Nimbello to Expand AI-Powered SaaS Offerings,https://finance.yahoo.com/sectors/technology/articles/pairsoft-acquires-nimbello-expand-ai-130000002.html,0.5
2026-03-19 13:07:00+00:00,PEP,Food Dive,‘Not all proteins are created equal’: Inside PepsiCo’s approach to functional ingredients,https://finance.yahoo.com/sectors/healthcare/articles/not-proteins-created-equal-inside-130700217.html,0.5
2026-03-19 13:12:00+00:00,GEHC,Zacks,Hologic's Women's Health Index Flags Alarming Gaps in STI Screening,https://finance.yahoo.com/sectors/healthcare/articles/hologics-womens-health-index-flags-131200905.html,-0.5
2026-03-19 13:12:00+00:00,ABNB,Motley Fool,2 Artificial Intelligence (AI) Stocks With Millionaire-Making Potential That Wall Street Is Overlooking,https://finance.yahoo.com/markets/stocks/articles/2-artificial-intelligence-ai-stocks-131200879.html,0.5
2026-03-19 13:20:00+00:00,CMCSA,ACCESS Newswire,CBMJ CEO Rips Legacy Liberal Media Over Iran Coverage on The Schaftlein Report,https://finance.yahoo.com/markets/stocks/articles/cbmj-ceo-rips-legacy-liberal-132000232.html,0.2
2026-03-19 13:30:00+00:00,TEAM,Business Wire,Andersen Consulting Expands Technology Platform in France,https://finance.yahoo.com/sectors/technology/articles/andersen-consulting-expands-technology-platform-133000276.html,0.5
2026-03-19 13:39:47+00:00,ADP,The Fly,"Micron downgraded, Five Below upgraded: Wall Street's top analyst calls",https://finance.yahoo.com/markets/stocks/articles/micron-downgraded-five-below-upgraded-133947861.html,0.2
2026-03-19 13:54:00+00:00,CDNS,PR Newswire,"Flexcompute Launches PhotonForge Connector for Cadence Virtuoso Studio, Advancing Integrated Photonic Design Workflows for AI Data Centers",https://finance.yahoo.com/sectors/technology/articles/flexcompute-launches-photonforge-connector-cadence-135400924.html,0.6
2026-03-19 14:00:00+00:00,TMUS,Business Wire,"Connect (X) 2026 to Feature AI Network and Edge Leaders from NVIDIA, Nokia, T-Mobile, American Tower, Intel, JLL, Qualcomm",https://finance.yahoo.com/sectors/technology/articles/connect-x-2026-feature-ai-140000663.html,0.6
2026-03-19 14:06:09+00:00,DDOG,Simply Wall St.,Datadog Targets AI Driven Observability And Compliance Focused Growth In Regulated Sectors,https://finance.yahoo.com/markets/stocks/articles/datadog-targets-ai-driven-observability-140609528.html,0.5
2026-03-19 14:21:00+00:00,ZS,Zacks,CrowdStrike vs. Zscaler: Which Cybersecurity Stock Has an Edge?,https://finance.yahoo.com/markets/stocks/articles/crowdstrike-vs-zscaler-cybersecurity-stock-142100493.html,0.2
2026-03-19 14:24:00+00:00,ZS,Zacks,Can Strategic AI Partnerships Drive CrowdStrike's Long-Term Growth?,https://finance.yahoo.com/sectors/technology/articles/strategic-ai-partnerships-drive-crowdstrikes-142400281.html,0.5
2026-03-19 14:30:00+00:00,SBUX,Zacks,Dutch Bros Loyalty Hits 15M Members: Is Engagement Driving Sales?,https://finance.yahoo.com/markets/stocks/articles/dutch-bros-loyalty-hits-15m-143000331.html,0.5
2026-03-19 14:30:38+00:00,CSGP,StockStory,1 Growth Stock with All-Star Potential and 2 That Underwhelm,https://finance.yahoo.com/markets/stocks/articles/1-growth-stock-star-potential-143038072.html,0.2
2026-03-19 14:33:00+00:00,REGN,Zacks,Can Alnylam's Pipeline Drugs Sustain Long-Term Growth Ahead?,https://finance.yahoo.com/sectors/healthcare/articles/alnylams-pipeline-drugs-sustain-long-143300917.html,0.2
2026-03-19 14:41:00+00:00,DDOG,Zacks,Datadog Stock Surges 27% in a Year: Time to Hold or Book Profits?,https://finance.yahoo.com/markets/stocks/articles/datadog-stock-surges-27-time-144100643.html,0.5
2026-03-19 14:44:00+00:00,ADP,Zacks,Can Workday's AI Expansion Through Sana Boost Its Future Profits?,https://finance.yahoo.com/sectors/technology/articles/workdays-ai-expansion-sana-boost-144400354.html,0.5
2026-03-19 14:46:16+00:00,ABNB,Benzinga,Chamath Palihapitiya Plans Robotaxi Fleets Nationwide — Expects Positive Cash Flow In Under 2 Years,https://finance.yahoo.com/sectors/technology/articles/chamath-palihapitiya-plans-robotaxi-fleets-144616713.html,0.8
2026-03-19 14:48:00+00:00,GEHC,Zacks,GEHC & Springbok Collaborate on MRI Muscle Analysis for Sports,https://finance.yahoo.com/sectors/healthcare/articles/gehc-springbok-collaborate-mri-muscle-144800655.html,0.5
2026-03-19 14:52:26+00:00,ROP,24/7 Wall St.,3 Dividend Aristocrat Stocks That Are Dirt Cheap Right Now,https://finance.yahoo.com/markets/stocks/articles/3-dividend-aristocrat-stocks-dirt-145226452.html,0.5
2026-03-19 15:00:00+00:00,WDAY,PR Newswire,Harness Selected by Workday to Power Agentic AI Software Delivery at Enterprise Scale,https://finance.yahoo.com/sectors/technology/articles/harness-selected-workday-power-agentic-150000545.html,0.5
2026-03-19 15:04:31+00:00,GEHC,Simply Wall St.,Stryker Investors Weigh Cyberattack Recovery As CEO Joins GE HealthCare Board,https://finance.yahoo.com/markets/stocks/articles/stryker-investors-weigh-cyberattack-recovery-150431809.html,0.1
2026-03-19 15:05:16+00:00,FTNT,Simply Wall St.,A Look At Fortinet (FTNT) Valuation After Its Accelerate 2026 SecOps And FortiOS 8.0 Launch,https://finance.yahoo.com/markets/stocks/articles/look-fortinet-ftnt-valuation-accelerate-150516931.html,0.2
2026-03-19 15:10:00+00:00,INTU,MT Newswires,"Intuit Fiscal Q3 Seen as Catalyst for Tax-Season Visibility, Growth, Morgan Stanley Says",https://finance.yahoo.com/markets/stocks/articles/intuit-fiscal-q3-seen-catalyst-151000586.html,0.5
2026-03-19 15:22:00+00:00,TMUS,Zacks,AT&T vs. Verizon: Which Telecom Stock Has Better Upside Now?,https://finance.yahoo.com/markets/stocks/articles/t-vs-verizon-telecom-stock-152200014.html,0.5
2026-03-19 15:30:03+00:00,LIN,Zacks,Celanese (CE) Up 9.2% Since Last Earnings Report: Can It Continue?,https://finance.yahoo.com/markets/stocks/articles/celanese-ce-9-2-since-153003273.html,0.5
2026-03-19 15:30:03+00:00,CDNS,Zacks,Why Is Cadence (CDNS) Down 5% Since Last Earnings Report?,https://finance.yahoo.com/markets/stocks/articles/why-cadence-cdns-down-5-153003372.html,-0.5
2026-03-19 15:30:04+00:00,EXC,Zacks,Why Is DTE Energy (DTE) Up 3.1% Since Last Earnings Report?,https://finance.yahoo.com/markets/stocks/articles/why-dte-energy-dte-3-153004686.html,0.2
2026-03-19 15:30:06+00:00,AEP,Zacks,Why Is FirstEnergy (FE) Up 3.5% Since Last Earnings Report?,https://finance.yahoo.com/markets/stocks/articles/why-firstenergy-fe-3-5-153006569.html,0.5
2026-03-19 15:30:11+00:00,FTNT,Zacks,Why Is Palo Alto (PANW) Up 10.9% Since Last Earnings Report?,https://finance.yahoo.com/markets/stocks/articles/why-palo-alto-panw-10-153011915.html,0.5
2026-03-19 15:44:23+00:00,KLAC,Insider Monkey,"Oppenheimer Raises PT on KLA (KLAC) Stock to $1,900",https://finance.yahoo.com/markets/stocks/articles/oppenheimer-raises-pt-kla-klac-154423011.html,0.8
2026-03-19 15:45:54+00:00,MPWR,24/7 Wall St.,3 Surefire Stock Splits to Buy in 2026,https://finance.yahoo.com/markets/stocks/articles/3-surefire-stock-splits-buy-154554534.html,0.5
2026-03-19 16:13:00+00:00,KDP,Zacks,Can KDP Sustain Its Growth Amid Cost Pressures & Coffee Headwinds?,https://finance.yahoo.com/markets/stocks/articles/kdp-sustain-growth-amid-cost-161300746.html,-0.5
2026-03-19 16:13:00+00:00,KHC,Zacks,Will Kraft Heinz's NFL Deal Strengthen Its Growth Recovery Plan?,https://finance.yahoo.com/markets/stocks/articles/kraft-heinzs-nfl-deal-strengthen-161300376.html,0.5
2026-03-19 16:16:00+00:00,AMGN,Zacks,AMGN Trading Above 50 & 200-Day SMA: How to Play the Stock?,https://finance.yahoo.com/markets/stocks/articles/amgn-trading-above-50-200-161600620.html,0.2
2026-03-19 16:36:00+00:00,WBD,Barrons.com,Paramount Stock Heads for Lowest Level Since 2009. You Don’t Need a New Headline to Know What’s Going On.,https://www.barrons.com/articles/paramount-skydance-stock-losing-streak-warner-bros-28fe38e2?siteid=yhoof2&yptr=yahoo,-0.8
2026-03-19 16:48:13+00:00,INTU,Investing.com,Intuit stock rises after Morgan Stanley Top Pick designation,https://finance.yahoo.com/markets/stocks/articles/intuit-stock-rises-morgan-stanley-164813457.html,0.8
2026-03-19 17:04:08+00:00,MELI,Simply Wall St.,How The MercadoLibre (MELI) Story Is Shifting As Investment And Margin Expectations Reset,https://finance.yahoo.com/markets/stocks/articles/mercadolibre-meli-story-shifting-investment-170408827.html,0.1
2026-03-19 17:05:38+00:00,PEP,StockStory,2 Reasons to Like YUM and 1 to Stay Skeptical,https://finance.yahoo.com/markets/stocks/articles/2-reasons-yum-1-stay-170538082.html,0.5
2026-03-19 17:13:36+00:00,TTWO,Insider Monkey,"Is Take-Two Interactive Software, Inc. (TTWO) A Good Stock To Buy Now?",https://finance.yahoo.com/markets/stocks/articles/two-interactive-software-inc-ttwo-171336421.html,0.2
2026-03-19 17:18:00+00:00,XEL,Zacks,Can GEV Capitalize on the Exploding Power Demand From AI Data Centers?,https://finance.yahoo.com/sectors/energy/articles/gev-capitalize-exploding-power-demand-171800432.html,0.5
2026-03-19 17:23:00+00:00,ADI,Zacks,5 Dividend Growth Stocks to Buy Amid Rising Inflation Risk,https://finance.yahoo.com/markets/stocks/articles/5-dividend-growth-stocks-buy-172300353.html,0.5
2026-03-19 17:49:00+00:00,ADSK,Zacks,FIG Stock Outlook: Can AI Credit Monetization Lift 2026 Sales?,https://finance.yahoo.com/markets/stocks/articles/fig-stock-outlook-ai-credit-174900376.html,0.2
2026-03-19 18:05:51+00:00,CTSH,Simply Wall St.,Has Cognizant (CTSH) Fallen Too Far After Recent Share Price Weakness?,https://finance.yahoo.com/markets/stocks/articles/cognizant-ctsh-fallen-too-far-180551845.html,0.1
2026-03-19 18:07:00+00:00,MAR,TheStreet,Marriott makes another major bet on luxury travelers,https://finance.yahoo.com/sectors/healthcare/articles/marriott-makes-another-major-bet-180700526.html,0.6
2026-03-19 18:14:21+00:00,TXN,Schaeffer's Investment Research,Blue-Chip Tech Stock Could Topple Overhead Resistance,https://finance.yahoo.com/markets/stocks/articles/blue-chip-tech-stock-could-181421483.html,0.2
2026-03-19 18:35:00+00:00,ODFL,Zacks,Should Investors Buy Knight-Swift Stock Post Dividend Hike?,https://finance.yahoo.com/markets/stocks/articles/investors-buy-knight-swift-stock-183500630.html,0.2
2026-03-19 18:50:00+00:00,VRTX,Motley Fool,Best Growth Stock to Buy Right Now: Eli Lilly vs. Vertex Pharmaceuticals,https://finance.yahoo.com/markets/stocks/articles/best-growth-stock-buy-now-185000799.html,0.5
2026-03-19 19:26:51+00:00,WBD,24/7 Wall St.,Netflix Retreats: The Streaming Giant Faces Its Toughest Balancing Act Yet,https://finance.yahoo.com/markets/stocks/articles/netflix-retreats-streaming-giant-faces-192651532.html,-0.5
2026-03-19 20:02:00+00:00,TMUS,GlobeNewswire,Credit Acceptance Appoints Steffen Schumann as Chief Business Officer,https://finance.yahoo.com/markets/stocks/articles/credit-acceptance-appoints-steffen-schumann-200200461.html,0.5
2026-03-19 20:03:48+00:00,MAR,Simply Wall St.,Did Kapalua Bay’s Future St. Regis Conversion Subtly Recast Marriott’s (MAR) Luxury Resort Strategy?,https://finance.yahoo.com/markets/stocks/articles/did-kapalua-bay-future-st-200348186.html,0.1
2026-03-19 20:05:01+00:00,TXN,Simply Wall St.,Assessing Texas Instruments (TXN) Valuation After New 800V AI Data Center Power Architecture Announcement,https://finance.yahoo.com/markets/stocks/articles/assessing-texas-instruments-txn-valuation-200501473.html,0.2
2026-03-19 20:12:12+00:00,BKR,MT Newswires,US Equity Markets Lower After Middle East War Escalates,https://finance.yahoo.com/markets/stocks/articles/us-equity-markets-lower-middle-201212417.html,-0.8
2026-03-19 20:15:55+00:00,STX,StockStory,"Seagate (STX) Shares Skyrocket, What You Need To Know",https://finance.yahoo.com/markets/stocks/articles/seagate-stx-shares-skyrocket-know-201555231.html,0.8
2026-03-19 20:51:00+00:00,STX,Barrons.com,"These Stocks Are Today’s Movers: Micron, Accenture, Seagate, APA, Newmont, Alibaba, Swarmer, and More",https://www.barrons.com/articles/stock-movers-f3a4e6b7?siteid=yhoof2&yptr=yahoo,0.5
2026-03-19 21:00:00+00:00,TMUS,Business Wire,T-Mobile Declares Quarterly Cash Dividend,https://finance.yahoo.com/markets/stocks/articles/t-mobile-declares-quarterly-cash-210000520.html,0.5
2026-03-19 21:20:02+00:00,PEP,Zacks,"Scholastic (SCHL) Reports Q3 Loss, Misses Revenue Estimates",https://finance.yahoo.com/markets/stocks/articles/scholastic-schl-reports-q3-loss-212002172.html,-0.7
2026-03-19 21:30:02+00:00,CSX,Zacks,FedEx (FDX) Q3 Earnings and Revenues Beat Estimates,https://finance.yahoo.com/markets/stocks/articles/fedex-fdx-q3-earnings-revenues-213002020.html,0.8
2026-03-19 21:45:02+00:00,DDOG,Zacks,Datadog (DDOG) Registers a Bigger Fall Than the Market: Important Facts to Note,https://finance.yahoo.com/markets/stocks/articles/datadog-ddog-registers-bigger-fall-214502081.html,-0.5
2026-03-19 21:45:04+00:00,PDD,Zacks,PDD Holdings Inc. Sponsored ADR (PDD) Suffers a Larger Drop Than the General Market: Key Insights,https://finance.yahoo.com/markets/stocks/articles/pdd-holdings-inc-sponsored-adr-214504999.html,-0.5
2026-03-19 21:50:04+00:00,CMCSA,Zacks,Why the Market Dipped But Comcast (CMCSA) Gained Today,https://finance.yahoo.com/markets/stocks/articles/why-market-dipped-comcast-cmcsa-215004209.html,0.2
2026-03-19 21:57:55+00:00,WBD,The Wall Street Journal,Paramount Skydance Hits Lowest Closing Price Since 2009,https://www.wsj.com/livecoverage/stock-market-today-dow-sp-500-nasdaq-03-19-2026/card/paramount-skydance-hits-lowest-closing-price-since-2009-cgvVaJtge4wE4Pada13Q?siteid=yhoof2&yptr=yahoo,-0.7
2026-03-19 22:00:04+00:00,PCAR,Zacks,Why Paccar (PCAR) Dipped More Than Broader Market Today,https://finance.yahoo.com/markets/stocks/articles/why-paccar-pcar-dipped-more-220004852.html,-0.5
2026-03-19 22:26:07+00:00,TMUS,Motley Fool,"Stock Market Today, March 19: AT&T Rises After Launch of AI-Powered Customer App",https://finance.yahoo.com/markets/stocks/articles/stock-market-today-march-19-222607681.html,0.5
2026-03-19 23:06:57+00:00,DDOG,Simply Wall St.,Datadog (DDOG) Valuation Check As New AI Observability And Resilience Tools Reach General Availability,https://finance.yahoo.com/markets/stocks/articles/datadog-ddog-valuation-check-ai-230657746.html,0.5
2026-03-19 23:07:34+00:00,KDP,Simply Wall St.,Is Keurig Dr Pepper (KDP) Pricing Look Attractive After Recent Share Price Weakness,https://finance.yahoo.com/markets/stocks/articles/keurig-dr-pepper-kdp-pricing-230734411.html,0.5
2026-03-19 23:25:00+00:00,MELI,Motley Fool,Top 2 Once-in-a-Decade Consumer Picks for Long-Term Investors,https://finance.yahoo.com/markets/stocks/articles/top-2-once-decade-consumer-232500189.html,0.5
2026-03-20 00:00:00+00:00,CEG,SEC-EDGAR-8K,"(Item 8.01) . Other Events On January 7, 2026, Constellation Energy Corporation (Nasdaq: CEG) (“CEG Parent”) and Constellation Energy Generation, LLC, a Pennsylvania limited liability company (“Constellation”) completed the previously announced transactions contemplated by the Agreement and Plan of Merger, dated January 10, 2025 (the “Merger Agreement”), by and among Calpine Corporation, a Delaware corporation (“Calpine”), certain wholly-owned direct and indirect subsidiaries of Calpine and CEG Parent, and Volt Energy Holdings GP, LLC, a Delaware limited liability",,0.1
2026-03-20 01:06:09+00:00,VRTX,Simply Wall St.,Assessing Vertex Pharmaceuticals (VRTX) Valuation After Positive RAINIER Trial Update And Accelerated IgAN Filing,https://finance.yahoo.com/sectors/healthcare/articles/assessing-vertex-pharmaceuticals-vrtx-valuation-010609540.html,0.5
2026-03-20 04:24:56+00:00,TEAM,Financial Times,AI sell-off’s worst-hit company grapples with ‘SaaSpocalypse’,https://finance.yahoo.com/markets/stocks/articles/ai-sell-off-worst-hit-042456243.html,-0.6
2026-03-20 04:27:48+00:00,ADP,Insider Monkey,"Guggenheim Initiates ADP as Buy, Says Fears around AI Are Premature",https://finance.yahoo.com/markets/stocks/articles/guggenheim-initiates-adp-buy-says-042748279.html,0.6
2026-03-20 04:31:37+00:00,PEP,Insider Monkey,PepsiCo Hits 2025 Water Targets Early Under pep+ Initiative,https://finance.yahoo.com/markets/stocks/articles/pepsico-hits-2025-water-targets-043137370.html,0.5
2026-03-20 05:45:00+00:00,BKNG,PR Newswire,Agoda's Top Picks for Unique Zipline Adventures in Asia,https://finance.yahoo.com/markets/crypto/articles/agodas-top-picks-unique-zipline-054500018.html,0.5
2026-03-20 06:06:53+00:00,CHTR,Simply Wall St.,How Charter’s AI Contact Center Push With RingCentral Shapes Its Broader Digital Strategy At CHTR,https://finance.yahoo.com/markets/stocks/articles/charter-ai-contact-center-push-060653150.html,0.2
2026-03-20 06:46:57+00:00,MCHP,Insider Monkey,Microchip Technology(MCHP) Will Address Emerging Cybersecurity Requirements With Its New Trust Platform,https://finance.yahoo.com/sectors/technology/articles/microchip-technology-mchp-address-emerging-064657238.html,0.6
2026-03-20 06:47:02+00:00,NXPI,Insider Monkey,Bullish Analyst Sentiment on NXP Semiconductors N.V. (NXPI) Amid Positive Management Outlook,https://finance.yahoo.com/markets/stocks/articles/bullish-analyst-sentiment-nxp-semiconductors-064702661.html,0.8
2026-03-20 08:28:00+00:00,WBD,Motley Fool,"Is Netflix a Buy, Sell, or Hold in 2026?",https://finance.yahoo.com/markets/stocks/articles/netflix-buy-sell-hold-2026-082800033.html,0.0
2026-03-20 09:33:00+00:00,PEP,Food Dive,"After funding collapse, what’s next for food startups?",https://finance.yahoo.com/sectors/technology/articles/funding-collapse-next-food-startups-093300662.html,0.1
2026-03-20 10:50:00+00:00,VRTX,Motley Fool,My Top 3 Drug Stocks for March 2026,https://finance.yahoo.com/sectors/healthcare/articles/top-3-drug-stocks-march-105000992.html,0.0
2026-03-20 10:54:00+00:00,VRSK,GlobeNewswire,"Insurance Analytics Market to Triple in Size by 2033 Driven by Advanced Technologies - Revenues to Hit $48 Billion Led by Hexaware Technologies, LexisNexis Risk Solutions, Microsoft, MicroStrategy, Open Text",https://finance.yahoo.com/sectors/technology/articles/insurance-analytics-market-triple-size-105400299.html,0.8
2026-03-20 11:00:00+00:00,BKR,GlobeNewswire,Baker Hughes Announces Dates for First-quarter Earnings Release and Webcast,https://finance.yahoo.com/sectors/energy/articles/baker-hughes-announces-dates-first-110000359.html,0.0
2026-03-20 11:00:17+00:00,CEG,24/7 Wall St.,Forget Savings Accounts and Buy These 2 Utility ETFs Instead,https://finance.yahoo.com/markets/stocks/articles/forget-savings-accounts-buy-2-110017203.html,0.1
2026-03-20 11:05:55+00:00,SBUX,Simply Wall St.,How The Starbucks (SBUX) Investment Story Is Shifting As Turnaround Hopes Meet Valuation Questions,https://finance.yahoo.com/markets/stocks/articles/starbucks-sbux-investment-story-shifting-110555277.html,0.1
2026-03-20 11:07:58+00:00,BKNG,Simply Wall St.,What Booking Holdings (BKNG)'s India Corporate Travel Tie-Up Signals About Its Enterprise Strategy,https://finance.yahoo.com/markets/stocks/articles/booking-holdings-bkng-india-corporate-110758853.html,0.2
2026-03-20 11:27:00+00:00,BKNG,MarketBeat,Expedia Stock Turns Volatile After Rally. Where Does It Go Next?,https://finance.yahoo.com/markets/stocks/articles/expedia-stock-turns-volatile-rally-112700572.html,0.1
2026-03-20 11:55:19+00:00,TEAM,24/7 Wall St.,"Watch These 4 Companies, Their Shares Could Rip Higher Once Layoffs Are Announced – Or Maybe Not",https://finance.yahoo.com/markets/stocks/articles/watch-4-companies-shares-could-115519419.html,0.2
2026-03-20 11:58:00+00:00,VRTX,Zacks,Vertex Stock Falls 4.8% in a Month: Buying Opportunity or Red Flag?,https://finance.yahoo.com/sectors/healthcare/articles/vertex-stock-falls-4-8-115800541.html,-0.5
2026-03-20 12:00:00+00:00,HON,PR Newswire,HONEYWELL ANNOUNCES EARLY PARTICIPATION RESULTS AND UPSIZING OF ITS DEBT TENDER OFFERS,https://finance.yahoo.com/markets/stocks/articles/honeywell-announces-early-participation-results-120000897.html,0.2
2026-03-20 12:03:36+00:00,XEL,Simply Wall St.,Ethics Streak Puts Xcel Energy’s Valuation And Risk Profile In Focus,https://finance.yahoo.com/markets/stocks/articles/ethics-streak-puts-xcel-energy-120336863.html,0.5
2026-03-20 12:04:54+00:00,CMCSA,Simply Wall St.,How The Comcast (CMCSA) Investment Narrative Is Shifting After Versant Spin Off And Fiber Risks,https://finance.yahoo.com/markets/stocks/articles/comcast-cmcsa-investment-narrative-shifting-120454890.html,0.1
2026-03-20 12:07:36+00:00,WBD,The Wall Street Journal,Spencer Jakab | Is the Largest Leveraged Buyout Ever in Doubt?,https://www.wsj.com/livecoverage/stock-market-today-dow-sp-500-nasdaq-03-20-2026/card/spencer-jakab-is-the-largest-leveraged-buyout-ever-in-doubt--XaYDXHDAC5sl6fimdIA2?siteid=yhoof2&yptr=yahoo,0.0
2026-03-20 12:15:18+00:00,WBD,GuruFocus.com,Disney Faces Hidden Risk From Reality TV Fallout,https://finance.yahoo.com/markets/stocks/articles/disney-faces-hidden-risk-reality-121518962.html,-0.5
2026-03-20 12:17:32+00:00,TMUS,GuruFocus.com,T-Mobile's Dividend Stays Put For A Reason,https://finance.yahoo.com/markets/stocks/articles/t-mobiles-dividend-stays-put-121732464.html,0.5
2026-03-20 12:19:18+00:00,ORLY,Insider Monkey,Higher Operating Expenses Weighed on O’Reilly Automotive (ORLY),https://finance.yahoo.com/markets/stocks/articles/higher-operating-expenses-weighed-o-121918593.html,-0.5
2026-03-20 12:30:02+00:00,STX,Zacks,Here's How Much You'd Have If You Invested $1000 in Seagate a Decade Ago,https://finance.yahoo.com/markets/stocks/articles/heres-much-youd-invested-1000-123002559.html,0.5
2026-03-20 12:36:00+00:00,ADP,Zacks,Implied Volatility Surging for Automatic Data Processing Stock Options,https://finance.yahoo.com/markets/options/articles/implied-volatility-surging-automatic-data-123600982.html,0.5
2026-03-20 12:49:00+00:00,VRSK,Insider Monkey,Verisk Analytics (VRSK) Shares Retreated by 11% in Q4. Here’s Why,https://finance.yahoo.com/markets/stocks/articles/verisk-analytics-vrsk-shares-retreated-124900656.html,-0.6
