timestamp,ticker,source,text,url,SentimentScore
2025-07-08 13:00:03+00:00,SPGI,Zacks,How to Boost Your Portfolio with Top Finance Stocks Set to Beat Earnings,https://finance.yahoo.com/news/boost-portfolio-top-finance-stocks-130003382.html,0.8
2025-07-08 13:00:03+00:00,MCD,Zacks,How to Boost Your Portfolio with Top Retail-Wholesale Stocks Set to Beat Earnings,https://finance.yahoo.com/news/boost-portfolio-top-retail-wholesale-130003527.html,0.6
2025-07-08 13:00:04+00:00,NEE,Zacks,"NextEra Energy, Inc. (NEE) Is a Trending Stock: Facts to Know Before Betting on It",https://finance.yahoo.com/news/nextera-energy-inc-nee-trending-130004891.html,0.5
2025-07-08 13:00:05+00:00,COST,Zacks,Here is What to Know Beyond Why Costco Wholesale Corporation (COST) is a Trending Stock,https://finance.yahoo.com/news/know-beyond-why-costco-wholesale-130005833.html,0.2
2025-07-08 13:06:36+00:00,UNP,Barchart,What to Expect From Union Pacific's Next Quarterly Earnings Report,https://finance.yahoo.com/news/expect-union-pacifics-next-quarterly-130636655.html,0.0
2025-07-08 13:14:04+00:00,MCD,GOBankingRates,How Much More Your McDonald’s Big Mac Will Be Due To Trump’s Tariffs on Beef Imports,https://finance.yahoo.com/news/much-more-mcdonald-big-mac-131404872.html,-0.5
2025-07-08 13:14:39+00:00,MDLZ,Barchart,What to Expect From Mondelez International’s Q2 2025 Earnings Report,https://finance.yahoo.com/news/expect-mondelez-international-q2-2025-131439828.html,0.2
2025-07-08 13:15:01+00:00,BKNG,Zacks,Booking Holdings Inc. (BKNG) Hits Fresh High: Is There Still Room to Run?,https://finance.yahoo.com/news/booking-holdings-inc-bkng-hits-131501492.html,0.5
2025-07-08 13:15:02+00:00,MU,Barchart,Can Micron Stock Hit $200 in 2025?,https://finance.yahoo.com/news/micron-stock-hit-200-2025-131502729.html,0.2
2025-07-08 13:20:49+00:00,MDLZ,Just Food,Mondelez urges further delay to EU deforestation law,https://finance.yahoo.com/news/mondelez-urges-further-delay-eu-132049413.html,-0.5
2025-07-08 13:20:49+00:00,MDLZ,Just Drinks,Mondelez urges further delay deforestation law amid calls for EU to press on,https://finance.yahoo.com/news/mondelez-urges-further-delay-deforestation-132049457.html,0.1
2025-07-08 13:22:02+00:00,HON,Investopedia,Honeywell Explores Strategic Alternatives for 2 Units Ahead of Split,https://finance.yahoo.com/news/honeywell-explores-strategic-alternatives-2-132202990.html,0.5
2025-07-08 13:30:02+00:00,DIS,Zacks,Why Walt Disney (DIS) is a Top Stock for the Long-Term,https://finance.yahoo.com/news/why-walt-disney-dis-top-133002125.html,0.8
2025-07-08 13:30:03+00:00,NOW,Zacks,Wall Street Bulls Look Optimistic About ServiceNow (NOW): Should You Buy?,https://finance.yahoo.com/news/wall-street-bulls-look-optimistic-133003796.html,0.8
2025-07-08 13:30:03+00:00,LRCX,Zacks,Earnings Growth & Price Strength Make Lam Research (LRCX) a Stock to Watch,https://finance.yahoo.com/news/earnings-growth-price-strength-lam-133003318.html,0.8
2025-07-08 13:30:04+00:00,DE,Zacks,Is Deere (DE) a Buy as Wall Street Analysts Look Optimistic?,https://finance.yahoo.com/news/deere-buy-wall-street-analysts-133004338.html,0.6
2025-07-08 13:30:58+00:00,TGT,Yahoo Finance Video,Retailer check-in: How Trump's new tariffs impact the sector,https://finance.yahoo.com/video/retailer-check-trumps-tariffs-impact-133058310.html,-0.5
2025-07-08 13:31:39+00:00,PNC,The Fly,"Circle initiated, CoreWeave downgraded: Wall Street's top analyst calls",https://finance.yahoo.com/news/circle-initiated-coreweave-downgraded-wall-133139326.html,-0.5
2025-07-08 13:34:02+00:00,NEE,The Wall Street Journal,New Trump Order Adds to Pressure on Sunrun and Other Renewable-Energy Stocks,https://www.wsj.com/livecoverage/stock-market-today-dow-sp-500-nasdaq-07-08-2025/card/new-trump-order-adds-to-pressure-on-sunrun-and-other-renewable-energy-stocks-A8n8kvXSeLrj6SvHPntA?siteid=yhoof2&yptr=yahoo,-0.6
2025-07-08 13:37:39+00:00,SO,reddit.com/r/stocks,"So.... why is the stock market completely ignoring Trump's tariffs this time??? - I seriously dont get it. Trump just announced plans to do Liberation Day 2.0 all over again but this time the stock market stays... up??? Wtf. 

Does Wallstreet simply not care about the economy anymore?",,-0.6
2025-07-08 13:39:17+00:00,UPS,FreightWaves,"US parcel market to grow 36% by 2030, Pitney Bowes says",https://finance.yahoo.com/news/us-parcel-market-grow-36-133917531.html,0.5
2025-07-08 13:40:04+00:00,GILD,Zacks,Has Gilead Sciences (GILD) Outpaced Other Medical Stocks This Year?,https://finance.yahoo.com/news/gilead-sciences-gild-outpaced-other-134004387.html,0.2
2025-07-08 13:47:01+00:00,KO,Just Drinks,"Keurig Dr Pepper allowed to end partnership with Reyes Coca-Cola, judge rules",https://finance.yahoo.com/news/keurig-dr-pepper-allowed-end-134701676.html,0.2
2025-07-08 13:49:00+00:00,MO,Zacks,Altria Group Gains 21% in 6 Months: How to Play the Stock?,https://finance.yahoo.com/news/altria-group-gains-21-6-134900544.html,0.5
2025-07-08 13:50:00+00:00,NEE,Barrons.com,"SunRun, Enphase Stocks Tumble as Trump Adds to Gloom in Solar Sector",https://www.barrons.com/articles/sunrun-enphase-solar-stock-price-9fd61b1a?siteid=yhoof2&yptr=yahoo,-0.8
2025-07-08 13:50:02+00:00,AXP,Zacks,Are You a Momentum Investor? This 1 Stock Could Be the Perfect Pick,https://finance.yahoo.com/news/momentum-investor-1-stock-could-135002879.html,0.5
2025-07-08 13:51:00+00:00,GILD,Zacks,Gilead Sciences Rallies 27.2% in Six Months: Buy or Sell the Stock?,https://finance.yahoo.com/news/gilead-sciences-rallies-27-2-135100214.html,0.5
2025-07-08 13:51:00+00:00,LMT,Zacks,Boeing Secures a $2.8B Contract to Aid the Evolved Strategic Satellite,https://finance.yahoo.com/news/boeing-secures-2-8b-contract-135100649.html,0.8
2025-07-08 13:55:02+00:00,MU,Zacks,Does Micron (MU) Have the Potential to Rally 25.68% as Wall Street Analysts Expect?,https://finance.yahoo.com/news/does-micron-mu-potential-rally-135502523.html,0.5
2025-07-08 13:56:00+00:00,QCOM,Zacks,QCOM Betting Big on AI PC: Will it Deliver Sustainable Growth?,https://finance.yahoo.com/news/qcom-betting-big-ai-pc-135600506.html,0.5
2025-07-08 13:57:00+00:00,CVX,Zacks,Can Devon Build a Resilient Portfolio Through Targeted Acquisitions?,https://finance.yahoo.com/news/devon-build-resilient-portfolio-targeted-135700615.html,0.5
2025-07-08 14:00:00+00:00,ADBE,Zacks,5 ETFs to Profit From Amazon's Longest-Ever Prime Day Event,https://finance.yahoo.com/news/5-etfs-profit-amazons-longest-140000534.html,0.6
2025-07-08 14:00:01+00:00,C,Zacks,Citigroup (C) Earnings Expected to Grow: Should You Buy?,https://finance.yahoo.com/news/citigroup-c-earnings-expected-grow-140001624.html,0.5
2025-07-08 14:01:00+00:00,LMT,Zacks,BAE Systems Expands Maritime Capabilities With Sea Domain Innovations,https://finance.yahoo.com/news/bae-systems-expands-maritime-capabilities-140100573.html,0.5
2025-07-08 14:06:50+00:00,MSFT,reddit.com/r/stocks,"Evercore: Will boost free cash flow for Microsoft and Oracle - Some software companies, such as Microsoft ( NASDAQ: MSFT ) and Oracle ( NYSE: ORCL ), will benefit from higher free cash flow due to some elements of President Donald Trump's ‘One Great, Beautiful Act,’ Evercore ISI said.

We believe “A Great and Beautiful Act” could create a stealth free cash flow tailwind for profitable software companies, thanks to favourable changes in the tax treatment of R&D and capital expenditures,’ said Evercore analysts led by Kirk Materne (NYSE: ORCL). ), an Evercore analyst led by Kirk Materne, said. ‘Based on our analysis, the companies that benefit the most are those with high R&D intensity, high levels of capital expenditures, and that currently pay a significant amount of cash taxes.’

Evercore estimates that Microsoft's free cash flow will increase by $11 billion, or $1.50 per share. Oracle's free cash flow could increase by $3.3 billion, or $1.12 per share.

Mateen said, ""The average return for software companies that pay cash taxes is about 9%, largely due to more favourable R&D treatment ...... It's also worth noting that these are tax accounting changes, not financial accounting, and are largely based on the fact that tax benefits related to R&D and bonus depreciation are being brought forward .""

The bill includes the reinstatement of domestic R&D expensing. In addition, the bill provides for a 100 per cent rebate of bonus depreciation for qualified capital expenditures placed in service between 2025 and 2029.

Evercore noted, ‘The net impact is an additional 80% cash tax savings on 2025 R&D expenses.’ ""On the capital expenditure side, “bonus depreciation” on capital expenditure is gradually reduced from 2022 onwards, meaning that by 2025, 40 per cent of capital expenditure is immediately deductible for cash tax purposes, with the remaining 60 per cent amortised over the useful life of the asset. As a result of OBBB, all capital expenditures will receive 100 per cent “bonus depreciation” in the first year.""

Microsoft and Oracle are among the software companies benefiting from high capital expenditures. evercore estimates that the companies will spend $69.7 billion and $23.6 billion on capital expenditures in 2025. Much of this capex is related to artificial intelligence and data centre construction.

Evercore rates Microsoft Outperform and raised its price target to $515 from $500. Oracle is also rated Outperform and its price target was raised to $215 from $180.

Additionally, Evercore expects investment in artificial intelligence and the technology sector in general to increase as companies in a variety of industries reap the benefits.",,0.8
2025-07-08 14:07:00+00:00,LMT,Zacks,Fresh Russia-Ukraine Feud Brings Spotlight on Lockheed,https://finance.yahoo.com/news/fresh-russia-ukraine-feud-brings-140700124.html,0.2
2025-07-08 14:24:53+00:00,HON,MT Newswires,Honeywell to Evaluate Alternatives for 2 Businesses Ahead of Planned Split,https://finance.yahoo.com/news/honeywell-evaluate-alternatives-2-businesses-142453716.html,0.5
2025-07-08 14:25:56+00:00,NEE,Investopedia,Solar Stocks Slump on Trump Executive Order Cutting Federal Support,https://finance.yahoo.com/news/solar-stocks-slump-trump-executive-142556695.html,-0.8
2025-07-08 14:29:00+00:00,MU,Zacks,Micron Q3 Gross Margin Hits 39% on Strong Pricing: More Upside Ahead?,https://finance.yahoo.com/news/micron-q3-gross-margin-hits-142900238.html,0.6
2025-07-08 14:34:00+00:00,TGT,Zacks,Can Walmart's High-Margin Verticals Sustain Its Retail Edge?,https://finance.yahoo.com/news/walmarts-high-margin-verticals-sustain-143400399.html,0.2
2025-07-08 14:41:00+00:00,C,Zacks,Small-Business Optimism Comes in Lower,https://finance.yahoo.com/news/small-business-optimism-comes-lower-144100159.html,-0.5
2025-07-08 14:43:00+00:00,BMY,Zacks,AstraZeneca Boasts Strong Oncology Portfolio: Can It Sustain Growth?,https://finance.yahoo.com/news/astrazeneca-boasts-strong-oncology-portfolio-144300095.html,0.6
2025-07-08 14:49:00+00:00,TGT,Zacks,Can Remodeling Efforts Revive Target's In-Store Traffic Trends?,https://finance.yahoo.com/news/remodeling-efforts-revive-targets-store-144900269.html,0.5
2025-07-08 14:52:00+00:00,MU,Barrons.com,Why Samsung’s Bad News Is Good News for Micron Stock,https://www.barrons.com/articles/micron-stock-price-samsung-nvidia-ai-chips-d36b053d?siteid=yhoof2&yptr=yahoo,0.6
2025-07-08 14:53:00+00:00,KO,Zacks,Coca-Cola Stock Reflects Modest Growth in 3 Months: Buy Now or Wait?,https://finance.yahoo.com/news/coca-cola-stock-reflects-modest-145300803.html,0.2
2025-07-08 14:56:00+00:00,NKE,Zacks,NIKE vs. lululemon: Which Stock Wins the Activewear Showdown?,https://finance.yahoo.com/news/nike-vs-lululemon-stock-wins-145600028.html,0.2
2025-07-08 15:00:00+00:00,SCHW,Zacks,Schwab Stock Touches 52-Week High: Is This the Right Time to Buy SCHW?,https://finance.yahoo.com/news/schwab-stock-touches-52-week-150000668.html,0.5
2025-07-08 15:01:42+00:00,IBM,Yahoo Finance Video,"Uber, IBM's Power11 chip, Hershey new CEO: Trending Tickers",https://finance.yahoo.com/video/uber-ibms-power11-chip-hershey-150142417.html,0.2
2025-07-08 15:04:00+00:00,TGT,Zacks,Will Project Elevate Keep Driving Same-Store Sales at Dollar General?,https://finance.yahoo.com/news/project-elevate-keep-driving-same-150400419.html,0.2
2025-07-08 15:10:24+00:00,MS,Insider Monkey,Morgan Stanley Lifts Dividend Ahead of Board Approval,https://finance.yahoo.com/news/morgan-stanley-lifts-dividend-ahead-151024778.html,0.5
2025-07-08 15:11:33+00:00,NFLX,Insider Monkey,"Goldman Sachs Lifts Netflix, Inc. (NFLX) Price Target Ahead of Q2",https://finance.yahoo.com/news/goldman-sachs-lifts-netflix-inc-151133178.html,0.5
2025-07-08 15:13:00+00:00,CVX,Barrons.com,Exxon Just Lowered Its Earnings Guidance. Why the Stock Is Rising.,https://www.barrons.com/articles/exxon-earnings-guidance-stock-price-oil-cee17885?siteid=yhoof2&yptr=yahoo,0.2
2025-07-08 15:15:00+00:00,MA,Zacks,Mastercard's Fintech Ties in Emerging Markets: Bold Move or Risky Bet?,https://finance.yahoo.com/news/mastercards-fintech-ties-emerging-markets-151500750.html,0.1
2025-07-08 15:21:09+00:00,MDT,MedTech Dive,Medtronic names CFO for diabetes spinoff,https://finance.yahoo.com/news/medtronic-names-cfo-diabetes-spinoff-152109334.html,0.2
2025-07-08 15:25:00+00:00,MU,Barrons.com,"Broadcom and 13 Other Stocks That Have Come Too Far, Too Fast",https://www.barrons.com/articles/broadcom-stock-price-sell-2f5c06f5?siteid=yhoof2&yptr=yahoo,-0.5
2025-07-08 15:33:00+00:00,NOW,Zacks,Snowflake Stock Rides on Cortex AI Adoption: Can the Growth Continue?,https://finance.yahoo.com/news/snowflake-stock-rides-cortex-ai-153300195.html,0.5
2025-07-08 15:38:47+00:00,PEP,Investopedia,Wendy's CEO Kirk Tanner Leaving Burger Giant for Hershey,https://finance.yahoo.com/news/wendys-ceo-kirk-tanner-leaving-153847825.html,0.1
2025-07-08 15:40:33+00:00,HON,MT Newswires,Top Midday Stories: Canadian Regulator Advances Amazon Probe; Boeing Q2 Commercial Deliveries Up 63% YoY,https://finance.yahoo.com/news/top-midday-stories-canadian-regulator-154033268.html,0.5
2025-07-08 15:46:05+00:00,NEE,Investopedia,"Top Stock Movers Now: Enphase Energy, Newmont, Stanley Black & Decker, and More",https://finance.yahoo.com/news/top-stock-movers-now-enphase-154605066.html,0.5
2025-07-08 16:00:07+00:00,BKNG,Zacks,Are You Looking for a Top Momentum Pick? Why Booking Holdings (BKNG) is a Great Choice,https://finance.yahoo.com/news/looking-top-momentum-pick-why-160007425.html,0.8
2025-07-08 16:14:00+00:00,C,Zacks,Citigroup Hits 52-Week High: How to Approach the Stock Now?,https://finance.yahoo.com/news/citigroup-hits-52-week-high-161400914.html,0.5
2025-07-08 16:25:44+00:00,MDLZ,MT Newswires,Mondelez Recalls Some RITZ Peanut Butter Cracker Sandwiches,https://finance.yahoo.com/news/mondelez-recalls-ritz-peanut-butter-162544409.html,-0.5
2025-07-08 16:40:34+00:00,NOW,reddit.com/r/stocks,"My long term stock portfolio strategy (experienced opinions please) - Hey guys, I’m 21 years old and just started building my stock portfolio a few months ago. (I’m from Dubai and I use IBKR, if that matters.)

So from everything I’ve read, people usually recommend something like a 70% ETF and 30% individual stock split for a long-term portfolio. I totally get that it’s nearly impossible to consistently pick winning stocks, especially as someone with less than a year of experience.

But at the same time, I’ve heard that line that says a blindfolded monkey picks better stock than an experienced manager?

Anyway, here’s my situation.

I’m fully long-term. I don’t plan to sell or liquidate anything, my goal is to just keep adding money every few months and buy/hold stocks.

But just yesterday I checked my portfolio analysis and kinda panicked when I saw that 76% of it is individual stocks.

Is that necessarily a bad thing for a long-term portfolio?

So far, my performance has been really good (probably because I started buying in March/April when things were down). I have over 30 stocks.. few of them are ETFs.. and two of my individual picks are up 50% and 35% just in the last month.

Obviously, I know that’s full luck because I didn’t expect the stock to do that well. But considering my worst-performing holdings are VHT, SCHD, and IXJ and even those are only down around 4–5%.

I just feel like building my own little basket of stocks have been much better for me. But I only have 6-7 months of exposure, so I’m looking for experienced opinions on this.

So now I’m wondering: Does having a higher % in individual stocks just increase your exposure to “luck” meaning:

1.	⁠you have a better chance of doing really well in 1 or 2 of picks.
2.	⁠the rest of your picks performs average
3.	⁠the bottom 5 picks don’t perform terrible?

Is that fair or does that just not work long term?

Would love to hear your thoughts. I’m still new to all this and just trying to learn.",,0.5
2025-07-08 16:45:02+00:00,NOW,Zacks,ServiceNow (NOW) is an Incredible Growth Stock: 3 Reasons Why,https://finance.yahoo.com/news/servicenow-now-incredible-growth-stock-164502661.html,0.8
2025-07-08 16:54:45+00:00,GE,reddit.com/r/stocks,"Cramer believes GE Vernova can keep going up - GE Vernova price target increased at BMO Capital to $590 from $522. 

Cramer said that GEV is viewed as being expensive but he believes GEV can still see more orders, particularly from overseas customers.

I prefer LEU to GEV based on cost but having both wouldn't be the worst thing in the world. I think. What does the hive say? Is this a rare moment where we don't want to ""inverse Cramer""?",,0.5
2025-07-08 17:15:00+00:00,PEP,FastCompany,PepsiCo and Wendy’s exec Kirk Tanner to become Hershey’s next CEO,https://finance.yahoo.com/news/pepsico-wendy-exec-kirk-tanner-171500999.html,0.5
2025-07-08 17:16:51+00:00,MDT,Simply Wall St.,Medtronic (NYSE:MDT) Prepares for Diabetes Unit Spin-Off with New CFO Appointment,https://finance.yahoo.com/news/medtronic-nyse-mdt-prepares-diabetes-171651218.html,0.5
2025-07-08 17:17:46+00:00,PG,Simply Wall St.,Procter & Gamble (NYSE:PG) Launches Luxurious Unstopables Laundry Scent Collection With Jasmine Tookes,https://finance.yahoo.com/news/procter-gamble-nyse-pg-launches-171746104.html,0.5
2025-07-08 17:20:37+00:00,PEP,Simply Wall St.,Hershey (NYSE:HSY) Appoints Former PepsiCo Executive Kirk Tanner As New CEO,https://finance.yahoo.com/news/hershey-nyse-hsy-appoints-former-172037968.html,0.5
2025-07-08 17:21:27+00:00,BDX,Simply Wall St.,Becton Dickinson (NYSE:BDX) Appoints Bilal Muhsin As President Of New Connected Care Segment,https://finance.yahoo.com/news/becton-dickinson-nyse-bdx-appoints-172127633.html,0.5
2025-07-08 17:24:25+00:00,ACN,Simply Wall St.,"SAP (XTRA:SAP) Partners Globally With JA Worldwide To Empower Over 85,000 Youth",https://finance.yahoo.com/news/sap-xtra-sap-partners-globally-172425860.html,0.8
2025-07-08 17:25:00+00:00,PEP,The Wall Street Journal,Hershey Recruits Collab-Loving Wendy’s Boss as New CEO,https://www.wsj.com/business/hershey-names-wendys-executive-as-new-ceo-6e218d2e?siteid=yhoof2&yptr=yahoo,0.5
2025-07-08 17:26:58+00:00,JNJ,Simply Wall St.,Johnson & Johnson (NYSE:JNJ) Submits sNDA For Schizophrenia Drug CAPLYTA® To FDA,https://finance.yahoo.com/news/johnson-johnson-nyse-jnj-submits-172658969.html,0.5
2025-07-08 17:27:51+00:00,RTX,Simply Wall St.,RTX (NYSE:RTX) Successfully Demonstrates Barracuda Mine Neutralization Vehicle in Narragansett Bay,https://finance.yahoo.com/news/rtx-nyse-rtx-successfully-demonstrates-172751190.html,0.6
2025-07-08 17:31:56+00:00,CVX,Simply Wall St.,Highlighting July 2025's Top Dividend Stocks,https://finance.yahoo.com/news/highlighting-july-2025s-top-dividend-173156450.html,0.5
2025-07-08 17:37:33+00:00,HON,Simply Wall St.,Honeywell International (NasdaqGS:HON) Appoints Jim Masso to Lead Process Automation Business,https://finance.yahoo.com/news/honeywell-international-nasdaqgs-hon-appoints-173733329.html,0.5
2025-07-08 17:59:47+00:00,C,Investor's Business Daily,How To Use A Cash-Secured Put Ahead Of Citigroup's Earnings,https://www.investors.com/research/options/citigroup-c-stock-cash-secured-put/?src=A00220&yptr=yahoo,0.2
2025-07-08 18:00:00+00:00,C,Yahoo Finance Video,Big Bank earnings: Why capital markets will be the key driver,https://finance.yahoo.com/video/big-bank-earnings-why-capital-180000768.html,0.5
2025-07-08 18:04:13+00:00,SO,reddit.com/r/stocks,"Trump says he will impose 50% tariff on copper imports on Tuesday - Per Yahoo News 

WASHINGTON (Reuters) -President Donald Trump said he will announce a 50% tariff on imported copper on Tuesday, an effort to boost U.S. production of a metal critical to electric vehicles, military hardware, the power grid and many consumer goods.

U.S. Comex copper futures jumped more than 10% after the announcement.


Trump told reporters at a White House cabinet meeting that he planned to make the copper tariff announcement later in the day but he did not say when the tariff would take effect.

The Trump administration announced a so-called Section 232 investigation into U.S. imports of the red metal in February. The deadline for the investigation to conclude is in November.

The National Mining Association and the American Critical Minerals Association did not immediately respond to requests for comment.

Freeport-McMoRan, the largest U.S. copper producer, did not immediately respond to request for comment.

(Reporting By Andrea Shalal and Jarrett Renshaw; Editing by Franklin Paul and Cynthia Osterman)

Terms  and Privacy Policy
Privacy Dashboard
",,0.2
2025-07-08 18:15:47+00:00,ADBE,Investor's Business Daily,Amazon Prime Day Is Here. Here's How Much Shoppers Are Expected To Spend.,https://www.investors.com/news/technology/amazon-stock-amazon-prime-day-projections/?src=A00220&yptr=yahoo,0.5
2025-07-08 18:17:46+00:00,PFE,Yahoo Finance Video,"Uber's highs, Trump tariff warning, Wendy’s CEO heads to Hershey",https://finance.yahoo.com/video/ubers-highs-trump-tariff-warning-181746888.html,0.2
2025-07-08 18:18:33+00:00,PFE,Bloomberg,"Trump Says He’ll Set 50% Copper Tariff, Wait Year on Drug Levies",https://finance.yahoo.com/news/trump-says-ll-set-50-181833132.html,0.1
2025-07-08 19:03:02+00:00,CAT,Motley Fool,Why Caterpillar Stock Jumped 11.5% in June,https://finance.yahoo.com/news/why-caterpillar-stock-jumped-11-190302346.html,0.5
2025-07-08 19:19:30+00:00,NKE,Motley Fool,Why Nike Stock Was Sliding Today,https://finance.yahoo.com/news/why-nike-stock-sliding-today-191930866.html,-0.5
2025-07-08 19:24:21+00:00,WMT,Yahoo Finance,Amazon's Prime Day event is on. How Walmart is hoping to crash the party.,https://finance.yahoo.com/news/amazons-prime-day-event-is-on-how-walmart-is-hoping-to-crash-the-party-192421273.html,0.2
2025-07-08 19:31:00+00:00,LLY,Barrons.com,Regeneron’s Blockbuster Dupixent Faces a New Rival,https://www.barrons.com/articles/regeneron-blockbuster-dupixent-rival-ef230b36?siteid=yhoof2&yptr=yahoo,-0.5
2025-07-08 19:52:53+00:00,PFE,MT Newswires,Sector Update: Health Care Stocks Advance Late Afternoon,https://finance.yahoo.com/news/sector-health-care-stocks-advance-195253353.html,0.5
2025-07-08 20:01:33+00:00,PFE,Yahoo Finance,"Stock market today: Dow, S&P 500 slip as Trump stays firm on August tariff deadline, announces copper duties",https://finance.yahoo.com/news/live/stock-market-today-dow-sp-500-slip-as-trump-stays-firm-on-august-tariff-deadline-announces-copper-duties-200133528.html,-0.5
2025-07-08 20:07:45+00:00,ADBE,TechCrunch,GenAI as a shopping assistant set to explode during Prime Day sales,https://finance.yahoo.com/news/genai-shopping-assistant-set-explode-200745363.html,0.8
2025-07-08 20:12:13+00:00,PNC,American Banker,PNC Bank automates direct deposit switch for customers,https://finance.yahoo.com/news/pnc-bank-automates-direct-deposit-201213365.html,0.5
2025-07-08 20:15:00+00:00,GE,Barrons.com,Honeywell Is Looking at ‘Strategic Alternatives.’ What It Means for the Stock.,https://www.barrons.com/articles/honeywell-stock-rice-strategic-alternatives-breakup-1b888f2d?siteid=yhoof2&yptr=yahoo,0.2
2025-07-08 20:17:00+00:00,CMCSA,Zacks,"Top Analyst Reports for T-Mobile, AstraZeneca & Comcast",https://finance.yahoo.com/news/top-analyst-reports-t-mobile-201700363.html,0.0
2025-07-08 20:19:00+00:00,PEP,Barrons.com,"Hershey Names New CEO, Continuing Leadership Shuffle.  The Stock Falls.",https://www.barrons.com/articles/hershey-new-ceo-stock-falls-wendys-95f8b314?siteid=yhoof2&yptr=yahoo,-0.5
2025-07-08 20:19:30+00:00,ACN,Investor's Business Daily,Palantir Stock Goes 'Warp Speed' — But There's A Caveat,https://www.investors.com/research/how-to-find-the-best-stocks-to-buy/palantir-stock-accenture-warp-speed-for-warships/?src=A00220&yptr=yahoo,0.1
2025-07-08 20:21:15+00:00,HD,Bloomberg,SpaceX Valuation to Hit Around $400 Billion in Share Sale,https://finance.yahoo.com/news/spacex-valuation-hit-around-400-184152092.html,0.8
2025-07-08 20:31:52+00:00,MCD,Benzinga,"Bill Gates Reserved A Michelin-Star Restaurant for Two Days — But Chef Says He Didn't Even Try The $313 Meal, Just Ordered a Diet Coke And Left",https://finance.yahoo.com/news/bill-gates-reserved-michelin-star-203152661.html,-0.8
2025-07-08 20:32:32+00:00,TXN,Investor's Business Daily,Texas Instruments Stock Nears Buy Point Ahead Of Q2 Report,https://www.investors.com/news/technology/texas-instruments-stock-nears-buy-point-before-q2-report/?src=A00220&yptr=yahoo,0.5
2025-07-08 20:33:55+00:00,IBM,GuruFocus.com,How IBM Plans to Redefine AI Performance with Its New Hardware,https://finance.yahoo.com/news/ibm-plans-redefine-ai-performance-203355315.html,0.5
2025-07-08 20:34:25+00:00,USB,Yahoo Finance Video,HBSC downgrades Big Banks: Analyst behind the call explains why,https://finance.yahoo.com/video/hbsc-downgrades-big-banks-analyst-203425963.html,-0.5
