timestamp,ticker,source,text,url,SentimentScore
2025-07-02 20:56:51+00:00,ADP,MT Newswires,"Nasdaq, S&P 500 Notch New Record Highs Following US-Vietnam Deal; Tesla Rebounds",https://finance.yahoo.com/news/nasdaq-p-500-notch-record-205651725.html,0.8
2025-07-02 21:45:01+00:00,CAT,Zacks,Why Caterpillar (CAT) Outpaced the Stock Market Today,https://finance.yahoo.com/news/why-caterpillar-cat-outpaced-stock-214501419.html,0.5
2025-07-02 21:45:02+00:00,DE,Zacks,Deere (DE) Surpasses Market Returns: Some Facts Worth Knowing,https://finance.yahoo.com/news/deere-surpasses-market-returns-facts-214502914.html,0.5
2025-07-02 21:45:05+00:00,CB,Zacks,Chubb (CB) Stock Sinks As Market Gains: Here's Why,https://finance.yahoo.com/news/chubb-cb-stock-sinks-market-214505337.html,-0.5
2025-07-02 21:50:03+00:00,AMGN,Zacks,Amgen (AMGN) Outperforms Broader Market: What You Need to Know,https://finance.yahoo.com/news/amgen-amgn-outperforms-broader-market-215003760.html,0.5
2025-07-02 21:50:05+00:00,LRCX,Zacks,Lam Research (LRCX) Exceeds Market Returns: Some Facts to Consider,https://finance.yahoo.com/news/lam-research-lrcx-exceeds-market-215005738.html,0.5
2025-07-02 22:00:03+00:00,ADI,Zacks,Analog Devices (ADI) Exceeds Market Returns: Some Facts to Consider,https://finance.yahoo.com/news/analog-devices-adi-exceeds-market-220003977.html,0.5
2025-07-02 23:00:08+00:00,MDT,Benzinga,This $125M Israeli Startup Is Building The World's First Cataract Robot To Solve A Global Crisis: 'There Is No Human Way To Close The Gap',https://finance.yahoo.com/news/125m-israeli-startup-building-worlds-230008284.html,0.6
2025-07-03 00:00:00+00:00,AON,SEC-EDGAR-8K,"(Item 5.02) Departure of Directors or Certain Officers; Election of Directors; Appointment of Certain Officers; Compensatory Arrangements of Certain Officers. Amendment to International Assignment Letter On June 27, 2025, Aon Corporation (“Aon Corporation”), an indirect, wholly owned subsidiary of Aon plc (together with its subsidiaries, “Aon” or the “Company”), and Gregory C. Case entered into an amendment (the “Case Amendment”) to the international assignment letter agreement dated July 1, 2016 between Aon Corporation and Mr. Case (as

(Item 5.07) Submission of Matters to a Vote of Security Holders. The Company held its Annual Meeting on June 27, 2025. A total of 193,925,428 Class A Ordinary Shares, or 89.77% of the total shares entitled to vote, were represented at the Annual Meeting in person or by proxy. Shareholders voted on the following eight proposals at the Annual Meeting, all of which are described in the Proxy Statement, and cast their votes as described below: 1.",,0.1
2025-07-03 00:00:00+00:00,BA,SEC-EDGAR-8K,"(Item 5.02) . Departure of Directors or Certain Officers; Election of Directors; Appointment of Certain Officers; Compensatory Arrangements of Certain Officers. On June 29, 2025, the Board of Directors of The Boeing Company (the “Company”) elected Jesus (Jay) Malave to serve as the Company’s Executive Vice President and Chief Financial Officer, effective August 15, 2025 (the “Effective Date”), succeeding Brian J. West in that role. As of the Effective Date, Mr. West will cease to be the",,0.1
2025-07-03 02:16:09+00:00,SPG,Insider Monkey,Citi Maintains Neutral Rating on Simon Property Group (SPG),https://finance.yahoo.com/news/citi-maintains-neutral-rating-simon-021609309.html,0.0
2025-07-03 02:16:33+00:00,PLD,Insider Monkey,Prologis (PLD) To Add 4000 Homes with Caltrain Site Revamp,https://finance.yahoo.com/news/prologis-pld-add-4000-homes-021633955.html,0.5
2025-07-03 05:42:25+00:00,CSX,StockStory,5 Must-Read Analyst Questions From CSX’s Q1 Earnings Call,https://finance.yahoo.com/news/5-must-read-analyst-questions-054225218.html,0.0
2025-07-03 06:47:29+00:00,GILD,Insider Monkey,Gilead Sciences (GILD) Announces that US FDA Approves Yeztugo®as pre-exposure prophylaxis (PrEP),https://finance.yahoo.com/news/gilead-sciences-gild-announces-us-064729153.html,0.8
2025-07-03 06:47:32+00:00,AMGN,Insider Monkey,Amgen (AMGN) Announces Full Results from Part 1 of the Phase 2 study of MariTide,https://finance.yahoo.com/news/amgen-amgn-announces-full-results-064732857.html,0.5
2025-07-03 11:00:49+00:00,ADI,Simply Wall St.,"Is Analog Devices, Inc. (NASDAQ:ADI) Potentially Undervalued?",https://finance.yahoo.com/news/analog-devices-inc-nasdaq-adi-110049653.html,0.2
2025-07-03 11:00:52+00:00,SCHW,Investor's Business Daily,10 Simple Money Habits That Are Key To Building Wealth,https://www.investors.com/etfs-and-funds/personal-finance/money-habits-that-are-key-to-building-wealth/?src=A00220&yptr=yahoo,0.5
2025-07-03 11:01:11+00:00,CAT,Simply Wall St.,Is Caterpillar Inc. (NYSE:CAT) A High Quality Stock To Own?,https://finance.yahoo.com/news/caterpillar-inc-nyse-cat-high-110111205.html,0.2
2025-07-03 11:22:36+00:00,USB,MT Newswires,"Major US Banks to Benefit From 'Re-Emergence' of Capital Markets, Morgan Stanley Says",https://finance.yahoo.com/news/major-us-banks-benefit-apos-112236735.html,0.8
2025-07-03 11:33:39+00:00,ADP,MT Newswires,Stocks Edge Up Pre-Bell as Investors Await Key Jobs Report Before Independence Day,https://finance.yahoo.com/news/stocks-edge-pre-bell-investors-113339933.html,0.5
2025-07-03 11:55:00+00:00,EL,Zacks,5 Momentum Picks for Third-Quarter 2025 After a Stellar Second Quarter,https://finance.yahoo.com/news/5-momentum-picks-third-quarter-115500639.html,0.8
2025-07-03 12:00:02+00:00,ACN,Barchart,This Underrated Stock Just Scored a Major Palantir Win. Should You Buy It Now?,https://finance.yahoo.com/news/underrated-stock-just-scored-major-120002148.html,0.5
2025-07-03 12:00:14+00:00,AMGN,Simply Wall St.,"Amgen Insiders Sell US$12m Of Stock, Possibly Signalling Caution",https://finance.yahoo.com/news/amgen-insiders-sell-us-12m-120014232.html,-0.5
2025-07-03 12:04:00+00:00,SO,Zacks,Southern Company's Georgia Power Freezes Base Rates Through 2028,https://finance.yahoo.com/news/southern-companys-georgia-power-freezes-120400430.html,0.8
2025-07-03 12:51:39+00:00,CME,The Wall Street Journal,Traders Bet on Fewer Rate Cuts After Solid Jobs Report,https://www.wsj.com/livecoverage/june-jobs-report-stock-market-dow-sp500-nasdaq-07-03-25/card/traders-bet-on-fewer-rate-cuts-after-solid-jobs-report-Fddd5IQUFZv7Tc8IlTCW?siteid=yhoof2&yptr=yahoo,0.6
2025-07-03 12:52:00+00:00,SCHW,Zacks,"The Zacks Analyst Blog Highlights Coinbase Global, W. R. Berkley, Northern Trust, Goldman Sachs and Charles Schwab",https://finance.yahoo.com/news/zacks-analyst-blog-highlights-coinbase-125200914.html,0.5
2025-07-03 13:00:02+00:00,BKNG,Zacks,Booking Holdings Inc. (BKNG) is Attracting Investor Attention: Here is What You Should Know,https://finance.yahoo.com/news/booking-holdings-inc-bkng-attracting-130002209.html,0.5
2025-07-03 13:09:12+00:00,PG,Insider Monkey,Procter & Gamble Maintains Outperform Rating Amid Organizational Restructuring,https://finance.yahoo.com/news/procter-gamble-maintains-outperform-rating-130912539.html,0.5
2025-07-03 13:10:02+00:00,USB,Zacks,Improve Your Retirement Income with These 3 Top-Ranked Dividend Stocks,https://finance.yahoo.com/news/improve-retirement-income-3-top-131002281.html,0.5
2025-07-03 13:16:31+00:00,CME,The Wall Street Journal,That Sound You Hear Is Rate-Cut Odds Collapsing: Reactions to the Jobs Report,https://www.wsj.com/livecoverage/june-jobs-report-stock-market-dow-sp500-nasdaq-07-03-25/card/that-sound-you-hear-is-rate-cut-odds-collapsing-reactions-to-the-jobs-report-oS0vQvV0wZK8zB0Uw4vX?siteid=yhoof2&yptr=yahoo,-0.6
2025-07-03 13:26:00+00:00,PM,Zacks,PM Grows Smoke-Free Profit Share: Will Margins Keep Expanding?,https://finance.yahoo.com/news/pm-grows-smoke-free-profit-132600662.html,0.5
2025-07-03 13:42:00+00:00,BKNG,Barrons.com,Tripadvisor Stock Surges. Why Starboard Stake Is Good for the Travel Sector.,https://www.barrons.com/articles/tripadvisor-stock-activist-starboard-travel-a665ae08?siteid=yhoof2&yptr=yahoo,0.8
2025-07-03 13:56:00+00:00,PM,Zacks,MO Strengthens on! Brand: Can it Sustain Momentum in Nicotine Pouches?,https://finance.yahoo.com/news/mo-strengthens-brand-sustain-momentum-135600942.html,0.5
2025-07-03 14:00:00+00:00,ACN,TechCrunch,Writer CEO May Habib to take the AI Stage at TechCrunch Disrupt 2025,https://finance.yahoo.com/news/writer-ceo-may-habib-ai-140000043.html,0.5
2025-07-03 14:00:17+00:00,PM,Simply Wall St.,"Philip Morris International Insiders Sell US$49m Of Stock, Possibly Signalling Caution",https://finance.yahoo.com/news/philip-morris-international-insiders-sell-140017461.html,-0.5
2025-07-03 14:03:00+00:00,SCHW,Zacks,"IBKR Stock Gains on Higher June DARTs: Should You Buy, Hold, or Sell?",https://finance.yahoo.com/news/ibkr-stock-gains-higher-june-140300703.html,0.5
2025-07-03 14:05:00+00:00,PLD,Zacks,Prologis Stock Rises 10.3% in Three Months: Will the Trend Last?,https://finance.yahoo.com/news/prologis-stock-rises-10-3-140500050.html,0.5
2025-07-03 14:31:00+00:00,RTX,Zacks,Lockheed's Unit Secures a Contract to Support the AEGIS Combat System,https://finance.yahoo.com/news/lockheeds-unit-secures-contract-support-143100655.html,0.5
2025-07-03 14:51:30+00:00,CME,Bloomberg,Trump Visits Iowa While 2028 Republicans Wait for Their Chance,https://finance.yahoo.com/news/trump-visits-iowa-while-2028-145130426.html,0.1
2025-07-03 15:03:00+00:00,ADP,Zacks,Nonfarm Payrolls Exceed Estimates in June,https://finance.yahoo.com/news/nonfarm-payrolls-exceed-estimates-june-150300788.html,0.8
2025-07-03 15:19:00+00:00,CI,Barrons.com,Robinhood Stock Is Falling After S&P 500 Snub. Why That’s Shortsighted.,https://www.barrons.com/articles/robinhood-stock-sp-500-datadog-bcfa4b27?siteid=yhoof2&yptr=yahoo,0.2
2025-07-03 16:10:02+00:00,LIN,Zacks,Will Linde (LIN) Beat Estimates Again in Its Next Earnings Report?,https://finance.yahoo.com/news/linde-lin-beat-estimates-again-161002749.html,0.2
2025-07-03 16:10:03+00:00,SCHW,Zacks,Will Charles Schwab (SCHW) Beat Estimates Again in Its Next Earnings Report?,https://finance.yahoo.com/news/charles-schwab-schw-beat-estimates-161003294.html,0.2
2025-07-03 16:10:04+00:00,PNC,Zacks,Why The PNC Financial Services Group (PNC) is Poised to Beat Earnings Estimates Again,https://finance.yahoo.com/news/why-pnc-financial-services-group-161004940.html,0.8
2025-07-03 16:43:39+00:00,MDT,Insider Monkey,Wolfe Research Upgrades Medtronic (MDT) to Peer Perform,https://finance.yahoo.com/news/wolfe-research-upgrades-medtronic-mdt-164339563.html,0.5
2025-07-03 16:55:00+00:00,BKNG,Barrons.com,"Travel Stocks Could Offer Investors a Glorious Trip, This Analyst Says",https://www.barrons.com/articles/travel-stocks-united-delta-hyatt-cb139268?siteid=yhoof2&yptr=yahoo,0.8
2025-07-03 17:27:10+00:00,CME,MT Newswires,Sector Update: Financial Stocks Rise Thursday Afternoon,https://finance.yahoo.com/news/sector-financial-stocks-rise-thursday-172710541.html,0.5
2025-07-03 17:27:16+00:00,ACN,Simply Wall St.,Palantir Technologies (NasdaqGS:PLTR) Powers U.S. Navy's Shipbuilding With Warp Speed Initiative,https://finance.yahoo.com/news/palantir-technologies-nasdaqgs-pltr-powers-172716901.html,0.8
2025-07-03 17:46:06+00:00,VRTX,MT Newswires,Vertex Says Long-Term Data Show Casgevy's 'Durable' Clinical Benefits in Blood Disorder Trials,https://finance.yahoo.com/news/vertex-says-long-term-data-174606793.html,0.6
2025-07-03 18:04:07+00:00,SPGI,MT Newswires,"S&P 500, Nasdaq Stretch Record Closing Runs After Jobs Report",https://finance.yahoo.com/news/p-500-nasdaq-stretch-record-180407002.html,0.5
2025-07-03 19:27:35+00:00,NOW,reddit.com/r/stocks,"Trump’s Tax Bill Ekes Through House. The President Meets His Deadline. - President Donald Trump and Republicans will hit their July 4 deadline to pass the president’s signature tax and spending legislation and sign it into law. Now the pressure will be on to convince voters that Trump’s achievement will make the U.S. economy stronger. Americans thus far aren’t convinced.

The House voted 218-214 to pass the bill, which extends the individual tax cuts that Trump originally signed into law in 2017, among other provisions.

Over the past two days, fiscal conservatives have lambasted the bill for adding a projected $3.4 trillion to the $36.2 trillion national debt over the next decade. Meanwhile, some GOP moderates expressed concern about the bill’s cuts to Medicaid that the nonpartisan Congressional Budget Office has said will likely result in nearly 12 million people losing their insurance coverage.

In the end, both groups folded without any changes. Some previous holdouts said the White House made assurances on how they would enforce certain provisions in the bill, while House leadership also suggested Republicans would have a chance to pass another bill to make changes later in the year.

Read More:
https://www.barrons.com/articles/trump-tax-bill-house-pass-9e230859
",,-0.6
2025-07-03 19:30:17+00:00,ADSK,TechCrunch,Wonder Dynamics co-founder Nikola Todorovic joins the AI Stage at TechCrunch Disrupt 2025,https://finance.yahoo.com/news/wonder-dynamics-co-founder-nikola-231000500.html,0.5
2025-07-04 04:02:47+00:00,CL,StockStory,"Colgate-Palmolive (CL): Buy, Sell, or Hold Post Q1 Earnings?",https://finance.yahoo.com/news/colgate-palmolive-cl-buy-sell-040247793.html,0.2
2025-07-04 04:03:33+00:00,MO,StockStory,"Altria (MO): Buy, Sell, or Hold Post Q1 Earnings?",https://finance.yahoo.com/news/altria-mo-buy-sell-hold-040333782.html,0.2
2025-07-04 04:31:11+00:00,TEAM,StockStory,2 Growth Stocks with All-Star Potential and 1 to Approach with Caution,https://finance.yahoo.com/news/2-growth-stocks-star-potential-043111237.html,0.5
2025-07-04 04:35:44+00:00,ADI,StockStory,3 Volatile Stocks in the Doghouse,https://finance.yahoo.com/news/3-volatile-stocks-doghouse-043544526.html,-0.5
2025-07-04 04:36:27+00:00,TMO,StockStory,1 Large-Cap Stock to Own for Decades and 2 to Steer Clear Of,https://finance.yahoo.com/news/1-large-cap-stock-own-043627632.html,0.2
2025-07-04 04:37:31+00:00,DE,StockStory,1 Profitable Stock to Keep an Eye On and 2 to Keep Off Your Radar,https://finance.yahoo.com/news/1-profitable-stock-keep-eye-043731016.html,0.5
2025-07-04 04:38:41+00:00,CL,StockStory,2 S&P 500 Stocks with Promising Prospects and 1 to Question,https://finance.yahoo.com/news/2-p-500-stocks-promising-043841308.html,0.5
2025-07-04 05:01:00+00:00,AMGN,Barrons.com,Lilly and Novo Are the Kings of Weight-Loss Drugs. The Companies Coming for Their Crowns.,https://www.barrons.com/articles/lilly-novo-weight-loss-drugs-amgen-roche-ozempic-08784075?siteid=yhoof2&yptr=yahoo,0.2
2025-07-04 05:32:20+00:00,MDLZ,StockStory,5 Must-Read Analyst Questions From Mondelez’s Q1 Earnings Call,https://finance.yahoo.com/news/5-must-read-analyst-questions-053220601.html,0.1
2025-07-04 05:47:47+00:00,ADSK,Insider Monkey,"Datadog Earns Forbes Global 2000 Spot, Unveils New AI, Observability Features at DASH 2025",https://finance.yahoo.com/news/datadog-earns-forbes-global-2000-054747975.html,0.5
2025-07-04 05:48:42+00:00,TMO,Insider Monkey,"Solventum Amends Thermo Fisher Deal, Retains Water Filtration Business",https://finance.yahoo.com/news/solventum-amends-thermo-fisher-deal-054842808.html,0.5
2025-07-04 06:43:03+00:00,CME,Insider Monkey,CME Group to Launch FX Tape+ for Enhanced Transparency in Foreign Exchange Markets,https://finance.yahoo.com/news/cme-group-launch-fx-tape-064303510.html,0.5
2025-07-04 06:54:39+00:00,PG,Insider Monkey,Jim Cramer Says “Buy Procter & Gamble”,https://finance.yahoo.com/news/jim-cramer-says-buy-procter-065439709.html,0.5
2025-07-04 07:04:14+00:00,GE,Insider Monkey,Jim Cramer Believes “GE Vernova Can Continue to Grind Higher”,https://finance.yahoo.com/news/jim-cramer-believes-ge-vernova-070414978.html,0.6
2025-07-04 07:04:39+00:00,BMY,Insider Monkey,Jim Cramer Says “Bristol Myers has a Faint Pulse”,https://finance.yahoo.com/news/jim-cramer-says-bristol-myers-070439775.html,-0.6
2025-07-04 07:22:48+00:00,AMGN,Insider Monkey,Piper Sandler Reaffirms Buy on Amgen Amid MariTide Tolerability Update,https://finance.yahoo.com/news/piper-sandler-reaffirms-buy-amgen-072248177.html,0.5
2025-07-04 07:22:55+00:00,CMCSA,Insider Monkey,Comcast Gets Buy Rating as Peacock and Universal Boost Growth Outlook,https://finance.yahoo.com/news/comcast-gets-buy-rating-peacock-072255191.html,0.6
2025-07-04 07:23:01+00:00,SYK,Insider Monkey,"Stryker’s Incompass System Secures FDA Nod, Boosting Orthopaedics Innovation Strategy",https://finance.yahoo.com/news/stryker-incompass-system-secures-fda-072301025.html,0.8
2025-07-04 07:23:04+00:00,LIN,Insider Monkey,"Linde Stock Holds Price Target as UBS Highlights AI, Hydrogen, and Growth Sectors",https://finance.yahoo.com/news/linde-stock-holds-price-target-072304203.html,0.5
2025-07-04 08:43:26+00:00,ADSK,Yahoo Finance UK,"Trending tickers: TripAdvisor, Bitmine, WolfSpeed, BYD and AstraZeneca",https://finance.yahoo.com/news/tripadvisor-bitmine-wolfspeed-byd-astrazeneca-trending-tickers-084326972.html,0.0
2025-07-04 10:52:00+00:00,NKE,Motley Fool,These Were The 2 Best-Performing Stocks in the Dow Jones Industrial Average in June 2025,https://finance.yahoo.com/news/were-2-best-performing-stocks-105200885.html,0.5
2025-07-04 11:05:36+00:00,CME,Barchart,CME Group's Quarterly Earnings Preview: What You Need to Know,https://finance.yahoo.com/news/cme-groups-quarterly-earnings-preview-110536788.html,0.2
2025-07-04 11:29:46+00:00,RTX,Barchart,RTX Corporation's Q2 2025 Earnings: What to Expect,https://finance.yahoo.com/news/rtx-corporations-q2-2025-earnings-112946187.html,0.0
2025-07-04 12:01:34+00:00,MDLZ,Just Food,Cacique Foods appoints former Mondelez executive as new CEO,https://finance.yahoo.com/news/cacique-foods-appoints-former-mondelez-120134851.html,0.5
2025-07-04 12:13:07+00:00,NOW,reddit.com/r/stocks,"Businesses are clear beneficiaries of the new bill, pushing corporate expansions and stock prices to new heights with new tax breaks. - **Big corporations would see a drastic rise in revenue resulting from tax cuts and relief from the rejection of proposed tax bills.  Corporate America gets a sigh of relief for expansion and new investment allowed by the increased revenue and liquidity.  Many small businesses will benefit as well, which will funnel additional funding to the large corporations.**

* This makes the dropped corporate tax rate from 35% to 21% permanent and lowers marginal income tax rates for most tax brackets.
* Rejection of increase in stock buyback tax.
* Rejection of proposed tax bills that would have limited state and local deductions for corporations.
* The new tax bill is set to benefit private student loan lenders, such as SoFi, which could see a jump in demand.
* Many of the tax breaks from the 2017 TCJA (originally set to expire in 2025) will become permanent.
* Restore a tax break from the 2017 tax package that allowed businesses to fully write off the cost of equipment in the first year it was purchased
* Allow businesses to write off the cost of research and development in the year it was incurred
* Businesses will be allowed to fully and immediately deduct the cost of building new manufacturing facilities.
* QBI for Small Businesses and Partnerships (formed by lawyers, doctors, and investors) will increase through the House Proposal from 20% to 23% from now until 2029. The Senate bill will permanently maintain the current minimum 20% rate.
* Boost defense spending by $150B
* \~$10B in funding to reach the Moon and Mars, and decommission of the ISS.

**Here are other Winners and Losers of the new tax bill:**

**Winners:**

Millionaires' inheritance beneficiaries: The estate tax exemption rises to $15 million for individuals, $30 million for married couples, and then adjusts with inflation.

State and local tax deduction rises to $40,000 annually for a five-year period, which phases out for earners over $500,000/year.

Seniors get a larger standard deduction.

Tips and Overtime pay are exempt from income taxes.

529 Plan benefits for younger children went up from $10K to $20K in annual withdrawals while widening the definition of “qualified expenses” in K-12 to include non-tuition categories like books, tutoring, standardized testing fees, educational therapies for children with disabilities, and more.  Increasing the ability to pay for private school, along with public school-type expenses.

Certain professional credential fees, like exams and licensing costs, will also now be covered as qualified expenses under 529 Plan funds.

A new tax-advantaged investment vehicle named the Trump Account (basically a Kid IRA), which has to be established before children turn 18 and can’t be tapped until after they turn 18.  However, 529s remain optimal for those looking to save for educational expenses.

Private Equity tax breaks.

Domestic Car Buyers would get up to $10,000 a year in loan interest deduction through 2028.

Fossil Fuel Producers get tax breaks.

Telecommunications get a massive, wider radio spectrum, increasing service capabilities

**Losers:**

New work requirements for Medicaid recipients with cuts and increased cost sharing.

Expanded work requirements for food stamps to cover beneficiaries up to 65 YO with states to contribute portions of food stamp benefits.

Tax credits for solar panels and wind systems are phasing out.

Tax credits for energy-efficient home improvements are eliminated at the end of the year.

The Senate's decision allows states to continue developing and enforcing their own AI regulations.

EV maker hit by elimination of $7,500 tax credit.

Elite universities get new tiered tax rates as high as 8%.

New 1% tax on transfers of money to foreign countries.  (This is currently tackled by companies such as SoFi with the development of International money transfer utilizing blockchain and Crypto international payment with SoFi/Galileo)

Restrictions on some immigrants' access to health coverage premium credits.

Gamblers would be limited to a 90% deduction on losses against their winnings.",,0.8
2025-07-04 12:53:56+00:00,LIN,Insider Monkey,Should You Invest in Linde plc (LIN)?,https://finance.yahoo.com/news/invest-linde-plc-lin-125356825.html,0.0
2025-07-04 12:56:00+00:00,EL,Zacks,Helen of Troy Q1 Earnings Coming Up: What Investors Need to Know,https://finance.yahoo.com/news/helen-troy-q1-earnings-coming-125600964.html,0.2
2025-07-04 13:00:03+00:00,PLD,Zacks,Why Investors Need to Take Advantage of These 2 Finance Stocks Now,https://finance.yahoo.com/news/why-investors-advantage-2-finance-130003709.html,0.5
2025-07-04 13:00:03+00:00,ISRG,Zacks,"Investors Heavily Search Intuitive Surgical, Inc. (ISRG): Here is What You Need to Know",https://finance.yahoo.com/news/investors-heavily-search-intuitive-surgical-130003070.html,0.5
2025-07-04 13:00:04+00:00,SPGI,Zacks,How to Find Strong Finance Stocks Slated for Positive Earnings Surprises,https://finance.yahoo.com/news/strong-finance-stocks-slated-positive-130004854.html,0.8
2025-07-04 13:00:37+00:00,ELV,StockStory,"Stocks making big moves this week: Oscar Health, Sunrun, Elevance Health, Tesla, and GMS",https://finance.yahoo.com/news/stocks-making-big-moves-week-130037835.html,0.5
2025-07-04 13:02:00+00:00,RTX,Zacks,RTX's Raytheon Unit Set to See Sales Boost With Major Defense Contracts,https://finance.yahoo.com/news/rtxs-raytheon-unit-set-see-130200833.html,0.8
2025-07-04 13:30:03+00:00,ABT,Zacks,Is It Worth Investing in Abbott (ABT) Based on Wall Street's Bullish Views?,https://finance.yahoo.com/news/worth-investing-abbott-abt-based-133003535.html,0.5
2025-07-04 13:32:00+00:00,HD,Zacks,Home Depot Stock Picks Momentum in 3 Months: Buy Now or Stay Put?,https://finance.yahoo.com/news/home-depot-stock-picks-momentum-133200836.html,0.2
2025-07-04 13:45:00+00:00,ISRG,Zacks,Intuitive Surgical's Fifth Generation da Vinci System Receives CE Mark,https://finance.yahoo.com/news/intuitive-surgicals-fifth-generation-da-134500316.html,0.5
2025-07-04 13:45:47+00:00,PNC,TipRanks,"Meta upgraded, PNC Financial downgraded: Wall Street’s top analyst calls",https://finance.yahoo.com/news/meta-upgraded-pnc-financial-downgraded-134547568.html,0.2
2025-07-04 14:25:00+00:00,TEAM,Zacks,GitLab's DevSecOps Growth Momentum Continues: A Sign for More Upside?,https://finance.yahoo.com/news/gitlabs-devsecops-growth-momentum-continues-142500489.html,0.6
