timestamp,ticker,source,text,url,SentimentScore
2026-03-25 13:30:02+00:00,TTWO,Zacks,Wall Street Analysts See Take-Two (TTWO) as a Buy: Should You Invest?,https://finance.yahoo.com/markets/stocks/articles/wall-street-analysts-see-two-133002724.html,0.5
2026-03-25 13:30:03+00:00,AMAT,Zacks,Wall Street Bulls Look Optimistic About Applied Materials (AMAT): Should You Buy?,https://finance.yahoo.com/markets/stocks/articles/wall-street-bulls-look-optimistic-133003544.html,0.8
2026-03-25 13:30:03+00:00,ISRG,Zacks,Wall Street Analysts Think Intuitive Surgical (ISRG) Is a Good Investment: Is It?,https://finance.yahoo.com/markets/stocks/articles/wall-street-analysts-think-intuitive-133003914.html,0.5
2026-03-25 13:31:24+00:00,WMT,24/7 Wall St.,COSW Sells Away Costco’s Upside Each Week to Fund Its Distributions,https://finance.yahoo.com/markets/options/articles/cosw-sells-away-costco-upside-133124566.html,-0.5
2026-03-25 13:35:16+00:00,QCOM,24/7 Wall St.,SCHD Just Made Big Changes. Is This Dividend Growth ETF Still a Buy?,https://finance.yahoo.com/markets/stocks/articles/schd-just-made-big-changes-133516206.html,0.5
2026-03-25 13:40:01+00:00,CTAS,Zacks,Cintas (CTAS) Q3 Earnings and Revenues Beat Estimates,https://finance.yahoo.com/markets/stocks/articles/cintas-ctas-q3-earnings-revenues-134001349.html,0.8
2026-03-25 13:40:02+00:00,PAYX,Zacks,Paychex (PAYX) Beats Q3 Earnings and Revenue Estimates,https://finance.yahoo.com/markets/stocks/articles/paychex-payx-beats-q3-earnings-134002536.html,0.8
2026-03-25 13:41:00+00:00,PLTR,Motley Fool,"This Is the Most Hated Tech Stock on Wall Street Right Now, and I Think It's a Buy",https://finance.yahoo.com/markets/stocks/articles/most-hated-tech-stock-wall-134100847.html,0.5
2026-03-25 13:43:00+00:00,ISRG,Zacks,MDT Expands Agreement With Merit to Offer ViaVerte: Stock to Gain?,https://finance.yahoo.com/markets/stocks/articles/mdt-expands-agreement-merit-offer-134300756.html,0.5
2026-03-25 13:48:07+00:00,CEG,The Fly,"Arm upgraded, Mondelez downgraded: Wall Street's top analyst calls",https://finance.yahoo.com/markets/stocks/articles/arm-upgraded-strategy-initiated-wall-135004199.html,-0.5
2026-03-25 13:49:00+00:00,WMT,PR Newswire,Bria Named to Fast Company's Annual List of the World's Most Innovative Companies of 2026,https://finance.yahoo.com/sectors/technology/articles/bria-named-fast-companys-annual-134900839.html,0.8
2026-03-25 13:52:00+00:00,PYPL,Zacks,Klarna Doubles Down on U.S. Expansion With Elliott Backing,https://finance.yahoo.com/markets/stocks/articles/klarna-doubles-down-u-expansion-135200702.html,0.5
2026-03-25 13:52:01+00:00,CSX,FreightWaves,Transload provider bringing new life to dormant Maine rail lines,https://finance.yahoo.com/economy/policy/articles/transload-provider-bringing-life-dormant-135201788.html,0.6
2026-03-25 13:55:00+00:00,DDOG,Zacks,MDB's Atlas Outlook Reflects Caution: Is Growth Losing Momentum?,https://finance.yahoo.com/markets/stocks/articles/mdbs-atlas-outlook-reflects-caution-135500988.html,-0.5
2026-03-25 13:56:00+00:00,AAPL,24/7 Wall St.,Opinion: Apple’s a Massive Share-Taker Amid Sky-High Memory Prices,https://finance.yahoo.com/markets/stocks/articles/opinion-apple-massive-share-taker-135600548.html,0.5
2026-03-25 13:57:02+00:00,AAPL,24/7 Wall St.,The Nasdaq Could Pop 2% On Today’s News,https://finance.yahoo.com/markets/stocks/articles/nasdaq-could-pop-2-today-135702177.html,0.8
2026-03-25 14:00:00+00:00,WMT,PR Newswire,Veho Named to Fast Company's Annual List of the World's Most Innovative Companies of 2026,https://finance.yahoo.com/sectors/technology/articles/veho-named-fast-companys-annual-140000370.html,0.8
2026-03-25 14:00:00+00:00,CMCSA,Business Wire,"Comcast Advertising Launches Outcomes+, a Next Gen Targeting and Attribution Solution Across Traditional and Streaming TV",https://finance.yahoo.com/sectors/technology/articles/comcast-advertising-launches-outcomes-next-140000901.html,0.5
2026-03-25 14:00:00+00:00,SHOP,PR Newswire,Deck Commerce Powers Eddie Bauer's Digital Expansion with O5 Group,https://finance.yahoo.com/sectors/technology/articles/deck-commerce-powers-eddie-bauers-140000683.html,0.5
2026-03-25 14:00:02+00:00,CTAS,Zacks,Here's What Key Metrics Tell Us About Cintas (CTAS) Q3 Earnings,https://finance.yahoo.com/markets/stocks/articles/heres-key-metrics-tell-us-140002331.html,0.2
2026-03-25 14:00:02+00:00,PAYX,Zacks,Paychex (PAYX) Reports Q3 Earnings: What Key Metrics Have to Say,https://finance.yahoo.com/markets/stocks/articles/paychex-payx-reports-q3-earnings-140002683.html,0.2
2026-03-25 14:03:30+00:00,AVGO,24/7 Wall St.,Broadcom’s AI Revenue Just Doubled. The Stock Barely Moved,https://finance.yahoo.com/markets/stocks/articles/broadcom-ai-revenue-just-doubled-140330879.html,0.2
2026-03-25 14:04:42+00:00,BKR,Simply Wall St.,Baker Hughes Taps Google Cloud As AI Power Demand Reshapes Growth,https://finance.yahoo.com/sectors/energy/articles/baker-hughes-taps-google-cloud-140442521.html,0.5
2026-03-25 14:05:47+00:00,LRCX,Simply Wall St.,Assessing Lam Research (LRCX) Valuation After Strong Multi Year Shareholder Returns,https://finance.yahoo.com/markets/stocks/articles/assessing-lam-research-lrcx-valuation-140547659.html,0.5
2026-03-25 14:11:00+00:00,STX,Zacks,Western Digital Riding on AI & Cloud Boom to Power Growth,https://finance.yahoo.com/sectors/technology/articles/western-digital-riding-ai-cloud-141100101.html,0.6
2026-03-25 14:11:00+00:00,ZS,Zacks,Can Prisma Browser Adoption Accelerate PANW's SASE Growth?,https://finance.yahoo.com/markets/stocks/articles/prisma-browser-adoption-accelerate-panws-141100890.html,0.5
2026-03-25 14:15:00+00:00,TSLA,MoneyShow,Market Minute 3-25-26- Markets Rally on Mideast Deal Hopes,https://finance.yahoo.com/markets/stocks/articles/market-minute-3-25-26-141500485.html,0.8
2026-03-25 14:16:00+00:00,ASML,Zacks,Can High-NA EUV Adoption Accelerate ASML's Long-Term Revenue Growth?,https://finance.yahoo.com/markets/stocks/articles/high-na-euv-adoption-accelerate-141600899.html,0.5
2026-03-25 14:19:00+00:00,CSCO,PR Newswire,"Atom Computing Announces Strategic Collaboration with Cisco to Advance Scalable, Networked, and Distributed Quantum Computing",https://finance.yahoo.com/sectors/technology/articles/atom-computing-announces-strategic-collaboration-141900823.html,0.8
2026-03-25 14:19:45+00:00,STX,Investing.com,"MU, WDC, SNDK fall: Why Google’s TurboQuant is rattling memory stocks",https://finance.yahoo.com/sectors/technology/articles/mu-wdc-sndk-fall-why-141945272.html,-0.5
2026-03-25 14:21:25+00:00,COST,Yahoo Finance,Why Costco's cheap new Kirkland energy drink won't crush Celsius,https://finance.yahoo.com/news/why-costcos-cheap-new-kirkland-energy-drink-wont-crush-celsius-142125090.html,0.1
2026-03-25 14:23:50+00:00,AAPL,Insider Monkey,Apple (AAPL) Rose on Better-Than-Feared iPhone 17 Sales,https://finance.yahoo.com/markets/stocks/articles/apple-aapl-rose-better-feared-142350507.html,0.6
2026-03-25 14:25:00+00:00,SBUX,Zacks,Can Starbucks' $2B Cost-Savings Plan Reignite Margin Expansion?,https://finance.yahoo.com/markets/stocks/articles/starbucks-2b-cost-savings-plan-142500395.html,0.2
2026-03-25 14:25:48+00:00,AMAT,Insider Monkey,Applied Materials (AMAT) Surged on Improving Wafer-Fab Spending Visibility,https://finance.yahoo.com/markets/stocks/articles/applied-materials-amat-surged-improving-142548508.html,0.8
2026-03-25 14:26:51+00:00,MRVL,TipRanks,Trump Trade: TotalEnergies to shift capital from wind to natural gas,https://finance.yahoo.com/sectors/energy/articles/trump-trade-totalenergies-shift-capital-142651664.html,-0.5
2026-03-25 14:29:51+00:00,CTAS,MT Newswires,Cintas Lifts Full-Year Outlook Following Third-Quarter Beat,https://finance.yahoo.com/markets/stocks/articles/cintas-lifts-full-outlook-following-142951378.html,0.6
2026-03-25 14:30:00+00:00,MSTR,TheStreet,Veteran investor slams Michael Saylor over Bitcoin centralization push,https://finance.yahoo.com/markets/crypto/articles/veteran-investor-slams-michael-saylor-143000289.html,-0.7
2026-03-25 14:30:00+00:00,AAPL,GlobeNewswire,"BuffBuff Introduces New HSR Top-Up Service Targeting Safer, Lower-Cost In-Game Purchases",https://finance.yahoo.com/markets/crypto/articles/buffbuff-introduces-hsr-top-targeting-143000093.html,0.6
2026-03-25 14:31:01+00:00,AAPL,Insider Monkey,Was Jim Cramer Right About Apple (AAPL)?,https://finance.yahoo.com/markets/stocks/articles/jim-cramer-apple-aapl-143101685.html,0.2
2026-03-25 14:31:24+00:00,NFLX,Insider Monkey,Investors’ Concerns Hurt Netflix (NFLX) in Q4,https://finance.yahoo.com/markets/stocks/articles/investors-concerns-hurt-netflix-nflx-143124499.html,-0.6
2026-03-25 14:32:04+00:00,LRCX,24/7 Wall St.,Micron Falls as Q2 Earnings and AI Compression Put Memory Stocks on Edge,https://finance.yahoo.com/markets/stocks/articles/micron-falls-q2-earnings-ai-143204617.html,-0.6
2026-03-25 14:32:13+00:00,WMT,Retail Insight Network,FedEx to roll out same-day deliveries,https://finance.yahoo.com/markets/stocks/articles/fedex-roll-same-day-deliveries-143213546.html,0.5
2026-03-25 14:33:00+00:00,SBUX,Zacks,BROS' Record AUVs Stand Out: Can Unit Economics Stay This Strong?,https://finance.yahoo.com/markets/stocks/articles/bros-record-auvs-stand-unit-143300768.html,0.5
2026-03-25 14:35:00+00:00,ISRG,Zacks,Reasons to Retain TransMedics Stock in Your Portfolio for Now,https://finance.yahoo.com/sectors/healthcare/articles/reasons-retain-transmedics-stock-portfolio-143500236.html,0.5
2026-03-25 14:35:00+00:00,AXON,Zacks,Can Axon Sustain EBITDA Margin Momentum Amid Cost Pressures?,https://finance.yahoo.com/markets/stocks/articles/axon-sustain-ebitda-margin-momentum-143500676.html,-0.5
2026-03-25 14:41:00+00:00,TSLA,Barrons.com,Wall Street Is Going Gaga for Robots. Aptiv and Other Stocks Will Benefit.,https://www.barrons.com/articles/wall-street-robots-aptiv-stocks-will-benefit-87b65059?siteid=yhoof2&yptr=yahoo,0.8
2026-03-25 14:42:00+00:00,DASH,Zacks,SERV Taps Uber & DoorDash Scale: Is Platform Leverage Paying Off?,https://finance.yahoo.com/markets/stocks/articles/serv-taps-uber-doordash-scale-144200829.html,0.2
2026-03-25 14:45:24+00:00,AAPL,24/7 Wall St.,3 Equal Weight ETFs Beating the S&P 500 in 2026 as Mega-Cap Dominance Fades,https://finance.yahoo.com/markets/options/articles/3-equal-weight-etfs-beating-144524448.html,0.5
2026-03-25 14:48:00+00:00,CTSH,PR Newswire,Cognizant Named to Newsweek's America's Greatest Workplaces for Entry Level 2026,https://finance.yahoo.com/markets/stocks/articles/cognizant-named-newsweeks-americas-greatest-144800967.html,0.8
2026-03-25 14:49:00+00:00,ASML,reddit.com/r/stocks,"Asml is now my anchor stock - I keep putting money into asml and it surpassed my VOO stock. At first I was apprehensive, but i’m not seeing much movement in 2026 with everything going on. Dunno how long this bubble will last, but until they have any type of real competition, I’m still gonna buy on any dip. I am starting to pivot to bottleneck, pick & shovel, toll booth stocks, and companies with",,0.2
2026-03-25 14:49:51+00:00,TSLA,Reuters Videos,"SpaceX could file for IPO as soon as this week, report suggests",https://finance.yahoo.com/video/spacex-could-file-ipo-soon-144951877.html,0.5
2026-03-25 14:51:00+00:00,CSCO,Zacks,"Intrusion Stock Tanks 8% as Q4 Earnings Miss, Revenues Decline Y/Y",https://finance.yahoo.com/markets/stocks/articles/intrusion-stock-tanks-8-q4-145100885.html,-0.6
2026-03-25 14:57:28+00:00,AMZN,Yahoo Finance Video,AmEx CEO talks AI impact in shareholder letter: A closer look,https://finance.yahoo.com/video/amex-ceo-talks-ai-impact-in-shareholder-letter-a-closer-look-145728327.html,0.1
2026-03-25 14:58:24+00:00,INSM,24/7 Wall St.,Insmed CEO reveals Japan patient population exceeds US market for lung disease,https://finance.yahoo.com/sectors/healthcare/articles/insmed-ceo-reveals-japan-patient-145824376.html,0.5
2026-03-25 15:02:00+00:00,GILD,Business Wire,Weave Bio Establishes Inaugural Strategic Advisory Board to Shape the Future of AI-Driven Regulatory Science,https://finance.yahoo.com/sectors/healthcare/articles/weave-bio-establishes-inaugural-strategic-150200207.html,0.6
2026-03-25 15:03:00+00:00,ADSK,Zacks,FIG vs. ADSK: Which Stock Has an Edge in the Design SaaS Market?,https://finance.yahoo.com/markets/stocks/articles/fig-vs-adsk-stock-edge-150300067.html,0.2
2026-03-25 15:05:31+00:00,PLTR,Motley Fool,3 Weaknesses to Weigh Before You Buy Palantir (PLTR) Stock,https://finance.yahoo.com/markets/stocks/articles/3-weaknesses-weigh-buy-palantir-150531772.html,-0.5
2026-03-25 15:06:14+00:00,WMT,Verdict Food Service,Krispy Kreme restructures Western US JV and sells Japan business,https://finance.yahoo.com/markets/stocks/articles/krispy-kreme-restructures-western-us-150614231.html,0.1
2026-03-25 15:06:44+00:00,META,Yahoo Finance Video,"Arm stock skyrockets on chip news, On Holding CEO to step down",https://finance.yahoo.com/video/arm-stock-skyrockets-on-chip-news-on-holding-ceo-to-step-down-150644010.html,0.5
2026-03-25 15:08:00+00:00,NXPI,Zacks,Can Qualcomm's Advanced AI Camera for Security & IoT Drive Profits?,https://finance.yahoo.com/sectors/technology/articles/qualcomms-advanced-ai-camera-security-150800473.html,0.2
2026-03-25 15:11:08+00:00,MSTR,Yahoo Finance,"Bitcoin hovers around $71,000 as Bernstein analysts say token 'looks bottomed'",https://finance.yahoo.com/news/bitcoin-hovers-around-71000-as-bernstein-analysts-say-token-looks-bottomed-151108043.html,0.6
2026-03-25 15:13:00+00:00,ISRG,Zacks,Reasons to Retain Fresenius Medical Stock in Your Portfolio for Now,https://finance.yahoo.com/sectors/healthcare/articles/reasons-retain-fresenius-medical-stock-151300805.html,0.5
2026-03-25 15:13:00+00:00,APP,Zacks,APP vs DUOL: Which Mobile-Tech Growth Stock Is the Better Buy Now?,https://finance.yahoo.com/markets/stocks/articles/app-vs-duol-mobile-tech-151300531.html,0.5
2026-03-25 15:17:35+00:00,PLTR,MarketBeat,Ondas Q4 Earnings Call Highlights,https://finance.yahoo.com/markets/stocks/articles/ondas-q4-earnings-call-highlights-151735728.html,0.2
2026-03-25 15:18:00+00:00,ISRG,Zacks,LivaNova Expands OSA Care With FDA-Approved aura6000 System,https://finance.yahoo.com/sectors/healthcare/articles/livanova-expands-osa-care-fda-151800810.html,0.5
2026-03-25 15:18:00+00:00,SHOP,Zacks,DASH Benefits From Robust E-Commerce Growth: More Upside Ahead?,https://finance.yahoo.com/markets/stocks/articles/dash-benefits-robust-e-commerce-151800471.html,0.6
2026-03-25 15:19:00+00:00,CRWD,Business Wire,CrowdStrike Launches the Charlotte AI AgentWorks Ecosystem for Building Secure Agents,https://finance.yahoo.com/sectors/technology/articles/crowdstrike-launches-charlotte-ai-agentworks-151900187.html,0.5
2026-03-25 15:21:00+00:00,TSLA,TipRanks,OpenAI Flags Microsoft as ‘Top Risk’ in Pre-IPO Document,https://finance.yahoo.com/markets/stocks/articles/openai-flags-microsoft-top-risk-152100320.html,-0.5
2026-03-25 15:25:00+00:00,VRTX,BioPharma Dive,Maze tumbles despite positive data for kidney disease drug,https://finance.yahoo.com/sectors/healthcare/articles/maze-tumbles-positive-data-kidney-152500386.html,-0.6
2026-03-25 15:27:33+00:00,PDD,GuruFocus.com,PDD Revenue Rises 12% as Temu Growth Rebounds,https://finance.yahoo.com/markets/stocks/articles/pdd-revenue-rises-12-temu-152733625.html,0.6
2026-03-25 15:29:00+00:00,NFLX,CNW Group,Joey Ai Expands Netflix Advertising Opportunities in Canada,https://finance.yahoo.com/sectors/technology/articles/joey-ai-expands-netflix-advertising-152900681.html,0.5
2026-03-25 15:30:00+00:00,PAYX,Motley Fool,Paychex (PAYX) Q3 2026 Earnings Call Transcript,https://finance.yahoo.com/markets/stocks/articles/paychex-payx-q3-2026-earnings-153000385.html,0.0
2026-03-25 15:30:04+00:00,FANG,Zacks,Diamondback (FANG) Up 14.2% Since Last Earnings Report: Can It Continue?,https://finance.yahoo.com/markets/stocks/articles/diamondback-fang-14-2-since-153004081.html,0.5
2026-03-25 15:33:39+00:00,TSLA,Bloomberg,SpaceX said to target as much as $75B in blockbuster IPO,https://finance.yahoo.com/markets/stocks/articles/spacex-said-target-much-75-153339733.html,0.8
2026-03-25 15:34:00+00:00,WMT,Motley Fool,"Could Investing $10,000 in Walmart Make You Richer?",https://finance.yahoo.com/markets/stocks/articles/could-investing-10-000-walmart-153400943.html,0.5
2026-03-25 15:36:00+00:00,PYPL,Zacks,Circle Moves Beyond Stablecoins: Is Diversification Paying Off?,https://finance.yahoo.com/markets/crypto/articles/circle-moves-beyond-stablecoins-diversification-153600924.html,0.5
2026-03-25 15:37:00+00:00,AAPL,Zacks,Why ARM's New AI Chips is a Game Changer,https://finance.yahoo.com/sectors/technology/articles/why-arms-ai-chips-game-153700062.html,0.8
2026-03-25 15:40:00+00:00,TEAM,Zacks,NOW's Subscription Growth Continues: Is Long-Term Momentum Secured?,https://finance.yahoo.com/markets/stocks/articles/nows-subscription-growth-continues-long-154000960.html,0.5
2026-03-25 15:43:00+00:00,CEG,Zacks,CEG vs. VST: Which Nuclear Stock Has the Edge in the Utility Sector?,https://finance.yahoo.com/sectors/energy/articles/ceg-vs-vst-nuclear-stock-154300195.html,0.2
2026-03-25 15:45:02+00:00,EXC,Zacks,Why Exelon (EXC) is a Great Dividend Stock Right Now,https://finance.yahoo.com/markets/stocks/articles/why-exelon-exc-great-dividend-154502238.html,0.8
2026-03-25 15:59:00+00:00,BKR,Zacks,Strong Backlog and Natural Gas Tailwinds Support Archrock's Growth,https://finance.yahoo.com/sectors/energy/articles/strong-backlog-natural-gas-tailwinds-155900075.html,0.8
2026-03-25 15:59:33+00:00,PLTR,Motley Fool,Palantir Named as Part of Trump Administration's $185 Billion Golden Dome Project,https://finance.yahoo.com/sectors/technology/articles/palantir-named-part-trump-administrations-155933594.html,0.2
2026-03-25 16:00:00+00:00,REGN,Zacks,REGN Soars 28.9% in Six Months: Is There More Upside Potential in 2026?,https://finance.yahoo.com/sectors/healthcare/articles/regn-soars-28-9-six-160000422.html,0.6
2026-03-25 16:03:48+00:00,PEP,24/7 Wall St.,3 Beaten-Down Dividend Aristocrats to Scoop Up While Wall Street Chases AI Stocks Into a Cliff,https://finance.yahoo.com/markets/stocks/articles/3-beaten-down-dividend-aristocrats-160348068.html,-0.6
2026-03-25 16:06:20+00:00,MSTR,Simply Wall St.,Strategy (MSTR) Is Down 9.3% After Massive Capital Raise To Turbocharge Bitcoin Buying - What's Changed,https://finance.yahoo.com/markets/crypto/articles/strategy-mstr-down-9-3-160620873.html,-0.6
2026-03-25 16:07:14+00:00,CRWD,Simply Wall St.,Is CrowdStrike (CRWD) Turning Falcon Into the AI Security OS That Deepens Its Competitive Moat?,https://finance.yahoo.com/markets/stocks/articles/crowdstrike-crwd-turning-falcon-ai-160714601.html,0.5
2026-03-25 16:07:21+00:00,SNPS,Simply Wall St.,How Elliott’s Activist Stake and AI Push At Synopsys (SNPS) Has Changed Its Investment Story,https://finance.yahoo.com/markets/stocks/articles/elliott-activist-stake-ai-push-160721752.html,0.2
2026-03-25 16:08:12+00:00,AVGO,24/7 Wall St.,TSM vs. AVGO: Which is a Better Semiconductor Stock?,https://finance.yahoo.com/markets/stocks/articles/tsm-vs-avgo-better-semiconductor-160812191.html,0.0
2026-03-25 16:09:27+00:00,AVGO,24/7 Wall St.,"Jensen Huang Just Made a $1 Trillion Prediction. One Stock Benefits Most, and It’s Not Nvidia",https://finance.yahoo.com/markets/stocks/articles/jensen-huang-just-made-1-160927290.html,0.2
2026-03-25 16:10:44+00:00,TSLA,Barchart,Elon Musk Just Announced a ‘Herculean Task’ for Tesla. Can TSLA Stock Survive and Thrive?,https://finance.yahoo.com/markets/stocks/articles/elon-musk-just-announced-herculean-161044939.html,0.5
2026-03-25 16:13:00+00:00,MSFT,Barrons.com,Meta Takes a Swipe at Tesla With $9 Trillion Stock Goal in Half the Time,https://www.barrons.com/articles/facebook-meta-stock-price-pay-package-bb9a3297?siteid=yhoof2&yptr=yahoo,0.5
2026-03-25 16:13:43+00:00,STX,Investing.com,Why you should buy the Google-related pullback in memory stocks,https://finance.yahoo.com/markets/stocks/articles/why-buy-google-related-pullback-161343863.html,0.5
2026-03-25 16:18:00+00:00,PAYX,Zacks,"Paychex's Q3 Earnings and Revenues Surpass Estimates, Increase Y/Y",https://finance.yahoo.com/markets/stocks/articles/paychexs-q3-earnings-revenues-surpass-161800565.html,0.8
2026-03-25 16:18:36+00:00,AVGO,GuruFocus.com,Broadcom Shares Rise on Wall Street Upgrade,https://finance.yahoo.com/markets/stocks/articles/broadcom-shares-rise-wall-street-161836161.html,0.8
2026-03-25 16:21:49+00:00,CTAS,MarketBeat,Cintas Q3 Earnings Call Highlights,https://finance.yahoo.com/markets/stocks/articles/cintas-q3-earnings-call-highlights-162149877.html,0.5
2026-03-25 16:21:50+00:00,PAYX,MarketBeat,Paychex Q3 Earnings Call Highlights,https://finance.yahoo.com/markets/stocks/articles/paychex-q3-earnings-call-highlights-162150074.html,0.0
2026-03-25 16:30:00+00:00,AMD,Barrons.com,Arm Stock Surges 20% After Falling on Plan to Sell Own Chips. What Happened?,https://www.barrons.com/articles/arm-holdings-to-sell-its-own-chips-51d7be95?siteid=yhoof2&yptr=yahoo,0.5
2026-03-25 16:32:00+00:00,NFLX,Zacks,"Is Netflix Stock's 7.3X PS Still Worth it? Buy, Sell, or Hold?",https://finance.yahoo.com/markets/stocks/articles/netflix-stocks-7-3x-ps-163200732.html,0.2
2026-03-25 16:33:00+00:00,WMT,TheStreet,Walmart makes a massive move for clothing customers,https://finance.yahoo.com/sectors/technology/articles/walmart-makes-massive-move-clothing-163300033.html,0.8
2026-03-25 16:37:48+00:00,COST,reddit.com/r/stocks,"HOOD announces $1.5Bn Share Buyback - 90% Reddit uses Robinhood for trading HOOD fell nearly 40% from its high What in general we think regarding Robinhood as long term investment? According to yahoo news: Robinhood is betting $1.5Bn on itself. The popular trading platform announced a massive share repurchase program on Tuesday, authorizing the company to buy back its own stock over the next three years. This move comes at a moment of sharp contrast:",,0.2
2026-03-25 16:39:56+00:00,PEP,Just Drinks,"Reed’s CEO steps down, COO named interim chief",https://finance.yahoo.com/markets/stocks/articles/reed-ceo-steps-down-coo-163956127.html,0.0
2026-03-25 16:40:00+00:00,KDP,Zacks,Clorox Leverages Digital and Operational Optimization to Aid Growth,https://finance.yahoo.com/markets/stocks/articles/clorox-leverages-digital-operational-optimization-164000946.html,0.5
2026-03-25 16:47:00+00:00,AAPL,TheStreet,Morgan Stanley has a stark message for investors in Apple stocks,https://finance.yahoo.com/markets/stocks/articles/morgan-stanley-stark-message-investors-164700952.html,-0.5
2026-03-25 16:49:00+00:00,PAYX,MT Newswires,Paychex Affirms Outlook as Third-Quarter Results Top Street Views,https://finance.yahoo.com/markets/stocks/articles/paychex-affirms-outlook-third-quarter-164900955.html,0.8
2026-03-25 16:56:14+00:00,PLTR,GuruFocus.com,Palantir's Defense Role Is Quietly Expanding,https://finance.yahoo.com/sectors/technology/articles/palantirs-defense-role-quietly-expanding-165614692.html,0.5
2026-03-25 17:00:00+00:00,BKR,Barrons.com,Oil Stocks Are Gushing. This Energy IPO Could Pop.,https://www.barrons.com/articles/hmh-stock-price-ipo-news-292b53e4?siteid=yhoof2&yptr=yahoo,0.8
2026-03-25 17:00:00+00:00,MAR,PR Newswire,Marriott International Named a 2026 Where You Work Matters Platinum Employer,https://finance.yahoo.com/sectors/healthcare/articles/marriott-international-named-2026-where-170000056.html,0.6
2026-03-25 17:08:00+00:00,INTU,Zacks,Block vs Intuit: Which Fintech Stock is the Better Buy Now?,https://finance.yahoo.com/markets/stocks/articles/block-vs-intuit-fintech-stock-170800961.html,0.5
2026-03-25 17:12:00+00:00,MSFT,Proactive,"Microsoft price target lowered on M365, Copilot questions",https://finance.yahoo.com/markets/stocks/articles/microsoft-price-target-lowered-m365-171200393.html,-0.5
2026-03-25 17:14:00+00:00,CRWD,Business Wire,CrowdStrike Expands Strategic Collaboration With Intel to Secure the Next Generation of AI PCs,https://finance.yahoo.com/sectors/technology/articles/crowdstrike-expands-strategic-collaboration-intel-171400744.html,0.8
2026-03-25 17:16:38+00:00,MSFT,Investopedia,Nvidia Design Partner Arm Says It's Going to Sell Its Own Chips. Its Stock Is Soaring.,https://finance.yahoo.com/markets/stocks/articles/nvidia-design-partner-arm-says-171638615.html,0.8
2026-03-25 17:17:35+00:00,STX,GuruFocus.com,This Google Shift Is Raising Questions For Chip Makers,https://finance.yahoo.com/sectors/technology/articles/google-shift-raising-questions-chip-171735713.html,0.1
2026-03-25 17:19:17+00:00,MU,Insider Monkey,Jim Cramer on Micron: “I Think It’ll Prove to Be a More Meaningful Position as It Goes Down”,https://finance.yahoo.com/markets/stocks/articles/jim-cramer-micron-think-ll-171917561.html,0.1
2026-03-25 17:20:50+00:00,AAPL,Bloomberg,Musk’s xAI ‘Doubling Down’ on AI Videos After OpenAI Nixes Sora,https://finance.yahoo.com/sectors/technology/articles/musk-xai-doubling-down-ai-172050031.html,0.1
2026-03-25 17:26:00+00:00,NFLX,Zacks,Netflix Rides on Strong Advertising Revenues: More Upside Ahead?,https://finance.yahoo.com/markets/stocks/articles/netflix-rides-strong-advertising-revenues-172600342.html,0.6
2026-03-25 17:27:08+00:00,INTU,Motley Fool,Can Circle Keep Growing Even if Stablecoins Get Shackled?,https://finance.yahoo.com/markets/crypto/articles/circle-keep-growing-even-stablecoins-172708041.html,0.1
2026-03-25 17:30:15+00:00,QCOM,Barchart,Arm Just Debuted Its First In-House Chip. Should You Buy ARM Stock Now?,https://finance.yahoo.com/markets/stocks/articles/arm-just-debuted-first-house-173015130.html,0.5
2026-03-25 17:30:26+00:00,MSFT,24/7 Wall St.,VIG Returned 223% Over 10 Years and Still Costs Almost Nothing,https://finance.yahoo.com/markets/stocks/articles/vig-returned-223-over-10-173026178.html,0.8
