timestamp,ticker,source,text,url,SentimentScore
2025-01-23 00:00:00+00:00,GE,SEC-EDGAR-8K,"(Item 2.02) Results of Operations and Financial Condition. On January 23, 2025, General Electric Company, operating as GE Aerospace (the ""Company""), released its fourth-quarter and full-year 2024 financial results on its investor relations website at www.geaerospace.com/investor-relations. A copy of these is attached as Exhibit 99 and incorporated by reference herein. The information provided pursuant to this

(Item 2.02) , including Exhibit 99, is being furnished and shall not be deemed ""filed"" for purposes of Section 18 of the Securities Exchange Act of 1934 (the ""Exchange Act"") or otherwise subject to the liabilities under that Section and shall not be deemed to be incorporated by reference into any filing of the Company under the Securities Act of 1933 or the Exchange Act.",,0.1
2025-01-29 00:00:00+00:00,MSFT,SEC-EDGAR-8K,"(Item 2.02) . Results of Operations and Financial Condition On January 29, 2025, Microsoft Corporation issued a press release announcing its financial results for the fiscal quarter ended December 31, 2024. A copy of the press release is furnished as Exhibit 99.1 to this report. In accordance with General Instruction B.2 of Form 8-K, the information in this Current Report on Form 8-K, including Exhibit 99.1, shall not be deemed to be “filed” for purposes of Section",,0.0
2025-01-29 00:00:00+00:00,LRCX,SEC-EDGAR-8K,(Item 1.01) . Entry into a Material Definitive Agreement 3,,0.0
2025-01-30 00:00:00+00:00,TEAM,SEC-EDGAR-8K,"(Item 2.02) . Results of Operations and Financial Condition. On January 30, 2025, Atlassian Corporation (the “ Company ”) issued a press release announcing its results for the quarter ended December 31, 2024 (the “ Press Release ”). A copy of the Press Release is attached as Exhibit 99.1 to this current report on Form 8-K and is incorporated by reference herein. The Company also published a letter to its shareholders announcing its financial results for the

(Item 2.02) , including Exhibit 99.1 and Exhibit 99.2, is being furnished and shall not be deemed “filed” for the purposes of Section 18 of the Securities Exchange Act of 1934, as amended (the “ Exchange Act ”), or otherwise subject to the liabilities of that section, nor shall it be deemed incorporated by reference into any filing made by the Company under the Securities Act of 1933, as amended, or the Exchange Act, except as shall",,0.1
2025-02-03 00:00:00+00:00,RTX,SEC-EDGAR-8K,"(Item 5.02) . Departure of Directors or Certain Officers; Election of Directors; Appointment of Certain Officers; Compensatory Arrangements of Certain Officers. On February 3, 2025, RTX Corporation (“RTX” or the “Company”) announced that Gregory J. Hayes, RTX’s current Executive Chairman, has informed the Board of Directors of his intention to not stand for re-election and to step down as Executive Chairman and as a member of the Board, effective April 30, 2025. Mr. Hayes has agreed to",,-0.5
2025-02-04 00:00:00+00:00,MRK,SEC-EDGAR-8K,"(Item 2.02) . Results of Operations and Financial Condition. The following information, including the exhibits hereto, is being furnished pursuant to this

(Item 2.02) . Incorporated by reference is a press release issued by Merck & Co., Inc. on February 4, 2025, regarding earnings for the fourth quarter and year end of 2024, attached as Exhibit 99.1. Also incorporated by reference is certain supplemental information not included in the press release, attached as Exhibit 99.2. This information shall not be deemed to be “filed” for purposes of Section 18 of the Securities Exchange Act of 1934, as amended (the",,0.1
2025-02-04 00:00:00+00:00,EL,SEC-EDGAR-8K,"(Item 2.02) Results of Operations and Financial Condition On February 4, 2025, The Estée Lauder Companies Inc. (the “Company”) issued a press release announcing its financial results for its fiscal quarter ended December 31, 2024. The release includes the Company’s estimates related to its fiscal 2025 third quarter net sales and diluted net earnings per common share. A copy of the press release is attached hereto as Exhibit 99.1 and is incorporated herein by reference.",,0.0
2025-02-04 00:00:00+00:00,AMGN,SEC-EDGAR-8K,"(Item 2.02) Results of Operations and Financial Condition. Fourth Quarter and Full Year 2024 Earnings Press Release and Reconciliation of Non-GAAP Financial Measures On February 4, 2025 , the Company issued a press release announcing its unaudited results of operations for the three months and year ended December 31, 2024, and its unaudited financial position as of December 31, 2024. The full text of the press release is furnished as Exhibit 99.1 hereto. In its press release

(Item 2.02) of this Current Report is not incorporated by reference into any filings of the Company made under the Securities Act of 1933, as amended, whether made before or after the date of this Current Report, regardless of any general incorporation language in the filing unless specifically stated so therein.",,0.1
2025-02-12 00:00:00+00:00,LLY,SEC-EDGAR-8K,"(Item 8.01) . Other Events. On February 10, 2025, Eli Lilly and Company (the “Company”) entered into an underwriting agreement (the “Underwriting Agreement”) with Barclays Capital Inc., BofA Securities, Inc., Citigroup Global Markets Inc., Deutsche Bank Securities Inc. and Goldman Sachs & Co. LLC, as representatives of the several underwriters named therein, for the issuance and sale by the Company of $1,000,000,000 aggregate principal amount of its 4.550% Notes due 2028 (the “2028 Notes”), $1,250,000,000 aggregate principal",,0.1
2025-02-18 00:00:00+00:00,LIN,SEC-EDGAR-8K,"(Item 8.01) . Other Events. On February 18, 2025, Linde plc (the “Company”) issued €850 million aggregate principal amount of 2.625% Notes due 2029 (the “2029 Notes”), issued €750 million aggregate principal amount of 3.000% Notes due 2033 (the “2033 Notes”) and issued €650 million aggregate principal amount of 3.250% Notes due 2037 (the “2037 Notes”). The 2029 Notes, the 2033 Notes and the 2037 Notes were issued pursuant to a Subscription Agreement, dated February 14, 2025,",,0.1
2025-02-18 00:00:00+00:00,BMY,SEC-EDGAR-8K,"(Item 5.02) Departure of Directors or Certain Officers; Election of Directors; Appointment of Certain Officers; Compensatory Arrangements of Certain Officers (b) On February 14 , 2025, Sandra Leung notified Bristol-Myers Squibb Company (the “Company”) of her intention to retire from her position as Executive Vice President, General Counsel in 2025. Ms. Leung is expected to remain with the Company for a transition period until her successor’s appointment in order to assist with the transition of her duties.",,-0.2
2025-02-20 00:00:00+00:00,DHR,SEC-EDGAR-8K,"(ITEM 5.02) DEPARTURE OF DIRECTORS OR CERTAIN OFFICERS; ELECTION OF DIRECTORS; APPOINTMENT OF CERTAIN OFFICERS; COMPENSATORY ARRANGEMENTS OF CERTAIN OFFICERS Director Appointment On February 20, 2025, the Board of Directors (“Board”) of Danaher Corporation (“Danaher” or the “Company”) appointed Charles W. Lamanna to the Board, with a term expiring at Danaher’s 2025 annual meeting of shareholders. Mr. Lamanna was also appointed to the Science & Technology Committee of the Board. As a non-employee director, Mr. Lamanna will",,0.1
2025-02-27 00:00:00+00:00,SYK,SEC-EDGAR-8K,"(ITEM 1.01) ENTRY INTO A MATERIAL DEFINITIVE AGREEMENT On February 25, 2025, Stryker Corporation, and certain of its subsidiaries as designated borrowers, entered into a revolving credit agreement with various lenders and issuing banks and Wells Fargo Bank, National Association, as administrative agent (the “Credit Agreement”), that replaces its previous revolving credit agreement, dated as of October 26, 2021 (the “2021 Credit Agreement”). The principal terms of the Credit Agreement are: (1) an aggregate principal amount of

(Item 1.01) above with respect to the Credit Agreement is hereby incorporated by reference into this",,0.1
2025-02-27 00:00:00+00:00,MA,SEC-EDGAR-8K,"(Item 8.01) Other Events. On February 27, 2025, Mastercard Incorporated (the “Company”) completed an offering of $300,000,000 aggregate principal amount of its Floating Rate Notes due 2028 (the “Floating Rate Notes”), $450,000,000 aggregate principal amount of its 4.550% Notes due 2028 (the “2028 Notes”) and $500,000,000 aggregate principal amount of its 4.950% Notes due 2032 (the “2032 Notes” and, together with the Floating Rate Notes and the 2028 Notes, the “Notes”). The offering of the Notes was",,0.1
2025-02-28 00:00:00+00:00,DE,SEC-EDGAR-8K,"(Item 5.07) Submission of Matters to a Vote of Security Holders Deere & Company (the “Company”) held its annual meeting of shareholders on February 26, 2025 (the “Annual Meeting”). The voting results for each matter submitted to a vote of shareholders at the Annual Meeting are as follows: 1. Election of Directors All director nominees were elected for terms expiring at the 2026 annual meeting of shareholders with the following votes: Shares Voted For Shares Voted Against",,0.1
2025-03-10 00:00:00+00:00,AMAT,SEC-EDGAR-8K,"(Item 5.07) Submission of Matters to a Vote of Security Holders. The Annual Meeting of Shareholders of Applied Materials, Inc. (the “Company”) was held on March 6, 2025 (the “Annual Meeting”). At the Annual Meeting, the Company’s shareholders cast their votes on three proposals, as set forth below. Proposal 1. Election of Directors. Name of Nominee For Against Abstain Broker Non-Votes Rani Borkar 584,684,759 10,552,537 850,131 93,148,031 Judy Bruner 555,787,128 39,475,637 824,662 93,148,031 Xun (Eric) Chen 582,947,061",,0.1
2025-03-10 00:00:00+00:00,CSX,SEC-EDGAR-8K,"(Item 8.01) .

(Item 8.01) . Other Events On March 10, 2025, CSX Corporation (the “Company”) completed a public offering of $600,000,000 aggregate principal amount of the Company’s 5.050% Notes due 2035 (the “Notes”). The Notes were issued pursuant to an indenture, dated as of August 1, 1990, between the Company and The Bank of New York Mellon Trust Company, N.A. (formerly known as The Bank of New York Trust Company, N.A.), successor to JPMorgan Chase Bank, N.A. (formerly known",,0.1
2025-03-10 00:00:00+00:00,ORCL,SEC-EDGAR-8K,"(Item 2.02) Results of Operati ons and Financial Condition On March 10, 2025, Oracle Corporation (“Oracle”) issued a press release announcing financial results for its fiscal third quarter ended February 28, 2025. A copy of this press release is furnished as Exhibit 99.1 to this report. Section 8—Other Events

(Item 8.01) O ther Events Oracle announced that its Board of Directors has declared a cash dividend of $0.50 per share of outstanding common stock payable on April 23, 2025, to stockholders of record as of the close of business on April 10, 2025. Section 9—Financial Statements and Exhibits",,0.5
2025-03-11 00:00:00+00:00,MCD,SEC-EDGAR-8K,"(Item 5.02) . Departure of Directors or Certain Officers; Election of Directors; Appointment of Certain Officers; Compensatory Arrangements of Certain Officers. (b) On March 10, 2025, the Board of Directors (the “Board”) of McDonald’s Corporation (the “Company”) approved changes to the Company’s senior management, including the appointment of Gillian (Jill) McDonald as Executive Vice President – Global Chief Restaurant Experience Officer. Ms. McDonald, one of the Company’s named executive officers, currently serves as Executive Vice President –",,0.0
2025-03-12 00:00:00+00:00,GILD,SEC-EDGAR-8K,"(Item 5.02) Departure of Directors or Certain Officers; Election of Directors; Appointment of Certain Officers; Compensatory Arrangements of Certain Officers. On March 12, 2025, Gilead Sciences, Inc., a Delaware corporation (the “Company”), announced that Sandra Patterson, the Company’s Senior Vice President, Corporate Controller and Chief Accounting Officer and the Company’s principal accounting officer, has decided to leave the Company. The Company’s Board of Directors has appointed Diane E. Wilfong as the Company’s interim Corporate Controller and Chief",,-0.2
2025-03-12 00:00:00+00:00,ADBE,SEC-EDGAR-8K,"(Item 2.02) . Results of Operations and Financial Condition. On March 12, 2025, Adobe Inc. (“Adobe”) issued a press release announcing financial results for its first quarter fiscal year 2025 ended February 28, 2025. A copy of this press release is furnished and attached hereto as Exhibit 99.1 and is incorporated herein by reference. The information in this report and the exhibit attached hereto are being furnished and shall not be deemed filed for purposes of the",,0.1
2025-03-17 00:00:00+00:00,CVX,SEC-EDGAR-8K,"(Item 8.01) . Other Events. Between January and March 2025, Chevron Corporation (“Chevron” or the “company”) purchased 15,380,000 shares of Hess Corporation (“Hess”) common stock at prevailing market prices in open market transactions. The number of shares purchased represents approximately 4.99% of the shares of Hess common stock outstanding as of January 31, 2025, as reported by Hess in its Annual Report on Form 10-K for the year ended December 31, 2024. These purchases, which were made",,0.0
2025-03-17 00:00:00+00:00,MDT,SEC-EDGAR-8K,"(Item 5.02) . Departure of Directors or Certain Officers; Election of Directors; Appointment of Certain Officers; Compensatory Arrangements of Certain Officers. Transition of Principal Accounting Officer On March 12, 2025, Jennifer M. Kirk, the Global Controller and Principal Accounting Officer of Medtronic plc (Company), notified the Company of her decision to resign from the Company, effective May 2, 2025, to become the chief executive officer of Exubrion Therapeutics, a privately held company. Ms. Kirk’s resignation did not",,-0.2
2025-03-20 00:00:00+00:00,SPG,SEC-EDGAR-8K,"(ITEM 5.02) DEPARTURE OF DIRECTORS OR PRINCIPAL OFFICERS; ELECTION OF DIRECTORS; APPOINTMENT OF CERTAIN OFFICERS; COMPENSATORY ARRANGEMENTS OF CERTAIN OFFICERS. On March 20, 2025, Allan B. Hubbard, a member of the Board of Directors (the “Board”) of Simon Property Group, Inc. (the “Company”), notified the Company that, effective May 14, 2025, he is retiring from the Board and will not stand for re-election at the Company’s upcoming 2025 annual meeting of shareholders to be held on May",,-0.5
2025-03-20 00:00:00+00:00,ACN,SEC-EDGAR-8K,"(Item 2.02) Results of Operations and Financial Condition On March 20, 2025, Accenture plc (“Accenture”) issued a news release announcing financial results for its second quarter of fiscal 2025, which ended on February 28, 2025. A copy of the news release is attached hereto as Exhibit 99. All information in the news release is furnished but not filed. Non-GAAP Financial Information In the attached news release Accenture discloses the following non-GAAP financial measures: • Free cash flow",,0.0
2025-03-24 00:00:00+00:00,DIS,SEC-EDGAR-8K,"(Item 5.07) Submission of Matters to a Vote of Security Holders. (a-b) The final results of voting on each of the matters submitted to a vote of security holders during the Registrant’s annual meeting of shareholders on March 20, 2025 are as follows. 1. Election of Directors: For Against Abstentions Broker Non-Votes Mary T. Barra 1,173,554,159 46,902,767 2,166,807 250,362,675 Amy L. Chang 1,207,387,859 12,228,417 3,007,457 250,362,675 D. Jeremy Darroch 1,210,906,336 9,191,055 2,526,342 250,362,675 Carolyn N. Everson 1,209,731,318",,0.1
2025-04-08 00:00:00+00:00,CVS,SEC-EDGAR-8K,"(Item 5.02) . Departure of Directors or Certain Officers; Election of Directors; Appointment of Certain Officers; Compensatory Arrangements of Certain Officers. Appointment of Brian O. Newman as Executive Vice President and Chief Financial Officer On April 7, 2025, the Board of Directors of CVS Health Corporation (the “Company” or “CVS Health”) appointed Brian O. Newman to serve as Executive Vice President and Chief Financial Officer of CVS Health, effective May 12, 2025 (the “Effective Date”). Mr. Newman",,0.1
2025-04-10 00:00:00+00:00,AON,SEC-EDGAR-8K,"(Item 5.02) Departure of Directors or Certain Officers; Election of Directors; Appointment of Certain Officers; Compensatory Arrangements of Certain Officers. On April 7, 2025, Fulvio Conti informed Aon plc (the “Company”) of his decision to retire from the Company’s Board of Directors after more than 15 years, effective upon the completion of his current term at the Company’s 2025 Annual General Meeting. Mr. Conti informed the Company that his retirement is not due to any disagreements with",,-0.2
2025-04-11 00:00:00+00:00,BLK,SEC-EDGAR-8K,"(Item 2.02) . Results of Operations and Financial Condition On April 11, 2025, BlackRock, Inc. (the “Company”) reported results of operations for the three months ended March 31, 2025. A copy of the earnings release issued by the Company is attached as Exhibit 99.1 to this Form 8-K.",,0.0
2025-04-11 00:00:00+00:00,META,SEC-EDGAR-8K,"(Item 5.02) Departure of Directors or Certain Officers; Election of Directors; Appointment of Certain Officers; Compensatory Arrangements of Certain Officers. On April 11, 2025, the Board of Directors (the ""Board"") of Meta Platforms, Inc. (the ""Company"") approved an increase in the size of the Board to fifteen (15) members and elected Dina Powell McCormick and Patrick Collison as members of the Board, effective April 15, 2025. A copy of the press release announcing the election is attached",,0.2
2025-04-14 00:00:00+00:00,AMAT,SEC-EDGAR-8K,"(Item 8.01) Other Events. On April 14, 2025, Applied Materials, Inc. issued a press release announcing that it has purchased 9% of the outstanding shares of the common stock of BE Semiconductor Industries N.V., a Dutch public limited liability company. The purchase was made through market-based transactions. A copy of the press release is attached as Exhibit 99.1 to this Current Report on Form 8-K.",,0.0
2025-04-14 00:00:00+00:00,TEAM,SEC-EDGAR-8K,"(Item 5.02) . Departure of Directors or Certain Officers; Election of Directors; Appointment of Certain Officers; Compensatory Arrangements of Certain Officers . On April 9, 2025, Enrique Salem notified Atlassian Corporation (the “ Company ”) of his decision to retire as a director of the Company, effective as of April 14, 2025. The Board of Directors of the Company (the “ Board ”) and the Company are deeply grateful for Mr. Salem’s dedication and contributions to the",,0.5
2025-04-15 00:00:00+00:00,JNJ,SEC-EDGAR-8K,"(Item 2.02) Results of operations and financial condition On April 15, 2025, Johnson & Johnson issued the attached press release (Exhibit 99.1) announcing its sales and earnings for the first quarter ended March 30, 2025.

(Item 8.01) Other Events On April 15, 2025, Johnson & Johnson issued the attached press release (Exhibit 99.3) announcing that its Board of Directors declared a 4.8% increase in the quarterly dividend, from $1.24 per share to $1.30 per share, marking the 63rd year of consecutive increases. At the new rate, the indicated dividend on an annual basis is $5.20 per share compared to the previous rate of $4.96 per share. The next quarterly dividend is payable",,0.8
2025-04-15 00:00:00+00:00,NVDA,SEC-EDGAR-8K,"(Item 8.01) Other Events. On April 9, 2025, the U.S. government, or USG, informed NVIDIA Corporation, or the Company, that the USG requires a license for export to China (including Hong Kong and Macau) and D:5 countries, or to companies headquartered or with an ultimate parent therein, of the Company’s H20 integrated circuits and any other circuits achieving the H20’s memory bandwidth, interconnect bandwidth, or combination thereof. The USG indicated that the license requirement addresses the risk",,-0.2
2025-04-16 00:00:00+00:00,USB,SEC-EDGAR-8K,"(Item 5.02) Departure of Directors or Certain Officers; Election of Directors; Appointment of Certain Officers; Compensatory Arrangements of Certain Officers. As U.S. Bancorp (the “Company”) previously disclosed on a Current Report on Form 8-K filed on January 28, 2025, Gunjan Kedia was appointed as the Company’s President and Chief Executive Officer, effective April 15, 2025. At its meeting on April 15, 2025, the Company’s Board of Directors determined the base salary and target annual cash incentive award

(Item 5.02) .",,0.1
2025-04-16 00:00:00+00:00,COST,SEC-EDGAR-8K,"(Item 8.01) . Other Events The Board of Directors declared a quarterly cash dividend on the Company's common stock and approved a quarterly increase from $1.16 to $1.30 per share, $5.20 on an annualized basis. The dividend was declared on April 16, 2025, and is payable May 16, 2025, to shareholders of record at the close of business on May 2, 2025.",,0.8
2025-04-16 00:00:00+00:00,CSX,SEC-EDGAR-8K,"(Item 2.02) . Results of Operations and Financial Condition On April 16, 2025, CSX Corporation issued a press release and its CSX Quarterly Financial Report on financial and operating results for the quarter ended March 31, 2025. A copy of the press release is attached as Exhibit 99.1 and a copy of the CSX Quarterly Financial Report is attached as Exhibit 99.2, each of which is incorporated by reference herein. These documents are available on the Company's",,0.0
2025-04-16 00:00:00+00:00,ABT,SEC-EDGAR-8K,"(Item 2.02) Results of Operations and Financial Condition On April 16, 2025, Abbott Laboratories announced its results of operations for the first quarter 2025. Furnished as Exhibit 99.1, and incorporated herein by reference, is the news release issued by Abbott announcing those results. In that news release, Abbott uses various non-GAAP financial measures including, among others, net earnings excluding specified items. These non-GAAP financial measures adjust for factors that are unusual or unpredictable, such as expenses primarily

(Item 2.02) ). 104 Cover Page Interactive Data File (the cover page XBRL tags are embedded in the Inline XBRL document).",,0.1
2025-04-17 00:00:00+00:00,NFLX,SEC-EDGAR-8K,"(Item 2.02) Results of Operations and Financial Condition. On April 17, 2025, Netflix, Inc. (the “Company”) announced its financial results for the quarter ended March 31, 2025. The Letter to Shareholders, which is attached hereto as Exhibit 99.1 and is incorporated herein by reference, includes reference to the non-GAAP financial information. A reconciliation to the GAAP equivalent of non-GAAP measures is contained in tabular form in Exhibit 99.1. We are not able to reconcile forward-looking non-GAAP financial

(Item 2.02) and the accompanying Exhibit 99.1 are “furnished” and shall not be deemed “filed” for purposes of Section 18 of the Securities Exchange Act of 1934, as amended (the “Exchange Act”), or otherwise subject to the liabilities of that section, and shall not be incorporated by reference in any filing under the Securities Act of 1933, as amended, or the Exchange Act regardless of any general incorporation language in such filing, unless expressly incorporated by specific

(Item 5.02) Departure of Directors or Certain Officers; Election of Directors; Appointment of Certain Officers; Compensatory Arrangements of Certain Officers. On April 11, 2025, Reed Hastings informed the Company of his intent to transition from his executive officer position. Effective April 17, 2025, Reed Hastings will transition to serve as Chairman of the board of directors of the Company (the “Board”) and non-executive director. On April 11, 2025, Timothy Haley informed the Company of his decision to",,0.1
2025-04-17 00:00:00+00:00,USB,SEC-EDGAR-8K,"(Item 5.07) Submission of Matters to a Vote of Security Holders. U.S. Bancorp (the “Company”) held its 2025 annual meeting of shareholders on Tuesday, April 15, 2025. Shareholders considered four proposals at the meeting, each of which is described in more detail in the Company’s Definitive Proxy Statement on Schedule 14A, which was filed with the Securities and Exchange Commission on March 5, 2025, as supplemented by a proxy statement supplement filed with the Securities and Exchange",,0.0
2025-04-17 00:00:00+00:00,LMT,SEC-EDGAR-8K,"(Item 5.02) Departure of Directors or Certain Officers; Election of Directors; Appointment of Certain Officers; Compensatory Arrangements of Certain Officers. On April 17, 2025, Lockheed Martin Corporation (“Lockheed Martin” or the “Company”) announced that Jay Malave, its Chief Financial Officer, advised the Company of his intention to pursue other opportunities outside of the Company. Mr. Malave’s departure is not related to any financial or accounting issue or any disagreement with the Company on any matter relating to",,0.1
2025-04-17 00:00:00+00:00,SCHW,SEC-EDGAR-8K,"(Item 2.02) Results of Operations and Financial Condition On April 17, 2025, The Charles Schwab Corporation issued a press release announcing its financial results for the quarter ended March 31, 2025. A copy of the press release is furnished as Exhibit 99.1 to this report.",,0.0
2025-04-18 00:00:00+00:00,TXN,SEC-EDGAR-8K,"(ITEM 5.07) . Submission of Matters to a Vote of Security Holders. At the annual meeting of stockholders held on April 17, 2025, the stockholders elected the Board of Directors of Texas Instruments Incorporated and voted upon the proposals contained within the company’s proxy statement dated March 5, 2025. The Board nominees were elected with the following vote: Nominee For Against Abstentions Broker Non-Votes Mark Blinn 721,514,575 22,997,791 874,915 65,641,693 Todd Bluedorn 702,584,071 41,836,102 967,108 65,641,693 Janet",,0.1
