timestamp,ticker,source,text,url,SentimentScore
2026-03-24 12:50:00+00:00,PYPL,Motley Fool,"If You Invested $1,000 in PayPal Stock 10 Years Ago, Here's How Much You'd Have Today",https://finance.yahoo.com/markets/stocks/articles/invested-1-000-paypal-stock-125000205.html,0.5
2026-03-24 12:50:00+00:00,ISRG,Zacks,Should You Continue to Hold OMCL Stock in Your Portfolio?,https://finance.yahoo.com/markets/stocks/articles/continue-hold-omcl-stock-portfolio-125000182.html,0.0
2026-03-24 12:50:58+00:00,CSGP,Insider Monkey,Heavy Investment in Its Residential Portal Weighed on CoStar Group’s (CSGP) Yearly Performance,https://finance.yahoo.com/markets/stocks/articles/heavy-investment-residential-portal-weighed-125058333.html,-0.6
2026-03-24 12:52:35+00:00,MRVL,StockStory,1 of Wall Street’s Favorite Stock on Our Watchlist and 2 We Find Risky,https://finance.yahoo.com/markets/stocks/articles/1-wall-street-favorite-stock-125235883.html,0.2
2026-03-24 12:55:00+00:00,MSTR,CryptoProwl,Strategy Plans $42 Billion Capital Raise To Fund Bitcoin Purchases,https://finance.yahoo.com/markets/crypto/articles/strategy-plans-42-billion-capital-125500130.html,0.5
2026-03-24 13:00:00+00:00,ABNB,Business Wire,"Conductor Introduces AEO Trailblazer Awards, Recognizing Enterprise Brands Leading in AI Search Visibility",https://finance.yahoo.com/sectors/technology/articles/conductor-introduces-aeo-trailblazer-awards-130000949.html,0.5
2026-03-24 13:00:00+00:00,MELI,PR Newswire,"FLUENT VENTURES ANNOUNCES THE GEO ALPHA PRIZE, HONORING THE TECHNOLOGY COMPANIES THAT INSPIRED THE WORLD",https://finance.yahoo.com/sectors/technology/articles/fluent-ventures-announces-geo-alpha-130000766.html,0.6
2026-03-24 13:00:00+00:00,WDAY,GlobeNewswire,Opkey Release Advisor: Speed Up Oracle and Workday Release Analysis By 80% with Agentic AI,https://finance.yahoo.com/sectors/technology/articles/opkey-release-advisor-speed-oracle-130000913.html,0.6
2026-03-24 13:00:00+00:00,ADBE,PR Newswire,"NeutronX Appoints Former Adobe Enterprise Architect Focused on AI, Data Governance, and High-Speed API Edge Processing for Large-Scale Data Systems to Advance Next-Generation Infrastructure",https://finance.yahoo.com/sectors/technology/articles/neutronx-appoints-former-adobe-enterprise-130000144.html,0.6
2026-03-24 13:00:00+00:00,TMUS,Business Wire,Twilio Becomes the Only Cloud Communications Provider with Direct 10DLC and Toll-Free Connections Across All Major Carriers in the United States and Canada,https://finance.yahoo.com/sectors/technology/articles/twilio-becomes-only-cloud-communications-130000456.html,0.8
2026-03-24 13:00:00+00:00,ALNY,Business Wire,Viz.ai Partners with Alnylam Pharmaceuticals to Advance Earlier Identification and Care Coordination in Cardiac Amyloidosis,https://finance.yahoo.com/sectors/healthcare/articles/viz-ai-partners-alnylam-pharmaceuticals-130000478.html,0.6
2026-03-24 13:00:00+00:00,MAR,PR Newswire,What's Next in Destination Weddings: Spring 2026 Trends from Mexico & the Caribbean,https://finance.yahoo.com/sectors/technology/articles/whats-next-destination-weddings-spring-130000070.html,0.5
2026-03-24 13:00:00+00:00,ODFL,FreightWaves,Samsara introduces 2026 North America Customer Advisory Board,https://finance.yahoo.com/sectors/technology/articles/samsara-introduces-2026-north-america-130000040.html,0.5
2026-03-24 13:00:00+00:00,CSCO,PR Newswire,NSS Labs Appoints Industry Veteran Dominick Delfino as Executive Advisor,https://finance.yahoo.com/sectors/technology/articles/nss-labs-appoints-industry-veteran-130000062.html,0.5
2026-03-24 13:00:00+00:00,KDP,PR Newswire,"Crooked Pop™ Launches a New Era of Clean Alcohol with USDA-Certified Organic, Zero-Sugar Hard Soda",https://finance.yahoo.com/sectors/healthcare/articles/crooked-pop-launches-era-clean-130000364.html,0.8
2026-03-24 13:00:03+00:00,ISRG,Zacks,"Intuitive Surgical, Inc. (ISRG) Is a Trending Stock: Facts to Know Before Betting on It",https://finance.yahoo.com/markets/stocks/articles/intuitive-surgical-inc-isrg-trending-130003211.html,0.5
2026-03-24 13:00:03+00:00,SHOP,Zacks,Investors Heavily Search Shopify Inc. (SHOP): Here is What You Need to Know,https://finance.yahoo.com/markets/stocks/articles/investors-heavily-search-shopify-inc-130003154.html,0.5
2026-03-24 13:00:03+00:00,VRTX,Zacks,Vertex Pharmaceuticals Incorporated (VRTX) is Attracting Investor Attention: Here is What You Should Know,https://finance.yahoo.com/markets/stocks/articles/vertex-pharmaceuticals-incorporated-vrtx-attracting-130003739.html,0.5
2026-03-24 13:00:04+00:00,WBD,Zacks,"Warner Bros. Discovery, Inc. (WBD) Is a Trending Stock: Facts to Know Before Betting on It",https://finance.yahoo.com/markets/stocks/articles/warner-bros-discovery-inc-wbd-130004750.html,0.5
2026-03-24 13:00:04+00:00,ZS,Zacks,"Zscaler, Inc. (ZS) Is a Trending Stock: Facts to Know Before Betting on It",https://finance.yahoo.com/markets/stocks/articles/zscaler-inc-zs-trending-stock-130004295.html,0.5
2026-03-24 13:00:04+00:00,NFLX,Zacks,"Here is What to Know Beyond Why Netflix, Inc. (NFLX) is a Trending Stock",https://finance.yahoo.com/markets/stocks/articles/know-beyond-why-netflix-inc-130004668.html,0.2
2026-03-24 13:00:05+00:00,AMAT,Zacks,"Applied Materials, Inc. (AMAT) Is a Trending Stock: Facts to Know Before Betting on It",https://finance.yahoo.com/markets/stocks/articles/applied-materials-inc-amat-trending-130005458.html,0.5
2026-03-24 13:05:00+00:00,CDNS,Zacks,Can Rising AI Tool Adoption Lift Synopsys' Design Automation Revenues?,https://finance.yahoo.com/sectors/technology/articles/rising-ai-tool-adoption-lift-130500170.html,0.5
2026-03-24 13:06:43+00:00,MSTR,Coinspeaker,Strategy Seeks $44.1B Capital Raise to Expand Bitcoin Holdings Amid Market Downturn,https://finance.yahoo.com/markets/crypto/articles/strategy-seeks-44-1b-capital-130643014.html,0.5
2026-03-24 13:07:52+00:00,PANW,Simply Wall St.,Palo Alto Networks’ AI Agent Security Push Might Change The Case For Investing In Palo Alto Networks (PANW),https://finance.yahoo.com/sectors/technology/articles/palo-alto-networks-ai-agent-130752441.html,0.5
2026-03-24 13:09:00+00:00,INSM,Zacks,INSM Stock Gains After Arikayce Hits Goal in Label Expansion Study,https://finance.yahoo.com/sectors/healthcare/articles/insm-stock-gains-arikayce-hits-130900480.html,0.6
2026-03-24 13:11:00+00:00,INTU,Zacks,"Zacks Investment Ideas feature highlights: EPR Properties, H&R Block, Intuit, HSBC and JPMorgan",https://finance.yahoo.com/markets/stocks/articles/zacks-investment-ideas-feature-highlights-131100875.html,0.2
2026-03-24 13:12:00+00:00,SNPS,Zacks,Synopsys vs. NVIDIA: Which Chip Ecosystem Stock Is the Better Bet?,https://finance.yahoo.com/markets/stocks/articles/synopsys-vs-nvidia-chip-ecosystem-131200631.html,0.2
2026-03-24 13:16:00+00:00,COST,Zacks,Costco's Comparable Sales Stay Strong: Is Traffic Driving Growth?,https://finance.yahoo.com/markets/stocks/articles/costcos-comparable-sales-stay-strong-131600624.html,0.5
2026-03-24 13:20:00+00:00,FAST,Zacks,"Zacks Industry Outlook Highlights Siemens, Fastenal and Global Industrial Company",https://finance.yahoo.com/markets/stocks/articles/zacks-industry-outlook-highlights-siemens-132000229.html,0.0
2026-03-24 13:21:59+00:00,AEP,reddit.com/r/stocks,"AEP trade or keep - I’m due to inherit about 200,000 dollars worth of American electric power within the next few weeks. I do not need the money so no need to cash out. My portfolio now consists of SWPPX, SCHD, SCHY and SCHA. Yes I use Schwab lol. Every now and then I might hold a few individual stocks just for fun but nothing of significance. My question is should I keep the inherited",,0.2
2026-03-24 13:27:54+00:00,MSTR,Insider Monkey,Everpure (PSTG) was Volatile Despite Strong Results,https://finance.yahoo.com/markets/stocks/articles/everpure-pstg-volatile-despite-strong-132754552.html,0.2
2026-03-24 13:34:48+00:00,MSTR,Insider Monkey,Brown Advisory Mid-Cap Growth Strategy Bets on Medline (MDLN) in IPO,https://finance.yahoo.com/markets/stocks/articles/brown-advisory-mid-cap-growth-133448387.html,0.5
2026-03-24 13:35:09+00:00,GILD,GuruFocus.com,U.S Stocks Futures Pullback as Middle East Jitters Trump Peace Hopes,https://finance.yahoo.com/markets/stocks/articles/u-stocks-futures-pullback-middle-133509023.html,-0.5
2026-03-24 13:37:31+00:00,MSTR,Insider Monkey,Cardinal Health (CAH) Surged Following Improved Specialty Mix in Pharma,https://finance.yahoo.com/markets/stocks/articles/cardinal-health-cah-surged-following-133731290.html,0.6
2026-03-24 13:40:04+00:00,FAST,Zacks,Is Fastenal (FAST) Stock Outpacing Its Industrial Products Peers This Year?,https://finance.yahoo.com/markets/stocks/articles/fastenal-fast-stock-outpacing-industrial-134004504.html,0.5
2026-03-24 13:40:31+00:00,MSTR,Insider Monkey,Resilience of Travel Boosted Hilton Worldwide Holdings (HLT) in Q4,https://finance.yahoo.com/markets/stocks/articles/resilience-travel-boosted-hilton-worldwide-134031271.html,0.6
2026-03-24 13:43:00+00:00,CSCO,Zacks,Arista Focusing More on CloudEOS Edge: The Next Growth Driver?,https://finance.yahoo.com/markets/stocks/articles/arista-focusing-more-cloudeos-edge-134300378.html,0.5
2026-03-24 13:43:00+00:00,CRWD,Business Wire,"CrowdStrike Launches Flex for Services, Bringing Flexible Cybersecurity Services Consumption to the Agentic Era",https://finance.yahoo.com/sectors/technology/articles/crowdstrike-launches-flex-services-bringing-134300214.html,0.5
2026-03-24 13:45:46+00:00,ASML,24/7 Wall St.,ASML Lands Massive EUV Deal Clearing Path to Double Revenue by 2030,https://finance.yahoo.com/markets/stocks/articles/asml-lands-massive-euv-deal-134546297.html,0.8
2026-03-24 13:48:36+00:00,WDC,Bloomberg,Memory Is Wall Street’s Favorite Tech Trade as Mag 7 Disappoints,https://finance.yahoo.com/news/memory-wall-street-favorite-tech-104758723.html,-0.5
2026-03-24 13:58:04+00:00,MSTR,24/7 Wall St.,"MicroStrategy Is Down 56.9% YTD, Yet Still Buying Bitcoin by the Billions",https://finance.yahoo.com/markets/crypto/articles/microstrategy-down-56-9-ytd-135804850.html,0.2
2026-03-24 14:00:00+00:00,CMCSA,Business Wire,Comcast Business Powers Record-Breaking 2026 THE PLAYERS Championship with City-Scale Network Deployment and Enables First-Ever RealTime4K Viewing Experience,https://finance.yahoo.com/sectors/technology/articles/comcast-business-powers-record-breaking-140000974.html,0.6
2026-03-24 14:00:00+00:00,CHTR,PR Newswire,SPECTRUM NEWS AND SYRACUSE UNIVERSITY'S NEWHOUSE SCHOOL PARTNER TO DEVELOP NEXT GENERATION OF JOURNALISTS,https://finance.yahoo.com/sectors/technology/articles/spectrum-news-syracuse-universitys-newhouse-140000934.html,0.6
2026-03-24 14:00:30+00:00,KHC,Just Food,McCain ‘to shut New Zealand factory’,https://finance.yahoo.com/sectors/energy/articles/mccain-shut-zealand-factory-140030215.html,-0.7
2026-03-24 14:06:00+00:00,COST,PR Newswire,Stellar Snacks Announces Strategic Growth Investment from Main Post Partners,https://finance.yahoo.com/markets/stocks/articles/stellar-snacks-announces-strategic-growth-140600513.html,0.8
2026-03-24 14:16:00+00:00,ISRG,Zacks,ISRG's Margins Contract in Q4: Will Tariffs Continue to Hurt in 2026?,https://finance.yahoo.com/markets/stocks/articles/isrgs-margins-contract-q4-tariffs-141600761.html,-0.6
2026-03-24 14:19:52+00:00,CRWD,24/7 Wall St.,Why the WisdomTree Cybersecurity Fund Will Soar in the Agentic AI Era,https://finance.yahoo.com/markets/stocks/articles/why-wisdomtree-cybersecurity-fund-soar-141952585.html,0.8
2026-03-24 14:21:00+00:00,ISRG,Zacks,COR to Expand Retina Consultants of America With $1.1B EyeSouth Deal,https://finance.yahoo.com/sectors/healthcare/articles/cor-expand-retina-consultants-america-142100902.html,0.5
2026-03-24 14:25:00+00:00,GILD,Proactive,"Gilead Sciences to acquire Ouro Medicines, expanding autoimmune therapy portfolio",https://finance.yahoo.com/sectors/healthcare/articles/gilead-sciences-acquire-ouro-medicines-142500466.html,0.5
2026-03-24 14:25:04+00:00,COST,Sourcing Journal,Will Lawsuit Filers Fly to the Front of the Line for Tariff Refunds?,https://finance.yahoo.com/economy/policy/articles/lawsuit-filers-fly-front-line-142504251.html,0.1
2026-03-24 14:26:10+00:00,LRCX,Insider Monkey,Jim Cramer on Lam Research: “You’ve Got a Winner in Lam Research”,https://finance.yahoo.com/markets/stocks/articles/jim-cramer-lam-research-ve-142610145.html,0.8
2026-03-24 14:27:00+00:00,ORLY,MarketBeat,Hitting the Brakes: Is O'Reilly's Stock a Breakdown or a Buy?,https://finance.yahoo.com/markets/stocks/articles/hitting-brakes-oreillys-stock-breakdown-142700427.html,0.2
2026-03-24 14:32:05+00:00,XEL,24/7 Wall St.,Xcel Energy Could Hit $89 by Year-End as UBS Argues Wildfire Risks Are Already Priced Into $76.75 Stock,https://finance.yahoo.com/markets/stocks/articles/xcel-energy-could-hit-89-143205137.html,0.5
2026-03-24 14:33:35+00:00,MSTR,Investing.com,"Bitcoin bottom likely in, upside ahead: Bernstein",https://finance.yahoo.com/markets/crypto/articles/bitcoin-bottom-likely-upside-ahead-143335860.html,0.5
2026-03-24 14:35:00+00:00,APP,Zacks,APPS' AGP Business Shows Double-Digit Growth: Is it Sustainable?,https://finance.yahoo.com/markets/stocks/articles/apps-agp-business-shows-double-143500159.html,0.5
2026-03-24 14:39:00+00:00,ASML,Zacks,ASML vs. AMKR: Which Semiconductor Equipment Stock Has an Edge Now?,https://finance.yahoo.com/markets/stocks/articles/asml-vs-amkr-semiconductor-equipment-143900759.html,0.2
2026-03-24 14:42:00+00:00,MNST,Zacks,Coca-Cola Faces Margin Pressure: Can Pricing Power Hold?,https://finance.yahoo.com/markets/stocks/articles/coca-cola-faces-margin-pressure-144200638.html,-0.5
2026-03-24 14:44:53+00:00,META,reddit.com/r/stocks,"People are not ready for a Crash - I think I’ll start with a quote “one thing we know is that people don’t learn from history” Charlie Munger Notice how sensitive people are with even a 5-6 percent pullback? How insecure everyone is about their stocks? The fact we look at Walmart at a 37PE, or even Meta at 26 PE and say “that’s a good deal” is historically and laughably inaccurate. I don’t see",,-0.8
2026-03-24 14:45:00+00:00,CSCO,Zacks,ALAB Benefits From Strong AI Infrastructure Demand: What's Ahead?,https://finance.yahoo.com/sectors/technology/articles/alab-benefits-strong-ai-infrastructure-144500358.html,0.5
2026-03-24 14:46:00+00:00,KDP,Zacks,Coca-Cola vs. Keurig: Which Beverage Stock Looks Poised for Growth?,https://finance.yahoo.com/markets/stocks/articles/coca-cola-vs-keurig-beverage-144600397.html,0.5
2026-03-24 14:56:00+00:00,AMGN,Zacks,J&J Stock Trading Above 200- & 50-Day SMA for 8 Months: Time to Buy?,https://finance.yahoo.com/markets/stocks/articles/j-j-stock-trading-above-145600459.html,0.5
2026-03-24 14:56:41+00:00,CSCO,24/7 Wall St.,"Fintech Is Down 17% This Year, but Cybersecurity Tells a Different Story for These 2 ETFs",https://finance.yahoo.com/markets/stocks/articles/fintech-down-17-cybersecurity-tells-145641591.html,0.2
2026-03-24 14:56:44+00:00,LIN,Oilprice.com,5 Stocks to Buy Now That The Strait of Hormuz is Closed,https://finance.yahoo.com/sectors/energy/articles/5-stocks-buy-now-strait-145644041.html,0.2
2026-03-24 14:56:51+00:00,TTWO,24/7 Wall St.,"3 AI ETFs in 2026: One Is Up 77%, One Is Down 8%, and the Gap Tells You Everything",https://finance.yahoo.com/markets/stocks/articles/3-ai-etfs-2026-one-145651787.html,0.2
2026-03-24 15:00:00+00:00,ZS,Business Wire,P0 Security Announces Technology Partnership with Zscaler to Advance Zero Trust for Private Resources,https://finance.yahoo.com/sectors/technology/articles/p0-security-announces-technology-partnership-150000313.html,0.5
2026-03-24 15:01:00+00:00,KLAC,Zacks,Teradyne Drives Robotics With AI: Is the Growth Thesis Strengthening?,https://finance.yahoo.com/sectors/technology/articles/teradyne-drives-robotics-ai-growth-150100604.html,0.5
2026-03-24 15:03:00+00:00,ADI,Zacks,SNDK vs. ADI: Which Semiconductor Stock Has an Edge in Data Centers?,https://finance.yahoo.com/markets/stocks/articles/sndk-vs-adi-semiconductor-stock-150300494.html,0.5
2026-03-24 15:03:00+00:00,ISRG,PR Newswire,Sonder Capital Closes its Second Fund and Announces Participation from Major Healthcare Systems,https://finance.yahoo.com/sectors/healthcare/articles/sonder-capital-closes-second-fund-150300798.html,0.5
2026-03-24 15:06:00+00:00,TMUS,Zacks,AT&T Teams Up With TGL for Seamless Coverage: Can it Aid Shares?,https://finance.yahoo.com/markets/stocks/articles/t-teams-tgl-seamless-coverage-150600428.html,0.5
2026-03-24 15:08:12+00:00,MPWR,StockStory,1 of Wall Street’s Favorite Stock to Target This Week and 2 We Avoid,https://finance.yahoo.com/markets/stocks/articles/1-wall-street-favorite-stock-150812204.html,0.5
2026-03-24 15:12:00+00:00,WDAY,Zacks,Workday Rides on Subscription Revenue Growth: Will it Sustain?,https://finance.yahoo.com/markets/stocks/articles/workday-rides-subscription-revenue-growth-151200080.html,0.2
2026-03-24 15:15:00+00:00,NFLX,Zacks,"Sentiment Shifts on These Beaten Down Stocks: NFLX, ORCL",https://finance.yahoo.com/markets/stocks/articles/sentiment-shifts-beaten-down-stocks-151500444.html,0.2
2026-03-24 15:21:04+00:00,PYPL,TheStreet,Cathie Wood sells Peter Thiel-backed crypto stock twice in a row,https://finance.yahoo.com/markets/crypto/articles/cathie-wood-sells-peter-thiel-152104896.html,-0.5
2026-03-24 15:22:00+00:00,APP,MarketBeat,These Insider Trades Look Like Clear Signals—Until You Read the Fine Print,https://finance.yahoo.com/markets/stocks/articles/insider-trades-look-clear-signals-152200936.html,0.1
2026-03-24 15:29:00+00:00,CDNS,Zacks,Cadence Down 16% in the Past 6 Months: How to Play the Stock?,https://finance.yahoo.com/markets/stocks/articles/cadence-down-16-past-6-152900311.html,-0.5
2026-03-24 15:36:18+00:00,ZS,MT Newswires,"Top Midday Stories: Sumitomo Mitsui Says No Immediate Plan to Acquire Jefferies; Janus Gets $52/Share Offer From Trian, General Catalyst",https://finance.yahoo.com/markets/stocks/articles/top-midday-stories-sumitomo-mitsui-153618251.html,0.2
2026-03-24 15:36:49+00:00,ALNY,MarketBeat,"Alnylam Pharmaceuticals Touts AMVUTTRA ATTR-CM Momentum, Raises 2026 TTR Revenue Outlook",https://finance.yahoo.com/sectors/healthcare/articles/alnylam-pharmaceuticals-touts-amvuttra-attr-153649907.html,0.6
2026-03-24 15:38:00+00:00,BKNG,Zacks,Expedia vs. Booking Holdings: Which Travel Stock Is a Stronger Pick?,https://finance.yahoo.com/news/expedia-vs-booking-holdings-travel-153800086.html,0.5
2026-03-24 15:39:07+00:00,COST,StockStory,1 High-Flying Stock with Solid Fundamentals and 2 We Avoid,https://finance.yahoo.com/markets/stocks/articles/1-high-flying-stock-solid-153907332.html,0.5
2026-03-24 15:51:00+00:00,GEHC,Zacks,GE HealthCare Wins FDA 510(k) Clearance for Photonova Spectra PCCT,https://finance.yahoo.com/sectors/healthcare/articles/ge-healthcare-wins-fda-510-155100710.html,0.5
2026-03-24 15:58:00+00:00,ASML,Barrons.com,SK Hynix Plans Big Investment Push. Why Micron Stock Is Dropping.,https://www.barrons.com/articles/sk-hynix-stock-price-investment-micron-20df4359?siteid=yhoof2&yptr=yahoo,-0.5
2026-03-24 16:05:36+00:00,ASML,Simply Wall St.,Is ASML Holding (NasdaqGS:ASML) Pricing In Too Much Future Growth After Its 89.6% One-Year Rally?,https://finance.yahoo.com/markets/stocks/articles/asml-holding-nasdaqgs-asml-pricing-160536305.html,-0.6
2026-03-24 16:15:00+00:00,CMCSA,ACCESS Newswire,Jacksonville Military Moms Receive Surprise Gifts at Golf‑Inspired Operation Shower,https://finance.yahoo.com/sectors/technology/articles/jacksonville-military-moms-receive-surprise-161500853.html,0.6
2026-03-24 16:22:00+00:00,ISRG,Zacks,Here's Why You Should Retain GEHC Stock in Your Portfolio for Now,https://finance.yahoo.com/markets/stocks/articles/heres-why-retain-gehc-stock-162200661.html,0.5
2026-03-24 16:28:00+00:00,MSTR,decrypt,Bitcoin Has Likely Bottomed as Strategy Shows Resilience Amid Plunge: Bernstein,https://finance.yahoo.com/markets/crypto/articles/bitcoin-likely-bottomed-strategy-shows-162800454.html,0.5
2026-03-24 16:53:07+00:00,BKNG,Investor's Business Daily,"This Airline Adds Premium Seats. Shares Lag, But These Travel Stocks Defy Slump.",https://www.investors.com/news/united-airlines-ual-stock-premium-seats-travel-stocks-expe-bkng/?src=A00220&yptr=yahoo,0.5
2026-03-24 17:02:23+00:00,QCOM,Reuters,"Arm unveils new AI chip, expects it to add billions in annual revenue",https://finance.yahoo.com/sectors/technology/articles/arm-unveils-ai-chip-expects-170223282.html,0.8
2026-03-24 17:05:33+00:00,META,reddit.com/r/stocks,"SNAP- Is it a lost cause? - I have $35k invested in Snap shares at around 7$. What I don't get is- why did the price drop to beyond $4.5 after finally some good news? What's the catch here? The company is finally making some money, yes the users in North America are slightly lesser but with Snapchat+ and the AR glasses, wouldn't the revenue make up for it and even more? I understand the",,0.2
2026-03-24 17:07:00+00:00,PANW,Zacks,AVGO's Symantec CBX Expands Security Portfolio: Revenues to Surge?,https://finance.yahoo.com/markets/stocks/articles/avgos-symantec-cbx-expands-security-170700491.html,0.6
2026-03-24 17:07:00+00:00,SHOP,WSJ,The Global Commerce Reset and a New CFO Playbook,https://finance.yahoo.com/video/global-commerce-reset-cfo-playbook-170700892.html,0.5
2026-03-24 17:15:00+00:00,SNPS,PR Newswire,Synopsys Supports New Arm AGI CPU with Full-Stack Design Solutions,https://finance.yahoo.com/sectors/technology/articles/synopsys-supports-arm-agi-cpu-171500584.html,0.5
2026-03-24 17:25:00+00:00,SHOP,WSJ,How Shopify Grew Without Adding to Its Headcount,https://finance.yahoo.com/video/shopify-grew-without-adding-headcount-172500843.html,0.5
2026-03-24 17:31:00+00:00,QCOM,MarketBeat,These 3 Beaten-Down Stocks Just Announced Massive Share Buybacks,https://finance.yahoo.com/markets/stocks/articles/3-beaten-down-stocks-just-173100209.html,0.5
2026-03-24 17:32:39+00:00,GILD,Pharmaceutical Technology,Gilead acquires first TCE asset with $2.2bn Ouro Medicines buyout,https://finance.yahoo.com/sectors/healthcare/articles/gilead-acquires-first-tce-asset-173239753.html,0.5
2026-03-24 17:33:00+00:00,KDP,Zacks,"FMX Boosts Share Repurchase Plan, Progresses Well on Forward Strategy",https://finance.yahoo.com/markets/stocks/articles/fmx-boosts-share-repurchase-plan-173300692.html,0.8
2026-03-24 17:38:57+00:00,GOOGL,reddit.com/r/stocks,"$GOOGL down 3% today and trending all over Reddit, is anyone actually buying this dip? - Got an alert that Google is trending across Reddit right now and figured I should probably stop watching from the sidelines. Stock is at $292 after dropping 3% today and people seem split between ""this is a gift"" and ""there's more pain coming."" What caught my eye is Nancy Pelosi opened a $500K+ position in GOOGL back in January.",,0.2
2026-03-24 17:41:00+00:00,AXON,Zacks,Axon vs. Teledyne: Which Defense & Security Stock has Greater Upside?,https://finance.yahoo.com/markets/stocks/articles/axon-vs-teledyne-defense-security-174100161.html,0.5
2026-03-24 17:46:48+00:00,TEAM,Investing.com,Software is sick again today... and it’s not just because of Claude,https://finance.yahoo.com/markets/stocks/articles/software-sick-again-today-not-174648511.html,-0.6
2026-03-24 17:51:56+00:00,DASH,LA Times,Walmart delivery by Google company drone may soon be coming to the San Francisco Bay Area,https://finance.yahoo.com/sectors/technology/articles/walmart-delivery-google-company-drone-175156734.html,0.5
2026-03-24 18:00:00+00:00,GILD,Barrons.com,Gilead to Buy Ouro Medicines for $2.2 Billion. Why the Deal Is Key to Future Stock Gains.,https://www.barrons.com/articles/gilead-sciences-stock-ouro-medicines-deal-47750ea5?siteid=yhoof2&yptr=yahoo,0.5
2026-03-24 18:13:00+00:00,AMAT,Zacks,Advanced Packaging Growth Drives KLAC's Prospects: What's Ahead?,https://finance.yahoo.com/markets/stocks/articles/advanced-packaging-growth-drives-klacs-181300763.html,0.6
2026-03-24 18:14:08+00:00,FAST,Insider Monkey,Is Fastenal Company (FAST) A Good Stock To Buy Now?,https://finance.yahoo.com/markets/stocks/articles/fastenal-company-fast-good-stock-181408249.html,0.2
2026-03-24 18:14:22+00:00,ADI,StockStory,2 Growth Stocks Set to Flourishand 1 Facing Challenges,https://finance.yahoo.com/markets/stocks/articles/2-growth-stocks-set-flourishand-181422504.html,0.5
2026-03-24 18:15:41+00:00,SHOP,Simply Wall St.,Shopify Recognition Raises Questions On Growth Premium And Platform Strength,https://finance.yahoo.com/markets/stocks/articles/shopify-recognition-raises-questions-growth-181541801.html,-0.5
2026-03-24 18:18:30+00:00,AEP,Simply Wall St.,Is It Time To Reassess American Electric Power (AEP) After Strong Multi‑Year Gains?,https://finance.yahoo.com/markets/stocks/articles/time-reassess-american-electric-power-181830499.html,0.5
2026-03-24 18:19:22+00:00,NFLX,StockStory,2 Mega-Cap Stocks Worth Your Attention and 1 We Turn Down,https://finance.yahoo.com/markets/stocks/articles/2-mega-cap-stocks-worth-181922835.html,0.0
2026-03-24 18:22:04+00:00,WDC,Barchart,2 Reasons Why Western Digital Stock Could Keep Climbing In 2026,https://finance.yahoo.com/markets/stocks/articles/2-reasons-why-western-digital-182204704.html,0.5
2026-03-24 18:26:18+00:00,CSCO,Insider Monkey,Is Broadcom (AVGO) The Best AI Chip Stock to Buy According to Jim Cramer?,https://finance.yahoo.com/markets/stocks/articles/broadcom-avgo-best-ai-chip-182618624.html,0.2
2026-03-24 18:32:02+00:00,LIN,Investor's Business Daily,Olin Stock Sees Relative Strength Rating Jump To 83,https://www.investors.com/news/olin-stock-sees-relative-strength-rating-jump-to-83/?src=A00220&yptr=yahoo,0.6
2026-03-24 18:44:22+00:00,CSCO,StockStory,1 Growth Stock with All-Star Potential and 2 We Avoid,https://finance.yahoo.com/markets/stocks/articles/1-growth-stock-star-potential-184422380.html,0.5
2026-03-24 19:02:00+00:00,SHOP,WSJ,What Is the Future of Agentic Commerce?,https://finance.yahoo.com/video/future-agentic-commerce-190200791.html,0.0
