timestamp,ticker,source,text,url,SentimentScore
2026-04-16 00:00:00+00:00,NFLX,SEC-EDGAR-8K,"(Item 2.02) Results of Operations and Financial Condition. On April 16, 2026, Netflix, Inc. (the “Company”) announced its financial results for the quarter ended March 31, 2026. The Letter to Shareholders, which is attached hereto as Exhibit 99.1 and is incorporated herein by reference, includes reference to the non-GAAP financial information. A reconciliation to the GAAP equivalent of non-GAAP measures is contained in tabular form in Exhibit 99.1. We are not able to reconcile forward-looking non-GAAP financial

(Item 2.02) and the accompanying Exhibit 99.1 are “furnished” and shall not be deemed “filed” for purposes of Section 18 of the Securities Exchange Act of 1934, as amended (the “Exchange Act”), or otherwise subject to the liabilities of that section, and shall not be incorporated by reference in any filing under the Securities Act of 1933, as amended, or the Exchange Act regardless of any general incorporation language in such filing, unless expressly incorporated by specific

(Item 5.02) Departure of Directors or Certain Officers; Election of Directors; Appointment of Certain Officers; Compensatory Arrangements of Certain Officers. On April 10, 2026, Reed Hastings informed the Company of his decision to not stand for re-election as a director at the Company’s 2026 annual meeting of stockholders (the “Annual Meeting”). Mr. Hastings’ current term will expire at the Annual Meeting. He will continue to serve as a director and Chairman of the Board until the Annual",,0.1
2026-04-16 00:10:27+00:00,ZS,StockStory,"Zscaler (ZS) Stock Trades Up, Here Is Why",https://finance.yahoo.com/markets/stocks/articles/zscaler-zs-stock-trades-why-001027132.html,0.5
2026-04-16 00:50:27+00:00,INTU,StockStory,"8x8, Intuit, Okta, and Box Stocks Trade Up, What You Need To Know",https://finance.yahoo.com/markets/stocks/articles/8x8-intuit-okta-box-stocks-005027299.html,0.5
2026-04-16 00:58:27+00:00,ADSK,StockStory,"Autodesk, BILL, and Snowflake Shares Are Soaring, What You Need To Know",https://finance.yahoo.com/markets/stocks/articles/autodesk-bill-snowflake-shares-soaring-005827624.html,0.8
2026-04-16 01:07:59+00:00,CSCO,Simply Wall St.,Cisco Astrix Talks Highlight AI Agent Security Push For Investors,https://finance.yahoo.com/markets/stocks/articles/cisco-astrix-talks-highlight-ai-010759928.html,0.5
2026-04-16 01:10:44+00:00,MNST,Simply Wall St.,Assessing Monster Beverage (MNST) Valuation After Recent Share Price Softness,https://finance.yahoo.com/markets/stocks/articles/assessing-monster-beverage-mnst-valuation-011044004.html,0.2
2026-04-16 02:07:41+00:00,PANW,Simply Wall St.,Palo Alto Networks Expands AI Security With Koi Deal And AES Launch,https://finance.yahoo.com/markets/stocks/articles/palo-alto-networks-expands-ai-020741622.html,0.5
2026-04-16 02:08:22+00:00,WDC,Simply Wall St.,Western Digital (WDC) Is Up 7.7% After Securing Multi‑Year AI Storage Commitments And Boosting Payouts,https://finance.yahoo.com/markets/stocks/articles/western-digital-wdc-7-7-020822120.html,0.8
2026-04-16 02:35:32+00:00,AMAT,Reuters,"Musk's staff reaches out to suppliers for Terafab project, Bloomberg News reports",https://finance.yahoo.com/sectors/technology/articles/musks-staff-reaches-suppliers-terafab-023532595.html,0.1
2026-04-16 02:42:27+00:00,CHTR,StockStory,Why Charter (CHTR) Stock Is Trading Up Today,https://finance.yahoo.com/markets/stocks/articles/why-charter-chtr-stock-trading-024227781.html,0.5
2026-04-16 02:53:14+00:00,NVDA,reddit.com/r/stocks,"Why does the market keep pushing toward highs even when the macro backdrop still looks bad? - Trying to build a better framework for reading days like this, because the market keeps looking irrational if I only focus on the headlines. Today looked pretty strong on the surface: • SPY closed at 694.46, up 1.22% • QQQ closed at 628.60, up 1.82% • IWM closed at 268.72, up 1.38% • VIX closed at 18.29 What’s",,0.2
2026-04-16 03:54:27+00:00,KLAC,StockStory,"KLA Corporation and Lam Research Shares Plummet, What You Need To Know",https://finance.yahoo.com/markets/stocks/articles/kla-corporation-lam-research-shares-035427274.html,-0.7
2026-04-16 04:18:27+00:00,TTWO,StockStory,"Take-Two, Sea, and Remitly Stocks Trade Up, What You Need To Know",https://finance.yahoo.com/markets/stocks/articles/two-sea-remitly-stocks-trade-041827199.html,0.5
2026-04-16 04:23:37+00:00,AXON,Barchart,Earnings Preview: What to Expect From AppLovin’s Report,https://finance.yahoo.com/markets/stocks/articles/earnings-preview-expect-applovin-report-042337744.html,0.5
2026-04-16 04:40:14+00:00,FTNT,Barchart,Here's What to Expect From Fortinet’s Next Earnings Report,https://finance.yahoo.com/markets/stocks/articles/heres-expect-fortinet-next-earnings-044014643.html,0.2
2026-04-16 04:44:41+00:00,DDOG,Barchart,Datadog’s Quarterly Earnings Preview: What You Need to Know,https://finance.yahoo.com/markets/stocks/articles/datadog-quarterly-earnings-preview-know-044441431.html,0.2
2026-04-16 06:05:17+00:00,KDP,Simply Wall St.,Keurig Dr Pepper Reshapes Coffee Stake And Tests Energy Drink Growth,https://finance.yahoo.com/markets/stocks/articles/keurig-dr-pepper-reshapes-coffee-060517146.html,0.2
2026-04-16 06:42:27+00:00,AXON,StockStory,Why Axon (AXON) Stock Is Trading Up Today,https://finance.yahoo.com/markets/stocks/articles/why-axon-axon-stock-trading-064227979.html,0.5
2026-04-16 06:45:51+00:00,SHOP,Insider Monkey,Here Is Why Reddit (RDDT) Is Among the Best Internet Content and Information Stocks to Buy?,https://finance.yahoo.com/markets/stocks/articles/why-reddit-rddt-among-best-064551758.html,0.8
2026-04-16 07:02:30+00:00,SHOP,Insider Monkey,Jim Cramer Explains Why Shopify Is Not a Victim of AI Displacement,https://finance.yahoo.com/markets/stocks/articles/jim-cramer-explains-why-shopify-070230807.html,0.6
2026-04-16 07:02:50+00:00,CRWD,Insider Monkey,"Jim Cramer Says AI Is Not “Gobbling” Stocks Like CrowdStrike, Its “Supporting” Them",https://finance.yahoo.com/markets/stocks/articles/jim-cramer-says-ai-not-070250657.html,0.6
2026-04-16 07:04:49+00:00,MELI,Simply Wall St.,MercadoLibre (MELI) Valuation Check After Recent Share Price Swings,https://finance.yahoo.com/markets/stocks/articles/mercadolibre-meli-valuation-check-recent-070449471.html,0.2
2026-04-16 07:30:27+00:00,BKNG,StockStory,"Booking, Wayfair, and Coupang Shares Are Soaring, What You Need To Know",https://finance.yahoo.com/markets/stocks/articles/booking-wayfair-coupang-shares-soaring-073027354.html,0.6
2026-04-16 07:38:27+00:00,ABNB,StockStory,Why Airbnb (ABNB) Stock Is Up Today,https://finance.yahoo.com/markets/stocks/articles/why-airbnb-abnb-stock-today-073827511.html,0.5
2026-04-16 07:50:00+00:00,EA,Zacks,"The Zacks Analyst Blog Highlights Netflix, Ralph Lauren, Roku, Take-Two Interactive and Electronic Arts",https://finance.yahoo.com/markets/stocks/articles/zacks-analyst-blog-highlights-netflix-075000983.html,0.5
2026-04-16 07:54:27+00:00,DDOG,StockStory,Why Datadog (DDOG) Stock Is Up Today,https://finance.yahoo.com/markets/stocks/articles/why-datadog-ddog-stock-today-075427498.html,0.5
2026-04-16 08:06:27+00:00,TTWO,Simply Wall St.,"Take-Two (TTWO) Leans on GTA Online Windfall, But How Durable Is Its Flagship Franchise Power?",https://finance.yahoo.com/markets/stocks/articles/two-ttwo-leans-gta-online-080627536.html,0.1
2026-04-16 08:07:44+00:00,MPWR,Simply Wall St.,Is It Too Late To Consider Monolithic Power Systems (MPWR) After 160% One Year Surge?,https://finance.yahoo.com/news/too-consider-monolithic-power-systems-080744694.html,0.1
2026-04-16 08:23:44+00:00,AMAT,Bloomberg,Musk Asks Suppliers to Move at ‘Light Speed’ on New Chipmaking Plan,https://finance.yahoo.com/sectors/technology/articles/musk-asks-suppliers-move-light-025431179.html,0.5
2026-04-16 08:26:27+00:00,APP,StockStory,"Dropbox, Five9, Veeva Systems, AppLovin, and Toast Shares Skyrocket, What You Need To Know",https://finance.yahoo.com/markets/stocks/articles/dropbox-five9-veeva-systems-applovin-082627332.html,0.8
2026-04-16 08:50:27+00:00,WDAY,StockStory,Why Workday (WDAY) Stock Is Trading Up Today,https://finance.yahoo.com/markets/stocks/articles/why-workday-wday-stock-trading-085027429.html,0.5
2026-04-16 08:51:23+00:00,DASH,Verdict Food Service,Autonomous deliveries could cut food order costs down to $1 – Barclays,https://finance.yahoo.com/sectors/technology/articles/autonomous-deliveries-could-cut-food-085123198.html,0.5
2026-04-16 09:27:55+00:00,MCHP,Insider Monkey,Microchip Technology Incorporated (MCHP) Expands DSC Family for AI and Data Centers,https://finance.yahoo.com/sectors/technology/articles/microchip-technology-incorporated-mchp-expands-092755393.html,0.5
2026-04-16 09:28:03+00:00,AMAT,Insider Monkey,"Is Applied Materials, Inc. (AMAT) a Top Data Center Stock Amid Burgeoning DRAM Opportunity?",https://finance.yahoo.com/markets/stocks/articles/applied-materials-inc-amat-top-092803739.html,0.5
2026-04-16 09:57:16+00:00,INTU,TipRanks,Morgan Stanley Calls These 2 Stocks ‘Top Picks’ for 2026 – Here’s Why,https://finance.yahoo.com/markets/stocks/articles/morgan-stanley-calls-2-stocks-095716224.html,0.5
2026-04-16 10:00:00+00:00,ADSK,Zacks,New Strong Buy Stocks for April 16th,https://finance.yahoo.com/markets/stocks/articles/strong-buy-stocks-april-16th-100000864.html,0.5
2026-04-16 10:00:00+00:00,KDP,Food Dive,Hershey US president unexpectedly departs,https://finance.yahoo.com/markets/stocks/articles/hershey-us-president-unexpectedly-departs-100000463.html,-0.5
2026-04-16 10:02:47+00:00,QCOM,Simply Wall St.,Qualcomm’s Automotive Push Adds New Layer To QCOM Investment Story,https://finance.yahoo.com/markets/stocks/articles/qualcomm-automotive-push-adds-layer-100247172.html,0.5
2026-04-16 10:05:14+00:00,DASH,Simply Wall St.,US Stock Market Today S&P 500 Futures Edge Higher As Bond Yields Ease,https://finance.yahoo.com/markets/stocks/articles/us-stock-market-today-p-100514961.html,0.5
2026-04-16 10:35:53+00:00,AMAT,Barchart,Nasdaq Futures Climb as TSMC Boosts Tech Optimism,https://finance.yahoo.com/markets/stocks/articles/nasdaq-futures-climb-tsmc-boosts-103553137.html,0.8
2026-04-16 10:55:00+00:00,SBUX,Motley Fool,1 Obvious Way This Consumer-Facing Stock Can Beat the S&P 500 Over the Next 3 Years,https://finance.yahoo.com/markets/stocks/articles/1-obvious-way-consumer-facing-105500554.html,0.6
2026-04-16 11:01:06+00:00,ARM,Benzinga,"Broadcom Wins Big, But AI Infrastructure Is 'Real Winner' Of Meta Deal, Says Daniel Newman",https://finance.yahoo.com/sectors/technology/articles/broadcom-wins-big-ai-infrastructure-110106973.html,0.6
2026-04-16 11:04:11+00:00,LRCX,Investing.com,ASML valuation gap with US peers hits decade low,https://finance.yahoo.com/markets/stocks/articles/asml-valuation-gap-us-peers-110411802.html,0.2
2026-04-16 11:04:36+00:00,ODFL,Simply Wall St.,Why The Old Dominion Freight Line (ODFL) Story Is Shifting As Analysts Debate Valuation,https://finance.yahoo.com/markets/stocks/articles/why-old-dominion-freight-line-110436886.html,0.2
2026-04-16 11:14:27+00:00,DXCM,StockStory,3 Reasons Investors Love DexCom (DXCM),https://finance.yahoo.com/markets/stocks/articles/3-reasons-investors-love-dexcom-111427180.html,0.5
2026-04-16 11:31:53+00:00,PAYX,Simply Wall St.,Discover Paychex And 2 More Top Dividend Stocks,https://finance.yahoo.com/markets/stocks/articles/discover-paychex-2-more-top-113153999.html,0.2
2026-04-16 11:35:49+00:00,APP,Simply Wall St.,Insider-Favored Growth Stocks Including Pagaya Technologies,https://finance.yahoo.com/markets/stocks/articles/insider-favored-growth-stocks-including-113549499.html,0.5
2026-04-16 11:43:13+00:00,ASML,24/7 Wall St.,ASML and TSMC Just Told the Market AI Spending Isn’t Slowing Down,https://finance.yahoo.com/sectors/technology/articles/asml-tsmc-just-told-market-114313973.html,0.5
2026-04-16 11:56:00+00:00,ADBE,Motley Fool,Bargain Alert: 2 Brand-Name Software Stocks That Haven't Been This Cheap in Over a Decade,https://finance.yahoo.com/markets/stocks/articles/bargain-alert-2-brand-name-115600139.html,0.8
2026-04-16 11:59:49+00:00,DASH,Barchart,What You Need To Know Ahead of DoorDash's Earnings Release,https://finance.yahoo.com/markets/stocks/articles/know-ahead-doordashs-earnings-release-115949131.html,0.0
2026-04-16 12:24:07+00:00,PANW,Banking Dive,Palo Alto Networks founder applies to invest in California bank,https://finance.yahoo.com/markets/stocks/articles/palo-alto-networks-founder-applies-122407021.html,0.5
2026-04-16 12:25:38+00:00,LRCX,GuruFocus.com,Musk Pushes Deeper Into Chip Manufacturing With Terafab,https://finance.yahoo.com/sectors/technology/articles/musk-pushes-deeper-chip-manufacturing-122538207.html,0.5
2026-04-16 12:37:47+00:00,ADBE,Simply Wall St.,E-Commerce Today - Shopify to Announce Q1 2026 Financial Results Soon,https://finance.yahoo.com/markets/stocks/articles/e-commerce-today-shopify-announce-123747962.html,0.1
2026-04-16 12:40:00+00:00,CEG,Motley Fool,Constellation Energy Is Down 28% From Its 52-Week High. Here's What Is Weighing on the Stock.,https://finance.yahoo.com/markets/stocks/articles/constellation-energy-down-28-52-124000776.html,-0.6
2026-04-16 12:46:09+00:00,AMAT,GuruFocus.com,Musk's Chip Push Signals Bigger Ambitions,https://finance.yahoo.com/sectors/technology/articles/musks-chip-push-signals-bigger-124609279.html,0.5
2026-04-16 12:49:32+00:00,KLAC,GuruFocus.com,ASML Trades At Decade-Low Premium Despite 36% Rally,https://finance.yahoo.com/markets/stocks/articles/asml-trades-decade-low-premium-124932043.html,0.5
2026-04-16 12:50:49+00:00,SHOP,24/7 Wall St.,ServiceNow vs Shopify: Which Is the Better Short Candidate Right Now?,https://finance.yahoo.com/markets/stocks/articles/servicenow-vs-shopify-better-short-125049003.html,-0.5
2026-04-16 12:54:00+00:00,PANW,Zacks,Zscaler Stock Plummets 42% YTD: Should You Hold Tight or Exit?,https://finance.yahoo.com/markets/stocks/articles/zscaler-stock-plummets-42-ytd-125400133.html,-0.6
2026-04-16 12:56:48+00:00,AMAT,GuruFocus.com,Elon Musk Advances Terafab Plan Targeting $13 Trillion Chip Investment,https://finance.yahoo.com/sectors/technology/articles/elon-musk-advances-terafab-plan-125648951.html,0.8
2026-04-16 13:00:04+00:00,SBUX,Zacks,Here is What to Know Beyond Why Starbucks Corporation (SBUX) is a Trending Stock,https://finance.yahoo.com/markets/stocks/articles/know-beyond-why-starbucks-corporation-130004317.html,0.2
2026-04-16 13:00:05+00:00,GILD,Zacks,"Gilead Sciences, Inc. (GILD) Is a Trending Stock: Facts to Know Before Betting on It",https://finance.yahoo.com/markets/stocks/articles/gilead-sciences-inc-gild-trending-130005719.html,0.5
2026-04-16 13:00:06+00:00,ABNB,Zacks,"Here is What to Know Beyond Why Airbnb, Inc. (ABNB) is a Trending Stock",https://finance.yahoo.com/markets/stocks/articles/know-beyond-why-airbnb-inc-130006562.html,0.2
2026-04-16 13:03:00+00:00,SBUX,Zacks,Starbucks Rebounds on Traffic Growth: Time to Buy the Stock?,https://finance.yahoo.com/markets/stocks/articles/starbucks-rebounds-traffic-growth-time-130300051.html,0.6
2026-04-16 13:10:00+00:00,BKNG,MarketBeat,"Booking Holdings Down 15%, Is It Time to Buy?",https://finance.yahoo.com/markets/stocks/articles/booking-holdings-down-15-time-131000571.html,0.5
2026-04-16 13:15:03+00:00,ISRG,Zacks,Seeking Clues to Intuitive Surgical (ISRG) Q1 Earnings? A Peek Into Wall Street Projections for Key Metrics,https://finance.yahoo.com/markets/stocks/articles/seeking-clues-intuitive-surgical-isrg-131503174.html,0.2
2026-04-16 13:30:03+00:00,WDAY,Zacks,Wall Street Bulls Look Optimistic About Workday (WDAY): Should You Buy?,https://finance.yahoo.com/markets/stocks/articles/wall-street-bulls-look-optimistic-133003506.html,0.8
2026-04-16 13:35:00+00:00,REGN,Zacks,NTLA Stock Rises 20% in 3 Months: Here's What You Should Know,https://finance.yahoo.com/markets/stocks/articles/ntla-stock-rises-20-3-133500595.html,0.6
2026-04-16 13:35:36+00:00,BKNG,Insider Monkey,"Jim Cramer on Booking Holdings: “When the War Ends, I Think This Thing’s Going to Soar”",https://finance.yahoo.com/markets/stocks/articles/jim-cramer-booking-holdings-war-133536378.html,0.8
2026-04-16 13:39:47+00:00,APP,Insider Monkey,Jim Cramer Discusses AppLovin in Light of Google Competition Fears,https://finance.yahoo.com/markets/stocks/articles/jim-cramer-discusses-applovin-light-133947813.html,0.2
2026-04-16 13:40:00+00:00,MDLZ,Zacks,MDLZ vs. SJM: Which Branded Food Stock Is Better Positioned Today?,https://finance.yahoo.com/markets/stocks/articles/mdlz-vs-sjm-branded-food-134000676.html,0.5
2026-04-16 13:42:00+00:00,AMGN,Zacks,J&J Targets Double-Digit Growth by 2030 Despite Stelara Drag,https://finance.yahoo.com/sectors/healthcare/articles/j-j-targets-double-digit-134200445.html,0.2
2026-04-16 13:47:39+00:00,INTU,The Fly,"Qualcomm downgraded, Okta upgraded: Wall Street's top analyst calls",https://finance.yahoo.com/news/marvell-upgraded-trade-desk-downgraded-143122342.html,0.2
2026-04-16 13:48:00+00:00,CRWD,Zacks,Can Platform Wins Accelerate Palo Alto Networks' Long-Term Growth?,https://finance.yahoo.com/markets/stocks/articles/platform-wins-accelerate-palo-alto-134800226.html,0.5
2026-04-16 13:50:55+00:00,ADSK,24/7 Wall St.,Autodesk vs Snowflake: Which Is the Better Short Candidate Right Now?,https://finance.yahoo.com/markets/stocks/articles/autodesk-vs-snowflake-better-short-135055065.html,-0.5
2026-04-16 13:54:00+00:00,CTSH,Zacks,Serve Robotics Stock Dips 36% in 3 Months: Should You Hold or Fold?,https://finance.yahoo.com/markets/stocks/articles/serve-robotics-stock-dips-36-135400191.html,-0.6
2026-04-16 14:00:00+00:00,PYPL,Motley Fool,"Multibillion-Dollar Defense Contracts: Is Palantir Quietly Turning Into a Core ""Infrastructure"" Stock for U.S. Intelligence?",https://finance.yahoo.com/markets/stocks/articles/multibillion-dollar-defense-contracts-palantir-140000191.html,0.5
2026-04-16 14:00:06+00:00,HON,Zacks,Honeywell International Inc. (HON) Expected to Beat Earnings Estimates: Should You Buy?,https://finance.yahoo.com/markets/stocks/articles/honeywell-international-inc-hon-expected-140006321.html,0.6
2026-04-16 14:00:07+00:00,BKR,Zacks,Baker Hughes (BKR) Q1 Earnings Preview: What's in the Cards?,https://finance.yahoo.com/markets/stocks/articles/baker-hughes-bkr-q1-earnings-140007224.html,0.5
2026-04-16 14:00:11+00:00,KDP,Zacks,"Keurig Dr Pepper, Inc (KDP) Expected to Beat Earnings Estimates: Can the Stock Move Higher?",https://finance.yahoo.com/markets/stocks/articles/keurig-dr-pepper-inc-kdp-140011961.html,0.5
2026-04-16 14:00:14+00:00,CSX,Zacks,Union Pacific (UNP) Reports Next Week: Wall Street Expects Earnings Growth,https://finance.yahoo.com/markets/stocks/articles/union-pacific-unp-reports-next-140014091.html,0.8
2026-04-16 14:00:17+00:00,CMCSA,Zacks,Analysts Estimate Comcast (CMCSA) to Report a Decline in Earnings: What to Look Out for,https://finance.yahoo.com/markets/stocks/articles/analysts-estimate-comcast-cmcsa-report-140017119.html,-0.5
2026-04-16 14:03:53+00:00,DASH,Simply Wall St.,How The DoorDash (DASH) Investment Story Is Shifting With New Guidance AI Questions And Deals,https://finance.yahoo.com/markets/stocks/articles/doordash-dash-investment-story-shifting-140353560.html,0.2
2026-04-16 14:06:35+00:00,PYPL,24/7 Wall St.,Mizuho Downgrades PayPal to Neutral Citing X’s Threat to Venmo: Is the PYPL Comeback Story Over?,https://finance.yahoo.com/markets/stocks/articles/mizuho-downgrades-paypal-neutral-citing-140635617.html,-0.6
2026-04-16 14:09:00+00:00,KDP,Zacks,"PEP Q1 Earnings Beat on North America Gains, International Strength",https://finance.yahoo.com/markets/stocks/articles/pep-q1-earnings-beat-north-140900586.html,0.8
2026-04-16 14:11:00+00:00,KDP,Zacks,Keurig Gears Up for Q1 Earnings: Key Metrics Investors Should Track,https://finance.yahoo.com/markets/stocks/articles/keurig-gears-q1-earnings-key-141100428.html,0.2
2026-04-16 14:14:00+00:00,DDOG,Zacks,Can SNOW's Expansion Into Observability Strengthen the Growth Thesis?,https://finance.yahoo.com/markets/stocks/articles/snows-expansion-observability-strengthen-growth-141400956.html,0.5
2026-04-16 14:22:00+00:00,GEHC,Zacks,Glaukos Wins Permanent J-Code for Epioxa Keratoconus Therapy,https://finance.yahoo.com/sectors/healthcare/articles/glaukos-wins-permanent-j-code-142200050.html,0.5
2026-04-16 14:28:28+00:00,QCOM,24/7 Wall St.,JPMorgan Downgrades Qualcomm and Puts It on Negative Watch: Is the Smartphone Giant’s Best Days Behind It?,https://finance.yahoo.com/markets/stocks/articles/jpmorgan-downgrades-qualcomm-puts-negative-142828927.html,-0.6
2026-04-16 14:40:00+00:00,AMAT,Zacks,NVDA vs. AMAT: Which Semiconductor Stock is a Better Buy Now?,https://finance.yahoo.com/markets/stocks/articles/nvda-vs-amat-semiconductor-stock-144000995.html,0.2
2026-04-16 14:43:29+00:00,NVDA,reddit.com/r/stocks,"Ran a Quality + GARP screen this week… results were not what I expected - The last couple weeks have been straight-up exhausting. iran stuff shuts the Strait, Dow suddenly rips 1300 points off one ceasefire tweet, tariff headlines every five minutes and FinTwit is split between “buy everything right now” and “cash is king bro”. I got sick of doom-scrolling and reacting to every headline so I went back to basics and actually screened",,-0.5
2026-04-16 14:48:00+00:00,GILD,Zacks,Danaher Gears Up to Post Q1 Earnings: What Lies Ahead for the Stock?,https://finance.yahoo.com/markets/stocks/articles/danaher-gears-post-q1-earnings-144800880.html,0.2
2026-04-16 14:48:00+00:00,GEHC,Zacks,Reasons to Retain West Pharmaceutical Stock in Your Portfolio for Now,https://finance.yahoo.com/markets/stocks/articles/reasons-retain-west-pharmaceutical-stock-144800754.html,0.5
2026-04-16 14:49:00+00:00,ADI,Zacks,"ASML Holding Q1 Earnings Beat Estimates, Revenues Rise Y/Y",https://finance.yahoo.com/markets/stocks/articles/asml-holding-q1-earnings-beat-144900503.html,0.8
2026-04-16 14:51:05+00:00,INTU,Insider Monkey,Analysts See 65% Upside for Intuit (INTU) Despite 40% One-Year Share Price Decline,https://finance.yahoo.com/markets/stocks/articles/analysts-see-65-upside-intuit-145105455.html,0.8
2026-04-16 14:51:13+00:00,CSGP,Insider Monkey,CoStar Group (CSGP) is Among the Best Low-Risk High-Reward Stocks,https://finance.yahoo.com/markets/stocks/articles/costar-group-csgp-among-best-145113071.html,0.8
2026-04-16 15:04:30+00:00,LRCX,Simply Wall St.,Lam Research Drawn Into Musk’s Terafab AI Chip Ambitions,https://finance.yahoo.com/markets/stocks/articles/lam-research-drawn-musk-terafab-150430139.html,0.1
2026-04-16 15:15:17+00:00,ASML,Barchart,Should You Buy the ASML Stock Dip?,https://finance.yahoo.com/markets/stocks/articles/buy-asml-stock-dip-151517194.html,0.2
2026-04-16 15:26:58+00:00,QCOM,24/7 Wall St.,AMD Gains 6% Ahead of May Earnings: Is the AI Chip Challenger Finally Ready to Rival NVIDIA?,https://finance.yahoo.com/markets/stocks/articles/amd-gains-6-ahead-may-152658327.html,0.6
2026-04-16 15:38:00+00:00,MCHP,Zacks,Top Robotics Stocks With Strong Potential for Long-Term Growth,https://finance.yahoo.com/markets/stocks/articles/top-robotics-stocks-strong-potential-153800865.html,0.8
2026-04-16 15:50:00+00:00,GEHC,Zacks,Here's Why You Should Retain BDX Stock in Your Portfolio Now,https://finance.yahoo.com/sectors/healthcare/articles/heres-why-retain-bdx-stock-155000320.html,0.5
2026-04-16 15:51:00+00:00,TMUS,Zacks,VZ to Boost Fan Experience at FIFA World Cup: Will it Drive Prospects?,https://finance.yahoo.com/markets/stocks/articles/vz-boost-fan-experience-fifa-155100925.html,0.5
2026-04-16 15:57:30+00:00,WDC,24/7 Wall St.,"Buy, Sell or Hold Micron at $445 or SanDisk at $885?",https://finance.yahoo.com/markets/stocks/articles/buy-sell-hold-micron-445-155730268.html,-0.2
2026-04-16 16:00:00+00:00,SNDK,Zacks,Sandisk vs. Marvell: Which AI Infrastructure Stock Should You Buy?,https://finance.yahoo.com/markets/stocks/articles/sandisk-vs-marvell-ai-infrastructure-160000726.html,0.2
2026-04-16 16:00:07+00:00,AMAT,Zacks,Applied Materials (AMAT) Is Up 14.64% in One Week: What You Should Know,https://finance.yahoo.com/markets/stocks/articles/applied-materials-amat-14-64-160007359.html,0.8
2026-04-16 16:02:00+00:00,BKR,Zacks,Baker Hughes Divests Waygate Technologies to Hexagon for $1.45B,https://finance.yahoo.com/sectors/energy/articles/baker-hughes-divests-waygate-technologies-160200985.html,0.5
2026-04-16 16:03:00+00:00,MELI,Insider Monkey,Do You Believe Mercadolibre (MELI) has a Long Runway for Future Growth?,https://finance.yahoo.com/markets/stocks/articles/believe-mercadolibre-meli-long-runway-160300564.html,0.5
2026-04-16 16:05:04+00:00,ADSK,Simply Wall St.,Is Globant’s (GLOB) Deeper Autodesk Tandem Role Quietly Reframing Its Physical AI Ambitions?,https://finance.yahoo.com/markets/stocks/articles/globant-glob-deeper-autodesk-tandem-160504860.html,0.2
2026-04-16 16:05:35+00:00,AXON,Simply Wall St.,How The Axon Enterprise (AXON) Narrative Is Shifting After Analyst Fair Value Reset,https://finance.yahoo.com/markets/stocks/articles/axon-enterprise-axon-narrative-shifting-160535092.html,0.2
2026-04-16 16:10:02+00:00,WDC,Zacks,Will Western Digital (WDC) Beat Estimates Again in Its Next Earnings Report?,https://finance.yahoo.com/markets/stocks/articles/western-digital-wdc-beat-estimates-161002350.html,0.2
2026-04-16 16:10:03+00:00,EXC,Zacks,Will Exelon (EXC) Beat Estimates Again in Its Next Earnings Report?,https://finance.yahoo.com/markets/stocks/articles/exelon-exc-beat-estimates-again-161003220.html,0.2
2026-04-16 16:14:00+00:00,CSCO,Zacks,Ciena Soars 182% in 6 Months: Should Investors Buy the Stock Now?,https://finance.yahoo.com/markets/stocks/articles/ciena-soars-182-6-months-161400394.html,0.5
