timestamp,ticker,source,text,url,SentimentScore
2026-04-17 13:38:32+00:00,TMUS,Insider Monkey,"KeyBanc Turn Bullish on T-Mobile US, Inc. (TMUS) Ahead of Potential Earnings Catalyst",https://finance.yahoo.com/markets/stocks/articles/keybanc-turn-bullish-t-mobile-133832279.html,0.6
2026-04-17 13:39:00+00:00,MAR,Zacks,Carter's Q1 Earnings on The Horizon: What Should Investors Know?,https://finance.yahoo.com/markets/stocks/articles/carters-q1-earnings-horizon-investors-133900613.html,0.0
2026-04-17 13:40:28+00:00,ISRG,Insider Monkey,"Intuitive Surgical, Inc. (ISRG) Price Target Lowered at BITG Amid CMS FY27 Payment Rule Impact",https://finance.yahoo.com/sectors/healthcare/articles/intuitive-surgical-inc-isrg-price-134028679.html,-0.5
2026-04-17 13:42:32+00:00,BKNG,Insider Monkey,Here’s Middle Coast Investing’s Views on Booking Holdings (BKNG),https://finance.yahoo.com/markets/stocks/articles/middle-coast-investing-views-booking-134232941.html,0.2
2026-04-17 13:44:37+00:00,GILD,Insider Monkey,"Morgan Stanley Adjusts Gilead Sciences, Inc. (GILD) Outlook Ahead of Q1 Earnings",https://finance.yahoo.com/sectors/healthcare/articles/morgan-stanley-adjusts-gilead-sciences-134437180.html,0.5
2026-04-17 13:57:00+00:00,KDP,Zacks,Beyond Beer Push: Can Molson Coors Drive Long-Term Growth?,https://finance.yahoo.com/markets/stocks/articles/beyond-beer-push-molson-coors-135700930.html,0.2
2026-04-17 13:57:22+00:00,GILD,Insider Monkey,"B. Riley Sees Upside in MacroGenics, Inc. (MGNX) Following Gilead-Driven Sector Activity",https://finance.yahoo.com/sectors/healthcare/articles/b-riley-sees-upside-macrogenics-135722014.html,0.6
2026-04-17 13:57:28+00:00,PDD,GuruFocus.com,"China Imposes $528 Million Penalty On Alibaba, JD, Meituan, PDD, Douyin",https://finance.yahoo.com/markets/stocks/articles/china-imposes-528-million-penalty-135728989.html,-0.5
2026-04-17 14:00:04+00:00,CMCSA,Zacks,Charter Communications (CHTR) Reports Next Week: Wall Street Expects Earnings Growth,https://finance.yahoo.com/markets/stocks/articles/charter-communications-chtr-reports-next-140004249.html,0.6
2026-04-17 14:08:13+00:00,QCOM,24/7 Wall St.,David Tepper Is Bullish on These 2 Contrarian Picks and 2 Mega-Cap Winners,https://finance.yahoo.com/markets/stocks/articles/david-tepper-bullish-2-contrarian-140813549.html,0.6
2026-04-17 14:09:00+00:00,GEHC,Zacks,PacBio Stock Up on New FFPE Workflow Boosting Cancer Sequencing,https://finance.yahoo.com/sectors/healthcare/articles/pacbio-stock-ffpe-workflow-boosting-140900612.html,0.6
2026-04-17 14:23:27+00:00,TMUS,TipRanks,T-Mobile assumed with an Overweight at Morgan Stanley,https://finance.yahoo.com/markets/stocks/articles/t-mobile-assumed-overweight-morgan-142327576.html,0.5
2026-04-17 14:31:13+00:00,PYPL,Benzinga,"Martin Shkreli Says Elizabeth Warren Shoots From The Hip And Is Wrong About Tesla, Disney And Palantir Paying Zero Taxes: 'You Don't Know Facts'",https://finance.yahoo.com/economy/policy/articles/martin-shkreli-says-elizabeth-warren-143113430.html,-0.6
2026-04-17 14:37:00+00:00,COST,TheStreet,Costco adds popular fast food product to lineup,https://finance.yahoo.com/markets/stocks/articles/costco-adds-popular-fast-food-143700689.html,0.5
2026-04-17 14:37:06+00:00,EXC,24/7 Wall St.,"Exelon Gets Hit With a Triple Downgrade From Barclays, BMO and Mizuho: Three Firms Agree the Regulatory Tide Has Turned",https://finance.yahoo.com/markets/stocks/articles/exelon-gets-hit-triple-downgrade-143706188.html,-0.6
2026-04-17 14:43:37+00:00,PDD,24/7 Wall St.,Morgan Stanley Opens a Tactical Buy on PDD Holdings: A Regulation Overhang Just Lifted and the Clock Is Ticking,https://finance.yahoo.com/markets/stocks/articles/morgan-stanley-opens-tactical-buy-144337662.html,0.6
2026-04-17 14:44:00+00:00,AMAT,Zacks,"Taiwan Semiconductor Q1 Earnings Beat Estimates, Revenues Rise Y/Y",https://finance.yahoo.com/markets/stocks/articles/taiwan-semiconductor-q1-earnings-beat-144400227.html,0.8
2026-04-17 14:46:00+00:00,SBUX,Zacks,3 Restaurant Stocks Positioned to Grow Despite Industry Struggles,https://finance.yahoo.com/markets/stocks/articles/3-restaurant-stocks-positioned-grow-144600464.html,0.5
2026-04-17 14:46:00+00:00,ROST,Zacks,Buy 5 Stocks With High ROE as Markets Hit Record High on Likely Truce,https://finance.yahoo.com/markets/stocks/articles/buy-5-stocks-high-roe-144600666.html,0.8
2026-04-17 15:00:51+00:00,FAST,reddit.com/r/stocks,"Etoro $ETOR looks set for recovery - eToro $ETOR, the European Robinhood took a dip recently with the market and coin plunge but is recovering nicely now that the Iran nonsense is coming to an end and the market heads back on its way north catalyst: likely big rebound ahead driven by coin + market recovery Fast growth: Revenue, earnings and funded accounts are all growing rapidly Etoro is expanding its footprint aggressively, focusing on",,0.8
2026-04-17 15:04:07+00:00,ROST,StockStory,1 Profitable Stock to Research Further and 2 Facing Headwinds,https://finance.yahoo.com/markets/stocks/articles/1-profitable-stock-research-further-150407764.html,0.5
2026-04-17 15:07:23+00:00,QCOM,Insider Monkey,Qualcomm (QCOM) Makes A Strategic Bet That Could Matter More Than It Seems,https://finance.yahoo.com/markets/stocks/articles/qualcomm-qcom-makes-strategic-bet-150723480.html,0.6
2026-04-17 15:07:45+00:00,NXPI,Insider Monkey,NXP Semiconductors (NXPI): A Cut To $230 Reveals A Bigger Debate,https://finance.yahoo.com/sectors/technology/articles/nxp-semiconductors-nxpi-cut-230-150745485.html,0.1
2026-04-17 15:08:00+00:00,MELI,Zacks,MercadoLibre vs. Amazon: Which E-Commerce Stock Has More Upside?,https://finance.yahoo.com/markets/stocks/articles/mercadolibre-vs-amazon-e-commerce-150800766.html,0.5
2026-04-17 15:12:00+00:00,QCOM,Zacks,Cirrus Logic Up 34% in 3 Months: Should Investors Buy Now or Wait?,https://finance.yahoo.com/markets/stocks/articles/cirrus-logic-34-3-months-151200916.html,0.5
2026-04-17 15:18:00+00:00,ASML,Zacks,ASML vs. AAOI: Which Stock Leads the Data Center Supply Chain?,https://finance.yahoo.com/markets/stocks/articles/asml-vs-aaoi-stock-leads-151800655.html,0.2
2026-04-17 15:19:00+00:00,FANG,Zacks,Will ExxonMobil Leverage the Permian Basin for Long-Term Growth?,https://finance.yahoo.com/sectors/energy/articles/exxonmobil-leverage-permian-basin-long-151900325.html,0.5
2026-04-17 15:24:00+00:00,EA,Zacks,Netflix Q1 Earnings & Revenues Top Estimates on Subscription Growth,https://finance.yahoo.com/markets/stocks/articles/netflix-q1-earnings-revenues-top-152400638.html,0.8
2026-04-17 15:28:00+00:00,ASML,Motley Fool,The Best Artificial Intelligence (AI) Chip Equipment Stock Just Raised Guidance. Here's What ASML's Earnings Mean for the Nasdaq.,https://finance.yahoo.com/markets/stocks/articles/best-artificial-intelligence-ai-chip-152800068.html,0.6
2026-04-17 15:28:16+00:00,GEHC,MedTech Dive,"GE HealthCare, RadNet expand AI mammography collaboration",https://finance.yahoo.com/sectors/healthcare/articles/ge-healthcare-radnet-expand-ai-152816267.html,0.5
2026-04-17 15:29:06+00:00,COST,reddit.com/r/stocks,"Oil drops as Hormuz tensions ease, but is the risk really gone? - With the latest developments in the Middle East, the energy sector is going through a pretty sharp repricing. WTI and Brent both dropped significantly, which looks like a classic unwind of geopolitical risk premium. At the same time, mixed signals from different sides are making the short term outlook less clear. On one hand, tensions around the Strait of Hormuz seem to",,-0.2
2026-04-17 15:30:00+00:00,SNDK,Investing.com,SanDisk gets another price target hike as NAND supply remains tight,https://finance.yahoo.com/markets/stocks/articles/sandisk-gets-another-price-target-153000252.html,0.5
2026-04-17 15:40:04+00:00,GEHC,Zacks,GEHC vs. SYK: Which Stock Is the Better Value Option?,https://finance.yahoo.com/markets/stocks/articles/gehc-vs-syk-stock-better-154004086.html,0.2
2026-04-17 15:48:00+00:00,QCOM,Zacks,Can Intel's Core Series 3 Processors Launch Boost Its Profits?,https://finance.yahoo.com/sectors/technology/articles/intels-core-series-3-processors-154800457.html,0.2
2026-04-17 16:00:04+00:00,FANG,Zacks,What Makes Diamondback (FANG) a New Buy Stock,https://finance.yahoo.com/markets/stocks/articles/makes-diamondback-fang-buy-stock-160004998.html,0.5
2026-04-17 16:00:04+00:00,SNDK,Zacks,Are You Looking for a Top Momentum Pick? Why Sandisk Corporation (SNDK) is a Great Choice,https://finance.yahoo.com/markets/stocks/articles/looking-top-momentum-pick-why-160004825.html,0.8
2026-04-17 16:01:26+00:00,PEP,CFO Dive,PepsiCo CFO says inflation ‘will come’ as Iran conflict adds risk,https://finance.yahoo.com/economy/policy/articles/pepsico-cfo-says-inflation-come-160126107.html,-0.5
2026-04-17 16:11:46+00:00,CDNS,Barchart,Lesser-Known Cadence Design Systems Just Landed Google and Nvidia Deals. Should You Buy CDNS Stock?,https://finance.yahoo.com/markets/stocks/articles/lesser-known-cadence-design-systems-161146267.html,0.5
2026-04-17 16:14:09+00:00,GILD,Insider Monkey,Jim Cramer on Gilead Sciences: “I’d Hold On to It”,https://finance.yahoo.com/markets/stocks/articles/jim-cramer-gilead-sciences-d-161409703.html,0.6
2026-04-17 16:15:50+00:00,DASH,TechCrunch,Chef Robotics escaped the robot cooking graveyard and says it’s thriving — here’s why,https://finance.yahoo.com/sectors/technology/articles/chef-robotics-escaped-robot-cooking-161550763.html,0.6
2026-04-17 16:23:00+00:00,EXC,Zacks,Eversource Gains From Grid Modernization & Infrastructure Development,https://finance.yahoo.com/sectors/energy/articles/eversource-gains-grid-modernization-infrastructure-162300263.html,0.6
2026-04-17 16:26:00+00:00,ADBE,Zacks,Adobe Expands AI Portfolio for Creators: Buy or Hold the Stock?,https://finance.yahoo.com/markets/stocks/articles/adobe-expands-ai-portfolio-creators-162600597.html,0.5
2026-04-17 16:30:00+00:00,WBD,MarketBeat,"Why Netflix Tanked Despite Big EPS Beat, Outlook Ahead",https://finance.yahoo.com/markets/stocks/articles/why-netflix-tanked-despite-big-163000973.html,-0.5
2026-04-17 16:59:38+00:00,WBD,Motley Fool,Netflix Stock Tanked Today. Should You Buy the Dip?,https://finance.yahoo.com/markets/stocks/articles/netflix-stock-tanked-today-buy-165938522.html,-0.5
2026-04-17 17:21:00+00:00,HON,Zacks,3M Gears Up to Report Q1 Earnings: What's in the Offing?,https://finance.yahoo.com/markets/stocks/articles/3m-gears-report-q1-earnings-172100142.html,0.2
2026-04-17 17:24:55+00:00,ISRG,24/7 Wall St.,Intuitive Surgical Is Jumping 2.7% Ahead of Earnings. Is the Robotics Stock Ready to Recover?,https://finance.yahoo.com/markets/stocks/articles/intuitive-surgical-jumping-2-7-172455635.html,0.5
2026-04-17 17:36:03+00:00,APP,Simply Wall St.,3 Growth Companies With Insider Ownership Up To 12%,https://finance.yahoo.com/markets/stocks/articles/3-growth-companies-insider-ownership-173603823.html,0.5
2026-04-17 17:50:00+00:00,ISRG,Zacks,ISRG's Rising Procedure TAM With Low Penetration Backs Sustained Growth,https://finance.yahoo.com/sectors/healthcare/articles/isrgs-rising-procedure-tam-low-175000526.html,0.8
2026-04-17 17:51:12+00:00,GILD,Insider Monkey,Citi Raises Gilead (GILD) Price Target Ahead of Q1 Biopharma Preview,https://finance.yahoo.com/sectors/healthcare/articles/citi-raises-gilead-gild-price-175112297.html,0.5
2026-04-17 17:58:24+00:00,AMGN,Insider Monkey,"UBS Sees Continued Upside in Amgen (AMGN), Lifts Target to $400",https://finance.yahoo.com/sectors/healthcare/articles/ubs-sees-continued-upside-amgen-175824718.html,0.8
2026-04-17 18:05:18+00:00,ABNB,Simply Wall St.,Airbnb (ABNB) Valuation Check As Steady Share Price Momentum Meets Conflicting Fair Value Signals,https://finance.yahoo.com/markets/stocks/articles/airbnb-abnb-valuation-check-steady-180518673.html,0.1
2026-04-17 18:16:26+00:00,DASH,StockStory,3 Reasons We’re Fans of DoorDash (DASH),https://finance.yahoo.com/markets/stocks/articles/3-reasons-fans-doordash-dash-181626137.html,0.5
2026-04-17 18:20:56+00:00,BKR,Oilprice.com,"US Oil, Gas Drilling Activity Slows",https://finance.yahoo.com/sectors/energy/articles/us-oil-gas-drilling-activity-182056523.html,-0.5
2026-04-17 18:23:09+00:00,ZS,Barchart,A Key Cybersecurity CEO Says ‘We Must Fight AI With AI’ as Software Stocks Keep Selling Off. Are We Missing the Bigger Picture With Cyber Stocks?,https://finance.yahoo.com/sectors/technology/articles/key-cybersecurity-ceo-says-must-182309260.html,0.2
2026-04-17 18:29:09+00:00,STX,GuruFocus.com,Seagate Added To Positive Catalyst Watch As Price Target Raised To $600,https://finance.yahoo.com/markets/stocks/articles/seagate-added-positive-catalyst-watch-182909025.html,0.8
2026-04-17 18:32:38+00:00,PYPL,GuruFocus.com,Why PayPal Stock Popped Today,https://finance.yahoo.com/markets/stocks/articles/why-paypal-stock-popped-today-183238460.html,0.5
2026-04-17 18:40:26+00:00,TXN,StockStory,3 Overrated  Stocks We Keep Off Our Radar,https://finance.yahoo.com/markets/stocks/articles/3-overrated-stocks-keep-off-184026872.html,-0.5
2026-04-17 18:43:00+00:00,ADBE,Motley Fool,Adobe's Stock Hasn't Been This Cheap in Years. Here's Whether to Buy Now.,https://finance.yahoo.com/markets/stocks/articles/adobes-stock-hasnt-cheap-years-184300793.html,0.5
2026-04-17 18:50:29+00:00,MELI,Motley Fool,"Sara-Bay Financial Makes Big Bet on MercadoLibre, Adds $12 Million Worth of Stock",https://finance.yahoo.com/markets/stocks/articles/sara-bay-financial-makes-big-185029915.html,0.8
2026-04-17 18:53:05+00:00,MELI,Motley Fool,Why This $59 Million MercadoLibre Buy Follows a 12% Stock Drop,https://finance.yahoo.com/markets/stocks/articles/why-59-million-mercadolibre-buy-185305867.html,-0.5
2026-04-17 18:56:13+00:00,AMD,Investopedia,Oracle—and Other Beaten-Down Tech Stocks—Surge in Latest Market Rally,https://finance.yahoo.com/sectors/technology/articles/oracle-other-beaten-down-tech-185613346.html,0.6
2026-04-17 19:05:33+00:00,ALNY,Simply Wall St.,A Look At Alnylam Pharmaceuticals (ALNY) Valuation After Recent Choppy Trading And Rich P/E Multiple,https://finance.yahoo.com/markets/stocks/articles/look-alnylam-pharmaceuticals-alny-valuation-190533526.html,0.1
2026-04-17 19:31:02+00:00,PYPL,Benzinga,Joe Lonsdale Was Once Rejected For A PayPal Internship After An 'Argument' With Max Levchin — Here's How The Palantir Co-Founder Bounced Back,https://finance.yahoo.com/markets/stocks/articles/joe-lonsdale-once-rejected-paypal-193102648.html,0.5
2026-04-17 20:04:07+00:00,TXN,24/7 Wall St.,This Hedge Fund-Favored Semi Stock is on the Cusp of a Multi-Year Breakout,https://finance.yahoo.com/markets/stocks/articles/hedge-fund-favored-semi-stock-200407204.html,0.8
2026-04-17 20:05:12+00:00,CMCSA,Simply Wall St.,How The Comcast (CMCSA) Investment Story Is Shifting With New Competition And Analyst Revisions,https://finance.yahoo.com/markets/stocks/articles/comcast-cmcsa-investment-story-shifting-200512077.html,0.2
2026-04-17 20:11:35+00:00,PEP,Nation's Restaurant News,Marriott to switch from Pepsi to Coke,https://finance.yahoo.com/sectors/technology/articles/marriott-switch-pepsi-coke-201135807.html,0.5
2026-04-17 20:14:47+00:00,FAST,reddit.com/r/stocks,"Beginning of Inflection point for Reddit - Opportunity Summary - I'm a relatively new Reddit user (8 months), and have broken through to find great value in the platform. I've been buying Reddit shares for the past month and its now 6% of my equity portfolio, and wanted to summarize the opportunity I see and see what the community thinks. I think the authenticity on Reddit is real, human connection and insight will be more",,0.8
2026-04-17 20:16:37+00:00,COST,Motley Fool,Asset Advisors Investment Management Expands Stake in iShares iBonds Dec 2029 Treasury ETF,https://finance.yahoo.com/markets/options/articles/asset-advisors-investment-management-expands-201637517.html,0.5
2026-04-17 20:25:00+00:00,AMD,Motley Fool,Will Intel (INTC) Stock Drop to $50?,https://finance.yahoo.com/markets/stocks/articles/intel-intc-stock-drop-50-202500880.html,-0.5
2026-04-17 20:52:43+00:00,SNDK,Yahoo Finance,Allbirds stock gains 350% this week as shoemaker pivots to AI,https://finance.yahoo.com/news/allbirds-stock-gains-350-this-week-as-shoemaker-pivots-to-ai-205243380.html,0.6
2026-04-17 20:55:00+00:00,WBD,Zacks,Is the Post-Earnings Dip in Netflix Stock Overdone?,https://finance.yahoo.com/markets/stocks/articles/post-earnings-dip-netflix-stock-205500983.html,0.2
2026-04-17 20:55:51+00:00,ADSK,Insider Monkey,Globant S.A. (GLOB) Gets Named As an Autodesk Tandem Digital Twin Solution Provider,https://finance.yahoo.com/markets/stocks/articles/globant-glob-gets-named-autodesk-205551892.html,0.5
2026-04-17 20:57:05+00:00,WBD,Yahoo Finance,"Netflix stock slides as forecast misses, co-founder Reed Hastings announces departure from board",https://finance.yahoo.com/news/netflix-stock-slides-as-forecast-misses-co-founder-reed-hastings-announces-departure-from-board-215534384.html,-0.7
2026-04-17 21:06:01+00:00,PYPL,Simply Wall St.,Venmo Stash Rewards Expansion Tests PayPal’s Branded Payments Recovery Narrative,https://finance.yahoo.com/markets/stocks/articles/venmo-stash-rewards-expansion-tests-210601698.html,0.2
2026-04-17 21:10:35+00:00,WBD,Motley Fool,"Stock Market Today, April 17: Netflix Drops As Reed Hastings Departs From Board and Company Offers Soft Guidance",https://finance.yahoo.com/markets/stocks/articles/stock-market-today-april-17-211035749.html,-0.7
2026-04-17 21:15:23+00:00,CEG,Insider Monkey,Constellation Energy (CEG) Asserts Dominance on Clean Energy with Calvert Cliffs Clean Energy Upgrades,https://finance.yahoo.com/sectors/energy/articles/constellation-energy-ceg-asserts-dominance-211523753.html,0.8
2026-04-17 21:16:00+00:00,APP,Zacks,"Top Analyst Reports for Microsoft, AbbVie & BHP",https://finance.yahoo.com/markets/stocks/articles/top-analyst-reports-microsoft-abbvie-211600816.html,0.0
2026-04-17 21:16:34+00:00,XEL,Insider Monkey,This Is Why Xcel Energy (XEL) Outlook Is Positive As a Top Utility Investment Play,https://finance.yahoo.com/sectors/energy/articles/why-xcel-energy-xel-outlook-211634919.html,0.8
2026-04-17 21:19:26+00:00,EXC,Insider Monkey,Exelon Corporation (EXC) A Top Utility Stock Projecting Robust Growth,https://finance.yahoo.com/sectors/energy/articles/exelon-corporation-exc-top-utility-211926401.html,0.8
2026-04-17 21:28:14+00:00,HON,Insider Monkey,Honeywell International Inc. (HON): One of the Best Military Drone Stocks to Buy Right Now,https://finance.yahoo.com/markets/stocks/articles/honeywell-international-inc-hon-one-212814840.html,0.8
2026-04-17 21:45:02+00:00,PYPL,Zacks,Paypal (PYPL) Outpaces Stock Market Gains: What You Should Know,https://finance.yahoo.com/markets/stocks/articles/paypal-pypl-outpaces-stock-market-214502461.html,0.5
2026-04-17 21:45:02+00:00,COST,Zacks,Costco (COST) Exceeds Market Returns: Some Facts to Consider,https://finance.yahoo.com/markets/stocks/articles/costco-cost-exceeds-market-returns-214502967.html,0.5
2026-04-17 21:45:03+00:00,SNPS,Zacks,Synopsys (SNPS) Beats Stock Market Upswing: What Investors Need to Know,https://finance.yahoo.com/markets/stocks/articles/synopsys-snps-beats-stock-market-214503224.html,0.5
2026-04-17 21:45:03+00:00,ADBE,Zacks,Adobe Systems (ADBE) Stock Declines While Market Improves: Some Information for Investors,https://finance.yahoo.com/markets/stocks/articles/adobe-systems-adbe-stock-declines-214503457.html,-0.5
2026-04-17 21:45:04+00:00,APP,Zacks,AppLovin (APP) Rises Higher Than Market: Key Facts,https://finance.yahoo.com/markets/stocks/articles/applovin-app-rises-higher-market-214504097.html,0.5
2026-04-17 21:45:04+00:00,INTU,Zacks,Intuit (INTU) Outperforms Broader Market: What You Need to Know,https://finance.yahoo.com/markets/stocks/articles/intuit-intu-outperforms-broader-market-214504941.html,0.5
2026-04-17 21:50:02+00:00,AMGN,Zacks,Amgen (AMGN) Laps the Stock Market: Here's Why,https://finance.yahoo.com/markets/stocks/articles/amgen-amgn-laps-stock-market-215002941.html,0.5
2026-04-17 21:50:04+00:00,VRTX,Zacks,Vertex Pharmaceuticals (VRTX) Beats Stock Market Upswing: What Investors Need to Know,https://finance.yahoo.com/markets/stocks/articles/vertex-pharmaceuticals-vrtx-beats-stock-215004280.html,0.5
2026-04-17 21:50:04+00:00,CDNS,Zacks,Cadence Design Systems (CDNS) Beats Stock Market Upswing: What Investors Need to Know,https://finance.yahoo.com/markets/stocks/articles/cadence-design-systems-cdns-beats-215004884.html,0.5
2026-04-17 21:50:04+00:00,WDC,Zacks,Why Western Digital (WDC) Outpaced the Stock Market Today,https://finance.yahoo.com/markets/stocks/articles/why-western-digital-wdc-outpaced-215004663.html,0.5
2026-04-17 22:00:02+00:00,ROST,Zacks,Why Ross Stores (ROST) Outpaced the Stock Market Today,https://finance.yahoo.com/markets/stocks/articles/why-ross-stores-rost-outpaced-220002635.html,0.5
2026-04-17 22:04:32+00:00,PYPL,Simply Wall St.,A Look At PayPal Holdings (PYPL) Valuation As Activist Interest And Downgrade Concerns Grow,https://finance.yahoo.com/markets/stocks/articles/look-paypal-holdings-pypl-valuation-220432129.html,0.1
2026-04-17 22:24:00+00:00,TXN,Zacks,Earnings Outlook Remains Very Strong: A Closer Look,https://finance.yahoo.com/markets/stocks/articles/earnings-outlook-remains-very-strong-222400940.html,0.8
2026-04-17 23:05:00+00:00,AMD,Motley Fool,I Sold My Warner Bros. Shares and Bought These 2 Growth Stocks Instead. The AI Supercycle Made It Obvious.,https://finance.yahoo.com/markets/stocks/articles/sold-warner-bros-shares-bought-230500163.html,0.5
2026-04-17 23:05:39+00:00,TXN,Simply Wall St.,Texas Instruments Nvidia Robotics Partnership Puts Valuation And Growth In Focus,https://finance.yahoo.com/markets/stocks/articles/texas-instruments-nvidia-robotics-partnership-230539599.html,0.5
2026-04-17 23:15:00+00:00,CSCO,Zacks,What Stock Will be the Next 1990s Cisco?,https://finance.yahoo.com/markets/stocks/articles/stock-next-1990s-cisco-231500805.html,0.5
2026-04-17 23:20:26+00:00,LRCX,StockStory,2 S&P 500 Stocks Worth Your Attention and 1 We Ignore,https://finance.yahoo.com/markets/stocks/articles/2-p-500-stocks-worth-232026785.html,0.0
2026-04-18 00:15:28+00:00,ADBE,Simply Wall St.,Adobe AI Push With Firefly And Partners Prompts Fresh Valuation Look,https://finance.yahoo.com/markets/stocks/articles/adobe-ai-push-firefly-partners-001528894.html,0.5
2026-04-18 00:17:19+00:00,FAST,Simply Wall St.,Is Fastenal’s (FAST) Margin Squeeze Rewriting the Narrative on Its Digital and FMI Strategy?,https://finance.yahoo.com/markets/stocks/articles/fastenal-fast-margin-squeeze-rewriting-001719453.html,0.2
2026-04-18 01:10:21+00:00,CMCSA,Simply Wall St.,Comcast Links AI Ad Targeting And Broadband Expansion To Valuation Story,https://finance.yahoo.com/markets/stocks/articles/comcast-links-ai-ad-targeting-011021812.html,0.2
2026-04-18 01:20:26+00:00,HON,StockStory,3 Unpopular Stocks We Approach with Caution,https://finance.yahoo.com/markets/stocks/articles/3-unpopular-stocks-approach-caution-012026329.html,-0.5
2026-04-18 01:28:57+00:00,STX,Insider Monkey,"JPMorgan Raises Amphenol (APH) Target Ahead of Q1, Sees AI Infrastructure Upside",https://finance.yahoo.com/markets/stocks/articles/jpmorgan-raises-amphenol-aph-target-012857157.html,0.6
2026-04-18 01:38:21+00:00,BKNG,Insider Monkey,B. Riley Resets Booking (BKNG) PT after Split; Tigress Financial Raises Target on AI Momentum,https://finance.yahoo.com/markets/stocks/articles/b-riley-resets-booking-bkng-013821894.html,0.5
2026-04-18 02:08:30+00:00,PEP,Simply Wall St.,PepsiCo (PEP) Valuation Check After Earnings Beat And Snack Price Cuts Fuel Volume Recovery,https://finance.yahoo.com/markets/stocks/articles/pepsico-pep-valuation-check-earnings-020830123.html,0.6
2026-04-18 02:46:17+00:00,VRTX,Insider Monkey,Morgan Stanley Lifts Vertex Pharmaceuticals (VRTX) PT on Updated Biopharma Models,https://finance.yahoo.com/sectors/healthcare/articles/morgan-stanley-lifts-vertex-pharmaceuticals-024617296.html,0.5
2026-04-18 02:48:56+00:00,SHOP,Insider Monkey,"Wells Fargo Trims Shopify (SHOP) Target, Remains Bullish on Long-Term AI Commerce Potential",https://finance.yahoo.com/markets/stocks/articles/wells-fargo-trims-shopify-shop-024856414.html,0.6
2026-04-18 03:09:14+00:00,MCHP,Simply Wall St.,Is It Too Late To Consider Microchip Technology (MCHP) After A 110% One Year Surge?,https://finance.yahoo.com/markets/stocks/articles/too-consider-microchip-technology-mchp-030914709.html,0.2
2026-04-18 03:12:26+00:00,FANG,StockStory,"Diamondback Energy and Riley Exploration Permian Stocks Trade Down, What You Need To Know",https://finance.yahoo.com/sectors/energy/articles/diamondback-energy-riley-exploration-permian-031226283.html,-0.5
2026-04-18 03:58:34+00:00,AXON,Barchart,Axon Enterprise’s Q1 2O26 Earnings: What to Expect,https://finance.yahoo.com/markets/stocks/articles/axon-enterprise-q1-2o26-earnings-035834846.html,0.0
2026-04-18 04:18:37+00:00,FAST,reddit.com/r/stocks,"Is AI’s real impact on stocks about margin expansion, not revenue growth? Looking for flaws in this thesis. - I’ve been thinking through what’s actually holding the market back right now, and I want to pressure test this with people who think critically about macro, earnings, and second-order effects. My current view is that a big piece of market hesitation has been geopolitical risk plus uncertainty around how AI actually translates into broad public-market earnings.",,0.2
2026-04-18 04:19:29+00:00,ASML,Simply Wall St.,Assessing ASML (ENXTAM:ASML) Valuation After Q1 Beat Guidance Hike And China Export Headwinds,https://finance.yahoo.com/markets/stocks/articles/assessing-asml-enxtam-asml-valuation-041929114.html,0.2
2026-04-18 05:04:21+00:00,IDXX,Simply Wall St.,Is It Too Late To Consider IDEXX Laboratories (IDXX) After A 43% One Year Rally?,https://finance.yahoo.com/markets/stocks/articles/too-consider-idexx-laboratories-idxx-050421847.html,0.1
