timestamp,ticker,source,text,url,SentimentScore
2026-03-21 21:11:27+00:00,MELI,Insider Monkey,"Is MercadoLibre, Inc. (MELI) A Good Stock To Buy Now?",https://finance.yahoo.com/markets/stocks/articles/mercadolibre-inc-meli-good-stock-211127196.html,0.5
2026-03-21 21:34:00+00:00,MRVL,Motley Fool,Better Semiconductor Stock: Broadcom vs. Marvell Technology,https://finance.yahoo.com/markets/stocks/articles/better-semiconductor-stock-broadcom-vs-213400329.html,0.5
2026-03-21 22:05:28+00:00,ROST,Simply Wall St.,Did Ross Stores' (ROST) 2026 Store Push and Donations Just Reframe Its Off-Price Narrative?,https://finance.yahoo.com/markets/stocks/articles/did-ross-stores-rost-2026-220528544.html,0.2
2026-03-21 22:25:00+00:00,CEG,Motley Fool,This Nuclear Energy Trend Could Be Bigger Than Investors Think in 2026,https://finance.yahoo.com/sectors/energy/articles/nuclear-energy-trend-could-bigger-222500627.html,0.5
2026-03-21 22:56:00+00:00,KHC,Business Wire,"Kraft Hockeyville Reveals Taber, AB and Tumbler Ridge, BC as Top Two Finalists in 20th Anniversary Year",https://finance.yahoo.com/sectors/technology/articles/kraft-hockeyville-reveals-taber-ab-225600101.html,0.5
2026-03-21 23:04:54+00:00,MPWR,Simply Wall St.,Is It Too Late To Consider Monolithic Power Systems (MPWR) After Its 82% One Year Surge?,https://finance.yahoo.com/markets/stocks/articles/too-consider-monolithic-power-systems-230454654.html,0.2
2026-03-21 23:33:55+00:00,INSM,Motley Fool,This $116 Million Buy Joins a 360% Stock Run and Seemingly Signals Conviction in a Key Drug Launch,https://finance.yahoo.com/sectors/healthcare/articles/116-million-buy-joins-360-233355944.html,0.8
2026-03-21 23:39:42+00:00,INSM,Motley Fool,This New $193 Million Bet Targets a Biotech With $689 Million in Revenue and a Potential Turnaround Story,https://finance.yahoo.com/sectors/healthcare/articles/193-million-bet-targets-biotech-233942111.html,0.8
2026-03-22 01:04:42+00:00,WDC,Simply Wall St.,Western Digital Books HDD Capacity Through 2026 On AI Data Center Demand,https://finance.yahoo.com/markets/stocks/articles/western-digital-books-hdd-capacity-010442794.html,0.2
2026-03-22 02:41:00+00:00,ZS,Motley Fool,Better Cybersecurity Stock: Okta vs. Zscaler,https://finance.yahoo.com/markets/stocks/articles/better-cybersecurity-stock-okta-vs-024100134.html,0.5
2026-03-22 03:05:00+00:00,WDC,Motley Fool,"Could Buying $10,000 of Sandisk Make You a Millionaire?",https://finance.yahoo.com/markets/stocks/articles/could-buying-10-000-sandisk-030500214.html,0.5
2026-03-22 03:07:42+00:00,KHC,Simply Wall St.,Could Kraft Heinz’s NFL Push and Healthier Mac & Cheese Redefine Its Brand Narrative for KHC?,https://finance.yahoo.com/markets/stocks/articles/could-kraft-heinz-nfl-push-030742844.html,0.2
2026-03-22 03:09:09+00:00,DASH,Simply Wall St.,Is It Time To Reassess DoorDash (DASH) After Recent Share Price Weakness,https://finance.yahoo.com/markets/stocks/articles/time-reassess-doordash-dash-recent-030909320.html,0.2
2026-03-22 04:03:00+00:00,SBUX,TheStreet,McDonald's latest menu missteps could have a major domino effect,https://finance.yahoo.com/sectors/healthcare/articles/mcdonalds-latest-menu-missteps-could-040300930.html,-0.6
2026-03-22 05:04:54+00:00,CEG,Simply Wall St.,Constellation Energy Vote Tests Investor Expectations On DEI And Governance,https://finance.yahoo.com/markets/stocks/articles/constellation-energy-vote-tests-investor-050454116.html,0.2
2026-03-22 06:06:17+00:00,KHC,Simply Wall St.,How The Kraft Heinz (KHC) Investment Story Is Shifting As Analysts Rework Expectations,https://finance.yahoo.com/markets/stocks/articles/kraft-heinz-khc-investment-story-060617907.html,0.2
2026-03-22 06:25:00+00:00,FANG,Motley Fool,Top Stocks to Double Up on Right Now,https://finance.yahoo.com/markets/stocks/articles/top-stocks-double-now-062500610.html,0.5
2026-03-22 07:17:00+00:00,MELI,Motley Fool,3 Latin American Fintechs That Are Growing Faster Than You Think,https://finance.yahoo.com/markets/stocks/articles/3-latin-american-fintechs-growing-071700154.html,0.5
2026-03-22 07:35:00+00:00,AXON,Motley Fool,2 Tech Stocks That Could Help Make You a Fortune,https://finance.yahoo.com/markets/stocks/articles/2-tech-stocks-could-help-073500661.html,0.5
2026-03-22 08:00:00+00:00,ADBE,Fortune,Meet the CFO who turned Adobe’s finance department into an AI lab,https://finance.yahoo.com/sectors/technology/articles/meet-cfo-turned-adobe-finance-080000648.html,0.5
2026-03-22 08:03:20+00:00,TMUS,Simply Wall St.,Credit Acceptance Taps New Chief Business Officer As Valuation Questions Linger,https://finance.yahoo.com/markets/stocks/articles/credit-acceptance-taps-chief-business-080320497.html,-0.5
2026-03-22 10:01:02+00:00,ADBE,Benzinga,"Salesforce, Adobe Stocks Face 2008-Style Collapse In 'SaaSpocalypse'",https://finance.yahoo.com/markets/stocks/articles/salesforce-adobe-stocks-face-2008-100102561.html,-0.6
2026-03-22 10:23:41+00:00,PDD,Investing.com,Beijing vows broader market access as goods trade surplus hits record levels,https://finance.yahoo.com/economy/policy/articles/beijing-vows-broader-market-access-102341457.html,0.5
2026-03-22 11:06:12+00:00,KLAC,Simply Wall St.,Does KLA (KLAC) Turbocharged Buyback Signal Durable Cash Strength Or Fewer Reinvestment Opportunities?,https://finance.yahoo.com/markets/stocks/articles/does-kla-klac-turbocharged-buyback-110612582.html,0.1
2026-03-22 12:02:01+00:00,MAR,MarketBeat,"SKYX Platforms Highlights Plug-and-Play Smart Ceiling Tech, Pushes for Mandatory WSCR Code Status",https://finance.yahoo.com/markets/stocks/articles/skyx-platforms-highlights-plug-play-120201342.html,0.5
2026-03-22 12:11:00+00:00,INTU,MarketBeat,Circle May Be the Biggest Winner of America’s Stablecoin Shift,https://finance.yahoo.com/markets/crypto/articles/circle-may-biggest-winner-america-121100269.html,0.8
2026-03-22 13:05:27+00:00,PDD,Simply Wall St.,A Look At PDD Holdings (PDD) Valuation After Recent Share Weakness And Q3 2024 Results,https://finance.yahoo.com/markets/stocks/articles/look-pdd-holdings-pdd-valuation-130527973.html,0.2
2026-03-22 14:58:34+00:00,TEAM,Moneywise,Uber CEO says other execs are lying about AI: 'They say it'll be fine' but privately admit millions of jobs are gone,https://finance.yahoo.com/sectors/technology/articles/uber-ceo-says-other-execs-145834132.html,-0.8
2026-03-22 16:02:53+00:00,ORLY,reddit.com/r/stocks,"What will you invest in next paycheck? - With the war, tariffs, inflation, no rate cut, AI Capex and so many other things going on, what are you thinking of investing in next paycheck? This question is, I guess, more for those who invest in individual stocks, since the answer for the VTI/VOO and chill crowd is always the same. ======================== Obviously markets are down in March but not as much as I expected. I’m",,0.1
2026-03-22 16:05:07+00:00,SHOP,Simply Wall St.,Assessing Shopify (SHOP) Valuation After Recent Share Price Weakness And AI Feature Rollout,https://finance.yahoo.com/markets/stocks/articles/assessing-shopify-shop-valuation-recent-160507213.html,0.2
2026-03-22 16:06:38+00:00,VRSK,Simply Wall St.,Assessing Verisk Analytics (VRSK) Valuation After A Mixed Period For Shareholder Returns,https://finance.yahoo.com/markets/stocks/articles/assessing-verisk-analytics-vrsk-valuation-160638487.html,0.1
2026-03-22 16:22:00+00:00,PANW,Motley Fool,Is Palo Alto Networks Stock a Buy Now?,https://finance.yahoo.com/markets/stocks/articles/palo-alto-networks-stock-buy-162200881.html,0.2
2026-03-22 17:06:04+00:00,APP,Simply Wall St.,AppLovin Expands Axon AI As Investors Weigh Broader Growth Potential,https://finance.yahoo.com/markets/stocks/articles/applovin-expands-axon-ai-investors-170604109.html,0.5
2026-03-22 18:01:56+00:00,DXCM,MarketBeat,"Tandem Diabetes Care Maps Pharmacy Shift, Targets 65% Gross Margin and 2026 Mobi Tubeless Launch",https://finance.yahoo.com/sectors/healthcare/articles/tandem-diabetes-care-maps-pharmacy-180156337.html,0.5
2026-03-22 18:19:58+00:00,XEL,Motley Fool,Littelfuse Stock Climbs 22% YTD After $3.8 Million Trim in Volatile Run,https://finance.yahoo.com/markets/stocks/articles/littelfuse-stock-climbs-22-ytd-181958347.html,0.6
2026-03-22 19:03:59+00:00,VRTX,Simply Wall St.,How Vertex’s IgA Nephropathy Data and Accelerated FDA Pathway At Vertex Pharmaceuticals (VRTX) Has Changed Its Investment Story,https://finance.yahoo.com/sectors/healthcare/articles/vertex-iga-nephropathy-data-accelerated-190359367.html,0.2
2026-03-22 19:04:08+00:00,ZS,Simply Wall St.,A Look At Zscaler (ZS) Valuation After Recent Share Price Weakness,https://finance.yahoo.com/markets/stocks/articles/look-zscaler-zs-valuation-recent-190408655.html,0.2
2026-03-22 19:05:49+00:00,NXPI,Simply Wall St.,NXP’s New i.MX 93W Highlights Edge AI Potential And Valuation Gap,https://finance.yahoo.com/markets/stocks/articles/nxp-mx-93w-highlights-edge-190549381.html,0.6
2026-03-22 19:35:00+00:00,COST,Motley Fool,Will Beyond Meat's Move From Fridge to Freezer at Walmart and Costco Help or Hurt the Stock?,https://finance.yahoo.com/markets/stocks/articles/beyond-meats-move-fridge-freezer-193500877.html,0.2
2026-03-22 19:49:07+00:00,MELI,Insider Monkey,MercadoLibre Inc. (MELI) Positioned for E-commerce Growth Despite Downgrade on Competition Concerns,https://finance.yahoo.com/markets/stocks/articles/mercadolibre-inc-meli-positioned-e-165307096.html,0.2
2026-03-22 19:55:11+00:00,APP,Insider Monkey,Stagwell Taps AppLovin Corporation (APP) Mobile Advertising Platform,https://finance.yahoo.com/markets/stocks/articles/stagwell-taps-applovin-corporation-app-165311165.html,0.5
2026-03-22 19:59:14+00:00,MRVL,Insider Monkey,Marvell Technology (MRVL) Unveils Advanced Switch for AI Data Center Scale-Up Infrastructure,https://finance.yahoo.com/sectors/technology/articles/marvell-technology-inc-mrvl-unveils-165314179.html,0.6
2026-03-22 20:03:14+00:00,REGN,Simply Wall St.,How The Regeneron (REGN) Story Is Shifting As Dupixent And Pipeline Expectations Reset,https://finance.yahoo.com/sectors/healthcare/articles/regeneron-regn-story-shifting-dupixent-200314610.html,0.2
2026-03-22 20:04:20+00:00,LRCX,Insider Monkey,Is Lam Research Corporation (LRCX) Eyeing Besi Industries Merger Amid IBM Pact for Logic Scaling,https://finance.yahoo.com/markets/stocks/articles/lam-research-corporation-lrcx-eyeing-165320856.html,0.2
2026-03-22 21:05:37+00:00,ZS,Simply Wall St.,Zscaler Data Sovereignty Expansion And Valuation Gap Draw Investor Focus,https://finance.yahoo.com/markets/stocks/articles/zscaler-data-sovereignty-expansion-valuation-210537580.html,0.5
2026-03-22 22:05:31+00:00,MRVL,Simply Wall St.,Do New AI Connectivity Launches and Dividend Plans Change The Bull Case For Marvell (MRVL)?,https://finance.yahoo.com/markets/stocks/articles/ai-connectivity-launches-dividend-plans-220531051.html,0.2
2026-03-23 00:00:00+00:00,PANW,SEC-EDGAR-8K,"(Item 8.01) . Other Events. Reference is made to that certain Indenture, dated as of June 10, 2025 (the “Base Indenture”), between CyberArk Software Ltd. (the “CyberArk”) and U.S. Bank Trust Company, National Association, as trustee (the “Trustee”), as amended, supplemented or otherwise modified from time, including by that certain First Supplemental Indenture, dated as of February 11, 2026 (the “Supplemental Indenture”), among the Company, the Trustee and Palo Alto Networks, Inc. (the “Indenture”), governing CyberArk’s 0.00%",,0.0
2026-03-23 00:00:00+00:00,INSM,SEC-EDGAR-8K,"(ITEM 8.01) — Other Events. On March 23, 2026 , the Company issued a press release announcing positive topline results from the ENCORE Study. Topline efficacy results from the ENCORE Study are as follows: ARIKAYCE 590 mg plus azithromycin 250 mg + ethambutol 15 mg/kg once-daily (N=213) Placebo plus azithromycin 250 mg + ethambutol 15 mg/kg once-daily (N=212) Treatment difference, p-value Primary Endpoint Change from Baseline in Respiratory Symptom Score at Month 13 17.77 points 14.66 points",,1.0
2026-03-23 00:00:00+00:00,HON,SEC-EDGAR-8K,"(Item 8.01) Other Events Honeywell Debt Tender Offers On March 20, 2026, Honeywell International Inc., a Delaware corporation (“Honeywell”), issued a press release announcing the results, as of 5:00 p.m., New York City time on March 19, 2026, of its previously announced tender offers to purchase for cash certain of the existing debt securities issued by Honeywell (the “Tender Offers”). A copy of that press release is attached as Exhibit 99.1 and incorporated by reference herein. In",,0.1
2026-03-23 00:00:00+00:00,MSTR,SEC-EDGAR-8K,"(Item 8.01) . Other Events. On March 23, 2026, Strategy Inc (the “ Company ”) entered into joinders with each of Moelis & Company LLC (“ Moelis ” and such joinder with Moelis the “ Moelis Joinder ”), A.G.P./Alliance Global Partners (“ Alliance ” and such joinder with Alliance the “ Alliance Joinder ”) and StoneX Financial Inc. (“ StoneX ” and such joinder with StoneX the “ StoneX Joinder ”), which added Moelis, Alliance and StoneX

(Item 1.01) . Entry into a Material Definitive Agreement. The information set forth in

(Item 8.01) of this Current Report on Form 8-K related to the Common Stock Sales Agreement Addendum, STRC Sales Agreement Addendum and STRK Sales Agreement Addendum is incorporated herein by reference.

(Item 8.01) of this Current Report on Form 8-K related to the termination of the prior offering of shares of STRK Preferred Stock under the Prior STRK Preferred Stock Prospectus is incorporated herein by reference.",,0.1
2026-03-23 00:00:00+00:00,MSTR,SEC-EDGAR-8K,"(Item 8.01) Other Events. ATM Update On March 23, 2026, Strategy Inc (""Strategy"") announced an update with respect to sales made under its at-the-market offering program (""ATM"") of the following securities: During Period March 16, 2026 to March 22, 2026 As of March 22, 2026 Security Shares Sold Notional Value (in millions) (1) Net Proceeds (in millions) (2) Available for Issuance and Sale (in millions) STRF Stock - $ - $ - $ 1,619.3 10.00% Series A",,0.1
2026-03-23 00:29:00+00:00,LIN,Proactive,Lindian brings Kangankunde closer to production with Tipume camp milestone,https://finance.yahoo.com/sectors/energy/articles/lindian-brings-kangankunde-closer-production-002900276.html,0.5
2026-03-23 01:00:00+00:00,BKNG,PR Newswire,Agoda Reveals 55% Increase in Hari Raya Accommodation Searches with Japan and China Among Top Searched Markets,https://finance.yahoo.com/markets/stocks/articles/agoda-reveals-55-increase-hari-010000694.html,0.5
2026-03-23 04:00:00+00:00,BKNG,PR Newswire,Agoda Curates Top Weekend Trip Destinations in Asia,https://finance.yahoo.com/markets/articles/agoda-curates-top-weekend-trip-040000946.html,0.5
2026-03-23 04:01:00+00:00,BKR,The Daily Upside,Baker Hughes Undergoes an AI Makeover,https://finance.yahoo.com/sectors/energy/articles/baker-hughes-undergoes-ai-makeover-040100856.html,0.5
2026-03-23 04:23:20+00:00,COST,Simply Wall St.,Costco Expands Member Offerings With Fertility Care And In Store Events,https://finance.yahoo.com/sectors/healthcare/articles/costco-expands-member-offerings-fertility-042320697.html,0.5
2026-03-23 05:01:00+00:00,ISRG,MoneyShow,"ISRG- Not Cheap, But Delivering on Growth Expectations",https://finance.yahoo.com/markets/stocks/articles/isrg-not-cheap-delivering-growth-050100210.html,0.5
2026-03-23 05:03:39+00:00,VRTX,Simply Wall St.,How The Vertex Pharmaceuticals (VRTX) Story Is Shifting Toward Nephrology And Beyond Cystic Fibrosis,https://finance.yahoo.com/sectors/healthcare/articles/vertex-pharmaceuticals-vrtx-story-shifting-050339855.html,0.2
2026-03-23 06:05:23+00:00,ADI,Simply Wall St.,A Look At Analog Devices (ADI) Valuation After Recent Share Price Volatility,https://finance.yahoo.com/markets/stocks/articles/look-analog-devices-adi-valuation-060523291.html,0.1
2026-03-23 06:48:13+00:00,ABNB,Euronews,Meet the co-founder of Airbnb: How a weekend scheme to pay the rent turned into an industry giant,https://finance.yahoo.com/economy/policy/articles/meet-co-founder-airbnb-weekend-054813476.html,0.8
2026-03-23 07:04:48+00:00,LRCX,Simply Wall St.,IBM Alliances Highlight Quantum And AI Upside For Undervalued Shares,https://finance.yahoo.com/markets/stocks/articles/ibm-alliances-highlight-quantum-ai-070448163.html,0.8
2026-03-23 08:07:00+00:00,ROP,The Wall Street Journal,"Roche Halts Development of Drug Candidate for Muscle Diseases, Chugai Says",https://www.wsj.com/health/pharma/roche-halts-development-of-drug-candidate-for-muscle-diseases-chugai-says-acabc236?siteid=yhoof2&yptr=yahoo,-0.5
2026-03-23 09:57:00+00:00,KLAC,Zacks,"The Zacks Analyst Blog Highlights NVIDIA, Caterpillar, KLA and Frequency Electronics",https://finance.yahoo.com/markets/stocks/articles/zacks-analyst-blog-highlights-nvidia-095700359.html,0.0
2026-03-23 09:57:47+00:00,PEP,24/7 Wall St.,Was Warren Buffett’s Coca-Cola Investment a Mistake?,https://finance.yahoo.com/markets/stocks/articles/warren-buffett-coca-cola-investment-095747108.html,-0.5
2026-03-23 10:00:16+00:00,CEG,Yahoo Finance Video,"Energy: What to watch at CERAWeek amid Iran war, rising oil prices",https://finance.yahoo.com/video/energy-watch-ceraweek-amid-iran-100016983.html,0.5
2026-03-23 10:00:47+00:00,DASH,Verdict Food Service,"DoorDash launches “Tasks”, adding paid gigs beyond delivery",https://finance.yahoo.com/sectors/technology/articles/doordash-launches-tasks-adding-paid-100047349.html,0.5
2026-03-23 10:01:00+00:00,ADBE,Zacks,The Zacks Analyst Blog Highlights Microsoft and Adobe,https://finance.yahoo.com/markets/stocks/articles/zacks-analyst-blog-highlights-microsoft-100100406.html,0.5
2026-03-23 10:05:16+00:00,PANW,Simply Wall St.,Is It Time To Reassess Palo Alto Networks (PANW) After Mixed Returns And Product Expansion News,https://finance.yahoo.com/markets/stocks/articles/time-reassess-palo-alto-networks-100516455.html,0.1
2026-03-23 10:16:00+00:00,INSM,BioPharma Dive,FDA seeks feedback on voucher program; Study data lift ‘overhang’ on Insmed shares,https://finance.yahoo.com/sectors/healthcare/articles/fda-seeks-feedback-voucher-program-101600205.html,0.5
2026-03-23 10:32:20+00:00,COST,reddit.com/r/stocks,"($BTU) Asia & Europe LNG Spot Surge, Qatar Production Cuts, LNG-to-coal Substitution Play - **The Basics** We are all aware Qatar now has a structural 17% hit on LNG exports, primarily with destination being SE Asia & Europe. As a result the regional European & Asian LNG spot prices have soared and many countries are actively shifting policies to allow thermal coal usage. With Europe being stricter on green energy, LNG substitution is more profound",,0.6
2026-03-23 10:39:23+00:00,DXCM,StockStory,2 Healthcare Stocks to Target This Week and 1 That Underwhelm,https://finance.yahoo.com/sectors/healthcare/articles/2-healthcare-stocks-target-week-103923325.html,0.2
2026-03-23 10:44:23+00:00,ODFL,StockStory,3 Profitable Stocks We Approach with Caution,https://finance.yahoo.com/markets/stocks/articles/3-profitable-stocks-approach-caution-104423179.html,-0.5
2026-03-23 10:46:32+00:00,WBD,MT Newswires,"Market Chatter: Google, Amazon, Apple Face EU 'Gatekeeper' Designation Push Over Smart TVs, Virtual Assistants",https://finance.yahoo.com/sectors/technology/articles/market-chatter-google-amazon-apple-104632785.html,0.1
2026-03-23 10:49:23+00:00,INTU,StockStory,3 of Wall Street’s Favorite Stocks with Exciting Potential,https://finance.yahoo.com/markets/stocks/articles/3-wall-street-favorite-stocks-104923560.html,0.6
2026-03-23 10:59:07+00:00,SBUX,Restaurant Dive,Starbucks challenged by labor-friendly activist investors,https://finance.yahoo.com/sectors/healthcare/articles/starbucks-challenged-labor-friendly-activist-105907024.html,-0.5
2026-03-23 10:59:23+00:00,KLAC,StockStory,1 Cash-Producing Stock on Our Buy List and 2 We Turn Down,https://finance.yahoo.com/markets/stocks/articles/1-cash-producing-stock-buy-105923386.html,0.2
2026-03-23 11:00:00+00:00,BKR,GlobeNewswire,ST LNG Selects Baker Hughes as Technology Provider for U.S. Offshore LNG Project,https://finance.yahoo.com/sectors/energy/articles/st-lng-selects-baker-hughes-110000022.html,0.5
2026-03-23 11:00:00+00:00,INSM,PR Newswire,Insmed Announces Positive Topline Results from Phase 3b ENCORE Study of ARIKAYCE® (Amikacin Liposome Inhalation Suspension) in Patients with MAC Lung Disease,https://finance.yahoo.com/sectors/healthcare/articles/insmed-announces-positive-topline-results-110000107.html,0.8
2026-03-23 11:01:00+00:00,CMCSA,Business Wire,FiscalNote Announces Strategic Partnership to Accelerate Generation and Monetization of Political Prediction Content,https://finance.yahoo.com/economy/policy/articles/fiscalnote-announces-strategic-partnership-accelerate-110100415.html,0.6
2026-03-23 11:08:27+00:00,ROST,LA Times,"As malls and department stores fade, California's Ross and other discounters are booming",https://finance.yahoo.com/economy/articles/many-shoppers-retailers-struggle-californias-110827680.html,0.6
2026-03-23 11:14:23+00:00,MELI,StockStory,1 of Wall Street’s Favorite Stock to Own for Decades and 2 We Brush Off,https://finance.yahoo.com/markets/stocks/articles/1-wall-street-favorite-stock-111423415.html,0.2
2026-03-23 11:29:23+00:00,BKNG,StockStory,1 Profitable Stock on Our Watchlist and 2 We Question,https://finance.yahoo.com/markets/stocks/articles/1-profitable-stock-watchlist-2-112923637.html,0.2
2026-03-23 11:29:42+00:00,PYPL,Insider Monkey,Here’s How PayPal Holdings (PYPL) Compounds the Value Over the Long Term,https://finance.yahoo.com/markets/stocks/articles/paypal-pypl-compounds-value-over-112942719.html,0.5
2026-03-23 11:30:00+00:00,ALNY,GlobeNewswire,Arbutus Reports Fourth Quarter and Year End 2025 Financial Results and Provides Corporate Update,https://finance.yahoo.com/sectors/healthcare/articles/arbutus-reports-fourth-quarter-end-113000299.html,0.0
2026-03-23 11:30:00+00:00,ADBE,Business Wire,Ford and Major League Baseball Unite to Celebrate America’s Pastime and the People Who Power It,https://finance.yahoo.com/sectors/technology/articles/ford-major-league-baseball-unite-113000230.html,0.6
2026-03-23 11:37:08+00:00,ADBE,Fortune,"Adobe’s CFO is using AI to answer 300,000 emails, cut contract review in half — and make sure finance never slows the company down",https://finance.yahoo.com/sectors/technology/articles/adobe-cfo-using-ai-answer-113708999.html,0.6
2026-03-23 11:39:23+00:00,CHTR,StockStory,3 Mid-Cap Stocks with Warning Signs,https://finance.yahoo.com/markets/stocks/articles/3-mid-cap-stocks-warning-113923327.html,-0.5
2026-03-23 11:39:23+00:00,KDP,StockStory,2 Consumer Stocks with Solid Fundamentals and 1 We Ignore,https://finance.yahoo.com/markets/stocks/articles/2-consumer-stocks-solid-fundamentals-113923178.html,0.5
2026-03-23 11:48:58+00:00,MPWR,Insider Monkey,Monolithic Power (MPWR) Gained as Its Blackwell Platform Fared Stronger,https://finance.yahoo.com/markets/stocks/articles/monolithic-power-mpwr-gained-blackwell-114858707.html,0.8
2026-03-23 11:53:27+00:00,SBUX,The Telegraph,Former labourer to make £400m from Huel sale,https://finance.yahoo.com/news/huel-founder-400m-sale-evian-115327982.html,0.5
2026-03-23 12:03:48+00:00,EA,Simply Wall St.,A Look At Electronic Arts (EA) Valuation As Shares Hover Near US$200 After Strong Multi Year Returns,https://finance.yahoo.com/markets/stocks/articles/look-electronic-arts-ea-valuation-120348803.html,0.6
2026-03-23 12:07:17+00:00,ROST,Insider Monkey,Ross Stores’ (ROST) Comparable Sales Grew 7% in Q4,https://finance.yahoo.com/markets/stocks/articles/ross-stores-rost-comparable-sales-120717591.html,0.8
2026-03-23 12:09:41+00:00,KHC,Just Food,Kraft Heinz to “upgrade” Canada plant,https://finance.yahoo.com/sectors/technology/articles/kraft-heinz-upgrade-canada-plant-120941757.html,0.5
2026-03-23 12:15:00+00:00,REGN,BioPharma Dive,Apogee strengthens case for longer-lasting eczema drug,https://finance.yahoo.com/sectors/healthcare/articles/apogee-strengthens-case-longer-lasting-121500798.html,0.6
2026-03-23 12:16:45+00:00,CTAS,MT Newswires,Stock Futures Rebound as Trump Announces Pause in Military Strikes on Iran Energy Infrastructure,https://finance.yahoo.com/markets/stocks/articles/stock-futures-rebound-trump-announces-121645541.html,0.8
2026-03-23 12:17:11+00:00,AXON,Insider Monkey,What Makes Axon (AXON) an Attractive Opportunity?,https://finance.yahoo.com/markets/stocks/articles/makes-axon-axon-attractive-opportunity-121711819.html,0.6
2026-03-23 12:30:02+00:00,ADSK,Zacks,Here's How Much a $1000 Investment in Autodesk Made 10 Years Ago Would Be Worth Today,https://finance.yahoo.com/markets/stocks/articles/heres-much-1000-investment-autodesk-123002892.html,0.5
2026-03-23 12:41:21+00:00,GEHC,Insider Monkey,Citi Reduces PT on GE HealthCare Technologies (GEHC) Stock,https://finance.yahoo.com/sectors/healthcare/articles/citi-reduces-pt-ge-healthcare-124121999.html,-0.5
2026-03-23 12:42:17+00:00,ADBE,Insider Monkey,Barclays Downgrades Adobe Inc. (ADBE) Stock to Equal Weight,https://finance.yahoo.com/markets/stocks/articles/barclays-downgrades-adobe-inc-adbe-124217640.html,-0.5
2026-03-23 12:44:55+00:00,EA,MT Newswires,Market Chatter: Electronic Arts Projects $700 Million in Annual Cost Savings to Attract Debt Investors,https://finance.yahoo.com/markets/stocks/articles/market-chatter-electronic-arts-projects-124455924.html,0.5
2026-03-23 13:00:00+00:00,DASH,Business Wire,Gas Price Relief For Dashers,https://finance.yahoo.com/sectors/energy/articles/gas-price-relief-dashers-130000316.html,0.5
2026-03-23 13:00:00+00:00,CSGP,Business Wire,Visual Lease Named 2026 GlobeSt. Influencer in CRE Technology,https://finance.yahoo.com/sectors/technology/articles/visual-lease-named-2026-globest-130000500.html,0.5
