timestamp,ticker,source,text,url,SentimentScore
2025-05-20 00:00:00+00:00,UPS,SEC-EDGAR-8K,"(Item 8.01) . Other Events. On May 15, 2025, the Company entered into an agreement (the “Underwriting Agreement”) with the underwriters listed on Schedule I thereto (the “Underwriters”), whereby the Company agreed to sell and the Underwriters agreed to purchase from the Company, subject to and upon the terms and conditions set forth in the Underwriting Agreement, $170,673,000 principal amount of Floating Rate Senior Notes due 2075 (the “Transaction”). The Company intends to use the net proceeds",,0.2
2025-05-20 00:00:00+00:00,AXP,SEC-EDGAR-8K,"(Item 8.01) Other Events. Exhibits are filed herewith in connection with the issuance by American Express Company (the “Company”), on May 20, 2025, of €1,000,000,000 aggregate principal amount of 3.433% Fixed-to-Floating Rate Notes due May 20, 2032 (the “Notes”) pursuant to a Prospectus Supplement dated May 13, 2025 to the Prospectus dated February 9, 2024, filed as part of the Company’s Registration Statement on Form S-3 (No. 333-276975). The Notes were issued under a senior indenture, dated",,0.1
2025-05-20 00:00:00+00:00,HD,SEC-EDGAR-8K,"(Item 2.02) . Results of Operations and Financial Condition. On May 20, 2025, The Home Depot, Inc. (the “Company”) issued a press release, attached as Exhibit 99.1 and incorporated herein by reference, announcing the Company’s financial results for the fiscal quarter ended May 4, 2025. The information contained in this

(Item 2.02) , including Exhibit 99.1 attached hereto, is being furnished and shall not be deemed filed for purposes of Section 18 of the Securities Exchange Act of 1934, as amended, or otherwise subject to the liabilities of Section 18. Furthermore, the information contained in this

(Item 2.02) and Exhibit 99.1 shall not be deemed to be incorporated by reference into any registration statement or other document filed pursuant to the Securities Act of 1933, as amended.",,0.0
2025-05-20 00:00:00+00:00,CVS,SEC-EDGAR-8K,"(Item 5.07) Submission of Matters to a Vote of Security Holders. The following are the voting results on each matter submitted to the stockholders of CVS Health Corporation (the “Company”) at the Annual Meeting of Stockholders held on May 15, 2025 (the “Annual Meeting”). The proposals below are described in detail in the proxy statement filed by the Company on April 4, 2025 (the “Proxy Statement”). There were present at the Annual Meeting, in person or by",,0.0
2025-05-21 00:00:00+00:00,MDT,SEC-EDGAR-8K,"(Item 2.02) . Results of Operations and Financial Condition On May 21, 2025, Medtronic plc, a public limited company organized under the laws of Ireland, issued a press release announcing its full year and fourth quarter fiscal year 2025 financial results. A copy of the Medtronic financial results press release is furnished as Exhibit 99.1 to this Current Report on Form 8-K.

(Item 5.02) Departure of Directors or Certain Officers; Election of Directors; Appointment of Certain Officers; Compensatory Arrangements of Certain Officers. As referenced in the press release furnished as Exhibit 99.1 to this Current Report on Form 8-K, the Company announced that Sean Salmon would be departing from his position as EVP and President, Cardiovascular Portfolio and Skip Kiil would be assuming the role of EVP and President, Cardiovascular Portfolio, effective May 21, 2025. Mr. Salmon will remain

(Item 8.01) . Other Events As described in the press release attached as Exhibit 99.2 to this Current Report on Form 8-K, on May 21, 2025, Medtronic announced its intent to separate its Diabetes business into a new standalone public company.",,0.1
2025-05-21 00:00:00+00:00,TGT,SEC-EDGAR-8K,"(Item 2.02) Results of Operations and Financial Condition . On May 21, 2025, Target Corporation issued a News Release containing its financial results for the three months ended May 3, 2025. The News Release is attached hereto as Exhibit 99.",,0.0
2025-05-21 00:00:00+00:00,UNH,SEC-EDGAR-8K,"(Item 5.02) . Departure of Directors or Certain Officers; Election of Directors; Appointment of Certain Officers; Compensatory Arrangements of Certain Officers. On May 20, 2025, the Board of Directors of UnitedHealth Group Incorporated (the “Company”) accepted Andrew Witty’s resignation as a director of the Company, effective immediately. Accordingly, Mr. Witty will not stand for re-election as a director in connection with the Company’s 2025 annual shareholder meeting to be held on June 2, 2025.",,-0.5
2025-05-21 00:00:00+00:00,CCI,SEC-EDGAR-8K,"(Item 5.07) below, at the 2025 annual meeting of stockholders (""Annual Meeting"") of Crown Castle Inc. (""Company""), the Company's stockholders approved the proposals to amend and restate the Company's Restated Certificate of Incorporation (""Charter"") to eliminate (1) all supermajority voting requirements and (2) certain unnecessary or outdated provisions set forth therein (collectively, ""Charter Amendments""). The Company's Board of Directors previously approved the Charter Amendments, subject to stockholder approval. The Charter Amendments became effective upon the filing of

(ITEM 5.07) —SUBMISSION OF MATTERS TO A VOTE OF SECURITY HOLDERS At the Annual Meeting held on May 21, 2025, the Company's stockholders (1) elected each of the nine nominees for director, to serve until the Company's next Annual Meeting and until their respective successors are duly elected and qualified, (2) ratified the appointment of PricewaterhouseCoopers LLP as the Company's independent registered public accountants for fiscal year 2025, (3) approved, on a non-binding, advisory basis, the compensation",,0.5
2025-05-22 00:00:00+00:00,TMO,SEC-EDGAR-8K,"(Item 5.02) Departure of Directors or Certain Officers; Election of Directors; Appointment of Certain Officers; Compensatory Arrangements of Certain Officers. On May 21, 2025, the Board of Directors (the “Board”) of Thermo Fisher Scientific Inc. (the “Company”), following a thorough evaluation, approved the grant of 5-year cliff vesting performance-based restricted stock units (the “Award”) to Marc N. Casper, the Company’s Chairman, President and Chief Executive Officer (“CEO”), to secure his continued leadership through at least May 2030,",,0.5
2025-05-22 00:00:00+00:00,ADSK,SEC-EDGAR-8K,"(Item 2.02) . Results of Operations and Financial Condition. On May 22, 2025, Autodesk, Inc. (“Autodesk” or the “Company”) issued a press release reporting financial results for the first fiscal quarter ended April 30, 2025. The press release is furnished herewith as Exhibit 99.1 and is incorporated herein by reference. The exhibit shall not be deemed “filed” for purposes of Section 18 of the Securities Exchange Act of 1934, as amended (the “Exchange Act”), or incorporated by

(Item 5.02) . Departure of Directors or Certain Officers; Election of Directors; Appointment of Certain Officers; Compensatory Arrangements of Certain Officers. On May 22, 2025, the Company announced that Stephen W. Hope, the Company’s Senior Vice President and Chief Accounting Officer, would step down as principal accounting officer following the filing of the Company’s quarterly report on Form 10-Q for the quarter ended April 30, 2025. At that time, Janesh Moorjani, the Company’s Chief Financial Officer and",,0.1
2025-05-22 00:00:00+00:00,QCOM,SEC-EDGAR-8K,"(Item 1.01) . Entry into a Material Definitive Agreement. On May 21, 2025, QUALCOMM Incorporated (the Company) executed an Officers’ Certificate (the Officers’ Certificate), in accordance with Sections 2.02, 2.03, 10.04 and 10.05 of the Indenture dated May 20, 2015 (the Base Indenture and, together with the Officers’ Certificate, the Indenture) between the Company and U.S. Bank Trust Company, National Association (as successor in interest to U.S. Bank National Association), as trustee (the Trustee), in connection with

(Item 8.01) . Other Events. On May 19, 2025, the Company entered into an underwriting agreement (the Underwriting Agreement) with J.P. Morgan Securities LLC, BofA Securities, Inc., Barclays Capital Inc., Goldman Sachs & Co. LLC and Morgan Stanley & Co. LLC, on behalf of the several Underwriters listed in Schedule I thereto (the Underwriters), pursuant to which the Company agreed to issue and sell the Notes to the Underwriters in a registered public offering (the Offering). The",,0.1
2025-05-22 00:00:00+00:00,ADI,SEC-EDGAR-8K,"(Item 2.02) . Results of Operations and Financial Condition On May 22, 2025, Analog Devices, Inc. (the “Registrant”) announced its financial results for its fiscal second quarter ended May 3, 2025. The full text of the press release issued by the Registrant concerning the foregoing results is furnished herewith as Exhibit 99.1. The information in this

(Item 2.02) and in the accompanying Exhibit 99.1 shall not be incorporated by reference into any filing of the Registrant, whether made before or after the date hereof, regardless of any general incorporation language in such filing, unless expressly incorporated by specific reference to such filing. The information in this

(Item 2.02) , including Exhibit 99.1, shall not be deemed to be “filed” for purposes of Section 18 of the Securities Exchange Act of 1934, as amended, or otherwise subject to the liabilities of that section or Sections 11 and 12(a)(2) of the Securities Act of 1933, as amended.",,0.0
2025-05-22 00:00:00+00:00,ZTS,SEC-EDGAR-8K,"(Item 5.02) Departure of Directors or Certain Officers; Election of Directors; Appointment of Certain Officers; Compensatory Arrangements of Certain Officers. Effective May 21, 2025, Mr. Robert Scully retired from the Board of Directors of Zoetis Inc. (the “Company”), prior to the Company’s 2025 Annual Meeting of Shareholders (the “Annual Meeting”) in accordance with the Company’s director retirement policy. Effective May 21, 2025, Dr. Mark Stetter was elected to the Board of Directors of the company at the

(Item 5.07) . Submission of Matters to a Vote of Security Holders. As discussed under

(Item 5.02) of this Current Report on Form 8-K, on May 21, 2025, the Company held the Annual Meeting. At the Annual Meeting, the Company’s shareholders voted on four proposals, each of which is described in more detail in the Company’s definitive proxy statement filed with the Securities and Exchange Commission on April 9, 2025 (the “Proxy Statement”). There were 392,890,991 shares of common stock present at the Annual Meeting in person or by proxy, which represented",,0.1
2025-05-22 00:00:00+00:00,JPM,SEC-EDGAR-8K,"(Item 5.07) Submission of Matters to a Vote of Security Holders. (a) Registrant held its Annual Meeting of Shareholders on Tuesday, May 20, 2025; 2,371,361,078 shares were represented in person or by proxy, or 85.21% of the total shares outstanding. (b) The results of the shareholder voting on the proposals presented were as follows: MANAGEMENT PROPOSALS Proposal 1 - Shareholders elected the 12 director nominees named in the Proxy Statement. All director nominees received at least 92.98%",,0.5
2025-05-22 00:00:00+00:00,AMZN,SEC-EDGAR-8K,(ITEM 5.07) . SUBMISSION OF MATTERS TO A VOTE OF SECURITY HOLDERS. 3,,0.0
2025-05-23 00:00:00+00:00,PLD,SEC-EDGAR-8K,(Item 1.01) . Entry into a Material Definitive Agreement.,,0.0
2025-05-23 00:00:00+00:00,MCD,SEC-EDGAR-8K,"(Item 5.07) Submission of Matters to a Vote of Security Holders. McDonald’s Corporation (the “Company”) held its 2025 Annual Shareholders’ Meeting (the “Annual Meeting”) on May 20, 2025. Set forth below are the final, certified voting results for each proposal presented at the Annual Meeting, as reported by Broadridge Financial Solutions, Inc., the Company’s independent inspector of election. Proposal 1 : The election of 11 nominees to the Company’s Board of Directors, each to hold office until",,0.0
2025-05-23 00:00:00+00:00,PEP,SEC-EDGAR-8K,"(Item 8.01) . Other Events. Effective May 23, 2025, PepsiCo, Inc. (“ PepsiCo ”) terminated the $5,000,000,000 364 day unsecured revolving credit agreement, dated as of May 24, 2024, among PepsiCo, as borrower, the lenders party thereto, and Citibank, N.A., as administrative agent (the “ 2024 364 Day Credit Agreement ”). There were no outstanding borrowings under the 2024 364 Day Credit Agreement at the time of its termination. On May 23, 2025, PepsiCo entered into a",,0.1
2025-05-23 00:00:00+00:00,TXN,SEC-EDGAR-8K,"(Item 8.01) . Other Events Issuance of $1,200,000,000 of Notes On May 23, 2025, Texas Instruments Incorporated (“Texas Instruments”) consummated the issuance and sale of $550,000,000 aggregate principal amount of its 4.500% Notes due 2030 (the “2030 Notes”) and $650,000,000 aggregate principal amount of its 5.100% Notes due 2035 (the “2035 Notes” and, together with the 2030 Notes, the “Notes”), pursuant to an underwriting agreement filed herewith as Exhibit 1.1 dated May 20, 2025 among Texas Instruments",,0.1
2025-05-23 00:00:00+00:00,SCHW,SEC-EDGAR-8K,"(Item 5.07) Submission of Matters to a Vote of Security Holders. (a) The 2025 Annual Meeting of Stockholders of The Charles Schwab Corporation (“CSC”) was held on May 22, 2025. (b) All nominees for director were elected, and each nominee received more “for” votes than “against” votes cast for the nominee’s election. The proposal to ratify the selection of Deloitte & Touche LLP (“Deloitte”) as CSC’s independent auditors for the 2025 fiscal year was approved. The advisory",,0.1
2025-05-23 00:00:00+00:00,HON,SEC-EDGAR-8K,"(Item 5.07) Submission of Matters to a Vote of Security Holders Honeywell International Inc. (the “Company”) held its Annual Meeting of Shareowners on May 20, 2025. The following matters set forth in our Proxy Statement dated April 9, 2025 (the “2025 Proxy Statement”), which was filed with the Securities and Exchange Commission pursuant to Regulation 14A under the Securities Exchange Act of 1934, were voted upon with the results indicated below. 1. The nominees listed below were",,0.1
2025-05-27 00:00:00+00:00,NOW,SEC-EDGAR-8K,"(Item 5.07) Submission of Matters to a Vote of Security Holders. At the Annual Meeting, the shareholders were asked to vote on seven proposals. A brief description of each proposal, along with the final voting results, is set forth below: 1. The shareholders elected the individuals listed below as directors to serve until the next annual shareholders meeting and until his or her successor has been duly elected and qualified or his or her earlier death, resignation",,0.2
2025-05-27 00:00:00+00:00,ADI,SEC-EDGAR-8K,"(Item 5.02) . Departure of Directors or Certain Officers; Election of Directors; Appointment of Certain Officers; Compensatory Arrangements of Certain Officers. On May 21, 2025, Dr. Laurie Glimcher informed the Board of Directors (the “Board”) of Analog Devices, Inc. (the “Company”) that she had decided to retire from the Board, effective immediately. Dr. Glimcher’s decision to retire did not involve any disagreement on any matter relating to the Company’s operations, policies or practices. In connection with Dr.",,-0.2
2025-05-27 00:00:00+00:00,SO,SEC-EDGAR-8K,"(Item 5.07) . Submission of Matters to a Vote of Security Holders. The Southern Company (the “Company”) held its Annual Meeting of Stockholders on May 21, 2025. Stockholders voted as follows on the eight matters presented for a vote: 1. The nominees for election to the Board of Directors were elected based on the following votes: Nominees Votes For % Votes Cast For Votes Against Abstentions Broker Non-Votes Janaki Akella 749,639,237 99.21% 5,944,364 1,941,368 182,350,030 Shantella E.",,0.1
2025-05-27 00:00:00+00:00,MDLZ,SEC-EDGAR-8K,"(Item 5.02) Departure of Directors or Certain Officers; Election of Directors; Appointment of Certain Officers; Compensatory Arrangements of Certain Officers. Mondelēz International, Inc. Severance Plan for Key Executives On May 20, 2025, in connection with a review of Mondelēz International, Inc.'s (the "" Company "") severance programs, the People and Compensation Committee of the Company (the “ Committee ”) approved the Mondelēz International, Inc. Severance Plan for Key Executives (the “ Plan ”). All of the Company’s

(Item 5.07) . Submission of Matters to a Vote of Security Holders. On May 21, 2025, we held our annual meeting of shareholders. A total of 1,124,518,986 shares of our Class A Common Stock, or 86.8% of our outstanding shares of Class A Common Stock, were represented at the annual meeting. The final voting results for each of the matters submitted to a shareholder vote at the annual meeting are set forth below: 1. Our shareholders elected",,0.1
2025-05-27 00:00:00+00:00,AMGN,SEC-EDGAR-8K,"(Item 5.07) . Submission of Matters to a Vote of Security Holders. The Company held its Annual Meeting on May 23, 2025. The final results of the voting for each matter submitted to a vote of stockholders at the meeting are as follows: Item 1 - Election of Directors Each of the following 12 nominees for director were elected to serve a one-year term expiring at the Company’s 2026 annual meeting of stockholders and until his or",,0.1
2025-05-27 00:00:00+00:00,EQIX,SEC-EDGAR-8K,"(Item 5.07) . Submission of Matters to a Vote of Security Holders. The Annual Meeting of Equinix, Inc. (“Equinix”) was held on May 21, 2025 (the “Annual Meeting”) for the purpose of considering and voting on: • Election of 8 directors to the Board of Directors (the “Board”) to serve until the next Annual Meeting or until their successors have been duly elected and qualified; • Approval, by a non-binding advisory vote, of the compensation of Equinix’s",,0.1
2025-05-28 00:00:00+00:00,HD,SEC-EDGAR-8K,"(Item 5.07) . Submission of Matters to a Vote of Security Holders. The 2025 Annual Meeting of Shareholders of The Home Depot, Inc. (the “Company”) was held on May 22, 2025. Below are the final vote results from the meeting. Proposal 1 : The following nominees were elected by majority vote to serve on the Board of Directors of the Company: FOR AGAINST ABSTAIN BROKER NON-VOTES Gerard J. Arpey 694,921,089 14,023,258 1,063,654 138,693,972 Ari Bousbib 678,305,860 30,575,941",,0.1
2025-05-28 00:00:00+00:00,NEE,SEC-EDGAR-8K,"(Item 5.07) Submission of Matters to a Vote of Security Holders (a) NextEra Energy, Inc. (NEE) held its 2025 Annual Meeting of Shareholders (2025 Annual Meeting) on May 22, 2025. At the 2025 Annual Meeting, NEE's shareholders approved three proposals. The proposals are described in detail in NEE's definitive proxy statement on Schedule 14A for the 2025 Annual Meeting (Proxy Statement), filed with the Securities and Exchange Commission on April 1, 2025. (b) The final voting results",,0.1
2025-05-28 00:00:00+00:00,TMO,SEC-EDGAR-8K,"(Item 5.07) Submission of Matters to a Vote of Security Holders At the Annual Meeting held on May 21, 2025, the shareholders of the Company voted on the following proposals: 1. The following nominees were elected to the Company’s Board of Directors for a one-year term expiring at the 2026 annual meeting of shareholders. For Against Abstain Broker Non-Votes Marc N. Casper 288,144,302 25,678,666 2,486,405 18,072,525 Nelson J. Chai 296,784,356 18,421,795 1,103,222 18,072,525 Ruby R. Chandy 313,439,920",,0.1
2025-05-28 00:00:00+00:00,NVDA,SEC-EDGAR-8K,"(Item 2.02) Results of Operations and Financial Condition. On May 28, 2025, NVIDIA Corporation, or the Company, issued a press release announcing its results for the quarter ended April 27, 2025. The press release is attached as Exhibit 99.1 and is incorporated herein by reference. Attached hereto as Exhibit 99.2 and incorporated by reference herein is financial information and commentary by Colette M. Kress, Executive Vice President and Chief Financial Officer of the Company, regarding results for",,0.1
2025-05-28 00:00:00+00:00,HON,SEC-EDGAR-8K,"(Item 1.01) Entry into a Material Definitive Agreement. On May 28, 2025, Honeywell International Inc. (the “Company”) entered into a Cooperation Agreement (the “Agreement”) with Elliott Investment Management L.P., Elliott Associates, L.P. and Elliott International, L.P. (collectively, “Elliott”). Pursuant to the Agreement, the Board of Directors of the Company (the “Board”) agreed to increase the size of the Board by one, appoint Marc Steinberg (the “New Director”) to the Board, effective as of May 31, 2025 (the

(Item 5.02) . Departure of Directors or Certain Officers; Election of Directors; Appointment of Certain Officers; Compensatory Arrangements of Certain Officers. The description of the matters included under

(Item 1.01) are incorporated into this

(Item 5.02) by reference. On the Effective Date, the New Director will also be appointed to serve as a member of the Audit Committee of the Board. The New Director will receive the same compensation as the Company’s other non-employee directors. There are no arrangements or understandings between the New Director and any other person pursuant to which the New Director was appointed as a director other than with respect to the matters referred to in

(Item 1.01) . At this time, there are no transactions in which the New Director has or will have an interest that would be required to be disclosed pursuant to Item 404(a) of Regulation S-K under the Exchange Act.",,0.1
2025-05-29 00:00:00+00:00,MRK,SEC-EDGAR-8K,"(Item 5.07) . Submission of Matters to a Vote of Security Holders. (a) The Annual Meeting of Shareholders of Merck & Co., Inc. (the “Company”) was held on May 27, 2025. (b) Shareholders voted on the matters set forth below: 1. The following nominees were elected to the Company’s Board of Directors to hold office until the Company’s next Annual Meeting of Shareholders and received the number of votes set forth opposite their names: Names Votes For",,0.0
2025-05-29 00:00:00+00:00,COST,SEC-EDGAR-8K,"(Item 2.02) . Results of Operations and Financial Condition On May 29, 2025, the Company issued a press release containing its operating results for the third quarter (twelve weeks) and the first 36 weeks of fiscal 2025, ended May 11, 2025. A copy of the press release is attached as Exhibit 99.1. In addition, a copy of the Company's earnings release supplement for the third quarter of fiscal 2025 is attached as Exhibit 99.2.",,0.0
2025-05-29 00:00:00+00:00,CL,SEC-EDGAR-8K,"(Item 5.02) . Departure of Directors or Certain Officers; Election of Directors; Appointment of Certain Officers; Compensatory Arrangements of Certain Officers. On May 29, 2025, Colgate-Palmolive Company (the “Company”) announced that its Board of Directors (the “Board”) had elected Shane Grant as the Company’s Chief Operating Officer, Americas, reporting to Chairman, President and Chief Executive Officer, Noel R. Wallace, effective June 16, 2025. Mr. Grant, 50, will join the Company from Group Danone (“Danone”), a leading global",,0.2
2025-05-30 00:00:00+00:00,META,SEC-EDGAR-8K,"(Item 5.07) Submission of Matters to a Vote of Security Holders. On May 28, 2025, Meta Platforms, Inc. (the ""Company"") held its annual meeting of shareholders via live audio webcast (the ""Annual Meeting""). At the Annual Meeting, the Company's shareholders voted on fourteen proposals, each of which is described in more detail in the Company's definitive proxy statement filed with the Securities and Exchange Commission on April 17, 2025 (the ""Proxy Statement""). At the beginning of the",,0.1
2025-05-30 00:00:00+00:00,NOW,SEC-EDGAR-8K,"(Item 8.01) Other Events. On May 30, 2025, ServiceNow, Inc. (the “Company”) filed with the U.S. Securities and Exchange Commission (the “SEC”) a prospectus supplement to its effective registration statement on Form S-3ASR (File No. 333-279150) covering the resale from time to time by certain stockholders of shares of the Company’s common stock (the “Shares”). Such stockholders acquired the Shares in connection with the Company’s acquisition of Logik.io Inc. A copy of the legal opinion of Freshfields",,0.1
2025-05-30 00:00:00+00:00,CVX,SEC-EDGAR-8K,"(Item 5.07) Submission of Matters to a Vote of Security Holders. (b) At the Annual Meeting, Chevron stockholders voted on the matters set forth below, with final voting results indicated. For the election of Directors in an uncontested election, each nominee who received a majority of votes cast (i.e., the number of shares voted for exceeded the number of shares voted against, excluding abstentions) was elected as a Director. Approval of the amendment to Chevron’s Restated Certificate",,0.1
2025-05-30 00:00:00+00:00,XOM,SEC-EDGAR-8K,"(Item 5.07) Submission of Matters to a Vote of Security Holders. (a), (b) Exxon Mobil Corporation (the “Company,” “ExxonMobil,” “we,” or “our”) held its Annual Meeting of Shareholders (“Annual Meeting”) on May 28, 2025. At the meeting, the matters set forth below were submitted for a vote of security holders. As of the close of business on April 2, 2025, which was the record date for the Annual Meeting, 4,308,968,407 shares of ExxonMobil common stock, without par",,0.0
2025-05-30 15:31:22+00:00,CCI,Zacks,Why Is Crown Castle (CCI) Down 5.6% Since Last Earnings Report?,https://finance.yahoo.com/news/why-crown-castle-cci-down-153122154.html,-0.5
2025-05-31 12:04:36+00:00,CCI,Benzinga,"If You Invested $10K In Crown Castle Stock 10 Years Ago, How Much Would You Have Now?",https://finance.yahoo.com/news/invested-10k-crown-castle-stock-120436462.html,0.0
